38223850,Ennis (1969),1969,"From 180 primary children of varied backgrounds half were selected for instruction in conditional logic by means of an audio-tutorial method. At the termination of 15 weekly lessons the experimental students did no better than the control students on our individually-administered conditional logic test (""Smith-Sturgeon Conditional Reasoning Test""), but there was wide variation among age demonstrated mastery of basic principles of conditional logic. Thus, although out methods were not effective in the teaching of conditional logic to young children, many have somehow learned it anyway. In the control group significant relationships between conditional logic ability and verbal intelligence (.6) and socioeconomic status (.4) were found. No significant relationship between conditional logic ability and sex was discernable",['Metacognition and self-regulation'],NA,,Report,,['Technical report'],NA,NA,,['USA'],,['Primary/elementary school'],NA,NA,,High ecological validity,NA,NA,,"['6', '7', '8', '9']",NA,NA,,NA,NA,,NA,NA,,3,"['Page 31:\n[¬s]""Our study was carried out in three elementary schools serving three distinct neighborhoods in a small upstate New York community[¬e]""']",,NA,NA,NA,,NA,NA,,NA,NA,,NA,NA,,['not_provided'],NA,NA,,['No'],NA,NA,,Random (please specify),"['Page 32:\n[¬s]"" From one of the two classrooms ten children were selected at random*to be the controls; from the second classroom ten children were selected at random to be experimentals. ""\n""Over the course of the year it was necessary to add a child to some of the original groups as children left the school for one reason or another. In such cases, care was taken to see that each new child was chosen at random, and had the same experience with regard to the experiment as other members of the group. One exception to the above descrip\xad tion was that of the urban school. Here only one classroom was available in each grade; thus both the experimental and the control group came from the same classroom.""\n""In this case it was not possible to make additions to the experimental group if a child dropped out.[¬e]""']",NA,,School - multi-site,"['Page 32:\n[¬s]""The sample of children for this study was selected from grades one, two, and three of the schools described on the preceding page. In each school and for each grade two classrooms were chosen in cooperation with the principals of the schools who were asked for classes representative of the school.[¬e]""']",NA,,['Individual RCT'],"['Page 32:\n[¬s]"" In each school and for each grade two classrooms were chosen in cooperation with the principals of the schools who were asked for classes representative of the school. From one of the two classrooms ten children were selected at random*to be the controls; from the second classroom ten children were selected at random to be experimentals.[¬e]""']",NA,,Yes,"['Page 32:\n[¬s]""From one of the two classrooms ten children were selected at random*to be the controls; from the second classroom ten children were selected at random to be experimentals.""\n""*The random table used is found in William C. Guenther, Concepts of Statistical Inference, McGraw-Hi 11 , 1965.[¬e]""']",NA,
38223988,Erktin (2004),2004,"Mathematics teachers are mostly aware that teaching thinking is their responsibility. Nevertheless, the question of whether particular kinds of teaching can improve thinking skills is unclear. A project aiming to direct mathematics teachers in teaching thinking has been initiated where teachers were introduced to the debate on how thinking could be taught. Three studies were carried out to investigate the measurement of metacognition, role of metacognition on mathematics achievement, and effects of teaching metacognitive skills on mathematics achievement. Several problems with teachers using metacognitive training as a means of teaching thinking were identified.",['Metacognition and self-regulation'],NA,,"Journal, Article",,['Journal article'],NA,NA,,['Turkey'],,"['Primary/elementary school', 'Independent/private school']",NA,NA,,High ecological validity,NA,NA,,"['12', '13']",NA,NA,,1,"['Page 7:\n[¬s]""private primary school[¬e]""']",,1,"['Page 7:\n[¬s]""private primary school[¬e]""']",,1,"['Page 7:\n[¬s]""private primary school[¬e]""']",,NA,NA,NA,,1,"['Page 8:\n[¬s]""The class with the lower mean mathematics\nattitude score was assigned as the experimental group.[¬e]""']",,1,"['Page 8:\n[¬s]""The control\ngroup (n=24)[¬e]""']",,2,"['Page 7:\n[¬s]""There were four sections of 6th grades, two\nof which took part in this study.[¬e]""', 'Page 8:\n[¬s]""The class with the lower mean mathematics attitude score was assigned as the experimental group.""\n""The control\ngroup[¬e]""']",,NA,NA,NA,,['No'],NA,NA,,"Non-random, but matched","['Page 7:\n[¬s]""Prior to the beginning of subject of ""fractions"" pre-tests of achievement, metacognition, and attitudes towards mathematics were administered to four sections of 6 th graders. Two sections whose scores on the pre-test measure of achievement (t = -0.96, p>.05)""\n""and metacognition (t = 0.77, p>.05) did not differ[¬e]""', 'Page 8:\n[¬s]""statistically significantly were chosen as the experimental and control groups (Table 1).[¬e]""']",NA,,Class,"['Page 7:\n[¬s]""There were four sections of 6 th grades, two of which took part in this study. One section with 2lstudents was selected as the experimental group.[¬e]""']",NA,,['Prospective QED'],"['Page 7:\n[¬s]""The third study was a quasi-experimental study\ninvolving an examination of the effect of teaching\nmetacognitive skills on the mathematics performance,\nmetacognition, and mathematics attitudeof 6th grade\nstudents (Oxcan, 2000)[¬e]""']",NA,,Not applicable,NA,NA,
40294903,Esser (2001) MSR,2001,"This study examined the relative effects of three intervention methods on the reading comprehension of students with learning disabilities. Participants were 110 African-American sixth and seventh grade students who attended an urban middle school in the Midwest. Eighty of the participants had been identified as learning disabled, and 30 participants were enrolled in a regular education program for the academically talented at the school. The three intervention methods employed in the study were Metacognitive Strategy Training, Attribution Retraining, and Combined Metacognitive Strategy Training and Attribution Retraining. In addition to the treatment groups, a control group of students with learning disabilities and an average reader control group were included. The intervention program took place over a three-week period, with two, 50-minute sessions per week. Learning disabled students in the Metacognitive Strategy Training group received instruction in five metacognitive reading strategies  purpose setting and previewing, using background knowledge and developing text-related questions, and summarization. Participants in the Attribution Retraining group were provided with instruction designed to help them adopt self-promoting beliefs regarding academic achievement. Students in the Combined group were exposed to a combination of the strategy training and attribution retraining used with the other treatment groups. Participants in the LD control group and the non-LD control group were given no training. Rather, they were asked to read one or two passages per session and respond to multiple-choice questions related to the passages. Participants' performance on a metacomprehension reading strategy inventory, an attribution rating scale, a reading comprehension quiz and a strategy use inventory was measured prior to the intervention (pretest), immediately following the intervention (posttest 1) and six weeks following the intervention (posttest 2). Data was analyzed using a one-way repeated measures analysis of variance with IQ as a covariate. The results yielded significant time x group interaction effects on all variables, indicating that the method of intervention differentially effected subject response. While no significant time effects were found, profile plot analysis suggested that a combination of metacognitive strategy training and attribution retraining appeared to be the most promising of the three intervention methods.",['Metacognition and self-regulation'],NA,,Dissertation,,['Dissertation or thesis'],NA,NA,,['USA'],,['Middle school'],NA,NA,,High ecological validity,NA,NA,,"['11', '12', '13']",NA,NA,,1,"['Page 8:\n[¬s]""an urban middle school[¬e]""']",,1,"['Page 8:\n[¬s]""an urban middle school[¬e]""']",,1,"['Page 8:\n[¬s]""an urban middle school[¬e]""']",,NA,NA,NA,,NA,NA,,NA,NA,,NA,NA,,['not_provided'],Not provided,NA,,['No'],NA,NA,,Random (please specify),"['Page 70:\n[¬s]""students with learning disabilities with severe reading problems) from an urban middle school in the midwest were randomly selected to participate in this study[¬e]""', 'Page 71:\n[¬s]""Students with learning disabilities were randomly assigned to""\n"" training conditions or an LO control condition.[¬e]""']",NA,,Individual,"['Page 71:\n[¬s]""Students with learning disabilities were randomly assigned to ""\n"" training conditions or an LO control condition.[¬e]""']",NA,,['Individual RCT'],"['Page 71:\n[¬s]""Students with learning disabilities were randomly assigned to ""\n""training conditions or an LO control condition.[¬e]""']",NA,,Yes,"['Page 71:\n[¬s]""Students with learning disabilities were randomly assigned to ""\n""training conditions or an LO control condition.[¬e]""']",NA,
38223947,Franklin (1993),1993,University professors gave inservice workshops for intermediate grade teachers and continued to support teachers by modeling reading instruction techniques and monitoring implementation of reading strategies in the teachers' classrooms. Results for 82 fifth and sixth graders showed significant gains in Metropolitan Achievement Test reading scores after 1 year of the project.,['Metacognition and self-regulation'],NA,,"Journal, Article",,['Journal article'],NA,NA,,['USA'],,['Primary/elementary school'],NA,NA,,High ecological validity,NA,"This was difficult as limited information was provided regarding procedures followed by teacher (as highlighted in relation to training question, this was not prescriptive). As the strategies were modelled by the university professors within the participating classes this could be understood to demonstrate low ecological validity as the professors were likely to be unknown to the students. High ecological validity seems more likely because the intervention was conducted within the school setting, presumably through school hours, and as it lasted for a school year allowed the students to get used to any changes to previous teaching styles (styles which may change each year anyway as a consequence of different teachers and levels of work). ",,"['10', '11', '12']",NA,NA,,NA,NA,,NA,NA,,NA,NA,,['not_provided'],NA,NA,,NA,NA,,NA,NA,,NA,NA,,['not_provided'],NA,NA,,['No'],NA,NA,,"Non-random, not matched prior to treatment","['Page 2:\n[¬s]""The 82 subjects for this study were drawn from the total fifth and sixth grade population of a small, rural public school district located near a state university. Students from these grades who were not included in the study consisted of (a) transfer students for whom spring achievement test scores were not available for both years, and (b) students assigned to resource classes due to learning problems, since the test information for the latter group was reported separately and did not include scale scores.[¬e]""']",NA,,Region or district,NA,"Does not state number of schools or classes involved, only that students were from the same public school district.",,['Prospective QED'],NA,NA,,Not applicable,NA,NA,
38224049,Fuchs (2003),2003,"The authors assessed the contribution of self-regulated learning strategies (SRL), when combined with problem-solving transfer instruction (L. S. Fuchs et al., 2003), on 3rd-graders' mathematical problem solving. SRL incorporated goal setting and self-evaluation. Problem-solving transfer instruction taught problem-solution methods, the meaning of transfer, and 4 superficial-problem features that change a problem without altering its type or solution  it also prompted metacognitive awareness to transfer. The authors contrasted the effectiveness of transfer plus SRL to the transfer treatment alone and to teacher-designed instruction. Twenty-four 3rd-grade teachers, with 395 students, were assigned randomly to conditions. Treatments were conducted for 16 weeks. Students were pre- and posttested on problem-solving tests and responded to a posttreatment questionnaire tapping self-regulation processes. SRL positively affected performance.",['Metacognition and self-regulation'],NA,,"Journal, Article",,['Journal article'],NA,NA,,['USA'],,['Primary/elementary school'],NA,NA,,High ecological validity,NA,NA,,"['8', '9']",NA,NA,,6,"['Page 2:\n[¬s]""From six schools in a southeastern urban school district, 24 third-grade\nteachers volunteered to participate. Stratifying so that each condition was\nrepresented approximately equally in each school, we randomly assigned\nteachers to three conditions[¬e]""']",,6,"['Page 2:\n[¬s]""From six schools in a southeastern urban school district, 24 third-grade\nteachers volunteered to participate. Stratifying so that each condition was\nrepresented approximately equally in each school, we randomly assigned\nteachers to three conditions[¬e]""']",,6,"['Page 2:\n[¬s]""six schools in a southeastern urban school district[¬e]""']",,NA,NA,NA,,NA,NA,,NA,NA,,NA,NA,,['not_provided'],24 third grade teachers participated in the study with 3 groups. 8 teachers were assigned to each group.   Coding for only 2 groups means 16 teachers were involved which may imply 16 classes although this is not explicitly stated.,"['Page 2:\n[¬s]""24 third-grade\nteachers volunteered to participate.[¬e]""']",,['No'],NA,"There are three idenitifiable groups  1) Control, 2) Transfer, 3) Transfer plus SRL. Please focus on Group 1 and 3. Ignore data relating to Group 2. ",,Random (please specify),"['Page 1:\n[¬s]""Twenty-four 3rd-grade teachers, with 395 students, were assigned randomly to conditions.[¬e]""']",NA,,Individual,"['Page 1:\n[¬s]""395 students, were assigned randomly to conditions. [¬e]""', 'Page 2:\n[¬s]"" we randomly assigned teachers to three conditions[¬e]""']",focusing on 2 conditions,,['Individual RCT'],"['Page 2:\n[¬s]""we randomly assigned\nteachers to three conditions (8 per condition): control (teacher-designed\ninstruction informed by the basal), transfer (Fuchs et al.’s, 2003, solution\nplus transfer, with some modifications described in the following para-\ngraphs), and transfer plus SRL.[¬e]""']",NA,,Yes,"['Page 2:\n[¬s]""From six schools in a southeastern urban school district, 24 third-grade\nteachers volunteered to participate. Stratifying so that each condition was\nrepresented approximately equally in each school, we randomly assigned\nteachers to three conditions (8 per condition): control (teacher-designed\ninstruction informed by the basal), transfer (Fuchs et al.’s, 2003, solution\nplus transfer, with some modifications described in the following para-\ngraphs), and transfer plus SRL. Teacher groups were comparable on\ngender, age, education, and years teaching. Students were the 395 children\nin these classrooms who were present for each pre- and posttest. Student\ngroups were comparable on gender, reduced or free lunch, race, special-\neducation status, and English-as-a-second-language status. Also, the 395\nchildren in the complete data set were demographically comparable with\nthe remaining 58 pupils who were absent on one or more pre- or posttest.[¬e]""']",NA,
38224050,Gallini (1993),1993,"Investigates the impact of macroprocessing and microprocessing strategy instruction on text learning among high school remedial students over a 6-week period. Results indicate that, of 66 students assigned to 1 of 3 treatment groups, the macro-level group exceeded the other 2 groups on comprehension and on immediate and delayed passage recall assessments.",['Metacognition and self-regulation'],NA,,"Journal, Article",,['Journal article'],NA,NA,,['USA'],,['Secondary/High school'],NA,NA,,Low ecological validity,NA,NA,,['No information provided'],NA,NA,,1,"['Page 2:\n[¬s]""stu\xad dents enrolled in a remedial reading curriculum in a public school in the southeast.[¬e]""']",,1,"['Page 2:\n[¬s]""stu\xad dents enrolled in a remedial reading curriculum in a public school in the southeast.[¬e]""']",,1,"['Page 2:\n[¬s]""stu\xad dents enrolled in a remedial reading curriculum in a public school in the southeast.[¬e]""']",,NA,NA,NA,,NA,NA,,NA,NA,,NA,NA,,NA,NA,NA,,['No'],NA,"There are three idenitifiable groups  1) Macroprocessing, 2) Microprocessing, 3) Control. Instructions to focus on Group 1 and 3. Ignore data relating to Group 2",,Random (please specify),"['Page 1:\n[¬s]""Subjects were randomly assiped[¬e]""']",NA,,Individual,"['Page 1:\n[¬s]""Subjects were randomly[¬e]""']",NA,,['Individual RCT'],"['Page 5:\n[¬s]""Subjects were randomly assigned to one of the three treatment groups described above: (a) the micro-level strategy, (b) the macro-level strategy, or (c) the control strategy group.[¬e]""']",NA,,NA,NA,NA,
38224150,Gambrell (1986),1986,"Reports a study indicating that students who received instructions to induce mental imagery identified both explicit and implicit inconsistencies in text significantly more often than did those in a control group, supporting the use of mental imagery as a comprehension-monitoring strategy",['Metacognition and self-regulation'],NA,,"Journal, Article",,['Journal article'],NA,NA,,['USA'],,['Primary/elementary school'],"['Page 4:\n[¬s]"" public elementary schools[¬e]""']",NA,,High ecological validity,NA,NA,,"['9', '10', '11']",NA,NA,,5,"['Page 4:\n[¬s]""five public elementary schools[¬e]""']",,5,"['Page 4:\n[¬s]"" five public elementary schools[¬e]""']",,5,"['Page 4:\n[¬s]"" five public elementary schools[¬e]""']",,NA,NA,NA,,NA,NA,,NA,NA,,NA,NA,,['not_provided'],NA,NA,,['No'],NA,NA,,Random (please specify),"['Page 5:\n[¬s]""Subjects were assigned randomly to one of two treatment conditions: mental imagery instruc\xad tions or general instructions.[¬e]""']",Subjects were assigned randomly to one of two treatment conditions  mental imagery instruc­ tions or general instructions.,,Individual,NA,NA,,['Individual RCT'],"['Page 5:\n[¬s]""Subjects were assigned randomly to one of two treatment conditions:[¬e]""']",NA,,Yes,"['Page 4:\n[¬s]""Fourth- and fifth-grade below average read; ers served as subjects in this study. We identi\xad fied 124 subjects from five public elementary schools in Maryland who scored 1 to 2 years below grade level on the total reading portion of the California Achievement Test (1978) for par\xad ticipation in the study.[¬e]""', 'Page 5:\n[¬s]""Subjects were assigned randomly to one of two treatment conditions: mental imagery instruc\xad tions or general instructions.[¬e]""']",NA,
38223989,García-Sánchez (2006) 1_1,2006,"We examined the differential effects of the social cognitive model of sequential skill acquisition (SCM intervention) and the self-regulated strategy development model (SRSD intervention) for writing. One hundred and twenty-one 5th- and 6th- grade Spanish students with learning disabilities (LD) and/or low achievement (LA) were randomly assigned either to an experimental intervention group or the standard instruction group. Both self-regulatory interventions showed a significant improvement with a large effect size in the structure, coherence, and quality of students' writing products, as determined in terms of reader- and text-based measures. Additionally, both interventions demonstrated a substantial increase in the time students spent on writing and revising their texts  the latter was noted especially in the SCM intervention group although only the SRSD intervention showed a significant increase in the time students dedicated to planning text. Finally, with regard to writing self-efficacy, only the SC...",['Metacognition and self-regulation'],NA,,"Journal, Article",,['Journal article'],NA,NA,,['Spain'],,['Primary/elementary school'],NA,NA,,Low ecological validity,NA,NA,,"['10', '11', '12']",NA,NA,,11,"['Page 4:\n[¬s]""The sample was drawn from 11 primary schools in Leon in northwest Spain.[¬e]""']",,11,"['Page 4:\n[¬s]""The sample was drawn from 11 primary schools in Leon in northwest Spain.[¬e]""']",,11,"['Page 4:\n[¬s]""The sample was drawn from 11 primary schools in Leon in northwest Spain.[¬e]""']",,NA,NA,NA,,NA,NA,,NA,NA,,NA,NA,,['not_provided'],NA,NA,,['Yes (Please specify)'],NA,"3 groups, but as instructed by the coding team, only Group 1 (experimental 1) vs Group 3 (control) will be coded. ",,Random (please specify),"['Page 3:\n[¬s]""Participants were randomly allocated to either an experimental or a comparison group.[¬e]""']",NA,,Individual,"['Page 3:\n[¬s]""Participants were randomly allocated to either an experimental or a comparison group.[¬e]""']",NA,,['Individual RCT'],"['Page 3:\n[¬s]""Participants were randomly allocated to either an experimental or a comparison group.[¬e]""']",NA,,Yes,"['Page 3:\n[¬s]""First, the teach\xad ers carried out an initial screening consisting of an interview or questionnaire about the achievement of students with difficulties in writing. Then, psychoedu\xad cational teams assessed those students using IQ and aptitude tests, parents\' and teachers\' reports, observa\xad tions and interviews with the students, and also the students\' grades.""\n""However, because in Spain there are no specific grade tests, the psychoeducational teams determined which students had LD and/or LA, but not identified as having special educational needs - a developmental disability - in order to exclude students whose difficulties could be attributed to a physical, a psychic or a sensory disability, or a lack of schooling. As a result, only students with a significant delay, com\xad pared with their peers, in writing performance were included in the study.""\n""Each of our participants had seriously low achieve\xad ment in writing but we systematically excluded chil\xad dren who were diagnosed as having special educational needs by psychoeducational teams (with a type of developmental disability) to ensure that our samples consisted of children whose learning problems were more consistent with the American definition of LD.""\n""Participants were randomly allocated to either an experimental or a comparison group.[¬e]""']",NA,
40294905,García-Sánchez (2006) 1_2,2006,"We examined the differential effects of the social cognitive model of sequential skill acquisition (SCM intervention) and the self-regulated strategy development model (SRSD intervention) for writing. One hundred and twenty-one 5th- and 6th- grade Spanish students with learning disabilities (LD) and/or low achievement (LA) were randomly assigned either to an experimental intervention group or the standard instruction group. Both self-regulatory interventions showed a significant improvement with a large effect size in the structure, coherence, and quality of students' writing products, as determined in terms of reader- and text-based measures. Additionally, both interventions demonstrated a substantial increase in the time students spent on writing and revising their texts  the latter was noted especially in the SCM intervention group although only the SRSD intervention showed a significant increase in the time students dedicated to planning text. Finally, with regard to writing self-efficacy, only the SC...",['Metacognition and self-regulation'],NA,,"Journal, Article",,['Journal article'],NA,NA,,['Spain'],,['Primary/elementary school'],NA,NA,,Low ecological validity,NA,NA,,"['10', '11', '12']",NA,NA,,11,"['Page 4:\n[¬s]""The sample was drawn from 11 primary schools[¬e]""']",,11,"['Page 4:\n[¬s]""The sample was drawn from 11 primary schools[¬e]""']",,11,"['Page 4:\n[¬s]""The sample was drawn from 11 primary schools[¬e]""']",,NA,NA,NA,,NA,NA,,NA,NA,,NA,NA,,['not_provided'],NA,NA,,['Yes (Please specify)'],NA,"3 groups, but as instructed by the coding team, Group 2 (experimental 2) vs Group 3 (control) will be coded. ",,Random (please specify),"['Page 3:\n[¬s]""Participants were randomly allocated to either an experimental or a comparison group.[¬e]""']",NA,,Individual,"['Page 3:\n[¬s]""Participants were randomly allocated to either an experimental or a comparison group.[¬e]""']",NA,,['Individual RCT'],"['Page 3:\n[¬s]""Participants were randomly allocated to either an experimental or a comparison group.[¬e]""']",NA,,Yes,"['Page 3:\n[¬s]""First, the teach\xad ers carried out an initial screening consisting of an interview or questionnaire about the achievement of students with difficulties in writing. Then, psychoedu\xad cational teams assessed those students using IQ and aptitude tests, parents\' and teachers\' reports, observa\xad tions and interviews with the students, and also the students\' grades.""\n""Participants were randomly allocated to either an experimental or a comparison group.[¬e]""']",NA,
