38224004,Kramarski (2003) 1_1,2003,"The main purpose of the present study was to investigate the differential effects of Computer Algebra Systems (CAS) and metacognitive training on mathematical reasoning. Participants were 83 students (boys and girls) who studied algebra in four eighth‐grade classrooms randomly selected to four instructional methods  CAS embedded within metacognitive training (CAS +META), metacognitive training without CAS learning (META), CAS learning without metacognitive training (CAS) and CONT learning without CAS and metacognitive training (CONT). Results showed that the CAS +META condition significantly outperformed the META and the CAS conditions, who in turn significantly outperformed the CONT condition on aspects of mathematical reasoning. No significant differences were found between the META and CAS conditions. In addition, the study found that the metacognitive students (CAS +META and META conditions) outperformed their counterparts (CAS and CONT) on their metacognitive knowledge. This paper describes research ...",['Metacognition and self-regulation'],NA,,"Journal, Article",,['Journal article'],NA,NA,,['Israel'],,['Middle school'],NA,NA,,Unclear,NA,NA,,"['13', '14']",NA,NA,,4,"['Page 4:\n[¬s]"" four junior high schools.[¬e]""']",,4,"['Page 4:\n[¬s]"" four junior high schools.[¬e]""']",,4,"['Page 4:\n[¬s]"" four junior high schools.[¬e]""']",,NA,NA,NA,,1,"['Page 4:\n[¬s]"" four eighth-grade classrooms""\n""Classrooms were randomly assigned to one of the following conditions:[¬e]""']",,1,"['Page 4:\n[¬s]"" four eighth-grade classrooms""\n""Classrooms were randomly assigned to one of the following conditions:[¬e]""', 'Page 4:\n[¬s]""Classrooms were randomly assigned to one of the following conditions:[¬e]""']",,2,"['Page 4:\n[¬s]"" four eighth-grade classrooms[¬e]""', 'Page 4:\n[¬s]""Classrooms were randomly assigned to one of the following conditions:[¬e]""']",,NA,NA,NA,,['No'],NA,asked to code group 2 and 4,,Random (please specify),"['Page 2:\n[¬s]""articipants were 83 students (boys and girls) who studied algebra in four eighth-grade classrooms randomly selected to four instructional methods:[¬e]""', 'Page 4:\n[¬s]""Participants were 83 students (boys and girls) who studied in four eighth-grade classrooms randomly selected from four junior high schools.[¬e]""']",NA,,Class,"['Page 4:\n[¬s]""Classrooms were randomly assigned to one of the following conditions:[¬e]""']",NA,,['Cluster RCT'],"['Page 4:\n[¬s]""Classrooms were randomly assigned to one of the following conditions:[¬e]""']",NA,,Yes,"['Page 4:\n[¬s]""Participants were 83 students (boys and girls) who studied in four eighth-grade classrooms randomly selected from four junior high schools. All classrooms studied Algebra five times a week during a five-month period according to the mathematics curriculum suggested by the Israeli Ministry of Education. Classrooms were randomly assigned to one of the following conditions:[¬e]""']",NA,
38224005,Kramarski (2003) 1_1,2003,"The purpose of this study was to investigate the effects of four instructional methods on students’ mathematical reasoning and metacognitive knowledge. The participants were 384 eighth-grade students. The instructional methods were cooperative learning combined with metacognitive training (COOP+META), individualized learning combined with metacognitive training (IND+META), cooperative learning without metacognitive training (COOP), and individualized learning without metacognitive training (IND). Results showed that the COOP+META group significantly outperformed the IND +META group, which in turn significantly outperformed the COOP and IND groups on graph interpretation and various aspects of mathematical explanations. Furthermore, the metacognitive groups (COOP+META and IND +META) outperformed their counterparts (COOP and IND) on graph construction (transfer tasks) and metacognitive knowledge. This article presents theoretical and practical implications of the findings.",['Metacognition and self-regulation'],NA,,"Journal, Article",,['Journal article'],NA,NA,,['Israel'],,['Middle school'],NA,NA,,High ecological validity,NA,NA,,"['13', '14']",NA,NA,,1,"['Page 14:\n[¬s]""four schools participated in the study""\n""We did not assign classrooms to different conditions within\none school[¬e]""']",,1,"['Page 14:\n[¬s]""four schools participated in the study.[¬e]""']",,2,"['Page 14:\n[¬s]""four schools participated in the study[¬e]""', 'Page 14:\n[¬s]""four schools participated in the study[¬e]""']",,NA,NA,NA,,3,"['Page 14:\n[¬s]""3 classrooms (out\nof 6 parallel eighth-grade classrooms) were randomly selected to participate[¬e]""']",,3,"['Page 14:\n[¬s]""3 classrooms (out\nof 6 parallel eighth-grade classrooms) were randomly selected to participate[¬e]""']",,6,"['Page 14:\n[¬s]""in each school 3 classrooms (out\nof 6 parallel eighth-grade classrooms) were randomly selected[¬e]""']",,NA,NA,NA,,['Yes (Please specify)'],NA,"4 coonditions, but as instructed by the coding team, Coop + Meta vs Coop will be coded. ",,Random (please specify),"['Page 14:\n[¬s]"" Schools were randomly assigned to conditions[¬e]""']",NA,,School - cluster,"['Page 14:\n[¬s]"" Schools were randomly assigned to conditions, and in each school 3 classrooms (out of 6 parallel eighth-grade classrooms) were randomly selected to participate in the present study.[¬e]""']",NA,,['Cluster RCT'],"['Page 5:\n[¬s]""The participants were 384 students (181 boys and 203 girls) who studied in\n12 eighth-grade classrooms randomly selected from 4 junior high schools.\nThe 4 schools were randomly selected from a pool of 15 schools located in\none district,[¬e]""']",NA,,Yes,"['Page 14:\n[¬s]""12 classrooms from four schools participated in the study. Schools\nwere randomly assigned to conditions, and in each school 3 classrooms (out\nof 6 parallel eighth-grade classrooms) were randomly selected to participate in\nthe present study. We did not assign classrooms to different conditions within\none school because our experience shows that teachers in the same school\ntend to share materials and talk to each other about their teaching activities.[¬e]""']",NA,
40294921,Kramarski (2003) 1_2,2003,"The main purpose of the present study was to investigate the differential effects of Computer Algebra Systems (CAS) and metacognitive training on mathematical reasoning. Participants were 83 students (boys and girls) who studied algebra in four eighth‐grade classrooms randomly selected to four instructional methods  CAS embedded within metacognitive training (CAS +META), metacognitive training without CAS learning (META), CAS learning without metacognitive training (CAS) and CONT learning without CAS and metacognitive training (CONT). Results showed that the CAS +META condition significantly outperformed the META and the CAS conditions, who in turn significantly outperformed the CONT condition on aspects of mathematical reasoning. No significant differences were found between the META and CAS conditions. In addition, the study found that the metacognitive students (CAS +META and META conditions) outperformed their counterparts (CAS and CONT) on their metacognitive knowledge. This paper describes research ...",['Metacognition and self-regulation'],NA,,"Journal, Article",,['Journal article'],NA,NA,,['Israel'],,['Middle school'],NA,NA,,Unclear,NA,NA,,"['13', '14']",NA,NA,,4,"['Page 4:\n[¬s]""four junior high schools[¬e]""']",,4,"['Page 4:\n[¬s]""four junior high schools.[¬e]""']",,4,"['Page 4:\n[¬s]""four junior high schools.[¬e]""']",,NA,NA,NA,,1,"['Page 4:\n[¬s]"" four eighth-grade classrooms""\n""Classrooms were randomly assigned to one of the following conditions:[¬e]""']",,1,"['Page 4:\n[¬s]""four eighth-grade classrooms""\n""Classrooms were randomly assigned to one of the following conditions:[¬e]""']",,2,"['Page 4:\n[¬s]""four eighth-grade classrooms""\n""Classrooms were randomly assigned to one of the following conditions:[¬e]""']",,NA,NA,NA,,['No'],NA,asked to code group 1 and 3 only,,Random (please specify),"['Page 2:\n[¬s]"" Participants were 83 students (boys and girls) who studied algebra in four eighth-grade classrooms randomly selected to four instructional methods:[¬e]""']",NA,,Class,"['Page 4:\n[¬s]""Classrooms were randomly assigned to one of the following conditions:[¬e]""']",NA,,['Cluster RCT'],"['Page 4:\n[¬s]""Classrooms were randomly assigned to one of the following conditions:[¬e]""']",NA,,Yes,"['Page 4:\n[¬s]""Participants were 83 students (boys and girls) who studied in four eighth-grade classrooms randomly selected from four junior high schools. All classrooms studied Algebra five times a week during a five-month period according to the mathematics curriculum suggested by the Israeli Ministry of Education. Classrooms were randomly assigned to one of the following conditions:[¬e]""']",NA,
45336758,Kramarski (2003) 1_2,2003,"The purpose of this study was to investigate the effects of four instructional methods on students’ mathematical reasoning and metacognitive knowledge. The participants were 384 eighth-grade students. The instructional methods were cooperative learning combined with metacognitive training (COOP+META), individualized learning combined with metacognitive training (IND+META), cooperative learning without metacognitive training (COOP), and individualized learning without metacognitive training (IND). Results showed that the COOP+META group significantly outperformed the IND +META group, which in turn significantly outperformed the COOP and IND groups on graph interpretation and various aspects of mathematical explanations. Furthermore, the metacognitive groups (COOP+META and IND +META) outperformed their counterparts (COOP and IND) on graph construction (transfer tasks) and metacognitive knowledge. This article presents theoretical and practical implications of the findings.",['Metacognition and self-regulation'],NA,,"Journal, Article",,['Journal article'],NA,NA,,['Israel'],,['Middle school'],"['Page 5:\n[¬s]""12 eighth-grade classrooms randomly selected from 4 junior high schools.[¬e]""']",NA,,High ecological validity,"['Page 5:\n[¬s]""At the beginning of\nthe unit the teacher introduced strategies of graph interpretation such as using\ntables, algebraic formulas, steps, and verbal explanations. All students in all con-\nditions practiced those strategies with the same problems or tasks, and all used\nthe same textbook. In addition, the teachers used the same problems or tasks\nwhen they introduced new concepts. In addition to the textbook, students\nunder each condition used learning materials that covered the same kinds of[¬e]""', 'Page 6:\n[¬s]""exercises as those presented in the textbook but that emphasized the unique\ncomponents of each condition.""\n""The differences among the groups were in the instructional method.[¬e]""']",NA,,"['13', '14', 'No information provided']",NA,Grade 8 students,,NA,NA,,NA,NA,,4,"['Page 5:\n[¬s]""The participants were 384 students (181 boys and 203 girls) who studied in\n12 eighth-grade classrooms randomly selected from 4 junior high schools.[¬e]""']",,NA,NA,NA,,NA,NA,,NA,NA,,12,"['Page 5:\n[¬s]""The participants were 384 students (181 boys and 203 girls) who studied in\n12 eighth-grade classrooms[¬e]""']",,NA,NA,NA,,['Yes (Please specify)'],NA,Coding request for META + IND (treatment) v. IND only in this four arm study. Other arms included META + COOP and COOP.,,Random (please specify),"['Page 14:\n[¬s]""Schools\nwere randomly assigned to conditions, and in each school 3 classrooms (out\nof 6 parallel eighth-grade classrooms) were randomly selected to participate in\nthe present study[¬e]""']",NA,,School - cluster,"['Page 14:\n[¬s]""Schools\nwere randomly assigned to conditions, and in each school 3 classrooms (out\nof 6 parallel eighth-grade classrooms) were randomly selected to participate in\nthe present study. We did not assign classrooms to different conditions within\none school because our experience shows that teachers in the same school\ntend to share materials and talk to each other about their teaching activities.[¬e]""']",NA,,['Cluster RCT'],"['Page 14:\n[¬s]""Schools\nwere randomly assigned to conditions,[¬e]""']",NA,,Yes,"['Page 14:\n[¬s]""12 classrooms from four schools participated in the study. Schools\nwere randomly assigned to conditions, and in each school 3 classrooms (out\nof 6 parallel eighth-grade classrooms) were randomly selected to participate in\nthe present study.[¬e]""', 'Page 5:\n[¬s]""The participants were 384 students (181 boys and 203 girls) who studied in\n12 eighth-grade classrooms randomly selected from 4 junior high schools.\nThe 4 schools were randomly selected from a pool of 15 schools located in\none district[¬e]""']",NA,
38224066,Kramarski (2004),2004,"The present study investigates the differential effects of cooperative learning with or without metacognitive instruction on making sense of graphs. Participants were 196 eighth-graders who studied in six classrooms. Data were analyzed by using quantitative and qualitative methods. Results indicated that students who were exposed to the metacognitive instruction within cooperative learning (COOP+META) significantly outperformed their counterparts who were exposed to cooperative learning with no metacognitive instruction (COOP). The positive effects of COOP+META were observed on both graph interpretation and graph construction (transfer task) with regard to alternative conceptions. Furthermore, observations indicated differential characteristics of discourse behaviors during small group interaction under these methods. The practical implications of the study are discussed.",['Metacognition and self-regulation'],NA,,"Journal, Article",,['Journal article'],NA,NA,,['Israel'],,['Middle school'],NA,NA,,High ecological validity,NA,NA,,"['12', '13']",NA,NA,,1,"['Page 7:\n[¬s]""Schools were assigned randomly to one of the following methods of instruction:[¬e]""']",,1,"['Page 7:\n[¬s]""Schools were assigned randomly to one of the following methods of instruction:[¬e]""']",,2,"['Page 5:\n[¬s]""two junior high schools.[¬e]""']",,NA,NA,NA,,3,"['Page 11:\n[¬s]""within each school three classes (of six parallel eighth-grade classes) were randomly selected to participate in the study.[¬e]""']",,3,"['Page 11:\n[¬s]""within each school three classes (of six parallel eighth-grade classes) were randomly selected to participate in the study.[¬e]""']",,6,"['Page 11:\n[¬s]""six classes from two schools participated in the study.[¬e]""']",,NA,NA,NA,,['No'],NA,NA,,Random (please specify),"['Page 7:\n[¬s]""Schools were assigned randomly to one of the following methods of instruction: COOP C META and COOP.[¬e]""']",NA,,School - cluster,"['Page 7:\n[¬s]""Schools were assigned randomly[¬e]""']",NA,,['Cluster RCT'],"['Page 7:\n[¬s]""Schools were assigned randomly to one of the following methods of instruction: COOP C META and COOP.[¬e]""']",Level of randomization is school.,,Yes,"['Page 11:\n[¬s]""Schools were randomly assigned to the methods of instruction, and within each school three classes (of six parallel eighth-grade classes) were randomly selected to participate in the study.[¬e]""', 'Page 5:\n[¬s]""The study’s participants were 196 students (96 boys and 100 girls, mean age 12.8) who attended six eighth-grade classes randomly selected from two junior high schools.""\n""Within each school, three classes were randomly selected from a pool of seven classes in which mathematics was taught in heterogeneous classrooms with no groupings or ability tracking.[¬e]""']",NA,
38224001,Kramarski (2006),2006,"This study compares two E‐learning environments  E‐learning supported with IMPROVE self‐metacognitive questioning (EL+IMP), and E‐learning without explicit support of self‐regulation (EL). The effects were compared between mathematical problem‐solving and self‐regulated learning (SRL). Participants were 65 ninth‐grade students who studied linear function in Israeli junior high schools. Results showed that EL+IMP students significantly outperformed the EL students in problem‐solving procedural and transfer tasks regarding mathematical explanations. We also found that the EL+IMP students outperformed their counterparts in using self‐monitoring strategies during problem solving. This study discusses both the practical and theoretical implications of supporting SRL in mathematical E‐learning environments.",['Metacognition and self-regulation'],NA,,"Journal, Article",,['Journal article'],NA,NA,,['Israel'],,['Middle school'],NA,NA,,High ecological validity,NA,NA,,"['14', '15']",NA,NA,,1,"['Page 3:\n[¬s]""one junior high school[¬e]""']",,1,"['Page 3:\n[¬s]""one junior high school[¬e]""']",,1,"['Page 3:\n[¬s]""one junior high school[¬e]""']",,NA,NA,NA,,1,"['Page 3:\n[¬s]""Each\ninstructional approach was assigned randomly to one\nof the classes.[¬e]""']",,1,"['Page 3:\n[¬s]""Each\ninstructional approach was assigned randomly to one\nof the classes.[¬e]""']",,2,"['Page 3:\n[¬s]""two classes[¬e]""']",,NA,NA,NA,,['No'],NA,NA,,Random (please specify),"['Page 3:\n[¬s]"" Each instructional approach was assigned randomly to one of the classes.[¬e]""']",NA,,Class,"['Page 3:\n[¬s]"" Each instructional approach was assigned randomly to one of the classes. [¬e]""']",NA,,['Individual RCT'],"['Page 5:\n[¬s]""Participants were 65 (boys and girls) ninth-grade stu\xad\ndents who were assigned randomly to two EL en\xad\nvironments: EL+IMP and EL.[¬e]""']",NA,,Yes,"['Page 5:\n[¬s]""Participants were 65 (boys and girls) ninth-grade stu\xad\ndents who were assigned randomly to two EL en\xad\nvironments: EL+IMP and EL.[¬e]""']",NA,
38224295,Kramarski (2006) 1_1,2006,"The authors investigated the effects of online discussion embedded within metacognitive guidance on mathematical literacy and self-regulated learning (SRL). They compared 4 instructional methods  online discussion embedded within metacognitive guidance (Online+Meta), online discussion without metacognitive guidance (Online), face-to-face discussion with metacognitive guidance (Ftf+Meta), and face-to-face discussion without metacognitive guidance (Ftf). Participants were 86 seventh-grade Israeli boys and girls who practiced problem solving in 4 classes. Results showed that the Online+Meta students significantly outperformed the Ftf+Meta students, who, in turn, significantly outperformed the Online and Ftf students on mathematical literacy of standard tasks, real-life tasks, and various aspects of self-regulated learning. Regarding Online students, results were mixed  these students outperformed the Ftf students on part of the criteria for standard problem-solving standard tasks and real-life tasks...",['Metacognition and self-regulation'],NA,,"Journal, Article",,['Journal article'],NA,NA,,['Israel'],,['Secondary/High school'],NA,NA,,Unclear,NA,NA,,"['12', '13']",NA,NA,,NA,NA,,NA,NA,,NA,NA,,['not_provided'],Not provided,NA,,1,"['Page 3:\n[¬s]""One class (n = 20) was exposed to Online+ Meta[¬e]""']",,1,"['Page 3:\n[¬s]""the second class (n = 23) was exposed to Online[¬e]""']",,2,"['Page 3:\n[¬s]""One class (n = 20) was exposed to Online+ Meta;\nthe second class (n = 23) was exposed to Online;[¬e]""']",,NA,NA,NA,,['No'],NA,asked to code groups 1 and 2 - online + meta and online,,Random (please specify),"['Page 4:\n[¬s]""We assigned schools randomly to one of the following four instruction methods:[¬e]""']",NA,,School - cluster,"['Page 4:\n[¬s]""We assigned schools randomly to one of the following four instruction methods:[¬e]""']",NA,,['Cluster RCT'],"['Page 4:\n[¬s]""We assigned schools randomly to one of the following\nfour instruction methods:[¬e]""']",NA,,Yes,NA,NA,
40294922,Kramarski (2006) 1_2,2006,"The authors investigated the effects of online discussion embedded within metacognitive guidance on mathematical literacy and self-regulated learning (SRL). They compared 4 instructional methods  online discussion embedded within metacognitive guidance (Online+Meta), online discussion without metacognitive guidance (Online), face-to-face discussion with metacognitive guidance (Ftf+Meta), and face-to-face discussion without metacognitive guidance (Ftf). Participants were 86 seventh-grade Israeli boys and girls who practiced problem solving in 4 classes. Results showed that the Online+Meta students significantly outperformed the Ftf+Meta students, who, in turn, significantly outperformed the Online and Ftf students on mathematical literacy of standard tasks, real-life tasks, and various aspects of self-regulated learning. Regarding Online students, results were mixed  these students outperformed the Ftf students on part of the criteria for standard problem-solving standard tasks and real-life tasks...",['Metacognition and self-regulation'],NA,,"Journal, Article",,['Journal article'],NA,NA,,['Israel'],,['Secondary/High school'],NA,NA,,High ecological validity,NA,NA,,"['12', '13']",NA,NA,,NA,NA,,NA,NA,,NA,NA,,['not_provided'],NA,NA,,1,"['Page 3:\n[¬s]""he third\nclass (n = 22) was exposed to Ftf+Meta; an[¬e]""', 'Page 3:\n[¬s]""the third\nclass (n = 22) was exposed to Ftf+ Meta[¬e]""']",,1,"['Page 3:\n[¬s]""fourth class\n(n = 21) was exposed to Ftf.[¬e]""', 'Page 3:\n[¬s]""the fourth class\n(n = 21) was exposed to Ftf.[¬e]""']",,2,"['Page 3:\n[¬s]""he third\nclass (n = 22) was exposed to Ftf+Meta; and the fourth class\n(n = 21) was exposed to Ftf.[¬e]""', 'Page 3:\n[¬s]""the third\nclass (n = 22) was exposed to Ftf+ Meta; and the fourth class\n(n = 21) was exposed to Ftf[¬e]""']",,NA,NA,NA,,['No'],NA,asked to code groups 3 and 4 ftf + meta and ftf,,Random (please specify),"['Page 4:\n[¬s]""We assigned schools randomly to one of the following four instruction methods[¬e]""']",NA,,School - cluster,"['Page 4:\n[¬s]""We assigned schools randomly to one of the following four instruction methods:[¬e]""']",NA,,['Cluster RCT'],"['Page 4:\n[¬s]""We assigned schools randomly to one of the following\nfour instruction methods:[¬e]""']",NA,,Yes,"['Page 4:\n[¬s]""We assigned schools randomly to one of the following\nfour instruction methods:[¬e]""', 'Page 4:\n[¬s]""We assigned schools randomly to one of the following\nfour instruction methods:[¬e]""']",NA,
38224009,Kramarski (2008),2008,"The authors examined effects of 3 metacognitive approaches and 1 control group on mathematical reasoning, conceptual errors, and metacognitive knowledge. The metacognitive approaches were (a) diagnosing errors (DIA), (b) improvement via self-questioning (IMP), and (c) a combined approach (DIA+IMP). Controls (CONT) received no metacognitive instruction. Participants were 115 9th-grade students in an Israeli junior high school studying linear functions and graph representations. Results indicated that students using the combined approach outperformed their peers in all measures of mathematical reasoning and metacognitive knowledge. The IMP students outperformed the DIA and CONT students in problem-solving skills and metacognitive strategy use, and the DIA students outperformed their peers in reducing conceptual errors. The authors discuss the practical and theoretical implications of these metacognitive approaches.",['Metacognition and self-regulation'],NA,,"Journal, Article",,['Journal article'],NA,NA,,['Israel'],,['Secondary/High school'],"['Page 1:\n[¬s]"" junior high school[¬e]""']",junior high school,,High ecological validity,NA,NA,,['14'],NA,9th grade students,,1,"['Page 3:\n[¬s]""a junior high\nschool[¬e]""']",,1,"['Page 3:\n[¬s]""a junior high\nschool[¬e]""']",,1,"['Page 3:\n[¬s]""a junior high\nschool[¬e]""']",,NA,NA,NA,,NA,NA,,NA,NA,,NA,NA,,['not_provided'],Not provided,NA,,['No'],NA,We don't include conditions B and C in our analysis,,Random (please specify),"['Page 3:\n[¬s]"" We randomly assigned each class to exposure to only one of the following four instructional approaches to the curricular unit on lin\xad ear functions and graph representations:[¬e]""']",NA,,Class,"['Page 3:\n[¬s]"" At the beginning of the study, there were no significant differences among the four classes on mathematical knowledge as assessed by school testing based on the topics studied in eighth grade. We randomly assigned each class to exposure to only one of the following four instructional approaches to the curricular unit on lin\xad ear functions and graph representations[¬e]""']",NA,,['Individual RCT'],"['Page 3:\n[¬s]""We randomly\nassigned each class to exposure to only one of the following\nfour instructional approaches to the curricular unit on lin\xad\near functions and graph representations[¬e]""']",NA,,Yes,"['Page 3:\n[¬s]""We randomly\nassigned each class to exposure to only one of the following\nfour instructional approaches to the curricular unit on lin\xad\near functions and graph representations[¬e]""']",NA,
