38223964,Palincsar (1987),1987,"To determine the effect of training in reciprocal teaching on collaborative learning, a study of six middle school remedial reading classes was undertaken. Reciprocal teaching is a method in which the teacher participates both as a leader and as respondent. Before the experiment began, the teachers were trained for a day in reciprocal teaching and introduced to principles of collaborative learning, such as the joint role of student and teacher in acquiring comprehension strategies, the role of teacher modeling, and the importance of allowing students to lead discussions. Participants were 63 experimental and 66 control students. After pretesting, the teachers in the experimental classes introduced collaborative learning, and four reading comprehension strategies. Twenty days of reciprocal teaching followed, with each teacher implementing new stages in the process at the same time. Control groups used traditional basal reading instruction. During a 5-day maintenance phase, subjects completed daily assessment measures, after which students in both groups completed summarization and questioning transfer measures as a posttest. Three of the teachers were more comfortable with reciprocal teaching than the others, although assistance from leaders helped all six groups receive the same quality of instruction. Results revealed a significant improvement in experimental students' accuracy with recall and interpretation of material they read independently. Experimental subjects scored significantly higher on the posttests as well. It is also important that the students enjoyed collaborative learning, made gains in metacognition, and exhibited few behavior problems in the unstructured setting. (References and four tables of data are appended.)",['Metacognition and self-regulation'],NA,,Report,,['Conference paper'],NA,NA,,['USA'],,['Middle school'],NA,NA,,High ecological validity,NA,NA,,"['12', '13']",NA,NA,,NA,NA,,NA,NA,,NA,NA,,['not_provided'],NA,"['Page 5:\n[¬s]""We identified the students by screening each of the six developmental r ding classes\ninstructed by the six middle-school remedial reading teachers The screening proceeded by having\nthe students read silently a 500 word passage written at the seventh grade level entitled, Paper A\nWeb for Words They were cautioned to read carefully so that they would be able to answer\ncomprehension questions about the story[¬e]""']",,NA,NA,,NA,NA,,6,"['Page 5:\n[¬s]""We identified the students by screening each of the six developmental r ding classes\ninstructed by the six middle-school remedial reading teachers[¬e]""']",,NA,NA,NA,,['No'],NA,NA,,Random (please specify),"['Page 5:\n[¬s]""For each of the six teachers, the two classes containing the largest number of students who met our criteria for demonstrating a discrepancy between decoding and comprehension ability were identified ""\n""he two groups per teacher were then randomly assigned to the treatment or control conditions[¬e]""']",NA,,Class,NA,NA,,['Individual RCT'],"['Page 5:\n[¬s]""For each of the six teachers, the two classes containing the largest number of students who\nmet our criteria for demonstrating a discrepancy between decoding and comprehension ability were\nidentified Our criteria included the ability to read grade level material with 80 word-per-minute\naccuracy and two or fewer error words-per minute (Strong), while attaining 50% or less correct on\nthe comprehension questions In only one instance did a teacher have more than two groups in\nwhich a vast majority of the students attained these criteria In this instance, we selected the two\ngroups of equivalent size The two groups per teacher were then randomly assigned to the treatment\nor control conditions[¬e]""']",NA,,No/Unclear,"['Page 5:\n[¬s]""For each of the six teachers, the two classes containing the largest number of students who\nmet our criteria for demonstrating a discrepancy between decoding and comprehension ability were\nidentified Our criteria included the ability to read grade level material with 80 word-per-minute\naccuracy and two or fewer error words-per minute (Strong), while attaining 50% or less correct on\nthe comprehension questions In only one instance did a teacher have more than two groups in\nwhich a vast majority of the students attained these criteria In this instance, we selected the two\ngroups of equivalent size The two groups per teacher were then randomly assigned to the treatment\nor control conditions[¬e]""']",NA,
38223966,Paris (1984),1984,Examines reading awareness and comprehension skills to discover the developmental and instructional relationships between metacognition and performance. Half of the third- and fifth-grade subjects received four months of classroom instruction on reading strategies. Results of pre- and posttests and interviews revealed that the instruction increased reading awareness and comprehension.,['Metacognition and self-regulation'],NA,,"Journal, Article",,['Journal article'],NA,NA,,['USA'],,['Primary/elementary school'],NA,NA,,Low ecological validity,NA,"Low overall. Ecological validity but this was reduced somewhat by the untervention being implemented by an external education professional. However, other factors (including the intervention being conducted during school hours and in the school setting) indicate high EC. ",,"['8', '10', '9', '11']",NA,NA,,≤3,"['Page 3:\n[¬s]""four schools[¬e]""']",,≤3,"['Page 3:\n[¬s]""four schools[¬e]""']",,4,"['Page 3:\n[¬s]""four schools[¬e]""']",,NA,NA,NA,,≤7,"['Page 3:\n[¬s]""eight intact classrooms[¬e]""']",,≤7,"['Page 3:\n[¬s]""eight intact classrooms[¬e]""']",,8,"['Page 3:\n[¬s]""eight intact classrooms[¬e]""']",,['not_provided'],"Unclear - study states eight classes are used, but does not specify distribution of classes across intervention and control groups.",NA,,['No'],NA,NA,,"Non-random, but matched","['Page 3:\n[¬s]"" Schools were selected to represent the socioeconomic variation that existed within the district. They were also matched approxi\xad mately on schoolwide scores from the Califor\xad nia Achievement Test given the previous year. Each classroom had nearly equal num\xad bers of boys and girls, and classes had similar ethnic representation, approximately 65% white and 35% black, Asian, and Native American. [¬e]""']",Matched to a degree.,,Class,"['Page 3:\n[¬s]""members of eight intact classrooms whose teachers volunteered to participate in this study[¬e]""']",NA,,['Prospective QED'],"['Page 3:\n[¬s]""All children were members of eight intact classrooms whose teachers volunteered to participate in this study. Classes were located in four schools (one third- and one fifth-grade class in each school) in the same district.""\n""Separate schools\nwere chosen for experimental and control\nclasses[¬e]""']",NA,,Not applicable,NA,"NB  The distribution of the recruited sample into intervention and control groups is not provided. The study states that 183 students were recruited, 91 and 92 from third and fifth grade respectfully. The following code estimates 91 and 92 as close equal distribution of intervention and control of the recruited sample.",
38224160,Paris (1984),1984,Examined the role of awareness about their own cognitive skills on the learning and development of 87 3rd graders and 83 5th graders. Half of the Ss were given an experimental curriculum—informed strategies for learning (ISL)—designed to increase Ss' awareness and use of effective reading strategies. The remainder of the Ss were used as controls. Results show that Ss who participated in ISL made larger gains than did controls on cloze and error detection tasks. No differences between groups were found on 2 standardized tests of reading comprehension. Findings demonstrate that metacognition can be promoted through direct instruction in classrooms and that increased awareness can lead to better use of reading strategies,['Metacognition and self-regulation'],NA,,"Journal, Article",,['Journal article'],NA,NA,,['USA'],,['Primary/elementary school'],NA,NA,,Low ecological validity,NA,NA,,"['8', '9', '10', '11']",NA,NA,,4,"['Page 4:\n[¬s]""Two third-grade and two fifth-grade classes received training""\n""four schools[¬e]""']",,4,"['Page 4:\n[¬s]""the remaining four classes served as con- trols.[¬e]""']",,4,"['Page 4:\n[¬s]"" four schools[¬e]""']",,NA,NA,NA,,4,NA,,4,NA,,8,NA,,NA,NA,NA,,['No'],NA,NA,,Random (please specify),"['Page 4:\n[¬s]"" one third-grade and one fifth-grade class from each of four schools were assigned randomly to either the treatment or the control condition.[¬e]""']",NA,,School - cluster,"['Page 4:\n[¬s]"" As a result, one third-grade and one fifth-grade class from each of four schools were assigned randomly to either the treatment or the control condition.[¬e]""']",NA,,['Cluster RCT'],"['Page 4:\n[¬s]""class from each of four schools were assigned randomly to either the treatment or the control condition.[¬e]""']",assignment of class to either treatment or control conditions,,Yes,"['Page 4:\n[¬s]""Two third-grade and two fifth-grade classes received training, and the remaining four classes served as con- trols. Separate schools were chosen for experimental[¬e]""']",NA,
40294940,Paris (1986) MSR,1986,"Training studies in the field of children's reading have been useful methods for both theoretical understanding of the development of skilled reading and the improvement of educational practices. The data reported here are from an instructional study designed to improve students' use of reading strategies by increasing their metacognitive knowledge about reading. Approximately 500 third-grade and 500 fifth-grade children received an experimental curriculum that explicitly taught them to use reading strategies. An additional 600 children participated as control subjects. All children were tested at the beginning and end of the school year on a broad range of reading comprehension, strategy, metacognitive, and motivational measures. The findings indicate that children in experimental classrooms made significantly greater gains in awareness about reading than control children and demonstrated superior strategic skills. Additional analyses revealed the patterns of reading strategies, motivation, and metacognition characterizing readers of different ages and abilities. The implications of these results for conceptualizing reading and for educational practice were discussed.",['Metacognition and self-regulation'],NA,,"Journal, Article",,['Journal article'],NA,NA,,['USA'],,['Primary/elementary school'],NA,NA,,High ecological validity,NA,NA,,"['8', '9', '10', '11']",NA,NA,,NA,NA,,NA,NA,,28,"['Page 8:\n[¬s]""Approximately 800 third- and 800 fifth-grade children from 28 schools[¬e]""', 'Page 9:\n[¬s]""participated\nboys at each grade and the children were representative\nDetroit communities.\nin the study. There were roughly equal numbers of girls and[¬e]""']",,NA,NA,NA,,NA,NA,,NA,NA,,NA,NA,,['not_provided'],"The sample size for control and intervention group easily attainable from the abstract. However, highlighting the full text with the respective descriptions was challenging as ER4 would pick up more texts than needed. I had to do this in bits and pieces and in some instances, not full words were highlitable",NA,,['No'],NA,NA,,Unclear,NA,NA,,Class,"['Page 10:\n[¬s]"" unteered to participate in the experimental curriculum; 25 teachers in the same two districts provided control classrooms.[¬e]""', 'Page 9:\n[¬s]""Forty-six teachers vol-[¬e]""']",NA,,['Prospective QED'],"['Page 13:\n[¬s]""The study had a 2 (Grade) x 3 (Reader Ability) x 2 (Condition) x 2\n(Sex) factorial design with repeated measures. Grade (Third. Fifthj,\nReader Ability (Low, Mid, High), Condition (Experimental, Control) and\nSex (Female, Male) were between-subjects factors. and time of testing\nwas a within-subjects factor. Students were divided into three reader\ngroups based on their pretest Gates-MacGinitie comprehension test per-\nformance. The reader groups were formed by partitioning subjects at\nscores corresponding to the 33rd and 67th percentiles of the national\nnorms for each grade.[¬e]""']",NA,,Not applicable,NA,NA,
38223967,Patching (1983),1983,Results of a study that compared three instructional methods in teaching critical reading skills indicate that students performed better after direct instruction than after either using a workbook with corrective feedback or having no teacher intervention.,['Metacognition and self-regulation'],NA,,"Journal, Article",,['Journal article'],NA,NA,,['Australia'],,['Primary/elementary school'],NA,NA,,Low ecological validity,NA,NA,,"['10', '11']",NA,NA,,NA,NA,,NA,NA,,2,"['Page 5:\n[¬s]""The subjects were selected from four fifth-grade classes in two public schools in a community of 125,000 in the Northwest.[¬e]""']",,NA,NA,NA,,NA,NA,,NA,NA,,4,"['Page 5:\n[¬s]""The subjects were selected from four fifth-grade classes in two public schools in a community of 125,000 in the Northwest[¬e]""']",,NA,NA,NA,,['Yes (Please specify)'],"['Page 5:\n[¬s]"" The 39 subjects who met the screening criteria were randomly assigned to one of three groups; each group was then randomly assigned to one of the three treatment conditions[¬e]""']","3 groups, but as instructed by the coding team, Group 1 (Systematic Instruction) vs Group 3 (Control) will be coded.",,Random (please specify),"['Page 5:\n[¬s]"" The 39 subjects who met the screening criteria were randomly assigned to one of three groups; each group was then randomly assigned to one of the three treatment conditions.[¬e]""']",NA,,Individual,"['Page 5:\n[¬s]"" The 39 subjects who met the screening criteria were randomly assigned to one of three groups; each group was then randomly assigned to one of the three treatment conditions.[¬e]""']",NA,,['Individual RCT'],"['Page 5:\n[¬s]"" The 39 subjects who met the screening criteria were randomly assigned to one of three groups; each group was then randomly assigned to one of the three treatment conditions.[¬e]""']",NA,,NA,NA,NA,
38223968,Payne (1992),1992,"The efficacy of a metacognitive instructional strategy for use with basal readers in improving reading comprehension, strategy use, and attitude toward reading was investigated. Thirty-one children in two fourth-grade classrooms served as subjects in the experiment. Twenty students in a self-contained classroom served as the treatment group while eleven students in a second self-contained classroom served as the control. All subjects in both groups were administered the Metropolitan Achievement Test, Reading Attitude Inventory, and the Index of Reading Awareness in September prior to the treatment and again at the end of the treatment the following May. The experimental treatment was based on the instructional strategies proposed by Schmitt and Baumann (1986) that describe how teachers can incorporate the use of comprehension monitoring strategies into the guided reading phase of basal reader instruction. Results indicated that children can be taught how to use metacognitive reading strategies and techniques during basal reader instruction. Average fourth-grade readers who received metacognitive skills training had greater reading comprehension, greater knowledge about reading strategies, and mor epositive attitudes toward reading than children int he control group.",['Metacognition and self-regulation'],NA,,"Journal, Article",,['Journal article'],NA,NA,,['USA'],,['Primary/elementary school'],NA,NA,,High ecological validity,NA,NA,,"['9', '10']",NA,NA,,NA,NA,,NA,NA,,NA,NA,,NA,NA,NA,,4,"['Page 3:\n[¬s]"" 4 classrooms served as subjects in the experiment. [¬e]""']",,4,"['Page 3:\n[¬s]""4 classrooms served as subjects in the experiment.[¬e]""']",,4,"['Page 3:\n[¬s]""4 classrooms served as subjects in the experiment.[¬e]""']",,NA,NA,NA,,['No'],NA,NA,,"Non-random, not matched prior to treatment","['Page 4:\n[¬s]"" The teacher was dissatisfied with traditional basal readers because they provided little guidance on comprehen- sion strategies. This teacher was enthusiastic about the possibilities of im- proving children\'s reading comprehension as well as developing more positive attitudes toward reading through the use of metacognitive strategies.[¬e]""']","It feels, the developer/teacher did an experiment on their own class using a colleague's class as a control",,Class,NA,NA,,['Individual RCT'],NA,NA,,No/Unclear,NA,NA,
38224018,Pennequin (2010),2010,"The central question underlying this study was whether metacognition training could enhance the two metacognition components—knowledge and skills—and the mathematical problem-solving capacities of normal children in grade 3. We also investigated whether metacognitive training had a differential effect according to the children's mathematics level. A total of 48 participants took part in this study, divided into an experimental and a control group, each subdivided into a lower and a normal achievers group. The training programme took an interactive approach in accordance with Schraw's (1998) recommendation and was carried out over five training sessions. Results indicated that children in the training group had significantly higher post-test metacognitive knowledge, metacognitive skills, and mathematical problem-solving scores. In addition, metacognitive training was particularly beneficial to the low achievers. Thus metacognitive training enabled the low achievers to make progress and solve the same number of problems on the post-test as the normal chievers solved on the pre-test.",['Metacognition and self-regulation'],NA,,"Journal, Article",,['Journal article'],NA,NA,,['France'],,['Primary/elementary school'],NA,NA,,Low ecological validity,NA,NA,,"['8', '9']",NA,NA,,1,"['Page 9:\n[¬s]""an elementary school[¬e]""']",,1,"['Page 9:\n[¬s]""an elementary school[¬e]""']",,1,"['Page 9:\n[¬s]""an elementary school[¬e]""']",,NA,NA,NA,,NA,NA,,NA,NA,,NA,NA,,['not_provided'],NA,NA,,['No'],NA,NA,,Random (please specify),"['Page 9:\n[¬s]"" Participants were randomly assigned to an experimental and a control group,[¬e]""']",NA,,Individual,"['Page 9:\n[¬s]""Participants were randomly assigned to an experimental and a control group, each consisting of 24 elementary class children in a French school[¬e]""']",NA,,['Individual RCT'],"['Page 9:\n[¬s]""Participants were randomly assigned to an experimental and a control group,[¬e]""']",NA,,NA,NA,NA,
38224020,Perels (2005) 1_1,2005,"The effects of different trainings on the acquisition of mathematical problem-solving and self-regulation were studied with 249 eighth-graders. The study was conducted with 4 different trainings in German grammar schools. Each training consisted of six 90-min sessions on a weekly basis. The results confirm that it is possible to improve mathematical problem-solving and self-regulation competence through this kind of short training. The evaluation shows that the combination of self-regulatory and problem-solving strategies leads to the best effects for the improvement of self-regulatory competences. Furthermore, it is possible to improve problem-solving by practicing problem-solving and self-regulatory strategies or a combination of both.",['Metacognition and self-regulation'],NA,,"Journal, Article",,['Journal article'],NA,NA,,['Germany'],,['Secondary/High school'],NA,NA,,Unclear,NA,NA,,"['13', '14', '15']",NA,NA,,≤3,"['Page 6:\n[¬s]""three German grammar schools[¬e]""']",,≤3,"['Page 6:\n[¬s]""three German grammar schools[¬e]""']",,≤3,"['Page 6:\n[¬s]""three German grammar schools[¬e]""']",,NA,NA,NA,,≤3,"['Page 7:\n[¬s]""There were between 58 and 67 students assigned to each condition.[¬e]""']",,≤3,"['Page 7:\n[¬s]""There were between 58 and 67 students assigned to each condition.[¬e]""']",,≤6,"['Page 7:\n[¬s]""There were between 58 and 67 students assigned to each condition.[¬e]""']",,NA,NA,NA,,['No'],NA,"As per instructions  'There are four identifiable arms  1) self-regulation, 2) combined training, 3) problem-solving training, 4) control. Please focus on recording data for Groups 1 and 4.' ",,Random (please specify),"['Page 7:\n[¬s]""The participating students were randomly assigned""\n""There were between 58 and 67 students assigned to each condition.[¬e]""']",NA,,Individual,"['Page 6:\n[¬s]""Because of nine incomplete or incorrect ﬁlled out questionnaires only 240 data were integrated in the analyses.""\n""For all students, participation in the training was voluntary.[¬e]""', 'Page 6:\n[¬s]""Because of nine incomplete or incorrect ﬁlled out questionnaires only 240 data were integrated in the analyses.[¬e]""', 'Page 7:\n[¬s]""The participating students were randomly assigned to""\n""experimental conditions.[¬e]""']",NA,,['Individual RCT'],"['Page 7:\n[¬s]""The participating students were randomly assigned to one of four experimental\nconditions.[¬e]""']",NA,,Yes,"['Page 7:\n[¬s]""The participating students were randomly assigned to one of four experimental\nconditions.[¬e]""']",Note  Sample Sizes for following sample size code have been estimated.,
40294943,Perels (2005) 1_2,2005,"The effects of different trainings on the acquisition of mathematical problem-solving and self-regulation were studied with 249 eighth-graders. The study was conducted with 4 different trainings in German grammar schools. Each training consisted of six 90-min sessions on a weekly basis. The results confirm that it is possible to improve mathematical problem-solving and self-regulation competence through this kind of short training. The evaluation shows that the combination of self-regulatory and problem-solving strategies leads to the best effects for the improvement of self-regulatory competences. Furthermore, it is possible to improve problem-solving by practicing problem-solving and self-regulatory strategies or a combination of both.",['Metacognition and self-regulation'],NA,,"Journal, Article",,['Journal article'],NA,NA,,['Germany'],,['Secondary/High school'],NA,NA,,Unclear,NA,NA,,"['13', '14']",NA,NA,,≤3,"['Page 6:\n[¬s]""three German grammar schools[¬e]""']",,≤3,"['Page 6:\n[¬s]""three German grammar schools[¬e]""']",,≤3,"['Page 6:\n[¬s]""three German grammar schools[¬e]""']",,NA,NA,NA,,≤3,"['Page 7:\n[¬s]""There were between 58 and 67 students assigned to each condition.[¬e]""']",,≤3,"['Page 7:\n[¬s]""There were between 58 and 67 students assigned to each condition.[¬e]""']",,≤6,"['Page 7:\n[¬s]""There were between 58 and 67 students assigned to each condition.[¬e]""']",,NA,NA,NA,,['Yes (Please specify)'],NA,But only one focussed on for purposes of this coding,,Random (please specify),"['Page 7:\n[¬s]""The participating students were randomly assigned to one of four experimental conditions.[¬e]""']",No additional information given other than what is in code,,Individual,NA,NA,,['Individual RCT'],"['Page 7:\n[¬s]""The participating students were randomly assigned to one of four experimental\nconditions.[¬e]""']",NA,,Yes,"['Page 7:\n[¬s]""The participating students were randomly assigned to one of four experimental\nconditions.[¬e]""']",Note  Sample Sizes for following sample size code have been estimated. ,
40294944,Perels (2005) 1_3,2005,"The effects of different trainings on the acquisition of mathematical problem-solving and self-regulation were studied with 249 eighth-graders. The study was conducted with 4 different trainings in German grammar schools. Each training consisted of six 90-min sessions on a weekly basis. The results confirm that it is possible to improve mathematical problem-solving and self-regulation competence through this kind of short training. The evaluation shows that the combination of self-regulatory and problem-solving strategies leads to the best effects for the improvement of self-regulatory competences. Furthermore, it is possible to improve problem-solving by practicing problem-solving and self-regulatory strategies or a combination of both.",['Metacognition and self-regulation'],NA,,"Journal, Article",,['Journal article'],NA,NA,,['Germany'],,['Secondary/High school'],"['Page 1:\n[¬s]""German grammar schools.[¬e]""']",Grammar schools,,High ecological validity,NA,NA,,"['13', '14', '15']","['Page 6:\n[¬s]"" ages 13 (67%), 14 (31%) and 15 (2%)[¬e]""']",2%,,≤3,"['Page 6:\n[¬s]""three German grammar schools[¬e]""']",,≤3,"['Page 6:\n[¬s]""three German grammar schools[¬e]""']",,≤3,"['Page 6:\n[¬s]""three German grammar schools[¬e]""']",,NA,NA,NA,,≤3,"['Page 7:\n[¬s]""There were between 58 and 67 students assigned to each condition.[¬e]""']",,≤3,"['Page 7:\n[¬s]""There were between 58 and 67 students assigned to each condition.[¬e]""']",,≤6,"['Page 7:\n[¬s]""There were between 58 and 67 students assigned to each condition.[¬e]""']",,NA,NA,NA,,['No'],NA,"There are four identifiable arms, but I am focused on 3) problem-solving training, 4) control.",,Random (please specify),"['Page 7:\n[¬s]""The participating students were randomly assigned to one of four experimental conditions.[¬e]""']","All 8th grade students in 3 schools were invited to take part in the study. After consent was given by parents, the students were randomly assigned to one of four conditions, each group containning 58-67 students.",,Individual,NA,NA,,['Individual RCT'],"['Page 7:\n[¬s]""The participating students were randomly assigned to one of four experimental\nconditions.[¬e]""']",NA,,Yes,"['Page 7:\n[¬s]""The participating students were randomly assigned to one of four experimental\nconditions.[¬e]""']",Note  Sample Sizes for following sample size code have been estimated.,
