42024828,Donachy (1976),1976,['Parental engagement'],NA,Reynell: Compreh. - Parental Engagm.,,Reynell Developmental Language Scale - Compreh. (GrpA+B vs GrpE+F) - Parental Engagm.,,"['Toolkit primary outcome', 'Reading primary outcome']",,0.7165,,0.2584,,Literacy: reading comprehension,,32,,1.135,,0.928,,32,,0.43,,1.014,,0.2101,,1.223,,Primary outcome,,['Sample: All'],,With business as usual,,['Post-test unadjusted (select one from this group)'],,['Test type: Standardised test '],,Reynell: Compreh. - Parental Engagm.,,Reynell Developmental Language Scale - Compreh. (GrpA+B vs GrpE+F) - Parental Engagm.,,"['Toolkit primary outcome', 'Reading primary outcome']",,0.7165,,0.2584,,Literacy: reading comprehension,,32,,1.135,,0.928,,32,,0.43,,1.014,,0.2101,,1.223,,Primary outcome,,['Sample: All'],,With business as usual,,['Post-test unadjusted (select one from this group)'],,['Test type: Standardised test '],,NA,,NA,,NA,,NA,,NA,,NA,,NA,,NA,,NA,,NA,,NA,,NA,,NA,,NA,,NA,,NA,,NA,,NA,,NA,,NA,,NA,,NA,,NA,,NA,,NA,,NA,,NA,,NA,,NA,,NA,,NA,,NA,,NA,,NA,,NA,,NA,,NA,,NA,,NA,,NA,,NA,,NA,,NA,,NA,,NA,,NA,,NA,,NA,,NA,,NA,,NA,,NA,,NA,,NA,,NA,,NA,,NA,,NA,,NA,,NA,,NA,,NA,,NA,,NA,,NA,,NA,,NA,,NA,,NA,,NA,,NA,,NA,,NA,,NA,,NA,,NA,
73032953,Dulay (2019) 1_2,2019,['Parental engagement'],NA,Book vocabulary: DR vs control,,"Book vocabulary  DR (dialogic reading) vs control (the smd calculated here using post-test is is an underestimation of the authors' given d=.70 from the ANCOVA with covariates of pre-test, age, gender, and pre-school attendance, Table 4)",,"['Toolkit primary outcome', 'Reading primary outcome']",,0.5783,,0.1204,,Literacy: reading comprehension,,128,,4.37,,2.34,,164,,3.15,,1.9,,0.3424,,0.8143,,Primary outcome,,['Sample: All'],,With business as usual,,['Post-test unadjusted (select one from this group)'],,['Test type: Researcher developed test'],,Book vocabulary: DR vs control,,"Book vocabulary  DR (dialogic reading) vs control (the smd calculated here using post-test is is an underestimation of the authors' given d=.70 from the ANCOVA with covariates of pre-test, age, gender, and pre-school attendance, Table 4)",,"['Toolkit primary outcome', 'Reading primary outcome']",,0.5783,,0.1204,,Literacy: reading comprehension,,128,,4.37,,2.34,,164,,3.15,,1.9,,0.3424,,0.8143,,Primary outcome,,['Sample: All'],,With business as usual,,['Post-test unadjusted (select one from this group)'],,['Test type: Researcher developed test'],,NA,,NA,,NA,,NA,,NA,,NA,,NA,,NA,,NA,,NA,,NA,,NA,,NA,,NA,,NA,,NA,,NA,,NA,,NA,,Addition: DR  vs control,,Addition  DR (Dialogic Reading) vs control,,['Mathematics primary outcome'],,-0.0174,,0.1179,,Mathematics,,128,,0.99,,1.73,,164,,1.02,,1.72,,-0.2485,,0.2138,,Secondary outcome(s),,['Sample: All'],,With business as usual,,['Post-test unadjusted (select one from this group)'],,['Test type: Researcher developed test'],,NA,,NA,,NA,,NA,,NA,,NA,,NA,,NA,,NA,,NA,,NA,,NA,,NA,,NA,,NA,,NA,,NA,,NA,,NA,,NA,,NA,,NA,,NA,,NA,,NA,,NA,,NA,,NA,,NA,,NA,,NA,,NA,,NA,,NA,,NA,,NA,,NA,,NA,
73032954,Dulay (2019) 1_3,2019,['Parental engagement'],NA,Book vocabulary: EL vs control,,Book vocabulary  EL (Early Literacy) vs control ,,"['Toolkit primary outcome', 'Reading primary outcome']",,0.5802,,0.1226,,Literacy: reading other,,120,,4.37,,2.34,,164,,3.15,,1.9,,0.3399,,0.8206,,Primary outcome,,['Sample: All'],,With business as usual,,['Post-test unadjusted (select one from this group)'],,['Test type: Researcher developed test'],,Book vocabulary: EL vs control,,Book vocabulary  EL (Early Literacy) vs control ,,"['Toolkit primary outcome', 'Reading primary outcome']",,0.5802,,0.1226,,Literacy: reading other,,120,,4.37,,2.34,,164,,3.15,,1.9,,0.3399,,0.8206,,Primary outcome,,['Sample: All'],,With business as usual,,['Post-test unadjusted (select one from this group)'],,['Test type: Researcher developed test'],,NA,,NA,,NA,,NA,,NA,,NA,,NA,,NA,,NA,,NA,,NA,,NA,,NA,,NA,,NA,,NA,,NA,,NA,,NA,,Addition: EL  vs control,,Addition  EL (Early Literacy) vs control,,['Mathematics primary outcome'],,-0.0115,,0.1201,,Mathematics,,120,,1,,1.75,,164,,1.02,,1.72,,-0.247,,0.2239,,Secondary outcome(s),,['Sample: All'],,With business as usual,,['Post-test unadjusted (select one from this group)'],,['Test type: Researcher developed test'],,NA,,NA,,NA,,NA,,NA,,NA,,NA,,NA,,NA,,NA,,NA,,NA,,NA,,NA,,NA,,NA,,NA,,NA,,NA,,NA,,NA,,NA,,NA,,NA,,NA,,NA,,NA,,NA,,NA,,NA,,NA,,NA,,NA,,NA,,NA,,NA,,NA,,NA,
42025494,Evangelou (2007),2007,['Parental engagement'],NA,Verbal Comprehension (BAS),,"Verbal Comprehension from the British Ability Scales II (BAS) by Elliot, Smith, and McCulloch (1996). The test assesses understanding of language.",,"['Toolkit primary outcome', 'Other outcome']",,0.5255,,0.1692,,Literacy: speaking and listening/oral language,,64,,21.16,,3.43,,83,,19.68,,2.2,,0.1939,,0.8572,,Primary outcome,,['Sample: All'],,With business as usual,,['Post-test unadjusted (select one from this group)'],,['Test type: Standardised test '],,NA,,NA,,NA,,NA,,NA,,NA,,NA,,NA,,NA,,NA,,NA,,NA,,NA,,NA,,NA,,NA,,NA,,NA,,NA,,NA,,NA,,NA,,NA,,NA,,NA,,NA,,NA,,NA,,NA,,NA,,NA,,NA,,NA,,NA,,NA,,NA,,NA,,NA,,Early Number Concepts,,"Early Number Concepts from the British Ability Scales II (BAS) by Elliott, Smith, and McCulloch, (1996). The test is a scale with verbal, pictorial, and quantitative content.",,['Mathematics primary outcome'],,0.7683,,0.1724,,Mathematics,,64,,24.64,,3.44,,83,,21.47,,4.55,,0.4303,,1.1063,,Primary outcome,,['Sample: All'],,With business as usual,,['Post-test unadjusted (select one from this group)'],,['Test type: Standardised test '],,NA,,NA,,NA,,NA,,NA,,NA,,NA,,NA,,NA,,NA,,NA,,NA,,NA,,NA,,NA,,NA,,NA,,NA,,NA,,NA,,NA,,NA,,NA,,NA,,NA,,NA,,NA,,NA,,NA,,NA,,NA,,NA,,NA,,NA,,NA,,NA,,NA,,NA,
73032957,Fielding-Barnsley (2002),2002,['Parental engagement'],NA,PPVT: share book reading vs control,,PPVT  share book reading vs control (gain scores) (smd similar to d that I get from converting the author's heta squared reported effect using the psychometrica conversion formula),,"['Toolkit primary outcome', 'Reading primary outcome']",,-0.8612,,0.3605,,Literacy: reading comprehension,,17,,0.76,,4.59,,17,,5.18,,5.4,,-1.5678,,-0.1545,,Primary outcome,,['Sample: All'],,With business as usual,,['Pre-post gain'],,['Test type: Standardised test '],,PPVT: share book reading vs control,,PPVT  share book reading vs control (gain scores) (smd similar to d that I get from converting the author's heta squared reported effect using the psychometrica conversion formula),,"['Toolkit primary outcome', 'Reading primary outcome']",,-0.8612,,0.3605,,Literacy: reading comprehension,,17,,0.76,,4.59,,17,,5.18,,5.4,,-1.5678,,-0.1545,,Primary outcome,,['Sample: All'],,With business as usual,,['Pre-post gain'],,['Test type: Standardised test '],,NA,,NA,,NA,,NA,,NA,,NA,,NA,,NA,,NA,,NA,,NA,,NA,,NA,,NA,,NA,,NA,,NA,,NA,,NA,,NA,,NA,,NA,,NA,,NA,,NA,,NA,,NA,,NA,,NA,,NA,,NA,,NA,,NA,,NA,,NA,,NA,,NA,,NA,,NA,,NA,,NA,,NA,,NA,,NA,,NA,,NA,,NA,,NA,,NA,,NA,,NA,,NA,,NA,,NA,,NA,,NA,,NA,,NA,,NA,,NA,,NA,,NA,,NA,,NA,,NA,,NA,,NA,,NA,,NA,,NA,,NA,,NA,,NA,,NA,,NA,,NA,
42025509,Fielding-Barnsley (2003),2003,['Parental engagement'],NA,PPVT (time 2),," The Peabody picture vocabulary test (PPVT-111) (Dunn and Dunn, 1997). This test is a measure of receptive vocabulary. A matrix of four pictures is shown to the child, who is then asked to choose the picture that matches the spoken word provided by the tester.",,"['Toolkit primary outcome', 'Reading primary outcome']",,0.4583,,0.2903,,Literacy: reading other,,26,,88.69,,10,,23,,81.65,,19.35,,-0.1107,,1.0273,,Primary outcome,,['Sample: Low achievers'],,With business as usual,,['Post-test unadjusted (select one from this group)'],,['Test type: Standardised test '],,PPVT (time 2),," The Peabody picture vocabulary test (PPVT-111) (Dunn and Dunn, 1997). This test is a measure of receptive vocabulary. A matrix of four pictures is shown to the child, who is then asked to choose the picture that matches the spoken word provided by the tester.",,"['Toolkit primary outcome', 'Reading primary outcome']",,0.4583,,0.2903,,Literacy: reading other,,26,,88.69,,10,,23,,81.65,,19.35,,-0.1107,,1.0273,,Primary outcome,,['Sample: Low achievers'],,With business as usual,,['Post-test unadjusted (select one from this group)'],,['Test type: Standardised test '],,NA,,NA,,NA,,NA,,NA,,NA,,NA,,NA,,NA,,NA,,NA,,NA,,NA,,NA,,NA,,NA,,NA,,NA,,NA,,NA,,NA,,NA,,NA,,NA,,NA,,NA,,NA,,NA,,NA,,NA,,NA,,NA,,NA,,NA,,NA,,NA,,NA,,NA,,NA,,NA,,NA,,NA,,NA,,NA,,NA,,NA,,NA,,NA,,NA,,NA,,NA,,NA,,NA,,NA,,NA,,NA,,NA,,NA,,NA,,NA,,NA,,NA,,NA,,NA,,NA,,NA,,NA,,NA,,NA,,NA,,NA,,NA,,NA,,NA,,NA,,NA,
55203434,Ford (2009),2009,NA,NA,NA,,NA,,NA,,NA,,NA,,NA,,NA,,NA,,NA,,NA,,NA,,NA,,NA,,NA,,NA,,NA,,NA,,NA,,NA,,NA,,NA,,NA,,NA,,NA,,NA,,NA,,NA,,NA,,NA,,NA,,NA,,NA,,NA,,NA,,NA,,NA,,NA,,NA,,NA,,NA,,NA,,NA,,NA,,NA,,NA,,NA,,NA,,NA,,NA,,NA,,NA,,NA,,NA,,NA,,NA,,NA,,NA,,NA,,NA,,NA,,NA,,NA,,NA,,NA,,NA,,NA,,NA,,NA,,NA,,NA,,NA,,NA,,NA,,NA,,NA,,NA,,NA,,NA,,NA,,NA,,NA,,NA,,NA,,NA,,NA,,NA,,NA,,NA,,NA,,NA,,NA,,NA,,NA,,NA,,NA,,NA,,NA,,NA,,NA,,NA,,NA,,NA,,NA,,NA,,NA,,NA,,NA,,NA,,NA,,NA,,NA,,NA,,NA,,NA,
73032958,Fryer (2020) 1_1,2020,['Parental engagement'],NA,Standardized Cognitive Score: pre-school group vs control,,"Standardized Cognitive Score  pre-school group vs control (Main effects are coefficient estimates, the SE seem to be the figures in parentheses on Table 7 but this is not made clear by the authors)",,"['Toolkit primary outcome', 'Other outcome']",,0.234,,0.078,,Combined subjects,,NA,,NA,,NA,,NA,,NA,,NA,,0.0811,,0.3869,,Primary outcome,,['Sample: All'],,With business as usual,,['Post-test adjusted for baseline attainment'],,['Test type: Standardised test '],,NA,,NA,,NA,,NA,,NA,,NA,,NA,,NA,,NA,,NA,,NA,,NA,,NA,,NA,,NA,,NA,,NA,,NA,,NA,,NA,,NA,,NA,,NA,,NA,,NA,,NA,,NA,,NA,,NA,,NA,,NA,,NA,,NA,,NA,,NA,,NA,,NA,,NA,,NA,,NA,,NA,,NA,,NA,,NA,,NA,,NA,,NA,,NA,,NA,,NA,,NA,,NA,,NA,,NA,,NA,,NA,,NA,,NA,,NA,,NA,,NA,,NA,,NA,,NA,,NA,,NA,,NA,,NA,,NA,,NA,,NA,,NA,,NA,,NA,,NA,,NA,,NA,,NA,,NA,,NA,,NA,,NA,,NA,,NA,,NA,,NA,,NA,,NA,,NA,,NA,,NA,,NA,,NA,,NA,,NA,
73032959,Fryer (2020) 1_2,2020,['Parental engagement'],NA,Standardized Cognitive Score: Kinderprep vs control,,"Standardized Cognitive Score  Kinderprep vs control (Kinderprep comparisons are taken as end of summer, see Table 7, because of the different control group)  (Main effects are coefficient estimates, the SE seem to be the figures in parentheses on Table 7 but this is not made clear by the authors)",,"['Toolkit primary outcome', 'Other outcome']",,0.184,,0.07,,Combined subjects,,NA,,NA,,NA,,NA,,NA,,NA,,0.0468,,0.3212,,Primary outcome,,['Sample: All'],,With business as usual,,['Post-test adjusted for baseline attainment'],,['Test type: Standardised test '],,NA,,NA,,NA,,NA,,NA,,NA,,NA,,NA,,NA,,NA,,NA,,NA,,NA,,NA,,NA,,NA,,NA,,NA,,NA,,NA,,NA,,NA,,NA,,NA,,NA,,NA,,NA,,NA,,NA,,NA,,NA,,NA,,NA,,NA,,NA,,NA,,NA,,NA,,NA,,NA,,NA,,NA,,NA,,NA,,NA,,NA,,NA,,NA,,NA,,NA,,NA,,NA,,NA,,NA,,NA,,NA,,NA,,NA,,NA,,NA,,NA,,NA,,NA,,NA,,NA,,NA,,NA,,NA,,NA,,NA,,NA,,NA,,NA,,NA,,NA,,NA,,NA,,NA,,NA,,NA,,NA,,NA,,NA,,NA,,NA,,NA,,NA,,NA,,NA,,NA,,NA,,NA,,NA,,NA,,NA,
55203439,Hadeed (2011),2011,NA,NA,NA,,NA,,NA,,NA,,NA,,NA,,NA,,NA,,NA,,NA,,NA,,NA,,NA,,NA,,NA,,NA,,NA,,NA,,NA,,NA,,NA,,NA,,NA,,NA,,NA,,NA,,NA,,NA,,NA,,NA,,NA,,NA,,NA,,NA,,NA,,NA,,NA,,NA,,NA,,NA,,NA,,NA,,NA,,NA,,NA,,NA,,NA,,NA,,NA,,NA,,NA,,NA,,NA,,NA,,NA,,NA,,NA,,NA,,NA,,NA,,NA,,NA,,NA,,NA,,NA,,NA,,NA,,NA,,NA,,NA,,NA,,NA,,NA,,NA,,NA,,NA,,NA,,NA,,NA,,NA,,NA,,NA,,NA,,NA,,NA,,NA,,NA,,NA,,NA,,NA,,NA,,NA,,NA,,NA,,NA,,NA,,NA,,NA,,NA,,NA,,NA,,NA,,NA,,NA,,NA,,NA,,NA,,NA,,NA,,NA,,NA,,NA,,NA,,NA,
42025141,Hampton (1998) 1_1,1998,['Parental engagement'],NA,Reading ES - CTS & Terra Nova,,NA,,"['Toolkit primary outcome', 'Reading primary outcome']",,0.808,,0.112,,Literacy: reading comprehension,,0.80798934,,0,,0,,0.11204754,,0,,0,,0.5884,,1.0276,,Primary outcome,,['Sample: All'],,With business as usual,,['Post-test unadjusted (select one from this group)'],,['Test type: Standardised test '],,Reading ES - CTS & Terra Nova,,NA,,"['Toolkit primary outcome', 'Reading primary outcome']",,0.808,,0.112,,Literacy: reading comprehension,,0.80798934,,0,,0,,0.11204754,,0,,0,,0.5884,,1.0276,,Primary outcome,,['Sample: All'],,With business as usual,,['Post-test unadjusted (select one from this group)'],,['Test type: Standardised test '],,NA,,NA,,NA,,NA,,NA,,NA,,NA,,NA,,NA,,NA,,NA,,NA,,NA,,NA,,NA,,NA,,NA,,NA,,NA,,Maths ES - CTS & Terra Nova,,NA,,['Mathematics primary outcome'],,0.3577,,0.11,,Mathematics,,0.3577183,,0,,0,,0.11000369,,0,,0,,0.1421,,0.5733,,Secondary outcome(s),,['Sample: All'],,With business as usual,,['Post-test unadjusted (select one from this group)'],,['Test type: Standardised test '],,NA,,NA,,NA,,NA,,NA,,NA,,NA,,NA,,NA,,NA,,NA,,NA,,NA,,NA,,NA,,NA,,NA,,NA,,NA,,NA,,NA,,NA,,NA,,NA,,NA,,NA,,NA,,NA,,NA,,NA,,NA,,NA,,NA,,NA,,NA,,NA,,NA,,NA,
42024832,Highberger (1973),1973,['Parental engagement'],NA,Peabody Picture Vocabulary Test - Parental Engagement,,Pre-post gain score of the Peabody Picture Vocabulary Test. Form J was administered at pre-test and Form B at post-test.,,"['Toolkit primary outcome', 'Reading primary outcome']",,1.1584,,0.2425,,Literacy: reading other,,40,,10.08,,7.25,,40,,1.6,,7.25,,0.683,,1.6337,,Primary outcome,,['Sample: All'],,With business as usual,,['Pre-post gain'],,['Test type: Standardised test '],,Peabody Picture Vocabulary Test - Parental Engagement,,Pre-post gain score of the Peabody Picture Vocabulary Test. Form J was administered at pre-test and Form B at post-test.,,"['Toolkit primary outcome', 'Reading primary outcome']",,1.1584,,0.2425,,Literacy: reading other,,40,,10.08,,7.25,,40,,1.6,,7.25,,0.683,,1.6337,,Primary outcome,,['Sample: All'],,With business as usual,,['Pre-post gain'],,['Test type: Standardised test '],,NA,,NA,,NA,,NA,,NA,,NA,,NA,,NA,,NA,,NA,,NA,,NA,,NA,,NA,,NA,,NA,,NA,,NA,,NA,,NA,,NA,,NA,,NA,,NA,,NA,,NA,,NA,,NA,,NA,,NA,,NA,,NA,,NA,,NA,,NA,,NA,,NA,,NA,,NA,,NA,,NA,,NA,,NA,,NA,,NA,,NA,,NA,,NA,,NA,,NA,,NA,,NA,,NA,,NA,,NA,,NA,,NA,,NA,,NA,,NA,,NA,,NA,,NA,,NA,,NA,,NA,,NA,,NA,,NA,,NA,,NA,,NA,,NA,,NA,,NA,,NA,
73032961,Ihmeideh (2020),2020,['Parental engagement'],NA,Vocabulary: FLP  vs control,,Vocabulary  FLP (family Literacy Programs) vs control,,"['Toolkit primary outcome', 'Reading primary outcome']",,0.4958,,0.0898,,Literacy: reading other,,162,,6.16,,1.29,,581,,5.22,,2.03,,0.3198,,0.6718,,Primary outcome,,['Sample: All'],,With business as usual,,['Post-test unadjusted (select one from this group)'],,['Test type: Researcher developed test'],,Vocabulary: FLP  vs control,,Vocabulary  FLP (family Literacy Programs) vs control,,"['Toolkit primary outcome', 'Reading primary outcome']",,0.4958,,0.0898,,Literacy: reading other,,162,,6.16,,1.29,,581,,5.22,,2.03,,0.3198,,0.6718,,Primary outcome,,['Sample: All'],,With business as usual,,['Post-test unadjusted (select one from this group)'],,['Test type: Researcher developed test'],,NA,,NA,,NA,,NA,,NA,,NA,,NA,,NA,,NA,,NA,,NA,,NA,,NA,,NA,,NA,,NA,,NA,,NA,,NA,,NA,,NA,,NA,,NA,,NA,,NA,,NA,,NA,,NA,,NA,,NA,,NA,,NA,,NA,,NA,,NA,,NA,,NA,,NA,,NA,,NA,,NA,,NA,,NA,,NA,,NA,,NA,,NA,,NA,,NA,,NA,,NA,,NA,,NA,,NA,,NA,,NA,,NA,,NA,,NA,,NA,,NA,,NA,,NA,,NA,,NA,,NA,,NA,,NA,,NA,,NA,,NA,,NA,,NA,,NA,,NA,,NA,
42025475,Jordan (2000),2000,['Parental engagement'],NA,CAP Language Posttest,,Comprehensive Assessment Program Language Postest,,"['Toolkit primary outcome', 'Reading primary outcome']",,0.6865,,0.1439,,Literacy: reading other,,177,,37.27,,4.3,,71,,33.83,,6.42,,0.4045,,0.9685,,Primary outcome,,['Sample: Low achievers'],,With business as usual,,['Post-test unadjusted (select one from this group)'],,['Test type: Standardised test '],,CAP Language Posttest,,Comprehensive Assessment Program Language Postest,,"['Toolkit primary outcome', 'Reading primary outcome']",,0.6865,,0.1439,,Literacy: reading other,,177,,37.27,,4.3,,71,,33.83,,6.42,,0.4045,,0.9685,,Primary outcome,,['Sample: Low achievers'],,With business as usual,,['Post-test unadjusted (select one from this group)'],,['Test type: Standardised test '],,NA,,NA,,NA,,NA,,NA,,NA,,NA,,NA,,NA,,NA,,NA,,NA,,NA,,NA,,NA,,NA,,NA,,NA,,NA,,NA,,NA,,NA,,NA,,NA,,NA,,NA,,NA,,NA,,NA,,NA,,NA,,NA,,NA,,NA,,NA,,NA,,NA,,NA,,NA,,NA,,NA,,NA,,NA,,NA,,NA,,NA,,NA,,NA,,NA,,NA,,NA,,NA,,NA,,NA,,NA,,NA,,NA,,NA,,NA,,NA,,NA,,NA,,NA,,NA,,NA,,NA,,NA,,NA,,NA,,NA,,NA,,NA,,NA,,NA,,NA,,NA,
42025422,Justice (2000),2000,['Parental engagement'],NA,Words in Print,,Posttest Means and SD's ,,"['Toolkit primary outcome', 'Reading primary outcome']",,1.0585,,0.4076,,Literacy: reading comprehension,,14,,0.64,,0.19,,14,,0.41,,0.23,,0.2596,,1.8575,,Primary outcome,,NA,,With business as usual,,NA,,NA,,Words in Print,,Posttest Means and SD's ,,"['Toolkit primary outcome', 'Reading primary outcome']",,1.0585,,0.4076,,Literacy: reading comprehension,,14,,0.64,,0.19,,14,,0.41,,0.23,,0.2596,,1.8575,,Primary outcome,,NA,,With business as usual,,NA,,NA,,NA,,NA,,NA,,NA,,NA,,NA,,NA,,NA,,NA,,NA,,NA,,NA,,NA,,NA,,NA,,NA,,NA,,NA,,NA,,NA,,NA,,NA,,NA,,NA,,NA,,NA,,NA,,NA,,NA,,NA,,NA,,NA,,NA,,NA,,NA,,NA,,NA,,NA,,NA,,NA,,NA,,NA,,NA,,NA,,NA,,NA,,NA,,NA,,NA,,NA,,NA,,NA,,NA,,NA,,NA,,NA,,NA,,NA,,NA,,NA,,NA,,NA,,NA,,NA,,NA,,NA,,NA,,NA,,NA,,NA,,NA,,NA,,NA,,NA,,NA,,NA,
42059811,Koh (1982),1982,['Parental engagement'],NA,CBTS– Gr1-Grp A: Reading: Parental Engag.,,CBTS (Comprehensive Test of Basic Skills) – Gr1 - Grp A - Reading -Parental Engagement,,"['Toolkit primary outcome', 'Reading primary outcome']",,0.2551,,0.267,,Literacy: reading comprehension,,19,,0.9586,,0,,55,,0,,0,,-0.2682,,0.7784,,Primary outcome,,['Sample: All'],,With business as usual,,['Post-test adjusted for baseline attainment'],,['Test type: Standardised test '],,CBTS– Gr1-Grp A: Reading: Parental Engag.,,CBTS (Comprehensive Test of Basic Skills) – Gr1 - Grp A - Reading -Parental Engagement,,"['Toolkit primary outcome', 'Reading primary outcome']",,0.2551,,0.267,,Literacy: reading comprehension,,19,,0.9586,,0,,55,,0,,0,,-0.2682,,0.7784,,Primary outcome,,['Sample: All'],,With business as usual,,['Post-test adjusted for baseline attainment'],,['Test type: Standardised test '],,NA,,NA,,NA,,NA,,NA,,NA,,NA,,NA,,NA,,NA,,NA,,NA,,NA,,NA,,NA,,NA,,NA,,NA,,NA,,CBTS– Gr1-Grp A: Maths -Parental Eng.,,CBTS (Comprehensive Test of Basic Skills) – Gr1 - Grp A - Maths - Parental Engagement,,['Mathematics primary outcome'],,0.1288,,0.2663,,Mathematics,,19,,0.4839,,0,,55,,0,,0,,-0.3932,,0.6508,,Secondary outcome(s),,['Sample: All'],,With business as usual,,['Post-test adjusted for baseline attainment'],,['Test type: Standardised test '],,NA,,NA,,NA,,NA,,NA,,NA,,NA,,NA,,NA,,NA,,NA,,NA,,NA,,NA,,NA,,NA,,NA,,NA,,NA,,NA,,NA,,NA,,NA,,NA,,NA,,NA,,NA,,NA,,NA,,NA,,NA,,NA,,NA,,NA,,NA,,NA,,NA,,NA,
61218207,Korat (2013) PE,2013,['Parental engagement'],NA,Word meaning: e-book+printed vs control,,"Word meaning  e-book + printed book vs control [The text below Table 2 does not match the Table 2 stats – they are reversed between e-book and printed, as the means for the 2 treatment groups are compbined it doesn’t matter which one is which].    ",,"['Toolkit primary outcome', 'Reading primary outcome']",,1.2418,,0.2428,,Literacy: reading comprehension,,60,,73.7,,20.151,,30,,47.5,,22.4,,0.7658,,1.7177,,Primary outcome,,['Sample: All'],,With business as usual,,['Post-test unadjusted (select one from this group)'],,['Test type: Researcher developed test'],,Word meaning: e-book+printed vs control,,"Word meaning  e-book + printed book vs control [The text below Table 2 does not match the Table 2 stats – they are reversed between e-book and printed, as the means for the 2 treatment groups are compbined it doesn’t matter which one is which].    ",,"['Toolkit primary outcome', 'Reading primary outcome']",,1.2418,,0.2428,,Literacy: reading comprehension,,60,,73.7,,20.151,,30,,47.5,,22.4,,0.7658,,1.7177,,Primary outcome,,['Sample: All'],,With business as usual,,['Post-test unadjusted (select one from this group)'],,['Test type: Researcher developed test'],,NA,,NA,,NA,,NA,,NA,,NA,,NA,,NA,,NA,,NA,,NA,,NA,,NA,,NA,,NA,,NA,,NA,,NA,,NA,,NA,,NA,,NA,,NA,,NA,,NA,,NA,,NA,,NA,,NA,,NA,,NA,,NA,,NA,,NA,,NA,,NA,,NA,,NA,,NA,,NA,,NA,,NA,,NA,,NA,,NA,,NA,,NA,,NA,,NA,,NA,,NA,,NA,,NA,,NA,,NA,,NA,,NA,,NA,,NA,,NA,,NA,,NA,,NA,,NA,,NA,,NA,,NA,,NA,,NA,,NA,,NA,,NA,,NA,,NA,,NA,,NA,
73032962,Kotaman (2007),2007,['Parental engagement'],NA,PPVT : book reading vs control,,PPVT (adaptation of the PPVT into Turkish)   book reading vs control,,"['Toolkit primary outcome', 'Reading primary outcome']",,0.5726,,0.3233,,Literacy: reading other,,20,,47.15,,10.83,,20,,41.25,,9.31,,-0.0611,,1.2064,,Primary outcome,,['Sample: All'],,With business as usual,,['Post-test unadjusted (select one from this group)'],,['Test type: Standardised test '],,PPVT : book reading vs control,,PPVT (adaptation of the PPVT into Turkish)   book reading vs control,,"['Toolkit primary outcome', 'Reading primary outcome']",,0.5726,,0.3233,,Literacy: reading other,,20,,47.15,,10.83,,20,,41.25,,9.31,,-0.0611,,1.2064,,Primary outcome,,['Sample: All'],,With business as usual,,['Post-test unadjusted (select one from this group)'],,['Test type: Standardised test '],,NA,,NA,,NA,,NA,,NA,,NA,,NA,,NA,,NA,,NA,,NA,,NA,,NA,,NA,,NA,,NA,,NA,,NA,,NA,,NA,,NA,,NA,,NA,,NA,,NA,,NA,,NA,,NA,,NA,,NA,,NA,,NA,,NA,,NA,,NA,,NA,,NA,,NA,,NA,,NA,,NA,,NA,,NA,,NA,,NA,,NA,,NA,,NA,,NA,,NA,,NA,,NA,,NA,,NA,,NA,,NA,,NA,,NA,,NA,,NA,,NA,,NA,,NA,,NA,,NA,,NA,,NA,,NA,,NA,,NA,,NA,,NA,,NA,,NA,,NA,,NA,
42025476,Kraft (2001),2001,['Parental engagement'],NA,WRMT Word Identification,,Posttest means and SD's ,,"['Toolkit primary outcome', 'Other outcome']",,0.2758,,0.3073,,Literacy: decoding/phonics,,20,,104.1,,11.3,,23,,99.9,,17.5,,-0.3266,,0.8781,,Primary outcome,,['Sample: All'],,With business as usual,,['Post-test unadjusted (select one from this group)'],,['Test type: Standardised test '],,NA,,NA,,NA,,NA,,NA,,NA,,NA,,NA,,NA,,NA,,NA,,NA,,NA,,NA,,NA,,NA,,NA,,NA,,NA,,NA,,NA,,NA,,NA,,NA,,NA,,NA,,NA,,NA,,NA,,NA,,NA,,NA,,NA,,NA,,NA,,NA,,NA,,NA,,NA,,NA,,NA,,NA,,NA,,NA,,NA,,NA,,NA,,NA,,NA,,NA,,NA,,NA,,NA,,NA,,NA,,NA,,NA,,NA,,NA,,NA,,NA,,NA,,NA,,NA,,NA,,NA,,NA,,NA,,NA,,NA,,NA,,NA,,NA,,NA,,NA,,NA,,NA,,NA,,NA,,NA,,NA,,NA,,NA,,NA,,NA,,NA,,NA,,NA,,NA,,NA,,NA,,NA,,NA,,NA,,NA,
55203355,Lam (2013),2013,NA,NA,Word recognition,,"Word recognition  parental training vs control (t-test at post-test, SE produced is the same size as the authors’ reported one) ",,"['Toolkit primary outcome', 'Reading primary outcome']",,0.4385,,0.1451,,Literacy: reading other,,101,,3.06,,0,,94,,0,,0,,0.1542,,0.7229,,Primary outcome,,['Sample: All'],,With business as usual,,['Post-test unadjusted (select one from this group)'],,['Test type: Researcher developed test'],,Word recognition,,"Word recognition  parental training vs control (t-test at post-test, SE produced is the same size as the authors’ reported one) ",,"['Toolkit primary outcome', 'Reading primary outcome']",,0.4385,,0.1451,,Literacy: reading other,,101,,3.06,,0,,94,,0,,0,,0.1542,,0.7229,,Primary outcome,,['Sample: All'],,With business as usual,,['Post-test unadjusted (select one from this group)'],,['Test type: Researcher developed test'],,NA,,NA,,NA,,NA,,NA,,NA,,NA,,NA,,NA,,NA,,NA,,NA,,NA,,NA,,NA,,NA,,NA,,NA,,NA,,NA,,NA,,NA,,NA,,NA,,NA,,NA,,NA,,NA,,NA,,NA,,NA,,NA,,NA,,NA,,NA,,NA,,NA,,NA,,NA,,NA,,NA,,NA,,NA,,NA,,NA,,NA,,NA,,NA,,NA,,NA,,NA,,NA,,NA,,NA,,NA,,NA,,NA,,NA,,NA,,NA,,NA,,NA,,NA,,NA,,NA,,NA,,NA,,NA,,NA,,NA,,NA,,NA,,NA,,NA,,NA,,NA,
73032963,Leung (2019),2019,['Parental engagement'],NA,HKCAS-P cognition: Healthy Start vs control,,HKCAS-P cognition  Healthy Start Home Visiting Program vs control (post-test calculation of d),,"['Toolkit primary outcome', 'Other outcome']",,-0.0157,,0.1342,,Cognitive: other,,NA,,NA,,NA,,NA,,NA,,NA,,-0.2787,,0.2473,,Primary outcome,,['Sample: All'],,With business as usual,,['Post-test unadjusted (select one from this group)'],,['Test type: Standardised test '],,NA,,NA,,NA,,NA,,NA,,NA,,NA,,NA,,NA,,NA,,NA,,NA,,NA,,NA,,NA,,NA,,NA,,NA,,NA,,NA,,NA,,NA,,NA,,NA,,NA,,NA,,NA,,NA,,NA,,NA,,NA,,NA,,NA,,NA,,NA,,NA,,NA,,NA,,NA,,NA,,NA,,NA,,NA,,NA,,NA,,NA,,NA,,NA,,NA,,NA,,NA,,NA,,NA,,NA,,NA,,NA,,NA,,NA,,NA,,NA,,NA,,NA,,NA,,NA,,NA,,NA,,NA,,NA,,NA,,NA,,NA,,NA,,NA,,NA,,NA,,NA,,NA,,NA,,NA,,NA,,NA,,NA,,NA,,NA,,NA,,NA,,NA,,NA,,NA,,NA,,NA,,NA,,NA,,NA,,NA,
55203352,Levin (2012),2012,NA,NA,linguistic competencies,,"Mean percentage score on alphabetic skills  Includes  Receptive vocabulary (Peabody ), Expressive vocabulary, definition test, Listening comprehension of sentences/story). All treatment groups(Reading mediation + Writing mediation + Visuomotor skills mediation) vs control ",,"['Toolkit primary outcome', 'Reading primary outcome']",,0.3101,,0.2084,,Literacy: reading other,,93,,42.673,,9.393,,31,,39.53,,11.92,,-0.0983,,0.7185,,Primary outcome,,['Sample: All'],,With business as usual,,['Post-test unadjusted (select one from this group)'],,['Test type: Standardised test '],,linguistic competencies,,"Mean percentage score on alphabetic skills  Includes  Receptive vocabulary (Peabody ), Expressive vocabulary, definition test, Listening comprehension of sentences/story). All treatment groups(Reading mediation + Writing mediation + Visuomotor skills mediation) vs control ",,"['Toolkit primary outcome', 'Reading primary outcome']",,0.3101,,0.2084,,Literacy: reading other,,93,,42.673,,9.393,,31,,39.53,,11.92,,-0.0983,,0.7185,,Primary outcome,,['Sample: All'],,With business as usual,,['Post-test unadjusted (select one from this group)'],,['Test type: Standardised test '],,NA,,NA,,NA,,NA,,NA,,NA,,NA,,NA,,NA,,NA,,NA,,NA,,NA,,NA,,NA,,NA,,NA,,NA,,NA,,NA,,NA,,NA,,NA,,NA,,NA,,NA,,NA,,NA,,NA,,NA,,NA,,NA,,NA,,NA,,NA,,NA,,NA,,NA,,NA,,NA,,NA,,NA,,NA,,NA,,NA,,NA,,NA,,NA,,NA,,NA,,NA,,NA,,NA,,NA,,NA,,NA,,NA,,NA,,NA,,NA,,NA,,NA,,NA,,NA,,NA,,NA,,NA,,NA,,NA,,NA,,NA,,NA,,NA,,NA,,NA,,NA,
