42025499,Lonigan (1998),1998,['Parental engagement'],NA,PPVT Posttest adjusted High compliance Home only v control,,PPVT Posttest adjusted High compliance Home only v control,,"['Toolkit primary outcome', 'Reading primary outcome']",,0.0852,,0.4534,,Literacy: reading other,,7,,82.1,,9.41,,16,,80.7,,17.78,,-0.8035,,0.9738,,Primary outcome,,['Sample: Low achievers'],,With business as usual,,['Post-test unadjusted (select one from this group)'],,['Test type: Standardised test '],,PPVT Posttest adjusted High compliance Home only v control,,PPVT Posttest adjusted High compliance Home only v control,,"['Toolkit primary outcome', 'Reading primary outcome']",,0.0852,,0.4534,,Literacy: reading other,,7,,82.1,,9.41,,16,,80.7,,17.78,,-0.8035,,0.9738,,Primary outcome,,['Sample: Low achievers'],,With business as usual,,['Post-test unadjusted (select one from this group)'],,['Test type: Standardised test '],,NA,,NA,,NA,,NA,,NA,,NA,,NA,,NA,,NA,,NA,,NA,,NA,,NA,,NA,,NA,,NA,,NA,,NA,,NA,,NA,,NA,,NA,,NA,,NA,,NA,,NA,,NA,,NA,,NA,,NA,,NA,,NA,,NA,,NA,,NA,,NA,,NA,,NA,,NA,,NA,,NA,,NA,,NA,,NA,,NA,,NA,,NA,,NA,,NA,,NA,,NA,,NA,,NA,,NA,,NA,,NA,,NA,,NA,,NA,,NA,,NA,,NA,,NA,,NA,,NA,,NA,,NA,,NA,,NA,,NA,,NA,,NA,,NA,,NA,,NA,,NA,
73032966,Mantzicopoulos (2013) 1_2,2013,['Parental engagement'],NA,NA,,NA,,NA,,NA,,NA,,NA,,NA,,NA,,NA,,NA,,NA,,NA,,NA,,NA,,NA,,NA,,NA,,NA,,NA,,NA,,NA,,NA,,NA,,NA,,NA,,NA,,NA,,NA,,NA,,NA,,NA,,NA,,NA,,NA,,NA,,NA,,NA,,NA,,NA,,NA,,NA,,NA,,NA,,NA,,NA,,NA,,NA,,NA,,NA,,NA,,NA,,NA,,NA,,NA,,NA,,NA,,NA,,NA,,NA,,NA,,NA,,NA,,NA,,NA,,NA,,NA,,NA,,NA,,NA,,NA,,NA,,NA,,NA,,NA,,NA,,NA,,NA,,NA,,NA,,NA,,NA,,NA,,NA,,NA,,NA,,NA,,NA,,NA,,NA,,NA,,NA,,NA,,NA,,NA,,NA,,NA,,NA,,NA,,NA,,NA,,NA,,NA,,NA,,NA,,NA,,NA,,NA,,NA,,NA,,NA,,NA,,NA,,NA,,NA,
42024838,McCormick (1986),1986,['Parental engagement'],NA,PPVT-R,,Posttest means and SD's for wav 2 intervention vs control... as instructions state,,"['Toolkit primary outcome', 'Other outcome']",,0.0029,,0.2748,,Cognitive: other,,27,,100.07,,9.14,,26,,100.04,,10.92,,-0.5356,,0.5415,,,,['Sample: All'],,With business as usual,,['Post-test adjusted for baseline attainment'],,['Test type: Standardised test '],,NA,,NA,,NA,,NA,,NA,,NA,,NA,,NA,,NA,,NA,,NA,,NA,,NA,,NA,,NA,,NA,,NA,,NA,,NA,,NA,,NA,,NA,,NA,,NA,,NA,,NA,,NA,,NA,,NA,,NA,,NA,,NA,,NA,,NA,,NA,,NA,,NA,,NA,,NA,,NA,,NA,,NA,,NA,,NA,,NA,,NA,,NA,,NA,,NA,,NA,,NA,,NA,,NA,,NA,,NA,,NA,,NA,,NA,,NA,,NA,,NA,,NA,,NA,,NA,,NA,,NA,,NA,,NA,,NA,,NA,,NA,,NA,,NA,,NA,,NA,,NA,,NA,,NA,,NA,,NA,,NA,,NA,,NA,,NA,,NA,,NA,,NA,,NA,,NA,,NA,,NA,,NA,,NA,,NA,,NA,
42024898,McQueen (1988),1988,['Parental engagement'],NA,PPVT (grp I vs III - adjusted means),,"The Peabody Picture Vocabulary Test (PPVT) provides an estimate of verbal intelligence through measuring receptive vocabulary. Since the subjects are not required to read, the PPVT is useful when working with nonreaders or marginal readers, as was the case in this study. ",,"['Toolkit primary outcome', 'Reading primary outcome']",,1.1959,,0.3557,,Literacy: reading other,,20,,51.41,,15.32,,18,,35.82,,9.09,,0.4986,,1.8931,,Primary outcome,,['Sample: All'],,With business as usual,,['Post-test adjusted for baseline attainment'],,['Test type: Standardised test '],,PPVT (grp I vs III - adjusted means),,"The Peabody Picture Vocabulary Test (PPVT) provides an estimate of verbal intelligence through measuring receptive vocabulary. Since the subjects are not required to read, the PPVT is useful when working with nonreaders or marginal readers, as was the case in this study. ",,"['Toolkit primary outcome', 'Reading primary outcome']",,1.1959,,0.3557,,Literacy: reading other,,20,,51.41,,15.32,,18,,35.82,,9.09,,0.4986,,1.8931,,Primary outcome,,['Sample: All'],,With business as usual,,['Post-test adjusted for baseline attainment'],,['Test type: Standardised test '],,NA,,NA,,NA,,NA,,NA,,NA,,NA,,NA,,NA,,NA,,NA,,NA,,NA,,NA,,NA,,NA,,NA,,NA,,NA,,NA,,NA,,NA,,NA,,NA,,NA,,NA,,NA,,NA,,NA,,NA,,NA,,NA,,NA,,NA,,NA,,NA,,NA,,NA,,NA,,NA,,NA,,NA,,NA,,NA,,NA,,NA,,NA,,NA,,NA,,NA,,NA,,NA,,NA,,NA,,NA,,NA,,NA,,NA,,NA,,NA,,NA,,NA,,NA,,NA,,NA,,NA,,NA,,NA,,NA,,NA,,NA,,NA,,NA,,NA,,NA,,NA,
74578021,Mears (2007) EY_PE,2007,NA,NA,NA,,NA,,NA,,NA,,NA,,NA,,NA,,NA,,NA,,NA,,NA,,NA,,NA,,NA,,NA,,NA,,NA,,NA,,NA,,NA,,NA,,NA,,NA,,NA,,NA,,NA,,NA,,NA,,NA,,NA,,NA,,NA,,NA,,NA,,NA,,NA,,NA,,NA,,NA,,NA,,NA,,NA,,NA,,NA,,NA,,NA,,NA,,NA,,NA,,NA,,NA,,NA,,NA,,NA,,NA,,NA,,NA,,NA,,NA,,NA,,NA,,NA,,NA,,NA,,NA,,NA,,NA,,NA,,NA,,NA,,NA,,NA,,NA,,NA,,NA,,NA,,NA,,NA,,NA,,NA,,NA,,NA,,NA,,NA,,NA,,NA,,NA,,NA,,NA,,NA,,NA,,NA,,NA,,NA,,NA,,NA,,NA,,NA,,NA,,NA,,NA,,NA,,NA,,NA,,NA,,NA,,NA,,NA,,NA,,NA,,NA,,NA,,NA,,NA,
42025519,Mehran (1988),1988,['Parental engagement'],NA,CTBS:  reading - Parental Engagm.,,(CTBS) Comprehensive Test of Basic Skills-Total reading - Parental Engagm.,,"['Toolkit primary outcome', 'Reading primary outcome']",,0.2451,,0.2683,,Literacy: reading comprehension,,28,,377.03,,66.7,,28,,361.05,,61.76,,-0.2808,,0.7711,,Primary outcome,,['Sample: Low achievers'],,With business as usual,,['Post-test unadjusted (select one from this group)'],,['Test type: Standardised test '],,CTBS:  reading - Parental Engagm.,,(CTBS) Comprehensive Test of Basic Skills-Total reading - Parental Engagm.,,"['Toolkit primary outcome', 'Reading primary outcome']",,0.2451,,0.2683,,Literacy: reading comprehension,,28,,377.03,,66.7,,28,,361.05,,61.76,,-0.2808,,0.7711,,Primary outcome,,['Sample: Low achievers'],,With business as usual,,['Post-test unadjusted (select one from this group)'],,['Test type: Standardised test '],,NA,,NA,,NA,,NA,,NA,,NA,,NA,,NA,,NA,,NA,,NA,,NA,,NA,,NA,,NA,,NA,,NA,,NA,,NA,,NA,,NA,,NA,,NA,,NA,,NA,,NA,,NA,,NA,,NA,,NA,,NA,,NA,,NA,,NA,,NA,,NA,,NA,,NA,,NA,,NA,,NA,,NA,,NA,,NA,,NA,,NA,,NA,,NA,,NA,,NA,,NA,,NA,,NA,,NA,,NA,,NA,,NA,,NA,,NA,,NA,,NA,,NA,,NA,,NA,,NA,,NA,,NA,,NA,,NA,,NA,,NA,,NA,,NA,,NA,,NA,,NA,
47269856,Nedler (1971) PE,1971,['Parental engagement'],NA,Peabody Picture Vocabulary Test -Spanish,,NA,,"['Toolkit primary outcome', 'Other outcome']",,0.1974,,0.3668,,Cognitive: reasoning,,NA,,NA,,NA,,NA,,NA,,NA,,-0.5215,,0.9163,,Primary outcome,,['Sample: All'],,With business as usual,,['Post-test adjusted for baseline attainment'],,['Test type: Standardised test '],,NA,,NA,,NA,,NA,,NA,,NA,,NA,,NA,,NA,,NA,,NA,,NA,,NA,,NA,,NA,,NA,,NA,,NA,,NA,,NA,,NA,,NA,,NA,,NA,,NA,,NA,,NA,,NA,,NA,,NA,,NA,,NA,,NA,,NA,,NA,,NA,,NA,,NA,,NA,,NA,,NA,,NA,,NA,,NA,,NA,,NA,,NA,,NA,,NA,,NA,,NA,,NA,,NA,,NA,,NA,,NA,,NA,,NA,,NA,,NA,,NA,,NA,,NA,,NA,,NA,,NA,,NA,,NA,,NA,,NA,,NA,,NA,,NA,,NA,,NA,,NA,,NA,,NA,,NA,,NA,,NA,,NA,,NA,,NA,,NA,,NA,,NA,,NA,,NA,,NA,,NA,,NA,,NA,,NA,,NA,
42025480,Niedermeyer (1970),1970,['Parental engagement'],NA,Postest Mean Percent Correct,,Postest Mean Percent Correct,,"['Toolkit primary outcome', 'Reading primary outcome']",,1.3724,,0.2192,,Literacy: reading other,,68,,41.47,,8.87,,41,,25,,15.75,,0.9427,,1.8021,,Primary outcome,,['Sample: Low achievers'],,With active control,,['Post-test unadjusted (select one from this group)'],,['Test type: Researcher developed test'],,Postest Mean Percent Correct,,Postest Mean Percent Correct,,"['Toolkit primary outcome', 'Reading primary outcome']",,1.3724,,0.2192,,Literacy: reading other,,68,,41.47,,8.87,,41,,25,,15.75,,0.9427,,1.8021,,Primary outcome,,['Sample: Low achievers'],,With active control,,['Post-test unadjusted (select one from this group)'],,['Test type: Researcher developed test'],,NA,,NA,,NA,,NA,,NA,,NA,,NA,,NA,,NA,,NA,,NA,,NA,,NA,,NA,,NA,,NA,,NA,,NA,,NA,,NA,,NA,,NA,,NA,,NA,,NA,,NA,,NA,,NA,,NA,,NA,,NA,,NA,,NA,,NA,,NA,,NA,,NA,,NA,,NA,,NA,,NA,,NA,,NA,,NA,,NA,,NA,,NA,,NA,,NA,,NA,,NA,,NA,,NA,,NA,,NA,,NA,,NA,,NA,,NA,,NA,,NA,,NA,,NA,,NA,,NA,,NA,,NA,,NA,,NA,,NA,,NA,,NA,,NA,,NA,,NA,,NA,
42024842,Phillips (1990),1990,['Parental engagement'],NA,"MET-2 (Home vs Control combined for collector, village and urban groups",,"The Metropolitan Reading Readiness Test (MET) measures auditory memory, letter recognition, and language and listening.",,"['Toolkit primary outcome', 'Reading primary outcome']",,0,,0.1557,,Literacy: reading comprehension,,83,,37.9,,13.2,,82,,37.9,,12.2,,-0.3052,,0.3052,,Primary outcome,,['Sample: All'],,With business as usual,,['Post-test unadjusted (select one from this group)'],,['Test type: Standardised test '],,"MET-2 (Home vs Control combined for collector, village and urban groups",,"The Metropolitan Reading Readiness Test (MET) measures auditory memory, letter recognition, and language and listening.",,"['Toolkit primary outcome', 'Reading primary outcome']",,0,,0.1557,,Literacy: reading comprehension,,83,,37.9,,13.2,,82,,37.9,,12.2,,-0.3052,,0.3052,,Primary outcome,,['Sample: All'],,With business as usual,,['Post-test unadjusted (select one from this group)'],,['Test type: Standardised test '],,NA,,NA,,NA,,NA,,NA,,NA,,NA,,NA,,NA,,NA,,NA,,NA,,NA,,NA,,NA,,NA,,NA,,NA,,NA,,NA,,NA,,NA,,NA,,NA,,NA,,NA,,NA,,NA,,NA,,NA,,NA,,NA,,NA,,NA,,NA,,NA,,NA,,NA,,NA,,NA,,NA,,NA,,NA,,NA,,NA,,NA,,NA,,NA,,NA,,NA,,NA,,NA,,NA,,NA,,NA,,NA,,NA,,NA,,NA,,NA,,NA,,NA,,NA,,NA,,NA,,NA,,NA,,NA,,NA,,NA,,NA,,NA,,NA,,NA,,NA,,NA,
45336777,Phillips (1990) PE,1990,['Parental engagement'],NA,MET-2 (Home vs Control posttest),,"The MET measures auditory memory, letter recognition, and language and listening  the Circus assesses recall and interpretation of oral language  and the ELC determines whether children have acquired such basic concepts about print as identifying the front of a book, giving meanings for words.",,"['Toolkit primary outcome', 'Reading primary outcome']",,0.0008,,0.1557,,Literacy: reading comprehension,,83,,37.91,,13.2,,82,,37.9,,12.25,,-0.3044,,0.306,,Primary outcome,,['Sample: All'],,With business as usual,,['Post-test unadjusted (select one from this group)'],,['Test type: Standardised test '],,MET-2 (Home vs Control posttest),,"The MET measures auditory memory, letter recognition, and language and listening  the Circus assesses recall and interpretation of oral language  and the ELC determines whether children have acquired such basic concepts about print as identifying the front of a book, giving meanings for words.",,"['Toolkit primary outcome', 'Reading primary outcome']",,0.0008,,0.1557,,Literacy: reading comprehension,,83,,37.91,,13.2,,82,,37.9,,12.25,,-0.3044,,0.306,,Primary outcome,,['Sample: All'],,With business as usual,,['Post-test unadjusted (select one from this group)'],,['Test type: Standardised test '],,NA,,NA,,NA,,NA,,NA,,NA,,NA,,NA,,NA,,NA,,NA,,NA,,NA,,NA,,NA,,NA,,NA,,NA,,NA,,NA,,NA,,NA,,NA,,NA,,NA,,NA,,NA,,NA,,NA,,NA,,NA,,NA,,NA,,NA,,NA,,NA,,NA,,NA,,NA,,NA,,NA,,NA,,NA,,NA,,NA,,NA,,NA,,NA,,NA,,NA,,NA,,NA,,NA,,NA,,NA,,NA,,NA,,NA,,NA,,NA,,NA,,NA,,NA,,NA,,NA,,NA,,NA,,NA,,NA,,NA,,NA,,NA,,NA,,NA,,NA,,NA,
42025508,Rolla (2006),2006,['Parental engagement'],NA,Reading,,Posttest Means and SD's ,,"['Toolkit primary outcome', 'Reading primary outcome']",,0.1542,,0.2273,,Literacy: reading other,,30,,7.3,,8.3,,55,,6.4,,3.8,,-0.2913,,0.5997,,Primary outcome,,NA,,With business as usual,,NA,,NA,,Reading,,Posttest Means and SD's ,,"['Toolkit primary outcome', 'Reading primary outcome']",,0.1542,,0.2273,,Literacy: reading other,,30,,7.3,,8.3,,55,,6.4,,3.8,,-0.2913,,0.5997,,Primary outcome,,NA,,With business as usual,,NA,,NA,,NA,,NA,,NA,,NA,,NA,,NA,,NA,,NA,,NA,,NA,,NA,,NA,,NA,,NA,,NA,,NA,,NA,,NA,,NA,,NA,,NA,,NA,,NA,,NA,,NA,,NA,,NA,,NA,,NA,,NA,,NA,,NA,,NA,,NA,,NA,,NA,,NA,,NA,,NA,,NA,,NA,,NA,,NA,,NA,,NA,,NA,,NA,,NA,,NA,,NA,,NA,,NA,,NA,,NA,,NA,,NA,,NA,,NA,,NA,,NA,,NA,,NA,,NA,,NA,,NA,,NA,,NA,,NA,,NA,,NA,,NA,,NA,,NA,,NA,,NA,,NA,
73032969,Rosemberg (2011),2011,['Parental engagement'],NA,Increase in receptive vocabulary: A vs B,,"Increase in receptive vocabulary  Increase in receptive vocabulary  Intensive *Group A) vs Group B (part of the control group, control B+C)",,"['Toolkit primary outcome', 'Reading primary outcome']",,0.1674,,0.1386,,Literacy: reading other,,NA,,NA,,NA,,NA,,NA,,NA,,-0.1043,,0.4391,,Secondary outcome(s),,['Sample: All'],,With business as usual,,['Pre-post gain'],,['Test type: Standardised test '],,Increase in receptive vocabulary: A vs B,,"Increase in receptive vocabulary  Increase in receptive vocabulary  Intensive *Group A) vs Group B (part of the control group, control B+C)",,"['Toolkit primary outcome', 'Reading primary outcome']",,0.1674,,0.1386,,Literacy: reading other,,NA,,NA,,NA,,NA,,NA,,NA,,-0.1043,,0.4391,,Secondary outcome(s),,['Sample: All'],,With business as usual,,['Pre-post gain'],,['Test type: Standardised test '],,NA,,NA,,NA,,NA,,NA,,NA,,NA,,NA,,NA,,NA,,NA,,NA,,NA,,NA,,NA,,NA,,NA,,NA,,NA,,NA,,NA,,NA,,NA,,NA,,NA,,NA,,NA,,NA,,NA,,NA,,NA,,NA,,NA,,NA,,NA,,NA,,NA,,NA,,NA,,NA,,NA,,NA,,NA,,NA,,NA,,NA,,NA,,NA,,NA,,NA,,NA,,NA,,NA,,NA,,NA,,NA,,NA,,NA,,NA,,NA,,NA,,NA,,NA,,NA,,NA,,NA,,NA,,NA,,NA,,NA,,NA,,NA,,NA,,NA,,NA,,NA,
42025511,Saracho (1997),1997,['Parental engagement'],NA,Early Reading Ability,,Posttest means and SD's,,"['Toolkit primary outcome', 'Reading primary outcome']",,0.4349,,0.2008,,Literacy: reading comprehension,,48,,31.79,,4.87,,54,,29.59,,5.15,,0.0414,,0.8285,,Primary outcome,,NA,,With business as usual,,NA,,NA,,Early Reading Ability,,Posttest means and SD's,,"['Toolkit primary outcome', 'Reading primary outcome']",,0.4349,,0.2008,,Literacy: reading comprehension,,48,,31.79,,4.87,,54,,29.59,,5.15,,0.0414,,0.8285,,Primary outcome,,NA,,With business as usual,,NA,,NA,,NA,,NA,,NA,,NA,,NA,,NA,,NA,,NA,,NA,,NA,,NA,,NA,,NA,,NA,,NA,,NA,,NA,,NA,,NA,,NA,,NA,,NA,,NA,,NA,,NA,,NA,,NA,,NA,,NA,,NA,,NA,,NA,,NA,,NA,,NA,,NA,,NA,,NA,,NA,,NA,,NA,,NA,,NA,,NA,,NA,,NA,,NA,,NA,,NA,,NA,,NA,,NA,,NA,,NA,,NA,,NA,,NA,,NA,,NA,,NA,,NA,,NA,,NA,,NA,,NA,,NA,,NA,,NA,,NA,,NA,,NA,,NA,,NA,,NA,,NA,,NA,
73032970,Schenke (2020),2020,['Parental engagement'],NA,Maths: MU + SV vs MU,,"Maths  MU + SV vs MU (post-test, researcher test adapted from other tests)",,"['Toolkit primary outcome', 'Mathematics primary outcome']",,0.2055,,0.2469,,Mathematics,,33,,13.09,,3.63,,33,,12.24,,4.5,,-0.2784,,0.6893,,Primary outcome,,['Sample: All'],,With business as usual,,['Post-test unadjusted (select one from this group)'],,['Test type: Researcher developed test'],,NA,,NA,,NA,,NA,,NA,,NA,,NA,,NA,,NA,,NA,,NA,,NA,,NA,,NA,,NA,,NA,,NA,,NA,,NA,,NA,,NA,,NA,,NA,,NA,,NA,,NA,,NA,,NA,,NA,,NA,,NA,,NA,,NA,,NA,,NA,,NA,,NA,,NA,,Maths: MU + SV vs MU,,"Maths  MU + SV vs MU (post-test, researcher test adapted from other tests)",,"['Toolkit primary outcome', 'Mathematics primary outcome']",,0.2055,,0.2469,,Mathematics,,33,,13.09,,3.63,,33,,12.24,,4.5,,-0.2784,,0.6893,,Primary outcome,,['Sample: All'],,With business as usual,,['Post-test unadjusted (select one from this group)'],,['Test type: Researcher developed test'],,NA,,NA,,NA,,NA,,NA,,NA,,NA,,NA,,NA,,NA,,NA,,NA,,NA,,NA,,NA,,NA,,NA,,NA,,NA,,NA,,NA,,NA,,NA,,NA,,NA,,NA,,NA,,NA,,NA,,NA,,NA,,NA,,NA,,NA,,NA,,NA,,NA,,NA,
73032971,Schneider (2018),2018,['Parental engagement'],NA, WPPSI-IV: home intervention vs control,,Composite score derived from the WPPSI-IV  home intervention vs control,,"['Toolkit primary outcome', 'Other outcome']",,0.2892,,0.1451,,Combined subjects,,95,,2.82,,0.8,,97,,0.57,,0.79,,0.0048,,0.5737,,Primary outcome,,['Sample: All'],,With business as usual,,['Pre-post gain'],,['Test type: Standardised test '],,NA,,NA,,NA,,NA,,NA,,NA,,NA,,NA,,NA,,NA,,NA,,NA,,NA,,NA,,NA,,NA,,NA,,NA,,NA,,NA,,NA,,NA,,NA,,NA,,NA,,NA,,NA,,NA,,NA,,NA,,NA,,NA,,NA,,NA,,NA,,NA,,NA,,NA,,NA,,NA,,NA,,NA,,NA,,NA,,NA,,NA,,NA,,NA,,NA,,NA,,NA,,NA,,NA,,NA,,NA,,NA,,NA,,NA,,NA,,NA,,NA,,NA,,NA,,NA,,NA,,NA,,NA,,NA,,NA,,NA,,NA,,NA,,NA,,NA,,NA,,NA,,NA,,NA,,NA,,NA,,NA,,NA,,NA,,NA,,NA,,NA,,NA,,NA,,NA,,NA,,NA,,NA,,NA,,NA,,NA,
42064891,Seward (2009),2009,['Parental engagement'],NA,PPVT-III,,Posttest means and SD's. parent workshop only vs low comparison,,"['Toolkit primary outcome', 'Reading primary outcome']",,0.2358,,0.2642,,Literacy: decoding/phonics,,27,,102.32,,14.09,,31,,99.29,,11.31,,-0.2821,,0.7537,,Primary outcome,,NA,,With business as usual,,NA,,NA,,PPVT-III,,Posttest means and SD's. parent workshop only vs low comparison,,"['Toolkit primary outcome', 'Reading primary outcome']",,0.2358,,0.2642,,Literacy: decoding/phonics,,27,,102.32,,14.09,,31,,99.29,,11.31,,-0.2821,,0.7537,,Primary outcome,,NA,,With business as usual,,NA,,NA,,NA,,NA,,NA,,NA,,NA,,NA,,NA,,NA,,NA,,NA,,NA,,NA,,NA,,NA,,NA,,NA,,NA,,NA,,NA,,NA,,NA,,NA,,NA,,NA,,NA,,NA,,NA,,NA,,NA,,NA,,NA,,NA,,NA,,NA,,NA,,NA,,NA,,NA,,NA,,NA,,NA,,NA,,NA,,NA,,NA,,NA,,NA,,NA,,NA,,NA,,NA,,NA,,NA,,NA,,NA,,NA,,NA,,NA,,NA,,NA,,NA,,NA,,NA,,NA,,NA,,NA,,NA,,NA,,NA,,NA,,NA,,NA,,NA,,NA,,NA,,NA,
55203359,Sheridan (2011),2011,NA,NA,TROLL Reading: parental training vs control,,The Teacher Rating of Oral Language and Literacy (TROLL)   parental training vs control,,"['Toolkit primary outcome', 'Reading primary outcome']",,0.4305,,0.1377,,Literacy: reading other,,116,,3,,0.53,,101,,2.79,,0.43,,0.1607,,0.7004,,Primary outcome,,['Sample: All'],,With business as usual,,['Post-test unadjusted (select one from this group)'],,['Test type: Standardised test '],,TROLL Reading: parental training vs control,,The Teacher Rating of Oral Language and Literacy (TROLL)   parental training vs control,,"['Toolkit primary outcome', 'Reading primary outcome']",,0.4305,,0.1377,,Literacy: reading other,,116,,3,,0.53,,101,,2.79,,0.43,,0.1607,,0.7004,,Primary outcome,,['Sample: All'],,With business as usual,,['Post-test unadjusted (select one from this group)'],,['Test type: Standardised test '],,NA,,NA,,NA,,NA,,NA,,NA,,NA,,NA,,NA,,NA,,NA,,NA,,NA,,NA,,NA,,NA,,NA,,NA,,NA,,NA,,NA,,NA,,NA,,NA,,NA,,NA,,NA,,NA,,NA,,NA,,NA,,NA,,NA,,NA,,NA,,NA,,NA,,NA,,NA,,NA,,NA,,NA,,NA,,NA,,NA,,NA,,NA,,NA,,NA,,NA,,NA,,NA,,NA,,NA,,NA,,NA,,NA,,NA,,NA,,NA,,NA,,NA,,NA,,NA,,NA,,NA,,NA,,NA,,NA,,NA,,NA,,NA,,NA,,NA,,NA,,NA,
73032973,Sim (2014),2014,['Parental engagement'],NA,PPVT-IIIA/B: DR plus DR+PR vs control,,PPVT-IIIA/B  DR plus DR+PR vs control,,"['Toolkit primary outcome', 'Reading primary outcome']",,0.5283,,0.2528,,Literacy: reading other,,54,,81.741,,15.002,,23,,73.04,,19.08,,0.0328,,1.0238,,Primary outcome,,['Sample: All'],,With active control,,['Post-test unadjusted (select one from this group)'],,['Test type: Standardised test '],,PPVT-IIIA/B: DR plus DR+PR vs control,,PPVT-IIIA/B  DR plus DR+PR vs control,,"['Toolkit primary outcome', 'Reading primary outcome']",,0.5283,,0.2528,,Literacy: reading other,,54,,81.741,,15.002,,23,,73.04,,19.08,,0.0328,,1.0238,,Primary outcome,,['Sample: All'],,With active control,,['Post-test unadjusted (select one from this group)'],,['Test type: Standardised test '],,NA,,NA,,NA,,NA,,NA,,NA,,NA,,NA,,NA,,NA,,NA,,NA,,NA,,NA,,NA,,NA,,NA,,NA,,NA,,NA,,NA,,NA,,NA,,NA,,NA,,NA,,NA,,NA,,NA,,NA,,NA,,NA,,NA,,NA,,NA,,NA,,NA,,NA,,NA,,NA,,NA,,NA,,NA,,NA,,NA,,NA,,NA,,NA,,NA,,NA,,NA,,NA,,NA,,NA,,NA,,NA,,NA,,NA,,NA,,NA,,NA,,NA,,NA,,NA,,NA,,NA,,NA,,NA,,NA,,NA,,NA,,NA,,NA,,NA,,NA,,NA,
42059779,St Pierre (1995),1995,['Parental engagement'],NA,NA,,NA,,NA,,NA,,NA,,NA,,NA,,NA,,NA,,NA,,NA,,NA,,NA,,NA,,NA,,NA,,NA,,NA,,NA,,NA,,NA,,NA,,NA,,NA,,NA,,NA,,NA,,NA,,NA,,NA,,NA,,NA,,NA,,NA,,NA,,NA,,NA,,NA,,NA,,NA,,NA,,NA,,NA,,NA,,NA,,NA,,NA,,NA,,NA,,NA,,NA,,NA,,NA,,NA,,NA,,NA,,NA,,NA,,NA,,NA,,NA,,NA,,NA,,NA,,NA,,NA,,NA,,NA,,NA,,NA,,NA,,NA,,NA,,NA,,NA,,NA,,NA,,NA,,NA,,NA,,NA,,NA,,NA,,NA,,NA,,NA,,NA,,NA,,NA,,NA,,NA,,NA,,NA,,NA,,NA,,NA,,NA,,NA,,NA,,NA,,NA,,NA,,NA,,NA,,NA,,NA,,NA,,NA,,NA,,NA,,NA,,NA,,NA,,NA,
42059780,St Pierre (2005),2005,['Parental engagement'],NA,PPVT,,Posttest means and SD's for whole test,,"['Toolkit primary outcome', 'Reading primary outcome']",,0.0265,,0.1818,,Literacy: reading comprehension,,97,,77.21,,16.83,,44,,76.77,,15.88,,-0.3298,,0.3827,,Primary outcome,,NA,,With business as usual,,NA,,NA,,PPVT,,Posttest means and SD's for whole test,,"['Toolkit primary outcome', 'Reading primary outcome']",,0.0265,,0.1818,,Literacy: reading comprehension,,97,,77.21,,16.83,,44,,76.77,,15.88,,-0.3298,,0.3827,,Primary outcome,,NA,,With business as usual,,NA,,NA,,NA,,NA,,NA,,NA,,NA,,NA,,NA,,NA,,NA,,NA,,NA,,NA,,NA,,NA,,NA,,NA,,NA,,NA,,NA,,NA,,NA,,NA,,NA,,NA,,NA,,NA,,NA,,NA,,NA,,NA,,NA,,NA,,NA,,NA,,NA,,NA,,NA,,NA,,NA,,NA,,NA,,NA,,NA,,NA,,NA,,NA,,NA,,NA,,NA,,NA,,NA,,NA,,NA,,NA,,NA,,NA,,NA,,NA,,NA,,NA,,NA,,NA,,NA,,NA,,NA,,NA,,NA,,NA,,NA,,NA,,NA,,NA,,NA,,NA,,NA,,NA,
74578041,Starkey (2000) PE 1_2,2000,['Parental engagement'],NA,NA,,NA,,NA,,NA,,NA,,NA,,NA,,NA,,NA,,NA,,NA,,NA,,NA,,NA,,NA,,NA,,NA,,NA,,NA,,NA,,NA,,NA,,NA,,NA,,NA,,NA,,NA,,NA,,NA,,NA,,NA,,NA,,NA,,NA,,NA,,NA,,NA,,NA,,NA,,NA,,NA,,NA,,NA,,NA,,NA,,NA,,NA,,NA,,NA,,NA,,NA,,NA,,NA,,NA,,NA,,NA,,NA,,NA,,NA,,NA,,NA,,NA,,NA,,NA,,NA,,NA,,NA,,NA,,NA,,NA,,NA,,NA,,NA,,NA,,NA,,NA,,NA,,NA,,NA,,NA,,NA,,NA,,NA,,NA,,NA,,NA,,NA,,NA,,NA,,NA,,NA,,NA,,NA,,NA,,NA,,NA,,NA,,NA,,NA,,NA,,NA,,NA,,NA,,NA,,NA,,NA,,NA,,NA,,NA,,NA,,NA,,NA,,NA,,NA,
73032974,Strouse (2013),2013,['Parental engagement'],NA,EOW-PVT: DQ+DA vs control,,EOW-PVT (Expressive One-Word Picture Vocabulary Test)  DQ+DA (Dialogic questioning + Directed attention) vs control,,"['Toolkit primary outcome', 'Reading primary outcome']",,0.1367,,0.2778,,Literacy: reading comprehension,,41,,112.124,,13,,19,,110.15,,16.71,,-0.4079,,0.6812,,Primary outcome,,['Sample: All'],,With business as usual,,['Post-test unadjusted (select one from this group)'],,['Test type: Standardised test '],,EOW-PVT: DQ+DA vs control,,EOW-PVT (Expressive One-Word Picture Vocabulary Test)  DQ+DA (Dialogic questioning + Directed attention) vs control,,"['Toolkit primary outcome', 'Reading primary outcome']",,0.1367,,0.2778,,Literacy: reading comprehension,,41,,112.124,,13,,19,,110.15,,16.71,,-0.4079,,0.6812,,Primary outcome,,['Sample: All'],,With business as usual,,['Post-test unadjusted (select one from this group)'],,['Test type: Standardised test '],,NA,,NA,,NA,,NA,,NA,,NA,,NA,,NA,,NA,,NA,,NA,,NA,,NA,,NA,,NA,,NA,,NA,,NA,,NA,,NA,,NA,,NA,,NA,,NA,,NA,,NA,,NA,,NA,,NA,,NA,,NA,,NA,,NA,,NA,,NA,,NA,,NA,,NA,,NA,,NA,,NA,,NA,,NA,,NA,,NA,,NA,,NA,,NA,,NA,,NA,,NA,,NA,,NA,,NA,,NA,,NA,,NA,,NA,,NA,,NA,,NA,,NA,,NA,,NA,,NA,,NA,,NA,,NA,,NA,,NA,,NA,,NA,,NA,,NA,,NA,,NA,
42024834,Swinson (1985),1985,['Parental engagement'],NA,English Picture Vocabulary Test,,Posttest t-value for exp. vs control,,"['Toolkit primary outcome', 'Reading primary outcome']",,0.8423,,0.4208,,Literacy: reading comprehension,,13,,2.104,,0,,12,,0,,0,,0.0174,,1.6671,,Primary outcome,,['Sample: All'],,With business as usual,,['Post-test unadjusted (select one from this group)'],,['Test type: Standardised test '],,English Picture Vocabulary Test,,Posttest t-value for exp. vs control,,"['Toolkit primary outcome', 'Reading primary outcome']",,0.8423,,0.4208,,Literacy: reading comprehension,,13,,2.104,,0,,12,,0,,0,,0.0174,,1.6671,,Primary outcome,,['Sample: All'],,With business as usual,,['Post-test unadjusted (select one from this group)'],,['Test type: Standardised test '],,NA,,NA,,NA,,NA,,NA,,NA,,NA,,NA,,NA,,NA,,NA,,NA,,NA,,NA,,NA,,NA,,NA,,NA,,NA,,NA,,NA,,NA,,NA,,NA,,NA,,NA,,NA,,NA,,NA,,NA,,NA,,NA,,NA,,NA,,NA,,NA,,NA,,NA,,NA,,NA,,NA,,NA,,NA,,NA,,NA,,NA,,NA,,NA,,NA,,NA,,NA,,NA,,NA,,NA,,NA,,NA,,NA,,NA,,NA,,NA,,NA,,NA,,NA,,NA,,NA,,NA,,NA,,NA,,NA,,NA,,NA,,NA,,NA,,NA,,NA,,NA,
42025497,Sylva (2008),2008,['Parental engagement'],NA,BAS word reading - Parental Engagement,,Post-test unadjusted mean score. The test was a subscale of the  British Ability Scales II which measured the child’s ability to read single words,,"['Toolkit primary outcome', 'Reading primary outcome']",,0.2978,,0.201,,Literacy: reading other,,58,,24.62,,18.17,,44,,19.14,,18.38,,-0.0962,,0.6919,,Primary outcome,,['Sample: Low achievers'],,With business as usual,,['Post-test unadjusted (select one from this group)'],,['Test type: Standardised test '],,BAS word reading - Parental Engagement,,Post-test unadjusted mean score. The test was a subscale of the  British Ability Scales II which measured the child’s ability to read single words,,"['Toolkit primary outcome', 'Reading primary outcome']",,0.2978,,0.201,,Literacy: reading other,,58,,24.62,,18.17,,44,,19.14,,18.38,,-0.0962,,0.6919,,Primary outcome,,['Sample: Low achievers'],,With business as usual,,['Post-test unadjusted (select one from this group)'],,['Test type: Standardised test '],,NA,,NA,,NA,,NA,,NA,,NA,,NA,,NA,,NA,,NA,,NA,,NA,,NA,,NA,,NA,,NA,,NA,,NA,,NA,,NA,,NA,,NA,,NA,,NA,,NA,,NA,,NA,,NA,,NA,,NA,,NA,,NA,,NA,,NA,,NA,,NA,,NA,,NA,,NA,,NA,,NA,,NA,,NA,,NA,,NA,,NA,,NA,,NA,,NA,,NA,,NA,,NA,,NA,,NA,,NA,,NA,,NA,,NA,,NA,,NA,,NA,,NA,,NA,,NA,,NA,,NA,,NA,,NA,,NA,,NA,,NA,,NA,,NA,,NA,,NA,,NA,
73032975,Teepe (2019) 1_1,2019,['Parental engagement'],NA,PPVT (receptive voc): AL vs control,,Dutch version of the Peabody Picture Vocabulary Test (PPVT-III-N  active learning during parent group meetings (AL) vs control ,,"['Toolkit primary outcome', 'Reading primary outcome']",,0.3448,,0.1849,,Literacy: reading comprehension,,54,,16.57,,4.41,,66,,14.94,,4.92,,-0.0176,,0.7071,,Primary outcome,,['Sample: All'],,With business as usual,,['Post-test unadjusted (select one from this group)'],,['Test type: Standardised test '],,PPVT (receptive voc): AL vs control,,Dutch version of the Peabody Picture Vocabulary Test (PPVT-III-N  active learning during parent group meetings (AL) vs control ,,"['Toolkit primary outcome', 'Reading primary outcome']",,0.3448,,0.1849,,Literacy: reading comprehension,,54,,16.57,,4.41,,66,,14.94,,4.92,,-0.0176,,0.7071,,Primary outcome,,['Sample: All'],,With business as usual,,['Post-test unadjusted (select one from this group)'],,['Test type: Standardised test '],,NA,,NA,,NA,,NA,,NA,,NA,,NA,,NA,,NA,,NA,,NA,,NA,,NA,,NA,,NA,,NA,,NA,,NA,,NA,,NA,,NA,,NA,,NA,,NA,,NA,,NA,,NA,,NA,,NA,,NA,,NA,,NA,,NA,,NA,,NA,,NA,,NA,,NA,,NA,,NA,,NA,,NA,,NA,,NA,,NA,,NA,,NA,,NA,,NA,,NA,,NA,,NA,,NA,,NA,,NA,,NA,,NA,,NA,,NA,,NA,,NA,,NA,,NA,,NA,,NA,,NA,,NA,,NA,,NA,,NA,,NA,,NA,,NA,,NA,,NA,,NA,
