73032976,Teepe (2019) 1_2,2019,['Parental engagement'],NA,PPVT: TL vs control,,Dutch version of the Peabody Picture Vocabulary Test (PPVT-III-N  technology-enhanced learning (TL) vs control,,"['Toolkit primary outcome', 'Reading primary outcome']",,-0.0541,,0.1897,,Literacy: reading comprehension,,48,,14.67,,5,,66,,14.94,,4.92,,-0.426,,0.3177,,Primary outcome,,['Sample: All'],,With business as usual,,['Post-test unadjusted (select one from this group)'],,['Test type: Standardised test '],,PPVT: TL vs control,,Dutch version of the Peabody Picture Vocabulary Test (PPVT-III-N  technology-enhanced learning (TL) vs control,,"['Toolkit primary outcome', 'Reading primary outcome']",,-0.0541,,0.1897,,Literacy: reading comprehension,,48,,14.67,,5,,66,,14.94,,4.92,,-0.426,,0.3177,,Primary outcome,,['Sample: All'],,With business as usual,,['Post-test unadjusted (select one from this group)'],,['Test type: Standardised test '],,NA,,NA,,NA,,NA,,NA,,NA,,NA,,NA,,NA,,NA,,NA,,NA,,NA,,NA,,NA,,NA,,NA,,NA,,NA,,NA,,NA,,NA,,NA,,NA,,NA,,NA,,NA,,NA,,NA,,NA,,NA,,NA,,NA,,NA,,NA,,NA,,NA,,NA,,NA,,NA,,NA,,NA,,NA,,NA,,NA,,NA,,NA,,NA,,NA,,NA,,NA,,NA,,NA,,NA,,NA,,NA,,NA,,NA,,NA,,NA,,NA,,NA,,NA,,NA,,NA,,NA,,NA,,NA,,NA,,NA,,NA,,NA,,NA,,NA,,NA,,NA,
73032977,Ulutaş (2018),2018,['Parental engagement'],NA,Basic Process Skills Scale,,Basic Process Skills Scale  total score. Parent-Child Science Education Program vs control,,"['Toolkit primary outcome', 'Other outcome']",,0.1102,,0.2584,,Cognitive: other,,30,,5.85,,0.01,,30,,5.82,,0.38,,-0.3963,,0.6166,,Primary outcome,,['Sample: All'],,With business as usual,,['Post-test unadjusted (select one from this group)'],,['Test type: Researcher developed test'],,NA,,NA,,NA,,NA,,NA,,NA,,NA,,NA,,NA,,NA,,NA,,NA,,NA,,NA,,NA,,NA,,NA,,NA,,NA,,NA,,NA,,NA,,NA,,NA,,NA,,NA,,NA,,NA,,NA,,NA,,NA,,NA,,NA,,NA,,NA,,NA,,NA,,NA,,NA,,NA,,NA,,NA,,NA,,NA,,NA,,NA,,NA,,NA,,NA,,NA,,NA,,NA,,NA,,NA,,NA,,NA,,NA,,NA,,NA,,NA,,NA,,NA,,NA,,NA,,NA,,NA,,NA,,NA,,NA,,NA,,NA,,NA,,NA,,NA,,NA,,NA,,NA,,NA,,NA,,NA,,NA,,NA,,NA,,NA,,NA,,NA,,NA,,NA,,NA,,NA,,NA,,NA,,NA,,NA,,NA,
73032978,Vahidi (2017),2017,['Parental engagement'],NA,WPPSI-R: parent training vs control,,children’s cognitive performance - Wechsler Preschool and Primary Scale of Intelligence (WPPSI-R)  parent training vs control,,"['Toolkit primary outcome', 'Other outcome']",,0.7294,,0.3873,,Cognitive: other,,16,,41.06,,6.05,,13,,34.92,,10.24,,-0.0298,,1.4886,,Primary outcome,,['Sample: All'],,With business as usual,,['Post-test unadjusted (select one from this group)'],,['Test type: Standardised test '],,NA,,NA,,NA,,NA,,NA,,NA,,NA,,NA,,NA,,NA,,NA,,NA,,NA,,NA,,NA,,NA,,NA,,NA,,NA,,NA,,NA,,NA,,NA,,NA,,NA,,NA,,NA,,NA,,NA,,NA,,NA,,NA,,NA,,NA,,NA,,NA,,NA,,NA,,NA,,NA,,NA,,NA,,NA,,NA,,NA,,NA,,NA,,NA,,NA,,NA,,NA,,NA,,NA,,NA,,NA,,NA,,NA,,NA,,NA,,NA,,NA,,NA,,NA,,NA,,NA,,NA,,NA,,NA,,NA,,NA,,NA,,NA,,NA,,NA,,NA,,NA,,NA,,NA,,NA,,NA,,NA,,NA,,NA,,NA,,NA,,NA,,NA,,NA,,NA,,NA,,NA,,NA,,NA,,NA,,NA,
42025513,van Tuijl (2001) 1_1,2001,['Parental engagement'],NA,Active Vocabulary,,Posttest adjusted means and SD's for active vocabulary in home language,,"['Toolkit primary outcome', 'Other outcome']",,0.1877,,0.1589,,Languages,,122,,24.4,,5.9,,59,,23.3,,5.7,,-0.1237,,0.4991,,Primary outcome,,NA,,With business as usual,,NA,,NA,,NA,,NA,,NA,,NA,,NA,,NA,,NA,,NA,,NA,,NA,,NA,,NA,,NA,,NA,,NA,,NA,,NA,,NA,,NA,,NA,,NA,,NA,,NA,,NA,,NA,,NA,,NA,,NA,,NA,,NA,,NA,,NA,,NA,,NA,,NA,,NA,,NA,,NA,,NA,,NA,,NA,,NA,,NA,,NA,,NA,,NA,,NA,,NA,,NA,,NA,,NA,,NA,,NA,,NA,,NA,,NA,,NA,,NA,,NA,,NA,,NA,,NA,,NA,,NA,,NA,,NA,,NA,,NA,,NA,,NA,,NA,,NA,,NA,,NA,,NA,,NA,,NA,,NA,,NA,,NA,,NA,,NA,,NA,,NA,,NA,,NA,,NA,,NA,,NA,,NA,,NA,,NA,,NA,,NA,,NA,
46325712,van Tuijl (2001) 1_2,2001,['Parental engagement'],NA,RAKIT,,Revised Amsterdam Child Intelligence Test,,"['Toolkit primary outcome', 'Other outcome']",,0.3064,,0.3439,,Cognitive: reasoning,,25,,77,,13,,13,,72.9,,13.3,,-0.3677,,0.9805,,Primary outcome,,NA,,With business as usual,,NA,,NA,,NA,,NA,,NA,,NA,,NA,,NA,,NA,,NA,,NA,,NA,,NA,,NA,,NA,,NA,,NA,,NA,,NA,,NA,,NA,,NA,,NA,,NA,,NA,,NA,,NA,,NA,,NA,,NA,,NA,,NA,,NA,,NA,,NA,,NA,,NA,,NA,,NA,,NA,,NA,,NA,,NA,,NA,,NA,,NA,,NA,,NA,,NA,,NA,,NA,,NA,,NA,,NA,,NA,,NA,,NA,,NA,,NA,,NA,,NA,,NA,,NA,,NA,,NA,,NA,,NA,,NA,,NA,,NA,,NA,,NA,,NA,,NA,,NA,,NA,,NA,,NA,,NA,,NA,,NA,,NA,,NA,,NA,,NA,,NA,,NA,,NA,,NA,,NA,,NA,,NA,,NA,,NA,,NA,,NA,,NA,
42059834,Waksman (1979),1979,['Parental engagement'],NA,MRT (Total - ANOVA),,"The Metropolitan Readiness Test, which measures the extent to which school beginners have developed several skills and abilities which signal readi- ness for first-grade instruction  the test consists of six subtests  Word, Listen- ing, Matching, Alphabet, Numbers, and Copying.",,"['Toolkit primary outcome', 'Reading primary outcome']",,1.22,,0.31,,Literacy: reading comprehension,,NA,,NA,,NA,,NA,,NA,,NA,,0.6124,,1.8276,,Primary outcome,,['Sample: All'],,With business as usual,,['Post-test adjusted for baseline attainment'],,['Test type: Standardised test '],,MRT (Total - ANOVA),,"The Metropolitan Readiness Test, which measures the extent to which school beginners have developed several skills and abilities which signal readi- ness for first-grade instruction  the test consists of six subtests  Word, Listen- ing, Matching, Alphabet, Numbers, and Copying.",,"['Toolkit primary outcome', 'Reading primary outcome']",,1.22,,0.31,,Literacy: reading comprehension,,NA,,NA,,NA,,NA,,NA,,NA,,0.6124,,1.8276,,Primary outcome,,['Sample: All'],,With business as usual,,['Post-test adjusted for baseline attainment'],,['Test type: Standardised test '],,NA,,NA,,NA,,NA,,NA,,NA,,NA,,NA,,NA,,NA,,NA,,NA,,NA,,NA,,NA,,NA,,NA,,NA,,NA,,NA,,NA,,NA,,NA,,NA,,NA,,NA,,NA,,NA,,NA,,NA,,NA,,NA,,NA,,NA,,NA,,NA,,NA,,NA,,NA,,NA,,NA,,NA,,NA,,NA,,NA,,NA,,NA,,NA,,NA,,NA,,NA,,NA,,NA,,NA,,NA,,NA,,NA,,NA,,NA,,NA,,NA,,NA,,NA,,NA,,NA,,NA,,NA,,NA,,NA,,NA,,NA,,NA,,NA,,NA,,NA,,NA,
42059784,Weisberg (1974),1974,['Parental engagement'],NA,T test WRAT Speed Copy tick marks Head Start v control,,T test Wide Range Achievement Test Speed Copy tick marks Head Start v control,,"['Toolkit primary outcome', 'Other outcome']",,0.3183,,0.0968,,Cognitive: other,,2980,,4.26,,0,,111,,0.001,,0,,0.1287,,0.5079,,Primary outcome,,['Sample: All'],,With business as usual,,['Post-test unadjusted (select one from this group)'],,['Test type: Standardised test '],,NA,,NA,,NA,,NA,,NA,,NA,,NA,,NA,,NA,,NA,,NA,,NA,,NA,,NA,,NA,,NA,,NA,,NA,,NA,,NA,,NA,,NA,,NA,,NA,,NA,,NA,,NA,,NA,,NA,,NA,,NA,,NA,,NA,,NA,,NA,,NA,,NA,,NA,,NA,,NA,,NA,,NA,,NA,,NA,,NA,,NA,,NA,,NA,,NA,,NA,,NA,,NA,,NA,,NA,,NA,,NA,,NA,,NA,,NA,,NA,,NA,,NA,,NA,,NA,,NA,,NA,,NA,,NA,,NA,,NA,,NA,,NA,,NA,,NA,,NA,,NA,,NA,,NA,,NA,,NA,,NA,,NA,,NA,,NA,,NA,,NA,,NA,,NA,,NA,,NA,,NA,,NA,,NA,,NA,,NA,
42024940,Whitehurst (1994),1994,['Parental engagement'],NA,Writing Factor,,"writing (e.g., the ability to print one's first name). DSC (Developing Skills Checklist) - The DSC objectives are ar- ranged into 4 subscales labeled Memory , Auditory , Print Concepts and Writing (demonstrating left-to-right progression, printing first name, drawing a person, message-writing mechanics, message- writing quality). For each of the 18 objectives used in the present study, the DSC consists of multiple questions that are administered to children individually in the typical style of a standardized test of language or intelligence.",,"['Toolkit primary outcome', 'Writing and spelling primary outcome.']",,0.4407,,-0.0271,,Literacy: writing,,NA,,NA,,NA,,NA,,NA,,NA,,0.4939,,0.3875,,Primary outcome,,['Sample: Low achievers'],,With business as usual,,['Post-test adjusted for baseline attainment'],,['Test type: Standardised test '],,NA,,NA,,NA,,NA,,NA,,NA,,NA,,NA,,NA,,NA,,NA,,NA,,NA,,NA,,NA,,NA,,NA,,NA,,NA,,NA,,NA,,NA,,NA,,NA,,NA,,NA,,NA,,NA,,NA,,NA,,NA,,NA,,NA,,NA,,NA,,NA,,NA,,NA,,NA,,NA,,NA,,NA,,NA,,NA,,NA,,NA,,NA,,NA,,NA,,NA,,NA,,NA,,NA,,NA,,NA,,NA,,NA,,NA,,NA,,NA,,NA,,NA,,NA,,NA,,NA,,NA,,NA,,NA,,NA,,NA,,NA,,NA,,NA,,NA,,NA,,NA,,NA,,NA,,NA,,NA,,NA,,NA,,NA,,NA,,NA,,NA,,NA,,NA,,NA,,NA,,NA,,NA,,NA,,NA,,NA,
42025515,Whitehurst (1994),1994,['Parental engagement'],NA,Peabody Picture Viocabulary Test,,Posttest means and SD's for School+Home vs School ,,"['Toolkit primary outcome', 'Reading primary outcome']",,0.1262,,0.2977,,Literacy: reading comprehension,,20,,87.53,,16.72,,26,,85.73,,11.54,,-0.4573,,0.7098,,Primary outcome,,['Sample: All'],,With active control,,['Post-test unadjusted (select one from this group)'],,['Test type: Standardised test '],,Peabody Picture Viocabulary Test,,Posttest means and SD's for School+Home vs School ,,"['Toolkit primary outcome', 'Reading primary outcome']",,0.1262,,0.2977,,Literacy: reading comprehension,,20,,87.53,,16.72,,26,,85.73,,11.54,,-0.4573,,0.7098,,Primary outcome,,['Sample: All'],,With active control,,['Post-test unadjusted (select one from this group)'],,['Test type: Standardised test '],,NA,,NA,,NA,,NA,,NA,,NA,,NA,,NA,,NA,,NA,,NA,,NA,,NA,,NA,,NA,,NA,,NA,,NA,,NA,,NA,,NA,,NA,,NA,,NA,,NA,,NA,,NA,,NA,,NA,,NA,,NA,,NA,,NA,,NA,,NA,,NA,,NA,,NA,,NA,,NA,,NA,,NA,,NA,,NA,,NA,,NA,,NA,,NA,,NA,,NA,,NA,,NA,,NA,,NA,,NA,,NA,,NA,,NA,,NA,,NA,,NA,,NA,,NA,,NA,,NA,,NA,,NA,,NA,,NA,,NA,,NA,,NA,,NA,,NA,,NA,,NA,
45336798,Whitehurst (1994) PE,1994,['Parental engagement'],NA,Peabody Picture Vocabulary Test,,Posttest means and SD's for School+Home vs Control,,"['Toolkit primary outcome', 'Reading primary outcome']",,0.2328,,0.3039,,Literacy: reading comprehension,,20,,87.53,,16.72,,24,,83.68,,15.83,,-0.3628,,0.8284,,Primary outcome,,['Sample: All'],,With business as usual,,['Post-test unadjusted (select one from this group)'],,['Test type: Standardised test '],,Peabody Picture Vocabulary Test,,Posttest means and SD's for School+Home vs Control,,"['Toolkit primary outcome', 'Reading primary outcome']",,0.2328,,0.3039,,Literacy: reading comprehension,,20,,87.53,,16.72,,24,,83.68,,15.83,,-0.3628,,0.8284,,Primary outcome,,['Sample: All'],,With business as usual,,['Post-test unadjusted (select one from this group)'],,['Test type: Standardised test '],,NA,,NA,,NA,,NA,,NA,,NA,,NA,,NA,,NA,,NA,,NA,,NA,,NA,,NA,,NA,,NA,,NA,,NA,,NA,,NA,,NA,,NA,,NA,,NA,,NA,,NA,,NA,,NA,,NA,,NA,,NA,,NA,,NA,,NA,,NA,,NA,,NA,,NA,,NA,,NA,,NA,,NA,,NA,,NA,,NA,,NA,,NA,,NA,,NA,,NA,,NA,,NA,,NA,,NA,,NA,,NA,,NA,,NA,,NA,,NA,,NA,,NA,,NA,,NA,,NA,,NA,,NA,,NA,,NA,,NA,,NA,,NA,,NA,,NA,,NA,,NA,
42025425,Whitehurst (1999),1999,['Parental engagement'],NA,One word - Language,,Language age scores from One Word were used instead of age-corrected language quotients in the multivariate analysis to maintain scale equivalence with the raw score DSC dependent variables (the DSC does not generate a performance quotient).,,"['Toolkit primary outcome', 'Reading primary outcome']",,0.1001,,0.0619,,Literacy: reading other,,NA,,NA,,NA,,NA,,NA,,NA,,-0.0213,,0.2215,,Primary outcome,,['Sample: Low achievers'],,With business as usual,,['Post-test adjusted for baseline attainment'],,['Test type: Standardised test '],,One word - Language,,Language age scores from One Word were used instead of age-corrected language quotients in the multivariate analysis to maintain scale equivalence with the raw score DSC dependent variables (the DSC does not generate a performance quotient).,,"['Toolkit primary outcome', 'Reading primary outcome']",,0.1001,,0.0619,,Literacy: reading other,,NA,,NA,,NA,,NA,,NA,,NA,,-0.0213,,0.2215,,Primary outcome,,['Sample: Low achievers'],,With business as usual,,['Post-test adjusted for baseline attainment'],,['Test type: Standardised test '],,NA,,NA,,NA,,NA,,NA,,NA,,NA,,NA,,NA,,NA,,NA,,NA,,NA,,NA,,NA,,NA,,NA,,NA,,NA,,NA,,NA,,NA,,NA,,NA,,NA,,NA,,NA,,NA,,NA,,NA,,NA,,NA,,NA,,NA,,NA,,NA,,NA,,NA,,NA,,NA,,NA,,NA,,NA,,NA,,NA,,NA,,NA,,NA,,NA,,NA,,NA,,NA,,NA,,NA,,NA,,NA,,NA,,NA,,NA,,NA,,NA,,NA,,NA,,NA,,NA,,NA,,NA,,NA,,NA,,NA,,NA,,NA,,NA,,NA,,NA,,NA,
42025173,Woods (1974),1974,['Parental engagement'],NA,Murphy-Durrell Letter Names,,Posttest means and SD's ,,"['Toolkit primary outcome', 'Reading primary outcome']",,0.8028,,0.2374,,Literacy: reading comprehension,,39,,50.03,,1.44,,38,,46.08,,6.78,,0.3374,,1.2681,,Primary outcome,,['Sample: All'],,With business as usual,,['Post-test unadjusted (select one from this group)'],,['Test type: Standardised test '],,Murphy-Durrell Letter Names,,Posttest means and SD's ,,"['Toolkit primary outcome', 'Reading primary outcome']",,0.8028,,0.2374,,Literacy: reading comprehension,,39,,50.03,,1.44,,38,,46.08,,6.78,,0.3374,,1.2681,,Primary outcome,,['Sample: All'],,With business as usual,,['Post-test unadjusted (select one from this group)'],,['Test type: Standardised test '],,NA,,NA,,NA,,NA,,NA,,NA,,NA,,NA,,NA,,NA,,NA,,NA,,NA,,NA,,NA,,NA,,NA,,NA,,NA,,NA,,NA,,NA,,NA,,NA,,NA,,NA,,NA,,NA,,NA,,NA,,NA,,NA,,NA,,NA,,NA,,NA,,NA,,NA,,NA,,NA,,NA,,NA,,NA,,NA,,NA,,NA,,NA,,NA,,NA,,NA,,NA,,NA,,NA,,NA,,NA,,NA,,NA,,NA,,NA,,NA,,NA,,NA,,NA,,NA,,NA,,NA,,NA,,NA,,NA,,NA,,NA,,NA,,NA,,NA,,NA,,NA,
73032982,Zevenbergen (2003),2003,['Parental engagement'],NA,EOWPVT-R): shared reading vs control,,Expressive One-Word Picture Vocabulary Test-Revised (EOWPVT-R)  shared reading vs control,,"['Toolkit primary outcome', 'Reading primary outcome']",,0.4729,,0.1851,,Literacy: speaking and listening/oral language,,71,,82.01,,10.74,,52,,76.63,,12.04,,0.1101,,0.8356,,Primary outcome,,['Sample: All'],,With business as usual,,['Post-test unadjusted (select one from this group)'],,['Test type: Standardised test '],,EOWPVT-R): shared reading vs control,,Expressive One-Word Picture Vocabulary Test-Revised (EOWPVT-R)  shared reading vs control,,"['Toolkit primary outcome', 'Reading primary outcome']",,0.4729,,0.1851,,Literacy: speaking and listening/oral language,,71,,82.01,,10.74,,52,,76.63,,12.04,,0.1101,,0.8356,,Primary outcome,,['Sample: All'],,With business as usual,,['Post-test unadjusted (select one from this group)'],,['Test type: Standardised test '],,NA,,NA,,NA,,NA,,NA,,NA,,NA,,NA,,NA,,NA,,NA,,NA,,NA,,NA,,NA,,NA,,NA,,NA,,NA,,NA,,NA,,NA,,NA,,NA,,NA,,NA,,NA,,NA,,NA,,NA,,NA,,NA,,NA,,NA,,NA,,NA,,NA,,NA,,NA,,NA,,NA,,NA,,NA,,NA,,NA,,NA,,NA,,NA,,NA,,NA,,NA,,NA,,NA,,NA,,NA,,NA,,NA,,NA,,NA,,NA,,NA,,NA,,NA,,NA,,NA,,NA,,NA,,NA,,NA,,NA,,NA,,NA,,NA,,NA,,NA,,NA,
73032983,Zigler (2008),2008,['Parental engagement'],NA,MAP total: PAT vs no PAT,,MAP total  PAT vs no PAT  combining all SES (low & non-low) and all pre-school status (no preschool and preschool)  Fixed effect,,"['Toolkit primary outcome', 'Other outcome']",,0.1789,,0.0273,,Combined subjects,,0.178904403,,0,,0,,0.027260595,,0,,0,,0.1255,,0.2323,,Primary outcome,,['Sample: All'],,With business as usual,,['Post-test unadjusted (select one from this group)'],,['Test type: National test'],,NA,,NA,,NA,,NA,,NA,,NA,,NA,,NA,,NA,,NA,,NA,,NA,,NA,,NA,,NA,,NA,,NA,,NA,,NA,,NA,,NA,,NA,,NA,,NA,,NA,,NA,,NA,,NA,,NA,,NA,,NA,,NA,,NA,,NA,,NA,,NA,,NA,,NA,,NA,,NA,,NA,,NA,,NA,,NA,,NA,,NA,,NA,,NA,,NA,,NA,,NA,,NA,,NA,,NA,,NA,,NA,,NA,,NA,,NA,,NA,,NA,,NA,,NA,,NA,,NA,,NA,,NA,,NA,,NA,,NA,,NA,,NA,,NA,,NA,,NA,,NA,,NA,,NA,,NA,,NA,,NA,,NA,,NA,,NA,,NA,,NA,,NA,,NA,,NA,,NA,,NA,,NA,,NA,,NA,,NA,
73032984,Zucker (2021) 1_1,2021,['Parental engagement'],NA,RLN : Tier 1 vs BAU,,RLN (CIRCLE Rapid Letter Naming subtest   Tier 1 vs BAU (smd is the ame as the one reported by authors on Table 6),,"['Toolkit primary outcome', 'Reading primary outcome']",,-0.2749,,0.2014,,Literacy: reading other,,NA,,NA,,NA,,NA,,NA,,NA,,-0.6696,,0.1198,,Primary outcome,,['Sample: All'],,With business as usual,,['Post-test adjusted for baseline attainment AND clustering'],,['Test type: Standardised test '],,RLN : Tier 1 vs BAU,,RLN (CIRCLE Rapid Letter Naming subtest   Tier 1 vs BAU (smd is the ame as the one reported by authors on Table 6),,"['Toolkit primary outcome', 'Reading primary outcome']",,-0.2749,,0.2014,,Literacy: reading other,,NA,,NA,,NA,,NA,,NA,,NA,,-0.6696,,0.1198,,Primary outcome,,['Sample: All'],,With business as usual,,['Post-test adjusted for baseline attainment AND clustering'],,['Test type: Standardised test '],,NA,,NA,,NA,,NA,,NA,,NA,,NA,,NA,,NA,,NA,,NA,,NA,,NA,,NA,,NA,,NA,,NA,,NA,,NA,,NA,,NA,,NA,,NA,,NA,,NA,,NA,,NA,,NA,,NA,,NA,,NA,,NA,,NA,,NA,,NA,,NA,,NA,,NA,,NA,,NA,,NA,,NA,,NA,,NA,,NA,,NA,,NA,,NA,,NA,,NA,,NA,,NA,,NA,,NA,,NA,,NA,,NA,,NA,,NA,,NA,,NA,,NA,,NA,,NA,,NA,,NA,,NA,,NA,,NA,,NA,,NA,,NA,,NA,,NA,,NA,,NA,
73032985,Zucker (2021) 1_2,2021,['Parental engagement'],NA,NA,,NA,,NA,,NA,,NA,,NA,,NA,,NA,,NA,,NA,,NA,,NA,,NA,,NA,,NA,,NA,,NA,,NA,,NA,,NA,,NA,,NA,,NA,,NA,,NA,,NA,,NA,,NA,,NA,,NA,,NA,,NA,,NA,,NA,,NA,,NA,,NA,,NA,,NA,,NA,,NA,,NA,,NA,,NA,,NA,,NA,,NA,,NA,,NA,,NA,,NA,,NA,,NA,,NA,,NA,,NA,,NA,,NA,,NA,,NA,,NA,,NA,,NA,,NA,,NA,,NA,,NA,,NA,,NA,,NA,,NA,,NA,,NA,,NA,,NA,,NA,,NA,,NA,,NA,,NA,,NA,,NA,,NA,,NA,,NA,,NA,,NA,,NA,,NA,,NA,,NA,,NA,,NA,,NA,,NA,,NA,,NA,,NA,,NA,,NA,,NA,,NA,,NA,,NA,,NA,,NA,,NA,,NA,,NA,,NA,,NA,,NA,,NA,,NA,
