37092761,Eggen (1978),1978,"The effects of conceptual hierarchies as supplemental aids to textual materials was investigated. Sixty-five fourth, fifth, and sixth grade students were given a 1000-word reading passage describing the real number system. One group received a conceptual hierarchy in addition to the text  one group was asked to draw this hierarchy from the information in the text  a control group read the text. The group that was provided with the hierarchy scored significantly better than the control on Production and Comprehension subtests. The ineffectiveness of the draw hierarchy treatment was due to the inability of subjects to construct the hierarchy. Those able to complete the hierarchy scored significantly higher than control on Production and Comprehension subscores and on the total test. No differences were found between the successful drawers and the group provided with a hierarchy.",['Feedback'],NA,,"Journal, Article",,['Journal article'],NA,NA,,['USA'],NA,NA,,['Primary/elementary school'],NA,NA,,['Unclear'],NA,NA,,"['9', '10', '11']","['Page 3:\n[¬s]""h grade stu dents enrolled in a local elementary school. The sample included 22 fourth graders, 21 fifth graders, and 22 sixth graders. Thirty-six subjects were boys and 29 were [¬e]""', 'Page 3:\n[¬s]""h grade stu dents enrolled in a local elementary school. The sample included 22 fourth graders, 21 fifth graders, and 22 sixth graders. Thirty-six subjects were boys and 29 were [¬e]""', 'Page 3:\n[¬s]"" grade stu dents enrolled in a local elementary school. The sample included 22 fourth graders, 21 fifth graders, and 22 sixth graders. Thirty-six subjects were boys and 29 were [¬e]""']",NA,,1,"['Page 3:\n[¬s]""n a local elementary school. T[¬e]""']",,1,"['Page 3:\n[¬s]""n a local elementary school. Th[¬e]""']",,1,"['Page 3:\n[¬s]""a local elementary school. T[¬e]""']",,NA,NA,NA,,NA,NA,,NA,NA,,NA,NA,,['not_provided'],NA,"['Page 3:\n[¬s]""The subjects were 65 fourth, fifth, and sixth grade stu dents enrolled in a local elementary school. The sample included 22 fourth graders, 21 fifth graders, and 22 sixth graders. Thirty-six subjects were boys and 29 were girls. Subjects were not ability grouped in any classes. The subjects were randomly assig[¬e]""']",,['Yes (Please specify)'],"['Page 3:\n[¬s]""d by narrower, less inclusive concepts. A second group?provided hierarchy (PH)?was given the identical text, but which was supplemented by the addition of a conceptual hierarchy at five different points immediately following the relevant material.""\n""preceding ones, as shown in Figure 1. The third group?draw hierarchy (DH) ?was provided a text identical to that of the first two groups, but at five points in the text this group was asked to draw a conceptual hierarchy outlining the content just read.[¬e]""']",NA,,Random (please specify),"['Page 3:\n[¬s]""Subjects were not ability grouped in any classes. The subjects were randomly assign[¬e]""']",NA,,Individual,NA,NA,,['Multisite RCT'],"['Page 3:\n[¬s]""The subjects were randomly assigned within classes to one of three experimental groups. T[¬e]""']",NA,,['No/Unclear'],"['Page 3:\n[¬s]""bjects were not ability grouped in any classes. The subjects were randomly assigned within classes to one of three experimental groups. T[¬e]""']",NA,
40294902,Ehlinger (1988) FB,1988,"Research in reading comprehension and reading strategies suggests that cognitive modeling by teachers is an effective instructional tool to teach reading comprehension processes. However, despite evidence suggesting the effectiveness of such an approach, little is known about how teachers most effectively model these processes and how students are influenced by modeled strategies. A Social Cognitive Theory of Learning was used as a theoretical basis for this investigation which was designed to address two major questions  (1) What are the relative merits of characteristics of general modeling when applied to cognitive modeling of reading comprehension processes? (2) How do the characteristics of modeling, when applied to cognitive modeling of reading processes, influence the comprehension and comprehension monitoring of eighth grade readers? One hundred average eighth grade readers were randomly assigned to one of four modeling conditions  (1) Passive Cognitive Modeling. Cognitive modeling only. (2) Active Cognitive Modeling. Cognitive modeling with statements to explain the functional value of the modeled strategy and to foster self-efficacy in the students. (3) Full range Cognitive Modeling. Modeling same as ""active"" group with feedback, (4) Control. No modeling. Students met with the researcher in small groups for three sessions. Each session consisted of the researcher's verbal cognitive modeling of a passage being read, followed by the students individually applying the modeled strategy to another passage, followed by an oral retelling of the passage and comprehension questions. Data were analyzed with a one-way analysis of variance for oral retelling scores and for comprehension question scores, and with a chi-square for strategy use. Strategies were predetermined or emerged from qualitative analysis of the think-aloud protocols. Results revealed  (1) There were significant differences among groups for use of reading comprehension monitoring strategies (p $<$.05). The modeling conditions did significantly more monitoring of their comprehension by applying the modeled strategies and by using their own un-modeled strategies. (2) There were significant differences among groups for reading comprehension based on oral retellings (p $<$.05). Active and fullrange modeling groups had significantly better retellings than the control and passive modeling groups. (3) There were no significant differences among groups for performance on comprehension questions.",['Feedback'],NA,,Dissertation,,['Dissertation or thesis'],NA,NA,,['USA'],NA,NA,,['Middle school'],NA,NA,,['Low ecological validity'],NA,NA,,"['13', '14']",NA,NA,,1,"['Page 83:\n[¬s]"" a public school in Waukesha, Wisconsin[¬e]""']",,1,"['Page 83:\n[¬s]"" a public school in Waukesha, Wisconsin.[¬e]""']",,1,"['Page 83:\n[¬s]"" a public school in Waukesha, Wisconsin.[¬e]""']",,NA,NA,NA,,NA,NA,,NA,NA,,NA,NA,,['not_provided'],NA,NA,,['No'],NA,"As per the instructions  'Include for Feedback coding ""active cognitive modelling"" as control condition and ""full-range modelling"" as treatment condition.'",,Random (please specify),"['Page 83:\n[¬s]""a sample of 100 subjects who could adequately read material at a seventh to eighth grade level, but who had[¬e]""', 'Page 84:\n[¬s]""difficulty monitoring their comprehension were selected and randomly assigned [¬e]""', 'Page 85:\n[¬s]""Subjects were randomly assigned to""\n"" active cognitive modeling, fullrange cognitive mode l i n g[¬e]""']",NA,,Individual,"['Page 24:\n[¬s]""One hundred students enrolled in the eighth grade of a public middle school in Waukesha/ Wisconsin were selected for this investigation. Selection was based on the students\' abilty to adequately read material at a seventh to eighth grade level (as indicate by a cloze test for reading proficiency), but inability to monitor their comprehension (as indicated by an informational inconsistencies assessment to determine ability to monitor comprehension). Students were randomly assigned[¬e]""']",NA,,['Multisite RCT'],"['Page 83:\n[¬s]""The general population for this study was eighth grade students enrolled in a public school in Waukesha, Wisconsin. The total school enrollment was 1032 including 323 eighth graders. Specifically, the population was those eighth graders enrolled in regular language arts and social studies classes for hours 3, 6 and 8.""\n"" Students enrolled in exceptional educational or bilingual programs were excluded from the study. From this population, a sample of 100 subjects who could adequately read material at a seventh to eighth grade level, but who had 67[¬e]""', 'Page 84:\n[¬s]""difficulty monitoring their comprehension were selected and randomly assigned to one of four treatment groups.[¬e]""']",NA,,['Yes'],"['Page 84:\n[¬s]""Nine subjects (four boys and five girls) chose not to participate and the next subjects on the list were contacted.[¬e]""', 'Page 85:\n[¬s]""Subjects were randomly assigned to one of four treatment groups (control, passive cognitive modeling, active cognitive modeling, fullrange cognitive mode l i n g ) . Due to conflicts in students\' schedules, sixteen students could not be randomly assigned and were therefore assigned to a group according to their individual schedule.""\n""Of those sixteen there were eight boys and eight girls. Their cloze scores ranged from 30% to 58% with a mean of 43.6% and a mode of 36%, compared to a mean score of 44.9%, and a mode of 44% for the subjects overall. Their comprehension monitoring scores ranged from 0% to 60% with a mean score of 22.5% and a mode of 20%, compared to 21.7% for a mean and 20% as the mode score for the overall group. To balance the groups, four subjects were assigned to the control group, three to the passive cognitive modeling group, five to the active cognitive modeling group, and four to the fullrange cognitive modeling group.[¬e]""']",NA,
46887923,Elawar (1985),1985,"Eighteen Venezuelan elementary school teachers, trained to provide constructive written feedback on their sixth grade students' mathematics homework, did so three times weekly for ten weeks. In addition to learning and attitude outcomes, aptitude-treatment interactions were examined among treatments and student ability, attitude, and sex. (Author/BS)",NA,['Feedback'],,"Journal, Article",,['Journal article'],NA,NA,,['Venezuela'],NA,NA,,['Primary/elementary school'],NA,NA,,['High ecological validity'],"['Page 3:\n[¬s]""This approach ensured the maintenance of\nnormal learning environments, thus increasing the\necological validity and representativeness of findings.[¬e]""']",NA,,"['11', '12']",NA,NA,,3,NA,,3,NA,,3,NA,,NA,NA,NA,,NA,NA,,NA,NA,,NA,NA,,NA,NA,NA,,['Yes (Please specify)'],"['Page 4:\n[¬s]""The experimental design was a 3 (school) X 3 (treat-\nment) X 2 (sex) factorial. The three treatments were\nan experimental group, a knowledge-of-results control\ngroup, and a half-class treatment added as an additional\ncontrol.[¬e]""']",Main DE  Focus on the comparison between the Whole class treatment and No treatment.,,Random (please specify),"['Page 4:\n[¬s]""Assignment was made ran-\ndomly.[¬e]""']",NA,,Class,"['Page 4:\n[¬s]""The 18 classes were nested within treatment condi-\ntions (whole-class treatment, half-class treatment, and\ncontrol) within schools.[¬e]""']",NA,,['Cluster RCT'],NA,"Details of assignment to condition are not clearly stated, it appears 28 students in each of 18 classes of 30 to 45 were assigned to either intervention or control, so it seems assignment was at class level",,['Yes'],"['Page 4:\n[¬s]""To achieve a balanced design,\nonly 28 students (14 boys and 14 girls) were selected at\nrandom from each class.[¬e]""']",NA,
37061114,Elliot (1986),1986,"The purpose of this study was to investigate use of the microcomputer to enhance poor readers' comprehension of text. The study focused on two text-centered comprehension strategies, questions interspersed in text and immediate feedback, which were used in conjunction with computer-presented passages. The feedback capability of the computer was of primary interest, and was demonstrated by providing feedback regarding students' answers to interspersed questions. Poor readers were used as subjects because of indications from prior research that they are less able to organize text and to monitor their performance during reading than are good readers, suggesting that poor readers may benefit from externally-provided comprehension aids. There were three experimental groups  (a) a text-only group which read computerized text without interspersed questions or feedback, (b) a group reading the text with interspersed questions, but without feedback, (c) a group receiving feedback in addition to interspersed questions. Subjects were 66 sixth and seventh graders reading one to two years below grade level, who were randomly assigned to treatments. All subjects read 250-word expository passages, one science-related and one social studies-related. Re-reading of relevant portions of passages after answering interspersed questions was permitted. A cloze test and multiple-choice test consisting of factual and inferential questions were administered after each passage. The following relationship among groups was predicted for each of the four dependent variables (cloze, multiple-choice test, factual questions, inferential questions)  Group 1 < Group 2 < Group 3. A series of four 3 (type of presentation) x 2 (type of passage) ANOVAS with repeated measures on passages was performed. Study results failed to confirm the predicted relationships, as no significant differences were found among treatment groups for any of the dependent variables. Additional results showed that subjects did little re-reading of text and spent about half the time reading feedback as was expected. The latter finding may have contributed to the lack of significant results. It was concluded that poor readers will not necessarily be motivated to read all material presented to them on a microcomputer. It was suggested that only game-like or other highly motivating comprehension-related CAI materials be used with poor readers and that effectiveness of such materials be researched further.",['Feedback'],NA,,Dissertation,,['Dissertation or thesis'],NA,NA,,['USA'],NA,NA,,['Middle school'],"['Page 71:\n[¬s]""middle schoo[¬e]""']",NA,,['High ecological validity'],NA,NA,,"['11', '12', '13', '14']",NA,"The mean age of the sixth graders In the main study was 11 years, 9 months. Mean age of the seventh graders was 13 years, 1 month.",,1,"['Page 71:\n[¬s]"" an urban middle school[¬e]""']",,1,"['Page 71:\n[¬s]"" an urban middle school[¬e]""']",,NA,NA,,NA,NA,NA,,NA,NA,,NA,NA,,NA,NA,,['not_provided'],NA,NA,,['Yes (Please specify)'],"['Page 18:\n[¬s]"" (b) Group 2 - a group reading text containing Interspersed questions but which received no feedback, and (c) Group 3 - a group receiving feedback In addition to the Interspersed questions. [¬e]""']",NA,,Random (please specify),"['Page 72:\n[¬s]""Subjects were stratified by grade and reading level so that equal numbers from each subgroup could be assigned to treatments. From the stratified subgroups, subjects were randomly assigned to treatment groups and passage order.[¬e]""', 'Page 79:\n[¬s]""Subjects were randomly assigned to treatment groups and the order In which they read passages.[¬e]""']",no method given,,Individual,"['Page 79:\n[¬s]""Subjects were randomly assigned to treatment groups and the order In which they read passages.[¬e]""']",NA,,['Individual RCT'],"['Page 71:\n[¬s]""Subjects were poor readers selected from the sixth and seventh grades of an urban middle school.[¬e]""', 'Page 81:\n[¬s]""This study Incorporated a ""true"" experimental design.[¬e]""']",NA,,['No/Unclear'],"['Page 72:\n[¬s]""Subjects were stratified by grade and reading level so that equal numbers from each subgroup could be assigned to treatments. From the stratified subgroups, subjects were randomly assigned to treatment groups and passage order. Twenty-four subjects were then randomly assigned to be used In the pilot study, in which 21 students actually participated.[¬e]""', 'Page 82:\n[¬s]"" students were randomly assigned to one of two ""passage order"" conditions. Thus, half the students within each of the treatments read Passage 1 first, the other half read Passage 2 first, and test procedure learning effects were counterbalanced as a result.[¬e]""']",Sample size at randomisation stage is not clearly reported for the control and treatment group. It seems that the author reported it after attrition took place. ,
46887929,Farrell (1977),1977,NA,NA,['Feedback'],,Dissertation,,['Dissertation or thesis'],NA,NA,,['USA'],NA,NA,,['Secondary/High school'],NA,NA,,['High ecological validity'],NA,NA,,['No information provided'],NA,NA,,1,"['Page 52:\n[¬s]""the high school[¬e]""']",,1,NA,,1,NA,,NA,NA,NA,,6,"['Page 52:\n[¬s]""six Writing II classes[¬e]""']",,1,"['Page 52:\n[¬s]""one American\nLiterature class which did not receive composition instruction[¬e]""']",,7,NA,,NA,NA,NA,,['Yes (Please specify)'],"['Page 53:\n[¬s]""As previously indicated, several treatment groups were\ncompared in this study: student tutoring, peer evaluation,\nteacher lecture, and a no-compositlon literature group.[¬e]""']",Main DE  Focus on the comparison between the Peer evaluation (feedback) group versus the control (no comp).,,"Non-random, not matched prior to treatment",NA,NA,,Class,NA,NA,,['Cluster RCT'],NA,NA,,['Yes'],"['Page 53:\n[¬s]""random placement of students was not possible\nin this study. Variations in scheduling students at the\nschool made this impossible. It might happen, then, that a\nsection of advanced placement chemistry students would be\nlocked into the same writing class because of problems in\nscheduling lab time.[¬e]""']",NA,
46888082,Feng (1983) 1_1,1983,"Self-instructional booklets simulating computer-assisted instruction (CAI) were used to teach four basic concepts in science to first graders in three treatment groups which received different types of feedback--hints, correct answers, and right or wrong. A control group received neither instruction nor feedback. A multiple-choice test was administered to the 47 students in the 4 groups following completion of the instruction. It was found that the group provided with hints had the highest mean  the group provided with the correct answer had the second highest mean  the group provided with right/wrong feedback had the second lowest mean  and the control group had the lowest mean. The results were inconclusive with respect to the hypotheses as there were no significant differences among the group means. Possible causes are suggested in the discussion that concludes the report. A table summarizing the means and standard deviations, a flowchart showing the hypothesized model of relationships between different forms of feedback, and samples of generalities, practice items, and test items are provided. Lists of 12 references and 10 prior IDD&E working papers are also included. ",NA,['Feedback'],,Report,,['Technical report'],"['Page 1:\n[¬s]""Reports - Research/Technical (143)[¬e]""']",NA,,['USA'],"['Page 1:\n[¬s]""Syracuse Univ., N.Y. School of Educati\nApr 83\n20p.\nReports - Research/Technical (143)[¬e]""']",not stated bu the report was produced in NY,,['Primary/elementary school'],"['Page 8:\n[¬s]""first graders in a\nprivate elesentary school.[¬e]""']",NA,,['High ecological validity'],NA,NA,,"['7', '8']",NA,NA,,1,"['Page 8:\n[¬s]""The students were three classes of first graders in a\nprivate elesentary school.[¬e]""']",,1,"['Page 8:\n[¬s]""The students were three classes of first graders in a\nprivate elesentary school.[¬e]""']",,1,"['Page 8:\n[¬s]""The students were three classes of first graders in a\nprivate elesentary school.[¬e]""']",,NA,NA,NA,,2,"['Page 8:\n[¬s]""Students in classes I and I/ were assigned randosly tc three\ndifferent treatsent groups.[¬e]""']",,1,"['Page 8:\n[¬s]""rodents in class III were all\nassigned to the control group:[¬e]""']",,3,"['Page 8:\n[¬s]""three classes[¬e]""']",,NA,NA,NA,,['Yes (Please specify)'],"['Page 1:\n[¬s]""different types of feedback--hints, correct answers, and\nright or wrong.[¬e]""', 'Page 8:\n[¬s]""Students in classes I and I/ were assigned randosly tc three\ndifferent treatsent groups. rodents in class III were all\nassigned to the control group:[¬e]""']","we are interested in the hint treatment other treatments are  correct answers, and right/wrong feedback",,Random (please specify),"['Page 8:\n[¬s]""were assigned randosly tc three[¬e]""', 'Page 8:\n[¬s]""A total of 47 first graders took part in this experiment.\nStudents in classes I and I/ were assigned randosly tc three\ndifferent treatsent groups. rodents in class III were all\nassigned to the control group:[¬e]""']",random between the 3 treatments but not random between the treatment and control,,Individual,"['Page 8:\n[¬s]""A total of 47 first graders took part in this experiment.\nStudents in classes I and I/ were assigned randosly tc three[¬e]""', 'Page 8:\n[¬s]""A total of 47 first graders took part in this experiment.\nStudents in classes I and I/ were assigned randosly tc three\ndifferent treatsent groups. rodents in class III were all\nassigned to the control group:[¬e]""']",but control as class,,['Prospective QED'],"['Page 8:\n[¬s]""The experisental design was a posttest-only control\ngroup design(Caspbell C Stanley, 1c62).[¬e]""']",NA,,['No/Unclear'],"['Page 8:\n[¬s]""A total of 47 first graders took part in this experiment.\nStudents in classes I and I/ were assigned randosly tc three\ndifferent treatsent groups.[¬e]""']",Only treatment groups were randomised  a method of randomisation was not described.,
49106820,Feng (1983) 1_2,1983,"Self-instructional booklets simulating computer-assisted instruction (CAI) were used to teach four basic concepts in science to first graders in three treatment groups which received different types of feedback--hints, correct answers, and right or wrong. A control group received neither instruction nor feedback. A multiple-choice test was administered to the 47 students in the 4 groups following completion of the instruction. It was found that the group provided with hints had the highest mean  the group provided with the correct answer had the second highest mean  the group provided with right/wrong feedback had the second lowest mean  and the control group had the lowest mean. The results were inconclusive with respect to the hypotheses as there were no significant differences among the group means. Possible causes are suggested in the discussion that concludes the report. A table summarizing the means and standard deviations, a flowchart showing the hypothesized model of relationships between different forms of feedback, and samples of generalities, practice items, and test items are provided. Lists of 12 references and 10 prior IDD&E working papers are also included.",NA,['Feedback'],,Report,,['Technical report'],"['Page 1:\n[¬s]""Reports - Research/Technical (143)[¬e]""']",NA,,['USA'],"['Page 1:\n[¬s]""Syracuse Univ., N.Y. School of Educati[¬e]""']",not stated bu the report was produced in NY,,['Primary/elementary school'],"['Page 1:\n[¬s]""first graders in[¬e]""', 'Page 8:\n[¬s]""of first graders in a\nprivate elesentary school.[¬e]""']",NA,,['High ecological validity'],NA,NA,,"['7', '8']",NA,NA,,1,"['Page 8:\n[¬s]""The students were three classes of first graders in a\nprivate elesentary school.[¬e]""']",,1,"['Page 8:\n[¬s]""The students were three classes of first graders in a\nprivate elesentary school.[¬e]""']",,1,"['Page 8:\n[¬s]""The students were three classes of first graders in a\nprivate elesentary school.[¬e]""']",,NA,NA,NA,,2,"['Page 8:\n[¬s]""Students in classes I and I/ were assigned randosly tc three\ndifferent treatsent groups.[¬e]""']",,1,"['Page 8:\n[¬s]""rodents in class III were all\nassigned to the control group:[¬e]""']",,3,"['Page 8:\n[¬s]""The students were three classes of first graders in a\nprivate elesentary school.[¬e]""']",,NA,NA,NA,,['Yes (Please specify)'],"['Page 7:\n[¬s]""in the form of a hint, the correct answer, or\nright/wrong knowledge of results.[¬e]""']","also 2 more treatment groups, hint & right/wrong answer",,"Non-random, not matched prior to treatment","['Page 8:\n[¬s]""A total of 47 first graders took part in this experiment.\nStudents in classes I and I/ were assigned randosly tc three\ndifferent treatsent groups. rodents in class III were all\nassigned to the control group[¬e]""']",random between the 3 different treatment groups but not random between the treatment of interest in this data extraction and control,,Individual,"['Page 8:\n[¬s]""less, they are just normal kids from the general population.\nA total of 47 first graders took part in this experiment.\nStudents in classes I and I/ were assigned randosly tc three\ndifferent treatsent groups. rodents in class III were all\nassigned to the control group:[¬e]""', 'Page 8:\n[¬s]""A total of 47 first graders took part in this experiment.\nStudents in classes I and I/ were assigned randosly tc three\ndifferent treatsent groups. rodents in class III were all\nassigned to the control group:[¬e]""']",for control,,['Prospective QED'],"['Page 8:\n[¬s]""The experisental design was a posttest-only control\ngroup design(Caspbell C Stanley, 1c62).[¬e]""']",NA,,['No/Unclear'],NA,Only treatment groups were randomised  a method of randomisation was not described.,
