37092607,Koedinger (2010),2010,"ASSISTments is a web-based math tutor designed to address the need for timely student assessment while simultaneously providing instruction, thereby avoiding lost instruction time that typically occurs during assessment. This article presents a quasi-experiment that evaluates whether ASSISTments use has an effect on improving middle school students' year-end test scores. The data was collected from 1240 seventh graders in three treatment schools and one comparison school. Post-test (7th grade year-end test) results indicate, after adjusting for the pre-test (6th grade year-end test), that students in the treatment schools significantly outperformed students in the comparison school and the difference was especially present for special education students. A usage analysis reveals that greater student use of ASSISTments is associated with greater learning consistent with the hypothesis that it is useful as a tutoring system. We also found evidence consistent with the hypothesis that teachers adapt their whole class instruction based on overall student performance in ASSISTments. Namely, increased teacher use (i.e., having more students use the system more often) is associated with greater learning among students with little or no use, suggesting that those students may have benefited from teachers adapting their whole-class instruction based on what they learned from ASSISTments use reports. These results indicate potential for using technology to provide students instruction during assessment and to give teachers fast and continuous feedback on student progress.",['Feedback'],NA,,"Journal, Article",,['Journal article'],NA,NA,,['USA'],NA,NA,,['Middle school'],NA,NA,,['High ecological validity'],NA,NA,,"['12', '13']",NA,Grade 7 students,,3,"['Page 1:\n[¬s]""three treatment schools[¬e]""']",,1,"['Page 1:\n[¬s]""one comparison school[¬e]""']",,4,"['Page 9:\n[¬s]""four middle schools[¬e]""']",,NA,NA,NA,,NA,NA,,NA,NA,,NA,NA,,['not_provided'],Not provided,"['Page 12:\n[¬s]""a D a t a o n a s s i g n m e n t o f s t u d e n t s t o c l a s s w a s a v a i l a b l e o n l y f o r r e g u l a r t e a c h e r s w i t h a n A S S I S T m e n t a c c o u n t[¬e]""']",,['Yes (Please specify)'],"['Page 9:\n[¬s]""Treatment school A included 372 students""\n""Treatment school B included 322""\n""Treatment school C included 253 students""\n""Comparison school D included 293 students""\n"" when treatment students were in the lab, control students would work on traditional text-book activities[¬e]""']",NA,,"Non-random, not matched prior to treatment","['Page 10:\n[¬s]""Both the treatment and comparison groups had similar student characteristics (race, gender, limited English proficiency (LEP), free lunch eligibility, special education students) and teacher/school characteristics (licensed in teacher assign- ment, percent of core classes taught by \x93highly qualified teachers,\x94 student/teacher ratio). [¬e]""']",NA,,School - cluster,NA,NA,,['Prospective QED'],NA,NA,,['Not applicable'],NA,NA,
40294919,Kolic-Vehovec (2002) FB,2002,"The effects of the self-monitoring and attribution training on accuracy and fluency of reading, as well as reading comprehension, and reading attribution of second-grade poor readers were examined. The participants were assigned in three experimental groups and one control group. One experimental group was encouraged for self-monitoring and self-correction by token-economy. The second group was instructed to attribute reading success to effort and ability, and failure to lack of effort. The third experimental group obtained a combination of self-monitoring and attribution training, and the control group practiced reading without feedback. All students showed improvement in reading fluency and comprehension. Self-monitoring training, as well as attribution training and their combination improved reading accuracy. Changes toward more internal attribution were obtained only in the experimental groups with explicit attribution training applied",['Feedback'],NA,,"Journal, Article",,['Journal article'],NA,NA,,['Croatia'],NA,NA,,['Primary/elementary school'],NA,NA,,['Low ecological validity'],NA,NA,,"['7', '8']",NA,NA,,NA,NA,,NA,NA,,3,"['Page 4:\n[¬s]"" three primary schools[¬e]""']",,NA,NA,NA,,NA,NA,,NA,NA,,NA,NA,,['not_provided'],Not provided,NA,,['No'],NA,NA,,Unclear,NA,NA,,Individual,NA,NA,,['Prospective QED'],"['Page 4:\n[¬s]""The sample was chosen from three primary schools in Rijeka, Croatia. The selection was made according to students\' results on a Furlan\'s Aloud Reading Test (Furlan, 1975) used regularly in Croatian schools for the evaluation of reading in the first four years of schooling. The participants in this study were 20% of second grade students in these schools Mean age:8 years, 4 months) with the lowest results on that test. The students\' reading fluency was one standard deviation or more lower from the average one. The students showed average or above average results on a test of nonverbal cognitive ability (Raven\'s Colored Progressive Matrices, Raven, Court, & Raven, 1994), and on a vocabulary test (a sub-test Vocabulary from REWISC, Biro, 1987). The participants were assigned to four groups of 15 subjects: one experimental and three control groups.[¬e]""']",NA,,['Not applicable'],NA,NA,
37092586,Kozlow (2004),2004,NA,['Feedback'],NA,,Report,,['Technical report'],NA,NA,,['USA'],NA,NA,,['Primary/elementary school'],NA,NA,,['High ecological validity'],NA,Dependent's on school's access to 6+1 Writing Traits model,,"['9', '10']",NA,Grade 4 students,,NA,NA,,NA,NA,,NA,NA,,['not_provided'],NA,"['Page 22:\n[¬s]""one school district[¬e]""']",,NA,NA,,NA,NA,,NA,NA,,['not_provided'],"Not provided - Data is given for entire sample - 38 classes in intervention and control (76 classes in total), but not specifically for Grade 4 - which is where outcome and sample data have been extracted from. The total number of classes reduces to 72, but again reflects entire sample not just 4th grade.","['Page 22:\n[¬s]""The study was conducted in one school district and involved 76 teachers and their classes in grades 3 to 6. Within each grade level, half the teachers were randomly assigned to the treatment group and half were randomly assigned to the control group. [¬e]""', 'Page 23:\n[¬s]""72 classrooms[¬e]""']",,['No'],"['Page 21:\n[¬s]""one treatment and one control group[¬e]""']",NA,,Random (please specify),"['Page 21:\n[¬s]""one treatment and one control group with teachers randomly assigned to groups within each of four grades[¬e]""', 'Page 22:\n[¬s]""half the teachers were randomly assigned to the treatment group and half were randomly assigned to the control group[¬e]""']",NA,,Class,NA,NA,,['Cluster RCT'],NA,NA,,['Yes'],"['Page 22:\n[¬s]""half the teachers were randomly assigned to the treatment group and half were randomly assigned to the control group[¬e]""']",NA,
40294920,Kramarski (2009) FB,2009,"This exploratory study investigated 100 Israeli 9th graders who used two different group-metacognitive support methods in online mathematical inquiry—group feedback guidance (GFG) and self-explanation guidance (SEG)—compared to a control group (CONT). The study evaluated each method's effects on students'  (a) mathematical inquiry ability  problem solving, explanations, mathematical feedback in online forum discussions, and transfer ability  and (b) self-regulated learning (SRL) measures (self-report questionnaires and metacognitive feedback in online forum discussions). Metacognitive support methods, based on IMPROVE self-questioning strategies, appeared in pop-up screens and provided the two experimental groups with differential cues for problem-solving processes. Mixed quantitative and qualitative analyses showed that GFG students outperformed SEG students in most mathematical and SRL measures and the CONT students in all measures. In addition, SEG students outperformed the CONT students in mathematica...","['Feedback', 'Collaborative learning']",NA,,"Journal, Article",,['Journal article'],NA,NA,,['Israel'],NA,NA,,['Middle school'],NA,NA,,['High ecological validity'],NA,NA,,"['15', '14']",NA,NA,,1,"['Page 7:\n[¬s]""one junior high school[¬e]""']",,1,"['Page 7:\n[¬s]""one junior high school[¬e]""']",,1,"['Page 7:\n[¬s]""one junior high school[¬e]""']",,NA,NA,NA,,1,"['Page 7:\n[¬s]""We assigned each class to one of the three instructional methods: ""\n""GFG[¬e]""']",,1,"['Page 7:\n[¬s]""We assigned each class to one of the three instructional methods:""\n""CONT[¬e]""']",,2,"['Page 7:\n[¬s]""We assigned each class to one of the""\n""instructional methods:""\n""GFG, or CONT.[¬e]""']",,NA,NA,NA,,['Yes (Please specify)'],NA,"Technically yes, but only one focussed on for purposes of this coding. ",,Unclear,NA,NA,,Class,NA,NA,,['Prospective QED'],"['Page 7:\n[¬s]""Participants were 100 ninth-grade students (47 boys, 53 girls) attending three classes within one junior high school in central Israel. We assigned each class to one of the three instructional methods: SEG, GFG, or CONT. [¬e]""']",Note  SEG not coded in extraction due to Citation notes,,['Not applicable'],NA,NA,
37092670,Lacher (1983),1983,"This study investigated variables which contribute to acquisition and maintenance over one week of trained verbal rehearsal in the performance of serial recall by 84 kindergarten and first-grade children. Children with low and high pretest recall were given rehearsal training with or without trial-by-trial feedback alone, along with a “looking” strategy, or along with the looking strategy and with instructions to compare the relative success of rehearsal and looking. Consistent with findings on acquiring Piagetian abilities, initial performance was a major determinant of effects of training on posttest performance. Only high scorers increased in rehearsal and recall during the pretest. Given training, however, all groups of low and high scorers increased in use of rehearsal, recall, and reported verbal memory aids from pretest to posttest one week after training. Feedback aided all groups' recall during training, but did not affect maintenance of rehearsal.",['Feedback'],NA,,"Journal, Article",,['Journal article'],"['Page 1:\n[¬s]""Journal of General Psychology[¬e]""']",NA,,['USA'],"['Page 3:\n[¬s]""Pretests were administered to 150 children in kindergarten and first-grade classes of two Northfield, Minnesota public schools[¬e]""']",NA,,['Primary/elementary school'],"['Page 3:\n[¬s]""Pretests were administered to 150 children in kindergarten and first-grade classes of two Northfield, Minnesota public schools. The 5s were 84 of these children selected for training by virtue of missing at least four of the 10 pretest trials. There were 55 boys and 29 girls (corresponding to the sex distribution in classes pretested); 65 were in kindergarten, 10 in transitional first grade, and 9 in regular first-grade classes (age X = 77 months; range = 68-101 months).[¬e]""']",NA,,['Unclear'],NA,No details about where the intervention took place or who was responsible for its delivery,,"['5', '6', '7']","['Page 3:\n[¬s]""Pretests were administered to 150 children in kindergarten and first-grade classes of two Northfield, Minnesota public school[¬e]""', 'Page 3:\n[¬s]""Pretests were administered to 150 children in kindergarten and first-grade classes of two Northfield, Minnesota public schools[¬e]""', 'Page 3:\n[¬s]""Pretests were administered to 150 children in kindergarten and first-grade classes of two Northfield, Minnesota public schools[¬e]""']",NA,,2,"['Page 3:\n[¬s]"" two Northfield, Minnesota public schools[¬e]""']",,2,"['Page 3:\n[¬s]""two Northfield, Minnesota public schools[¬e]""']",,2,"['Page 3:\n[¬s]"" two Northfield, Minnesota public schools[¬e]""']",,NA,NA,NA,,NA,NA,,NA,NA,,NA,NA,,['not_provided'],Not provided,NA,,['Yes (Please specify)'],"['Page 3:\n[¬s]""After pretesting, children were randomly assigned to one of three training conditions: Rehearsal Only, Rehearsal & Look, and Compare Rehearsal & Look; and one of two feed\xad back conditions: feedback absent and feedback present; the latter were informed of whether or not recall was correct after each trial.[¬e]""']","After pretesting, children were randomly assigned to one of three training conditions  Rehearsal Only, Rehearsal & Look, and Compare Rehearsal & Look  and one of two feed­ back conditions  feedback absent and feedback present  the latter were informed of whether or not recall was correct after each trial.",,Random (please specify),"['Page 3:\n[¬s]""After pretesting, children were randomly assigned to one of three training conditions: Rehearsal Only, Rehearsal & Look, and Compare Rehearsal & Look; and one of two feed\xad back conditions: feedback absent and feedback present; the latter were informed of whether or not recall was correct after each trial.[¬e]""']","After pretesting, children were randomly assigned to one of three training conditions  Rehearsal Only, Rehearsal & Look, and Compare Rehearsal & Look  and one of two feed­ back conditions  feedback absent and feedback present  the latter were informed of whether or not recall was correct after each trial.",,Individual,"['Page 3:\n[¬s]""Pretests were administered to 150 children in kindergarten and first-grade classes of two Northfield, Minnesota public schools. The 5s were 84 of these children selected for training by virtue of missing at least four of the 10 pretest trials. There were 55 boys and 29 girls (corresponding to the sex distribution in classes pretested); 65 were in kindergarten, 10 in transitional first grade, and 9 in regular first-grade classes (age X = 77 months; range = 68-101 months).[¬e]""']",NA,,['Individual RCT'],"['Page 3:\n[¬s]"" After pretesting, children were randomly assigned to""\n""one of two feed\xad back conditions: feedback absent and feedback present; the latter were informed of whether or not recall was correct after each trial.[¬e]""']",NA,,['Yes'],"['Page 3:\n[¬s]""After pretesting, children were randomly assigned to""\n""one of two feed\xad back conditions: feedback absent and feedback present; the latter were informed of whether or not recall was correct after each trial.[¬e]""']",NA,
46888303,Lenhard (2013),2013,"There are many established reading strategy training programmes, which explicitly teach strategic and meta-cognitive knowledge to improve reading comprehension. Although instruction in strategy knowledge leads to improvements in meta-cognitive skills, the effects do not always transfer to reading comprehension. Therefore, to investigate preconditions for knowledge transfer, two different strategy training programmes were implemented in nine classes of Grade 6 students (N = 148) over the course of one school year. One programme involved teacher-directed instruction of declarative meta-cognitive knowledge (Reading Detectives  Ruhl & Souvignier, 2006). The other aimed at improving executive meta-cognition by guided practice  students worked with a computer program based on latent semantic analysis (LSA) (conText) and received immediate feedback on written summaries. Although both groups improved their strategy knowledge to the same extent, the conText group showed a greater improvement in reading comprehension. These findings suggest that guided practice, which is characterised by intensive practice and individualised corrective feedback, is superior to explicitly teaching strategy knowledge. Adapted from the source document",NA,['Feedback'],,"Journal, Article",,['Journal article'],NA,NA,,['Germany'],NA,NA,,['Primary/elementary school'],NA,NA,,['High ecological validity'],NA,NA,,"['9', '10']",NA,NA,,1,"['Page 8:\n[¬s]""The sample consisted of 148 students from nine classes of the second school year of\nHauptschule (sixth-grade level)[¬e]""']",,1,NA,,1,NA,,NA,NA,NA,,4,"['Page 8:\n[¬s]""Four classes used the\nweb-based training with conText[¬e]""']",,5,"['Page 8:\n[¬s]""he other fi ve used the direct strategy instruction pro-\ngramme Reading Detectives.[¬e]""']",,9,"['Page 8:\n[¬s]""The sample consisted of 148 students from nine classes of the second school year of\nHauptschule (sixth-grade level).[¬e]""']",,NA,NA,NA,,['No'],NA,NA,,Random (please specify),"['Page 8:\n[¬s]""The classes were randomly assigned to the treatment groups and participated\nas a whole.[¬e]""']",NA,,Class,NA,NA,,['Cluster RCT'],"['Page 8:\n[¬s]""The sample consisted of 148 students from nine classes of the second school year of\nHauptschule (sixth-grade level). Thus, we recruited low-performing students, but we did\nnot select them individually. Instead, we drew a convenience sample of classes from the\nHauptschule. The classes were randomly assigned to the treatment groups and participated\nas a whole.[¬e]""']",NA,,['Yes'],"['Page 8:\n[¬s]""The sample consisted of 148 students from nine classes of the second school year of\nHauptschule (sixth-grade level). Thus, we recruited low-performing students, but we did\nnot select them individually. Instead, we drew a convenience sample of classes from the\nHauptschule. The classes were randomly assigned to the treatment groups and participated\nas a whole[¬e]""']",NA,
46888095,Llorens (2014) 1_1,2014,"This study analyses the effectiveness of adaptive formative feedback to boost strategic search decisions and performance when students are asked to answer a set of questions in a task-oriented reading situation. We compared automatic feedback that included information about the right answer with feedback that also included the connection between the students' strategic search decisions and their performance. Ninety-two high school students read two non-continuous texts. They received feedback during a training phase, and then they read and also received feedback with a similar text in a final phase. Text and questions were presented using a new computer-based technology that provided automatic adaptive feedback depending on the experimental condition  right-answer feedback, strategic-search-decisions feedback and placebo feedback. We found that strategic-search-decisions feedback improved strategic decisions over right-answer and placebo feedback in the final text, which in turn improved question-answering performance. Some positive effects were also found during training. These results open new possibilities to adaptive automatic procedures to teach task-oriented reading skills to students. © 2014 John Wiley & Sons Ltd.",NA,['Feedback'],,"Journal, Article",,['Journal article'],NA,NA,,['Spain'],"['Page 1:\n[¬s]""University of Valencia, Spain[¬e]""', 'Page 17:\n[¬s]""the Spanish Ministry of Science and Innovation with\nmain researcher Dr. Eduardo Vidal-Abarca[¬e]""', 'Page 7:\n[¬s]""were Spanish native speakers)[¬e]""']"," from the authors' affiliations and comments in the text, but not specified as such",,['Secondary/High school'],"['Page 7:\n[¬s]""Ninety-two high school students from grades 7 and 8\n(mean age 12.53, sd = 1.47;[¬e]""']",from the age of participants,,['Low ecological validity'],"['Page 10:\n[¬s]""The experiment lasted two sessions of approxi-\nmately 1 h. In the ﬁrst session, we tested participants\non reading literacy skills (i.e., CompLEC). I[¬e]""', 'Page 7:\n[¬s]""The texts and questions were presented using a new\ncomputer-based technology based on Read&Answer\nsoftware (Vidal-Abarca, Martínez et al., 2011). The\nprogram recorded every action the students undertook,\nthe order of these activities and the time each activity\nlasted (i.e., online processing measures) using\nmasking/unmasking procedure.[¬e]""']",potentially... There is a need for specific computer program potentially complicating and expensive although there is no detailed info on the costs involved no details if this took place at school - seems to be - or a lab. they have involved a pilot experiment,,"['12', '13', '14']","['Page 7:\n[¬s]""Ninety-two high school students from grades 7 and 8\n(mean age 12.53, sd = 1.47;[¬e]""']",NA,,1,"['Page 7:\n[¬s]""Ninety-two high school students from grades 7 and 8\n(mean age 12.53, sd = 1.47; 67% male, all of them""\n""were Spanish native speakers) participated in the study.\nThey were randomly distributed into three groups\naccording to the formative feedback type[¬e]""']",,1,NA,,1,"['Page 7:\n[¬s]""Ninety-two high school students from grades 7 and 8\n(mean age 12.53, sd = 1.47; 67% male, all of them[¬e]""']",,NA,NA,NA,,1 (Right answer feedback),"['Page 7:\n[¬s]""They were randomly distributed into three groups\naccording to the formative feedback type. The ﬁnal\nsample distribution was as follows: there were 30 stu-\ndents in the strategic-search-decisions feedback group,\n34 students participated in the right-answer feedback\ngroup, and 28 students participated in the placebo feed-\nback group.[¬e]""']",,1,NA,,3,"['Page 7:\n[¬s]""They were randomly distributed into three groups\naccording to the formative feedback type[¬e]""']",,NA,NA,NA,,['Yes (Please specify)'],"['Page 1:\n[¬s]""that provided automatic adaptive feedback depending\non the experimental condition: right-answer feedback, strategic-search-decisions feedback\nand placebo feedback[¬e]""']",strategic-search-decision feedback is the other treatment which we look at in a separate data extraction ,,Random (please specify),"['Page 7:\n[¬s]""They were randomly distributed into three groups\naccording to the formative feedback type. The ﬁnal\nsample distribution was as follows: there were 30 stu-\ndents in the strategic-search-decisions feedback group,\n34 students participated in the right-answer feedback\ngroup, and 28 students participated in the placebo feed-\nback group. S[¬e]""']",NA,,Individual,"['Page 7:\n[¬s]""They were randomly distributed into three groups\naccording to the formative feedback type""\n""Students were assigned to each condition\nafter being tested with a standardized comprehension\ntest (CompLEC; Llorens et al., 2011) so that all groups\nwere similar in terms of comprehension skills, F[¬e]""']",NA,,['Individual RCT'],"['Page 7:\n[¬s]""Ninety-two high school students from grades 7 and 8\n(mean age 12.53, sd = 1.47; 67% male, all of them""\n""were Spanish native speakers) participated in the study.\nThey were randomly distributed into three groups\naccording to the formative feedback type[¬e]""']",NA,,['Yes'],"['Page 7:\n[¬s]""They were randomly distributed into three groups\naccording to the formative feedback type. The ﬁnal\nsample distribution was as follows: there were 30 stu-\ndents in the strategic-search-decisions feedback group,\n34 students participated in the right-answer feedback\ngroup, and 28 students participated in the placebo feed-\nback group.[¬e]""']",NA,
