37092715,Reid (1988),1988,"72 children (mean age = 6–5) were assigned to 1 of 6 training conditions for speaking skills in a 2 (with or without feedback) × 3 (degree of overt activity) crossed design. Children in the active condition participated directly in three training exercises  each child in the passive condition observed the performance of the child in the active condition to whom he was matched  children in the active-passive condition received a combination of the two previous treatments. Children were given a pretest and immediate and delayed posttests, each of which was comprised of five tasks, four of which aimed at measuring possible transfer to other referential communication behaviors. Posttest evaluations showed that improvements in speaking behavior were related to the feedback condition, but not to the child's initial level of competence as assessed by global performance on the five pretest tasks. The reverse was true for the four transfer tasks. The amount of overt activity did not exert a significant effect on children's performance of any of the five tasks. Possible causes of the difficulty of obtaining transfer in training experiments are discussed.",['Feedback'],NA,,"Journal, Article",,['Journal article'],NA,NA,,['Canada'],NA,NA,,['Primary/elementary school'],NA,NA,,['Low ecological validity'],NA,NA,,"['5', '6', '7']",NA,NA,,3,"['Page 3:\n[¬s]""Seventy-two kindergarteners and first-graders (36 boys and 36 girls; M = age 6-5, range = 5-5 to 7-3) from three middle-class elementary schools in Montreal participated in the study.[¬e]""']",,3,"['Page 3:\n[¬s]""Seventy-two kindergarteners and first-graders (36 boys and 36 girls; M = age 6-5, range = 5-5 to 7-3) from three middle-class elementary schools in Montreal participated in the study.[¬e]""']",,3,"['Page 3:\n[¬s]"" three middle-class elementary schools in Montreal participated in the study.[¬e]""']",,NA,NA,NA,,NA,NA,,NA,NA,,6,NA,,NA,NA,NA,,['Yes (Please specify)'],"['Page 3:\n[¬s]""To attain the three main objectives of the study, children were assigned to one of six training conditions in a 2 (with or without feedback) X 3 (de\xad gree of overt activity) crossed design.""\n""The children were assigned to six groups (n = 12)[¬e]""']","There were 6 treatment groups.   However, the feedback condition (feedback/no feedback) will be focused upon, as instructed by the coding team. ",,"Non-random, but matched","['Page 3:\n[¬s]""The children were assigned to six groups (n = 12) that were equated on the basis of sex, grade, and the scores obtained on each pretest task.[¬e]""']",NA,,Individual,"['Page 3:\n[¬s]""The children were assigned to six groups (n = 12) [¬e]""']",NA,,['Individual RCT'],"['Page 1:\n[¬s]""72 children (mean age = 6*5) were assigned to 1 of 6 training conditions[¬e]""']",NA,,['No/Unclear'],NA,NA,
37092594,Reynolds (1988),1988,"The present study investigated the effects of instruction in two revision strategies on the paragraph writing of students with learning disabilities in Grades 6 through 8. The two experimental groups both received instruction in one strategy for revision of mechanics and one for content, but the order of instruction varied. Results suggest that revision instruction for both experimental groups improved scores on an analytic scale for mechanics, regardless of order of instruction, but improvement in content scores was not demonstrated.",['Feedback'],NA,,"Journal, Article",,['Journal article'],NA,NA,,['USA'],NA,NA,,['Middle school'],NA,NA,,['Low ecological validity'],NA,NA,,"['11', '12', '13', '14']",NA,NA,,NA,NA,,NA,NA,,NA,NA,,['not_provided'],NA,NA,,3,"['Page 2:\n[¬s]""Fifty-four students (45 boys and 9 girls) participated in this study. Five students were in sixth grade, 29 in seventh grade, and 20 in eighth grade.[¬e]""']",,3,"['Page 2:\n[¬s]""Fifty-four students (45 boys and 9 girls) participated in this study. Five students were in sixth grade, 29 in seventh grade, and 20 in eighth grade.[¬e]""']",,3,"['Page 2:\n[¬s]""Fifty-four students (45 boys and 9 girls) participated in this study. Five students were in sixth grade, 29 in seventh grade, and 20 in eighth grade.[¬e]""']",,NA,NA,NA,,['Yes (Please specify)'],"['Page 3:\n[¬s]"" Classes were assigned to one of three groups.""\n""Group X received instruction in Evalu\xad ative and Directive Phrases followed by instruction in COPS. This order was reversed for Group Y. The control group (Group Z) received no instruction in either of the revision strategies.[¬e]""']","There are 3 groups   Group X = EPD + COPS Group Y = COPS + EPD Group Z = No instruction in either revision strategy  However, only Group X and Group Z will be recorded, as intructed by the coding team.",,"Non-random, not matched prior to treatment","['Page 4:\n[¬s]""Pretest scores were analyzed first via analysis of variance (ANOVA) to check for equality of groups before interven\xad tion. No significant differences among the groups, F(2,50) = 0.96,p> .05, or between the Content and Mechanics subscores,/ 7 (1,50) = 0.20,p>.05, were found.[¬e]""']",NA,,Class,"['Page 3:\n[¬s]""Classes were assigned to one of three groups.[¬e]""']",NA,,['Individual RCT'],NA,NA,,['No/Unclear'],NA,NA,
37092778,Rickards (1978),1978,"Administered the New Developmental Reading Test—Intermediate Level, Form B, to 228 middle-class 5th graders. Based on the results, 93 good and poor comprehenders were chosen. Ss read an 800-word passage and after every 2 paragraphs received either a meaningful learning question requiring the organization of facts under given concepts, a rote learning question requiring literal recall of passage information, or no adjunct question. For most measures of text recall, good comprehenders recalled more than poor comprehenders  the type of treatment did not have a significant effect. For poor comprehenders, however, meaningful learning post-questions yielded significantly greater recall of facts from the question-related paragraphs than did rote learning post-questions or no questions. On the measure of recall of subordinate material, the performance of the poor comprehenders given meaningful learning post-questions did not differ significantly from that of the good comprehenders, regardless of the kind of treatment the latter received.",['Feedback'],NA,,"Journal, Article",,['Journal article'],NA,NA,,['USA'],NA,NA,,['Primary/elementary school'],NA,NA,,['Low ecological validity'],NA,NA,,"['10', '11']",NA,NA,,NA,NA,,NA,NA,,NA,NA,,['not_provided'],NA,NA,,NA,NA,,NA,NA,,NA,NA,,['not_provided'],The children belonged to 5th grade but it is not clear how many classes were included in the study,"['Page 5:\n[¬s]""The subjects in this experiment (N = 93) were drawn from 228 middleclass fifth-grade children residing in northern Indiana.[¬e]""']",,['Yes (Please specify)'],"['Page 9:\n[¬s]"" Hence, 1-third of the total group of subjects (both good and poor comprehenders) were given meaningful learning post questions, another third were given rote learning post questions, and the final third were given the passage without interspersed questions of any kind.[¬e]""']","Group 1 = Meaningful Learning Group 2 = Rote LEarning  Group 3 = No question (control)  As instructed by the coding team, only information for Group 1 and Group 3 will be coded. ",,Random (please specify),"['Page 6:\n[¬s]""Each good and poor comprehender was assigned in equal numbers (N = 16) to one of the experimental or control conditions by reference to a table of random numbers.[¬e]""']",NA,,Individual,"['Page 6:\n[¬s]""Each good and poor comprehender was assigned in equal numbers (N = 16) to one of the experimental or control conditions[¬e]""']",NA,,['Individual RCT'],NA,NA,,['Yes'],"['Page 5:\n[¬s]""The subjects in this experiment (N = 93) were drawn from 228 middleclass fifth-grade children residing in northern Indiana.[¬e]""', 'Page 6:\n[¬s]""Initially, all 228 children were administered the New Developmental Reading Test—Intermediate Level, Form B (Bond, Balow, and Hoyt, 1968). Only those students who scored at or above grade level on the vocabulary subtest of the above test were considered as possible subjects for the experiment. From this overall group, a subgroup of “good comprehenders” was then selected. This group included those students who scored at or up to 2 years above grade level on the Composite Comprehension Score of the above test. Additionally, a subgroup of “poor comprehenders” was chosen.""\n""Each good and poor comprehender was assigned in equal numbers (N = 16) to one of the experimental or control conditions by reference to a table of random numbers. [¬e]""']",NA,
38296661,Rienzo (2016),2016,"Powerful Learning Conversations (PLC) sought to improve the feedback that teachers give to pupils in Year 9, by training them to apply techniques used in sports coaching. It is based on the idea that feedback in sports coaching is often provided immediately after a task is performed, and delivered in a way that children are more likely to respond positively to. The training programme adopted a 'cascade' model  expert teachers were trained in the approach and then expected to disseminate their training to English and Maths teachers in their school. PLC was developed in the UK secondary school context by the Youth Sport Trust (YST) in collaboration with the University of Exeter. This feasibility pilot study was conducted in 20 schools between January 2014 and November 2014. It had two aims  (1) to explore whether the programme is feasible and ready for a full-scale trial, and (2) to explore the effect on children's attainment and other outcomes of the programme. Key conclusions include  (1) There was no evidence that the programme had an impact on English attainment  (2) The evaluation detected a positive impact on Maths attainment, but this result is not secure and we are not able to draw firm conclusions about the programme's impact  (3) Interviews and observations with teachers found the programme was implemented in different ways and with different levels of understanding in different schools. This could be avoided by ensuring the programme and its underpinning concepts are more clearly defined  (4) The intervention is not ready to be evaluated using a large-scale trial without further development. In particular, it is important that the programme is more clearly defined and less open to interpretation by teachers  and (5) If the programme is taken to a full trial it is recommended that paper-based tests are used. The pilot provided mixed evidence of promise. There was no evidence that PLC had an impact on English attainment. The evaluation did detect an impact on Maths attainment, which was equivalent to six additional months' progress over the course of a year. However, it is important to note that these results, particularly the Maths result, should be treated with caution. The evaluation did not provide evidence of a differential impact on pupils eligible for free school meals or pupils with a low prior attainment. The evaluation provided mixed evidence regarding the programme's feasibility. The training was well attended by teachers and they appeared to be engaged. Nearly all teachers who took part in the training found it interesting, engaging and relevant to their teaching, and believed that their school as a whole would benefit from the programme. The programme is likely to be affordable if it was delivered at scale.",['Feedback'],NA,,Report,,['Technical report'],NA,NA,,"['UK (Select all that apply)', 'England']",NA,NA,,['Secondary/High school'],NA,text says it was piloted in 20 primary schools but the students are in year 9 so I'm assuming this was an error,,['High ecological validity'],NA,NA,,"['13', '14']",NA,NA,,10,"['Page 13:\n[¬s]"" the randomisation of schools (to achieve a 50:50 allocation) was performed[¬e]""', 'Page 19:\n[¬s]""Allocated to intervention (schools n=10;[¬e]""']",,10,"['Page 13:\n[¬s]""the randomisation of schools (to achieve a 50:50 allocation) was performed[¬e]""', 'Page 19:\n[¬s]""Allocated to control (schools n=10;[¬e]""']",,NA,NA,,NA,NA,NA,,10,NA,,10,NA,,10,NA,,NA,NA,NA,,['No'],NA,NA,,Random (please specify),"['Page 13:\n[¬s]""The 20 schools were matched and paired according to regional location and low/high attainment based on Key Stage 2 achievement of feeder schools. Block randomisation was then used to allocate schools within each pair to either intervention or control group.[¬e]""', 'Page 6:\n[¬s]""20 schools were randomly allocated to either the intervention or a \x91business as usual\x92 control group,[¬e]""']",NA,,School - cluster,"['Page 6:\n[¬s]"" 20 schools were randomly allocated[¬e]""']",NA,,['Cluster RCT'],"['Page 12:\n[¬s]""A randomised control trial (RCT) design was used to generate potential effect size estimates.""\n""The unit of randomisation was the school, with each of the 20 schools being randomly allocated to either intervention or a waitlist control.[¬e]""']",NA,,['Yes'],"['Page 13:\n[¬s]""Each school was assigned a randomly generated number. • Schools were sorted by blocking variable (schools were grouped into four blocks with the four highest performing 2 schools in Devon and Cornwall being in one block; the remaining schools in Devon and Cornwall in a second block; the four highest performing schools in all other areas in a third block; and the remaining schools in the fourth block) and, within each block, by the random number. • The first school was randomised into either the treatment or control group. • Each subsequent school was assigned to have the opposite outcome of the previous school.[¬e]""']",NA,
37092595,Rosenthal (2006),2006,"A considerable amount of attention has focused on reading and mathematics difficulties of elementary-aged students. Significantly less attention has focused on the written expression problems of elementary-aged students, which is problematic given that approximately 6% of the school-aged population may have a disorder in written expression (Luttinger & Gertner, 2001). In an attempt to address this problem, the present study examined the effectiveness of a performance feedback intervention in improving the writing fluency skills of a group of elementary-aged students. In addition, this study attempted to examine whether varying the frequency of feedback affected the amount of improvement observed in students' writing fluency skills. A total of 42 students in three third-grade classrooms participated in the study. Each classroom was randomly assigned to one of three conditions  (a) no feedback  (b) performance feedback intervention once per week  or (c) performance feedback intervention three times per week. Growth in students' writing fluency (i.e., total words written, number of sentences, number of letter sequences) as well as spelling was assessed using a time series design. In addition, a prepost cohort design was utilized to assess changes in students' writing achievement on standardized measures. The results of this study indicated statistically significant differences in students' writing fluency growth (i.e., total number of words written) between the three conditions, with students assigned to the performance feedback intervention three times a week demonstrating more growth than the no feedback condition. No significant differences were detected on students' growth of the remaining writing fluency outcomes (i.e., number of sentences, number of letter sequences) or students' writing achievement on the standardized measures. Implications and future research directions were discussed.",['Feedback'],NA,,Dissertation,,['Dissertation or thesis'],NA,NA,,['USA'],NA,NA,,['Primary/elementary school'],NA,NA,,['Low ecological validity'],NA,NA,,"['8', '9']",NA,NA,,1,"['Page 38:\n[¬s]""The setting was one public elementary school in a mixed locale (i.e., rural and suburban) school district of New Yor[¬e]""']",,1,"['Page 38:\n[¬s]""The setting was one public elementary school in a mixed locale (i.e., rural and suburban) school district of New York.[¬e]""']",,NA,NA,,NA,NA,NA,,2,"['Page 36:\n[¬s]""Potential participants were recruited from three third-grade general education elementary classrooms [¬e]""', 'Page 37:\n[¬s]""Each classroom was randomly assigned to one of three conditions: (a) control group; (b) single feedback; and (c) multiple feedback.[¬e]""']",,1,"['Page 36:\n[¬s]""Potential participants were recruited from three third-grade general education elementary classrooms [¬e]""']",,3,"['Page 36:\n[¬s]""Potential participants were recruited from three third-grade general education elementary classrooms[¬e]""']",,NA,NA,NA,,['Yes (Please specify)'],"['Page 49:\n[¬s]""Classrooms were randomly assigned to one of three conditions: (a) no feedback condition; (b) single feedback condition; and (c) multiple feedback condition.[¬e]""']","There is 3 groups   Group 1  Control Group 2  Single Feedback Group 3  Multiple Feedback  As instructed by the coding team, only Group 1 and Group 3 will be coded for.",,Random (please specify),"['Page 37:\n[¬s]"" Each classroom was randomly assigned to one of three conditions: (a) control group; (b) single feedback; and (c) multiple feedback.[¬e]""']",NA,,Class,"['Page 37:\n[¬s]""ach classroom was randomly assigned to one of three conditions: (a) control group; (b) single feedback; and (c) multiple feedback.[¬e]""']",NA,,['Cluster RCT'],"['Page 37:\n[¬s]"" Each classroom was randomly assigned to one of three conditions: (a) control group; (b) single feedback; and (c) multiple feedback.[¬e]""']",NA,,['Yes'],"['Page 49:\n[¬s]""Classrooms were randomly assigned to one of three conditions: (a) no feedback condition; (b) single feedback condition; and (c) multiple feedback condition. Each classroom was assigned a number and a random number generator was utilized to randomly assign each classroom to a condition. Two experimental designs were used to examine whether the performance feedback intervention was effective in improving children\x92s writing fluency skills and whether varying the frequency of feedback affected the amount of improvement observed in students\x92 writing fluency skills. A time series design was used to compare the amount of growth in children\x92s writing fluency skills, as measured by CBM-WE, across the three conditions.[¬e]""']",NA,
40294951,Roussey (1992) FB,1992,"Novice writers have little control over the text composition process. Being unable to depart from focusing on their representation of the text, they cannot see the potential improvements that might be made to the overall text organization. Based on Vygotsky’s theory, two approaches might be applied to promote the development of the internal dialogue subjects could use to better control their writing  1) co-action with another writer  2) interaction with a computer, which prompts and informs. Four experimental situations were set up, resulting from the combination of two factors  the individual or dyadic working mode, and (in case of error) the production (or absence) of a response by the tutorial software concerning text structure. Children age 8 to 9 completed 6 texts (story, argumentation, and description). The expert children working individually benefited the most from the computer prompts. Contrary to usual observations, the dyads did not perform better and exchanged little information about the reasons behind their selection of a given solution. Their dialogue included very few arguments about the structural aspects of the text.","['Feedback', 'Collaborative learning']",NA,,"Journal, Article",,['Journal article'],NA,NA,,['France'],NA,NA,,['Primary/elementary school'],NA,NA,,['High ecological validity'],NA,NA,,"['8', '9']","['Page 2:\n[¬s]""cture. Children a[¬e]""']",NA,,1,"['Page 5:\n[¬s]""The data in this study were g[¬e]""']",,1,"['Page 5:\n[¬s]""The data in this study were g[¬e]""']",,1,"['Page 5:\n[¬s]""The data in this study were [¬e]""']",,NA,NA,NA,,NA,NA,,NA,NA,,3,"['Page 4:\n[¬s]""Seventy-two subjects (Forty-eight for dyads and twenty-four for solos) 8 to 9 year olds from three different fourth grade classes were divided by their respective teachers into tw[¬e]""']",,NA,NA,NA,,['Yes (Please specify)'],NA,"four conditions   (1) working in dyads or individually, and  (2) working with or without computer prompts",,"Non-random, but matched","['Page 4:\n[¬s]""re divided by their respective teachers into t[¬e]""', 'Page 5:\n[¬s]""groups on the basis of their achievement in French (both oral and written: reading vocabulary and grammar exercises, written composition): good/very good, and average/poor. The dyads were made up of two pupils from the same group, but with a slightly different level of expertise. Two children who were either close friends or showed animosity towards each other were never placed in the s[¬e]""']",Teachers of 3 classes rated their 72 students to either v.good/good or average/poor in French. 24 dyads were created my matching pupils within a category. 24 students worked solo. ,,Individual,NA,NA,,NA,NA,NA,,NA,NA,NA,
37092719,Rust (1977),1977,"The effects of immediate knowledge of results, goal setting instructions, and subjects’ sex upon answering multiple choice questions were evaluated in a group of seventh grade students. None of the main effects and none of the interactions reached significance. To further evaluate the lack of significance the actual functionality of the variables was investigated. Control subjects were asked to judge how sure they were of their answers to the test questions, and whether they had adopted the goals. The results indicated that the subjects had intrinsic knowledge of results and failed to adopt specific goals. The findings demonstrate the importance of controlling for these variables in studies of knowledge of results on academic tests.",['Feedback'],NA,,"Journal, Article",,['Journal article'],NA,NA,,['USA'],NA,NA,,['Middle school'],NA,NA,,['High ecological validity'],NA,NA,,"['12', '13']",NA,NA,,1,"['Page 2:\n[¬s]""Orange County, Virginia Intermediate School[¬e]""']",,1,"['Page 2:\n[¬s]""Orange County, Virginia Intermediate School[¬e]""']",,1,"['Page 2:\n[¬s]""Orange County, Virginia Intermediate School.[¬e]""']",,NA,NA,NA,,4,NA,,4,NA,,8,"['Page 2:\n[¬s]"" 264 to pro\xad vide equal (N - 33) cell frequencies.[¬e]""']",,NA,NA,NA,,['Yes (Please specify)'],"['Page 3:\n[¬s]""The experimental conditions (IKR and goal setting)""\n""A 2 (IKR vs no-IKR) by 2 (goal setting instructions vs try your best instructions) by 2 (male vs female) analysis of covariance was used to evaluate the influence of IKR, goal setting, and sex on Part 2 test performance.[¬e]""']","There is more than one treatment group.   Group 1  IKR + Goal  Group 2  IKR + 'Try your best' Group 3  No knowledge of results + Goal  Group 4  No knowledge of results + 'Try your best'  However, as instructed by the coding team, only Group 2 and Group 4 will be coded. ",,Random (please specify),"['Page 2:\n[¬s]""An equal number of each sex were given IKR and no-IKR. Otherwise, subjects were randomly assigned to experimental conditions.[¬e]""']",NA,,Individual,"['Page 2:\n[¬s]"" subjects were randomly assigned to experimental conditions.[¬e]""']",NA,,['Individual RCT'],"['Page 2:\n[¬s]""subjects were randomly assigned to experimental conditions.[¬e]""']",NA,,['Yes'],"['Page 2:\n[¬s]""An equal number of each sex were given IKR and no-IKR. Otherwise, subjects were randomly assigned to experimental conditions.[¬e]""']",NA,
