40398944,Roy (2019),2019,"Catch Up® Literacy is a structured one-to-one intervention that aims to improve the reading ability of struggling readers. The intervention is book-based and comprises two 15-minute sessions each week on a one-to-one basis. Students receive Catch Up® for approximately 6 to 12 months depending on individual need  once the pupil’s reading age has caught up to their chronological reading age, they leave the programme. Schools receive three half-day training sessions for the Teaching Assistants (TAs) who deliver the intervention and their designated Catch Up® Literacy coordinator in their school, as well as materials to support the one-to-one sessions. The project was a randomised controlled trial. One hundred and fifty six primary schools were randomised to receive Catch Up® Literacy or to continue with their existing practices and act as Business as Usual (BaU) control schools. All the schools nominated up to 12 pupils in Years 4 or 5 (aged eight to ten years old) who were underperforming or struggling with literacy. The purpose of this trial was to evaluate the effect of Catch Up® Literacy over existing practice - ‘Business as Usual’ - for these pupils. The evaluation sought to answer the primary research question  what is the impact of Catch Up® Literacy on Year 4 and Year 5 pupils’ reading comprehension skills as measured by the Hodder Group Reading Test (HGRT). The implementation and process evaluation drew on observations of training sessions, surveys of TAs and coordinators, and telephone interviews in Catch Up® schools and a termly activity log for the BaU control schools.","['One to one tuition', 'Phonics', 'Teaching assistants']",NA,,Report,,['Technical report'],NA,NA,,"['UK (Select all that apply)', 'England']",,['Primary/elementary school'],NA,NA,,High ecological validity,NA,NA,,"['8', '9', '10']",NA,NA,,75,"['Page 18:\n[¬s]"" 75 intervention schools[¬e]""']",,77,"['Page 18:\n[¬s]""77 control schools[¬e]""']",,152,"['Page 18:\n[¬s]""152 schools[¬e]""']",,NA,NA,NA,,NA,NA,,NA,NA,,NA,NA,,['not_provided'],Not provided,NA,,['No'],"['Page 5:\n[¬s]"" One hundred and fifty six primary schools were randomised to receive Catch Up® Literacy or to continue with their existing practices and act as Business as Usual (BaU) control schools.[¬e]""']",NA,,Random (please specify),"['Page 12:\n[¬s]""Primary schools that were not already delivering Catch Up® Literacy or Catch Up® Numeracy were eligible to take part in the trial. Schools were asked to nominate up to 12 Year 4 and Year 5 pupils, who were underperforming or struggling in literacy. There was no threshold to describe the underperformance.[¬e]""', 'Page 17:\n[¬s]""However, due to the delays in receiving pupil data from the schools, the first wave of randomisation did not take place until September 2016, followed by two more waves of randomisation, in late September and in early October 2016. In order to achieve the recruitment target, primary schools from Southend were also recruited to take part in the trial (this area was not considered in the original protocol).[¬e]""', 'Page 18:\n[¬s]""Recruitment was undertaken by Catch Up®. NFER carried out the stratified randomisation using geographical area as strata. There were seven strata (North East region, Brighton, Barrow-in-Furness, Grimsby, Hull & Immingham, Bournemouth, Plymouth and Southend). Three waves of randomisation were conducted, using a full SPSS syntax audit trail (see Appendix C).""\n""Randomisation, pupil data collection and baseline SSRT administration took place simultaneously. This arrangement meant that NFER provided the randomisation results to Catch Up® with a view to informing schools only when schools had undertaken baseline SSRT and had submitted their pupil data to Catch Up®. This resulted in three schools that did not submit the required pupil data and therefore did not know their group allocation. Of these, two were intervention schools and one was a control school. One further school was randomised due to an administrative error – this school never intended to take part and therefore was removed from the subsequent data collection. The resultant sample was 152 schools: 75 intervention schools and 77 control schools.[¬e]""']",NA,,School - cluster,"['Page 5:\n[¬s]""The project was a randomised controlled trial. One hundred and fifty six primary schools were randomised to receive Catch Up® Literacy or to continue with their existing practices and act as Business as Usual (BaU) control schools.[¬e]""']",NA,,['Cluster RCT'],"['Page 5:\n[¬s]""The project was a randomised controlled trial. One hundred and fifty six primary schools were randomised to receive Catch Up® Literacy or to continue with their existing practices and act as Business as Usual (BaU) control schools.[¬e]""']",NA,,Yes,"['Page 12:\n[¬s]""Primary schools that were not already delivering Catch Up® Literacy or Catch Up® Numeracy were eligible to take part in the trial. Schools were asked to nominate up to 12 Year 4 and Year 5 pupils, who were underperforming or struggling in literacy. There was no threshold to describe the underperformance.[¬e]""', 'Page 17:\n[¬s]""However, due to the delays in receiving pupil data from the schools, the first wave of randomisation did not take place until September 2016, followed by two more waves of randomisation, in late September and in early October 2016. In order to achieve the recruitment target, primary schools from Southend were also recruited to take part in the trial (this area was not considered in the original protocol).[¬e]""', 'Page 18:\n[¬s]""Recruitment was undertaken by Catch Up®. NFER carried out the stratified randomisation using geographical area as strata. There were seven strata (North East region, Brighton, Barrow-in-Furness, Grimsby, Hull & Immingham, Bournemouth, Plymouth and Southend). Three waves of randomisation were conducted, using a full SPSS syntax audit trail (see Appendix C).""\n""Table 4: Catch Up® Literacy: results of the randomisation""\n""Randomisation, pupil data collection and baseline SSRT administration took place simultaneously. This arrangement meant that NFER provided the randomisation results to Catch Up® with a view to informing schools only when schools had undertaken baseline SSRT and had submitted their pupil data to Catch Up®. This resulted in three schools that did not submit the required pupil data and therefore did not know their group allocation. Of these, two were intervention schools and one was a control school. One further school was randomised due to an administrative error – this school never intended to take part and therefore was removed from the subsequent data collection. The resultant sample was 152 schools: 75 intervention schools and 77 control schools.[¬e]""']",NA,
38296667,Rutt (2015),2015,"Catch Up Literacy is a structured one-to-one literacy intervention for pupils between the ages of 6 and 14 who are struggling to learn to read. It teaches pupils to blend phonemes (combine letter sounds into words), segment phonemes (separate words into letter sounds), and memorise particular words so they can be understood without needing to use phonics strategies to decode them. The intervention matches books to pupils according to their reading ability, which pupils then read to a teaching assistant (TA), so is intended to also support the development of their comprehension skills. In this evaluation, the intervention was delivered through two 15-minute sessions per week over 30 weeks at the transition from primary to secondary school, with a break for the summer holidays. Pupils were identified by their Year 6 teachers in their feeder primary schools as being struggling readers who were predicted to achieve below level 4b in reading. Each secondary school employed two part-time TAs to deliver the intervention in the last few weeks of Year 6 and after the pupils transitioned to secondary school. The TAs delivering Catch Up Literacy were supplied with detailed session plans and received three half-day training sessions led by Catch Up. The study was funded by the Education Endowment Foundation as one of 23 projects focused on literacy catch-up at the primary—secondary transition.","['Teaching assistants', 'Phonics', 'One to one tuition']",NA,,Report,,['Technical report'],NA,NA,,"['UK (Select all that apply)', 'England']",,"['Primary/elementary school', 'Secondary/High school']",NA,NA,,High ecological validity,NA,NA,,"['10', '11', '12']",NA,NA,,15,"['Page 13:\n[¬s]"" 15 schools[¬e]""']",,15,"['Page 13:\n[¬s]"" 15 schools [¬e]""']",,15,"['Page 13:\n[¬s]""15 schools[¬e]""']",,NA,NA,NA,,NA,NA,,NA,NA,,NA,NA,,['not_provided'],Not provided,NA,,['No'],NA,NA,,Random (please specify),"['Page 10:\n[¬s]""This was a multicentre, two-arm, parallel-group, pupil-randomised trial [¬e]""']",NA,,Individual,"['Page 10:\n[¬s]""This was a multicentre, two-arm, parallel-group, pupil-randomised trial [¬e]""']",NA,,['Multisite RCT'],"['Page 10:\n[¬s]""This was a multicentre, two-arm, parallel-group, pupil-randomised trial within schools in England. [¬e]""']",NA,,Yes,"['Page 14:\n[¬s]""Randomisation An Excel-based randomisation algorithm was used by NFER to allocate eligible pupils to one of three groups. These were the treatment and control groups and a reserve group if a secondary school was able to provide more than the 48 pupils requested.[¬e]""']",NA,
43099855,Ryder (2008),2008,"The aim of this study was to determine whether explicit instruction in phonemic awareness and phonemically based decoding skills would be an effective intervention strategy for children with early reading difficulties in a whole language instructional environment. Twenty-four 6- and 7-year-old struggling readers were randomly assigned to an intervention or control group, with the intervention group being divided into four groups of three children each. The intervention program was carried out over a period of 24 weeks and comprised 56 highly sequenced, semi-scripted lessons in phonemic awareness and alphabetic coding skills delivered by a teacher aide who received training and ongoing support from a remedial reading specialist. Posttests results showed that the intervention group significantly outperformed the control group on measures of phonemic awareness, pseudoword decoding, context free word recognition, and reading comprehension. Two-year follow-up data indicated that the positive effects of the intervention program were not only maintained but had generalized to word recognition accuracy in connected text.","['Phonics', 'Teaching assistants', 'Small group tuition']",NA,,"Journal, Article",,['Journal article'],NA,NA,,['New Zealand'],,['Primary/elementary school'],NA,NA,,High ecological validity,NA,NA,,"['6', '7']",NA,NA,,1,"['Page 6:\n[¬s]""The school participating in this study[¬e]""']",,1,"['Page 6:\n[¬s]""The school participating in this study[¬e]""']",,1,"['Page 6:\n[¬s]""The school participating in this study[¬e]""']",,NA,NA,NA,,4,"['Page 6:\n[¬s]""The children in the intervention and control groups\nwere distributed approximately equally across the four classrooms.[¬e]""']",,4,"['Page 6:\n[¬s]""The children in the intervention and control groups\nwere distributed approximately equally across the four classrooms.[¬e]""']",,4,"['Page 6:\n[¬s]""four separate Year 2 and Year 3 classrooms[¬e]""']",,NA,NA,NA,,['No'],NA,NA,,Random (please specify),"['Page 6:\n[¬s]""Early in the school year the 64 children in the larger pool were given the Burt\nWord Reading Test, New Zealand Revision (Gilmore, Croft, & Reid, 1981). From\nthe subgroup of 24 children whose Burt raw scores were the lowest, 12 closely\nmatched pairs were formed, and the children in each pair were randomly assigned to\nan intervention or control group.[¬e]""']",NA,,Individual,"['Page 6:\n[¬s]""The children in the intervention and control groups\nwere distributed approximately equally across the four classrooms.[¬e]""']",NA,,['Individual RCT'],"['Page 6:\n[¬s]""12 closely\nmatched pairs were formed, and the children in each pair were randomly assigned to\nan intervention or control group[¬e]""']",NA,,Yes,"['Page 6:\n[¬s]""Early in the school year the 64 children in the larger pool were given the Burt\nWord Reading Test, New Zealand Revision (Gilmore, Croft, & Reid, 1981). From\nthe subgroup of 24 children whose Burt raw scores were the lowest, 12 closely\nmatched pairs were formed, and the children in each pair were randomly assigned to\nan intervention or control group.[¬e]""']",NA,
43099897,Savage (2003),2003,"This paper evaluates three word-level teaching programmes delivered by trained Learning Support Assistants (LSAs) for Year 1 children ‘at risk’ of reading difficulties. Rime-based, phoneme-based, and ‘mixed’ (rime and phoneme-based) interventions were contrasted with controls receiving only the National Literacy Strategy. Phonological onset-rime and phoneme manipulation, spelling, and word and non-word reading were measured before and after the nine-week intervention. High rime neighbourhood (HRn) non-words (e.g. ‘dat’ – with many real word rime neighbours) and low rime neighbourhood (LRn) non-words (e.g. ‘tav’ with few real word neighbours) were used to evaluate onset-rime- or grapheme-phoneme-based decoding strategies. Results showed greater phonological onset-rime skills, lettersound knowledge and non-word reading skills in all LSA-taught intervention groups. There was no difference between the HRn and LRn non-words. The only reliable difference between the intervention groups was an advantage in phoneme blending for the rime-taught group. It was concluded that LSAs can enhance literacy development for 6-year-old poor readers. There appears to be no simple association between rime- or phoneme-based teaching intervention and changes in the size of unit used by children following interventions.","['Phonics', 'Teaching assistants']",NA,,"Journal, Article",,['Journal article'],"['Page 1:\n[¬s]""Journal of Research in Reading[¬e]""']",NA,,"['UK (Select all that apply)', 'England']",,['Primary/elementary school'],"['Page 4:\n[¬s]""Year 1[¬e]""']",NA,,High ecological validity,NA,"The intervention required moderate commitment, resources and specialism from schools especially as it was delivered by teaching assistants",,"['6', '5']","['Page 1:\n[¬s]""6-year-old poor readers[¬e]""']",NA,,9,"['Page 4:\n[¬s]""All schools in the participating Local Education Authority (equivalent to\nSchool District) were invited to participate in the study, and the ﬁrst nine schools to\nrespond positively were selected to participate[¬e]""']",,9,"['Page 9:\n[¬s]""Within each school, children were allocated to an\nintervention condition (usually nine children) or to a control condition (usually three\nchildren).[¬e]""']",,9,NA,,NA,NA,NA,,NA,NA,,NA,NA,,NA,NA,,['not_provided'],NA,NA,,['Yes (Please specify)'],"['Page 9:\n[¬s]""four intervention groups[¬e]""']",NA,,"Non-random, but matched","['Page 9:\n[¬s]""The intervention sample data was further analysed at this point to check that\na pre-test balance was achieved on all measures across the four treatment groups.""\n""there were no overall differences\nbetween the groups at pre-test""\n""Schools themselves decided on the precise composition of each of the\nsubgroups of three to four children who went together with an LSA for each intervention\nsession[¬e]""']",NA,,Individual,NA,NA,,['Cluster RCT'],"['Page 9:\n[¬s]""Each\nparticipating school was then arbitrarily allocated to one of the three intervention conditions[¬e]""']",NA,,Yes,"['Page 9:\n[¬s]""Each\nparticipating school was then arbitrarily allocated to one of the three intervention conditions[¬e]""']",NA,
43099898,Savage (2005),2005,"Evidence suggests that phonic interventions delivered by trained researchers improve early reading and spelling. This study sought to explore whether school Learning Support Assistants (LSAs) can also improve performance using these methods. Four groups (each of n = 27) of the poorest reading 6-year-old children in nine schools were screened and selected for this study. LSAs were briefly trained to administer phonic programmes as small group interventions for nine weeks. Rhyme- and phoneme-based programmes were also contrasted with controls receiving the National Literacy Strategy. At post-test, all intervention group children were better decoders, and had better phonological awareness and letter – sound knowledge than controls. The phoneme-based group had better letter – sound knowledge than the other intervention groups. It is concluded that trained Learning Support Assistants can deliver effective early preventive programmes for literacy difficulties.",['Phonics'],NA,,"Journal, Article",,['Journal article'],NA,NA,,['UK (Select all that apply)'],,['Primary/elementary school'],NA,NA,,High ecological validity,NA,NA,,"['5', '6']",NA,NA,,3,"['Page 8:\n[¬s]""Each of the three LSA-delivered interventions took place in three schools.[¬e]""']",,9,NA,,9,NA,,NA,NA,NA,,NA,NA,,NA,NA,,NA,NA,,['not_provided'],NA,NA,,['Yes (Please specify)'],"['Page 8:\n[¬s]""four interventions (‘phoneme’, ‘rhyme’, ‘mixed’ or NLS control)[¬e]""']",NA,,Random (please specify),"['Page 8:\n[¬s]""Each of the three LSA-delivered interventions took place in three schools. A quasi-\nrandom allocation of schools to programmes was undertaken: four schools whose\ncatchment areas were known to draw primarily from lower SES backgrounds were\neach allocated to separate intervention groups. After that, for the other schools the\nallocation was entirely arbitrary.[¬e]""']",NA,,School - multi-site,"['Page 9:\n[¬s]""Within each school, children were,\nhowever, entirely arbitrarily allocated to an intervention condition (nine children) or to\na control condition (three children).[¬e]""']",NA,,['Prospective QED'],"['Page 5:\n[¬s]""ll 498 children in Year 1 in these nine schools were then\nscreened by the LSAs in November and early December of Year 1, in order to\nidentify the poorest readers in each school. All children had experienced three\nmonths of Year 1 National Curriculum classes. Children had additionally received\neither one or three terms of reception (equivalent to kindergarten) class experience\ndepending on their age.[¬e]""', 'Page 8:\n[¬s]""There were 108 children recruited for the start of the intervention study\nas a result of the screening. There were 54 boys and 54 girls, who were the lowest-\nperforming children on the screening test. These 108 children were then allocated, by\nschool, to one of four interventions (‘phoneme’, ‘rhyme’, ‘mixed’ or NLS control).[¬e]""']",NA,,Yes,"['Page 8:\n[¬s]""A quasi-\nrandom allocation of schools to programmes was undertaken: four schools whose\ncatchment areas were known to draw primarily from lower SES backgrounds were\neach allocated to separate intervention groups. After that, for the other schools the\nallocation was entirely arbitrary.[¬e]""']",NA,
38296672,Sheard (2015),2015,"Units of Sound (UofS) is a computer-based programme designed to help struggling readers with their reading and spelling skills. It is a structured, multisensory programme that covers reading and spelling from simple phonics skills through to adult reading levels. It involves a high level of independent work by the student, with small groups of students supervised by a teacher or teaching assistant. Each ‘unit of sound’ (or phonic code) is introduced separately, then used in words, and then sentences. This evaluation assessed the reading ability of 786 Year 7 students in 45 schools. Students were randomly assigned within the schools to receive the intervention if they had scored below Level 4 on their Key Stage 2 SATs. The evaluation was funded by the Education Endowment Foundation as one of 23 projects focused on literacy catch-up at the primary-secondary transition for students who did not achieve Level 4 in English by the end of Key Stage 2. Two staff members in each school were identified to implement the interventions with groups of approximately five Year 7 students at a time. The designated teachers/teaching assistants in the participating schools undertook the 10-hour initial online training in UofS. Of the 45 schools that took part in the study, 31 had four sessions of additional face-to-face training and support from Dyslexia Action (DA) coaches and 14 had only online distance training and support instead of face-to-face support. Students spent one 60-minute session with the teaching assistant present and a further 30-minute session on another day working independently on the material covered with the teaching assistant. Schools varied in how they allocated the time. The intervention lasted for 18 weeks. Students were evaluated at baseline on the New Group Reading Test (NGRT) and then at follow-up on the NGRT and the Single Word Spelling Test (SWST). A light-touch process evaluation was conducted to determine teaching assistants’ and students’ perceptions of the programme. This included surveys of teaching staff and students and interviews with the DA coaches.","['Small group tuition', 'Phonics', 'Teaching assistants']",NA,,Report,,['Technical report'],NA,NA,,"['UK (Select all that apply)', 'England']",,['Secondary/High school'],NA,NA,,High ecological validity,NA,NA,,"['11', '12']",NA,NA,,45,"['Page 5:\n[¬s]""45 schools[¬e]""']",,45,"['Page 5:\n[¬s]"" 45 schools[¬e]""']",,45,"['Page 5:\n[¬s]""45 schools[¬e]""']",,NA,NA,NA,,NA,NA,,NA,NA,,NA,NA,,['not_provided'],"Individual students were eligible, not entire classes",NA,,['No'],NA,NA,,Random (please specify),"['Page 9:\n[¬s]""The IEE research team was to randomly select on average 20 students from each school who had achieved below Level 4 on the Key Stage 2 SATs in reading, and then randomly from those that met the criteria. The online (New Group Reading Test (NGRT) was to be administered to the selected students, and then they would be randomly assigned by the IEE to receive the intervention programme either during the study or as a delayed treatment at the end of the evaluation.[¬e]""']",NA,,School - multi-site,"['Page 14:\n[¬s]""Twenty students per school, randomly allocated to condition, would mean that ten students would participate in the intervention. Some schools had fewer than 20 struggling readers, so they were all randomised to condition. Some had too few staff to serve 10 students so we randomly selected twice as many as they could serve and then randomly assigned them to condition. Where a school had more than 20 struggling readers (10 out of 45 schools), the researchers randomly selected 20 of those who performed below Level 4 on their Key Stage SATs reading and then randomly allocated those individuals to UofS or control conditions.[¬e]""']",NA,,['Multisite RCT'],"['Page 9:\n[¬s]""individual level randomised multi-site trial[¬e]""']",NA,,Yes,"['Page 14:\n[¬s]"" In 35 of the 45 schools (78%), all of the students who achieved below Level 4 on the Key Stage 2 SATs in reading in Year 7 were individually randomly assigned to condition using a random number generator run by the IEE data manager.[¬e]""']",NA,
43099785,Silberberg (1973),1973,"Four groups of third grade children were exposed to different remedial reading methods for one year. Although the usual spurt in tested reading score was observed at the conclusion of that experience, a six-month follow-up indicated that the improvement in tested reading was transitory. There was not sufficient evidence to believe that any one method tried had any greater long-term effect than did any other, or that any of the methods involved in this study had a demonstrable long-range practical impact on a child's reading level.",['Phonics'],NA,,"Journal, Article",,['Journal article'],NA,NA,,['USA'],,"['Primary/elementary school', 'Independent/private school']","['Page 2:\n[¬s]""children who were entering third\ngrade in either a public or parochial school[¬e]""']",NA,,High ecological validity,NA,NA,,"['8', '9']","['Page 2:\n[¬s]""children who were entering third\ngrade[¬e]""']",NA,,NA,NA,,NA,NA,,12,"['Page 2:\n[¬s]""A total of 102 students were placed in 16\nremedial classes in 11 public schools and one\nparochial school.[¬e]""']",,NA,NA,NA,,NA,NA,,NA,NA,,NA,NA,,['not_provided'],NA,NA,,['Yes (Please specify)'],NA,"Visual-emphasis approach Auditory-Phonic Approach. Kinesthetic Approach  For the purposes of coding, the Auditory-phonic approach is coded as the intervention, and both the visual emphasis and kinesthetic approach are coded as the active controls",,Unclear,"['Page 2:\n[¬s]""A total of 102 students were placed in 16\nremedial classes in 11 public schools and one\nparochial school.""\n""The classroom teachers\nwere instructed to refer children who,\naccording to their evaluations, were reading one\nor more grades below grade placement.[¬e]""']",NA,,Not provided/ not available,NA,"There were 16 schools in this intervention, however further information pertaining to whether it was a multi-site or cluster design was not provided.",,['Prospective QED'],NA,NA,,Not applicable,"['Page 3:\n[¬s]""To minimize teacher effects, the seven teach-\ners were ranked from ""best"" to ""worst"" in\nterms of experience during the 1967-1968\nschool year. The criterion of ""best"" was a\nqualitative evaluation of observed ability to\ninteract with children in remedial classes. No\nteacher was inexperienced. Teachers were then\nallocated to method in such a way that the\nmean rank for each method was approximately\nequal.[¬e]""']",NA,
