43099864,Kirk (2009),2009,"This study evaluated the effects of an intervention program aimed to improve reading and spelling ability through instruction in morphological awareness together with other forms of linguistic awareness, including knowledge of phonology, orthography, syntax, and semantics. Sixteen children aged between 8 07 (years months) and 11 01 who demonstrated specific spelling difficulties were randomly assigned to either an experimental or a control group. Participants received an average of 19.4 sessions of intervention that focused on increasing awareness of the morphological structure of words, with particular attention to the orthographic rules that apply when suffixes are added to the base word. Participants in the experimental group made significantly greater gains in reading and spelling accuracy than those in the control group on both experimental and standardized measures of reading and spelling. The results also show that participants were able to generalize to new words what they had learned in the intervention sessions. Practitioners should consider the likely benefits of literacy intervention that focuses on developing morphological awareness in conjunction with other types of linguistic awareness.",['Phonics'],NA,,"Journal, Article",,['Journal article'],NA,NA,,['New Zealand'],,['Primary/elementary school'],"['Page 3:\n[¬s]""Participants were\naged between 8;07 and 11 ;01 at the beginning of the study.[¬e]""']","From Wiki education stage table (link in grade conversion table), this is equivalent to NZ Primary school",,High ecological validity,"['Page 4:\n[¬s]""All assessments and inter\xad\nvention sessions took place during school time in a quiet room at\nthe child’s school and were administered either by the first author\nor by one of two trained, supervised speech-language pathology\nstudents.[¬e]""']","Although the intervention was not delivered by a classroom teacher, it did take part in a school and seems as though it could be realistically adopted by teachers/schools with sufficient resources.",,"['8', '9', '10', '11']","['Page 3:\n[¬s]""Participants were\naged between 8;07 and 11 ;01 at the beginning of the study[¬e]""', 'Page 3:\n[¬s]""Participants were\naged between 8;07 and 11 ;01 at the beginning of the study[¬e]""', 'Page 3:\n[¬s]""Participants were\naged between 8;07 and 11 ;01 at the beginning of the study[¬e]""', 'Page 3:\n[¬s]""Participants were\naged between 8;07 and 11 ;01 at the beginning of the study[¬e]""']",NA,,2,"['Page 3:\n[¬s]""Participants attended two schools[¬e]""']",,2,"['Page 3:\n[¬s]""Participants attended two schools[¬e]""']",,2,"['Page 3:\n[¬s]""Participants attended two schools[¬e]""']",,NA,NA,NA,,NA,NA,,NA,NA,,NA,NA,,['not_provided'],NA,NA,,['No'],"['Page 3:\n[¬s]""Partic\xad\nipants were randomly assigned to either an experimental group\n(n = 8) who received intervention immediately or to a control group\n(n = 8) who did not receive intervention until after the experimental\ngroup had completed the intervention program[¬e]""']",NA,,Random (please specify),"['Page 3:\n[¬s]""Partic\xad\nipants were randomly assigned to either an experimental group\n(n = 8) who received intervention immediately or to a control group\n(n = 8) who did not receive intervention until after the experimental\ngroup had completed the intervention program.[¬e]""']",NA,,Individual,"['Page 3:\n[¬s]""Sixteen children took part in the study (11 boys, 5 girls). Partic\xad\nipants were randomly assigned to either an experimental group""\n""or to a control group[¬e]""']",NA,,['Individual RCT'],"['Page 3:\n[¬s]""Partic\xad\nipants were randomly assigned to either an experimental group\n(n = 8) who received intervention immediately or to a control group[¬e]""']",NA,,No/Unclear,NA,NA,
43099796,Klesius (1991),1991,"The purpose of this study was to examine the effectiveness of whole language instruction in first‐grade classrooms. Three whole language classrooms were compared with three traditional classrooms. Data were collected for end‐of‐the‐year achievement in reading comprehension, vocabulary, phonemic awareness, decoding, spelling, and writing. There were no significant differences between the two instructional programs on any of the variables. The study also examined whether there would be differences between whole language and traditional instruction in end‐of‐the‐year reading, writing, and spelling achievement for children with varying levels of incoming phonemic awareness, reading, and writing ability. Results suggested that neither program was more likely to close gaps between children high and low in these incoming abilities.",['Phonics'],NA,,"Journal, Article",,['Journal article'],NA,NA,,['USA'],,['Primary/elementary school'],NA,NA,,High ecological validity,NA,NA,,"['6', '7']",NA,NA,,1,"['Page 6:\n[¬s]""traditional school[¬e]""']",,1,"['Page 6:\n[¬s]""experimental school[¬e]""']",,2,"['Page 6:\n[¬s]""two schools participated in the study[¬e]""']",,NA,NA,NA,,3,"['Page 6:\n[¬s]""(Classes A, B, and C)[¬e]""']",,3,"['Page 6:\n[¬s]""(Classes D, E, and F)[¬e]""']",,6,"['Page 6:\n[¬s]""Six intact classes[¬e]""']",,NA,NA,NA,,['No'],NA,NA,,Unclear,NA,"Not specified, no indication as to how the schools were allocated to the treatment and control group.",,School - cluster,NA,NA,,['Prospective QED'],NA,NA,,Not applicable,NA,NA,
43099911,Kutrumbos (1993),1993,"Children who do not learn to read are at a serious disadvantage in a literate culture. The purpose of this study was to test the effectiveness of the Lindamood, Orton-Gillingham Log Program on the reading and spelling skills of older reading disabled students. The LOG Program is a multi-sensory program designed to develop a foundation in phonemic analysis skills basic to reading acquisition.  Two groups of 20 students were studied  one group received instruction based on the LOG Program while the control group received their normal remedial reading instruction for a period of three months. The control and experimental groups were intact groups  students were matched in pairs on sex, age, I.Q., and reading ability. Pre and posttesting included a measurement of reading and spelling achievement (Kaufman Test of Educational Achievement).  MANCOVA and ANCOVA were applied to determine if the LOG Program made a statistically significant difference in the reading and spelling skills of the reading delayed children in the treatment group when pretest scores were controlled. The analysis suggested that the LOG Program was effective for improving the overall reading and spelling skills of the students in the treatment group as measured by the K-TEA. Further analysis revealed the techniques of the LOG Program were effective for improving the reading decoding and spelling skills, but not the reading comprehension skills of the treatment group.  The results of this study support the literature on the effectiveness of phonemic awareness training on the acquisition of reading skills. The findings also suggest the LOG Program is an effective method for teaching reading decoding and spelling skills to the older reading delayed students in this study. Implications from the results of this study recommend inclusion of phonemic awareness training techniques in program development for beginning and delayed readers and in teacher education programs.",['Phonics'],NA,,Dissertation,,['Dissertation or thesis'],NA,NA,,['USA'],,"['Primary/elementary school', 'Middle school']",NA,NA,,High ecological validity,NA,NA,,"['9', '10', '11', '12', '13', '14']",NA,NA,,1,"['Page 150:\n[¬s]""The Academy for Learning Disabled\nChildren[¬e]""']",,2,"['Page 169:\n[¬s]""The control group was selected by the special\neducation resource teachers employed by the two\npublic schools[¬e]""']",,3,"['Page 149:\n[¬s]""Three schools in a western suburban\xad\nmetropolitan area participated in the study[¬e]""']",,NA,NA,NA,,3,"['Page 222:\n[¬s]""three\nseparate classrooms at the Academy[¬e]""']",,3,"['Page 218:\n[¬s]""two separate\nclassrooms taught in the middle school""\n""remaining three students studied were\nobserved in their elementary school. Their reading\ninstruction took place in the resource room[¬e]""']",,6,"['Page 218:\n[¬s]""two separate\nclassrooms taught in the middle school""\n""remaining three students studied were\nobserved in their elementary school. Their reading\ninstruction took place in the resource room[¬e]""', 'Page 222:\n[¬s]""three\nseparate classrooms at the Academy[¬e]""']",,NA,NA,NA,,['No'],NA,NA,,"Non-random, but matched","['Page 205:\n[¬s]""The coded list of subjects was then given to the public school teachers who selected matching students for the control group.""\n""The control and\nexperimental groups were intact groups; students\nwere matched by pairs on sex, age, I.Q., and reading\nability.[¬e]""']",NA,,Individual,NA,NA,,['Prospective QED'],NA,NA,,Not applicable,NA,NA,
47269827,Laub (1997) Ph,1997,"Children with learning disabilities have major difficulties mastering reading acquisition concepts. These concepts include decoding and comprehension. Project Read is a program that utilizes the phonetic approach with integration of whole authentic literature. The purpose of this study is to determine the effectiveness of the phonectic component of Project Read in teaching students with learning disabilities how to read. Participants were 48 students with learning disabilities. The control group consisted of 23 students who were assessed in the 1995-96 school year. The experimental group (25 students) received instruction in Project Read in the 1996-97 school year. Results indicated a significant difference between the two groups' posttest scores on phonetic skills, with the experimental group scoring measurably higher than the control group. No significant differences were found in reading comprehension. Both groups demonstrated significant growth in reading, decoding, and comprehension skills.",['Phonics'],NA,,Dissertation,,['Dissertation or thesis'],NA,NA,,['USA'],,['Primary/elementary school'],"['Page 37:\n[¬s]""The participants were selected from an elementary school[¬e]""']",NA,,High ecological validity,NA,NA,,"['8', '9', '10', '11']","['Page 38:\n[¬s]""The experimental group included 15 third grade and 10 fourth grade\nstudents.[¬e]""', 'Page 38:\n[¬s]""The mean age of the students\nwas 9.5. The range was between 8.4 and 11.2.[¬e]""', 'Page 38:\n[¬s]""The control group i""\n""There were 14 fourth grade and 9 third grade students[¬e]""']",NA,,1,"['Page 37:\n[¬s]""The participants were selected from an elementary school[¬e]""']",,1,"['Page 37:\n[¬s]""The participants were selected from an elementary school[¬e]""']",,1,"['Page 37:\n[¬s]""The participants in the control group attended the same rural school[¬e]""', 'Page 37:\n[¬s]""The participants were selected from an elementary school[¬e]""']",,NA,NA,NA,,NA,NA,,NA,NA,,NA,NA,,['not_provided'],NA,NA,,['No'],NA,NA,,Unclear,NA,NA,,Not provided/ not available,NA,NA,,['Prospective QED'],"['Page 37:\n[¬s]""The participants were selected from an elementary school in a small\nrural city in California. Each participant was identified with a learning\ndisability.""\n""The participants in the control group attended the same rural school in\nthe 1995-96 school year.[¬e]""']",A cohort of students was identified as the sample for the study.,,Not applicable,NA,NA,
43099801,Leinhardt (1981),1981,"This article documents the evaluations of the New Primary Grades Reading System (NRS). NRS was implemented in a variety of settings, and the evaluations track the implementation from the early stages of pilot testing through large-scale adoption of the program. Accompanying contrasts were made within a single school, within a school district, and across districts. This approach to evaluation followed the naturally occurring process of implementation of the innovation and provides convergent evidence as to its effects. The accumulation of evidence regarding the success of an innovation across settings allows for greater confidence in the conclusions drawn.",['Phonics'],NA,,"Journal, Article",,['Journal article'],NA,NA,,['USA'],,['Primary/elementary school'],"['Page 10:\n[¬s]""A adopted NRS for use in six of its first-grade Follow Through\nclassrooms.[¬e]""', 'Page 12:\n[¬s]""Six first-grade classrooms received\nreading instruction with NRS, and six classrooms were\ntaught with\nHoughton Mifflin.[¬e]""', 'Page 14:\n[¬s]""NRS was\nbeing implemented in six second-grade classrooms which were chosen\nbecause of their Follow Through involvement.[¬e]""', 'Page 6:\n[¬s]""four first-grade classrooms[¬e]""']",NA,,High ecological validity,NA,NA,,"['6', '7', '8']",NA,NA,,NA,NA,,NA,NA,,NA,NA,,['not_provided'],Only study 2 and 6 specify the number of schools. The other studes includethe number of classrooms but not schools,NA,,"30  (Taken from study 2, 3, 4, 5, 6)",NA,,"30  (Taken from study 2, 3, 4, 5, 6)",NA,,60,NA,,NA,NA,NA,,['No'],"['Page 4:\n[¬s]""All studies\nuse the student as the unit of analysis because all NRS classrooms were\nindividualized, and non-NRS classrooms used small groups for instruc-\ntion which were, reportedly, reconstituted frequently.[¬e]""']","There are 7 studies in this article, but it is indicated that each of the studies only had the one treatment group  ""This report includes 7 studies  Study 1 - Exclude - No data to calculate ES, Study 2 - Include, Study 3 - Include, Study 4 - Include, Study 5 - Include, Study 5A - Exclude - comparison over two years (follow up) and Study 6 - Include. Please undertake all of the data extractions, then undertake a mini-meta-analysis on these.""",,Unclear,NA,"This study looks at several studies, assignment to treatment groups was not specified in this text.",,Class,"['Page 10:\n[¬s]""A adopted NRS for use in six of its first-grade Follow Through\nclassrooms. The control group selected by the district superintendent as\ncomparable consisted of six first-grade classrooms that received reading\ninstruction with Houghton Mifflin. Here again, the evaluation followed\nthe implementation.[¬e]""', 'Page 6:\n[¬s]""being representative of the district. The seven\nHarper & Row) were used as the\nin two District A schools. These four classrooms were chosen by the\ndistrict superintendent as\nremaining first-grade classrooms within the district that received basal\ninstruction[¬e]""', 'Page 18:\n[¬s]""Census tract data from 1970 revealed similarities between District C\nand District A in terms of SES and race. By early 1976, when plans were\nbeing drawn up to establish District C as a\ncontrol, the population in\nDistrict A had begun to change. Three classrooms in two schools in\nDistrict C closely resembled those in District A with regard to SES and[¬e]""', 'Page 19:\n[¬s]""pretest information, so\nthey were used to represent the contrast group\nfor the eight District A classrooms.[¬e]""']",NA,,['Prospective QED'],NA,NA,,Not applicable,NA,NA,
43099902,Levy (1997) 1_1,1997,"In 2 studies, we compared the effectiveness of 4 different methods for acquiring initial reading vocabulary. Training emphasized similarity of word beginnings (onset plus vowel), similarity of word endings (rimes), phoneme segmentation and blending, or simple repetition of whole words. These 4 training regimes were compared with a control group given only regular classroom instruction. Beginning nonreaders acquired the trained words fastest in the onset and rime conditions, and most slowly in the whole word condition. Retention was excellent after 1 week and after 4 to 6 months, with no differences due to method of acquisition when only children who met the learning criterion were considered. Generalization to reading new words and nonwords was 40% to 50% on the first encounter for all children who acquired the entire word set during learning. In Experiment 2, the same pattern of results was obtained for delayed readers in Grade 2.",['Phonics'],NA,,"Journal, Article",,['Journal article'],NA,NA,,['Canada'],,"['Nursery school/pre-school', 'Primary/elementary school']",NA,Grade 1,,High ecological validity,NA,NA,,"['6', '7', '5']",NA,final sample between ages of 5 ys 9 ms and 7 ys 2 ms.,,2,NA,,2,NA,,2,NA,,NA,NA,NA,,NA,NA,,NA,NA,,NA,NA,,['not_provided'],NA,NA,,['Yes (Please specify)'],NA,Experiment 1.  a. Onset group as intervention (analytic phonics)  b. Business as usual control for primary outcome  c. Whole word as secondary active control. ,,Random (please specify),NA,Out of 150 children only children who read fewer than seven words on any of these screening tests were selected for the experiment. 100 children were randomly assigned to the five training groups,,Individual,NA,NA,,['Multisite RCT'],NA,NA,,No/Unclear,NA,NA,
46325682,Levy (1997) 1_2,1997,"In 2 studies, we compared the effectiveness of 4 different methods for acquiring initial reading vocabulary. Training emphasized similarity of word beginnings (onset plus vowel), similarity of word endings (rimes), phoneme segmentation and blending, or simple repetition of whole words. These 4 training regimes were compared with a control group given only regular classroom instruction. Beginning nonreaders acquired the trained words fastest in the onset and rime conditions, and most slowly in the whole word condition. Retention was excellent after 1 week and after 4 to 6 months, with no differences due to method of acquisition when only children who met the learning criterion were considered. Generalization to reading new words and nonwords was 40% to 50% on the first encounter for all children who acquired the entire word set during learning. In Experiment 2, the same pattern of results was obtained for delayed readers in Grade 2.",['Phonics'],NA,,"Journal, Article",,['Journal article'],NA,NA,,['Canada'],,"['Nursery school/pre-school', 'Primary/elementary school']",NA,83% of the children came from grade 1,,High ecological validity,NA,NA,,"['5', '6', '7']",NA,NA,,2,NA,,2,NA,,2,NA,,NA,NA,NA,,NA,NA,,NA,NA,,NA,NA,,['not_provided'],NA,NA,,['Yes (Please specify)'],NA,Experiment 1.  a. Rime group as intervention  b. Business as usual control  c. Whole word as secondary active control,,Random (please specify),NA,"Out of 150 children, only children who read fewer than seven words on any of these screening tests were selected for the experiment. 100 children were randomly assigned to the five training groups",,Individual,NA,NA,,['Multisite RCT'],NA,NA,,No/Unclear,NA,NA,
46325683,Levy (1997) 1_3,1997,"In 2 studies, we compared the effectiveness of 4 different methods for acquiring initial reading vocabulary. Training emphasized similarity of word beginnings (onset plus vowel), similarity of word endings (rimes), phoneme segmentation and blending, or simple repetition of whole words. These 4 training regimes were compared with a control group given only regular classroom instruction. Beginning nonreaders acquired the trained words fastest in the onset and rime conditions, and most slowly in the whole word condition. Retention was excellent after 1 week and after 4 to 6 months, with no differences due to method of acquisition when only children who met the learning criterion were considered. Generalization to reading new words and nonwords was 40% to 50% on the first encounter for all children who acquired the entire word set during learning. In Experiment 2, the same pattern of results was obtained for delayed readers in Grade 2.",['Phonics'],NA,,"Journal, Article",,['Journal article'],NA,NA,,['Canada'],,"['Nursery school/pre-school', 'Primary/elementary school']",NA,Grade 1 (83% children),,High ecological validity,NA,NA,,"['5', '6', '7']",NA,NA,,2,NA,,2,NA,,2,NA,,NA,NA,NA,,NA,NA,,NA,NA,,NA,NA,,['not_provided'],NA,NA,,['Yes (Please specify)'],NA,Experiment 1.  a. Phoneme group as intervention  b. Business as usual control for primary outcome  c. Whole word as secondary active control. ,,Random (please specify),NA,Out of 150 children only children who read fewer than seven words on any of these screening tests were selected for the experiment. 100 children were randomly assigned to the five training groups,,Individual,NA,NA,,['Multisite RCT'],NA,NA,,No/Unclear,NA,NA,
46325684,Levy (1997) 1_4,1997,"In 2 studies, we compared the effectiveness of 4 different methods for acquiring initial reading vocabulary. Training emphasized similarity of word beginnings (onset plus vowel), similarity of word endings (rimes), phoneme segmentation and blending, or simple repetition of whole words. These 4 training regimes were compared with a control group given only regular classroom instruction. Beginning nonreaders acquired the trained words fastest in the onset and rime conditions, and most slowly in the whole word condition. Retention was excellent after 1 week and after 4 to 6 months, with no differences due to method of acquisition when only children who met the learning criterion were considered. Generalization to reading new words and nonwords was 40% to 50% on the first encounter for all children who acquired the entire word set during learning. In Experiment 2, the same pattern of results was obtained for delayed readers in Grade 2.",['Phonics'],NA,,"Journal, Article",,['Journal article'],NA,NA,,['Canada'],,['Primary/elementary school'],NA,125 children in Grade 2,,High ecological validity,NA,NA,,"['7', '8']",NA,NA,,16,NA,,16,NA,,2,NA,,NA,NA,NA,,NA,NA,,NA,NA,,NA,NA,,['not_provided'],NA,NA,,['Yes (Please specify)'],NA, Experiment 2. Onset group as intervention (analytic phonics) with business as usual control for primary outcome and whole word as secondary active control. ,,Random (please specify),NA,"The final sample was made up of 125 children in Grade 2 classrooms from the same school system. These children came from 16 different schools that provided 400 children to be screened for admission to the study. Twenty-five children were randomly assigned to each of the five training conditions, with an approximately equal number of children assigned to each group in each school.",,Individual,NA,poorest readers in 16 schools ,,['Multisite RCT'],NA,NA,,No/Unclear,NA,NA,
46325685,Levy (1997) 1_5,1997,"In 2 studies, we compared the effectiveness of 4 different methods for acquiring initial reading vocabulary. Training emphasized similarity of word beginnings (onset plus vowel), similarity of word endings (rimes), phoneme segmentation and blending, or simple repetition of whole words. These 4 training regimes were compared with a control group given only regular classroom instruction. Beginning nonreaders acquired the trained words fastest in the onset and rime conditions, and most slowly in the whole word condition. Retention was excellent after 1 week and after 4 to 6 months, with no differences due to method of acquisition when only children who met the learning criterion were considered. Generalization to reading new words and nonwords was 40% to 50% on the first encounter for all children who acquired the entire word set during learning. In Experiment 2, the same pattern of results was obtained for delayed readers in Grade 2.",['Phonics'],NA,,"Journal, Article",,['Journal article'],NA,NA,,['Canada'],,['Primary/elementary school'],NA,NA,,High ecological validity,NA,NA,,"['7', '8']",NA,NA,,16,NA,,16,NA,,16,NA,,NA,NA,NA,,NA,NA,,NA,NA,,NA,NA,,['not_provided'],NA,NA,,['Yes (Please specify)'],NA,Experiment 2. Rime group as intervention (analytic phonics) with business as usual control for primary outcome and whole word as secondary active control.,,Random (please specify),NA,"The final sample was made up of 125 children in Grade 2 classrooms from the same school system. These children came from 16 different schools that provided 400 children to be screened for admission to the study. Twenty-five children were randomly assigned to each of the five training conditions, with an approximately equal number of children assigned to each group in each school. ",,Individual,NA,poorest readers in 16 schools,,['Multisite RCT'],NA,NA,,No/Unclear,NA,NA,
46325686,Levy (1997) 1_6,1997,"In 2 studies, we compared the effectiveness of 4 different methods for acquiring initial reading vocabulary. Training emphasized similarity of word beginnings (onset plus vowel), similarity of word endings (rimes), phoneme segmentation and blending, or simple repetition of whole words. These 4 training regimes were compared with a control group given only regular classroom instruction. Beginning nonreaders acquired the trained words fastest in the onset and rime conditions, and most slowly in the whole word condition. Retention was excellent after 1 week and after 4 to 6 months, with no differences due to method of acquisition when only children who met the learning criterion were considered. Generalization to reading new words and nonwords was 40% to 50% on the first encounter for all children who acquired the entire word set during learning. In Experiment 2, the same pattern of results was obtained for delayed readers in Grade 2.",['Phonics'],NA,,"Journal, Article",,NA,NA,NA,,['Canada'],,['Primary/elementary school'],NA,NA,,High ecological validity,NA,NA,,"['7', '8']",NA,NA,,16,NA,,16,NA,,16,NA,,NA,NA,NA,,NA,NA,,NA,NA,,NA,NA,,['not_provided'],NA,NA,,['Yes (Please specify)'],NA,Experiment 2. Phoneme group as intervention with business as usual control for primary outcome and whole word as secondary active control.,,Random (please specify),NA,"The final sample was made up of 125 children in Grade 2 classrooms from the same school system. These children came from 16 different schools that provided 400 children to be screened for admission to the study. Twenty-five children were randomly assigned to each of the five training conditions, with an approximately equal number of children assigned to each group in each school.  ",,Individual,NA,poorest readers in 16 schools,,['Multisite RCT'],NA,NA,,No/Unclear,NA,NA,
