47269796,Ewbank (2005) Ph,2005,"Within the National Literary Strategy, Wave 3 interventions are targeted at children needing more specific additional support. The present research examines the impact of one such approach, Direct Phonics (Wilson and Reason, 2003). Direct Phonics was introduced in 6 schools during 2002-2003 involving 15 teachers and 11 teaching assistants working with 16 groups of children in total. Quantitative data was obtained for a total of 40 children aged between 72 - 89 months, on the following pre and post intervention measures  receptive language as measured by the BPVS, phonological skills as measured by the PhAB, basic word recognition as measured by the WORD, various curriculum-based measures relating to letter and word knowledge. Qualitative data was obtained through discussions with the teaching staff, their observations and records and examples of the pupils' work. Curriculum-based measures drawing on the content of Direct Phonics demonstrated most convincing progress. There were also significant gains in scores on the WORD test but a calculation of effect size did not indicate that the children were 'catching up' with their age peers. It was argued that, in comparison with curriculum-based assessments, standardised tests were 'blunt' measures of progress for children in the beginning stages of literacy learning. Before the intervention, many of the children demonstrated phonological weaknesses on the PhAB test. The children's scores improved significantly on the sample of subtests administered post-intervention. Correlational analysis showed that PhAB scores were not related to children's curriculum-based measures of progress or their progress on the WORD test. BPVS as a baseline measure of receptive vocabulary was significantly related to the curriculum-based outcome measures. Case examples of two children making slow progress illustrated how their learning was a function of various factors including the pupils' motivation, language skills, their phonological profiles and their school attendance.",['Phonics'],NA,,Dissertation,,['Dissertation or thesis'],NA,NA,,"['UK (Select all that apply)', 'England']",,['Primary/elementary school'],"['Page 20:\n[¬s]""small group of 6 primary schools[¬e]""']",NA,,High ecological validity,NA,NA,,"['6', '7', '8']","['Page 108:\n[¬s]""All the pupils were from the key stage 1 department of the primary schools.\nWhen the intervention began, the mean age was 79 months; the youngest pupil\nwas 72 months and the oldest was 89 months.[¬e]""']",NA,,NA,NA,,NA,NA,,6,NA,,NA,NA,NA,,NA,NA,,NA,NA,,NA,NA,,['not_provided'],NA,NA,,['No'],NA,NA,,Regression discontinuity,"['Page 97:\n[¬s]""Four of the subtests were followed up; alliteration, rhyme,\nnaming speed pictures and nonword reading. Students who have three or more\nhighlighted (that is, low) scores on the subtests are considered to have a severe\nphonological processing deficit. For the purposes of analysis these students are[¬e]""', 'Page 98:\n[¬s]""referred to as the ""low P” group. Students with fewer than three highlighted\nscores are referred to as the “high P” group. Highlighted scores are\nstandardised scores that fall one standard deviation (15) below the mean (100);\nthat is, scores below 85.[¬e]""']",NA,,Individual,NA,NA,,['Interrupted time series QED'],NA,NA,,Not applicable,NA,NA,
43099804,Foorman (1997) 1_1,1997,"We examined the effectiveness of 3 different reading interventions in second and third graders with identified reading disabilities. Fourteen special education teachers taught 114 second and third graders either synthetic phonics, analytic phonics, or sight-word programs in the resource room 60 min a day for 1 school year. Growth in phonological and orthographic processing and word reading was compared for the 3 interventions. Facilitative effects of synthetic phonics were reduced when demographic and Verbal IQ covariates were included in the growth-curve models. However, the most significant mediator of intervention effects was initial differences in phonological and orthographic processing skills. Implications for service delivery and identification of children for special education are discussed.",['Phonics'],NA,,"Journal, Article",,['Journal article'],NA,NA,,['USA'],,['Primary/elementary school'],NA,NA,,High ecological validity,"['Page 6:\n[¬s]""The interventions took place in the resource room for 60 min daily during the 2-hr\nlanguage arts block[¬e]""']",NA,,"['7', '8', '9']",NA,NA,,NA,NA,,NA,NA,,13,NA,,NA,NA,NA,,NA,NA,,NA,NA,,NA,NA,,['not_provided'],NA,NA,,['No'],NA,EPPI Reviewer requested Treatment (Synthetic Phonics) v. Control (Sight recognition) There was a third arm within the study (Analytic phonics),,Random (please specify),NA,NA,,Individual,NA,NA,,['Prospective QED'],NA,NA,,Not applicable,NA,NA,
46325674,Foorman (1997) 1_2,1997,"We examined the effectiveness of 3 different reading interventions in second and third graders with identified reading disabilities. Fourteen special education teachers taught 114 second and third graders either synthetic phonics, analytic phonics, or sight-word programs in the resource room 60 min a day for 1 school year. Growth in phonological and orthographic processing and word reading was compared for the 3 interventions. Facilitative effects of synthetic phonics were reduced when demographic and Verbal IQ covariates were included in the growth-curve models. However, the most significant mediator of intervention effects was initial differences in phonological and orthographic processing skills. Implications for service delivery and identification of children for special education are discussed.",['Phonics'],NA,,"Journal, Article",,['Journal article'],NA,NA,,['USA'],,['Primary/elementary school'],NA,NA,,High ecological validity,NA,NA,,"['7', '8', '9']",NA,NA,,13,NA,,13,NA,,13,"['Page 4:\n[¬s]""Participants were all the second- and third-grade students with reading disabilities\n(RD) in 13 of 19 elementary schools in an urban school district in the Southwest.[¬e]""']",,NA,NA,NA,,NA,NA,,NA,NA,,NA,NA,,['not_provided'],NA,NA,,['No'],NA,This study includes 3 arms. Please code Analytic phonics as treatment group vs sight word as control group.,,"Non-random, but matched",NA,"all participating pupils had reading disability (RD), the allocation was based on their teacher volunteering to one of the programmes",,School - cluster,NA,"13 schools, 14 teachers (3 volunteered for the synthetic phonics programme, 7 volunteered for the analytic phonics programme, 4 teachers volunteered for the sight-word programme)",,['Prospective QED'],NA,"Students were assigned to condition based on specialist expertise in type of phonics instruction offered by pool of specialist teachers, each working a subset of local schools - as consequence syntheic phonic group tended to score higher VIQ",,No/Unclear,"['Page 19:\n[¬s]""Because random assignment to treatment groups was not\npossible, it is critical to consider other potential explanations for the treatment-\ngroup differences we observed.[¬e]""']",Assignment to condition seems to have occurred on the basis of specialism in technique by specialist teachers where teachers with expertise in specific technique worked in a subset of local schools,
43099811,Foorman (1998),1998,First and 2nd graders (N = 285) receiving Title 1 services received 1 of 3 kinds of classroom reading programs  direct instruction in letter–sound correspondences practiced in decodable text (direct code)  less direct instruction in systematic sound–spelling patterns embedded in connected text (embedded code)  and implicit instruction in the alphabetic code while reading connected text (implicit code). Children receiving direct code instruction improved in word reading at a faster rate and had higher word-recognition skills than those receiving implicit code instruction. Effects of instructional group on word recognition were moderated by initial levels of phonological processing and were most apparent in children with poorer initial phonological processing skills. Group differences in reading comprehension paralleled those for word recognition but were less robust. Groups did not differ in spelling achievement or in vocabulary growth. Results show advantages for reading instructional programs that emphasize explicit instruction in the alphabetic principle for at-risk children.,['Phonics'],NA,,"Journal, Article",,['Journal article'],NA,NA,,['USA'],,['Primary/elementary school'],NA,NA,,High ecological validity,NA,NA,,"['6', '7', '8']",NA,NA,,4,"['Page 3:\n[¬s]""Table 1""\n""School[¬e]""']",,6,"['Page 3:\n[¬s]""Table 1\nStudy Design and School Characteristics""\n""School[¬e]""']",,8,"['Page 3:\n[¬s]""Table 1\nStudy Design and School Characteristics""\n""School[¬e]""']",,NA,NA,NA,,13,"['Page 3:\n[¬s]""Table 1""\n""classrooms[¬e]""']",,38,"['Page 3:\n[¬s]""classrooms""\n""Table 1[¬e]""']",,51,"['Page 3:\n[¬s]""Table 1""\n""classrooms[¬e]""']",,NA,NA,NA,,['No'],NA,EPPI Reviewer requested Direct Code v. Control only. This was a three arm study,,Unclear,NA,NA,,Class,NA,NA,,['Prospective QED'],NA,NA,,Not applicable,NA,NA,
43099907,Ford (2009),2009,"Many older students and young adults leave high school without adequate reading ability to be successful as they transition into college or employment. Researchers report that the level of nearly illiteracy has reached a rate that threatens the economy and health of the nation. This study was founded on the reading stages scheme suggested by Chall that suggests that many older students struggle because they are deficient in, or lack, the phonological awareness skills, particularly phonemic awareness, that are normally acquired in Chall’s pre-reading and decoding stages of reading. This study explored the possible benefit of instruction in a specific method of decoding upon the general reading skills of struggling adolescent readers.  The study was conducted in an alternative high school using two groups with random assignment, pre- and posttests. The intervention was instruction in the backward-chaining method of decoding multisyllable words (as developed by Lewkowicz) followed by practice with computer-assisted instruction, using the Word Workout program.  Pre- and posttest results for the two groups were compared in the areas of phonological awareness, decoding, fluency, and silent-reading comprehension. Nonparametric statistical analysis using the Mann-Whitney U-test found a statistically significant difference in phonemic awareness after the intervention. There were moderate to large effect sizes found in single-word decoding and in silent-reading comprehension. Results of a posttest survey and focus group with experimental group students indicated that the participants had positive feelings about the helpfulness of the backward-chaining method to their reading.",['Phonics'],NA,,Dissertation,,['Dissertation or thesis'],NA,NA,,['USA'],,['Other educational setting (please specify)'],"['Page 60:\n[¬s]""alternative high school""\n""designed to provide a more successful school experience for nonspecial\neducation students who have had difficulty at their neighborhood high school and are\nat risk for dropping out[¬e]""']",NA,,High ecological validity,"['Page 62:\n[¬s]""Provide instruction in small groups and to individuals, using both direct\ninstruction in phonemic awareness and backward chaining of multisyllable\nwords (Appendix E) and practice with the Word Workout (Appendix A).[¬e]""']",NA,,"['14', '15', '16']",NA,NA,,1,"['Page 60:\n[¬s]""alternative high school[¬e]""']",,1,"['Page 60:\n[¬s]""alternative high school[¬e]""']",,1,"['Page 60:\n[¬s]""alternative high school[¬e]""']",,NA,NA,NA,,2,"['Page 61:\n[¬s]""two classes[¬e]""']",,2,"['Page 61:\n[¬s]""two classes[¬e]""']",,2,"['Page 61:\n[¬s]""two classes[¬e]""']",,NA,NA,NA,,['No'],"['Page 62:\n[¬s]""Divide students into experimental and control groups""\n""Divide students into experimental and control groups through a random\ndrawing.[¬e]""']",NA,,Random (please specify),"['Page 62:\n[¬s]""Divide students into experimental and control groups through a random\ndrawing.[¬e]""', 'Page 63:\n[¬s]""Students were\nrandomly assigned to an experimental or control group by drawing names.[¬e]""']",NA,,Individual,NA,NA,,['Individual RCT'],"['Page 63:\n[¬s]""Students were\nrandomly assigned to an experimental or control group[¬e]""']",NA,,Yes,"['Page 63:\n[¬s]""Students were\nrandomly assigned to an experimental or control group by drawing names.[¬e]""']",NA,
43099920,Frederickson (1996),1996,"This paper describes the development of a phonological awareness training programme (PAT) which is based on the use of analogies for learning to read and spell new words. The programme adopts a generative skills approach to reading and spelling. An evaluation study of the PAT programme took place in Buckinghamshire in 1993/4 together with a follow-up study in 1995. The results of these studies suggested that phonological awareness training which incorporates reading, spelling, and writing can form a useful part of a literacy programme for children with reading difficulties. Significant improvements in reading and spelling were found in the children who had followed the PAT programme. In addition to this, phonological skills such as rhyme fluency and spoonerisms, as measured by the Phonological Assessment Battery (PhAB), also showed significant improvement. The problems of helping children to develop syllabification skills is discussed. A description is given of our current developmental work on a rime based syllabification programme for children with specific learning difficulties.",['Phonics'],NA,,"Journal, Article",,['Journal article'],NA,NA,,"['UK (Select all that apply)', 'England']",,['Primary/elementary school'],NA,NA,,High ecological validity,NA,"No detail provided on representativness of sample The intervention requires moderate commitment and resources  from schools as it involves, training teachers in one 1 hour session, one 30 min follow-up and delivering conventional lesson plans to small groups for 20 minutes once a day four times a week for 20 weeks. Specialism is required as intervention is delivered by staff with experience in special educational needs",,"['9', '10']",NA,NA,,3,"['Page 6:\n[¬s]""school A""\n""schools B and C.[¬e]""', 'Page 7:\n[¬s]""Allocation to the PAT programme or the comparison groups was made by the\nspecial needs coordinator for each school.[¬e]""']",,3,"['Page 6:\n[¬s]""schools B and C""\n""school A[¬e]""', 'Page 7:\n[¬s]""Allocation to the PAT programme or the comparison groups was made by the\nspecial needs coordinator for each school.[¬e]""']",,3,"['Page 6:\n[¬s]""school A""\n""schools B and C.[¬e]""']",,NA,NA,NA,,NA,NA,,NA,NA,,NA,NA,,['not_provided'],Not provided,NA,,['No'],NA,EPPI comments instruct coding only first study,,"Non-random, but matched","['Page 7:\n[¬s]""Allocation to the PAT programme or the comparison groups was made by the\nspecial needs coordinator for each school. This enabled each school to readily\nincorporate the PAT programme groups into their special provision""\n""In making the allocation the\nspecial needs coordinators were asked to try to ensure an even distribution between\nthe PAT and comparison groups of subjects from each year group, with comparable\nlevels of reading difficulty and with comparable levels of special educational provision[¬e]""', 'Page 8:\n[¬s]""Table I. Pre-intervention assessment scores[¬e]""']",Students were assigned by school SEN coordinator on basis of ease of timetabling the intervention. SEN coordinator was asked to select even spread of reading performance. Table 1 shows no sig diffs in reading measures between intervention and control prior to intervention Unclear whether this should be coded as matched,,Individual,NA,NA,,"['Prospective QED', 'Regression Continuity  - naturally occurring']","['Page 5:\n[¬s]""quasi-experimental study[¬e]""']",NA,,Not applicable,NA,NA,
43099805,Fulwiler (1980),1980,"An examination of the history of reading instruction reveals that there has been a long-standing controversy over the effectiveness of the teaching of phonics. It is readily apparent from such an historical study that the enthusiasm for phonics as an effective methodology by the experts in reading instruction has waxed and waned over the years (Matthews, 1966). Only in relatively recent times, however, have carefully controlled and analytical reviews been made of the total of the respectable research evidence that deals with this issue.",['Phonics'],NA,,"Journal, Article",,['Journal article'],NA,NA,,['USA'],,['Primary/elementary school'],NA,Not stated but Grade 1 children,,High ecological validity,"['Page 5:\n[¬s]""It was not possible to make an assessment of the respective teaching\nabilities of the six teachers in this study. It was arranged, however, that\nthe three teachers in the less-intensive phonics classes were those who\nhad had more experience teaching reading than did the three teachers\nin the intensive phonics classes.[¬e]""']",NA,,"['6', '7']",NA,NA,,NA,NA,,NA,NA,,NA,NA,,['not_provided'],Not provided,NA,,3,"['Page 5:\n[¬s]""three classrooms[¬e]""']",,3,"['Page 5:\n[¬s]""three classrooms[¬e]""']",,6,"['Page 5:\n[¬s]""three classrooms""\n""three classrooms[¬e]""']",,NA,NA,NA,,['No'],"['Page 4:\n[¬s]""For this purpose two different approaches to beginning reading were\nidentified.[¬e]""']",NA,,Unclear,NA,NA,,Class,NA,NA,,NA,NA,NA,,Not applicable,NA,NA,
43099802,Gersten (1988) 1_1,1988,"This article addresses the issue of effective ways to educate low-income, educationally ""at-risk"" students in kindergarten by documenting an approach that has been effective in accelerating the academic growth of these students. First, the components of an academic kindergarten are described with a particular focus on how such a kindergarten can prepare students for the transition to first grade. The need to integrate academic activities with games and play experiences is stressed. Next, results of 2 research studies designed to evaluate both the short- and long-term benefits of academic kindergartens are presented. In the short-term study, a sample of disadvantaged students in East St. Louis who received a Direct Instruction (DI) program from kindergarten through third grade was compared with demographically similar students who received the DI program from first grade through third grade but did not receive an academic kindergarten. Results at the end of the third grade favored students who had received the academic kindergarten in reading, math, and language. In the second study, the ninth-grade achievement of the same 2 cohorts of students evaluated in Study 1 is presented. The results of this longitudinal study indicated that the benefits of an academic kindergarten were detected 6 years after the program had ended. This article concludes with a discussion of reasons why the academic kindergarten was successful  the quality of the curriculum, utilization of effective empirically derived teaching techniques, and maintenance of a high student success rate.",['Phonics'],NA,,"Journal, Article",,['Journal article'],NA,NA,,['USA'],,['Primary/elementary school'],"['Page 7:\n[¬s]""on in kinderga[¬e]""']",NA,,High ecological validity,NA,"Quasi experimental evaluation of an intervention/teaching approach already used in a kindergarten, therefore high ecological validity",,"['5', '6', '7', '8', '9']","['Page 7:\n[¬s]""e kindergarten through third-\ngrad[¬e]""', 'Page 7:\n[¬s]""e kindergarten through third-\ngrade progra[¬e]""', 'Page 7:\n[¬s]""kindergarten through third-\ngrad[¬e]""', 'Page 7:\n[¬s]""kindergarten through third-\ngrad[¬e]""', 'Page 7:\n[¬s]""kindergarten through third-\ngrad[¬e]""']",NA,,NA,NA,,NA,NA,,NA,NA,,['not_provided'],NA,NA,,NA,NA,,NA,NA,,NA,NA,,['not_provided'],NA,NA,,['No'],"['Page 7:\n[¬s]"", the Abt evaluation i""\n""luded a demographically similar quasi""\n""perimental comparison group that rec""\n""the district\'s traditional curriculum[¬e]""', 'Page 7:\n[¬s]""One\ncomparison group began kindergart""\n""197""\n""1970, one c""\n""egan kindergart[¬e]""']","As per coding instructions, will code for the cohort starting direct instruction in Kindergarten.  One treatment group - Direct Instruction One comparison group ",,Retrospective Quasi Experimental Design (QED),"['Page 7:\n[¬s]"", the Abt evaluation in-\ncluded a demographically similar quasi""\n""perimental comparison group that received\nthe district\'s traditional curriculum[¬e]""']",NA,,Not provided/ not available,NA,"Not clear whether the students in DI or comparison groups are classes, or whether division is by school",,['Retrospective QED  '],"['Page 7:\n[¬s]""The Abt evaluation intensively exam-\nined the academic progress of two cohorts\nof low-income children. The period of the\nevaluation coincided with the introduction\nof kindergarten in East St. Louis. Although\nboth cohorts of Follow Through students\nbegan school in the fall of 1970, one cohort\nbegan kindergarten and the other first[¬e]""']",NA,,Not applicable,NA,NA,
46325675,Gersten (1988) 1_2,1988,"This article addresses the issue of effective ways to educate low-income, educationally ""at-risk"" students in kindergarten by documenting an approach that has been effective in accelerating the academic growth of these students. First, the components of an academic kindergarten are described with a particular focus on how such a kindergarten can prepare students for the transition to first grade. The need to integrate academic activities with games and play experiences is stressed. Next, results of 2 research studies designed to evaluate both the short- and long-term benefits of academic kindergartens are presented. In the short-term study, a sample of disadvantaged students in East St. Louis who received a Direct Instruction (DI) program from kindergarten through third grade was compared with demographically similar students who received the DI program from first grade through third grade but did not receive an academic kindergarten. Results at the end of the third grade favored students who had received the academic kindergarten in reading, math, and language. In the second study, the ninth-grade achievement of the same 2 cohorts of students evaluated in Study 1 is presented. The results of this longitudinal study indicated that the benefits of an academic kindergarten were detected 6 years after the program had ended. This article concludes with a discussion of reasons why the academic kindergarten was successful  the quality of the curriculum, utilization of effective empirically derived teaching techniques, and maintenance of a high student success rate.",['Phonics'],NA,,"Journal, Article",,['Journal article'],NA,NA,,['USA'],,['Primary/elementary school'],"['Page 7:\n[¬s]""kindergarten through third-\ngrade progra[¬e]""']",US Kindergarten - third grade is in in elementary school,,High ecological validity,NA,"Study investigates the effects of a program already running in kindergartens and elementary schools, therefore high ecological validity ",,"['6', '7', '8', '9']","['Page 7:\n[¬s]""first- through third-grade pro[¬e]""', 'Page 7:\n[¬s]""first- through third-grade pro[¬e]""', 'Page 7:\n[¬s]""first- through third-grade pro[¬e]""', 'Page 7:\n[¬s]""first- through third-grade pro[¬e]""']",NA,,NA,NA,,NA,NA,,NA,NA,,['not_provided'],NA,NA,,NA,NA,,NA,NA,,NA,NA,,['not_provided'],NA,NA,,['No'],"['Page 7:\n[¬s]""Both cohorts received Direct Institution cur-\nriculum in reading, math, and language arts\nthrough the third grade as part of Project\nFollow Throug""\n""nd the other firs""\n""For each cohort, the Abt evaluation in-\ncluded a demographically similar quasi""\n""erimental comparison group that received\nthe district\'s traditional curriculum""\n""the other began first grade in 1970\n(with no kindergarten experien[¬e]""']","As per coding instructions, I will focus on the cohort who began in first grade (first through third grade cohort)",,Retrospective Quasi Experimental Design (QED),"['Page 7:\n[¬s]""For each cohort, the Abt evaluation""\n""luded a demographically similar quasi-""\n""rimental comparison group that received\nthe district\'s traditional curriculum[¬e]""']",NA,,Not provided/ not available,NA,"Unclear whether the cohort's represent classes, or a number of individual students from across schools or another level of assignment",,['Retrospective QED  '],NA,NA,,Not applicable,NA,NA,
