46325670,Brigman (2003) 1_3,2003,['Social and emotional learning'],NA,,"['Page 2:\n[¬s]""e Ready To\nLearn (RTL) c[¬e]""']",NA,,"['Page 3:\n[¬s]""The RTL curriculum focuses on teaching kindergarten\nstudents, in the targeted classes, prerequisite learning skills\ncited most frequently in the research literature as predictors\nof long-term school success""\n""The three key skills taught were (a) attending (paying\nattention, being on task, and following directions); (b) lis\ntening comprehension (understanding the main idea and\nknowing when and how to ask questions to clarify under\nstanding); and (c) social skills (learning to be encouraging to\nself, to increase persistence, and to increase ability to work\ncooperatively). The teachers taught the skills by using five\nteacher strategies that the research supported as being effec\ntive in teaching one or more of the targeted skills.""\n""The five teacher strategies in the RTL curriculum were\n(a) modeling-coaching-cuing (Ladd & Mize, 1993), (b)\npeer reporting (Grieger, Kaufman, & Greiger, 1976), (c)\nstorytelling (Hough, Nurss, & Wood, 1991), (d) story\nretelling (Koskinen, 1988; Morrow, 1985), and (e) the\nencouragement council (Dinkmeyer, McKay, & Dinkmeyer,\n1980). Teachers used a kit to guide implementation of the\nRTL curriculum, which contained the following materials:\nFuzzy and the Time of Great Change storybook (includes\nfive stories), teacher manual, parent newsletters, audiocas\nsettes (one for each of the five stories), and six Fuzzy Cater\npillar/Butterfly posters. The teacher manual included lesson\nplans, descriptions of the five teaching strategies to be used,\nand follow-up activities that reinforced targeted skills.[¬e]""']",NA,,"['Page 2:\n[¬s]""dies have indicated that children have dif\nficulty learning when they do not demonstrate certain prereq\nuisite learning skills that involve attention, listening compre\nhension, and social skills. The authors evaluated the Ready To\nLearn (RTL) curriculum for its effectiveness in improving the\nprerequisite learning skills[¬e]""']",NA,,['University/ researcher design'],NA,NA,,['Yes (Please specify)'],"['Page 4:\n[¬s]""Teacher training. Training in the use of the RTL curricu\nlum for the six treatment teachers involved 16 hr during three\nworkshops. In the initial full-day session, teachers received\nan understanding of the conceptual framework of RTL and a\nresearch base to support the skills and strategies used in the\nRTL curriculum. Teachers also received instruction on cur\nriculum delivery and follow-up activities. Two half-day\nworkshops were held in October and November to provide a\nreview of skills and strategies and to discuss progress and dif\nficulties with implementation of the program.[¬e]""']",NA,,"['Students', 'Teachers']","['Page 3:\n[¬s]""This study involved 260 kindergarten students wi[¬e]""', 'Page 4:\n[¬s]""t teachers can be trained to use IPS skills to\nincrease levels of facultative interpersonal conditions that\nare accompanied by mental health and cognitive student\ngains[¬e]""', 'Page 6:\n[¬s]""The focus of this project was to provide training to\nkindergarten teachers to use RTL, a curriculum that teaches\nchildren key prerequisite learning skills that are associated\nwith school success. T[¬e]""']",NA,,['Large group/class teaching (+6)'],"['Page 3:\n[¬s]""he uniqueness of this study is in its\napproach to training, the embedding and reinforcement of\nthe curriculum, and the direct teaching of a combination of\nlistening, attending, and social skills to entire classrooms of\nyoung children.[¬e]""']",NA,,['No'],NA,NA,,['No'],NA,NA,,['During regular school hours '],"['Page 3:\n[¬s]""Teachers used the RTL materials daily in treatment class\nrooms over 12 weeks. Directions for standard delivery were\nprovided for reading stories and follow-up activities.\nTeacher strategies provided in the RTL curriculum were\nused throughout the week to reinforce targeted skills during\nregular curriculum lessons. F[¬e]""']",NA,,['Class teachers'],"['Page 3:\n[¬s]""Teachers used the RTL materials daily in treatment class\nrooms over 12 weeks. Di[¬e]""']",NA,,"['Page 3:\n[¬s]""Teachers used the RTL materials daily in treatment class\nrooms over 12 weeks. D[¬e]""']",12,,"['Page 3:\n[¬s]""Teachers used the RTL materials daily in treatment class\nrooms over 12 weeks. D[¬e]""']",5,,NA,60,,"['Qualitative', 'Quantitative']","['Page 3:\n[¬s]""Teachers used a kit to guide implementation of the\nRTL curriculum, which contained the following materials:\nFuzzy and the Time of Great Change storybook (includes\nfive stories), teacher manual, parent newsletters, audiocas\nsettes (one for each of the five stories), and six Fuzzy Cater\npillar/Butterfly posters. The teacher manual included lesson\nplans, descriptions of the five teaching strategies to be used,\nand follow-up activities that reinforced targeted skills.[¬e]""', 'Page 4:\n[¬s]""Earlier studies (Aspy\n& Roebuck, 1977) have reported that teachers with high\nempathie responses correlate positively with increased stu\ndent achievement and behavior. To determine differences in\nempathie levels of responding between treatment and com\nparison teachers, I (first author) gave all 12 teachers eight\nwritten stimulus statements of students for which they\nwrote responses. Two trained judges rated the responses\nwith Carkhuff and Berenson\'s (1981) 5-point empathy\nscale, Understanding the Levels of Communication. We\nused a t test to analyze the differences between the two\ngroups\' responses; it yielded no significant difference (p =\n.529). Therefore, we had no evidence of differences in\nempathie responding of treatment- and comparison-group\nteachers at the onset of this study.""\n""To assure that the two judges rated responses similarly, we\ntrained and tested them to ensure high interrater reliability.\nThe interrater percentage of agreement coefficient was .82\non the 12 teachers\' responses to eight stimulus statements. In\nother words, out of a total of 96 responses, the two raters\nexactly matched 77 times, which was sufficient to establish\nrater consistency. Raters were blind to which teachers\' writ\nten responses were treatment or control.[¬e]""']",NA,,['No'],NA,NA,,['The developer'],NA,NA,,No,,['No/Unclear'],"['Page 3:\n[¬s]""There were approximately the same number of\nhigh-, medium-, and low-ability students in each of the 12\nclasses, as well as equal numbers of boys and girls. Th[¬e]""']",unclear for the primary outcome measures,,['Yes'],"['Page 5:\n[¬s]""We chose an analysis of covariance (ANCOVA) for sta\ntistical analysis. The covariate for the listening posttest was\nthe listening pretest.[¬e]""']",NA,,['Yes'],NA,NA,,"['Educational attainment', 'Gender']","['Page 3:\n[¬s]""here were approximately the same number of\nhigh-, medium-, and low-ability students in each of the 12\nclasses,[¬e]""', 'Page 3:\n[¬s]""There were approximately the same number of\nhigh-, medium-, and low-ability students in each of the 12\nclasses, as well as equal numbers of boys and girls. T[¬e]""']",NA,,['No'],NA,NA,
59618545,Conner (2011),2011,NA,NA,,"['Page 6:\n[¬s]""Making Choice""\n""Making[¬e]""']",NA,,"['Page 6:\n[¬s]""Making Choices was originally designed to\nprevent aggressive behavior and to promote social problem-\nsolving skills in elementary-aged children. Lessons were\nadapted for preschool-age children by group of social work\ngraduate students under the direction of social work faculty.\nThe revised content provided developmentally appropriate\nactivities for preschoolers. Although modified to use language\nand activities appropriate for 3-year-old children, the lessons\nmaintained the SIP sequence of the original curriculum. As a\npart of this systematic adaptation process, the revised interven-\ntion manual was reviewed by early childhood experts and edu-\ncators. Their feedback was incorporated in revisions.\nA family education intervention, Strong Families, was\ndeveloped by the same faculty-led work group and reviewed\nby the experts and educators as part of adaptation process. The\ngoal of the family intervention was to provide caregivers\n(hereafter, also parents) ofpreschool-aged childrenwith informa-\ntion about discipline techniques, normative child development,\nparent–child bonding, and the Making Choices program. In addi-\ntion, the intervention provided services to help families address\nbasic needs (e.g., nutrition, health care, job skills).The curriculum\nwas group-based and the sessions were usually provided at noon.\nTo encourage participation, a simple lunch was provided for par-\nticipants. Program materials were translated into Spanish for\nLatino parents, and a bilingual program specialist delivered the\nprogram to Spanish-speaking parents.[¬e]""']",NA,,"['Page 1:\n[¬s]""The purpose of this study was to pilot test a multicomponent program designed to prevent aggressive behavior in\npreschool children.[¬e]""']",NA,,['University/ researcher design'],NA,NA,,['Yes (Please specify)'],"['Page 6:\n[¬s]""Both cofacilitators attended trainings led by the university research team.""\n""The lead\nteacher had implemented portions of the Making Choices cur-\nricula during the previous ‘‘prepilot’’ year, when materials\nwere being designed and developed. A social work doctoral\nstudent provided weekly supervision for cofacilitators.""\n""Parents in the intervention group attended weekly sessions\nof the Strong Families curriculum. Each session was led by a\nsite-specific family coordinator, a trained lay person from the\ncommunity with at least 2 years experience in the position.\nSessions were 45 min in length.[¬e]""']",NA,,"['Students', 'Parents']",NA,NA,,['Large group/class teaching (+6)'],NA,NA,,['No'],NA,NA,,['Yes'],NA,NA,,['During regular school hours '],NA,NA,,['Research staff'],NA,NA,,"['Page 6:\n[¬s]""Groups met two times per week for 14 weeks,\nwith each session lasting 20 min[¬e]""']",14,,NA,2,,NA,20,,['Qualitative'],"['Page 6:\n[¬s]""The collection offidelity data served a dual purpose. Collecting\nthese data not only served to promote treatment integrity but\nalso to inform the ongoing cultural adaptation of the curricula\nand the week-to-week supervision of the intervention’s deliv-\nery. Two procedures were used to collect fidelity data from\nMaking Choices staff. First, program specialists filled out treat-\nment integrity forms after each intervention session. This form\nused a combination of closed- and open-ended questions to\nassess the extent to which lessons were implemented, to iden-\ntify the factors that influenced whether the lesson objectives\nwere achieved, and to gather recommendations for improving\nthe lessons. These data were used in weekly supervisory\nsessions to monitor implementation. In addition, the weekly\n45-min supervisory sessions also focused on helping program\nspecialists anticipate issues and adapt the subsequent lesson\ncontent to promote cultural congruence.\nAs needs for adaptation were identified, modifications were\nmade systematically, ensuring that changes did not compro-\nmise the core features of the SIP intervention. For example, a\ncentral analogy in the SIP skill-building sequence of one unit\ninvolved a turtle. However, many children in the sample lived\nin an urban environment and had never seen a turtle. Therefore,\nthe lesson was postponed until a turtle could be brought into the\nclassroom, the characteristics of a turtle explained to the chil-\ndren, and the children had a chance to observe the turtle. Les-\nson content was not changed, but the activities were augmented\nto improve cultural congruence. Similarly, one site made adap-\ntations to the lessons to account for intracultural variation. For\nexample, lessons that included illustrations or stories viewed as\nculturally relevant to Mexico were adapted by preschool staff,\nprogram staff, and the supervisor for participants from Colum-\nbia, Ecuador, Honduras, and Peru. Throughout this adaptation\nprocess, lessons maintained the core SIP focus but images and\nstories were fit to participants’ cultures of origin.\nFor the Strong Families program, the lesson content was\nadapted similarly to represent the experiences, cultural idioms,[¬e]""', 'Page 7:\n[¬s]""and colloquialisms of the participants. At the same time, staff\ngave attention to preserving the core intervention features of\nStrong Families. Process data were collected using monthly\nparent feedback forms and homework exercises, both of which\nwere tailored to lesson content. Parent feedback forms invited\nparticipants to identify helpful and unhelpful aspects of the\nintervention, and to suggest program content that might be\nhelpful to future participants. The supervisor met monthly with\neach family coordinator to review implementation, or as\nneeded when implementation issues arose[¬e]""']",NA,,['No'],NA,NA,,['The developer'],NA,NA,,No,,['Yes'],NA,see table 1,,['No'],NA,NA,,['Yes'],NA,NA,,"['Gender', 'Other (please specify)']",NA,age,,['No'],NA,NA,
59618610,Farran (2015) 1_1,2015,['Social and emotional learning'],NA,,"['Page 8:\n[¬s]""Tools of the Mind Pre-K Curriculum[¬e]""']",Tools of the Mind Pre-K Curriculum,,"['Page 71:\n[¬s]""When this study was conducted, the curriculum contained 63 separate activities, not all of which\nwere to be implemented at one time, some were prescribed for different points during the year,\nsome were to be done twice a week, some every day. Each activity had a series of 9 to 13 steps.[¬e]""']",NA,,"['Page 8:\n[¬s]""enhancing\nchildren’s self-regulation skills and their academic preparation for kindergarten when compared to\nthe usual prekindergarten curricula in use in the school system[¬e]""']",NA,,['University/ researcher design'],NA,NA,,['Yes (Please specify)'],"['Page 10:\n[¬s]""Training of teachers and practice in the curriculum occurred during the 2009-2010\nschool year.[¬e]""']",NA,,['Students'],NA,NA,,"['Small group/intensive support (3-5)', 'Large group/class teaching (+6)', 'Paired learning']",NA,NA,,['No'],NA,NA,,['No'],NA,NA,,['During regular school hours '],NA,NA,,"['Class teachers', 'Teaching assistants']",NA,NA,,"['Page 8:\n[¬s]""5-year[¬e]""']",190,,"['Page 71:\n[¬s]""not all of which were to be implemented at one time, some were prescribed for different points during the year, some were to be done twice a week, some every day""\n""the percentage of the day devoted to each of the major Tools Activity Blocks[¬e]""']",5,,"['Page 71:\n[¬s]""136 minutes[¬e]""']",136,,['Qualitative'],"['Page 71:\n[¬s]""Fidelity of Implementation[¬e]""']",NA,,['No'],NA,NA,,['The developer'],NA,NA,,No,,['Yes'],"['Page 25:\n[¬s]""Table 1: Demographics for Tools of the Mind and Comparison Children[¬e]""']",NA,,['Yes'],"['Page 74:\n[¬s]""Coefficients in the table are unstandardized regression coefficients (standard\nerrors) from multi-level regression models that account for nesting of teachers in schools and random assignment blocks. Covariates\nincluded in the models were pretest, gender, ELL and IEP status, age at pretest, and interval from pretest.[¬e]""']",NA,,['Yes'],"['Page 25:\n[¬s]""Table 1: Demographics for Tools of the Mind and Comparison Children[¬e]""']",NA,,"['Gender', 'Special educational needs', 'Other (please specify)', 'Socio-economic status']","['Page 25:\n[¬s]""Male[¬e]""', 'Page 25:\n[¬s]""IEP (=yes)""\n""IEP = individualized education plan[¬e]""', 'Page 25:\n[¬s]""White""\n""Black""\n""Hispanic""\n""Asian""\n""Multi-racial""\n""Other Minority""\n""ELL (=yes)""\n""ELL = English language learner[¬e]""', 'Page 26:\n[¬s]""Table 2: Average Age of Tools of the Mind and Comparison Children""\n""Table 3: Classroom Demographics[¬e]""', 'Page 25:\n[¬s]""FRPL = free or reduced price lunch.""\n""FRPL data were not available for Cohort 2 children.[¬e]""']",NA,,['Yes'],"['Page 36:\n[¬s]""Coefficients in the table are unstandardized regression coefficients from multi-level regression models. Covariates included in the models were\npretest, gender, ELL and IEP status, age at pretest, and interval from pretest.[¬e]""']",NA,
61218191,Farran (2015) 1_2,2015,['Social and emotional learning'],NA,,"['Page 1:\n[¬s]""Tools of the Mind Pre-K Curriculum[¬e]""']",Tools of the Mind Pre-K Curriculum,,"['Page 71:\n[¬s]""When this study was conducted, the curriculum contained 63 separate activities, not all of which\nwere to be implemented at one time, some were prescribed for different points during the year,\nsome were to be done twice a week, some every day. Each activity had a series of 9 to 13 steps.[¬e]""']",NA,,"['Page 8:\n[¬s]""enhancing\nchildren’s self-regulation skills and their academic preparation for kindergarten when compared to\nthe usual prekindergarten curricula in use in the school system[¬e]""']",NA,,['University/ researcher design'],NA,NA,,['Yes (Please specify)'],"['Page 10:\n[¬s]""Training of teachers and practice in the curriculum occurred during the 2009-2010\nschool year.[¬e]""']",NA,,['Students'],NA,NA,,['Large group/class teaching (+6)'],NA,NA,,['No'],NA,NA,,['No'],NA,NA,,['During regular school hours '],NA,NA,,"['Class teachers', 'Teaching assistants']",NA,NA,,"['Page 8:\n[¬s]""5-year[¬e]""']",190,,"['Page 71:\n[¬s]""the percentage of the day devoted to each of the major Tools Activity Blocks[¬e]""']",5,,"['Page 71:\n[¬s]""136 minutes[¬e]""']",136 ,,['Qualitative'],"['Page 71:\n[¬s]""Fidelity of Implementation[¬e]""']",NA,,['No'],NA,NA,,['The developer'],NA,NA,,No,,['Yes'],"['Page 25:\n[¬s]""Table 1: Demographics for Tools of the Mind and Comparison Children[¬e]""', 'Page 33:\n[¬s]""Table 9: Cohort 1 Standard Score Means, Standard Deviations, and Sample Sizes for the Woodcock Johnson\nAchievement Test Outcomes by Condition at Each Assessment[¬e]""']",NA,,['Yes'],"['Page 36:\n[¬s]""Coefficients in the table are unstandardized regression coefficients from multi-level regression models. Covariates included in the models were\npretest, gender, ELL and IEP status, age at pretest, and interval from pretest.[¬e]""']",NA,,['Yes'],"['Page 25:\n[¬s]""Table 1: Demographics for Tools of the Mind and Comparison Children[¬e]""', 'Page 36:\n[¬s]""Covariates included in the models were\npretest, gender, ELL and IEP status, age at pretest, and interval from pretest.[¬e]""']",NA,,"['Gender', 'Socio-economic status', 'Special educational needs', 'Other (please specify)']","['Page 25:\n[¬s]""Male[¬e]""', 'Page 25:\n[¬s]""FRPL (=yes)""\n""FRPL = free or reduced\nprice lunch[¬e]""', 'Page 25:\n[¬s]""IEP (=yes)""\n""IEP = individualized education plan[¬e]""', 'Page 25:\n[¬s]""White\nBlack\nHispanic\nAsian\nMulti-racial\nOther Minority""\n""ELL (=yes)""\n""ELL = English language learner[¬e]""']","Ethnicity/Race, ELL (=yes), Age, Classroom demographics",,['Yes'],"['Page 36:\n[¬s]""Coefficients in the table are unstandardized regression coefficients from multi-level regression models. Covariates included in the models were\npretest, gender, ELL and IEP status, age at pretest, and interval from pretest.[¬e]""']",NA,
59618549,Flook (2015),2015,NA,NA,,"['Page 1:\n[¬s]""mindfulness-based Kindness Curriculum (KC)[¬e]""']",NA,,"['Page 4:\n[¬s]""The intervention group received a 12-week mindfulness-based prosocial skills training designed for preschool-age children (see Appendix for sample lessons)""\n""The preschool KC\nis progressive in nature and incorporates children’s literature, music, and movement to teach\nand stabilize concepts related to kindness and compassion[¬e]""']",NA,,"['Page 4:\n[¬s]""KC is mindfulness practice, aimed at cultivating attention and emotion regulation, with a\nshared emphasis on kindness practices (e.g., empathy, gratitude, sharing)[¬e]""']",NA,,['University/ researcher design'],"['Page 3:\n[¬s]""All procedures\nfor this study were approved by both the university and school district research review\nboards.[¬e]""']",NA,,['Unclear/ Not specified'],NA,NA,,['Students'],NA,NA,,['Large group/class teaching (+6)'],"['Page 4:\n[¬s]""was provided universally to\nchildren as part of their standard classroom instruction during regular school hours.[¬e]""']",NA,,['No'],NA,NA,,['No'],NA,NA,,['During regular school hours '],"['Page 4:\n[¬s]""as part of their standard classroom instruction during regular school hours[¬e]""']",NA,,['External teachers'],"['Page 4:\n[¬s]""he curriculum was taught by\nexperienced mindfulness instructors[¬e]""']",NA,,"['Page 1:\n[¬s]""12-week mindfulness-based Kindness Curriculum (KC)[¬e]""', 'Page 4:\n[¬s]""over a 12-week period,\ntotaling approximately 10 hours of training.[¬e]""']",12,,"['Page 4:\n[¬s]""of two 20–30 minute lessons each week[¬e]""']",2,,"['Page 4:\n[¬s]""two 20–30 minute lessons each week""\n""totaling approximately 10 hours of training[¬e]""']",25,,['No implementation details provided.'],NA,NA,,['No'],NA,NA,,['The developer'],NA,NA,,No,,['Yes'],"['Page 6:\n[¬s]""There were no significant differences at baseline on any demographic variables or other\nmeasures assessed at baseline (i.e., delay of gratification, sharing task, TSC, DCCS, Flanker;\np > .05).[¬e]""']","but not for the main outcome, grades",,['No'],"['Page 6:\n[¬s]""For data only\nreported at post-test (i.e., school grades), independent t-tests were used comparing groups\npost-intervention.[¬e]""']",NA,,['No'],NA,NA,,NA,NA,NA,,['No'],NA,NA,
