id,pub_author,pub_year,strand_raw,strand_info,strand_CLEAN,int_name_ht,int_name_info,int_name_CLEAN,int_desc_ht,int_desc_info,int_desc_CLEAN,int_objec_ht,int_objec_info,int_objec_CLEAN,int_prov_raw,int_prov_ht,int_prov_info,int_prov_CLEAN,int_training_raw,int_training_ht,int_training_info,int_training_CLEAN,int_part_raw,int_part_ht,int_part_info,int_part_CLEAN,int_approach_raw,int_approach_ht,int_approach_info,int_approach_CLEAN,digit_tech_raw,digit_tech_ht,digit_tech_info,digital_tech_CLEAN,parent_partic_raw,parent_partic_ht,parent_partic_info,parent_partic_CLEAN,int_when_raw,int_when_ht,int_when_info,int_when_CLEAN,int_who_raw,int_who_ht,int_who_info,int_who_CLEAN,int_dur_ht,int_dur_info,int_dur_CLEAN,int_freq_ht,int_freq_info,int_freq_CLEAN,int_leng_ht,int_leng_info,int_leng_CLEAN,int_fidel_raw,int_fidel_ht,int_fidel_info,int_fidel_CLEAN,int_cost_raw,int_cost_ht,int_cost_info,int_cost_CLEAN,out_eval_raw,out_eval_ht,out_eval_info,out_eval_CLEAN,eef_eval_raw,eef_eval_CLEAN,base_diff_raw,base_diff_ht,base_diff_info,base_diff_CLEAN,comp_anal_raw,comp_anal_ht,comp_anal_info,comp_anal_CLEAN,comp_var_rep_raw,comp_var_rep_ht,comp_var_rep_info,comp_var_rep_CLEAN,comp_var_raw,comp_var_ht,comp_var_info,comp_var_CLEAN,clust_anal_raw,clust_anal_ht,clust_anal_info,clust_anal_CLEAN
43100726,Ashdown (2011) 1_1,2011,['Social and emotional learning'],NA,,"['Page 1:\n[¬s]""You Can Do\nIt! Early Childhood Education Program (YCDI),[¬e]""']",NA,,"['Page 4:\n[¬s]""The YCDI Social and Emotional\nLearning Curriculum consisting of many structured lessons\ncontaining activities that presented the emotional, behav-\nioural and attitudinal (self-talk) characteristics of conﬁ-\ndence, persistence, organisation and emotional resilience[¬e]""']",NA,,NA,Improved reading achievement & improved behaviour,,['University/ researcher design'],NA,NA,,['Yes (Please specify)'],"['Page 4:\n[¬s]""Teachers in the YCDI groups were trained in the use of the\nfollowing different components of the YCDI Early Child-\nhood program.[¬e]""']",NA,,['Students'],NA,NA,,['Large group/class teaching (+6)'],NA,NA,,['No'],NA,NA,,['No'],NA,NA,,['During regular school hours '],NA,NA,,['Class teachers'],NA,NA,,NA,2,,NA,3,,"['Page 5:\n[¬s]""Preparatory and grade 1 teachers presenting YCDI spent\n2 weeks (approximately six lessons) providing direct\ninstruction in four social and emotional competencies:\nconﬁdence, persistence, organisation and emotional resil-\nience.[¬e]""']",20 ,,['Qualitative'],NA,NA,,['No'],NA,NA,,['The developer'],NA,NA,,No,,['Yes'],NA,table 1 provides pretest scores,,['No'],NA,NA,,['Yes'],NA,NA,,['Educational attainment'],NA,NA,,['No'],NA,NA,
43100253,Bierman (2008),2008,['Social and emotional learning'],NA,,"['Page 2:\n[¬s]""e Head Start REDI (Research-based, Develop\nmentally Informed) in[¬e]""']",NA,,"['Page 2:\n[¬s]""riched intervention (Head Start REDI?Research\nbased, Developmentally Informed) or ""usual practice"" conditions. The intervention involved brief lessons, ""hands\non"" extension activities, and specific teaching strategies linked empirically with the promotion of: (a) social\nemotional competencies and (b) language development and emergent literacy skills. Take-home materials were\nprovided to parents to enhance skill development at home.[¬e]""']",NA,,"['Page 2:\n[¬s]""intervention targets the promotion\nof specific school readiness competencies in the domain\nof social-emotional development (prosocial behavior,\nemotional understanding, self-regulation, and aggres\nsion control) and cognitive development (language\nand emergent literacy skills).[¬e]""']",NA,,['University/ researcher design'],NA,NA,,['Yes (Please specify)'],"['Page 7:\n[¬s]""Training and professional development support. Teachers\nreceived detailed manuals and kits containing all materi\nals needed to implement the intervention. A 3-day\nprofessional training was conducted in August, prior\nto initiating the intervention, and a 1-day ""booster""""\n""training session was conducted in January. Teachers\nalso received weekly mentoring support provided by\nlocal educational consultants (""REDI trainers""), experi\nenced master teachers who were supervised by two\nproject-based senior educational trainers.[¬e]""']",NA,,['Students'],NA,NA,,['Large group/class teaching (+6)'],NA,NA,,['No'],NA,NA,,['Yes'],NA,NA,,"['During regular school hours ', 'Other (please specify)']","['Page 7:\n[¬s]""Parent take-home materials. Three ""take-home""\npackets were mailed to parents during the course of\nthe year, each containing a modeling videotape, with\nparenting tips and learning activities to use at home.\nIn addition, the PATHS curriculum included hand\nouts for parents, with suggestions for home activities.\nChildren also took home letter stickers and compli\nment pages to prompt their parents to ask them about\ntheir[¬e]""']",NA,,['Class teachers'],NA,NA,,NA,NA,,"['Page 6:\n[¬s]""o practice the target skills with\nteacher support. Teachers taught one PATHS lesson\nand conducted one extension activity each week.[¬e]""', 'Page 7:\n[¬s]""The cur\nriculum included two books per week, which were\nscripted with interactive questions""\n""Teachers were asked to use a 10- to 15-min Sound\nGame activity at least three times per week.\nIn addition, teachers were provided with a de[¬e]""']",1,,NA,60,,['Quantitative'],NA,NA,,['Yes (Please add details)'],NA,Part of costs,,['The developer'],NA,NA,,No,,['Yes'],"['Page 10:\n[¬s]""and center site (e.g., central or southeastern Pennsyl\nvania), cohort, and intervention status w""\n""as Level 2 covariates in each of these m""\n""significant (p < .05) pretreatment interven""\n""group differences emerged on the 11 m""\n""child skills or the 6 measures of child[¬e]""', 'Page 9:\n[¬s]""To examine preintervention differences between\nthe intervention and the comparison groups, hierar\nchical linear models (HLM) were estimated, account\ning for the nesting of children within classrooms.\nChild sex and race were included as Level 1 covariates[¬e]""']",NA,,['Yes'],"['Page 10:\n[¬s]""ntervention status were included\nLevel 2 covariates. Preintervention scores were ava\nable for all these measures and also were included\nLevel 1 covar""\n""The results of these HLM are summarized\nTable 3[¬e]""']",NA,,['Yes'],NA,within the HLM,,"['Educational attainment', 'Gender', 'Other (please specify)']","['Page 11:\n[¬s]""Language skills""\n""Control group""\n""Pre""\n""Intervention group""\n""Pre[¬e]""', 'Page 9:\n[¬s]""hild sex and race were included as Level 1 covariates[¬e]""', 'Page 10:\n[¬s]"".05) pretreatment intervention-control\ngroup differences emerged on the 11 measures of\nchild skills or the 6 measures of child behavior for\nwhich pretreatment scores were[¬e]""', 'Page 12:\n[¬s]""Social-emotional behaviors""\n""Pre""\n""Intervention group\nPre[¬e]""']",child behaviour ethnicity socio-emotional behaviour,,['No'],NA,NA,
59618542,Brigman (1999),1999,NA,NA,,"['Page 3:\n[¬s]""RTL Program""\n""Ready To Learn (RTL),[¬e]""']",NA,,"['Page 3:\n[¬s]""Ready To Learn (RTL), which focuses on teaching children ages 4-5 years a combination of learning skills and social skills in the regular classroom by the regular class- room teacher""\n""was based on integrating learning skills and social skills into the regular curriculum through the use of stories and five teacher strate- gies""\n""The\nthree targeted skill areas were (a) listening comprehension\nskills (including story structure), (b) attending skills, and\n(c) social skills. The skills were taught with five teacher\nstrategies that the research supported as being effective in\nteaching one or more of the targeted skills.""\n""The five strategies used were modeling-coaching-cuing""\n"", positive peer reporting""\n""student story telling""\n""), student story retelling""\n""and the encouragement council""\n""To implement\nRTL, each treatment teacher used a kit that included story-\nbooks that introduced the learning-social skills to the chil-\ndren, audiotapes of the stories, and a teacher manual.[¬e]""']",NA,,"['Page 3:\n[¬s]""helping children develop the\nskills needed for school success into practice. Our purpose\nin this study was to determine the effects of a particular cur-\nriculum, Ready To Learn (RTL)[¬e]""']",NA,,['University/ researcher design'],NA,NA,,['Yes (Please specify)'],"['Page 3:\n[¬s]""Teacher training. Teacher training for the five treatment""\n""group teachers and their five assistants included two 7-hr\nworkshops in September""\n"". The workshops provided the\nteachers with an understanding of the conceptual frame-\nwork of RTL, the research base supporting the selected\nlearning-social skills, and strategies used in teaching the\nskills. We conducted three half-day workshops in Novem-\nber, January, and March to provide a review of the skills and\nstrategies and to discuss progress and difficulties in imple-\nmenting the program.[¬e]""']",NA,,['Students'],NA,NA,,['Large group/class teaching (+6)'],"['Page 3:\n[¬s]""the systematic approach to teaching the critical skills in the regular classroom,""\n""the use of a format\nthat can be integrated easily into the ongoing curriculum.[¬e]""']",although not specified,,['Yes'],"['Page 3:\n[¬s]""To implement\nRTL, each treatment teacher used a kit that included story-\nbooks that introduced the learning-social skills to the chil-\ndren, audiotapes of the stories[¬e]""']",NA,,['No'],"['Page 3:\n[¬s]""To implement\nRTL, each treatment teacher used a kit that included story-\nbooks that introduced the learning-social skills to the chil-\ndren, audiotapes of the stories[¬e]""']",NA,,['During regular school hours '],"['Page 3:\n[¬s]""Embedding the teaching of those skills within the exist-\ning curriculum is one of the keys for providing that students\nreceive enough practice for skill development[¬e]""']",NA,,['Class teachers'],"['Page 3:\n[¬s]""(a) the systematic approach to teaching the critical skills in the regular classroom,""\n""(c) the use of a format that can be integrated easily into the ongoing curriculum.""\n""The teachers in the treatment classes used the RTL mate-\nrials, activities, and teacher strategies in a structured format[¬e]""']",NA,,"['Page 3:\n[¬s]""an average of 2 hr per week for 12 weeks before the\nposttest and 24 weeks before the post-posttest.[¬e]""']",12,,NA,NA,,"['Page 3:\n[¬s]""The teachers in the treatment classes used the RTL mate-\nrials, activities, and teacher strategies in a structured format\nan average of 2 hr per week for 12 weeks[¬e]""']",120,,['Qualitative'],"['Page 3:\n[¬s]""Monitoring level of RTL program implementation. We\ndetermined a minimum level of RTL program implementa-\ntion and communicated it to the participating teachers and\nteacher assistants. The minimum level of implementation\ncontained specific frequencies for the use of five teaching\nstrategies such as student story telling and materials such as\nreading the five stories from the RTL curriculum. The level\nof implementation was translated into a weekly monitoring\nreport form that the treatment teachers completed. Overall,\nthe level of implementation was then monitored in the fol-\nlowing four ways:""\n""1. At the beginning of this study (September), we con-\nducted two 7-hr workshops to train teachers and their teach-\ning assistants in the use of the RTL teaching strategies and\nmaterials. D[¬e]""', 'Page 4:\n[¬s]""2. The site supervisor randomly observed the treatment\nteachers weekly to monitor their use of the RTL curriculum.""\n""3. We conducted scheduled classroom observation ses-\nsions with each treatment teacher once per week throughout\nthe treatment period. After each 30-min observation, the\ntreatment teacher and one of the authors would have a 15-\n30 min conference to discuss program implementation.""\n"". A series of 3 half-day follow-up workshops were con-\nducted (November, January, and March). At these work-\nshops the teachers and authors discussed impleme,ntation\nissues and received feedback on level of implementation.\nStudent progress in developing the targeted skills also was\ndiscussed. A review of the teaching strategies and use of\nRTL materials were included. A""\n""To summarize, the initial demonstration of competency in\nthe teaching strategies and use of RTL materials, weekly\nclassroom observations by site supervisor and authors, and\nthe follow-up workshops indicated consistently that the\nteachers were implementing the RTL program as designed.[¬e]""']",NA,,['No'],NA,NA,,['The developer'],NA,NA,,No,,['No/Unclear'],"['Page 6:\n[¬s]""able 1.-Means and Standard Deviations of Dependent Variables, by Group[¬e]""']",no stats test on pre-test scores,,['Yes'],"['Page 3:\n[¬s]""Any differences be-\ntween groups at the beginning of the study were controlled\nfor by the statistical analysis on the data (multivariate analy-\nsis of variance).[¬e]""', 'Page 5:\n[¬s]""The effect of\ninterest was the Time x Group interaction, because that\neffect would represent the differences in performance\ntrends.[¬e]""']",NA,,['Yes'],NA,NA,,"['Gender', 'Other (please specify)']","['Page 3:\n[¬s]""here were approxi-\nmately equal numbers of boys and girls in both treatment\nand comparison classes.[¬e]""', 'Page 3:\n[¬s]""or all classes, the ethnic make-up\nwas approximately 95% Black and 5% White""\n""Each class\nhad approximately equal numbers of children, a certified\npreschool teacher, and a teacher’s assistant. T[¬e]""']",ethnicity,,['No'],NA,NA,
43100259,Brigman (2003) 1_1,2003,['Social and emotional learning'],NA,,"['Page 2:\n[¬s]""e Ready To\nLearn (RTL) curriculum f[¬e]""']",Ready To Learn (RTL) curriculum,,"['Page 3:\n[¬s]""The five teacher strategies in the RTL curriculum were (a) modeling-coaching-cuing (Ladd & Mize, 1993), (b) peer reporting (Grieger, Kaufman, & Greiger, 1976), (c) storytelling (Hough, Nurss, & Wood, 1991), (d) story retelling (Koskinen, 1988; Morrow, 1985), and (e) the encouragement council (Dinkmeyer, McKay, & Dinkmeyer, 1980).""\n""eachers used a kit to guide implementation of the\nRTL curriculum, which contained the following materials:\nFuzzy and the Time of Great Change storybook (includes\nfive stories), teacher manual, parent newsletters, audiocas\nsettes (one for each of the five stories), and six Fuzzy Cater\npillar/Butterfly posters.[¬e]""']",NA,,"['Page 2:\n[¬s]""The authors evaluated the Ready To\nLearn (RTL) curriculum for its effectiveness in improving the\nprerequisite learning skills in 12 kindergarten classes (260 stu\ndents) in 3 demographically similar elementary schools.[¬e]""']","To teach prerequisite learning and social skills, with the goal of improving those skills and school achievement.",,['School or group of schools'],NA,NA,,['Yes (Please specify)'],"['Page 4:\n[¬s]""Training in the use of the RTL curricu lum for the six treatment teachers involved 16 hr during three workshops. I""\n""In the initial full-day session, teachers received\nan understanding of the conceptual framework of RTL and a\nresearch base to support the skills and strategies used in the\nRTL curriculum. Teachers also received instruction on cur\nriculum delivery and follow-up activities. Two half-day\nworkshops were held in October and November to provide a\nreview of skills and strategies and to discuss progress and dif\nficulties with implementation of the program.[¬e]""']",NA,,['Students'],NA,NA,,['Large group/class teaching (+6)'],"['Page 3:\n[¬s]""The RTL curriculum focuses on teaching kindergarten\nstudents, in the targeted classes, prerequisite learning skills[¬e]""']",NA,,['No'],NA,NA,,['No'],NA,NA,,['During regular school hours '],NA,NA,,['Class teachers'],"['Page 4:\n[¬s]""Earlier studies (Aspy\n& Roebuck, 1977) have reported that teachers with high\nempathie responses correlate positively with increased stu\ndent achievement and behavior. To determine differences in\nempathie levels of responding between treatment and com\nparison teachers, I (first author) gave all 12 teachers eight\nwritten stimulus statements of students for which they\nwrote responses. Two trained judges rated the responses\nwith Carkhuff and Berenson\'s (1981) 5-point empathy\nscale, Understanding the Levels of Communication. We\nused a t test to analyze the differences between the two\ngroups\' responses; it yielded no significant difference (p =\n.529). Therefore, we had no evidence of differences in\nempathie responding of treatment- and comparison-group\nteachers at the onset of this study.""\n""To assure that the two judges rated responses similarly, we\ntrained and tested them to ensure high interrater reliability.\nThe interrater percentage of agreement coefficient was .82\non the 12 teachers\' responses to eight stimulus statements. In\nother words, out of a total of 96 responses, the two raters\nexactly matched 77 times, which was sufficient to establish\nrater consistency. Raters were blind to which teachers\' writ\nten responses were treatment or control.[¬e]""']",NA,,NA,12,,NA,5,,NA,60,,['No implementation details provided.'],NA,NA,,['No'],NA,NA,,['The developer'],NA,NA,,No,,['No/Unclear'],"['Page 3:\n[¬s]""here were approximately the same number of\nhigh-, medium-, and low-ability students in each of the 12\nclasses, as well as equal numbers of boys and girls. T[¬e]""']",unclear for the pre-test on the variable for the primary outcome,,['Yes'],"['Page 5:\n[¬s]""We chose an analysis of covariance (ANCOVA) for sta\ntistical analysis. The covariate for the listening posttest was\nthe listening pretest""\n""To adjust for preexisting differences\nbetween groups on the dependent variables, we used\nANCOVA (Campbell & Stanley, 1963).[¬e]""']",NA,,['Yes'],"['Page 3:\n[¬s]""ix of the classes\nreceived the treatment, and 6 of them acted as comparison\ngroups. There were approximately the same number of\nhigh-, medium-, and low-ability students in each of the 12\nclasses, as well as equal numbers of boys and girls. Th[¬e]""']",NA,,"['Gender', 'Educational attainment']","['Page 3:\n[¬s]""There were approximately the same number of\nhigh-, medium-, and low-ability students in each of the 12\nclasses, as well as equal numbers of boys and girls. Th[¬e]""', 'Page 3:\n[¬s]""There were approximately the same number of\nhigh-, medium-, and low-ability students in each of the 12\nclasses, as well as equal numbers of boys and girls. T[¬e]""']",NA,,['No'],NA,NA,
46325669,Brigman (2003) 1_2,2003,['Social and emotional learning'],NA,,"['Page 2:\n[¬s]""e Ready To\nLearn (RTL) c[¬e]""']",NA,,"['Page 3:\n[¬s]""The treatment involved in this study incorporated what is known about prerequisite learning skills, school success, and effective teacher strategies that are linked to increased social and academic performance in young children. With in this framework, Brigman, Lane, and Lane (1994) devel oped and evaluated the Ready To Learn curriculum. The RTL curriculum focuses on teaching learning and social skills as part of the regular classroom curriculum; specific teaching strategies are used to reinforce attending, listening, and social skills each day throughout the year. This embed ded approach is key for providing students with enough practice for skill development, and it allows for easy inte gration into the ongoing curriculum. The RTL model uses a tell, show, do, and coach approach that has been supported as a highly effective mode of instruction""\n""The RTL curriculum focuses on teaching kindergarten\nstudents, in the targeted classes, prerequisite learning skills\ncited most frequently in the research literature as predictors\nof long-term school success""\n""The three key skills taught were (a) attending (paying\nattention, being on task, and following directions); (b) lis\ntening comprehension (understanding the main idea and\nknowing when and how to ask questions to clarify under\nstanding); and (c) social skills (learning to be encouraging to\nself, to increase persistence, and to increase ability to work\ncooperatively). The teachers taught the skills by using five\nteacher strategies that the research supported as being effec\ntive in teaching one or more of the targeted skills.""\n""The five teacher strategies in the RTL curriculum were\n(a) modeling-coaching-cuing (Ladd & Mize, 1993), (b)\npeer reporting (Grieger, Kaufman, & Greiger, 1976), (c)\nstorytelling (Hough, Nurss, & Wood, 1991), (d) story\nretelling (Koskinen, 1988; Morrow, 1985), and (e) the\nencouragement council (Dinkmeyer, McKay, & Dinkmeyer,\n1980). Teachers used a kit to guide implementation of the\nRTL curriculum, which contained the following materials:\nFuzzy and the Time of Great Change storybook (includes\nfive stories), teacher manual, parent newsletters, audiocas\nsettes (one for each of the five stories), and six Fuzzy Cater\npillar/Butterfly posters. The teacher manual included lesson\nplans, descriptions of the five teaching strategies to be used,\nand follow-up activities that reinforced targeted skills.[¬e]""']",NA,,"['Page 2:\n[¬s]""dies have indicated that children have dif\nficulty learning when they do not demonstrate certain prereq\nuisite learning skills that involve attention, listening compre\nhension, and social skills. The authors evaluated the Ready To\nLearn (RTL) curriculum for its effectiveness in improving the\nprerequisite learning skills[¬e]""']",NA,,['University/ researcher design'],NA,NA,,['Yes (Please specify)'],"['Page 4:\n[¬s]""Teacher training. Training in the use of the RTL curricu\nlum for the six treatment teachers involved 16 hr during three\nworkshops. In the initial full-day session, teachers received\nan understanding of the conceptual framework of RTL and a\nresearch base to support the skills and strategies used in the\nRTL curriculum. Teachers also received instruction on cur\nriculum delivery and follow-up activities. Two half-day\nworkshops were held in October and November to provide a\nreview of skills and strategies and to discuss progress and dif\nficulties with implementation of the program.[¬e]""']",NA,,"['Students', 'Teachers']","['Page 3:\n[¬s]""This study involved 260 kindergarten students wi[¬e]""', 'Page 6:\n[¬s]""The focus of this project was to provide training to\nkindergarten teachers to use RTL, a curriculum that teaches\nchildren key prerequisite learning skills that are associated\nwith school success. T[¬e]""']",NA,,['Large group/class teaching (+6)'],"['Page 3:\n[¬s]""the direct teaching of a combination of\nlistening, attending, and social skills to entire classrooms of\nyoung children.[¬e]""']",NA,,['No'],NA,NA,,['No'],NA,NA,,['During regular school hours '],"['Page 3:\n[¬s]""The\nRTL curriculum focuses on teaching learning and social\nskills as part of the regular classroom curriculum[¬e]""']",NA,,['Class teachers'],"['Page 4:\n[¬s]""Training in the use of the RTL curricu\nlum for the six treatment teachers involved 16 hr during three\nworkshops. I[¬e]""']",NA,,"['Page 3:\n[¬s]""Teachers used the RTL materials daily in treatment class\nrooms over 12 weeks. D[¬e]""']",12,,"['Page 3:\n[¬s]""Teachers used the RTL materials daily in treatment class\nrooms over 12 weeks. D[¬e]""']",5,,NA,60,,['Quantitative'],"['Page 4:\n[¬s]""Earlier studies (Aspy\n& Roebuck, 1977) have reported that teachers with high\nempathie responses correlate positively with increased stu\ndent achievement and behavior. To determine differences in\nempathie levels of responding between treatment and com\nparison teachers, I (first author) gave all 12 teachers eight\nwritten stimulus statements of students for which they\nwrote responses. Two trained judges rated the responses\nwith Carkhuff and Berenson\'s (1981) 5-point empathy\nscale, Understanding the Levels of Communication. We\nused a t test to analyze the differences between the two\ngroups\' responses; it yielded no significant difference (p =\n.529). Therefore, we had no evidence of differences in\nempathie responding of treatment- and comparison-group\nteachers at the onset of this study.""\n""To assure that the two judges rated responses similarly, we\ntrained and tested them to ensure high interrater reliability.\nThe interrater percentage of agreement coefficient was .82\non the 12 teachers\' responses to eight stimulus statements. In\nother words, out of a total of 96 responses, the two raters\nexactly matched 77 times, which was sufficient to establish\nrater consistency. Raters were blind to which teachers\' writ\nten responses were treatment or control.[¬e]""']",NA,,['No'],NA,NA,,['The developer'],NA,NA,,No,,['No/Unclear'],"['Page 3:\n[¬s]""There were approximately the same number of\nhigh-, medium-, and low-ability students in each of the 12\nclasses, as well as equal numbers of boys and girls. Th[¬e]""']",not for primary outcome ,,['Yes'],"['Page 5:\n[¬s]""We chose an analysis of covariance (ANCOVA) for sta\ntistical analysis. The covariate for the listening posttest was\nthe listening pretes[¬e]""']",NA,,['Yes'],NA,NA,,"['Educational attainment', 'Gender']","['Page 3:\n[¬s]""here were approximately the same number of\nhigh-, medium-, and low-ability students in each of the 12\nclasses, as well as equal numbers of boys and girls. Th[¬e]""', 'Page 3:\n[¬s]""There were approximately the same number of\nhigh-, medium-, and low-ability students in each of the 12\nclasses, as well as equal numbers of boys and girls. T[¬e]""']",NA,,['No'],NA,NA,
