38296611,Dorsett (2014),2014,"['Metacognition and self-regulation', 'Parental engagement', 'Extending school time']",NA,KS2 MathEng Combined (inCAS) - Metacognition PETT,,"Pre-test and 6 months delayed post-test age-equivalent score. Combination of three InCAS measures  reading, general maths and mental arithmetic. Combined literacy and numeracy score =(reading score + (general maths score + mental arithmetic score)/2)/2.",,"['Toolkit primary outcome', 'Other outcome']",,-0.141,,0.283,,Combined subjects,,NA,,NA,,NA,,NA,,NA,,NA,,-0.6957,,0.4137,,Primary outcome,,['Sample: All'],,With business as usual,,['Post-test adjusted for baseline attainment AND clustering'],,['Test type: Standardised test '],,KS2 Reading (InCAS) - Metacognition PETT,,"Pre-test and 6 months delayed post-test age-equivalent score. InCAS measure of attainment in reading (word recognition, word decoding, comprehension and spelling).",,['Reading primary outcome'],,-0.069,,0.249,,Literacy: reading comprehension,,NA,,NA,,NA,,NA,,NA,,NA,,-0.557,,0.419,,Secondary outcome(s),,['Sample: All'],,With business as usual,,['Post-test adjusted for baseline attainment AND clustering'],,['Test type: Standardised test '],,NA,,NA,,NA,,NA,,NA,,NA,,NA,,NA,,NA,,NA,,NA,,NA,,NA,,NA,,NA,,NA,,NA,,NA,,NA,,KS2 Maths (InCAS) - Metacognition PETT,,Pre-test and 6 months delayed post-test age-equivalent score. InCAS measure of attainment in general mathematics. ,,['Mathematics primary outcome'],,-0.167,,0.219,,Mathematics,,NA,,NA,,NA,,NA,,NA,,NA,,-0.5962,,0.2622,,Secondary outcome(s),,['Sample: All'],,With business as usual,,['Post-test adjusted for baseline attainment AND clustering'],,['Test type: Standardised test '],,NA,,NA,,NA,,NA,,NA,,NA,,NA,,NA,,NA,,NA,,NA,,NA,,NA,,NA,,NA,,NA,,NA,,NA,,NA,,NA,,NA,,NA,,NA,,NA,,NA,,NA,,NA,,NA,,NA,,NA,,NA,,NA,,NA,,NA,,NA,,NA,,NA,,NA,
40117126,Dunn (1996),1996,['Extending school time'],NA,TAAS: Reading (RC)-Extend School,,Texas Assessment of Academic Skills (TAAS)  Reading scores from Reading Cohort (samples individually matched on reading scaled scores)– Year Round Education compared to traditional Calendar programs .,,"['Toolkit primary outcome', 'Reading primary outcome']",,0.4505,,0.17,,Literacy: reading other,,71.0,,3.224,,2.957,,71.0,,0.983,,6.342,,0.1173,,0.7837,,Primary outcome,,['Sample: All'],,With business as usual,,['Pre-post gain'],,['Test type: National test'],,TAAS: Reading (RC)-Extend School,,Texas Assessment of Academic Skills (TAAS)  Reading scores from Reading Cohort (samples individually matched on reading scaled scores)– Year Round Education compared to traditional Calendar programs .,,"['Toolkit primary outcome', 'Reading primary outcome']",,0.4505,,0.17,,Literacy: reading other,,71.0,,3.224,,2.957,,71.0,,0.983,,6.342,,0.1173,,0.7837,,Primary outcome,,['Sample: All'],,With business as usual,,['Pre-post gain'],,['Test type: National test'],,NA,,NA,,NA,,NA,,NA,,NA,,NA,,NA,,NA,,NA,,NA,,NA,,NA,,NA,,NA,,NA,,NA,,NA,,NA,,TAAS: Maths (MC)-Extend school,,Texas Assessment of Academic Skills (TAAS)  Maths scores from Maths Cohort (samples individually matched on maths scaled scored)– Year Round Education compared to traditional Calendar programs .,,['Mathematics primary outcome'],,-0.2724,,0.1723,,Mathematics,,68.0,,3.087,,5.035,,68.0,,4.647,,6.286,,-0.6101,,0.0653,,Primary outcome,,['Sample: All'],,With business as usual,,['Pre-post gain'],,['Test type: National test'],,NA,,NA,,NA,,NA,,NA,,NA,,NA,,NA,,NA,,NA,,NA,,NA,,NA,,NA,,NA,,NA,,NA,,NA,,NA,,NA,,NA,,NA,,NA,,NA,,NA,,NA,,NA,,NA,,NA,,NA,,NA,,NA,,NA,,NA,,NA,,NA,,NA,,NA,
40117194,Dynarski (2004),2004,['Extending school time'],NA,Grade in English ,,"The key findings for the two reports are compared, focusing on the intent-to-treat estimates, which are based on the full sample of treatment and comparison students, and on several key outcomes including grades.",,"['Toolkit primary outcome', 'Reading primary outcome']",,0.04,,0.01,,Literacy: reading other,,NA,,NA,,NA,,NA,,NA,,NA,,0.0204,,0.0596,,Primary outcome,,['Sample: All'],,With business as usual,,['Post-test unadjusted (select one from this group)'],,['Test type: School-developed test'],,Grade in English ,,"The key findings for the two reports are compared, focusing on the intent-to-treat estimates, which are based on the full sample of treatment and comparison students, and on several key outcomes including grades.",,"['Toolkit primary outcome', 'Reading primary outcome']",,0.04,,0.01,,Literacy: reading other,,NA,,NA,,NA,,NA,,NA,,NA,,0.0204,,0.0596,,Primary outcome,,['Sample: All'],,With business as usual,,['Post-test unadjusted (select one from this group)'],,['Test type: School-developed test'],,NA,,NA,,NA,,NA,,NA,,NA,,NA,,NA,,NA,,NA,,NA,,NA,,NA,,NA,,NA,,NA,,NA,,NA,,NA,,NA,,NA,,NA,,NA,,NA,,NA,,NA,,NA,,NA,,NA,,NA,,NA,,NA,,NA,,NA,,NA,,NA,,NA,,NA,,NA,,NA,,NA,,NA,,NA,,NA,,NA,,NA,,NA,,NA,,NA,,NA,,NA,,NA,,NA,,NA,,NA,,NA,,NA,,NA,,NA,,NA,,NA,,NA,,NA,,NA,,NA,,NA,,NA,,NA,,NA,,NA,,NA,,NA,,NA,,NA,,NA,,NA,
40117128,Elsberry (1992),1992,['Extending school time'],NA,TAAS: reading: 3rd+5th comb. -fixed effect-extend school,,A subset of the Texas Assessment of Academic Skills (TAAS) test. Combined using the fixed effect excel (AK),,"['Toolkit primary outcome', 'Reading primary outcome']",,0.5268,,0.1407,,Literacy: reading comprehension,,NA,,NA,,NA,,NA,,NA,,NA,,0.251,,0.8025,,Primary outcome,,['Sample: All'],,With business as usual,,['Post-test unadjusted (select one from this group)'],,['Test type: National test'],,TAAS: reading: 3rd+5th comb. -fixed effect-extend school,,A subset of the Texas Assessment of Academic Skills (TAAS) test. Combined using the fixed effect excel (AK),,"['Toolkit primary outcome', 'Reading primary outcome']",,0.5268,,0.1407,,Literacy: reading comprehension,,NA,,NA,,NA,,NA,,NA,,NA,,0.251,,0.8025,,Primary outcome,,['Sample: All'],,With business as usual,,['Post-test unadjusted (select one from this group)'],,['Test type: National test'],,NA,,NA,,NA,,NA,,NA,,NA,,NA,,NA,,NA,,NA,,NA,,NA,,NA,,NA,,NA,,NA,,NA,,NA,,NA,,TAAS:maths - 3rd+5th combined for fixed effect-extend.,,A subset of the Texas Assessment of Academic Skills (TAAS) test. Combined for fixed effect,,['Mathematics primary outcome'],,0.5119,,0.1408,,Mathematics,,NA,,NA,,NA,,NA,,NA,,NA,,0.2359,,0.7879,,Secondary outcome(s),,['Sample: All'],,With business as usual,,['Post-test unadjusted (select one from this group)'],,['Test type: National test'],,NA,,NA,,NA,,NA,,NA,,NA,,NA,,NA,,NA,,NA,,NA,,NA,,NA,,NA,,NA,,NA,,NA,,NA,,NA,,NA,,NA,,NA,,NA,,NA,,NA,,NA,,NA,,NA,,NA,,NA,,NA,,NA,,NA,,NA,,NA,,NA,,NA,,NA,
40117129,Espinosa (2000),2000,['Extending school time'],NA,ITBS Reading,,"The ITBS is a nationally recognized standardized test that was adopted by the Chicago Public Schools as one of the measuring tools to determine student academic achievement. The ITBS is designed and constructed by specialized professional staff at University of Iowa. The test reliability is high, and the interpretation of the results may be assisted by carefully developed norms. The ITBS is categorized and constructed by levels that reflect a consecutive developmental sequence from kindergarten to ninth grade. For its implementation, the different levels are assumed to correspond to the chronological age of the subject students.",,"['Toolkit primary outcome', 'Reading primary outcome']",,0.1519,,0.1136,,Literacy: reading comprehension,,NA,,NA,,NA,,NA,,NA,,NA,,-0.0707,,0.3745,,Primary outcome,,['Sample: All'],,With business as usual,,['Post-test unadjusted (select one from this group)'],,['Test type: Researcher developed test'],,ITBS Reading,,"The ITBS is a nationally recognized standardized test that was adopted by the Chicago Public Schools as one of the measuring tools to determine student academic achievement. The ITBS is designed and constructed by specialized professional staff at University of Iowa. The test reliability is high, and the interpretation of the results may be assisted by carefully developed norms. The ITBS is categorized and constructed by levels that reflect a consecutive developmental sequence from kindergarten to ninth grade. For its implementation, the different levels are assumed to correspond to the chronological age of the subject students.",,"['Toolkit primary outcome', 'Reading primary outcome']",,0.1519,,0.1136,,Literacy: reading comprehension,,NA,,NA,,NA,,NA,,NA,,NA,,-0.0707,,0.3745,,Primary outcome,,['Sample: All'],,With business as usual,,['Post-test unadjusted (select one from this group)'],,['Test type: Researcher developed test'],,NA,,NA,,NA,,NA,,NA,,NA,,NA,,NA,,NA,,NA,,NA,,NA,,NA,,NA,,NA,,NA,,NA,,NA,,NA,,NA,,NA,,NA,,NA,,NA,,NA,,NA,,NA,,NA,,NA,,NA,,NA,,NA,,NA,,NA,,NA,,NA,,NA,,NA,,NA,,NA,,NA,,NA,,NA,,NA,,NA,,NA,,NA,,NA,,NA,,NA,,NA,,NA,,NA,,NA,,NA,,NA,,NA,,NA,,NA,,NA,,NA,,NA,,NA,,NA,,NA,,NA,,NA,,NA,,NA,,NA,,NA,,NA,,NA,,NA,,NA,,NA,
40117274,Finch (1997),1997,['Extending school time'],NA,MEAP ,,The State of Michigan's  standardized test called the MEAP  (MEAP)  was used as the  posttest and the California Achievement Test  (CAT)  was used  as the pretest.  Both tests are based upon the NCTM  (National  Council of Teachers of Mathematics)  standards and are normed  referenced tools  for educational purposes. The score range of the MEAP is 343-668.,,"['Toolkit primary outcome', 'Mathematics primary outcome']",,0.0958,,0.2392,,Mathematics,,35.0,,523.17,,19.92,,35.0,,520.97,,25.21,,-0.3731,,0.5646,,Primary outcome,,NA,,With business as usual,,NA,,NA,,NA,,NA,,NA,,NA,,NA,,NA,,NA,,NA,,NA,,NA,,NA,,NA,,NA,,NA,,NA,,NA,,NA,,NA,,NA,,NA,,NA,,NA,,NA,,NA,,NA,,NA,,NA,,NA,,NA,,NA,,NA,,NA,,NA,,NA,,NA,,NA,,NA,,NA,,MEAP ,,The State of Michigan's  standardized test called the MEAP  (MEAP)  was used as the  posttest and the California Achievement Test  (CAT)  was used  as the pretest.  Both tests are based upon the NCTM  (National  Council of Teachers of Mathematics)  standards and are normed  referenced tools  for educational purposes. The score range of the MEAP is 343-668.,,"['Toolkit primary outcome', 'Mathematics primary outcome']",,0.0958,,0.2392,,Mathematics,,35.0,,523.17,,19.92,,35.0,,520.97,,25.21,,-0.3731,,0.5646,,Primary outcome,,NA,,With business as usual,,NA,,NA,,NA,,NA,,NA,,NA,,NA,,NA,,NA,,NA,,NA,,NA,,NA,,NA,,NA,,NA,,NA,,NA,,NA,,NA,,NA,,NA,,NA,,NA,,NA,,NA,,NA,,NA,,NA,,NA,,NA,,NA,,NA,,NA,,NA,,NA,,NA,,NA,,NA,,NA,
40117132,Gandara (1994),1994,['Extending school time'],NA,Palm - CTBS - Reading ,,NA,,"['Toolkit primary outcome', 'Reading primary outcome']",,0.3865,,0.235,,Literacy: reading comprehension,,NA,,NA,,NA,,NA,,NA,,NA,,-0.0741,,0.8471,,Primary outcome,,['Sample: All'],,With business as usual,,['Post-test unadjusted (select one from this group)'],,['Test type: Standardised test '],,Palm - CTBS - Reading ,,NA,,"['Toolkit primary outcome', 'Reading primary outcome']",,0.3865,,0.235,,Literacy: reading comprehension,,NA,,NA,,NA,,NA,,NA,,NA,,-0.0741,,0.8471,,Primary outcome,,['Sample: All'],,With business as usual,,['Post-test unadjusted (select one from this group)'],,['Test type: Standardised test '],,NA,,NA,,NA,,NA,,NA,,NA,,NA,,NA,,NA,,NA,,NA,,NA,,NA,,NA,,NA,,NA,,NA,,NA,,NA,,NA,,NA,,NA,,NA,,NA,,NA,,NA,,NA,,NA,,NA,,NA,,NA,,NA,,NA,,NA,,NA,,NA,,NA,,NA,,NA,,NA,,NA,,NA,,NA,,NA,,NA,,NA,,NA,,NA,,NA,,NA,,NA,,NA,,NA,,NA,,NA,,NA,,NA,,NA,,NA,,NA,,NA,,NA,,NA,,NA,,NA,,NA,,NA,,NA,,NA,,NA,,NA,,NA,,NA,,NA,,NA,,NA,
40117276,Gentilcore (2002),2002,['Extending school time'],NA,ELA-post test means and SDs,,NA,,"['Toolkit primary outcome', 'Other outcome']",,0.0004,,0.179,,Languages,,114.0,,704.5,,27.19,,43.0,,704.49,,19.37,,-0.3504,,0.3512,,Primary outcome,,['Sample: All'],,With business as usual,,['Post-test unadjusted (select one from this group)'],,['Test type: Standardised test '],,NA,,NA,,NA,,NA,,NA,,NA,,NA,,NA,,NA,,NA,,NA,,NA,,NA,,NA,,NA,,NA,,NA,,NA,,NA,,NA,,NA,,NA,,NA,,NA,,NA,,NA,,NA,,NA,,NA,,NA,,NA,,NA,,NA,,NA,,NA,,NA,,NA,,NA,,NA,,NA,,NA,,NA,,NA,,NA,,NA,,NA,,NA,,NA,,NA,,NA,,NA,,NA,,NA,,NA,,NA,,NA,,NA,,NA,,NA,,NA,,NA,,NA,,NA,,NA,,NA,,NA,,NA,,NA,,NA,,NA,,NA,,NA,,NA,,NA,,NA,,NA,,NA,,NA,,NA,,NA,,NA,,NA,,NA,,NA,,NA,,NA,,NA,,NA,,NA,,NA,,NA,,NA,,NA,,NA,,NA,
40117250,Gottfredson (2010),2010,['Extending school time'],NA,Academic performance - extending school time,,No clear description. Noted as test scores.,,"['Toolkit primary outcome', 'Other outcome']",,0.0,,0.0981,,NA,,211.0,,0.01,,0.0,,205.0,,-0.02,,0.0,,-0.1922,,0.1922,,,,['Sample: All'],,With business as usual,,['Post-test adjusted for baseline attainment AND clustering'],,['Test type: School-developed test'],,NA,,NA,,NA,,NA,,NA,,NA,,NA,,NA,,NA,,NA,,NA,,NA,,NA,,NA,,NA,,NA,,NA,,NA,,NA,,NA,,NA,,NA,,NA,,NA,,NA,,NA,,NA,,NA,,NA,,NA,,NA,,NA,,NA,,NA,,NA,,NA,,NA,,NA,,NA,,NA,,NA,,NA,,NA,,NA,,NA,,NA,,NA,,NA,,NA,,NA,,NA,,NA,,NA,,NA,,NA,,NA,,NA,,NA,,NA,,NA,,NA,,NA,,NA,,NA,,NA,,NA,,NA,,NA,,NA,,NA,,NA,,NA,,NA,,NA,,NA,,NA,,NA,,NA,,NA,,NA,,NA,,NA,,NA,,NA,,NA,,NA,,NA,,NA,,NA,,NA,,NA,,NA,,NA,,NA,,NA,
40117251,Grolnick (2007),2007,['Extending school time'],NA,Perceived competence - English,," Perceived competence scale for children. This scale measures students' perceptions of their competence in several areas. In this study, 6 items from the general self-worth and 6 from the cognitive (academic) area were included. Each item presents two types of students, one representing a high and the other a low level of competence. Students decide which they are most like and then whether the item is really true (= 4) or sort of true (= 3) for them. Cronbach's alphas were .78 for the cognitive and .66 for the general scales.",,['Toolkit primary outcome'],,0.0438,,0.2108,,Literacy: speaking and listening/oral language,,45.0,,3.09,,0.13,,45.0,,3.05,,0.14,,-0.3695,,0.457,,Primary outcome,,['Sample: All'],,With business as usual,,['Post-test adjusted for baseline attainment'],,['Test type: Standardised test '],,NA,,NA,,NA,,NA,,NA,,NA,,NA,,NA,,NA,,NA,,NA,,NA,,NA,,NA,,NA,,NA,,NA,,NA,,NA,,NA,,NA,,NA,,NA,,NA,,NA,,NA,,NA,,NA,,NA,,NA,,NA,,NA,,NA,,NA,,NA,,NA,,NA,,NA,,NA,,NA,,NA,,NA,,NA,,NA,,NA,,NA,,NA,,NA,,NA,,NA,,NA,,NA,,NA,,NA,,NA,,NA,,NA,,NA,,NA,,NA,,NA,,NA,,NA,,NA,,NA,,NA,,NA,,NA,,NA,,NA,,NA,,NA,,NA,,NA,,NA,,NA,,NA,,NA,,NA,,NA,,NA,,NA,,NA,,NA,,NA,,NA,,NA,,NA,,NA,,NA,,NA,,NA,,NA,,NA,,NA,
40117134,Haenn (1996),1996,['Extending school time'],NA,Reading achievement - extended school time (School A),,NA,,"['Toolkit primary outcome', 'Reading primary outcome']",,-0.306,,2.0,,Literacy: reading comprehension,,NA,,NA,,NA,,NA,,NA,,NA,,-4.226,,3.614,,Primary outcome,,['Sample: All'],,With business as usual,,['Pre-post gain'],,NA,,Reading achievement - extended school time (School A),,NA,,"['Toolkit primary outcome', 'Reading primary outcome']",,-0.306,,2.0,,Literacy: reading comprehension,,NA,,NA,,NA,,NA,,NA,,NA,,-4.226,,3.614,,Primary outcome,,['Sample: All'],,With business as usual,,['Pre-post gain'],,NA,,NA,,NA,,NA,,NA,,NA,,NA,,NA,,NA,,NA,,NA,,NA,,NA,,NA,,NA,,NA,,NA,,NA,,NA,,NA,,NA,,NA,,NA,,NA,,NA,,NA,,NA,,NA,,NA,,NA,,NA,,NA,,NA,,NA,,NA,,NA,,NA,,NA,,NA,,NA,,NA,,NA,,NA,,NA,,NA,,NA,,NA,,NA,,NA,,NA,,NA,,NA,,NA,,NA,,NA,,NA,,NA,,NA,,NA,,NA,,NA,,NA,,NA,,NA,,NA,,NA,,NA,,NA,,NA,,NA,,NA,,NA,,NA,,NA,,NA,,NA,,NA,
40117135,Hasselmeier (1997),1997,['Extending school time'],NA,"T.A.A.S. (Texas Assessment of Academic Skills) - combined Grade 3, 4 and 5 scores",,The T.A.A.S. (Texas Assessment of Academic Skills) is an annual achievement test that is administered to students in third grade through tenth grade in the state of Texas. ,,"['Toolkit primary outcome', 'Reading primary outcome', 'Mathematics primary outcome']",,0.502,,0.0603,,Literacy: reading comprehension,,538.0,,51.536,,12.281,,601.0,,45.401,,12.15,,0.3839,,0.6202,,Primary outcome,,['Sample: All'],,With business as usual,,['Post-test unadjusted (select one from this group)'],,['Test type: Standardised test '],,"T.A.A.S. (Texas Assessment of Academic Skills) - combined Grade 3, 4 and 5 scores",,The T.A.A.S. (Texas Assessment of Academic Skills) is an annual achievement test that is administered to students in third grade through tenth grade in the state of Texas. ,,"['Toolkit primary outcome', 'Reading primary outcome', 'Mathematics primary outcome']",,0.502,,0.0603,,Literacy: reading comprehension,,538.0,,51.536,,12.281,,601.0,,45.401,,12.15,,0.3839,,0.6202,,Primary outcome,,['Sample: All'],,With business as usual,,['Post-test unadjusted (select one from this group)'],,['Test type: Standardised test '],,NA,,NA,,NA,,NA,,NA,,NA,,NA,,NA,,NA,,NA,,NA,,NA,,NA,,NA,,NA,,NA,,NA,,NA,,NA,,"T.A.A.S. (Texas Assessment of Academic Skills) - combined Grade 3, 4 and 5 scores",,The T.A.A.S. (Texas Assessment of Academic Skills) is an annual achievement test that is administered to students in third grade through tenth grade in the state of Texas. ,,"['Toolkit primary outcome', 'Reading primary outcome', 'Mathematics primary outcome']",,0.502,,0.0603,,Literacy: reading comprehension,,538.0,,51.536,,12.281,,601.0,,45.401,,12.15,,0.3839,,0.6202,,Primary outcome,,['Sample: All'],,With business as usual,,['Post-test unadjusted (select one from this group)'],,['Test type: Standardised test '],,NA,,NA,,NA,,NA,,NA,,NA,,NA,,NA,,NA,,NA,,NA,,NA,,NA,,NA,,NA,,NA,,NA,,NA,,NA,,NA,,NA,,NA,,NA,,NA,,NA,,NA,,NA,,NA,,NA,,NA,,NA,,NA,,NA,,NA,,NA,,NA,,NA,,NA,
40117175,Hausner (2000),2000,['Extending school time'],NA,Letter Identification (t-test),,"Post-test T-test results for letter identification extracted for ES calculation. Letter Identification (LID) has a possible score of 54. Students are given a point for each randomly listed alphabet letter both upper and lower case including different types of print for ""a"" and ""g"".",,"['Toolkit primary outcome', 'Reading primary outcome']",,0.1394,,0.1196,,Literacy: reading comprehension,,128.0,,1.169,,0.0,,155.0,,0.243,,0.0,,-0.095,,0.3737,,Primary outcome,,['Sample: Low achievers'],,With business as usual,,['Post-test adjusted for baseline attainment'],,['Test type: Standardised test '],,Letter Identification (t-test),,"Post-test T-test results for letter identification extracted for ES calculation. Letter Identification (LID) has a possible score of 54. Students are given a point for each randomly listed alphabet letter both upper and lower case including different types of print for ""a"" and ""g"".",,"['Toolkit primary outcome', 'Reading primary outcome']",,0.1394,,0.1196,,Literacy: reading comprehension,,128.0,,1.169,,0.0,,155.0,,0.243,,0.0,,-0.095,,0.3737,,Primary outcome,,['Sample: Low achievers'],,With business as usual,,['Post-test adjusted for baseline attainment'],,['Test type: Standardised test '],,NA,,NA,,NA,,NA,,NA,,NA,,NA,,NA,,NA,,NA,,NA,,NA,,NA,,NA,,NA,,NA,,NA,,NA,,NA,,NA,,NA,,NA,,NA,,NA,,NA,,NA,,NA,,NA,,NA,,NA,,NA,,NA,,NA,,NA,,NA,,NA,,NA,,NA,,NA,,NA,,NA,,NA,,NA,,NA,,NA,,NA,,NA,,NA,,NA,,NA,,NA,,NA,,NA,,NA,,NA,,NA,,NA,,NA,,NA,,NA,,NA,,NA,,NA,,NA,,NA,,NA,,NA,,NA,,NA,,NA,,NA,,NA,,NA,,NA,,NA,,NA,
40117136,Heaberlin (2000),2000,['Extending school time'],NA,All Grades (1 to 5) - Total Reading Subtest NCE Scores on the ITBS,,Student achievement was measured by the Total Reading and Total Math scores on the Iowa Test of Basic Skills (ITBS). ,,"['Toolkit primary outcome', 'Reading primary outcome']",,0.0008,,0.0797,,Literacy: reading comprehension,,282.0,,47.87,,17.32,,356.0,,47.855,,19.123,,-0.1554,,0.1571,,Primary outcome,,NA,,With business as usual,,NA,,NA,,All Grades (1 to 5) - Total Reading Subtest NCE Scores on the ITBS,,Student achievement was measured by the Total Reading and Total Math scores on the Iowa Test of Basic Skills (ITBS). ,,"['Toolkit primary outcome', 'Reading primary outcome']",,0.0008,,0.0797,,Literacy: reading comprehension,,282.0,,47.87,,17.32,,356.0,,47.855,,19.123,,-0.1554,,0.1571,,Primary outcome,,NA,,With business as usual,,NA,,NA,,NA,,NA,,NA,,NA,,NA,,NA,,NA,,NA,,NA,,NA,,NA,,NA,,NA,,NA,,NA,,NA,,NA,,NA,,NA,,NA,,NA,,NA,,NA,,NA,,NA,,NA,,NA,,NA,,NA,,NA,,NA,,NA,,NA,,NA,,NA,,NA,,NA,,NA,,NA,,NA,,NA,,NA,,NA,,NA,,NA,,NA,,NA,,NA,,NA,,NA,,NA,,NA,,NA,,NA,,NA,,NA,,NA,,NA,,NA,,NA,,NA,,NA,,NA,,NA,,NA,,NA,,NA,,NA,,NA,,NA,,NA,,NA,,NA,,NA,,NA,,NA,
40117252,Hirsch (2011),2011,['Extending school time'],NA,Grade point average score(GPA)-extending school Time ,,GPA was calculated using weighted grades from students’ core academic courses.  ,,['Toolkit primary outcome'],,0.1012,,0.1146,,Curriculum: other,,134.0,,2.41,,0.98,,177.0,,2.31,,0.99,,-0.1234,,0.3258,,Primary outcome,,['Sample: All'],,With active control,,['Post-test unadjusted (select one from this group)'],,['Test type: National test'],,NA,,NA,,NA,,NA,,NA,,NA,,NA,,NA,,NA,,NA,,NA,,NA,,NA,,NA,,NA,,NA,,NA,,NA,,NA,,NA,,NA,,NA,,NA,,NA,,NA,,NA,,NA,,NA,,NA,,NA,,NA,,NA,,NA,,NA,,NA,,NA,,NA,,NA,,NA,,NA,,NA,,NA,,NA,,NA,,NA,,NA,,NA,,NA,,NA,,NA,,NA,,NA,,NA,,NA,,NA,,NA,,NA,,NA,,NA,,NA,,NA,,NA,,NA,,NA,,NA,,NA,,NA,,NA,,NA,,NA,,NA,,NA,,NA,,NA,,NA,,NA,,NA,,NA,,NA,,NA,,NA,,NA,,NA,,NA,,NA,,NA,,NA,,NA,,NA,,NA,,NA,,NA,,NA,,NA,,NA,
40117253,Hobbs (2012),2012,['Extending school time'],NA,Mathematics accuracy - extending school time,,Georgia Criterion-Referenced Competency Test- The Georgia Criterion-Referenced Competency Test (CRCT) is a multiple-choice standardized test designed to measure how well students have mastered standards in the state of Georgia. It compares students to a standard level of proficiency. The Georgia CRCT is given yearly in the Spring to students in first grade through eighth grade.,,"['Toolkit primary outcome', 'Mathematics primary outcome']",,0.0354,,0.1491,,Mathematics,,90.0,,824.84,,31.97,,90.0,,823.84,,23.71,,-0.2568,,0.3276,,Primary outcome,,['Sample: Low achievers'],,With business as usual,,['Post-test adjusted for baseline attainment'],,['Test type: Standardised test '],,NA,,NA,,NA,,NA,,NA,,NA,,NA,,NA,,NA,,NA,,NA,,NA,,NA,,NA,,NA,,NA,,NA,,NA,,NA,,NA,,NA,,NA,,NA,,NA,,NA,,NA,,NA,,NA,,NA,,NA,,NA,,NA,,NA,,NA,,NA,,NA,,NA,,NA,,Mathematics accuracy - extending school time,,Georgia Criterion-Referenced Competency Test- The Georgia Criterion-Referenced Competency Test (CRCT) is a multiple-choice standardized test designed to measure how well students have mastered standards in the state of Georgia. It compares students to a standard level of proficiency. The Georgia CRCT is given yearly in the Spring to students in first grade through eighth grade.,,"['Toolkit primary outcome', 'Mathematics primary outcome']",,0.0354,,0.1491,,Mathematics,,90.0,,824.84,,31.97,,90.0,,823.84,,23.71,,-0.2568,,0.3276,,Primary outcome,,['Sample: Low achievers'],,With business as usual,,['Post-test adjusted for baseline attainment'],,['Test type: Standardised test '],,NA,,NA,,NA,,NA,,NA,,NA,,NA,,NA,,NA,,NA,,NA,,NA,,NA,,NA,,NA,,NA,,NA,,NA,,NA,,NA,,NA,,NA,,NA,,NA,,NA,,NA,,NA,,NA,,NA,,NA,,NA,,NA,,NA,,NA,,NA,,NA,,NA,,NA,
40117137,Johnson (1984),1984,['Extending school time'],NA,CTBS Reading (ANOVA),,NA,,"['Toolkit primary outcome', 'Reading primary outcome', 'Mathematics primary outcome']",,1.05,,0.07,,Literacy: reading comprehension,,NA,,NA,,NA,,NA,,NA,,NA,,0.9128,,1.1872,,Primary outcome,,['Sample: All'],,With business as usual,,['Post-test adjusted for baseline attainment'],,['Test type: Standardised test '],,CTBS Reading (ANOVA),,NA,,"['Toolkit primary outcome', 'Reading primary outcome', 'Mathematics primary outcome']",,1.05,,0.07,,Literacy: reading comprehension,,NA,,NA,,NA,,NA,,NA,,NA,,0.9128,,1.1872,,Primary outcome,,['Sample: All'],,With business as usual,,['Post-test adjusted for baseline attainment'],,['Test type: Standardised test '],,NA,,NA,,NA,,NA,,NA,,NA,,NA,,NA,,NA,,NA,,NA,,NA,,NA,,NA,,NA,,NA,,NA,,NA,,NA,,CTBS Reading (ANOVA),,NA,,"['Toolkit primary outcome', 'Reading primary outcome', 'Mathematics primary outcome']",,1.05,,0.07,,Literacy: reading comprehension,,NA,,NA,,NA,,NA,,NA,,NA,,0.9128,,1.1872,,Primary outcome,,['Sample: All'],,With business as usual,,['Post-test adjusted for baseline attainment'],,['Test type: Standardised test '],,NA,,NA,,NA,,NA,,NA,,NA,,NA,,NA,,NA,,NA,,NA,,NA,,NA,,NA,,NA,,NA,,NA,,NA,,NA,,NA,,NA,,NA,,NA,,NA,,NA,,NA,,NA,,NA,,NA,,NA,,NA,,NA,,NA,,NA,,NA,,NA,,NA,,NA,
40117257,Kauh (2011),2011,['Extending school time'],NA, English Language Arts (ELA) GPA score-extending school time,,English Language Arts Grade point average -  the SE is estimated from the p-values given,,"['Toolkit primary outcome', 'Writing and spelling primary outcome.']",,-0.01,,0.04,,Languages,,NA,,NA,,NA,,NA,,NA,,NA,,-0.0884,,0.0684,,Primary outcome,,['Sample: All'],,With business as usual,,['Post-test unadjusted (select one from this group)'],,['Test type: National test'],,NA,,NA,,NA,,NA,,NA,,NA,,NA,,NA,,NA,,NA,,NA,,NA,,NA,,NA,,NA,,NA,,NA,,NA,,NA,,NA,,NA,,NA,,NA,,NA,,NA,,NA,,NA,,NA,,NA,,NA,,NA,,NA,,NA,,NA,,NA,,NA,,NA,,NA,,Math GPA score-extending school time,,Mathematics grade point average -  the SE is estimated from the p-values given,,['Mathematics primary outcome'],,0.09,,0.04,,Mathematics,,NA,,NA,,NA,,NA,,NA,,NA,,0.0116,,0.1684,,Primary outcome,,['Sample: All'],,With business as usual,,['Post-test unadjusted (select one from this group)'],,['Test type: National test'],,Science GPA score-extending school time,,Science grade point average -  the SE is estimated from the p-values given,,['Science primary outcome'],,0.01,,0.04,,Science,,NA,,NA,,NA,,NA,,NA,,NA,,-0.0684,,0.0884,,Primary outcome,,['Sample: All'],,With business as usual,,['Post-test unadjusted (select one from this group)'],,['Test type: National test'],,NA,,NA,,NA,,NA,,NA,,NA,,NA,,NA,,NA,,NA,,NA,,NA,,NA,,NA,,NA,,NA,,NA,,NA,,NA,
