40117150,Mitchell (1999),1999,['Extending school time'],NA,SAT-9 Reading Comprehension (Means/SDs),,"The Stanford Achievement Test, Version 9 or SAT-9 (the California STAR test), was used for reading comprehension. Means and SDs extracted for ES calculation.",,"['Toolkit primary outcome', 'Reading primary outcome']",,-0.0448,,0.0189,,Literacy: reading comprehension,,4421.0,,44.87,,21.3,,7632.0,,45.83,,21.51,,-0.0818,,-0.0077,,Primary outcome,,['Sample: All'],,With business as usual,,['Post-test unadjusted (select one from this group)'],,['Test type: Standardised test '],,SAT-9 Reading Comprehension (Means/SDs),,"The Stanford Achievement Test, Version 9 or SAT-9 (the California STAR test), was used for reading comprehension. Means and SDs extracted for ES calculation.",,"['Toolkit primary outcome', 'Reading primary outcome']",,-0.0448,,0.0189,,Literacy: reading comprehension,,4421.0,,44.87,,21.3,,7632.0,,45.83,,21.51,,-0.0818,,-0.0077,,Primary outcome,,['Sample: All'],,With business as usual,,['Post-test unadjusted (select one from this group)'],,['Test type: Standardised test '],,NA,,NA,,NA,,NA,,NA,,NA,,NA,,NA,,NA,,NA,,NA,,NA,,NA,,NA,,NA,,NA,,NA,,NA,,NA,,SAT-9 Maths (Means/SDs),,"The Stanford Achievement Test, Version 9 or SAT-9 (the California STAR test), was used for reading maths. Means and SDs extracted for ES calculation",,['Mathematics primary outcome'],,-0.0566,,0.0189,,Mathematics,,4413.0,,43.35,,19.81,,7584.0,,44.48,,20.04,,-0.0937,,-0.0195,,Primary outcome,,['Sample: All'],,With business as usual,,['Post-test unadjusted (select one from this group)'],,['Test type: Standardised test '],,NA,,NA,,NA,,NA,,NA,,NA,,NA,,NA,,NA,,NA,,NA,,NA,,NA,,NA,,NA,,NA,,NA,,NA,,NA,,NA,,NA,,NA,,NA,,NA,,NA,,NA,,NA,,NA,,NA,,NA,,NA,,NA,,NA,,NA,,NA,,NA,,NA,,NA,
40117264,Molina (2008),2008,['Extending school time'],NA,Academic achievement grades - extended school time,,"Official student report card records were provided by school staff. Percentage passing grades (i.e., grades A to D) and percentage better than a D were calculated. Grades from the first 9-week grading period of the current school year were used for the baseline assessment, and grades from the second 9-week grading period of the current school year were used for the posttreatment assessment. (Analyses with the prior year’s end-of-year GPA as the baseline assessment provided similar results.)",,['Toolkit primary outcome'],,0.4476,,0.4564,,Combined subjects,,11.0,,44.55,,17.53,,9.0,,33.89,,28.04,,-0.4468,,1.3421,,Primary outcome,,['Sample: Low achievers'],,With business as usual,,['Post-test adjusted for baseline attainment'],,['Test type: School-developed test'],,NA,,NA,,NA,,NA,,NA,,NA,,NA,,NA,,NA,,NA,,NA,,NA,,NA,,NA,,NA,,NA,,NA,,NA,,NA,,NA,,NA,,NA,,NA,,NA,,NA,,NA,,NA,,NA,,NA,,NA,,NA,,NA,,NA,,NA,,NA,,NA,,NA,,NA,,NA,,NA,,NA,,NA,,NA,,NA,,NA,,NA,,NA,,NA,,NA,,NA,,NA,,NA,,NA,,NA,,NA,,NA,,NA,,NA,,NA,,NA,,NA,,NA,,NA,,NA,,NA,,NA,,NA,,NA,,NA,,NA,,NA,,NA,,NA,,NA,,NA,,NA,,NA,,NA,,NA,,NA,,NA,,NA,,NA,,NA,,NA,,NA,,NA,,NA,,NA,,NA,,NA,,NA,,NA,,NA,,NA,
40117289,Mooney (1986),1986,['Extending school time'],NA,Gates-MacGinitie Reading Tests - Comprehension Score,,Gates-MacGinitie Reading Tests - Comprehension Score was used as a post-test measure.,,"['Toolkit primary outcome', 'Reading primary outcome']",,0.5314,,0.3725,,Literacy: reading comprehension,,15.0,,13.42,,3.06,,15.0,,11.93,,2.35,,-0.1987,,1.2615,,Primary outcome,,NA,,With business as usual,,NA,,NA,,Gates-MacGinitie Reading Tests - Comprehension Score,,Gates-MacGinitie Reading Tests - Comprehension Score was used as a post-test measure.,,"['Toolkit primary outcome', 'Reading primary outcome']",,0.5314,,0.3725,,Literacy: reading comprehension,,15.0,,13.42,,3.06,,15.0,,11.93,,2.35,,-0.1987,,1.2615,,Primary outcome,,NA,,With business as usual,,NA,,NA,,NA,,NA,,NA,,NA,,NA,,NA,,NA,,NA,,NA,,NA,,NA,,NA,,NA,,NA,,NA,,NA,,NA,,NA,,NA,,NA,,NA,,NA,,NA,,NA,,NA,,NA,,NA,,NA,,NA,,NA,,NA,,NA,,NA,,NA,,NA,,NA,,NA,,NA,,NA,,NA,,NA,,NA,,NA,,NA,,NA,,NA,,NA,,NA,,NA,,NA,,NA,,NA,,NA,,NA,,NA,,NA,,NA,,NA,,NA,,NA,,NA,,NA,,NA,,NA,,NA,,NA,,NA,,NA,,NA,,NA,,NA,,NA,,NA,,NA,,NA,,NA,
40117359,Morris (1990),1990,['Extending school time'],NA,Reading Accuracy (overall),,Means and SDs for Basal Word Recognition and Basal Passages combined for years 1986-87 and 1987-88. ,,"['Toolkit primary outcome', 'Reading primary outcome']",,0.9071,,0.272,,Literacy: reading comprehension,,30.0,,13.02,,7.8,,30.0,,7.2,,4.4,,0.3739,,1.4403,,Primary outcome,,['Sample: Low achievers'],,With business as usual,,['Pre-post gain'],,['Test type: Researcher developed test'],,Reading Accuracy (overall),,Means and SDs for Basal Word Recognition and Basal Passages combined for years 1986-87 and 1987-88. ,,"['Toolkit primary outcome', 'Reading primary outcome']",,0.9071,,0.272,,Literacy: reading comprehension,,30.0,,13.02,,7.8,,30.0,,7.2,,4.4,,0.3739,,1.4403,,Primary outcome,,['Sample: Low achievers'],,With business as usual,,['Pre-post gain'],,['Test type: Researcher developed test'],,NA,,NA,,NA,,NA,,NA,,NA,,NA,,NA,,NA,,NA,,NA,,NA,,NA,,NA,,NA,,NA,,NA,,NA,,NA,,NA,,NA,,NA,,NA,,NA,,NA,,NA,,NA,,NA,,NA,,NA,,NA,,NA,,NA,,NA,,NA,,NA,,NA,,NA,,NA,,NA,,NA,,NA,,NA,,NA,,NA,,NA,,NA,,NA,,NA,,NA,,NA,,NA,,NA,,NA,,NA,,NA,,NA,,NA,,NA,,NA,,NA,,NA,,NA,,NA,,NA,,NA,,NA,,NA,,NA,,NA,,NA,,NA,,NA,,NA,,NA,,NA,
40117214,Morrison (2000),2000,['Extending school time'],NA,Maths (f-test),,"Student academic performance was conceptualized as student grades in math, which was calculated for each student by examining report cards for their cur- rent academic year. These ratings were obtained from report cards ®led in the student cumulative ®les. The scales ranged from 1 to 5 with 5 being equivalent to the highest grade (A).",,"['Toolkit primary outcome', 'Mathematics primary outcome']",,-0.77,,0.11,,Mathematics,,NA,,NA,,NA,,NA,,NA,,NA,,-0.9856,,-0.5544,,Primary outcome,,['Sample: All'],,With business as usual,,['Post-test adjusted for baseline attainment'],,['Test type: School-developed test'],,NA,,NA,,NA,,NA,,NA,,NA,,NA,,NA,,NA,,NA,,NA,,NA,,NA,,NA,,NA,,NA,,NA,,NA,,NA,,NA,,NA,,NA,,NA,,NA,,NA,,NA,,NA,,NA,,NA,,NA,,NA,,NA,,NA,,NA,,NA,,NA,,NA,,NA,,Maths (f-test),,"Student academic performance was conceptualized as student grades in math, which was calculated for each student by examining report cards for their cur- rent academic year. These ratings were obtained from report cards ®led in the student cumulative ®les. The scales ranged from 1 to 5 with 5 being equivalent to the highest grade (A).",,"['Toolkit primary outcome', 'Mathematics primary outcome']",,-0.77,,0.11,,Mathematics,,NA,,NA,,NA,,NA,,NA,,NA,,-0.9856,,-0.5544,,Primary outcome,,['Sample: All'],,With business as usual,,['Post-test adjusted for baseline attainment'],,['Test type: School-developed test'],,NA,,NA,,NA,,NA,,NA,,NA,,NA,,NA,,NA,,NA,,NA,,NA,,NA,,NA,,NA,,NA,,NA,,NA,,NA,,NA,,NA,,NA,,NA,,NA,,NA,,NA,,NA,,NA,,NA,,NA,,NA,,NA,,NA,,NA,,NA,,NA,,NA,,NA,
40117215,Neufeld (1995),1995,['Extending school time'],NA,Locus of control (ANCOVA),,The Nowicki-Strickland Locus of Control instrument is designed to assess the degree to which children connect their actions to the outcomes which result from them. ANCOVA results extracted for ES calculation. ,,"['Toolkit primary outcome', 'Other outcome']",,1.08,,0.3,,Cognitive: other,,NA,,NA,,NA,,NA,,NA,,NA,,0.492,,1.668,,,,NA,,,,NA,,NA,,NA,,NA,,NA,,NA,,NA,,NA,,NA,,NA,,NA,,NA,,NA,,NA,,NA,,NA,,NA,,NA,,NA,,NA,,NA,,NA,,NA,,NA,,NA,,NA,,NA,,NA,,NA,,NA,,NA,,NA,,NA,,NA,,NA,,NA,,NA,,NA,,NA,,NA,,NA,,NA,,NA,,NA,,NA,,NA,,NA,,NA,,NA,,NA,,NA,,NA,,NA,,NA,,NA,,NA,,NA,,NA,,NA,,NA,,NA,,NA,,NA,,NA,,NA,,NA,,NA,,NA,,NA,,NA,,NA,,NA,,NA,,NA,,NA,,NA,,NA,,NA,,NA,,NA,,NA,,NA,,NA,,NA,,NA,,NA,,NA,,NA,,NA,,NA,,NA,,NA,,NA,,NA,,NA,,NA,,NA,
40117154,Paloczy (1997),1997,['Extending school time'],NA,TAAS Reading Achievement  (ANOVA),,"Students were tested on the following 6 TAAS objectives in reading  Word Meaning, Supporting Ideas, Summarization, Relationships and Outcomes, Inferences and Generalization, and Point of View, Propaganda and Nonfact.",,"['Toolkit primary outcome', 'Reading primary outcome']",,0.0078,,0.18,,Literacy: reading comprehension,,NA,,NA,,NA,,NA,,NA,,NA,,-0.345,,0.3606,,Primary outcome,,['Sample: All'],,With business as usual,,['Post-test unadjusted (select one from this group)'],,['Test type: Standardised test '],,TAAS Reading Achievement  (ANOVA),,"Students were tested on the following 6 TAAS objectives in reading  Word Meaning, Supporting Ideas, Summarization, Relationships and Outcomes, Inferences and Generalization, and Point of View, Propaganda and Nonfact.",,"['Toolkit primary outcome', 'Reading primary outcome']",,0.0078,,0.18,,Literacy: reading comprehension,,NA,,NA,,NA,,NA,,NA,,NA,,-0.345,,0.3606,,Primary outcome,,['Sample: All'],,With business as usual,,['Post-test unadjusted (select one from this group)'],,['Test type: Standardised test '],,NA,,NA,,NA,,NA,,NA,,NA,,NA,,NA,,NA,,NA,,NA,,NA,,NA,,NA,,NA,,NA,,NA,,NA,,NA,,TAAS Math Achievement (ANOVA),,"Students were tested on the following 11 TAAS objectives in mathematics  Number Concepts, Relations and Fractions, Geometric Properties, Measurement Concepts, Probability and Statistics, Use of Addition, Use of Subtraction, Use of Multiplication, Use of Division, Use of Estimation, and Use of Solution Strategies.",,['Mathematics primary outcome'],,0.012,,0.17,,Mathematics,,NA,,NA,,NA,,NA,,NA,,NA,,-0.3212,,0.3452,,Primary outcome,,['Sample: All'],,With business as usual,,['Post-test unadjusted (select one from this group)'],,NA,,NA,,NA,,NA,,NA,,NA,,NA,,NA,,NA,,NA,,NA,,NA,,NA,,NA,,NA,,NA,,NA,,NA,,NA,,NA,,NA,,NA,,NA,,NA,,NA,,NA,,NA,,NA,,NA,,NA,,NA,,NA,,NA,,NA,,NA,,NA,,NA,,NA,,NA,
40117157,Powers (1974),1974,['Extending school time'],NA,STEP Reading Achievement (Post-test Adjusted Mean and Unadjusted SDs),,"The Sequential Tests of Educational Progress (STEP) Reading test contains two sections, which measure the ability to read and understand a variety of materials. Items are classified as tapping three skill areas  comprehension, translation and inference, and analysis.",,"['Toolkit primary outcome', 'Reading primary outcome']",,-0.0522,,0.1177,,Literacy: reading comprehension,,133.0,,33.7,,9.6,,158.0,,34.2,,9.5,,-0.2829,,0.1784,,Primary outcome,,['Sample: All'],,With business as usual,,['Post-test adjusted for baseline attainment'],,['Test type: Standardised test '],,STEP Reading Achievement (Post-test Adjusted Mean and Unadjusted SDs),,"The Sequential Tests of Educational Progress (STEP) Reading test contains two sections, which measure the ability to read and understand a variety of materials. Items are classified as tapping three skill areas  comprehension, translation and inference, and analysis.",,"['Toolkit primary outcome', 'Reading primary outcome']",,-0.0522,,0.1177,,Literacy: reading comprehension,,133.0,,33.7,,9.6,,158.0,,34.2,,9.5,,-0.2829,,0.1784,,Primary outcome,,['Sample: All'],,With business as usual,,['Post-test adjusted for baseline attainment'],,['Test type: Standardised test '],,NA,,NA,,NA,,NA,,NA,,NA,,NA,,NA,,NA,,NA,,NA,,NA,,NA,,NA,,NA,,NA,,NA,,NA,,NA,,NA,,NA,,NA,,NA,,NA,,NA,,NA,,NA,,NA,,NA,,NA,,NA,,NA,,NA,,NA,,NA,,NA,,NA,,NA,,NA,,NA,,NA,,NA,,NA,,NA,,NA,,NA,,NA,,NA,,NA,,NA,,NA,,NA,,NA,,NA,,NA,,NA,,NA,,NA,,NA,,NA,,NA,,NA,,NA,,NA,,NA,,NA,,NA,,NA,,NA,,NA,,NA,,NA,,NA,,NA,,NA,,NA,
40117291,Prenovost (2001),2001,['Extending school time'],NA,Spring 2000 Stanford Achievement Test (SAT-9) Reading test,,"Spring 2000 Stanford Achievement Test, Ninth Edition (SAT-9), for both reading and mathematics.",,"['Toolkit primary outcome', 'Reading primary outcome']",,0.0382,,0.0551,,Literacy: reading comprehension,,NA,,NA,,NA,,NA,,NA,,NA,,-0.0698,,0.1462,,Primary outcome,,['Sample: All'],,With business as usual,,['Post-test adjusted for baseline attainment'],,['Test type: Standardised test '],,Spring 2000 Stanford Achievement Test (SAT-9) Reading test,,"Spring 2000 Stanford Achievement Test, Ninth Edition (SAT-9), for both reading and mathematics.",,"['Toolkit primary outcome', 'Reading primary outcome']",,0.0382,,0.0551,,Literacy: reading comprehension,,NA,,NA,,NA,,NA,,NA,,NA,,-0.0698,,0.1462,,Primary outcome,,['Sample: All'],,With business as usual,,['Post-test adjusted for baseline attainment'],,['Test type: Standardised test '],,NA,,NA,,NA,,NA,,NA,,NA,,NA,,NA,,NA,,NA,,NA,,NA,,NA,,NA,,NA,,NA,,NA,,NA,,NA,,NA,,NA,,NA,,NA,,NA,,NA,,NA,,NA,,NA,,NA,,NA,,NA,,NA,,NA,,NA,,NA,,NA,,NA,,NA,,NA,,NA,,NA,,NA,,NA,,NA,,NA,,NA,,NA,,NA,,NA,,NA,,NA,,NA,,NA,,NA,,NA,,NA,,NA,,NA,,NA,,NA,,NA,,NA,,NA,,NA,,NA,,NA,,NA,,NA,,NA,,NA,,NA,,NA,,NA,,NA,,NA,,NA,
40117178,Reisner (2004),2004,['Extending school time'],NA,Standardised maths scores-extending school time,,"Difference in Change in Mathematics Standardized Scale Scores for Active Participants, Grades 3-8",,"['Toolkit primary outcome', 'Mathematics primary outcome']",,0.79,,0.0,,Mathematics,,NA,,NA,,NA,,NA,,NA,,NA,,0.79,,0.79,,Primary outcome,,NA,,With business as usual,,NA,,NA,,NA,,NA,,NA,,NA,,NA,,NA,,NA,,NA,,NA,,NA,,NA,,NA,,NA,,NA,,NA,,NA,,NA,,NA,,NA,,NA,,NA,,NA,,NA,,NA,,NA,,NA,,NA,,NA,,NA,,NA,,NA,,NA,,NA,,NA,,NA,,NA,,NA,,NA,,Standardised maths scores-extending school time,,"Difference in Change in Mathematics Standardized Scale Scores for Active Participants, Grades 3-8",,"['Toolkit primary outcome', 'Mathematics primary outcome']",,0.79,,0.0,,Mathematics,,NA,,NA,,NA,,NA,,NA,,NA,,0.79,,0.79,,Primary outcome,,NA,,With business as usual,,NA,,NA,,NA,,NA,,NA,,NA,,NA,,NA,,NA,,NA,,NA,,NA,,NA,,NA,,NA,,NA,,NA,,NA,,NA,,NA,,NA,,NA,,NA,,NA,,NA,,NA,,NA,,NA,,NA,,NA,,NA,,NA,,NA,,NA,,NA,,NA,,NA,,NA,,NA,,NA,
40117295,Riley (1997),1997,['Extending school time'],NA,Maths Achievment (t-test),,"Student achievement in mathematics was measured using a score from the Mathematics Achievement Test, a multiple choice examination designed by the researcher. Test items were based on the school district’s mathematics curriculum. Ten points were awarded for each of the 10 questions that were answered correctly. Thus, the scores ranged from 0 to 100, which is the customary format for presenting scores to students.",,"['Toolkit primary outcome', 'Mathematics primary outcome']",,0.5346,,0.163,,Mathematics,,78.0,,5.93,,0.0,,78.0,,0.001,,0.0,,0.215,,0.8541,,Primary outcome,,['Sample: All'],,With business as usual,,['Post-test unadjusted (select one from this group)'],,['Test type: Researcher developed test'],,NA,,NA,,NA,,NA,,NA,,NA,,NA,,NA,,NA,,NA,,NA,,NA,,NA,,NA,,NA,,NA,,NA,,NA,,NA,,NA,,NA,,NA,,NA,,NA,,NA,,NA,,NA,,NA,,NA,,NA,,NA,,NA,,NA,,NA,,NA,,NA,,NA,,NA,,Maths Achievment (t-test),,"Student achievement in mathematics was measured using a score from the Mathematics Achievement Test, a multiple choice examination designed by the researcher. Test items were based on the school district’s mathematics curriculum. Ten points were awarded for each of the 10 questions that were answered correctly. Thus, the scores ranged from 0 to 100, which is the customary format for presenting scores to students.",,"['Toolkit primary outcome', 'Mathematics primary outcome']",,0.5346,,0.163,,Mathematics,,78.0,,5.93,,0.0,,78.0,,0.001,,0.0,,0.215,,0.8541,,Primary outcome,,['Sample: All'],,With business as usual,,['Post-test unadjusted (select one from this group)'],,['Test type: Researcher developed test'],,NA,,NA,,NA,,NA,,NA,,NA,,NA,,NA,,NA,,NA,,NA,,NA,,NA,,NA,,NA,,NA,,NA,,NA,,NA,,NA,,NA,,NA,,NA,,NA,,NA,,NA,,NA,,NA,,NA,,NA,,NA,,NA,,NA,,NA,,NA,,NA,,NA,,NA,
40117160,Ritter (1992),1992,['Extending school time'],NA,Mathematics accuracy - extended school time,,"The scores used to compare the tw, groups of year-round and traditional calendar students were from the math series entitled Transition Mathematics. This is a pre-algebra program which prepares students to take algebra the following year. It is divided into thirteen sequential chapters. Each chapter is divided into several sections. A quiz follows each section and a chapter test is administered at the end of each chapter. All tests are uniformly prepared by the text at mid-year a competency test covering chapters one through six is given to the students. This score was used in the study.",,"['Toolkit primary outcome', 'Mathematics primary outcome']",,-0.0507,,0.2924,,Mathematics,,22.0,,85.86,,9.49,,25.0,,86.32,,8.4,,-0.6237,,0.5224,,Primary outcome,,['Sample: High achievers'],,With business as usual,,['Post-test adjusted for baseline attainment'],,['Test type: Standardised test '],,NA,,NA,,NA,,NA,,NA,,NA,,NA,,NA,,NA,,NA,,NA,,NA,,NA,,NA,,NA,,NA,,NA,,NA,,NA,,NA,,NA,,NA,,NA,,NA,,NA,,NA,,NA,,NA,,NA,,NA,,NA,,NA,,NA,,NA,,NA,,NA,,NA,,NA,,Mathematics accuracy - extended school time,,"The scores used to compare the tw, groups of year-round and traditional calendar students were from the math series entitled Transition Mathematics. This is a pre-algebra program which prepares students to take algebra the following year. It is divided into thirteen sequential chapters. Each chapter is divided into several sections. A quiz follows each section and a chapter test is administered at the end of each chapter. All tests are uniformly prepared by the text at mid-year a competency test covering chapters one through six is given to the students. This score was used in the study.",,"['Toolkit primary outcome', 'Mathematics primary outcome']",,-0.0507,,0.2924,,Mathematics,,22.0,,85.86,,9.49,,25.0,,86.32,,8.4,,-0.6237,,0.5224,,Primary outcome,,['Sample: High achievers'],,With business as usual,,['Post-test adjusted for baseline attainment'],,['Test type: Standardised test '],,NA,,NA,,NA,,NA,,NA,,NA,,NA,,NA,,NA,,NA,,NA,,NA,,NA,,NA,,NA,,NA,,NA,,NA,,NA,,NA,,NA,,NA,,NA,,NA,,NA,,NA,,NA,,NA,,NA,,NA,,NA,,NA,,NA,,NA,,NA,,NA,,NA,,NA,
40117223,Schinke (1988),1988,['Extending school time'],NA,bicultural competence skills (ANOVA),,NA,,['Toolkit primary outcome'],,0.49,,0.17,,Cognitive: other,,NA,,NA,,NA,,NA,,NA,,NA,,0.1568,,0.8232,,Primary outcome,,['Sample: All'],,With business as usual,,['Post-test unadjusted (select one from this group)'],,NA,,NA,,NA,,NA,,NA,,NA,,NA,,NA,,NA,,NA,,NA,,NA,,NA,,NA,,NA,,NA,,NA,,NA,,NA,,NA,,NA,,NA,,NA,,NA,,NA,,NA,,NA,,NA,,NA,,NA,,NA,,NA,,NA,,NA,,NA,,NA,,NA,,NA,,NA,,NA,,NA,,NA,,NA,,NA,,NA,,NA,,NA,,NA,,NA,,NA,,NA,,NA,,NA,,NA,,NA,,NA,,NA,,NA,,NA,,NA,,NA,,NA,,NA,,NA,,NA,,NA,,NA,,NA,,NA,,NA,,NA,,NA,,NA,,NA,,NA,,NA,,NA,,NA,,NA,,NA,,NA,,NA,,NA,,NA,,NA,,NA,,NA,,NA,,NA,,NA,,NA,,NA,,NA,,NA,,NA,,NA,
40117180,Schinke (2000),2000,['Extending school time'],NA,Reading comprehension - extended school time,,No clear description. Noted as reading skills (p. 55).,,"['Toolkit primary outcome', 'Reading primary outcome']",,0.3106,,0.0,,Literacy: reading comprehension,,NA,,NA,,NA,,NA,,NA,,NA,,0.3106,,0.3106,,Primary outcome,,['Sample: Average'],,With business as usual,,['Post-test adjusted for baseline attainment'],,['Test type: School-developed test'],,Reading comprehension - extended school time,,No clear description. Noted as reading skills (p. 55).,,"['Toolkit primary outcome', 'Reading primary outcome']",,0.3106,,0.0,,Literacy: reading comprehension,,NA,,NA,,NA,,NA,,NA,,NA,,0.3106,,0.3106,,Primary outcome,,['Sample: Average'],,With business as usual,,['Post-test adjusted for baseline attainment'],,['Test type: School-developed test'],,NA,,NA,,NA,,NA,,NA,,NA,,NA,,NA,,NA,,NA,,NA,,NA,,NA,,NA,,NA,,NA,,NA,,NA,,NA,,NA,,NA,,NA,,NA,,NA,,NA,,NA,,NA,,NA,,NA,,NA,,NA,,NA,,NA,,NA,,NA,,NA,,NA,,NA,,NA,,NA,,NA,,NA,,NA,,NA,,NA,,NA,,NA,,NA,,NA,,NA,,NA,,NA,,NA,,NA,,NA,,NA,,NA,,NA,,NA,,NA,,NA,,NA,,NA,,NA,,NA,,NA,,NA,,NA,,NA,,NA,,NA,,NA,,NA,,NA,,NA,,NA,
40117166,Shields (1996),1996,['Extending school time'],NA,Stanford Achievement Test Total Reading,,NA,,"['Toolkit primary outcome', 'Reading primary outcome']",,0.4196,,0.1894,,Literacy: reading comprehension,,NA,,NA,,NA,,NA,,NA,,NA,,0.0485,,0.7907,,Primary outcome,,['Sample: All'],,With business as usual,,['Post-test unadjusted (select one from this group)'],,['Test type: Standardised test '],,Stanford Achievement Test Total Reading,,NA,,"['Toolkit primary outcome', 'Reading primary outcome']",,0.4196,,0.1894,,Literacy: reading comprehension,,NA,,NA,,NA,,NA,,NA,,NA,,0.0485,,0.7907,,Primary outcome,,['Sample: All'],,With business as usual,,['Post-test unadjusted (select one from this group)'],,['Test type: Standardised test '],,NA,,NA,,NA,,NA,,NA,,NA,,NA,,NA,,NA,,NA,,NA,,NA,,NA,,NA,,NA,,NA,,NA,,NA,,NA,,NA,,NA,,NA,,NA,,NA,,NA,,NA,,NA,,NA,,NA,,NA,,NA,,NA,,NA,,NA,,NA,,NA,,NA,,NA,,NA,,NA,,NA,,NA,,NA,,NA,,NA,,NA,,NA,,NA,,NA,,NA,,NA,,NA,,NA,,NA,,NA,,NA,,NA,,NA,,NA,,NA,,NA,,NA,,NA,,NA,,NA,,NA,,NA,,NA,,NA,,NA,,NA,,NA,,NA,,NA,,NA,,NA,
40117298,Smeallie (1997),1997,['Extending school time'],NA,(ACAvg) score-extending school time ,,"A composite rating of overall performance in English, social studies, mathematics, and science (ACAvg).",,"['Toolkit primary outcome', 'Other outcome']",,-0.4767,,0.2578,,Combined subjects,,31.0,,1.11,,0.749,,31.0,,1.449,,0.652,,-0.9821,,0.0286,,Primary outcome,,NA,,With business as usual,,NA,,NA,,NA,,NA,,NA,,NA,,NA,,NA,,NA,,NA,,NA,,NA,,NA,,NA,,NA,,NA,,NA,,NA,,NA,,NA,,NA,,NA,,NA,,NA,,NA,,NA,,NA,,NA,,NA,,NA,,NA,,NA,,NA,,NA,,NA,,NA,,NA,,NA,,NA,,NA,,NA,,NA,,NA,,NA,,NA,,NA,,NA,,NA,,NA,,NA,,NA,,NA,,NA,,NA,,NA,,NA,,NA,,NA,,NA,,NA,,NA,,NA,,NA,,NA,,NA,,NA,,NA,,NA,,NA,,NA,,NA,,NA,,NA,,NA,,NA,,NA,,NA,,NA,,NA,,NA,,NA,,NA,,NA,,NA,,NA,,NA,,NA,,NA,,NA,,NA,,NA,,NA,,NA,,NA,,NA,,NA,,NA,
40117168,Sorensen (1995),1995,['Extending school time'],NA,Stanford Achievement Test - Reading Scores,,"The instrument used in this study was the Stanford Achievement Test, Eighth Edition (1989), Primary Level 3, Form J  Intermediate Level 1, Form J  and Intermediate Level 2, Form J.  This test was administered in the first month of each school year. Year-round students were administered the tests in August or September depending upon their school calendar, and the traditional school students were administered their tests in September.",,"['Toolkit primary outcome', 'Reading primary outcome']",,-0.0184,,0.0218,,Literacy: reading comprehension,,4807.0,,642.7,,43.7,,3745.0,,643.5,,43.4,,-0.0611,,0.0244,,Primary outcome,,NA,,With business as usual,,NA,,NA,,Stanford Achievement Test - Reading Scores,,"The instrument used in this study was the Stanford Achievement Test, Eighth Edition (1989), Primary Level 3, Form J  Intermediate Level 1, Form J  and Intermediate Level 2, Form J.  This test was administered in the first month of each school year. Year-round students were administered the tests in August or September depending upon their school calendar, and the traditional school students were administered their tests in September.",,"['Toolkit primary outcome', 'Reading primary outcome']",,-0.0184,,0.0218,,Literacy: reading comprehension,,4807.0,,642.7,,43.7,,3745.0,,643.5,,43.4,,-0.0611,,0.0244,,Primary outcome,,NA,,With business as usual,,NA,,NA,,NA,,NA,,NA,,NA,,NA,,NA,,NA,,NA,,NA,,NA,,NA,,NA,,NA,,NA,,NA,,NA,,NA,,NA,,NA,,NA,,NA,,NA,,NA,,NA,,NA,,NA,,NA,,NA,,NA,,NA,,NA,,NA,,NA,,NA,,NA,,NA,,NA,,NA,,NA,,NA,,NA,,NA,,NA,,NA,,NA,,NA,,NA,,NA,,NA,,NA,,NA,,NA,,NA,,NA,,NA,,NA,,NA,,NA,,NA,,NA,,NA,,NA,,NA,,NA,,NA,,NA,,NA,,NA,,NA,,NA,,NA,,NA,,NA,,NA,,NA,,NA,
40117229,St Pierre (2001),2001,['Extending school time'],NA,Spelling scores-extending school time,,Spelling standardized grades,,"['Toolkit primary outcome', 'Writing and spelling primary outcome.']",,0.4067,,0.0,,Literacy: spelling,,NA,,NA,,NA,,NA,,NA,,NA,,0.4067,,0.4067,,Primary outcome,,NA,,With business as usual,,NA,,NA,,NA,,NA,,NA,,NA,,NA,,NA,,NA,,NA,,NA,,NA,,NA,,NA,,NA,,NA,,NA,,NA,,NA,,NA,,NA,,NA,,NA,,NA,,NA,,NA,,NA,,NA,,NA,,NA,,NA,,NA,,NA,,NA,,NA,,NA,,NA,,NA,,NA,,NA,,NA,,NA,,NA,,NA,,NA,,NA,,NA,,NA,,NA,,NA,,NA,,NA,,NA,,NA,,NA,,NA,,NA,,NA,,NA,,NA,,NA,,NA,,NA,,NA,,NA,,NA,,NA,,NA,,NA,,NA,,NA,,NA,,NA,,NA,,NA,,NA,,NA,,NA,,NA,,NA,,NA,,NA,,NA,,NA,,NA,,NA,,NA,,NA,,NA,,NA,,NA,,NA,,NA,,NA,,NA,,NA,,NA,
38296685,Styles (2014),2014,"['Extending school time', 'Small group tuition', 'Oral language interventions']",NA,Y7 Reading (NGRT) - smgrouptuit/extschooltime Chbooks,,"Pre-test (digital) post-test (paper form) adjusted composite mean score for reading ability consisting of two subscales  sentence completion and passage comprehension (New Group Reading Test, GL). The correlation between the digital pre-test and paper post-test was r=0.64.",,"['Toolkit primary outcome', 'Reading primary outcome']",,-0.14,,0.087,,Literacy: reading comprehension,,NA,,NA,,NA,,NA,,NA,,NA,,-0.3105,,0.0305,,Primary outcome,,['Sample: Low achievers'],,With business as usual,,['Post-test adjusted for baseline attainment AND clustering'],,['Test type: Standardised test '],,Y7 Reading (NGRT) - smgrouptuit/extschooltime Chbooks,,"Pre-test (digital) post-test (paper form) adjusted composite mean score for reading ability consisting of two subscales  sentence completion and passage comprehension (New Group Reading Test, GL). The correlation between the digital pre-test and paper post-test was r=0.64.",,"['Toolkit primary outcome', 'Reading primary outcome']",,-0.14,,0.087,,Literacy: reading comprehension,,NA,,NA,,NA,,NA,,NA,,NA,,-0.3105,,0.0305,,Primary outcome,,['Sample: Low achievers'],,With business as usual,,['Post-test adjusted for baseline attainment AND clustering'],,['Test type: Standardised test '],,NA,,NA,,NA,,NA,,NA,,NA,,NA,,NA,,NA,,NA,,NA,,NA,,NA,,NA,,NA,,NA,,NA,,NA,,NA,,NA,,NA,,NA,,NA,,NA,,NA,,NA,,NA,,NA,,NA,,NA,,NA,,NA,,NA,,NA,,NA,,NA,,NA,,NA,,NA,,NA,,NA,,NA,,NA,,NA,,NA,,NA,,NA,,NA,,NA,,NA,,NA,,NA,,NA,,NA,,NA,,NA,,NA,,NA,,NA,,NA,,NA,,NA,,NA,,NA,,NA,,NA,,NA,,NA,,NA,,NA,,NA,,NA,,NA,,NA,,NA,,NA,
