40117138,Kneese (1996),1996,['Extending school time'],NA,NAPT NCE Reading (post test),,"The achievement measurements in reading test was derived from the administration of the Norm-referenced AssessmentProgram for Texas (NAPT) (Norm-referenced Assessment Program for Texas, 1993) of the Iowa Test of Basic Skills. This study focused only on the use of the reading portions of the NAPT. The reading test was a comprehensive test.",,"['Toolkit primary outcome', 'Reading primary outcome']",,0.3104,,0.0807,,Literacy: reading comprehension,,311.0,,61.46,,18.37,,311.0,,55.99,,16.8,,0.1522,,0.4685,,Primary outcome,,['Sample: All'],,With business as usual,,['Post-test unadjusted (select one from this group)'],,['Test type: Standardised test '],,NAPT NCE Reading (post test),,"The achievement measurements in reading test was derived from the administration of the Norm-referenced AssessmentProgram for Texas (NAPT) (Norm-referenced Assessment Program for Texas, 1993) of the Iowa Test of Basic Skills. This study focused only on the use of the reading portions of the NAPT. The reading test was a comprehensive test.",,"['Toolkit primary outcome', 'Reading primary outcome']",,0.3104,,0.0807,,Literacy: reading comprehension,,311.0,,61.46,,18.37,,311.0,,55.99,,16.8,,0.1522,,0.4685,,Primary outcome,,['Sample: All'],,With business as usual,,['Post-test unadjusted (select one from this group)'],,['Test type: Standardised test '],,NA,,NA,,NA,,NA,,NA,,NA,,NA,,NA,,NA,,NA,,NA,,NA,,NA,,NA,,NA,,NA,,NA,,NA,,NA,,NAPT NCE Math (Post test),,"The achievement measurements in mathmatics test was derived from the administration of the Norm-referenced AssessmentProgram for Texas (NAPT) (Norm-referenced Assessment Program for Texas, 1993) of the Iowa Test of Basic Skills. This study focused only on the use of the mathematics portions of the NAPT. The mathematics test results represent a total score in math achievement with three separate subtests  mathematics concepts, problem solving, and com putation.",,['Mathematics primary outcome'],,0.2817,,0.0806,,Mathematics,,311.0,,61.13,,18.54,,311.0,,56.19,,16.43,,0.1237,,0.4396,,Secondary outcome(s),,['Sample: All'],,With business as usual,,['Post-test unadjusted (select one from this group)'],,['Test type: Standardised test '],,NA,,NA,,NA,,NA,,NA,,NA,,NA,,NA,,NA,,NA,,NA,,NA,,NA,,NA,,NA,,NA,,NA,,NA,,NA,,NA,,NA,,NA,,NA,,NA,,NA,,NA,,NA,,NA,,NA,,NA,,NA,,NA,,NA,,NA,,NA,,NA,,NA,,NA,
40117141,Kneese (2000),2000,['Extending school time'],NA,NEA Reading (gain score),,NA,,"['Toolkit primary outcome', 'Reading primary outcome']",,0.0,,0.0615,,Literacy: reading comprehension,,429.0,,10.0,,0.0,,691.0,,0.0,,0.0,,-0.1205,,0.1205,,Primary outcome,,['Sample: All'],,With business as usual,,['Post-test unadjusted (select one from this group)'],,['Test type: National test'],,NEA Reading (gain score),,NA,,"['Toolkit primary outcome', 'Reading primary outcome']",,0.0,,0.0615,,Literacy: reading comprehension,,429.0,,10.0,,0.0,,691.0,,0.0,,0.0,,-0.1205,,0.1205,,Primary outcome,,['Sample: All'],,With business as usual,,['Post-test unadjusted (select one from this group)'],,['Test type: National test'],,NA,,NA,,NA,,NA,,NA,,NA,,NA,,NA,,NA,,NA,,NA,,NA,,NA,,NA,,NA,,NA,,NA,,NA,,NA,,NA,,NA,,NA,,NA,,NA,,NA,,NA,,NA,,NA,,NA,,NA,,NA,,NA,,NA,,NA,,NA,,NA,,NA,,NA,,NA,,NA,,NA,,NA,,NA,,NA,,NA,,NA,,NA,,NA,,NA,,NA,,NA,,NA,,NA,,NA,,NA,,NA,,NA,,NA,,NA,,NA,,NA,,NA,,NA,,NA,,NA,,NA,,NA,,NA,,NA,,NA,,NA,,NA,,NA,,NA,,NA,,NA,
40117142,Kuner-Roth (1985),1985,['Extending school time'],NA,Iowa Tests of Basic Skills (ITBS) Reading,,"The traditional year school district chose the Iowa Tests of Basic Skills for testing in both grades three and seven. Harris (Buros, 1978) analyzed the Iowa Tests of Basic Skills as a test battery designed to provide information on the status of pupil development in the basic skill areas. The Levels Edition included tests in the five major skill areas of reading comprehension, language arts, mathematics, vocabulary, and w ork-study skills.",,"['Toolkit primary outcome', 'Reading primary outcome']",,0.4496,,0.1156,,Literacy: reading comprehension,,NA,,NA,,NA,,NA,,NA,,NA,,0.2231,,0.6761,,Primary outcome,,['Sample: All'],,With business as usual,,['Post-test adjusted for baseline attainment'],,['Test type: Standardised test '],,Iowa Tests of Basic Skills (ITBS) Reading,,"The traditional year school district chose the Iowa Tests of Basic Skills for testing in both grades three and seven. Harris (Buros, 1978) analyzed the Iowa Tests of Basic Skills as a test battery designed to provide information on the status of pupil development in the basic skill areas. The Levels Edition included tests in the five major skill areas of reading comprehension, language arts, mathematics, vocabulary, and w ork-study skills.",,"['Toolkit primary outcome', 'Reading primary outcome']",,0.4496,,0.1156,,Literacy: reading comprehension,,NA,,NA,,NA,,NA,,NA,,NA,,0.2231,,0.6761,,Primary outcome,,['Sample: All'],,With business as usual,,['Post-test adjusted for baseline attainment'],,['Test type: Standardised test '],,NA,,NA,,NA,,NA,,NA,,NA,,NA,,NA,,NA,,NA,,NA,,NA,,NA,,NA,,NA,,NA,,NA,,NA,,NA,,NA,,NA,,NA,,NA,,NA,,NA,,NA,,NA,,NA,,NA,,NA,,NA,,NA,,NA,,NA,,NA,,NA,,NA,,NA,,NA,,NA,,NA,,NA,,NA,,NA,,NA,,NA,,NA,,NA,,NA,,NA,,NA,,NA,,NA,,NA,,NA,,NA,,NA,,NA,,NA,,NA,,NA,,NA,,NA,,NA,,NA,,NA,,NA,,NA,,NA,,NA,,NA,,NA,,NA,,NA,,NA,,NA,
40117259,Langberg (2007),2007,['Extending school time'],NA,Academic Grades - Language Arts,,"The academic year in Columbia, SC is divided into four quarters. All students receive report cards with letter grades at the end of each quarter (grade report). Throughout the Richland One school district in Columbia, SC grades are based on a uniform scale where a grade of 0-69 is an F, 70-76 is a D, 77-84 is a C, 85-92 is a B, and 93-100 is an A. An examination of class grades was conducted comparing mean grades at quarter 1 and quarter 2 in the four core classes, Science, History, Math, and Language Arts. ",,"['Toolkit primary outcome', 'Reading primary outcome']",,0.3419,,0.2932,,Literacy: reading comprehension,,21.0,,81.7,,6.8,,27.0,,78.9,,8.9,,-0.2328,,0.9167,,Primary outcome,,['Sample: Low achievers'],,With business as usual,,['Post-test unadjusted (select one from this group)'],,['Test type: School-developed test'],,Academic Grades - Language Arts,,"The academic year in Columbia, SC is divided into four quarters. All students receive report cards with letter grades at the end of each quarter (grade report). Throughout the Richland One school district in Columbia, SC grades are based on a uniform scale where a grade of 0-69 is an F, 70-76 is a D, 77-84 is a C, 85-92 is a B, and 93-100 is an A. An examination of class grades was conducted comparing mean grades at quarter 1 and quarter 2 in the four core classes, Science, History, Math, and Language Arts. ",,"['Toolkit primary outcome', 'Reading primary outcome']",,0.3419,,0.2932,,Literacy: reading comprehension,,21.0,,81.7,,6.8,,27.0,,78.9,,8.9,,-0.2328,,0.9167,,Primary outcome,,['Sample: Low achievers'],,With business as usual,,['Post-test unadjusted (select one from this group)'],,['Test type: School-developed test'],,NA,,NA,,NA,,NA,,NA,,NA,,NA,,NA,,NA,,NA,,NA,,NA,,NA,,NA,,NA,,NA,,NA,,NA,,NA,,NA,,NA,,NA,,NA,,NA,,NA,,NA,,NA,,NA,,NA,,NA,,NA,,NA,,NA,,NA,,NA,,NA,,NA,,NA,,NA,,NA,,NA,,NA,,NA,,NA,,NA,,NA,,NA,,NA,,NA,,NA,,NA,,NA,,NA,,NA,,NA,,NA,,NA,,NA,,NA,,NA,,NA,,NA,,NA,,NA,,NA,,NA,,NA,,NA,,NA,,NA,,NA,,NA,,NA,,NA,,NA,,NA,
40117258,Langberg (2008),2008,['Extending school time'],NA,Academic performance - homework,,"The primary purpose of this scale is to measure how well the child is performing academically. The Academic performance rating scale (APRS) is a 19-item scale that is completed by the teacher. Factor analyses of the APRS have documented a three-factor structure including Academic Success (AS), Impulse Control (IC), and Academic Productivity (AP) factors. The subscales can also be combined to produce an APRS Total Score. ",,"['Toolkit primary outcome', 'Other outcome']",,0.2702,,0.346,,Combined subjects,,24.0,,63.83,,10.4,,13.0,,60.92,,10.8,,-0.4079,,0.9483,,Primary outcome,,['Sample: Low achievers'],,With active control,,['Post-test adjusted for baseline attainment'],,['Test type: Standardised test '],,NA,,NA,,NA,,NA,,NA,,NA,,NA,,NA,,NA,,NA,,NA,,NA,,NA,,NA,,NA,,NA,,NA,,NA,,NA,,NA,,NA,,NA,,NA,,NA,,NA,,NA,,NA,,NA,,NA,,NA,,NA,,NA,,NA,,NA,,NA,,NA,,NA,,NA,,NA,,NA,,NA,,NA,,NA,,NA,,NA,,NA,,NA,,NA,,NA,,NA,,NA,,NA,,NA,,NA,,NA,,NA,,NA,,NA,,NA,,NA,,NA,,NA,,NA,,NA,,NA,,NA,,NA,,NA,,NA,,NA,,NA,,NA,,NA,,NA,,NA,,NA,,NA,,NA,,NA,,NA,,NA,,NA,,NA,,NA,,NA,,NA,,NA,,NA,,NA,,NA,,NA,,NA,,NA,,NA,,NA,
40117206,Lauver (2002),2002,['Extending school time'],NA,SAT-9 Reading Comprehension test score-extending school time ,,"SAT-9 Reading Comprehension Multiple Choice Test, National Percentile, Grades 7 & 8 Only ",,"['Toolkit primary outcome', 'Reading primary outcome']",,0.0871,,0.1763,,Literacy: reading comprehension,,67.0,,0.0,,0.0,,62.0,,0.62,,0.0,,-0.2585,,0.4326,,Secondary outcome(s),,['Sample: All'],,With business as usual,,['Post-test unadjusted (select one from this group)'],,['Test type: National test'],,SAT-9 Reading Comprehension test score-extending school time ,,"SAT-9 Reading Comprehension Multiple Choice Test, National Percentile, Grades 7 & 8 Only ",,"['Toolkit primary outcome', 'Reading primary outcome']",,0.0871,,0.1763,,Literacy: reading comprehension,,67.0,,0.0,,0.0,,62.0,,0.62,,0.0,,-0.2585,,0.4326,,Secondary outcome(s),,['Sample: All'],,With business as usual,,['Post-test unadjusted (select one from this group)'],,['Test type: National test'],,NA,,NA,,NA,,NA,,NA,,NA,,NA,,NA,,NA,,NA,,NA,,NA,,NA,,NA,,NA,,NA,,NA,,NA,,NA,,SAT-9 Math score-extending school time,,"SAT-9 Math Total Multiple Choice Test, National Percentile, Grades 7 & 8 only",,['Mathematics primary outcome'],,0.1081,,0.1771,,Mathematics,,67.0,,0.0,,0.0,,61.0,,0.54,,0.0,,-0.239,,0.4552,,Secondary outcome(s),,['Sample: All'],,,,['Post-test unadjusted (select one from this group)'],,['Test type: National test'],,NA,,NA,,NA,,NA,,NA,,NA,,NA,,NA,,NA,,NA,,NA,,NA,,NA,,NA,,NA,,NA,,NA,,NA,,NA,,NA,,NA,,NA,,NA,,NA,,NA,,NA,,NA,,NA,,NA,,NA,,NA,,NA,,NA,,NA,,NA,,NA,,NA,,NA,
40117260,Lee (2006),2006,['Extending school time'],NA,Literacy comprehension - Extnding School Time,,"The literacy assessment included items “designed to measure basic skill (print familiarity, letter recognition, beginning and ending sounds, rhyming sounds,word recognition), vocabulary (receptive vocabulary), and comprehension (listening comprehension, words in context). Comprehension items were targeted to measure skills in initial understanding, developing interpretation, personal reflection, and demonstrating critical stance” (NCES). The results from an HLM analysis by the between-school SD of each outcome estimated from the within-school model.",,"['Toolkit primary outcome', 'Reading primary outcome']",,0.93,,0.05,,Literacy: reading other,,NA,,NA,,NA,,NA,,NA,,NA,,0.832,,1.028,,Primary outcome,,['Sample: All'],,With business as usual,,['Post-test adjusted for baseline attainment AND clustering'],,['Test type: Standardised test '],,Literacy comprehension - Extnding School Time,,"The literacy assessment included items “designed to measure basic skill (print familiarity, letter recognition, beginning and ending sounds, rhyming sounds,word recognition), vocabulary (receptive vocabulary), and comprehension (listening comprehension, words in context). Comprehension items were targeted to measure skills in initial understanding, developing interpretation, personal reflection, and demonstrating critical stance” (NCES). The results from an HLM analysis by the between-school SD of each outcome estimated from the within-school model.",,"['Toolkit primary outcome', 'Reading primary outcome']",,0.93,,0.05,,Literacy: reading other,,NA,,NA,,NA,,NA,,NA,,NA,,0.832,,1.028,,Primary outcome,,['Sample: All'],,With business as usual,,['Post-test adjusted for baseline attainment AND clustering'],,['Test type: Standardised test '],,NA,,NA,,NA,,NA,,NA,,NA,,NA,,NA,,NA,,NA,,NA,,NA,,NA,,NA,,NA,,NA,,NA,,NA,,NA,,Mathematics accuracy - Extending School time,,"The mathematics assessment measured conceptual knowledge, procedural knowledge, and problem solving. The items  were equally divided between number sense and measurement. results were calculated by dividing. The results from an HLM analysis by the between-school SD of each outcome estimated from the within-school model.",,['Mathematics primary outcome'],,0.75,,0.05,,Mathematics,,NA,,NA,,NA,,NA,,NA,,NA,,0.652,,0.848,,Secondary outcome(s),,['Sample: All'],,With business as usual,,['Post-test adjusted for baseline attainment AND clustering'],,['Test type: Standardised test '],,NA,,NA,,NA,,NA,,NA,,NA,,NA,,NA,,NA,,NA,,NA,,NA,,NA,,NA,,NA,,NA,,NA,,NA,,NA,,NA,,NA,,NA,,NA,,NA,,NA,,NA,,NA,,NA,,NA,,NA,,NA,,NA,,NA,,NA,,NA,,NA,,NA,,NA,
40117283,Legro (1990),1990,['Extending school time'],NA,MAT - K to 1 & 1st to 2nd combined (fixed effect),,The Metropolitan Achievement Test - combined groups for fixed effect ,,"['Toolkit primary outcome', 'Other outcome']",,0.1877,,0.2282,,Combined subjects,,NA,,NA,,NA,,NA,,NA,,NA,,-0.2595,,0.6349,,Primary outcome,,NA,,With business as usual,,NA,,NA,,NA,,NA,,NA,,NA,,NA,,NA,,NA,,NA,,NA,,NA,,NA,,NA,,NA,,NA,,NA,,NA,,NA,,NA,,NA,,NA,,NA,,NA,,NA,,NA,,NA,,NA,,NA,,NA,,NA,,NA,,NA,,NA,,NA,,NA,,NA,,NA,,NA,,NA,,NA,,NA,,NA,,NA,,NA,,NA,,NA,,NA,,NA,,NA,,NA,,NA,,NA,,NA,,NA,,NA,,NA,,NA,,NA,,NA,,NA,,NA,,NA,,NA,,NA,,NA,,NA,,NA,,NA,,NA,,NA,,NA,,NA,,NA,,NA,,NA,,NA,,NA,,NA,,NA,,NA,,NA,,NA,,NA,,NA,,NA,,NA,,NA,,NA,,NA,,NA,,NA,,NA,,NA,,NA,,NA,,NA,
40117284,Leslie (1998),1998,['Extending school time'],NA,ITBS Reading,,The ITBS subsets in reading and mathematics were designed and constructed by the professional staff of the College of Education at the University of Iowa.,,"['Toolkit primary outcome', 'Reading primary outcome']",,0.8322,,0.2666,,Literacy: reading other,,NA,,NA,,NA,,NA,,NA,,NA,,0.3098,,1.3546,,Primary outcome,,['Sample: Low achievers'],,With business as usual,,['Post-test adjusted for baseline attainment'],,['Test type: Standardised test '],,ITBS Reading,,The ITBS subsets in reading and mathematics were designed and constructed by the professional staff of the College of Education at the University of Iowa.,,"['Toolkit primary outcome', 'Reading primary outcome']",,0.8322,,0.2666,,Literacy: reading other,,NA,,NA,,NA,,NA,,NA,,NA,,0.3098,,1.3546,,Primary outcome,,['Sample: Low achievers'],,With business as usual,,['Post-test adjusted for baseline attainment'],,['Test type: Standardised test '],,NA,,NA,,NA,,NA,,NA,,NA,,NA,,NA,,NA,,NA,,NA,,NA,,NA,,NA,,NA,,NA,,NA,,NA,,NA,,NA,,NA,,NA,,NA,,NA,,NA,,NA,,NA,,NA,,NA,,NA,,NA,,NA,,NA,,NA,,NA,,NA,,NA,,NA,,NA,,NA,,NA,,NA,,NA,,NA,,NA,,NA,,NA,,NA,,NA,,NA,,NA,,NA,,NA,,NA,,NA,,NA,,NA,,NA,,NA,,NA,,NA,,NA,,NA,,NA,,NA,,NA,,NA,,NA,,NA,,NA,,NA,,NA,,NA,,NA,,NA,,NA,
40117261,Lightner (2010),2010,"['Extending school time', 'Reading comprehension strategies']",NA,Reading achievement - extended school time,,"Group Reading and Diagnostic Evaluation (GRADE) tests five areas of reading development in order to provide the educator with relevant data to make informed decisions regarding the students’ personal learning plan. GRADE results are designed to be used with student background information, sample of the students oral reading skills and other immediate tools that provide a complete picture of the student and his or her reading ability.",,"['Toolkit primary outcome', 'Reading primary outcome']",,0.7923,,0.2918,,Literacy: reading comprehension,,26.0,,-2.878,,0.0,,25.0,,0.006,,0.0,,0.2204,,1.3642,,Primary outcome,,['Sample: Low achievers'],,With business as usual,,['Post-test unadjusted (select one from this group)'],,['Test type: Standardised test '],,Reading achievement - extended school time,,"Group Reading and Diagnostic Evaluation (GRADE) tests five areas of reading development in order to provide the educator with relevant data to make informed decisions regarding the students’ personal learning plan. GRADE results are designed to be used with student background information, sample of the students oral reading skills and other immediate tools that provide a complete picture of the student and his or her reading ability.",,"['Toolkit primary outcome', 'Reading primary outcome']",,0.7923,,0.2918,,Literacy: reading comprehension,,26.0,,-2.878,,0.0,,25.0,,0.006,,0.0,,0.2204,,1.3642,,Primary outcome,,['Sample: Low achievers'],,With business as usual,,['Post-test unadjusted (select one from this group)'],,['Test type: Standardised test '],,NA,,NA,,NA,,NA,,NA,,NA,,NA,,NA,,NA,,NA,,NA,,NA,,NA,,NA,,NA,,NA,,NA,,NA,,NA,,NA,,NA,,NA,,NA,,NA,,NA,,NA,,NA,,NA,,NA,,NA,,NA,,NA,,NA,,NA,,NA,,NA,,NA,,NA,,NA,,NA,,NA,,NA,,NA,,NA,,NA,,NA,,NA,,NA,,NA,,NA,,NA,,NA,,NA,,NA,,NA,,NA,,NA,,NA,,NA,,NA,,NA,,NA,,NA,,NA,,NA,,NA,,NA,,NA,,NA,,NA,,NA,,NA,,NA,,NA,,NA,,NA,
40117146,Matty (1978),1978,['Extending school time'],NA,Cooperative Maths Test (ANOVA),,"Cooperative Mathematics Test Form A was used for measuring algebra achievement. The test administered in the last week fo August 1975. The test measures achievement in the first year algebra. Achievement is assessed in terms of students' comprehension of the basic concepts, techniques and unifying principles in the content area. ",,"['Toolkit primary outcome', 'Mathematics primary outcome']",,0.87,,0.17,,Mathematics,,NA,,NA,,NA,,NA,,NA,,NA,,0.5368,,1.2032,,Primary outcome,,['Sample: All'],,With business as usual,,['Post-test adjusted for baseline attainment'],,['Test type: Standardised test '],,NA,,NA,,NA,,NA,,NA,,NA,,NA,,NA,,NA,,NA,,NA,,NA,,NA,,NA,,NA,,NA,,NA,,NA,,NA,,NA,,NA,,NA,,NA,,NA,,NA,,NA,,NA,,NA,,NA,,NA,,NA,,NA,,NA,,NA,,NA,,NA,,NA,,NA,,Cooperative Maths Test (ANOVA),,"Cooperative Mathematics Test Form A was used for measuring algebra achievement. The test administered in the last week fo August 1975. The test measures achievement in the first year algebra. Achievement is assessed in terms of students' comprehension of the basic concepts, techniques and unifying principles in the content area. ",,"['Toolkit primary outcome', 'Mathematics primary outcome']",,0.87,,0.17,,Mathematics,,NA,,NA,,NA,,NA,,NA,,NA,,0.5368,,1.2032,,Primary outcome,,['Sample: All'],,With business as usual,,['Post-test adjusted for baseline attainment'],,['Test type: Standardised test '],,NA,,NA,,NA,,NA,,NA,,NA,,NA,,NA,,NA,,NA,,NA,,NA,,NA,,NA,,NA,,NA,,NA,,NA,,NA,,NA,,NA,,NA,,NA,,NA,,NA,,NA,,NA,,NA,,NA,,NA,,NA,,NA,,NA,,NA,,NA,,NA,,NA,,NA,
40117357,McKinney (1995),1995,['Extending school time'],NA,Stanford Achievement Test - Reading,,The Stanford Achievement Tests were used to assess academic achievement in the areas of Total Reading and Total Math.,,"['Toolkit primary outcome', 'Reading primary outcome']",,0.2162,,0.3036,,Literacy: reading comprehension,,NA,,NA,,NA,,NA,,NA,,NA,,-0.3789,,0.8113,,Primary outcome,,['Sample: Low achievers'],,With business as usual,,['Post-test adjusted for baseline attainment'],,['Test type: Standardised test '],,Stanford Achievement Test - Reading,,The Stanford Achievement Tests were used to assess academic achievement in the areas of Total Reading and Total Math.,,"['Toolkit primary outcome', 'Reading primary outcome']",,0.2162,,0.3036,,Literacy: reading comprehension,,NA,,NA,,NA,,NA,,NA,,NA,,-0.3789,,0.8113,,Primary outcome,,['Sample: Low achievers'],,With business as usual,,['Post-test adjusted for baseline attainment'],,['Test type: Standardised test '],,NA,,NA,,NA,,NA,,NA,,NA,,NA,,NA,,NA,,NA,,NA,,NA,,NA,,NA,,NA,,NA,,NA,,NA,,NA,,NA,,NA,,NA,,NA,,NA,,NA,,NA,,NA,,NA,,NA,,NA,,NA,,NA,,NA,,NA,,NA,,NA,,NA,,NA,,NA,,NA,,NA,,NA,,NA,,NA,,NA,,NA,,NA,,NA,,NA,,NA,,NA,,NA,,NA,,NA,,NA,,NA,,NA,,NA,,NA,,NA,,NA,,NA,,NA,,NA,,NA,,NA,,NA,,NA,,NA,,NA,,NA,,NA,,NA,,NA,,NA,,NA,
40117358,Meier (2001),2001,['Extending school time'],NA,WRAT score-extending school time,,"Wide Range Achievement Test–3 Reading Subtest (WRAT–R), Blue Form. The WRAT–RReading Subtest consists of a Letter Reading section and a Word Reading section. For letter reading, students name 15 letters of the alphabet. For word reading, students are asked to pronounce 42 words. One point is given for each correct letter and word. A maximum of 57 points can be earned",,"['Toolkit primary outcome', 'Reading primary outcome']",,0.3433,,0.0,,Literacy: reading other,,NA,,NA,,NA,,NA,,NA,,NA,,0.3433,,0.3433,,Primary outcome,,NA,,With business as usual,,NA,,NA,,WRAT score-extending school time,,"Wide Range Achievement Test–3 Reading Subtest (WRAT–R), Blue Form. The WRAT–RReading Subtest consists of a Letter Reading section and a Word Reading section. For letter reading, students name 15 letters of the alphabet. For word reading, students are asked to pronounce 42 words. One point is given for each correct letter and word. A maximum of 57 points can be earned",,"['Toolkit primary outcome', 'Reading primary outcome']",,0.3433,,0.0,,Literacy: reading other,,NA,,NA,,NA,,NA,,NA,,NA,,0.3433,,0.3433,,Primary outcome,,NA,,With business as usual,,NA,,NA,,NA,,NA,,NA,,NA,,NA,,NA,,NA,,NA,,NA,,NA,,NA,,NA,,NA,,NA,,NA,,NA,,NA,,NA,,NA,,NA,,NA,,NA,,NA,,NA,,NA,,NA,,NA,,NA,,NA,,NA,,NA,,NA,,NA,,NA,,NA,,NA,,NA,,NA,,NA,,NA,,NA,,NA,,NA,,NA,,NA,,NA,,NA,,NA,,NA,,NA,,NA,,NA,,NA,,NA,,NA,,NA,,NA,,NA,,NA,,NA,,NA,,NA,,NA,,NA,,NA,,NA,,NA,,NA,,NA,,NA,,NA,,NA,,NA,,NA,,NA,,NA,
38296647,Menzies (2015),2015,['Extending school time'],NA,Y7 English (PIE) extending school time,,"Pre-test (PIE 11) post-test (PIE 12) adjusted mean score for general literacy measured by the Progress in English (PIE) GL assessment. Consists of editing exercises (spelling, grammatical and stylistic errors) and reading exercises (text comprehension and understanding of language in context).",,"['Toolkit primary outcome', 'Reading primary outcome']",,0.09,,0.087,,Literacy: reading other,,NA,,NA,,NA,,NA,,NA,,NA,,-0.0805,,0.2605,,Primary outcome,,['Sample: Low achievers'],,With business as usual,,['Post-test adjusted for baseline attainment AND clustering'],,['Test type: Standardised test '],,Y7 English (PIE) extending school time,,"Pre-test (PIE 11) post-test (PIE 12) adjusted mean score for general literacy measured by the Progress in English (PIE) GL assessment. Consists of editing exercises (spelling, grammatical and stylistic errors) and reading exercises (text comprehension and understanding of language in context).",,"['Toolkit primary outcome', 'Reading primary outcome']",,0.09,,0.087,,Literacy: reading other,,NA,,NA,,NA,,NA,,NA,,NA,,-0.0805,,0.2605,,Primary outcome,,['Sample: Low achievers'],,With business as usual,,['Post-test adjusted for baseline attainment AND clustering'],,['Test type: Standardised test '],,NA,,NA,,NA,,NA,,NA,,NA,,NA,,NA,,NA,,NA,,NA,,NA,,NA,,NA,,NA,,NA,,NA,,NA,,NA,,Y7 Maths (PIM 12) extending school time ,,"Post-test adjusted mean score for numeracy measured by the Progress in Maths 12 (PIM 12) GL assessment. The questions addressed Levels 3 to 6 of the National Curriculum and covered number, algebra, shape and space, measures, data handling and probability.",,['Mathematics primary outcome'],,0.08,,0.094,,Mathematics,,NA,,NA,,NA,,NA,,NA,,NA,,-0.1042,,0.2642,,Secondary outcome(s),,['Sample: Low achievers'],,With business as usual,,['Post-test adjusted for baseline attainment AND clustering'],,['Test type: Standardised test '],,NA,,NA,,NA,,NA,,NA,,NA,,NA,,NA,,NA,,NA,,NA,,NA,,NA,,NA,,NA,,NA,,NA,,NA,,NA,,NA,,NA,,NA,,NA,,NA,,NA,,NA,,NA,,NA,,NA,,NA,,NA,,NA,,NA,,NA,,NA,,NA,,NA,,NA,
41425840,Menzies (2016),2016,"['Extending school time', 'Arts participation']",NA,3rd Cohort Reading Outcome Y4/5,,"Academic outcomes were measured using the InCAS assessment provided by the Centre for Evaluation and Monitoring (Centre for Evaluation and Monitoring, 2016). The assessment is an adaptive computerised assessment suitable for children in Year 2 to Year 6.",,"['Toolkit primary outcome', 'Reading primary outcome']",,0.1,,0.05,,Literacy: reading comprehension,,NA,,NA,,NA,,NA,,NA,,NA,,0.002,,0.198,,Primary outcome,,['Sample: All'],,With business as usual,,['Post-test adjusted for baseline attainment AND clustering'],,NA,,3rd Cohort Reading Outcome Y4/5,,"Academic outcomes were measured using the InCAS assessment provided by the Centre for Evaluation and Monitoring (Centre for Evaluation and Monitoring, 2016). The assessment is an adaptive computerised assessment suitable for children in Year 2 to Year 6.",,"['Toolkit primary outcome', 'Reading primary outcome']",,0.1,,0.05,,Literacy: reading comprehension,,NA,,NA,,NA,,NA,,NA,,NA,,0.002,,0.198,,Primary outcome,,['Sample: All'],,With business as usual,,['Post-test adjusted for baseline attainment AND clustering'],,NA,,NA,,NA,,NA,,NA,,NA,,NA,,NA,,NA,,NA,,NA,,NA,,NA,,NA,,NA,,NA,,NA,,NA,,NA,,NA,,NA,,NA,,NA,,NA,,NA,,NA,,NA,,NA,,NA,,NA,,NA,,NA,,NA,,NA,,NA,,NA,,NA,,NA,,NA,,NA,,NA,,NA,,NA,,NA,,NA,,NA,,NA,,NA,,NA,,NA,,NA,,NA,,NA,,NA,,NA,,NA,,NA,,NA,,NA,,NA,,NA,,NA,,NA,,NA,,NA,,NA,,NA,,NA,,NA,,NA,,NA,,NA,,NA,,NA,,NA,,NA,,NA,
