74070004,Thurston (2019),2019,"Abstract A randomized controlled trial of peer tutoring was undertaken in 60 Grade 6/Year 7, and 60 Grade 8/Year 9 classrooms (1299 Grade 6/Year 7 students and 1275 Grade 8/Year 9 students). Grade 8/Year 9 students acted as reading tutors to Grade 6/Year 7 students. Reading attainment was measured with an independent commercially available standardized reading attainment test with two sub-scales, sentence completion and passage comprehension. Results of multi-level modeling indicated significant gains in sentence completion for students acting as tutors in the bottom decile of reading, with no gains, nor deficits observed in the sample as a whole.",['Peer tutoring'],NA,,NA,"Journal, Article",,['Journal article'],"['Page 3:\n[¬s]""co-operative paired reading[¬e]""']",NA,,['England'],,['Secondary/High school'],"['Page 4:\n[¬s]""This represented 1338 students randomized to control condition and 1236 randomised to receive the\npaired reading intervention.[¬e]""']",NA,,High ecological validity,"['Page 4:\n[¬s]""north east of England[¬e]""']",NA,,"['11', '12', '13', '14']","['Page 4:\n[¬s]""Average school size was 880 (SD 364) students, average free school meal (FSM) percentage\nwas 20.24%[¬e]""']",NA,,10,NA,,10,NA,,10,"['Page 4:\n[¬s]""drawn from 10 high school settings.[¬e]""']",,NA,NA,NA,,58,NA,,62,NA,,120,NA,,NA,NA,NA,,['No'],"['Page 4:\n[¬s]""This represented 1338 students randomized to control condition and 1236 randomised to receive the\npaired reading intervention.[¬e]""']",NA,,Random (please specify),"['Page 4:\n[¬s]""Data was therefore collected from 60, Grade 6/Year 7 and 60, Grade 8/Year 9 classes\ndrawn from 10 high school settings.[¬e]""']",NA,,Class,"['Page 4:\n[¬s]""Teachers also checked the appropriateness of\nreadability of books during observations. The tutor and tutee started by reading together.[¬e]""', 'Page 6:\n[¬s]""Teachers attended two CPD sessions per year starting in November. The ﬁrst day provided an overview of the techniques and\nresearch design. Demonstrations of the Paired Reading were given. A manual to support teachers was provided for each school.[¬e]""']",NA,,['Multisite RCT'],"['Page 4:\n[¬s]""Grade 8/Year 9 and\nGrade 6/Year 7 classes were paired on the basis of timetabling availability, and then assigned in pairs to intervention or control\ncondition at the class level. This represented 1338 students randomized to control condition and 1236 randomised to receive the\npaired reading intervention.[¬e]""']",NA,,Yes,"['Page 4:\n[¬s]""This represented 1338 students randomized to control condition and 1236 randomised to receive the paired reading intervention.""\n""Grade 8/Year 9 and\nGrade 6/Year 7 classes were paired on the basis of timetabling availability, and then assigned in pairs to intervention or control\ncondition at the class level.[¬e]""']",NA,,NA,NA,NA,,"['Other types of student outcomes (Please specify)', 'Cognitive outcomes measured (Please specify)']","['Page 8:\n[¬s]""However, if these conversions were correct then it could be argued that the 16-week duration of this project may account for nearly\n25% of their school-based reading development during their nine years of compulsory schooling. This is not an insigniﬁcant amount,[¬e]""', 'Page 9:\n[¬s]""and despite the time and eﬀort of organizing such an intervention, schools may decide that it is worth it to beneﬁt these hard to reach\nstudents and ‘close the attainment gap’, albeit slightly.[¬e]""', 'Page 8:\n[¬s]""In this, the most immediate\noutcome would be more reading being undertaken and more new words being learned. This could be expected to be the immediate\noutcome of an error correction-based process. The more complex metacognitive understanding of text would be more likely to\ndevelop over a longer time period that was available to the intervention. As the intervention took place in schools with high poverty\nrates then one might expect that the ability to make gains in metacognitve awareness of text would come more slowly to students\nfrom lower socio-economic status homes, and therefore the longer term outcomes of the project were unlikely to have been optimized\nbetween pre/post test time periods (Hart & Risley, 1995).[¬e]""']",NA,,"['Page 3:\n[¬s]""The form of co-operative paired reading chosen as the subject of this study was characterized by speciﬁc role taking as tutor or\ntutee (ﬁxed role, cross-age),[¬e]""']",NA,
74070005,Thurston (2021),2021,"There is strong evidence that peer tutoring, as a form of cooperative learning, has a positive impact on tutor and tutee outcomes. However, little previous research has been reported as to the differential effects of engaging in cooperative learning in dyads for peer tutors and peer tutees, respectively. A randomised controlled experimental study was undertaken involving 295, 11- to 13-year-old students, drawn from 12 classrooms, across three secondary/high schools situated in areas of low-socio-economic status, in the north east of England. In total, 146 students engaged in cooperative learning for a period of 12 weeks, and 149 students served as a comparison group. Gains were significantly greater on independent standardised reading comprehension tests for those engaged in cooperative learning than those in comparison classes, and greater for tutors than tutees. The results are explored by critically reflecting on the underlying theories of education that may be at play in classrooms using this form of cooperative learning.",['Peer tutoring'],NA,,NA,"Journal, Article",,['Journal article'],"['Page 1:\n[¬s]""Peer Tutoring for Tutors\nand Tutees[¬e]""']",NA,,['England'],,['Secondary/High school'],"['Page 4:\n[¬s]""comprising 295 (149 control/146 intervention) students.[¬e]""']",NA,,High ecological validity,"['Page 4:\n[¬s]""the north east of England[¬e]""']",NA,,"['11', '12', '13', '14']","['Page 4:\n[¬s]""Free School\nMeals rates were School A = 36.5%, School B = 30.1%, School C = 34.1%, compared to a\nnational average = 28.8%[¬e]""']",NA,,3,NA,,3,NA,,3,"['Page 4:\n[¬s]""The project comprised 12 classes, including\nsix Year 7 classes and six Year 9 classes, drawn from three of the eight secondary/high\nschools within this geographic area comprising[¬e]""']",,NA,NA,NA,,6,NA,,6,NA,,12,"['Page 5:\n[¬s]""This was set to generate a number of 0 = control (n = 6) and\n1 = paired reading (n = 6) classes[¬e]""']",,NA,NA,NA,,['No'],"['Page 5:\n[¬s]""Classes were randomised to condition pairwise for each teacher who volunteered\nto implement the technique. Classes were grouped in pairs for each of the six teachers\n(12 classes in total). Then each pair of classes was randomised to condition using a\nrandom number generator programme for iPhone: Version 5.5 123 The Random Number\nGenerator by Nicolas Dean.[¬e]""']",NA,,Random (please specify),"['Page 5:\n[¬s]""Classes were randomised to condition pairwise for each teacher who volunteered\nto implement the technique. Classes were grouped in pairs for each of the six teachers\n(12 classes in total).[¬e]""']",NA,,Class,"['Page 5:\n[¬s]""Classes were grouped in pairs for each of the six teachers\n(12 classes in total).""\n""This generated a sample of equal number of classes,\nwhere control classes and intervention classes were taught by the same teacher. Teachers\nsigned Memorandum of Understanding stating that they would only use the paired reading\ntechnique with target classes, and would use business as usual for control classes.[¬e]""']",NA,,['Cluster RCT'],"['Page 5:\n[¬s]""Classes were randomised to condition pairwise for each teacher who volunteered\nto implement the technique. Classes were grouped in pairs for each of the six teachers\n(12 classes in total).[¬e]""']",NA,,Yes,"['Page 5:\n[¬s]""Classes were grouped in pairs for each of the six teachers\n(12 classes in total). Then each pair of classes was randomised to condition using a\nrandom number generator programme for iPhone: Version 5.5 123 The Random Number\nGenerator by Nicolas Dean.[¬e]""']",NA,,['Yes'],"['Page 5:\n[¬s]""The top-attaining tutor in the Year 9 class\ntutored the top-attaining tutee in the Year 7 class; the second top tutor tutored the second\ntop tutee in the younger class, and so on.[¬e]""']",NA,,['Cognitive outcomes measured (Please specify)'],NA,TE_SUB Reading Comprehension,,NA,NA,
74070006,Tsuei (2020),2020,"Reading competence is one of the most critical skills for children’s academic success. In the study reported on here we proposed an integrated peer-tutoring strategy for reading comprehension that employs e-books for elementary school students. The effects of this strategy on children’s reading comprehension were investigated using a quasi-experimental design. Three classes of 11–12-year-old students (n = 73) participated in the study for 12 weeks. Compared to the control group, students in the experimental group, who engaged in peer tutoring with e-book reading, showed significant gains in reading comprehension. Students’ perceptions of the benefits of the peer-tutoring resources to their reading are discussed. The findings demonstrate that the integration of peer tutoring in e-book reading results in an effective instructional model for the enhancement of elementary school students’ reading.",['Peer tutoring'],NA,,NA,"Journal, Article",,['Journal article'],"['Page 1:\n[¬s]""a peer-tutoring strategy on children’s e-book reading comprehension[¬e]""']",NA,,['Taiwan'],,['Primary/elementary school'],"['Page 3:\n[¬s]""Three classes of fifth-graders (n = 73) in an elemen-\ntary school in Taipei, Taiwan, participated in this\nstudy for twelve weeks.[¬e]""']",NA,,High ecological validity,"['Page 3:\n[¬s]""Taipei, Taiwan,[¬e]""']",NA,,"['11', '12']","['Page 1:\n[¬s]""11–12-year-old students[¬e]""', 'Page 1:\n[¬s]""11–12-year-old students[¬e]""']",NA,,1,NA,,1,NA,,1,"['Page 3:\n[¬s]""Three classes of fifth-graders (n = 73) in an elemen-\ntary school in Taipei[¬e]""']",,NA,NA,NA,,2,"['Page 3:\n[¬s]""Using a quasi-experimental\ndesign, two classes were assigned as the experi-\nmental group (48 students)[¬e]""']",,1,"['Page 3:\n[¬s]""nd one class was as-\nsigned as the control group (25 students).[¬e]""']",,3,NA,,NA,NA,NA,,['No'],"['Page 3:\n[¬s]""Using a quasi-experimental\ndesign, two classes were assigned as the experi-\nmental group (48 students) and one class was as-\nsigned as the control group (25 students).[¬e]""']",NA,,Retrospective Quasi Experimental Design (QED),"['Page 3:\n[¬s]""two classes were assigned as the experi-\nmental group (48 students) and one class was as-\nsigned as the control group (25 students).[¬e]""']",NA,,Class,"['Page 3:\n[¬s]""Three teachers, each with a master’s degree\nand between ten and fifteen years of teaching expe-\nrience in reading participated in the study.[¬e]""']",NA,,['Prospective QED'],"['Page 3:\n[¬s]""Using a quasi-experimental\ndesign, two classes were assigned as the experi-\nmental group (48 students) and one class was as-\nsigned as the control group (25 students).[¬e]""']",NA,,Not applicable,NA,NA,,NA,NA,NA,,"['Other types of student outcomes (Please specify)', 'Cognitive outcomes measured (Please specify)']","['Page 4:\n[¬s]""The eBPT instructional strategy was designed by in-\ntegrating the peer-tutoring and reading-instruction""\n""strategies for e-books.[¬e]""', 'Page 9:\n[¬s]""Low-\nachieving and average-ability students wrote more\nin expressing their ideas on the seventh passage than\nthey did in writing about the first passage. Peer tu-\ntoring may have enhanced these students’ confi-\ndence when answering questions. Thus, teachers\nshould use constructed-response comprehension\nquestions in reading classes, as this approach results\nin the deepest meaning making.[¬e]""']",NA,,NA,NA,
74070007,Udaka (2009),2009,"There are certain ways of reading to young children that are more effective than others in increasing language, vocabulary, and building early literacy skills. Dialogic reading is a method to enhance shared book reading by providing a context for dialogue and interaction between the adult and the child. Dialogic reading has been shown to have positive effects on young childrens’ early literacy and language skills. Thus far, parents and teachers have used these techniques in the home and school in one-on-one or small group settings. However, results have been variable due to inconsistent implementation. The purpose of this study was to examine the effects of implementing dialogic reading techniques in a preschool setting via cross age tutoring by fifth grade students. Students in preschool and fifth grade were recruited from a school in Eastern Maryland. Fifth graders served as tutors and were trained to use dialogic reading techniques with preschool students in the same school. The tutoring dyads met three times a week for 30 minutes for 8 weeks. Preschoolers’ receptive and expressive language skills as well as their readiness to begin school were assessed before and after the intervention, and fifth grader’s attitudes towards reading prior to and after the intervention were measured. Data on the preschool students were analyzed using an Analysis of Covariance and the results indicated significant changes in receptive, expressive and school readiness in comparison to the control group with medium to large effect sizes (.402 - .640). Furthermore, data on tutor attitudes toward reading were analyzed using two-sample paired t-tests. Results revealed an increase in positive attitudes toward recreational reading, with an effect size of .653, and an increase in general reading attitudes with an effect size of .421. Finally, teachers reported observable differences in their students and expressed interest in continuing this project. Fifth graders maintained adequate treatment integrity and felt positive about their experiences. Preschoolers reported positive experiences in reading with their tutors. Further interpretation of results, implications for practice, and future directions are discussed.",['Peer tutoring'],NA,,NA,Dissertation,,['Dissertation or thesis'],NA,NA,,['USA'],,['Nursery school/pre-school'],NA,NA,,High ecological validity,"['Page 93:\n[¬s]""During the intervention period, fifth grade tutors met with their tutees on Monday,\nThursday and Friday, at the same time, from 12:35-12:55 every week.""\n""The tutors transitioned from recess to the preschool area\nindependently, where their materials were kept on a shelf.""\n""The preschool classroom teacher\nor her substitute was present at all times in order to supervise the intervention.[¬e]""']",NA,,"['4', '5', '9', '10', '11']",NA,NA,,1,"['Page 88:\n[¬s]""Participants were recruited from one elementary school[¬e]""']",,1,"['Page 88:\n[¬s]""Participants were recruited from one elementary school[¬e]""']",,1,"['Page 88:\n[¬s]""Participants were recruited from one elementary school[¬e]""']",,NA,NA,NA,,1,"['Page 91:\n[¬s]""Of the three preschool classrooms in this school, two of the teachers volunteered\ntheir classrooms for this study.[¬e]""']",,1,"['Page 91:\n[¬s]""Of the three preschool classrooms in this school, two of the teachers volunteered\ntheir classrooms for this study.[¬e]""']",,2,"['Page 91:\n[¬s]""Of the three preschool classrooms in this school, two of the teachers volunteered\ntheir classrooms for this study.[¬e]""']",,NA,NA,NA,,['No'],NA,NA,,Random (please specify),"['Page 67:\n[¬s]""Children were matched on pre-test scores and randomly assigned to\nexperimental and control conditions[¬e]""', 'Page 92:\n[¬s]""classrooms were randomly assigned to the treatment or no treatment conditions[¬e]""']",NA,,Class,"['Page 92:\n[¬s]""classrooms were randomly assigned to the treatment or no treatment conditions[¬e]""']",NA,,['Cluster RCT'],"['Page 91:\n[¬s]""These preschool classrooms were randomly assigned to\nthe treatment or the control conditions[¬e]""']",NA,,Yes,"['Page 89:\n[¬s]""Students enrolled in the randomly selected elementary school came from\nmoderate to low income families, and there was a total school enrollment of 314 students\nduring the 2007-2008 school year.""\n""Fifth grade students were recruited to take part as tutors in this study.[¬e]""', 'Page 91:\n[¬s]""Of the three preschool classrooms in this school, two of the teachers volunteered\ntheir classrooms for this study. These preschool classrooms were randomly assigned to\nthe treatment or the control conditions.[¬e]""']",NA,,['Yes'],NA,NA,,['Other types of student outcomes (Please specify)'],"['Page 91:\n[¬s]""All the\nfifth grade students participated willingly in the trainings, and filled out the Elementary\nReading Attitudes Survey [ERAS] (McKenna & Kear, 1990) on the last day of their\ntraining and again on the last day of the intervention.[¬e]""']",NA,,NA,NA,
74070008,Ullah (2018),2018,"The present study is aimed at analyzing the effects of peer tutoring on the academic achievement of students in the subject of biology at secondary level. The objectives of the study were  (1) To find out the effects of peer tutoring on the academic achievement of students in the subject of biology  and (2) To examine the effects of peer tutoring with respect to knowledge, comprehension and application levels in cognitive domain of Bloom Taxonomy. All 433,405 male students at secondary level of 10th grade of Khyber Pakhtunkhwa were the population of the study. Forty students were taken as the sample of the study from the Allied National Software Institute (ANSI) Mardan. The Posttest-Only Equivalent Group Design was used. The data collected from pretest and posttest were analyzed through an independent sample t-test. It was found that the mean score of the experimental group was significantly better than that of the control group. It was concluded that peer tutoring enhanced the academic achievement of students in the experimental group significantly as compared to the control group  hence, it was an effective method of instruction for teaching biology at secondary level. It was suggested that peer tutoring may be incorporated along with other teaching methodologies for the subject of biology and it may be given due consideration in all teacher education practices in the country.",['Peer tutoring'],NA,,['MT_2023 (in progress)'],"Journal, Article",,['Journal article'],NA,NA,,['Pakistan'],,['Secondary/High school'],"['Page 4:\n[¬s]""at secondary level of 10th grade[¬e]""']",NA,,Unclear,"['Page 4:\n[¬s]""All 433,405 male students at secondary level of 10th grade of Khyber Pakhtunkhwa were the\npopulation of study[¬e]""', 'Page 5:\n[¬s]""The study needed two teachers of equal qualiﬁcation, but the school administration had allotted\nonly one teacher. Anyhow, he was allotted to the control group and the researcher personally monitored\nthe experimental group.[¬e]""']","The intervention took place at school, however, the researcher monitored the experimental group. Furthermore, the nature of the intervention required peers to take charge in the teaching, so I'm not sure how this would effect the ecological validity.",,"['15', '16']","['Page 4:\n[¬s]""male students at secondary level of 10th grade[¬e]""']",NA,,1,"['Page 4:\n[¬s]""Allied National Software Institute (ANSI) school, Mardan was selected for the study[¬e]""']",,1,NA,,1,NA,,NA,NA,NA,,1,NA,,1,NA,,2,NA,,NA,NA,NA,,['No'],"['Page 5:\n[¬s]""The experimental group was engaged in supervised\npeer tutoring and the control group was taught through lecture demonstration method.[¬e]""']",NA,,Random (please specify),"['Page 4:\n[¬s]""The sample was further divided into two equivalent groups (experimental\nand control groups) based on pretest scores by using pair random sampling techniques.[¬e]""']",NA,,Individual,"['Page 4:\n[¬s]""The sample was further divided into two equivalent groups (experimental\nand control groups) based on pretest scores by using pair random sampling techniques.[¬e]""']",NA,,['Cluster RCT'],"['Page 4:\n[¬s]""There were\n110 secondary students enrolled in four section of ANSI school. The school administration allowed the\nresearcher to conduct the study in only two sections to avoid major disturbances. These two sections\nwere selected randomly among four sections. There were 47 students in two sections, 10th Green and\n10th Yellow.[¬e]""']",I think sections means class,,Yes,"['Page 4:\n[¬s]""These two sections\nwere selected randomly among four sections""\n""The sample was further divided into two equivalent groups (experimental\nand control groups) based on pretest scores by using pair random sampling techniques. Both groups\nwere further categorized into low-achiever and high-achiever students based onpretest scores. In the\nexperimental group the high achievers were named as tutors and low achievers were named as tutees[¬e]""']",NA,,['No'],NA,NA,,NA,NA,NA,,NA,NA,
74070009,Ullah (2020),2020,"The instructional method peer tutoring provides an opportunity to let students od diverse abilities pair with each other to work on academic task in friendly environment. This study was an attempt to analyse how peer tutoring played this role in enhancing the academic achievements of tutors and tutees at secondary level in reference to the main levels (knowledge, comprehension and application) of the cognitive domain. This study explored data from 40 purposefully selected participants of ANSI school Mardan, by applying the Pre-test Post-test Equivalent Group Design of experimental design and conducting achievement tests before and after the treatments in order to accomplish the target objectives. The analysis of the data through inferential statistics (t-test) confirmed that though the tutors of the experimental group achieved better score at knowledge and application levels of the cognitive domain  however, they were not better in the comprehension level on post-test in compare to the high achievers of the control group. In the same way, the performance of the tutees of the group under investigation was significantly better with regards to academic ability knowledge and comprehension at cognitive domain  however, at the application level there was no significant difference as compare to their correspondent low achievers of the controlled group. In the light of the findings it was concluded that the academic performance of the tutors as well as the tutees was significantly affected by peer tutoring.",['Peer tutoring'],NA,,['MT_2023 (in progress)'],"Journal, Article",,['Journal article'],NA,NA,,['Pakistan'],,['Secondary/High school'],"['Page 6:\n[¬s]""a higher secondary school in private sector[¬e]""']",NA,,Unclear,NA,"Intervention was conducted by the researcher, however, the peer tutoring module was really conducted by students.",,"['15', '16']","['Page 6:\n[¬s]""grade 10th[¬e]""']",NA,,NA,NA,,NA,NA,,NA,NA,,NA,NA,NA,,NA,NA,,NA,NA,,NA,NA,,NA,NA,NA,,['No'],"['Page 6:\n[¬s]""experimental group was exposed to peer tutoring on one hand and\ncontrol group was being taught using the method of lecture demonstration on the other hand.[¬e]""']",NA,,Random (please specify),"['Page 6:\n[¬s]""Then on the basis of the scores of\npre-tests and through pair random sampling, the sample was divided into two groups (experimental\nand control group) of equal nature.[¬e]""']",NA,,Individual,"['Page 6:\n[¬s]""Then on the basis of the scores of\npre-tests and through pair random sampling, the sample was divided into two groups (experimental\nand control group) of equal nature.[¬e]""']",NA,,['Cluster RCT'],"['Page 6:\n[¬s]""ANSI, a higher secondary school in private sector in district Mardan was chosen as site for\nthe study. The selection of school was based on the personal relation of the researcher with\nadministration and partly because the study was experimental which involved disturbance of normal\nsetup for six weeks, and thus no other school was agreed to allow this scenario. There were round\nabout 110 students studying in grade 10th in four sections, 10th Green, 10th Yellow, 10th Blue, and 10th\nWhite. The administrator of the school permitted the researcher for his experiment in two classes,\n10th Green and 10th Yellow to avoid disturbance of the whole section. Forty seven students were\nstudying in these two sections while seven students decline to participate[¬e]""']",This study has exactly the same n as 74070008 Ullah (2018) in the same group names and the same number of students dropping out due to refusal to take part - I have not coded it as it seems likely to be the same data published a second time and would misrepresent the n of different students in an aggregate ,,NA,NA,NA,,['No'],NA,NA,,NA,NA,NA,,NA,NA,
