74069978,McDuffie (2009),2009,"Differential effects of a peer-tutoring intervention on the academic achievement of 203 7th-grade science students with and without disabilities in co-teaching and non-co-teaching settings were examined over an 8-week period. Impact of peer tutoring was assessed using a 2 condition by 2 settings by 2 types of students analysis of covariance with pretests as covariates. Results indicate that the peer-tutoring intervention was associated with improvements in student performance, and students in co-teaching settings perform better than those in non-co-teaching settings, but no additional value was added when peer tutoring was implemented in co-taught classrooms. Because co-teaching is increasingly used for teaching students with disabilities in general education classroom settings, implications of these findings for current practice and the need for future research are discussed.",['Peer tutoring'],NA,,['MT_2023 (in progress)'],"Journal, Article",,['Journal article'],"['Page 3:\n[¬s]""Specifically, the purpose of this\nstudy was to examine (a) the effects of a peer-\ntutoring intervention on the academic achieve-\nment of middle school science students with and\nwithout disabilities, (b) differences in students’\nacademic achievement in science across co-taught\nand non-co-taught settings, and (c) the extent to[¬e]""', 'Page 4:\n[¬s]""which value is added when peer tutoring is imple-\nmented in the context of a co-taught setting.[¬e]""']",NA,,['USA'],,['Middle school'],"['Page 5:\n[¬s]""A total of 203 middle school stu-\ndents with and without disabilities participated in\nthe investigation.[¬e]""']",NA,,High ecological validity,"['Page 4:\n[¬s]""We conducted the study in eight classrooms in\nthe suburbs of a large metropolitan area in the\neastern United States.""\n""The larger of the two districts was the 12th\nlargest in the nation and educated approximately\n165,000 students, and the second district was\nsmaller but rapidly growing and educated approx-\nimately 10,784 students.[¬e]""']",NA,,"['12', '13', '14']","['Page 5:\n[¬s]""Overall, students ranged in age from 12 years\n1 month to 14 years 0 months with a mean age of\n12 years 9 months (SD = 5 months)[¬e]""', 'Page 5:\n[¬s]""Overall, students ranged in age from 12 years\n1 month to 14 years 0 months with a mean age of\n12 years 9 months (SD = 5 months)[¬e]""', 'Page 5:\n[¬s]""Overall, students ranged in age from 12 years\n1 month to 14 years 0 months with a mean age of\n12 years 9 months (SD = 5 months).[¬e]""']",NA,,2,"['Page 4:\n[¬s]""Participants included students and teachers\nfrom two middle schools[¬e]""']",,2,"['Page 4:\n[¬s]""Participants included students and teachers\nfrom two middle schools[¬e]""']",,2,NA,,NA,NA,NA,,4,"['Page 4:\n[¬s]""four inclusive middle school science classes that were co-taugh""\n""We examined four main conditions: (a) co-taught classes with peer tutoring, (b) co- taught classes without peer tutoring""\n""t and\nfour middle school science classes that were not\nco-taught.[¬e]""']",,4,"['Page 4:\n[¬s]""four inclusive middle school science classes that were co-taught""\n""and\nfour middle school science classes that were not\nco-taught.[¬e]""']",,8,"['Page 4:\n[¬s]""We conducted the study in eight classrooms[¬e]""']",,NA,NA,NA,,['Yes (Please specify)'],"['Page 5:\n[¬s]""The four co-taught classes and the four\nnon-co-taught classes were then randomly as-\nsigned to either peer-tutoring or non-peer-tutor-\ning conditions.[¬e]""']",NA,,Random (please specify),"['Page 5:\n[¬s]""The four co-taught classes and the four\nnon-co-taught classes were then randomly as-\nsigned to either peer-tutoring or non-peer-tutor-\ning conditions.[¬e]""']",NA,,Class,"['Page 4:\n[¬s]""Four general education teachers,\ntwo special education teachers, one instructional\nassistant, and one substitute teacher participated\nin the study.[¬e]""']",NA,,['Cluster RCT'],"['Page 4:\n[¬s]""eight classrooms""\n""four inclusive middle\nschool science classes that were co-taught[¬e]""']",NA,,Yes,"['Page 5:\n[¬s]""The four co-taught classes and the four\nnon-co-taught classes were then randomly as-\nsigned to either peer-tutoring or non-peer-tutor-\ning conditions.[¬e]""']",NA,,['Yes'],"['Page 7:\n[¬s]""During interven-\ntion, students participated in peer tutoring in\nplace of traditional instruction for the first 10\nmin of each class. Students were trained on the\nrules and procedures of peer tutoring and were in-\ntroduced to the peer-tutoring materials.[¬e]""']",NA,,"['Other types of student outcomes (Please specify)', 'Cognitive outcomes measured (Please specify)']","['Page 14:\n[¬s]""They felt that peer tutoring promoted learn-\ning through drill and practice, improved\nmemorization skills, and increased student engage-\nment.[¬e]""']",NA,,"['Page 14:\n[¬s]""They felt that peer tutoring promoted learn-\ning through drill and practice, improved\nmemorization skills, and increased student engage-\nment.[¬e]""', 'Page 15:\n[¬s]""Observational findings suggest that students\nin non-co-taught settings interacted more with\ntheir teachers than did students in co-taught set-\ntings.""\n""In addition, we examined how interactions\ndiffered between students with and without dis-\nabilities. Results indicated that students with dis-\nabilities received more (a) teacher initiated\ninteractions, (b) individual interactions, (c) inter-\nactions of greater length, and (d) behavior ori-\nented interactions than students without\ndisabilities did.[¬e]""']",NA,
74069981,Mitchell (2016),2016,"A quasi-experimental study examined some effects of cross-age tutoring on fourth grade tutors\u0027 and second grade tutees\u0027 ability to spell accurately and correct errors on their own rough drafts. Half of the participating tutors were trained in tutoring skills  half were not. All participants were given pre- and post-assessments. On dictated writing assessments, second graders improved significantly, although fourth graders did not. On a free writing assessment, both second and fourth graders had significant gain scores. Observations during tutoring sessions showed benefits for both tutors and tutees.",['Peer tutoring'],NA,,['MT_2023 (in progress)'],"Journal, Article",,['Journal article'],"['Page 4:\n[¬s]""The purpose of this study was to determine how implemen-\ntation of cross-age tutoring sessions could impact spelling accu-\nracy of selected fourth- and second-grade students.[¬e]""']",NA,,['USA'],,['Primary/elementary school'],"['Page 7:\n[¬s]""Participants were 43 fourth graders\nin two intact classes and 42 second graders in three intact classes.\nThese 85 students included 39 boys and 46 girls[¬e]""']",NA,,High ecological validity,"['Page 7:\n[¬s]""U.S. Intermountain West.[¬e]""']",NA,,"['7', '8', '9', '10']","['Page 7:\n[¬s]""The current study was conducted at a Title 1 elementary school in\nthe U.S. Intermountain West.[¬e]""']",NA,,1,"['Page 7:\n[¬s]""a Title 1 elementary school[¬e]""']",,1,NA,,1,NA,,NA,NA,NA,,2,"['Page 7:\n[¬s]""The\ntrained-tutors intervention group consisted of one-third of the\nfourth graders who were trained with tutoring strategies to work\nwith one of the second-grade classes. The untrained-tutors inter-\nvention group, also consisting of one-third of the fourth graders,\nhad not been trained but participated as tutors to students in an-\nother second-grade class. The wait-list control group consisted of\nthe remaining fourth graders and the third second-grade class.[¬e]""']",,1,"['Page 7:\n[¬s]""The wait-list control group consisted of\nthe remaining fourth graders and the third second-grade class.[¬e]""']",,3,NA,,NA,NA,NA,,['Yes (Please specify)'],"['Page 7:\n[¬s]""Following the example of Paquette’s (2009) work, this study em-\nployed a pre-/post-assessment quasi-experimental design.[¬e]""']",NA,,Retrospective Quasi Experimental Design (QED),"['Page 7:\n[¬s]""Participants were 43 fourth graders\nin two intact classes and 42 second graders in three intact classes.[¬e]""']",NA,,Class,"['Page 7:\n[¬s]""One of the authors trained the fourth graders in the trained-\ntutors intervention group. She was the teacher of one of the sec-\nond grade classes in this study.[¬e]""']",NA,,['Prospective QED'],"['Page 7:\n[¬s]""intervention group consisted of one-third of the\nfourth graders who were trained with tutoring strategies to work\nwith one of the second-grade classes. The untrained-tutors inter-\nvention group, also consisting of one-third of the fourth graders,\nhad not been trained but participated as tutors to students in an-\nother second-grade class. The wait-list control group consisted of\nthe remaining fourth graders and the third second-grade class.[¬e]""']",NA,,Not applicable,"['Page 7:\n[¬s]""The\ntrained-tutors intervention group consisted of one-third of the\nfourth graders who were trained with tutoring strategies to work\nwith one of the second-grade classes. The untrained-tutors inter-\nvention group, also consisting of one-third of the fourth graders,\nhad not been trained but participated as tutors to students in an-\nother second-grade class. The wait-list control group consisted of\nthe remaining fourth graders and the third second-grade class.[¬e]""']",NA,,NA,NA,NA,,['Other types of student outcomes (Please specify)'],"['Page 18:\n[¬s]""The one-on-one attention seemed to be positive, regardless\nof whether the tutors had been trained or not.[¬e]""']",NA,,NA,NA,
74069982,Müller (2016),2016,"Reading strategy interventions relying upon peer tutoring are a common way to foster poor readers' comprehension skills. Those interventions are based on the assumption that tutees benefit from the (higher) reading skills of their tutors. However, this interpersonal effect has not yet been tested explicitly because the effectiveness of peer tutoring is commonly analyzed separately for tutees and tutors or with aggregated data. The present study illustrates how interpersonal and individual effects of a peer-tutored reading strategy intervention can be estimated using dyads as units of analysis in structural equation modeling. To demonstrate the application of the model, data from an experimental intervention study comparing the effects of a peer-tutored reading strategy training and a control condition in Grade 4 (N = 68 dyads) were analyzed.",['Peer tutoring'],NA,,['MT_2023 (in progress)'],"Journal, Article",,['Journal article'],"['Page 5:\n[¬s]""The purpose of the present study was to demonstrate how the Actor-Partner Interdependence\nModel (APIM, Kenny, 1996), a type of structural equation model that controls for dyadic interde-\npendence, can be applied fruitfully to analyzing the effects of peer-tutored reading interventions.[¬e]""']",NA,,['Germany'],,['Primary/elementary school'],"['Page 7:\n[¬s]""The 172 fourth-graders originally taking part in this[¬e]""', 'Page 8:\n[¬s]""experimental pre-/posttest study were from 15 schools located in the urban areas of Giessen\nand Kassel (Germany).[¬e]""']",NA,,High ecological validity,"['Page 8:\n[¬s]""Giessen\nand Kassel (Germany)[¬e]""']",NA,,"['9', '10']","['Page 8:\n[¬s]"". In total, 133 parents provided information on their\nprofessional qualiﬁcations. One participant’s parents reported no school-leaving qualiﬁcation\n(ISCED-level 0, 0.75% of all parents who provided information), 38 parents reported having\nﬁnished basic education after Grade 9 or 10 (ISCED-level 1 and 2, 28.57%), 55 parents reported\nhaving ﬁnished upper secondary education or having received a degree from a vocational school\n(ISCED-level 3 and 4, 41.35%), and 39 parents reported having received an academic degree\n(ISCED-level 5 to 8, 29.32%).[¬e]""']",NA,,14,"['Page 8:\n[¬s]""14 schools[¬e]""']",,14,"['Page 8:\n[¬s]""The ﬁve dyads per class were ran-\ndomly allocated at the class level to either the reading strategy group (35 dyads) or the control\ngroup (51 dyads).[¬e]""']",,14,NA,,NA,NA,NA,,14,"['Page 8:\n[¬s]""From each class, the ﬁve children with\nthe lowest reading comprehension scores (all of them below the class average) were chosen as\ntutees""\n""68 tutees[¬e]""']",,14,"['Page 8:\n[¬s]""From each class""\n""the ﬁve children with the highest reading comprehension scores (all of them above the\nclass average) were chosen as tutors.""\n""Among the 68 tutors[¬e]""']",,14,"['Page 8:\n[¬s]""From each class, the ﬁve children with the lowest reading comprehension scores (all of them below the class average) were chosen as tutees and the ﬁve children with the highest reading comprehension scores (all of them above the class average) were chosen as tutors.""\n""As a result, the data of 68 dyads (34 reading strategy, 34 controls) from 14 schools were\nincluded in the analysis (68 tutees, 33 female, and 68 tutors, 34 female).[¬e]""']",,NA,NA,NA,,['No'],"['Page 8:\n[¬s]""The ﬁve dyads per class were ran-\ndomly allocated at the class level to either the reading strategy group (35 dyads) or the control\ngroup (51 dyads).[¬e]""']",NA,,Random (please specify),"['Page 8:\n[¬s]""The ﬁve dyads per class were ran-\ndomly allocated at the class level to either the reading strategy group (35 dyads) or the control\ngroup (51 dyads).[¬e]""']",NA,,Class,"['Page 8:\n[¬s]""All materials and manuals for both treatments were designed by the authors and tested in a\npreliminary study. The training consisted of 25 sessions each, occurring in addition to regular\nschool lessons twice a week and lasting 45 minutes. The training sessions were conducted by\nuniversity students who provided standardized instructions. Special feedback rules were also\ngiven to the tutors to standardize the communication within the dyad.[¬e]""']",NA,,['Cluster RCT'],"['Page 8:\n[¬s]""The ﬁve dyads per class were ran-\ndomly allocated at the class level to either the reading strategy group (35 dyads) or the control\ngroup (51 dyads).[¬e]""']","stratified dyads, the best reader tutor was matched to the worst reader tutee",,Yes,"['Page 8:\n[¬s]""The ﬁve dyads per class were ran-\ndomly allocated at the class level to either the reading strategy group (35 dyads) or the control\ngroup (51 dyads).[¬e]""']",NA,,['No'],"['Page 5:\n[¬s]""To this end, data from a peer-tutored reading strategy\nintervention in same-age groups in Grade 4 were used to examine interpersonal and individual\neffects on reading comprehension.[¬e]""']",NA,,NA,NA,NA,,NA,NA,
74069983,Nnamani (2020),2020,"The study focused on investigating the impact reciprocal peer tutoring teaching approach has in promoting interest among senior secondary school students in writing expository essay in Igbo –Etiti Local Government Area, South-East, Nigeria. The effect of gender in promoting interest in expository essay writing among senior secondary school students was also investigated. Two research questions and three null hypotheses guided the study. The study adopted a quasi- experimental design. 75 (32 males and 43 females) in two intact classes consisted of the sample for the study. Expository Essay Writing Interest Inventory (EEWII) which was face validated by four consultants was used as an instrument to data for the study. Mean, standard deviation and analysis of covariance (ANCOVA) were used to analyze the data collected. Results obtained revealed that reciprocal peer tutoring teaching approach was effective in promoting interest in expository essay among the students. The result also indicated that the variation in the mean interest scores of male and female students in expository essay was not significant. The interaction effect of gender and the teaching approach on mean interest scores of senior secondary school students in expository essay writing was also not significant. Hence, the researchers recommended that secondary school teachers should adopt this teaching approach for expository essay writing teaching in secondary schools.",['Peer tutoring'],NA,,NA,"Journal, Article",,['Journal article'],NA,NA,,['Nigeria'],,['Secondary/High school'],"['Page 4:\n[¬s]""The sample for this study was seventy-five\nmale and female (75) students that were drawn from two co-educational secondary schools in the Local\nGovernment area.[¬e]""']",NA,,High ecological validity,"['Page 4:\n[¬s]""It was carried out in Igbo-Etiti Local Government Area of Enugu State, South- East,\nNigeria.[¬e]""']",NA,,"['17', '18', '14', '15', '16']","['Page 4:\n[¬s]""senior secondary class two (SS 11)[¬e]""', 'Page 4:\n[¬s]""senior secondary class two (SS 11)[¬e]""']",NA,,2,NA,,2,NA,,2,NA,,NA,NA,NA,,NA,NA,,NA,NA,,NA,NA,,['not_provided'],NA,NA,,['Not specified or N/A'],"['Page 4:\n[¬s]""The research design was quasi-experimental design.[¬e]""']",NA,,Retrospective Quasi Experimental Design (QED),"['Page 4:\n[¬s]""The sample for this study was seventy-five\nmale and female (75) students that were drawn from two co-educational secondary schools in the Local\nGovernment area.[¬e]""']",NA,,Individual,"['Page 4:\n[¬s]""Regular classroom English\nteachers served as research assistants to the researchers and were equally trained by the researchers themselves\nin areas of purpose of the study, treatment procedures, and procedures for administration and collection of the\ninstruments.[¬e]""']",NA,,['Prospective QED'],NA,NA,,Not applicable,NA,NA,,['Yes'],NA,NA,,['Other types of student outcomes (Please specify)'],NA,"Also, it was indicated by the result that gender did not influence the interest of students in expository essay writing.",,NA,NA,
74069984,Ohadugha (2020),2020,"The study examined the Impact of Peer-Mediated Learning on achievement and motivation in computer science among senior secondary school students in Minna metropolis, Niger state. The study adopted a randomized pre-test, post-test control group design. Two hypotheses were formulated to guide the study. Purposive sampling technique was used to select four (4) Private Secondary Schools from Minna, Metropolis. Eighty (80) Students were drawn from the four Secondary Schools as sample size through stratified random sampling technique. Validated Test Instrument  Basic Computer Skills Acquisition Test (BCSAT) and Questionnaire  Motivated Strategy for Learning Questionnaire (MSLQ) vetted by experts from Computer Science and Educational Technology Departments were used for data collection. The BCSAT was made up of 20 items multiple-choice objective test questions to test students’ cognitive knowledge and 5 practical questions, each comprising steps that tested students’ computer practical skills while MSLQ, a Likert scale with 31 items was used to determine the motivational beliefs of students taught computer skills. ANOVA and Kruskal Wallis H test was used for data analysis and was tested at 0.05 level of significance. The study revealed that there was a statistically significant difference in the mean scores of students taught using Peer-Mediated Learning (PML) than those taught using conventional method. The study further revealed that students’ motivation towards PML were significantly positive when compared to the students taught using conventional method. Based on these findings, the researchers recommended that Secondary Schools should adopt PML for effective teaching and learning of computer skills related concepts in Computer Science.",['Peer tutoring'],NA,,['MT_2023 (in progress)'],"Journal, Article",,['Journal article'],NA,NA,,['Niger'],,['Secondary/High school'],NA,NA,,High ecological validity,"['Page 2:\n[¬s]""it is a teaching strategy where a group of\nstudents interact with one another in order to help each other learn and this is often done by one student\noccupying the role of tutor while the other the role of tutee.[¬e]""', 'Page 4:\n[¬s]""The classroom for the experimental group was flipped and the purpose of the instructional power point\npresentation on the DVD package was to allow the students have pre-existing knowledge on what they would\nlearn interactively in the class as peers as this formed the basis for their learning.[¬e]""']",NA,,"['15', '16', '17', '18']",NA,NA,,4,NA,,4,NA,,4,"['Page 1:\n[¬s]""four (4) Private Secondary Schools[¬e]""']",,NA,NA,NA,,NA,NA,,NA,NA,,NA,NA,,['not_provided'],NA,NA,,['No'],NA,NA,,Random (please specify),"['Page 1:\n[¬s]""randomized pre-test, post-test control group design.""\n""stratified random sampling technique.[¬e]""', 'Page 4:\n[¬s]""students were selected using the hat draw method in which 10 pieces of\npaper were written ‘Yes’ and others ‘No’ separately for male and female. Those that picked ‘Yes’ were\nselected while those that picked ‘No’ were dropped. T[¬e]""']",NA,,School - multi-site,"['Page 4:\n[¬s]""Purposive sampling was used to sample four (4) private secondary schools in Minna Metropolis.""\n""Students were first stratified\nbased on gender, then ten (10) students were selected using the hat draw method in which 10 pieces of\npaper were written ‘Yes’ and others ‘No’ separately for male and female.""\n""This gave a sample size of 20 students (10 males and 10\nfemales) from each of the secondary schools and a total sample size of 80 SSII students (40 males and 40\nfemales).[¬e]""']",NA,,['Individual RCT'],"['Page 1:\n[¬s]""randomized pre-test, post-test control group design[¬e]""']",NA,,No/Unclear,"['Page 4:\n[¬s]""The research design adopted for this research was a pre-test, post-test, control group design. The population\nof this study was the entire Senior Secondary School Students (841) of 2016/2017 in 31 Private Schools in\nMinna Metropolis, Niger State. Private Secondary Schools were the focus in this study. Purposive sampling\nwas used to sample four (4) private secondary schools in Minna Metropolis. The sample of this study\ncomprised of 80 Senior Secondary School Two Students (SSII).[¬e]""']",NA,,['Yes'],NA,NA,,['Other types of student outcomes (Please specify)'],"['Page 1:\n[¬s]""The study examined the Impact of Peer-Mediated Learning on achievement and motivation in computer\nscience among senior secondary school students""\n""Questionnaire: Motivated Strategy for Learning Questionnaire (MSLQ)[¬e]""']",NA,,NA,NA,
