74069958,Flores (2016),2016,"This study relates to the results obtained in the development of reading comprehension (RC) and self-concept as a reader in students who participated in Llegim en parella (Reading in pairs), a Catalan peer tutoring programme. The research combines a quasi-experimental design with the use of comparison groups and pre-tests/ post-tests for both variables  a qualitative approach is adopted by analysing the interactions in order to detect influencing factors. Statistically significant results were obtained for all students in terms of RC but only for student tutors in relation to reading self-concept. The factors involved in the improvements identified in RC are  reading strategies, scaffolding in inferential and deep comprehension questions. Regarding self-concept, the tutor’s own role, his involvement with their tutees’ progress, reading aloud and the metacognitive reflection processes, are all factors that enable us to explain the improvement in the tutor’s reading self-perception. The positive influence of peer tutoring on the development of reading competence through this programme is clearly evident.",['Peer tutoring'],NA,,['MT_2023 (in progress)'],"Journal, Article",,['Journal article'],"['Page 4:\n[¬s]""Llegim en parella (Reading in pairs)[¬e]""']",NA,,['Spain'],,['Primary/elementary school'],"['Page 5:\n[¬s]""The participants were 577 students (aged between 9 and 12 years) and 20 teachers from 10\nprimary schools in Catalonia (Spain).[¬e]""']",NA,,High ecological validity,"['Page 5:\n[¬s]""Catalonia (Spain).[¬e]""']",NA,,"['6', '7', '8', '9', '10', '11']",NA,NA,,10,"['Page 5:\n[¬s]""Both groups included students from each of the schools,""\n""10\nprimary schools[¬e]""']",,10,NA,,10,NA,,NA,NA,NA,,NA,NA,,NA,NA,,NA,NA,,['not_provided'],NA,NA,,['No'],"['Page 5:\n[¬s]""The sample of students was divided into an intervention group (IG), consisting of 441\nstudents, all of whom took part in the Reading in pairs programme between 2009 and\n2011; and a comparison group with 136 students.[¬e]""', 'Page 6:\n[¬s]""The quantitative approximation, with\na quasi-experimental design based on a pre-test/post-test type with non-equivalent compa-\nrison groups, enabled us to identify the changes that took place in each of the parameters\nunder scrutiny:[¬e]""']",NA,,Retrospective Quasi Experimental Design (QED),"['Page 5:\n[¬s]""The sample of students was divided into an intervention group (IG), consisting of 441\nstudents, all of whom took part in the Reading in pairs programme between 2009 and\n2011; and a comparison group with 136 students. Both groups included students from each\nof the schools, and it was the latter, and not the researchers, who decided which class\ngroups would take part in the programme and which would not, based on their own internal\norganisational reasons.[¬e]""']",NA,,Class,"['Page 5:\n[¬s]""In the IG, the teachers from each centre chose their preferred peer type for the pro-\ngramme, so there were 345 students who took part in ﬁxed tutoring and 96 in reciprocal\ntutoring.[¬e]""']",NA,,['Individual RCT'],"['Page 5:\n[¬s]""groups included students from each\nof the schools, and it was the latter, and not the researchers, who decided which class\ngroups would take part in the programme and which would not, based on their own internal\norganisational reasons.[¬e]""']",NA,,Yes,"['Page 5:\n[¬s]""The sample of students was divided into an intervention group (IG), consisting of 441\nstudents, all of whom took part in the Reading in pairs programme between 2009 and\n2011; and a comparison group with 136 students. Both groups included students from each\nof the schools, and it was the latter, and not the researchers, who decided which class\ngroups would take part in the programme and which would not, based on their own internal\norganisational reasons.[¬e]""']",NA,,['Yes'],"['Page 16:\n[¬s]""And ﬁnally, the metacognitive reﬂections developed\nwith other students, in this case, with the tutees during the pair self-assessment, which are a\nkey element for the training of competent readers (Baker, 2008; De Backer et al., 2012).""\n""Finally, we explain how interactions between student\npairs in a structured relationship (tutor and tutee) can produce actuations of scaffolding and\nmetacognitive help, which in turn offer greater learning opportunities for all students.[¬e]""']",NA,,"['Other types of student outcomes (Please specify)', 'Cognitive outcomes measured (Please specify)']","['Page 16:\n[¬s]""Teachers will most likely need to help\ntutees to become aware of their progress as readers and make internal attributions (predom-\ninantly their own effort) for their improvement. Again, the teacher’s role in helping tutees\nto become aware of their reading improvement is key, as they create room for reﬂection,\nand by evaluating the tutors, they also highlight each tutee’s individual progress.[¬e]""']",NA,,"['Page 5:\n[¬s]""The sample of students was divided into an intervention group (IG), consisting of 441\nstudents, all of whom took part in the Reading in pairs programme between 2009 and\n2011;[¬e]""']",NA,
74069960,Greene (2018),2018,"The current study employed a randomized controlled trial to evaluate the use of peer tutoring and fluency-based instruction to increase mathematics fluency with addition and subtraction computation skills. Forty-one elementary school students between the ages of eight and 12 years participated in the 8-week study using cross-age peer tutoring, Say All Fast Minute Every Day Shuffled, frequency building, and the morningside math facts curriculum (Johnson in Morningside mathematics fluency  math facts (vol 1–6  curriculum program), Morningside Press, Seattle, 2008). Pre- and post-test measures of mathematics fluency and calculation were conducted with all participants. A measure of social skills and competing problem behaviors was also conducted at pre- and post-testing to evaluate any additional effects of the peer tutoring model. The results demonstrated a statistically significant difference between groups on measures of mathematics fluency, with the experimental group demonstrating significantly higher scores than the control group at post-testing. There were no significant differences between groups on measures of social skills and competing problem behaviors or calculation. The findings indicate that cross-age peer tutoring and fluency-based instruction resulted in positive outcomes for tutees in the mathematics domain, specifically mathematics fluency.",['Peer tutoring'],NA,,['MT_2023 (in progress)'],"Journal, Article",,['Journal article'],NA,NA,,['Ireland'],,['Primary/elementary school'],"['Page 7:\n[¬s]""urban elementary school i[¬e]""']",NA,,High ecological validity,"['Page 7:\n[¬s]""e study took place in a room\nseparate to the participants\' regular classroom, either prior to break time in the\nmorning or after lunch in the afternoon. Participants came to the room in groups of 5\ndyads, and each dyad sat across the table from each other. T[¬e]""']",NA,,"['8', '9', '10', '11', '12']","['Page 2:\n[¬s]""between the ages of eight and 12 years pa[¬e]""']",NA,,1,NA,,1,NA,,1,"['Page 7:\n[¬s]""The study was conducted in the participants\' school, a Band One school within\nthe School Support Programme (Delivering Equality of Opportunity in Schools,\nDEIS) by the Irish Department of Education (DES 2005). DE[¬e]""']",,NA,NA,NA,,NA,NA,,NA,NA,,NA,NA,,['not_provided'],NA,NA,,['Yes (Please specify)'],NA,"As per instructions  'This study includes 3 groups  a) Experimental (tutees), b) control, c) tutor. Please code for a+c vs b.'",,Random (please specify),"['Page 12:\n[¬s]""Tutees (those in third and fourth grade) were stratified into pairs\naccording to their pre-test scores on the WJIII (Woodcock et al. 2001) Mathematics\nFluency subtest. Participants were matched into pairs according to the participant\nwho had the next closest standard score to theirs. Participants in and each pair were\nthen randomly assigned to either the control group (n = 14) or experimental group\n(n = 15) using stratified randomization design. Pre[¬e]""', 'Page 6:\n[¬s]""A stratified randomized controlled trial (RCT) was employed to ev[¬e]""']",NA,,Individual,"['Page 12:\n[¬s]""Tutees (those in third and fourth grade) were stratified into pairs\naccording to their pre-test scores on the WJIII (Woodcock et al. 2001) Mathematics\nFluency subtest. Participants were matched into pairs according to the participant\nwho had the next closest standard score to theirs. Participants in and each pair were\nthen randomly assigned to either the control group (n = 14) or experimental group\n(n = 15) using stratified randomization design. Pre[¬e]""']",NA,,['Individual RCT'],"['Page 2:\n[¬s]""y-one elementary school\nstudents between the ages of eight and 12 years participated in the 8- week study\nusing cross-age peer tutoring,[¬e]""']",NA,,No/Unclear,NA,NA,,['Yes'],NA,social skills,,['Other types of student outcomes (Please specify)'],"['Page 10:\n[¬s]""The Social Skills Improvement System - Rating Scales (SSIS-RS; Gresham and\nElliott 2008) i[¬e]""', 'Page 2:\n[¬s]""measure of social skills and competing\nproblem behaviors was also conducted at pre- and post-testing to evaluate any\nadditional effects of the peer tutoring model. The re[¬e]""']",NA,,NA,NA,
74069961,Greenwood (1991),1991,"This longitudinal study investigated the effects of time spent in academic instruction and time engaged on elementary students' academic achievement gains. Three groups were compared over grades as follows  (a) an at-risk experimental group of low-socioeconomic status (SES) students for whom teachers implemented classwide peer tutoring (CWPT) beginning with the second semester of first grade continuing through Grade 3  (h) an equivalent at-risk control group  and (c) a non-risk comparison group of students of average- to high-SES. In both the control and comparison groups, teachers employed conventional instructional practices over Grades 1 through 3. Results indicated significant group differences in the time spent in academic instruction, engagement, and gains on the subtests of the Metropolitan Achievement Test that favored the experimental and comparison groups over the control group. Implications include the effectiveness of CWPT for at-risk students and the continuing vulnerability of at-risk students whose daily instructional programs provide less instructional time and foster lower levels of active academic engagement.",['Peer tutoring'],NA,,['MT_2023 (in progress)'],"Journal, Article",,['Journal article'],NA,NA,,['USA'],,['Primary/elementary school'],"['Page 1:\n[¬s]""elementary students[¬e]""']",NA,,High ecological validity,"['Page 5:\n[¬s]""Teachers organize the academic content to be\ntutored into daily and weekly units and prepare\nmaterials to be used within the CWPT format.\nTutoring occurs simultaneously for all tutor-tutee\npairs involving the entire class at the same time.\nThis leaves the classroom teacher free to super-\nvise and monitor students\' responding during tu-\ntoring sessions.""\n""Each year, the exper-\nimental group teachers were trained to implement\nthe CWPT procedures.[¬e]""']",NA,,"['5', '6', '7', '8']",NA,NA,,NA,NA,,NA,NA,,9,"['Page 2:\n[¬s]""The final sample\nconsisted of six Chapter I schools and three non-\nChapter 1 schools.[¬e]""']",,NA,NA,NA,,NA,NA,,NA,NA,,NA,NA,,['not_provided'],not provided,NA,,['Yes (Please specify)'],NA,As per instructions  'MDE  There are 3 arms in this study  (a) an at-risk experimental group of low-socioeconomic status (SES) class wide peer tutoring (CWPT)  (b) an equivalent at-risk control group  and (c) a non-risk comparison group of students of average- to high-SES. Please code for a vs b.',,"Non-random, not matched prior to treatment","['Page 2:\n[¬s]""To limit experimental contamination between\nteachers assigned to different conditions, all\nteachers and students within a school were as-\nsigned to the same condition[¬e]""']",NA,,School - cluster,"['Page 2:\n[¬s]""all\nteachers and students within a school were as-\nsigned to the same condition[¬e]""']",NA,,['Cluster RCT'],"['Page 2:\n[¬s]""Random selections were made\nwithin these SES-status groups. The final sample\nconsisted of six Chapter I schools and three non-\nChapter 1 schools. Because two low-SES school\nfaculties declined participation, additional ran-\ndom selections were made to replace them.[¬e]""']",NA,,No/Unclear,NA,NA,,['Yes'],NA,cognitive outcomes,,['Cognitive outcomes measured (Please specify)'],"['Page 5:\n[¬s]""The Otis-Lennon School Abil-\nities Test-Primary I, Form R (Otis & Lennon,\n1979) was used to obtain measured IQs.[¬e]""']",NA,,NA,NA,
74069962,Gyanani (1995),1995,This study explored the efficacy of peer tutoring in the development of verbal and spatial abilities that helps students attain a high level of academic achievement in geography. Students studying in class VIII of five selected schools took one standardized and three self-made tests. Results indicated that peer tutoring strategy plays a significant role in increasing the verbal and spatial abilities as well as in raising the academic level of students in geography.,['Peer tutoring'],NA,,['MT_2023 (in progress)'],"Journal, Article",,['Journal article'],NA,NA,,['India'],,['Secondary/High school'],NA,"method section, students ages 11-16",,High ecological validity,NA,"Whilst the investigator presented to the class, the work was carried out in the usual school setting. ",,"['11', '12', '13', '14', '15', '16']",NA,students ages 11-16,,NA,NA,,NA,NA,,5,NA,,NA,NA,NA,,NA,NA,,NA,NA,,NA,NA,,['not_provided'],"5 schools tot, each of them with 2 or more 8th grade classes, so the total n° of classes can't be calculated precisely (>/= 10)",NA,,['No'],NA,NA,,Random (please specify),NA,"P.470  'equated on the basis of age, intelligence, and existing knowledge of the subject of geography...The experimental and control groups were decided on the basis of random selection by flipping a coin.'",,Not provided/ not available,NA,NA,,['Prospective QED'],NA,matched groups that were later randomly allocated to experimental & control,,Not applicable,NA,NA,,['No'],NA,NA,,NA,NA,NA,,NA,NA,
74069963,Hattie (2006),2006,"Abstract This article presents three related evaluation studies looking at the effectiveness on achievement and motivation of Reading Together, a cross-age peer-tutoring reading program. The effects on tutees, tutors, teachers, and parents were monitored. The advantages of Reading Together began to accrue during the second and third phases of the program. Comparisons to the teaching of reading in the students' regular classrooms were made, and those regular classroom teachers who favored a skills-based approach, as opposed to a whole language or phonics approach recorded the greatest gains for students in the participating group and also for those in the control group.",['Peer tutoring'],NA,,['MT_2023 (in progress)'],"Journal, Article",,['Journal article'],NA,NA,,['USA'],,['Primary/elementary school'],"['Page 12:\n[¬s]""Grade 2 and 124 Grade 5 students participated[¬e]""']",NA,,High ecological validity,NA,"Takes place in the students' school, working with usual teacher and older/younger children from same school.",,"['7', '10', '11', '8']",NA,NA,,13,NA,,13,NA,,13,"['Page 12:\n[¬s]""Across 13 schools, 124 Grade 2 and 124 Grade 5 students participated in the\nReading Together program[¬e]""']",,NA,NA,NA,,NA,NA,,NA,NA,,NA,NA,,['not_provided'],NA,NA,,['No'],NA,As per instructions  'MDE  Please code Evaluation 3.',,"Non-random, but matched","['Page 12:\n[¬s]""Much care was taken to ensure that there were\nno initial differences in reading achievement and motivation either between the two groups\nwithin each school, or among groups across the schools. Similarly, no child was chosen for\neither group if he or she was considered to have a behavior problem or was involved in\nanother pull-out program.[¬e]""', 'Page 8:\n[¬s]""We had planned to randomly\nassign the students into the program group and the control group. However, the teachers\nwanted to have an influence over which students received the Reading Together program.\nThis was accepted for two main reasons: (i) it was important for ensuring a positive\nworking relationship with the teachers; and (ii) it was unlikely that there would be large\ndifferences between the experimental and control groups since they both met the rather\nstringent requirements for entry into the program.[¬e]""']",NA,,Individual,"['Page 12:\n[¬s]""Across 13 schools, 124 Grade 2 and 124 Grade 5 students participated in the\nReading Together program. At the beginning of the program, a control group was chosen\nfrom the remainder of the Grade 2 students.[¬e]""']",NA,,['Prospective QED'],"['Page 12:\n[¬s]""At the beginning of the program, a control group was chosen\nfrom the remainder of the Grade 2 students.[¬e]""']",NA,,Not applicable,NA,NA,,['No'],NA,NA,,NA,NA,NA,,NA,NA,
74069964,Johnson (2011),2011,"The purpose of this study was to determine the effect of peer-based instruction on rhythm reading achievement of instrumental and choral music students attending a large urbanfringe high school in a major metropolitan area. Participants (N = 131) included band (n = 71) and choir (n = 60) students whose backgrounds reflected extensive economic (78% free or reduced lunch) and ethnic diversity (44% Hispanic, 31% Caucasian, 6% African American, 11% Asian/Pacific islander, 8% Native American). Using a randomized, post-test only experimental design, students were randomly assigned to one of two treatment conditions  traditional teacher-led instruction or reciprocal peer-based instruction. After a two-week instruction period, results show that students receiving peer-based instruction demonstrated significantly higher levels of rhythm reading achievement than students receiving traditional teacher led instruction. Factorial ANOVA analyses revealed that music reading self-concept did not significantly moderate rhythm reading achievement. A significant interaction was found between ensemble type (band/choir) and method of instruction (on rhythm reading achievement) with peer-based instruction effects on rhythm reading achievement noticeably stronger for choir students.",['Peer tutoring'],NA,,['MT_2023 (in progress)'],"Journal, Article",,['Journal article'],NA,NA,,['USA'],,['Secondary/High school'],NA,NA,,High ecological validity,"['Page 7:\n[¬s]""The setting for this study was purposively chosen due to its status as one of only\na few high schools in the nation with a curriculum that is entirely standards-based,\nwhere students are grouped by ability in all subjects rather than by age (Vail, 2010).[¬e]""', 'Page 8:\n[¬s]""fter\ncompleting the MUSPI, band and vocal students were randomly assigned to one of\ntwo instructional formats: traditional didactic instruction that typified the teacher-led\nsecondary music ensemble classroom environment, or peer-based instruction where\nstudents were randomly paired with a partner to work within a reciprocal instruction\nmodel where students played both the roles of helper and helped.[¬e]""']","Took place in their school with their peers. As students are mixed by ability rather than age as part of their usual school experience, being mixed with pupils for the study would not have been out of the ordinary.",,"['11', '12', '13', '14', '15', '16']","['Page 7:\n[¬s]""music self-conc\nthe high school""\n""The setting for this study was purposively chosen due to its status as one of only\na few high schools in the nation with a curriculum that is entirely standards-based,\nwhere students are grouped by ability in all subjects rather than by age (Vail, 2010).[¬e]""']",NA,,1,NA,,1,NA,,1,"['Page 7:\n[¬s]""The setting for this study was purposively chosen due to its status as one of only\na few high schools in the nation with a curriculum that is entirely standards-based,\nwhere students are grouped by ability in all subjects rather than by age (Vail, 2010).[¬e]""']",,NA,NA,NA,,NA,NA,,NA,NA,,NA,NA,,['not_provided'],NA,NA,,['No'],NA,NA,,Random (please specify),"['Page 2:\n[¬s]""ing a randomized, post-test only experimental\ndesign""\n"", students were randomly assigned to one of two treatment conditions: traditional\nteacher-led instruction or reciprocal peer-based instruct[¬e]""']",NA,,Individual,"['Page 8:\n[¬s]""After\ncompleting the MUSPI, band and vocal students were randomly assigned to one of\ntwo instructional formats: traditional didactic instruction that typified the teacher-led\nsecondary music ensemble classroom environment, or peer-based instruction where\nstudents were randomly paired with a partner to work within a reciprocal instruction\nmodel where students played both the roles of helper and helped.[¬e]""']",NA,,['Individual RCT'],NA,NA,,No/Unclear,NA,NA,,['No'],NA,NA,,NA,NA,NA,,NA,NA,
