id,pub_author,pub_year,abstract,strand_raw,strand_info,strand_CLEAN,toolkit_version,pub_eppi,pub_eppi_CLEAN,pub_type_raw,pubtype_ht,pubtype_info,pub_type_CLEAN,loc_country_raw,loc_country_CLEAN,int_setting_raw,int_setting_ht,int_setting_info,int_Setting_CLEAN,eco_valid_raw,eco_valid_ht,eco_valid_info,eco_valid_CLEAN,part_age_raw,part_age_ht,part_age_info,part_age_CLEAN,school_treat_info,school_treat_ht,school_treat_CLEAN,school_cont_info,school_cont_ht,school_cont_CLEAN,school_total_info,school_total_ht,school_total_CLEAN,school_na_raw,school_na_info,school_na_ht,school_na_CLEAN,class_treat_info,class_treat_ht,class_treat_CLEAN,class_cont_info,class_cont_ht,class_cont_CLEAN,class_total_info,class_total_ht,class_total_CLEAN,class_na_raw,class_na_info,class_na_ht,class_na_CLEAN,treat_group_raw,treat_group_ht,treat_group_info,treat_group_CLEAN,part_assig_raw,part_assig_ht,part_assig_info,part_assig_CLEAN,level_assig_raw,level_assig_ht,level_assig_info,level_assig_CLEAN,int_desig_raw,int_design_ht,int_design_info,int_design_CLEAN,rand_raw,rand_ht,rand_info,rand_CLEAN,out_other_raw,out_other_ht,out_other_info,out_other_CLEAN,out_info_raw,out_info_ht,out_info_info,out_info_CLEAN,part_other_ht,part_other_info,part_other_CLEAN
74069942,Alegre (2019),2019,This study reports the academic benefits of peer tutoring in algebra for middle school students. A total of 380 students enrolled in grades 7th and 8th participated in the study. Two peer tutoring sessions took place during each week (10 weeks). Interactions between peers lasted 20 to 25 minutes for each session. The typology of tutoring was fixed and same-age. A pretest posttest with control group design was used. Statistical significant improvements were reported in the academic achievement variable after the implementation of the peer tutoring program for 7th and 8th grade courses separately and altogether. Over 87% of the students in the experimental group improved their marks. The overall effect size for the experience was reported to be medium (Hedge’s g = 0.48). The main conclusion of this study is that fixed and same-age peer tutoring in algebra may be very beneficial for middle school students.,['Peer tutoring'],NA,,['MT_2023 (in progress)'],"Journal, Article",,['Journal article'],NA,NA,,['Spain'],,['Middle school'],"['Page 5:\n[¬s]""a public middle-school[¬e]""']",NA,,High ecological validity,"['Page 5:\n[¬s]""Participants in the study were accessed through convenience sampling (non-\nprobabilistic sampling technique) as they were selected only because they were conveniently\navailable to the researchers (Altmann, 1974). Legal consent was obtained by the parents or\nlegal tutors of the students and the Educational Council of the region. In this sense, one of the\nresearchers of this manuscript served as a full-time teacher in the middle-school where this\nresearch took place. This teacher had previous experience in the peer tutoring field so the\nimplementation of the program was facilitated by the prior knowledge of this researcher.[¬e]""']",NA,,"['12', '13', '14', '15']","['Page 5:\n[¬s]""Their ages ranged from 12 to 15 years old.[¬e]""']",NA,,1,"['Page 5:\n[¬s]""a public middle-school[¬e]""']",,1,"['Page 5:\n[¬s]""a public middle-school[¬e]""']",,1,"['Page 5:\n[¬s]""a public middle-school[¬e]""']",,NA,NA,NA,,NA,NA,,NA,NA,,NA,NA,,['not_provided'],NA,NA,,['No'],"['Page 6:\n[¬s]""Besides, 70 students in 8th grade were assigned to the\nexperimental group and the remaining 65 students in 8th grade were assigned to the control\ngroup.[¬e]""']",NA,,"Non-random, but matched","['Page 6:\n[¬s]""Due to organizational matters, it was impossible to have the same number of students\nin the experimental and the control group. In any case, suggestions given by Kenny (1975)\nwere followed to ensure that experimental and control groups were matched as properly as\npossible. First, students were assigned on a probabilistic basis to either the experimental or\ncontrol group. Later, students’ average marks in Mathematics of the previous school-year\nwere calculated and compared between the experimental and control group for both grades in\norder to find if there were important differences between groups. Once all groups seemed\nproperly balanced regarding students’ previous mathematics achievement, a Kolmogorov-\nSmirnov test for normality (Lilliefors, 1967) was run to ensure the normality of each group\ndistribution.[¬e]""']",NA,,Individual,"['Page 6:\n[¬s]""Due to organizational matters, it was impossible to have the same number of students\nin the experimental and the control group. In any case, suggestions given by Kenny (1975)\nwere followed to ensure that experimental and control groups were matched as properly as\npossible. First, students were assigned on a probabilistic basis to either the experimental or\ncontrol group.[¬e]""']",NA,,['Retrospective QED  '],NA,NA,,Not applicable,NA,NA,,['No'],NA,NA,,NA,NA,NA,,NA,NA,
74069943,Aleid (2015),2015,"The aim of this Randomised Controlled Trial (RCT) study was to research, pilot, test and develop mathematical pedagogies to improve attainment in schools in Saudi Arabia. The pedagogies explored included the use of manipulatives and peer learning. The thesis reports an investigation using a factorial design of the effects of incorporating peer and resource-led learning into teacher pedagogies.\r\nIt examined the effects of using peer tutoring and manipulatives, both separately and together, on the mathematical education of fourth grade students (aged 10 and 11) in elementary schools in AlAhsa city in Saudi Arabia, with regard to (a) attainment in mathematics, (b) attitudes towards learning mathematics, (c) attitudes towards learning partners and (d) the students’ social relationships. Twenty-four classes were randomly chosen and assigned to different groups. One control group of six classes was taught as usual, and six classes were assigned to each of three experimental groups  that is, six each to the manipulatives group, the peer tutoring group and the group using peer tutoring and manipulatives together. Each experimental group undertook a 12-week programme in the fractions and decimals sections of the fourth grade elementary school mathematics curriculum. The research methods and materials were initially developed during a pilot study involving 8 classes of fourth grade students (aged 10 and 11) in elementary schools in AlAhsa city.\r\nThe results of this RCT suggested that the use of peer tutoring and manipulatives, separately and together, significantly affected the mathematical education of those students regarding their attainment, attitudes towards learning mathematics, attitudes towards their learning partners and social relationships. The results also showed that the improvement in the students’ social relationships predicted their attainment scores.\r\nSuggestions for further research into the effects of using peer tutoring and manipulatives, both separately and together, on mathematical education in elementary schools, are also made.",['Peer tutoring'],NA,,['MT_2023 (in progress)'],Dissertation,,['Dissertation or thesis'],NA,NA,,['Saudi Arabia'],,['Primary/elementary school'],"['Page 149:\n[¬s]""in\nelementary schools in AlAhsa, Saudi Arabia[¬e]""']",NA,,High ecological validity,"['Page 149:\n[¬s]""in elementary schools in AlAhsa, Saudi Arabia.""\n""All the\nmathematics teachers who participated in this study were Saudi male teachers aged\nfrom 26 to 35 years old who had qualified in one of the teachers’ colleges majoring\nin mathematics that are to be found in each major city in Saudi Arabia, and which\nwere run by the Saudi Ministry of Education.[¬e]""']",Taught during school times and by trained school teachers,,"['10', '11']","['Page 5:\n[¬s]""fourth grade students (aged 10 and 11)[¬e]""']",NA,,4,NA,,4,"['Page 152:\n[¬s]""Table 4-1: The details of the pilot study sample (generated by author)[¬e]""']",,8,"['Page 151:\n[¬s]""eight schools[¬e]""']",,NA,NA,NA,,4,NA,,4,NA,,8,"['Page 151:\n[¬s]""The\nstudy involved eight classes[¬e]""']",,NA,NA,NA,,['Yes (Please specify)'],NA,"There are 4 arms in this study   a) peer tutoring PT,  b) manipulatives M,  c) PT+M,  d) control.  Please compare a+c vs b+d.",,Random (please specify),"['Page 148:\n[¬s]""In the study, a randomised controlled factor design was used to measure the effects\nof using manipulatives, peer tutoring (PT), and peer tutoring plus manipulatives on\nmathematical attainment, as compared to a control group that used the normal\nmethod of teaching, that is, ‘treatment as usual’.[¬e]""', 'Page 173:\n[¬s]""The researcher used the same sampling process that had been used in the pilot study.\nThe schools that participated in this study were randomly assigned to conditions. The\nstudy involved 24 classes.[¬e]""']",NA,,School - multi-site,"['Page 151:\n[¬s]""Classes in the participating schools were then block assigned, by ballot, from lists of government and ARAMCO schools, to ensure equal numbers of each type of school in each treatment cell; the schools were then contacted and informed of their assignment to the experiment.""\n""The schools that participated in this study were randomly assigned to conditions.[¬e]""']",NA,,['Cluster RCT'],"['Page 151:\n[¬s]""The schools that participated in this study were randomly assigned to conditions.[¬e]""']",NA,,Yes,"['Page 151:\n[¬s]""In order to recruit schools,\na letter explaining the study and its method and design was sent by the education\nauthority in AlAhsa city to all elementary schools encouraging them to volunteer for\nthe project. Classes in the participating schools were then block assigned, by ballot,\nfrom lists of government and ARAMCO schools, to ensure equal numbers of each\ntype of school in each treatment cell; the schools were then contacted and informed\nof their assignment to the experiment.[¬e]""']",NA,,['Yes'],"['Page 153:\n[¬s]""Attitude of students towards mathematics[¬e]""']",NA,,['Other types of student outcomes (Please specify)'],"['Page 153:\n[¬s]""Attitude of students towards mathematics[¬e]""']",NA,,NA,NA,
74069944,Alwi (2016),2016,"Peer tutoring method was applied to observe its special effects on the success and approach of Learners in the subject of English. The determinations of the study were to measure the success of the learners in the subject of English before the testing, to expose the experimental group to cross age peer tutoring and the control group to conventional teaching to associate the change in the achievement of students participating in peer tutorials and learners who did not contribute in Peer tutoring. The exercise of peer tutoring across many disciplines is increasing to help in appealing learners for active learning process. It is kindly accepted that educational results. Peer shows a special role in kids’ development in accumulation to parents and instructors. However, the larger variability, autonomy and likeness of peer associations offers children the opportunity for a new kind of relational investigation and assessment. A sample of 137 students were taken from one by convince random sampling method selected school of low economic people resident area of Karachi orangi town Karachi. The design of the experimental study was “Pretest-Posttest Nonequivalent Groups Design” which is a form of Quasi-Experimental designs. 52 students from class II and III nominated institute were pretested complete a self-developed accomplishment exam. On the basis of pre- test results and the willingness of the students, paid of students were made on both classes. Students were paired as learning partners during the reading sessions. To determine the implication of the tutoring interference through evaluation of pre- and post-test success of experimental and control groups, descriptive statistics and ANOVA (analysis of Variance with Tukey Ba,b) were used.The Present research result was noted that cross-age tutoring—pairing students in grades II and III – was more positive effect on reading attitudes of the students and the most important gain for students as a result of the research was the self-esteem they developed from the self-worth they experienced. They had a great feeling of being needed.",['Peer tutoring'],NA,,['MT_2023 (in progress)'],"Journal, Article",,NA,NA,NA,,['Pakistan'],,['Primary/elementary school'],"['Page 10:\n[¬s]""Convince non random sampling method has been used for the\nselection of sample area of district west Karachi orangi town\nschools.""\n""The test was conducted in class II and Class III.[¬e]""', 'Page 9:\n[¬s]""Reading Among Young Children[¬e]""']",NA,,Unclear,NA,"Location and scheduled times not specified. While I assume this is ecologically valid and implemented in schools during school hours, I can't be certain.",,['No information provided'],NA,NA,,1,"['Page 9:\n[¬s]""primary school of Karachi[¬e]""']",,1,"['Page 9:\n[¬s]""primary school of Karachi[¬e]""']",,1,"['Page 9:\n[¬s]""primary school of Karachi[¬e]""']",,NA,NA,NA,,NA,NA,,NA,NA,,NA,NA,,['not_provided'],NA,NA,,"['No', 'Yes (Please specify)']","['Page 12:\n[¬s]""Same Age Experimental\nGroup\nCross age Experimental\nGroup[¬e]""', 'Page 10:\n[¬s]""First teacher took\ntest with normal way of teaching style and that group were called\ncontrol group, then researcher make paired of students in which\none paired make same class students and take test that group test\nwas called experimental group test and that result was recorded\nthen researcher make one another paired which are base on cross\nage group method in this way of one class Iv student older\nstudent paired with class III younger students and they lesson on\nlesson and then take test.[¬e]""']",I think there was same-age peer tutoring/cross age peer tutoring and a control.,,Retrospective Quasi Experimental Design (QED),NA,NA,,N,NA,NA,,['Retrospective QED  '],"['Page 1:\n[¬s]""Pretest-Posttest Nonequivalent Groups\nDesign” which is a form of Quasi-Experimental designs.[¬e]""']",NA,,Not applicable,NA,NA,,['No'],NA,NA,,NA,NA,NA,,NA,NA,
74069945,Amaka (2013),2013,"The study conducted to find out the effect of peer tutoring institutional method on the academic achievement in Home Economics among secondary school students in Dunukofia L.G.A of Anambra State. Quasi-experimental design was used. All the senior secondary school students in the local government area constituted the population of the study. Four secondary schools out of eight secondary schools was randomly selected, and all the 145 SS1 students offering Home Economics in these four schools were selected and assigned to experimental and control groups. One research question and one hypothesis guided the study. Data on student’s achievement was collected using Home Economics achievement test (HAT). The research question was answered using mean t-test statistics. The results indicated that students taught Home Economics using peer tutoring instructional methods achieved higher than those taught using lecture method, it was recommended that peer tutoring should be used in teaching Home Economics in secondary schools to enhance student’s achievement.",['Peer tutoring'],NA,,['MT_2023 (in progress)'],"Journal, Article",,['Journal article'],NA,NA,,['Nigeria'],,['Secondary/High school'],"['Page 2:\n[¬s]""Four secondary schools out of eight secondary in Dunukofia L.G.A was randomly selected.[¬e]""']",NA,,High ecological validity,"['Page 2:\n[¬s]""All the SS1\nstudents offering Home Economics was used.[¬e]""']",Indicative that the peer tutoring strategy was implemented during the schools' regular home economics instruction.,,['No information provided'],NA,NA,,2,"['Page 2:\n[¬s]""The four schools were divided into\nexperimental and control group using odd and even number method, where the odd number school becomes\nthe control group while the even number the experimental group.[¬e]""']",,2,"['Page 2:\n[¬s]""The four schools were divided into\nexperimental and control group using odd and even number method, where the odd number school becomes\nthe control group while the even number the experimental group.[¬e]""']",,4,"['Page 2:\n[¬s]""Four secondary schools out of eight secondary in Dunukofia L.G.A was randomly selected.[¬e]""']",,NA,NA,NA,,NA,NA,,NA,NA,,NA,NA,,['not_provided'],not provided,NA,,['No'],"['Page 2:\n[¬s]""The four schools were divided into\nexperimental and control group using odd and even number method, where the odd number school becomes\nthe control group while the even number the experimental group.[¬e]""']",NA,,Random (please specify),"['Page 2:\n[¬s]""The four schools were divided into\nexperimental and control group using odd and even number method[¬e]""']",NA,,School - cluster,"['Page 2:\n[¬s]""The four schools were divided into\nexperimental and control group using odd and even number method, where the odd number school becomes\nthe control group while the even number the experimental group.[¬e]""']",NA,,['Retrospective QED  '],"['Page 2:\n[¬s]""The design of the study is Quasi-experimental[¬e]""']",NA,,Not applicable,NA,NA,,['No'],NA,NA,,NA,NA,NA,,NA,NA,
74069946,Andriana (2018),2018,"Various efforts to develop education which related to quality of education were overall implemented by the government to enhance quality of education. The implementation of compatible method was an effort to improve learning achievement and accomplish learning goals. Peer tutoring is a group of students who have completed learning material then provide assistance for others who got difficulty in understanding the material. From the research result were obtained, (1) Sig. 0,011 = Ho was rejected means there was difference in students learning result in mathematic lesson by using peer tutoring method compare with conventional learning method  (2) Sig. 0,002 = Ho was rejected means there was difference in problem solving communication skill in mathematic lesson by using peer tutoring method compare with conventional learning method  (3) Sig. 0,043 = Ho was rejected means there was difference in problem solving comprehension skill in mathematic lesson by using peer tutoring method compare with conventional learning method. From the data, it can be concluded that students learning result using peer tutoring method was more effective. It was because, this method demanded students to be more active in learning process either individual or overall.",['Peer tutoring'],NA,,['MT_2023 (in progress)'],"Journal, Article",,['Journal article'],NA,NA,,['Indonesia'],,['Middle school'],"['Page 3:\n[¬s]""state junior high schools.[¬e]""']",NA,,High ecological validity,NA,it can be assumed that study took place in the state schools where they got the population from during regular school hours although not many details are provided,,"['13', '14']","['Page 1:\n[¬s]""EIGHT GRADE JUNIOR\nHIGH SCHOOL STUDENTS""\n""Indonesia[¬e]""']",NA,,NA,NA,,NA,NA,,NA,NA,,['not_provided'],"we have only 1 control and 1 experimental class, but it is not specified if they were both from the same school or from 2 different schools","['Page 3:\n[¬s]""The population included all eighth grade students\nof state junior high schools.[¬e]""']",,1,"['Page 3:\n[¬s]""VIII-B as the experimental class[¬e]""']",,1,"['Page 3:\n[¬s]""VIII-C as the control class[¬e]""']",,2,"['Page 3:\n[¬s]""In this research, the researchers took samples from all\nstudents of class VIII-B as the experimental class and class VIII-C as the control class[¬e]""']",,NA,NA,NA,,['No'],"['Page 3:\n[¬s]""In this research, the researchers took samples from all\nstudents of class VIII-B as the experimental class and class VIII-C as the control class with\nthe same number of students, namely 28.[¬e]""']",NA,,"Non-random, not matched prior to treatment","['Page 3:\n[¬s]""The sample was taken with ―purposive sampling‖ technique, that is sample determination\ntechnique based on certain criteria. In this research, the researchers took samples from all\nstudents of class VIII-B as the experimental class and class VIII-C as the control class with\nthe same number of students, namely 28.[¬e]""']",NA,,Class,"['Page 3:\n[¬s]""In this research, the researchers took samples from all\nstudents of class VIII-B as the experimental class and class VIII-C as the control class with\nthe same number of students, namely 28.[¬e]""']",NA,,['Retrospective QED  '],"['Page 3:\n[¬s]""The design used in this research was the two group\npattern (two-group-pretest-posttest) design[¬e]""']",NA,,Not applicable,NA,NA,,['Yes'],"['Page 2:\n[¬s]""problem-solving communication, and problem-solving understanding\nskills[¬e]""']",NA,,['Other types of student outcomes (Please specify)'],"['Page 2:\n[¬s]""problem-solving communication, and problem-solving understanding\nskills[¬e]""']",NA,,NA,NA,
74069947,Bellen (2017),2017,"Research shows that cognitive and affective abilities among science students can be enhanced using peer tutoring approach. However, peer tutoring approach remains an underutilized peer support (Bond & Castagnera 2006). This study determined the effects of peer tutoring approach in motivation, participation and academic performance of grade 8 students. Using regression discontinuity design, the respondents were non-struggling, struggling who accepted peer tutoring and struggling students who declined peer tutoring. Results showed that struggling students who accepted peer tutoring showed better participation, expertlike perceptions of junior high school science, and exam performance relative to their peers who were not attending the peer tutoring sessions. The results of this study provide evidence to teachers who want to plan targeted peer support for students who are struggling in junior high school science.",['Peer tutoring'],NA,,['MT_2023 (in progress)'],"Journal, Article",,['Journal article'],NA,NA,,['Philippines'],,['Secondary/High school'],"['Page 5:\n[¬s]""This study will be conducted in Caridad National High School, Caridad,[¬e]""']",NA,,High ecological validity,"['Page 5:\n[¬s]""This study will be conducted in Caridad National High School, Caridad,\nBaybay City, Leyte. It is a government-run basic education institution with\naround 500 students enrolled yearly.[¬e]""']",NA,,"['13', '14']","['Page 1:\n[¬s]""Grade 8[¬e]""']",NA,,1,"['Page 4:\n[¬s]""Caridad National High School[¬e]""']",,1,"['Page 4:\n[¬s]""Caridad National High School[¬e]""']",,1,"['Page 4:\n[¬s]""Caridad National High School[¬e]""']",,NA,NA,NA,,NA,NA,,NA,NA,,NA,NA,,['not_provided'],NA,NA,,['No'],"['Page 2:\n[¬s]""the tutored group made significant gains than the control group[¬e]""']",NA,,Regression discontinuity,"['Page 4:\n[¬s]""This study followed the regression discontinuity design (Jacob et al\n2012) for grade eight science students composed of three sections taught\nby a single teacher.[¬e]""']",NA,,Individual,"['Page 4:\n[¬s]""This study followed the regression discontinuity design (Jacob et al\n2012) for grade eight science students composed of three sections taught\nby a single teacher.[¬e]""']",NA,,['Regression Continuity  - naturally occurring'],"['Page 4:\n[¬s]""regression discontinuity design[¬e]""']",NA,,Not applicable,NA,NA,,['Yes'],"['Page 5:\n[¬s]""To track\nrelative changes in student perceptions during the course, percentage of\nfavorable responses on the SMQ-II posttest by struggling students who\naccepted peer tutoring, struggling students who declined peer tutoring,\nand non-struggling students were compared.[¬e]""']",NA,,['Other types of student outcomes (Please specify)'],"['Page 1:\n[¬s]""motivation, participation and academic performance of grade\n8 students.[¬e]""', 'Page 5:\n[¬s]""To track\nrelative changes in student perceptions during the course, percentage of\nfavorable responses on the SMQ-II posttest by struggling students who\naccepted peer tutoring, struggling students who declined peer tutoring,\nand non-struggling students were compared.[¬e]""']",NA,,NA,NA,
