id,pub_author,pub_year,strand_raw,strand_info,out_tit_tool,out_tit_tool_CLEAN,out_desc_tool,out_desc_tool_CLEAN,out_type_tool,out_type_tool_CLEAN,smd_tool,smd_tool_CLEAN,se_tool,se_tool_CLEAN,out_measure_tool,out_measure_tool_CLEAN,out_g1_n_tool,out_g1_n_tool_CLEAN,out_g1_mean_tool,out_g1_mean_tool_CLEAN,out_g1_sd_tool,out_g1_sd_tool_CLEAN,out_g2_n_tool,out_g2_n_tool_CLEAN,out_g2_mean_tool,out_g2_mean_tool_CLEAN,out_g2_sd_tool,out_g2_sd_tool_CLEAN,ci_lower_tool,ci_lower_tool_CLEAN,ci_upper_tool,ci_upper_tool_CLEAN,out_label_tool,out_label_tool_CLEAN,out_samp_tool,out_samp_tool_CLEAN,out_comp_tool,out_comp_tool_CLEAN,out_es_type_tool,out_es_type_tool_CLEAN,out_test_type_raw_tool,out_test_type_raw_tool_CLEAN,out_tit_red,out_tit_red_CLEAN,out_desc_red,out_desc_red_CLEAN,out_type_red,out_type_red_CLEAN,smd_red,smd_red_CLEAN,se_red,se_red_CLEAN,out_measure_red,out_measure_red_CLEAN,out_g1_n_red,out_g1_n_red_CLEAN,out_g1_mean_red,out_g1_mean_red_CLEAN,out_g1_sd_red,out_g1_sd_red_CLEAN,out_g2_n_red,out_g2_n_red_CLEAN,out_g2_mean_red,out_g2_mean_red_CLEAN,out_g2_sd_red,out_g2_sd_red_CLEAN,ci_lower_red,ci_lower_red_CLEAN,ci_upper_red,ci_upper_red_CLEAN,out_label_red,out_label_red_CLEAN,out_samp_red,out_samp_red_CLEAN,out_comp_red,out_comp_red_CLEAN,out_es_type_red,out_es_type_red_CLEAN,out_test_type_raw_red,out_test_type_raw_red_CLEAN,out_tit_wri,out_tit_wri_CLEAN,out_desc_wri,out_desc_wri_CLEAN,out_type_wri,out_type_wri_CLEAN,smd_wri,smd_wri_CLEAN,se_wri,se_wri_CLEAN,out_measure_wri,out_measure_wri_CLEAN,out_g1_n_wri,out_g1_n_wri_CLEAN,out_g1_mean_wri,out_g1_mean_wri_CLEAN,out_g1_sd_wri,out_g1_sd_wri_CLEAN,out_g2_n_wri,out_g2_n_wri_CLEAN,out_g2_mean_wri,out_g2_mean_wri_CLEAN,out_g2_sd_wri,out_g2_sd_wri_CLEAN,ci_lower_wri,ci_lower_wri_CLEAN,ci_upper_wri,ci_upper_wri_CLEAN,out_label_wri,out_label_wri_CLEAN,out_samp_wri,out_samp_wri_CLEAN,out_comp_wri,out_comp_wri_CLEAN,out_es_type_wri,out_es_type_wri_CLEAN,out_test_type_raw_wri,out_test_type_wri_CLEAN,out_tit_math,out_tit_math_CLEAN,out_desc_math,out_desc_math_CLEAN,out_type_math,out_type_math_CLEAN,smd_math,smd_math_CLEAN,se_math,se_math_CLEAN,out_measure_math,out_measure_math_CLEAN,out_g1_n_math,out_g1_n_math_CLEAN,out_g1_mean_math,out_g1_mean_math_CLEAN,out_g1_sd_math,out_g1_sd_math_CLEAN,out_g2_n_math,out_g2_n_math_CLEAN,out_g2_mean_math,out_g2_mean_math_CLEAN,out_g2_sd_math,out_g2_sd_math_CLEAN,ci_lower_math,ci_lower_math_CLEAN,ci_upper_math,ci_upper_math_CLEAN,out_label_math,out_label_math_CLEAN,out_samp_math,out_samp_math_CLEAN,out_comp_math,out_comp_math_CLEAN,out_es_type_math,out_es_type_math_CLEAN,out_test_type_raw_math,out_test_type_math_CLEAN,out_tit_sci,out_tit_sci_CLEAN,out_desc_sci,out_desc_sci_CLEAN,out_type_sci,out_type_sci_CLEAN,smd_sci,smd_sci_CLEAN,se_sci,se_sci_CLEAN,out_measure_sci,out_measure_sci_CLEAN,out_g1_n_sci,out_g1_n_sci_CLEAN,out_g1_mean_sci,out_g1_mean_sci_CLEAN,out_g1_sd_sci,out_g1_sd_sci_CLEAN,out_g2_n_sci,out_g2_n_sci_CLEAN,out_g2_mean_sci,out_g2_mean_sci_CLEAN,out_g2_sd_sci,out_g2_sd_sci_CLEAN,ci_lower_sci,ci_lower_sci_CLEAN,ci_upper_sci,ci_upper_sci_CLEAN,out_label_sci,out_label_sci_CLEAN,out_samp_sci,out_samp_sci_CLEAN,out_comp_sci,out_comp_sci_CLEAN,out_es_type_sci,out_es_type_sci_CLEAN,out_test_type_raw_sci,out_test_type_sci_CLEAN,out_tit_fsm,out_tit_fsm_CLEAN,out_desc_fsm,out_desc_fsm_CLEAN,out_type_fsm,out_type_fsm_CLEAN,smd_fsm,smd_fsm_CLEAN,se_fsm,se_fsm_CLEAN,out_measure_fsm,out_measure_fsm_CLEAN,out_g1_n_fsm,out_g1_n_fsm_CLEAN,out_g1_mean_fsm,out_g1_mean_fsm_CLEAN,out_g1_sd_fsm,out_g1_sd_fsm_CLEAN,out_g2_n_fsm,out_g2_n_fsm_CLEAN,out_g2_mean_fsm,out_g2_mean_fsm_CLEAN,out_g2_sd_fsm,out_g2_sd_fsm_CLEAN,ci_lower_fsm,ci_lower_fsm_CLEAN,ci_upper_fsm,ci_upper_fsm_CLEAN,out_label_fsm,out_label_fsm_CLEAN,out_samp_fsm,out_samp_fsm_CLEAN,out_comp_fsm,out_comp_fsm_CLEAN,out_es_type_fsm,out_es_type_fsm_CLEAN,out_test_type_raw_fsm,out_test_type_fsm_CLEAN
38224167,Adey (2002),2002,['Metacognition and self-regulation'],NA,Drawing (ANCOVA),,"This test is based on original Piagetian protocols. It assesses children 's ability to perceive the horizontality of the surface of water in a bottle as the bottle is tilted, and the verticality of a plumb line under similar circumstances.",,"['Toolkit primary outcome', 'Other outcome']",,0.54,,0.1,,Cognitive: other,,NA,,NA,,NA,,NA,,NA,,NA,,0.344,,0.736,,Primary outcome,,['Sample: All'],,With business as usual,,['Post-test adjusted for baseline attainment'],,['Test type: Standardised test '],,NA,,NA,,NA,,NA,,NA,,NA,,NA,,NA,,NA,,NA,,NA,,NA,,NA,,NA,,NA,,NA,,NA,,NA,,NA,,NA,,NA,,NA,,NA,,NA,,NA,,NA,,NA,,NA,,NA,,NA,,NA,,NA,,NA,,NA,,NA,,NA,,NA,,NA,,NA,,NA,,NA,,NA,,NA,,NA,,NA,,NA,,NA,,NA,,NA,,NA,,NA,,NA,,NA,,NA,,NA,,NA,,NA,,NA,,NA,,NA,,NA,,NA,,NA,,NA,,NA,,NA,,NA,,NA,,NA,,NA,,NA,,NA,,NA,,NA,,NA,,NA,,NA,,NA,,NA,,NA,,NA,,NA,,NA,,NA,,NA,,NA,,NA,,NA,,NA,,NA,,NA,,NA,,NA,,NA,,NA,
47063511,Barnett (2008),2008,['Metacognition and self-regulation'],NA,NA,,NA,,NA,,NA,,NA,,NA,,NA,,NA,,NA,,NA,,NA,,NA,,NA,,NA,,NA,,NA,,NA,,NA,,NA,,NA,,NA,,NA,,NA,,NA,,NA,,NA,,NA,,NA,,NA,,NA,,NA,,NA,,NA,,NA,,NA,,NA,,NA,,NA,,NA,,NA,,NA,,NA,,NA,,NA,,NA,,NA,,NA,,NA,,NA,,NA,,NA,,NA,,NA,,NA,,NA,,NA,,NA,,NA,,NA,,NA,,NA,,NA,,NA,,NA,,NA,,NA,,NA,,NA,,NA,,NA,,NA,,NA,,NA,,NA,,NA,,NA,,NA,,NA,,NA,,NA,,NA,,NA,,NA,,NA,,NA,,NA,,NA,,NA,,NA,,NA,,NA,,NA,,NA,,NA,,NA,,NA,,NA,,NA,,NA,,NA,,NA,,NA,,NA,,NA,,NA,,NA,,NA,,NA,,NA,,NA,,NA,,NA,,NA,,NA,
47063512,Blair (2014),2014,['Metacognition and self-regulation'],NA,EOWPVT Raw Score,, The EOWPVT is a norm-referenced measure of vocabulary that assesses the child’s ability to use words and requires the child to access and retrieve words from memory. The internal consistency reliability of the measure is .98.,,"['Toolkit primary outcome', 'Reading primary outcome']",,0.1553,,0.076,,Literacy: reading other,,417,,71.73,,16.9,,297,,69.09,,17.1,,0.0062,,0.3043,,Primary outcome,,['Sample: All'],,With business as usual,,['Post-test unadjusted (select one from this group)'],,['Test type: Standardised test '],,EOWPVT Raw Score,, The EOWPVT is a norm-referenced measure of vocabulary that assesses the child’s ability to use words and requires the child to access and retrieve words from memory. The internal consistency reliability of the measure is .98.,,"['Toolkit primary outcome', 'Reading primary outcome']",,0.1553,,0.076,,Literacy: reading other,,417,,71.73,,16.9,,297,,69.09,,17.1,,0.0062,,0.3043,,Primary outcome,,['Sample: All'],,With business as usual,,['Post-test unadjusted (select one from this group)'],,['Test type: Standardised test '],,NA,,NA,,NA,,NA,,NA,,NA,,NA,,NA,,NA,,NA,,NA,,NA,,NA,,NA,,NA,,NA,,NA,,NA,,NA,,NA,,NA,,NA,,NA,,NA,,NA,,NA,,NA,,NA,,NA,,NA,,NA,,NA,,NA,,NA,,NA,,NA,,NA,,NA,,NA,,NA,,NA,,NA,,NA,,NA,,NA,,NA,,NA,,NA,,NA,,NA,,NA,,NA,,NA,,NA,,NA,,NA,,NA,,NA,,NA,,NA,,NA,,NA,,NA,,NA,,NA,,NA,,NA,,NA,,NA,,NA,,NA,,NA,,NA,,NA,,NA,,NA,
38224206,de Koning (2002),2002,['Metacognition and self-regulation'],NA,Raven’s Standard Progressive Matrices,,"The test consists of 60 items divided into ﬁve parts (called sets A through E). Each of the 60 pages, one item per page, is divided into two half-pages. On the upper half, a matrix of ﬁgures is depicted con- taining a missing element. This element has to be detected among the six alternatives (sets A and B) or eight alternatives (sets C through E) printed at the bottom of the page. ",,"['Toolkit primary outcome', 'Other outcome']",,0.4041,,0.1517,,Cognitive: reasoning,,98,,29.67,,0.95,,81,,25.59,,1.09,,0.1067,,0.7014,,Primary outcome,,['Sample: All'],,With business as usual,,['Post-test unadjusted (select one from this group)'],,['Test type: Researcher developed test'],,NA,,NA,,NA,,NA,,NA,,NA,,NA,,NA,,NA,,NA,,NA,,NA,,NA,,NA,,NA,,NA,,NA,,NA,,NA,,NA,,NA,,NA,,NA,,NA,,NA,,NA,,NA,,NA,,NA,,NA,,NA,,NA,,NA,,NA,,NA,,NA,,NA,,NA,,NA,,NA,,NA,,NA,,NA,,NA,,NA,,NA,,NA,,NA,,NA,,NA,,NA,,NA,,NA,,NA,,NA,,NA,,NA,,NA,,NA,,NA,,NA,,NA,,NA,,NA,,NA,,NA,,NA,,NA,,NA,,NA,,NA,,NA,,NA,,NA,,NA,,NA,,NA,,NA,,NA,,NA,,NA,,NA,,NA,,NA,,NA,,NA,,NA,,NA,,NA,,NA,,NA,,NA,,NA,,NA,,NA,
38223850,Ennis (1969),1969,['Metacognition and self-regulation'],NA,Conditional logic - metacognition,,"The test was presented in two parts, each part using a different set of materials. One part, hereafter referred to as the house part, involved questions about a model house.The other, hereafter referred to as the chemicals part, involved questions about chemical reactions with safe, household chemicals.The model househad two handles (knife switches)and a push button switch on the outside,and a doorbell and a light inside.The light was visible through a small window when the light was on and the window open. TESTThe test consisted of 24 itemsin all.Six items applied to eachof the four principles.Each group of*six items is referredto as an itemgroup.Three of the items in each itemgroup were the suppositional formof the questions asked ofthe children while the otherthree were the factual forms. Some of the items for each principlewere from the house part and the rest from the chemicals part.",,"['Toolkit primary outcome', 'Other outcome']",,-0.1315,,0.1505,,Cognitive: reasoning,,90,,12.3,,5.1,,87,,13,,5.5,,-0.4265,,0.1635,,Primary outcome,,['Sample: All'],,With business as usual,,['Post-test adjusted for baseline attainment'],,['Test type: Researcher developed test'],,NA,,NA,,NA,,NA,,NA,,NA,,NA,,NA,,NA,,NA,,NA,,NA,,NA,,NA,,NA,,NA,,NA,,NA,,NA,,NA,,NA,,NA,,NA,,NA,,NA,,NA,,NA,,NA,,NA,,NA,,NA,,NA,,NA,,NA,,NA,,NA,,NA,,NA,,NA,,NA,,NA,,NA,,NA,,NA,,NA,,NA,,NA,,NA,,NA,,NA,,NA,,NA,,NA,,NA,,NA,,NA,,NA,,NA,,NA,,NA,,NA,,NA,,NA,,NA,,NA,,NA,,NA,,NA,,NA,,NA,,NA,,NA,,NA,,NA,,NA,,NA,,NA,,NA,,NA,,NA,,NA,,NA,,NA,,NA,,NA,,NA,,NA,,NA,,NA,,NA,,NA,,NA,,NA,,NA,,NA,
55203434,Ford (2009),2009,NA,NA,NA,,NA,,NA,,NA,,NA,,NA,,NA,,NA,,NA,,NA,,NA,,NA,,NA,,NA,,NA,,NA,,NA,,NA,,NA,,NA,,NA,,NA,,NA,,NA,,NA,,NA,,NA,,NA,,NA,,NA,,NA,,NA,,NA,,NA,,NA,,NA,,NA,,NA,,NA,,NA,,NA,,NA,,NA,,NA,,NA,,NA,,NA,,NA,,NA,,NA,,NA,,NA,,NA,,NA,,NA,,NA,,NA,,NA,,NA,,NA,,NA,,NA,,NA,,NA,,NA,,NA,,NA,,NA,,NA,,NA,,NA,,NA,,NA,,NA,,NA,,NA,,NA,,NA,,NA,,NA,,NA,,NA,,NA,,NA,,NA,,NA,,NA,,NA,,NA,,NA,,NA,,NA,,NA,,NA,,NA,,NA,,NA,,NA,,NA,,NA,,NA,,NA,,NA,,NA,,NA,,NA,,NA,,NA,,NA,,NA,,NA,,NA,,NA,,NA,
38224214,Hamers (1998) 1_1,1998,['Metacognition and self-regulation'],NA,SPM Total Scores (ANOVA),,"M3, M4, and M5 items from SPM task were included in the test. ",,"['Toolkit primary outcome', 'Other outcome']",,0.59,,0.4,,Cognitive: reasoning,,NA,,NA,,NA,,NA,,NA,,NA,,-0.194,,1.374,,Primary outcome,,['Sample: All'],,With business as usual,,['Post-test adjusted for baseline attainment'],,['Test type: Standardised test '],,NA,,NA,,NA,,NA,,NA,,NA,,NA,,NA,,NA,,NA,,NA,,NA,,NA,,NA,,NA,,NA,,NA,,NA,,NA,,NA,,NA,,NA,,NA,,NA,,NA,,NA,,NA,,NA,,NA,,NA,,NA,,NA,,NA,,NA,,NA,,NA,,NA,,NA,,NA,,NA,,NA,,NA,,NA,,NA,,NA,,NA,,NA,,NA,,NA,,NA,,NA,,NA,,NA,,NA,,NA,,NA,,NA,,NA,,NA,,NA,,NA,,NA,,NA,,NA,,NA,,NA,,NA,,NA,,NA,,NA,,NA,,NA,,NA,,NA,,NA,,NA,,NA,,NA,,NA,,NA,,NA,,NA,,NA,,NA,,NA,,NA,,NA,,NA,,NA,,NA,,NA,,NA,,NA,,NA,,NA,
38224059,Kernaghan (1995),1995,['Metacognition and self-regulation'],NA,Dictated Spelling Test-training words (immediate post-test mean/sd),,"The dictated spelling test consisted of 15 of the 20 training words plus five transfer words. The transfer words rhymed with the target words and differed only in the beginning letter. During spelling dictation, each word was presented alone, in the content of a sentence, and then alone again  the students were instructed to make their best guess when they were unsure of a correct spelling. It was stressed that students should attempt a spelling for each word.",,"['Toolkit primary outcome', 'Writing and spelling primary outcome.']",,0.9567,,0.4551,,Literacy: spelling,,11,,10.36,,2.77,,11,,7.55,,2.88,,0.0646,,1.8488,,Primary outcome,,['Sample: All'],,With business as usual,,['Post-test unadjusted (select one from this group)'],,['Test type: Standardised test '],,NA,,NA,,NA,,NA,,NA,,NA,,NA,,NA,,NA,,NA,,NA,,NA,,NA,,NA,,NA,,NA,,NA,,NA,,NA,,NA,,NA,,NA,,NA,,NA,,NA,,NA,,NA,,NA,,NA,,NA,,NA,,NA,,NA,,NA,,NA,,NA,,NA,,NA,,NA,,NA,,NA,,NA,,NA,,NA,,NA,,NA,,NA,,NA,,NA,,NA,,NA,,NA,,NA,,NA,,NA,,NA,,NA,,NA,,NA,,NA,,NA,,NA,,NA,,NA,,NA,,NA,,NA,,NA,,NA,,NA,,NA,,NA,,NA,,NA,,NA,,NA,,NA,,NA,,NA,,NA,,NA,,NA,,NA,,NA,,NA,,NA,,NA,,NA,,NA,,NA,,NA,,NA,,NA,,NA,,NA,
38224234,Klauer (1992),1992,['Metacognition and self-regulation'],NA,Raven's Progressive Matrices test,,An standardised test of the level of cognitive functioning.,,"['Toolkit primary outcome', 'Other outcome']",,1.5379,,0.59,,Cognitive: reasoning,,8,,29,,3.3,,8,,23,,4.04,,0.3816,,2.6942,,Primary outcome,,['Sample: High achievers'],,With business as usual,,['Post-test unadjusted (select one from this group)'],,['Test type: Standardised test '],,NA,,NA,,NA,,NA,,NA,,NA,,NA,,NA,,NA,,NA,,NA,,NA,,NA,,NA,,NA,,NA,,NA,,NA,,NA,,NA,,NA,,NA,,NA,,NA,,NA,,NA,,NA,,NA,,NA,,NA,,NA,,NA,,NA,,NA,,NA,,NA,,NA,,NA,,NA,,NA,,NA,,NA,,NA,,NA,,NA,,NA,,NA,,NA,,NA,,NA,,NA,,NA,,NA,,NA,,NA,,NA,,NA,,NA,,NA,,NA,,NA,,NA,,NA,,NA,,NA,,NA,,NA,,NA,,NA,,NA,,NA,,NA,,NA,,NA,,NA,,NA,,NA,,NA,,NA,,NA,,NA,,NA,,NA,,NA,,NA,,NA,,NA,,NA,,NA,,NA,,NA,,NA,,NA,,NA,,NA,
38224233,Klauer (1996) 1_1,1996,['Metacognition and self-regulation'],NA,Cattell’s Culture Fair Test,,"Cattell’s Culture Fair Test (CFI 2), a consisting of inductive reasoning subtests.",,"['Toolkit primary outcome', 'Other outcome']",,0.6768,,0.281,,Cognitive: reasoning,,NA,,NA,,NA,,NA,,NA,,NA,,0.1261,,1.2275,,Primary outcome,,['Sample: All'],,With business as usual,,['Post-test adjusted for baseline attainment'],,['Test type: Researcher developed test'],,NA,,NA,,NA,,NA,,NA,,NA,,NA,,NA,,NA,,NA,,NA,,NA,,NA,,NA,,NA,,NA,,NA,,NA,,NA,,NA,,NA,,NA,,NA,,NA,,NA,,NA,,NA,,NA,,NA,,NA,,NA,,NA,,NA,,NA,,NA,,NA,,NA,,NA,,NA,,NA,,NA,,NA,,NA,,NA,,NA,,NA,,NA,,NA,,NA,,NA,,NA,,NA,,NA,,NA,,NA,,NA,,NA,,NA,,NA,,NA,,NA,,NA,,NA,,NA,,NA,,NA,,NA,,NA,,NA,,NA,,NA,,NA,,NA,,NA,,NA,,NA,,NA,,NA,,NA,,NA,,NA,,NA,,NA,,NA,,NA,,NA,,NA,,NA,,NA,,NA,,NA,,NA,,NA,,NA,,NA,
38224235,Klauer (2002),2002,['Metacognition and self-regulation'],NA,Vocabulary Test (ANOVA),,"Vocabulary test (VT) was used to measure crystallized intelligence. Because the children were not yet able to read fluently enough, a vocabulary test was chosen which required the participants to identify a spoken word by marking the correct choice of four familiar pictures. The children had 20 s/item. The test consisted of 35 items.",,"['Toolkit primary outcome', 'Reading primary outcome']",,0.15,,0.14,,Literacy: reading comprehension,,NA,,NA,,NA,,NA,,NA,,NA,,-0.1244,,0.4244,,Secondary outcome(s),,['Sample: All'],,With business as usual,,['Post-test adjusted for baseline attainment'],,['Test type: Standardised test '],,Vocabulary Test (ANOVA),,"Vocabulary test (VT) was used to measure crystallized intelligence. Because the children were not yet able to read fluently enough, a vocabulary test was chosen which required the participants to identify a spoken word by marking the correct choice of four familiar pictures. The children had 20 s/item. The test consisted of 35 items.",,"['Toolkit primary outcome', 'Reading primary outcome']",,0.15,,0.14,,Literacy: reading comprehension,,NA,,NA,,NA,,NA,,NA,,NA,,-0.1244,,0.4244,,Secondary outcome(s),,['Sample: All'],,With business as usual,,['Post-test adjusted for baseline attainment'],,['Test type: Standardised test '],,NA,,NA,,NA,,NA,,NA,,NA,,NA,,NA,,NA,,NA,,NA,,NA,,NA,,NA,,NA,,NA,,NA,,NA,,NA,,NA,,NA,,NA,,NA,,NA,,NA,,NA,,NA,,NA,,NA,,NA,,NA,,NA,,NA,,NA,,NA,,NA,,NA,,NA,,NA,,NA,,NA,,NA,,NA,,NA,,NA,,NA,,NA,,NA,,NA,,NA,,NA,,NA,,NA,,NA,,NA,,NA,,NA,,NA,,NA,,NA,,NA,,NA,,NA,,NA,,NA,,NA,,NA,,NA,,NA,,NA,,NA,,NA,,NA,,NA,,NA,,NA,
40294945,Peskin (2004) MSR,2004,['Metacognition and self-regulation'],NA,Metacognitive Verb Comprehension Task (f-test),,"This test was based on the comprehension test in Astington and Pelletier (2003). After preliminary training on how to answer forced choice questions, children were told a story with accompanying pictures and eight questions each of which required differentiation between two metacognitive verbs.",,"['Toolkit primary outcome', 'Reading primary outcome']",,0.24,,0.29,,Literacy: reading comprehension,,NA,,NA,,NA,,NA,,NA,,NA,,-0.3284,,0.8084,,Primary outcome,,['Sample: All'],,With business as usual,,['Post-test adjusted for baseline attainment'],,['Test type: Researcher developed test'],,Metacognitive Verb Comprehension Task (f-test),,"This test was based on the comprehension test in Astington and Pelletier (2003). After preliminary training on how to answer forced choice questions, children were told a story with accompanying pictures and eight questions each of which required differentiation between two metacognitive verbs.",,"['Toolkit primary outcome', 'Reading primary outcome']",,0.24,,0.29,,Literacy: reading comprehension,,NA,,NA,,NA,,NA,,NA,,NA,,-0.3284,,0.8084,,Primary outcome,,['Sample: All'],,With business as usual,,['Post-test adjusted for baseline attainment'],,['Test type: Researcher developed test'],,NA,,NA,,NA,,NA,,NA,,NA,,NA,,NA,,NA,,NA,,NA,,NA,,NA,,NA,,NA,,NA,,NA,,NA,,NA,,NA,,NA,,NA,,NA,,NA,,NA,,NA,,NA,,NA,,NA,,NA,,NA,,NA,,NA,,NA,,NA,,NA,,NA,,NA,,NA,,NA,,NA,,NA,,NA,,NA,,NA,,NA,,NA,,NA,,NA,,NA,,NA,,NA,,NA,,NA,,NA,,NA,,NA,,NA,,NA,,NA,,NA,,NA,,NA,,NA,,NA,,NA,,NA,,NA,,NA,,NA,,NA,,NA,,NA,,NA,,NA,,NA,
38224188,Riding (1987),1987,['Metacognition and self-regulation'],NA,Maths Test (posttest means/SDs),,"Means and SDs for treatment (high/low, boys/girls) combined to calculate the overall scores. A test of mathematics was devised comprising 60 questions covering the concept of number and the representation of numbers by symbols, simple rules of addition and subtraction, and number sequence and with more complex addition and subtraction.",,"['Toolkit primary outcome', 'Mathematics primary outcome']",,0.8363,,0.2614,,Mathematics,,32,,16.5,,2.75,,32,,13.75,,3.68,,0.324,,1.3486,,Primary outcome,,['Sample: All'],,With business as usual,,['Post-test unadjusted (select one from this group)'],,['Test type: Researcher developed test'],,Reading Test (overall means/SDs),,"The Breakthrough to Literacy Reading Scheme (Mackay, Thompson & Schaub, 1970) was in common use in the school and was used as the criterion for progress in learning to read. It contained a 'sentence maker' designed to allow the learner to produce written language unaided by composing and arranging sentences using a limited supply of words, which were printed on cards. The child built up the number of words in his sentence maker as he learnt to read and use them. In addition to the Breakthrough materials, the school made use of reading books from a variety of reading schemes. The number of words in the sentence maker was used as the measure of progress in learning to read and to use language. This was considered preferable to a standardised reading test in view of the young age of the children.",,['Reading primary outcome'],,0.1755,,0.2505,,Literacy: reading comprehension,,32,,47.35,,25.89,,32,,42.5,,28.65,,-0.3155,,0.6665,,Secondary outcome(s),,['Sample: All'],,With business as usual,,['Post-test unadjusted (select one from this group)'],,['Test type: Researcher developed test'],,NA,,NA,,NA,,NA,,NA,,NA,,NA,,NA,,NA,,NA,,NA,,NA,,NA,,NA,,NA,,NA,,NA,,NA,,NA,,Maths Test (posttest means/SDs),,"Means and SDs for treatment (high/low, boys/girls) combined to calculate the overall scores. A test of mathematics was devised comprising 60 questions covering the concept of number and the representation of numbers by symbols, simple rules of addition and subtraction, and number sequence and with more complex addition and subtraction.",,"['Toolkit primary outcome', 'Mathematics primary outcome']",,0.8363,,0.2614,,Mathematics,,32,,16.5,,2.75,,32,,13.75,,3.68,,0.324,,1.3486,,Primary outcome,,['Sample: All'],,With business as usual,,['Post-test unadjusted (select one from this group)'],,['Test type: Researcher developed test'],,NA,,NA,,NA,,NA,,NA,,NA,,NA,,NA,,NA,,NA,,NA,,NA,,NA,,NA,,NA,,NA,,NA,,NA,,NA,,NA,,NA,,NA,,NA,,NA,,NA,,NA,,NA,,NA,,NA,,NA,,NA,,NA,,NA,,NA,,NA,,NA,,NA,,NA,
38224245,Roth-van (2002),2002,['Metacognition and self-regulation'],NA,The Informal Test of Inductive Reasoning I (ITIR-I),,"The ITIR- I covers all six paradigms (Generalization, Discrimination, Cross Classification, Recognizing Relations, Discriminating Relations, and System Construction). Each paradigm is represented by three tasks, so the whole test consists of 18 tasks. The tasks share all the external characteris- tics of the Denktraining tasks  The tasks are presented mainly by way of pictures, are derived from the same contexts, cover the same subject matter, and are in the same format as the Denktraining tasks.",,"['Toolkit primary outcome', 'Other outcome']",,0.5208,,0.2292,,Cognitive: reasoning,,41,,14.23,,2.98,,38,,12.79,,2.45,,0.0716,,0.9699,,Primary outcome,,['Sample: All'],,With business as usual,,['Post-test unadjusted (select one from this group)'],,['Test type: Researcher developed test'],,NA,,NA,,NA,,NA,,NA,,NA,,NA,,NA,,NA,,NA,,NA,,NA,,NA,,NA,,NA,,NA,,NA,,NA,,NA,,NA,,NA,,NA,,NA,,NA,,NA,,NA,,NA,,NA,,NA,,NA,,NA,,NA,,NA,,NA,,NA,,NA,,NA,,NA,,NA,,NA,,NA,,NA,,NA,,NA,,NA,,NA,,NA,,NA,,NA,,NA,,NA,,NA,,NA,,NA,,NA,,NA,,NA,,NA,,NA,,NA,,NA,,NA,,NA,,NA,,NA,,NA,,NA,,NA,,NA,,NA,,NA,,NA,,NA,,NA,,NA,,NA,,NA,,NA,,NA,,NA,,NA,,NA,,NA,,NA,,NA,,NA,,NA,,NA,,NA,,NA,,NA,,NA,,NA,,NA,,NA,
38224254,Tomic (1995),1995,['Metacognition and self-regulation'],NA,Cattell Test 1950 - Inductive Reasoning Questions - F test 4.6 ,,NA,,"['Toolkit primary outcome', 'Other outcome']",,0.7356,,0.3544,,Cognitive: reasoning,,NA,,NA,,NA,,NA,,NA,,NA,,0.0409,,1.4303,,Primary outcome,,['Sample: All'],,With business as usual,,['Post-test unadjusted (select one from this group)'],,['Test type: Researcher developed test'],,NA,,NA,,NA,,NA,,NA,,NA,,NA,,NA,,NA,,NA,,NA,,NA,,NA,,NA,,NA,,NA,,NA,,NA,,NA,,NA,,NA,,NA,,NA,,NA,,NA,,NA,,NA,,NA,,NA,,NA,,NA,,NA,,NA,,NA,,NA,,NA,,NA,,NA,,NA,,NA,,NA,,NA,,NA,,NA,,NA,,NA,,NA,,NA,,NA,,NA,,NA,,NA,,NA,,NA,,NA,,NA,,NA,,NA,,NA,,NA,,NA,,NA,,NA,,NA,,NA,,NA,,NA,,NA,,NA,,NA,,NA,,NA,,NA,,NA,,NA,,NA,,NA,,NA,,NA,,NA,,NA,,NA,,NA,,NA,,NA,,NA,,NA,,NA,,NA,,NA,,NA,,NA,,NA,,NA,,NA,
38224255,Tomic (1996) 1_1,1996,['Metacognition and self-regulation'],NA,CFT Intelligence Test - Metacognition,,"Unadjusted mean pots-test scores of the Cattell's Culture Fair test. Test scores do not however include  the subtest ""Mazes"".",,"['Toolkit primary outcome', 'Other outcome']",,0.5033,,0.3491,,Cognitive: reasoning,,17,,31.76,,3.46,,17,,29.94,,3.6,,-0.1809,,1.1875,,Primary outcome,,['Sample: All'],,With business as usual,,['Post-test unadjusted (select one from this group)'],,['Test type: Standardised test '],,NA,,NA,,NA,,NA,,NA,,NA,,NA,,NA,,NA,,NA,,NA,,NA,,NA,,NA,,NA,,NA,,NA,,NA,,NA,,NA,,NA,,NA,,NA,,NA,,NA,,NA,,NA,,NA,,NA,,NA,,NA,,NA,,NA,,NA,,NA,,NA,,NA,,NA,,Researcher-designed Mathematics Test - Metacognition,,Unadjusted mean post-test scores,,['Mathematics primary outcome'],,0.1738,,0.3437,,Mathematics,,17,,16.59,,4.98,,17,,15.76,,4.32,,-0.4999,,0.8476,,Secondary outcome(s),,['Sample: All'],,With business as usual,,['Post-test unadjusted (select one from this group)'],,['Test type: Researcher developed test'],,NA,,NA,,NA,,NA,,NA,,NA,,NA,,NA,,NA,,NA,,NA,,NA,,NA,,NA,,NA,,NA,,NA,,NA,,NA,,NA,,NA,,NA,,NA,,NA,,NA,,NA,,NA,,NA,,NA,,NA,,NA,,NA,,NA,,NA,,NA,,NA,,NA,,NA,
40294959,Tomic (1996) 1_2,1996,['Metacognition and self-regulation'],NA,Raven’s Coloured Progressive Matrices (CPM) Reasoning Test - Metacognition,,Post-test unadjusted mean mean score of a reasoning test ,,"['Toolkit primary outcome', 'Other outcome']",,0.8643,,0.4496,,Cognitive: reasoning,,14,,33.2,,3.768,,9,,29.2,,5.4,,-0.0169,,1.7455,,Primary outcome,,['Sample: All'],,With active control,,['Post-test unadjusted (select one from this group)'],,['Test type: Standardised test '],,NA,,NA,,NA,,NA,,NA,,NA,,NA,,NA,,NA,,NA,,NA,,NA,,NA,,NA,,NA,,NA,,NA,,NA,,NA,,NA,,NA,,NA,,NA,,NA,,NA,,NA,,NA,,NA,,NA,,NA,,NA,,NA,,NA,,NA,,NA,,NA,,NA,,NA,,Researcher-designed Mathematics Test - Metacognition,,Post-test unadjusted mean score of a researcher-designed mathematics test.,,['Mathematics primary outcome'],,0.7626,,0.4447,,Mathematics,,14,,16.65,,2.984,,9,,14.4,,2.6,,-0.1091,,1.6343,,Secondary outcome(s),,['Sample: All'],,With active control,,NA,,['Test type: Researcher developed test'],,NA,,NA,,NA,,NA,,NA,,NA,,NA,,NA,,NA,,NA,,NA,,NA,,NA,,NA,,NA,,NA,,NA,,NA,,NA,,NA,,NA,,NA,,NA,,NA,,NA,,NA,,NA,,NA,,NA,,NA,,NA,,NA,,NA,,NA,,NA,,NA,,NA,,NA,
38224253,Tomic (1998),1997,['Metacognition and self-regulation'],NA,Raven's CPM Test (post test),,Raven Coloured Progressive Matrices Test (Set A) administered to the children. The Raven Coloured Progresive Matrices Test tasks are non- verbal inteligence tests  they are known as measures of fluid inteligence.,,"['Toolkit primary outcome', 'Other outcome']",,0.6531,,0.3002,,Cognitive: reasoning,,23,,9.7,,1.4,,24,,8.7,,1.6,,0.0648,,1.2414,,Primary outcome,,['Sample: All'],,With business as usual,,['Post-test unadjusted (select one from this group)'],,['Test type: Standardised test '],,NA,,NA,,NA,,NA,,NA,,NA,,NA,,NA,,NA,,NA,,NA,,NA,,NA,,NA,,NA,,NA,,NA,,NA,,NA,,NA,,NA,,NA,,NA,,NA,,NA,,NA,,NA,,NA,,NA,,NA,,NA,,NA,,NA,,NA,,NA,,NA,,NA,,NA,,NA,,NA,,NA,,NA,,NA,,NA,,NA,,NA,,NA,,NA,,NA,,NA,,NA,,NA,,NA,,NA,,NA,,NA,,NA,,NA,,NA,,NA,,NA,,NA,,NA,,NA,,NA,,NA,,NA,,NA,,NA,,NA,,NA,,NA,,NA,,NA,,NA,,NA,,NA,,NA,,NA,,NA,,NA,,NA,,NA,,NA,,NA,,NA,,NA,,NA,,NA,,NA,,NA,,NA,,NA,,NA,,NA,
