id,pub_author,pub_year,strand_raw,strand_info,strand_CLEAN,sample_analysed_info,sample_analysed_ht,sample_analysed_CLEAN,part_gen_raw,part_gen_ht,part_gen_info,part_gen_CLEAN,fsm_perc_info,fsm_perc_ht,fsm_perc_CLEAN,fsm_info_info,fsm_info_ht,fsm_info_CLEAN,fsm_na_raw,fsm_na_info,fsm_na_CLEAN,base_n_treat_ht,base_n_treat_info,base_n_treat_CLEAN,base_n_cont_ht,base_n_cont_info,base_n_cont_CLEAN,base_n_treat2_ht,base_n_treat2_info,base_n_treat2_CLEAN,base_n_treat3_ht,base_n_treat3_info,base_n_treat3_CLEAN,n_treat_ht,n_treat_info,n_treat_CLEAN,n_cont_ht,n_cont_info,n_cont_CLEAN,n_treat2_ht,n_treat2_info,n_treat2_CLEAN,n_cont2_ht,n_cont2_info,n_cont2_CLEAN,attri_raw,attri_ht,attri_info,attri_CLEAN,attri_treat_ht,attri_treat_info,attri_treat_CLEAN,attri_perc_ht,attri_perc_info,attri_perc_CLEAN
38111539,Crain-Thoreson (1999) OL,1999,['Oral language interventions'],NA,,22,"['Page 4:\n[¬s]""Staff/practice, n = 13, and Staff/control, n = 9.[¬e]""']",,['Mixed gender'],"['Page 4:\n[¬s]""(22 boys and 10 girls)[¬e]""']",31 ,,NA,NA,,NA,NA,,['No SES/FSM Information Provided'],NA,,"['Page 4:\n[¬s]""Thus, final group sizes were Parent, n = 10, Staff/practice, n = 13, and Staff/control, n = 9.[¬e]""']",13,,"['Page 4:\n[¬s]""Thus, final group sizes were Parent, n = 10, Staff/practice, n = 13, and Staff/control, n = 9.[¬e]""']",9,,NA,NA,,NA,NA,,"['Page 4:\n[¬s]""TABLE 1. Description of Treatment Groups -- Note. Standard deviations are in parentheses. Maternal ed. = mother\x92s education (1 = < high school; 2 = high school; 3 = some postsecondary; 4 = 4-year college degree; 5 = advanced degree); PPVT-R = Peabody Picture Vocabulary Test-Revised (Dunn & Dunn, 1981); EOWPVT-R = Expressive One-Word Picture Vocabulary Test-Revised (Gardner, 1990); MLU = mean length of utterance. an = 10. bn = 13. cn = 9.[¬e]""']",13,,"['Page 4:\n[¬s]""Thus, final group sizes were Parent, n = 10, Staff/practice, n = 13, and Staff/control, n = 9. Table 1 provides information on the three groups of final partic- ipants for demographic variables and for the receptive and expressive language measures.[¬e]""']",9,,NA,NA,,NA,NA,,['Yes'],"['Page 4:\n[¬s]"" Children within each triad were then randomly assigned to the Parent (n = 13), Staff/practice (n = 13), or Staff/control (n = 11) group. (This procedure was followed within each of the three school districts participating in the study, leading to initially unequal numbers of participants in each group.) Five children did not complete the study. Three families dropped out of the parent group, due in one case to illness and in the two other cases to a reported lack of time. Two children in the control group did not complete the study due in one case to illness and in the other case to lack of compliance by the child during posttest video- taping. Thus, final group sizes were Parent, n = 10, Staff/practice, n = 13, and Staff/control, n = 9. Table 1 provides information on the three groups of final partic- ipants for demographic variables and for the receptive and expressive language measures.[¬e]""']",NA,,"['Page 4:\n[¬s]"" Children within each triad were then randomly assigned to the Parent (n = 13), Staff/practice (n = 13), or Staff/control (n = 11) group. (This procedure was followed within each of the three school districts participating in the study, leading to initially unequal numbers of participants in each group.) Five children did not complete the study. Three families dropped out of the parent group, due in one case to illness and in the two other cases to a reported lack of time. Two children in the control group did not complete the study due in one case to illness and in the other case to lack of compliance by the child during posttest video- taping. Thus, final group sizes were Parent, n = 10, Staff/practice, n = 13, and Staff/control, n = 9. Table 1 provides information on the three groups of final partic- ipants for demographic variables and for the receptive and expressive language measures.[¬e]""']",0,,"['Page 4:\n[¬s]"" Children within each triad were then randomly assigned to the Parent (n = 13), Staff/practice (n = 13), or Staff/control (n = 11) group. (This procedure was followed within each of the three school districts participating in the study, leading to initially unequal numbers of participants in each group.) Five children did not complete the study. Three families dropped out of the parent group, due in one case to illness and in the two other cases to a reported lack of time. Two children in the control group did not complete the study due in one case to illness and in the other case to lack of compliance by the child during posttest video- taping. Thus, final group sizes were Parent, n = 10, Staff/practice, n = 13, and Staff/control, n = 9. Table 1 provides information on the three groups of final partic- ipants for demographic variables and for the receptive and expressive language measures.[¬e]""']",9.09,
38111484,Crevecoeur (2008),2008,['Oral language interventions'],NA,,74 ,NA,,['No information provided'],NA,NA,,NA,"['Page 62:\n[¬s]""School A""\n""A large percentage of students (80.8%) were eligible to receive free or reduced-price lunch""\n""SchoolB""\n""A large percentage of students (91.3) were eligible to receive free or reduced- price lunch[¬e]""', 'Page 63:\n[¬s]""SchoolC""\n"" A large percentage of students (73.2) were eligible to receive free or reduced-price lunch[¬e]""']",,NA,NA,,NA,NA,,"['Page 1:\n[¬s]""EOLs, n = 49)[¬e]""', 'Page 64:\n[¬s]""49[¬e]""']",49,,"['Page 64:\n[¬s]""25[¬e]""']",25,,NA,NA,,NA,NA,,"['Page 85:\n[¬s]""49[¬e]""']",49,,"['Page 85:\n[¬s]""25[¬e]""']",25,,NA,NA,,NA,NA,,['No'],NA,NA,,NA,0,,NA,0,
68655326,Dimova (2020),2020,"['Oral language interventions', 'EY_Early literacy approaches', 'EY_Communication and language approaches']",NA,,1071,"['Page 21:\n[¬s]""192 schools provided data""\n""with an average of 5.7 children per school[¬e]""', 'Page 22:\n[¬s]""1071[¬e]""']",,['Mixed gender'],NA,See Table 12 - only baseline data provided and broken down by control and intervention.,,NA,NA,,NA,"['Page 16:\n[¬s]""Schools meeting the following criteria were eligible for inclusion in the study:""\n""has above average free school meal (FSM) eligibility; 7[¬e]""', 'Page 27:\n[¬s]""While it is usual for an EEF trial to report on pupils eligible for Free School Meals (FSM), and indeed the SAP listed\nthis as a subgroup analysis, this was not actually possible in this trial given the lack of FSM data availability for the\nage-group in the trial.[¬e]""']",,NA,NA,,NA,585,,NA,571,,NA,NA,,NA,NA,,NA,NA,,NA,NA,,NA,NA,,NA,NA,,['Yes'],NA,NA,,NA,9,,NA,7,
38111287,Feitelson (1993),1993,['Oral language interventions'],NA,,135  ,NA,,['No information provided'],NA,NA,,NA,NA,,NA,"['Page 3:\n[¬s]""Among the reasons for choosing this town were a lower-than-average income level [¬e]""']",,NA,NA,,"['Page 2:\n[¬s]""The 258 children in the experimental treatment listened to teachers’ story reading daily for 5 months, \'teachers in\nthe control classes (49 children) pursued a Ministry of Education program to enhance expressive language skills. I[¬e]""']",258,,"['Page 2:\n[¬s]""The 258 children in the experimental treatment listened to teachers’ story reading daily for 5 months, \'teachers in\nthe control classes (49 children) pursued a Ministry of Education program to enhance expressive language skills.[¬e]""']",49,,NA,NA,,NA,NA,,"['Page 6:\n[¬s]""‘Experimental n - 86. control n = 49, bAdjusted for pretest WISC-R vocabulary, ‘In a univariate F test, \'p < .05.[¬e]""']",86,,"['Page 6:\n[¬s]""‘Experimental n - 86. control n = 49, bAdjusted for pretest WISC-R vocabulary, ‘In a univariate F test, \'p < .05.[¬e]""']",49,,NA,NA,,NA,NA,,['Unclear (please add notes)'],NA,"Attrition not reported, but outcome data only collected on 1/3rd of treatment group. Explanation    Because resources precluded testing the large number of children that participated in the study, only one third of the students from each experimental class were randomly selected for testing. All children in the control classes were tested, as the experimental group stratum was substantially larger than the control one, requiring a 100% sampling from the smaller group in order to gain a fair representation of all the characteristics investigated (Cochran, 1973).",,NA,66%,,NA,56%,
55203434,Ford (2009),2009,"['EY_Communication and language approaches', 'EY_Self-regulation strategies', 'Metacognition and self-regulation', 'Oral language interventions', 'Parental engagement', 'EY_Parental engagement']",NA,,60,"['Page 6:\n[¬s]""60[¬e]""']",,['Mixed gender'],"['Page 6:\n[¬s]""16 boys and 14 girls in each case[¬e]""']",46.66 ,,100,NA,,NA,"['Page 6:\n[¬s]""Participants were recruited from districts identiﬁed by the local education\nauthority as having markers of severe social and economic deprivation. Approximately,\nhalf the children’s families were headed by young, single mothers and the majority were\nsurviving on unemployment or sickness beneﬁts. In 85% of the families, the primary\ncaregiver had left school at or before the age of 16 years. Most families lived on council\nestates and ethnicity comprised approximately 90% White and 10% Asian. All children\ncame from homes in which English was the primary spoken language.[¬e]""']",,NA,NA,,"['Page 7:\n[¬s]""30[¬e]""']",30,,"['Page 7:\n[¬s]""30[¬e]""']",30,,NA,NA,,NA,NA,,NA,NA,,NA,NA,,NA,NA,,NA,NA,,['Yes'],"['Page 7:\n[¬s]""Six families assigned to the intervention condition failed to complete the\nprogramme due to moving out of the area, producing a ﬁnal sample of 30 children that\nparticipated in the post-intervention assessments.[¬e]""']",NA,,"['Page 7:\n[¬s]""Six families assigned to the intervention condition failed to complete the\nprogramme[¬e]""']",10,,NA,8,
38111492,Freeman (2008),2008,['Oral language interventions'],NA,,27,"['Page 123:\n[¬s]""Full""\n""16""\n""Control""\n""11[¬e]""']",,['No information provided'],NA,NA,,NA,NA,,NA,NA,,['No SES/FSM Information Provided'],NA,,"['Page 118:\n[¬s]""16[¬e]""']",16,,"['Page 118:\n[¬s]""11[¬e]""']",11,,NA,NA,,NA,NA,,NA,NA,,NA,NA,,NA,NA,,NA,NA,,['No'],NA,NA,,NA,NA,,NA,NA,
37671552,Fricke (2013),2013,"['Teaching assistants', 'Oral language interventions', 'EY_Communication and language approaches']",NA,,164,"['Page 3:\n[¬s]""Allocated to intervention (N = 90)\nReceived allocated intervention (N = 89)\nDid not receive allocated intervention due\nto moving schools before intervention\nstarted (N = 1)\nAllocated to waiting control (N = 90)\n•""\n""Intervention\n••\nLost to follow-up due to moving schools:\nt2 = 6\nt3 = 0\nt4 = 0\nt5 = 1\nt6 = 0\nWaiting control\nLost to follow-up due to moving schools:\nt2 = 2\nt3 = 0\nt4 = 1\nt5 = 3\nt6 = 2[¬e]""']",,['No information provided'],NA,NA,,NA,NA,,NA,NA,,['No SES/FSM Information Provided'],NA,,"['Page 3:\n[¬s]""Allocated to intervention (N = 90)[¬e]""']",90,,"['Page 3:\n[¬s]""Allocated to waiting control (N = 90)[¬e]""']",90,,NA,NA,,NA,NA,,"['Page 3:\n[¬s]""Allocated to intervention (N = 90)""\n""Intervention •• Lost to follow-up due to moving schools: t2 = 6 t3 = 0 t4 = 0 t5 = 1 t6 = 0""\n""Received allocated intervention (N = 89)\nDid not receive allocated intervention due\nto moving schools before intervention\nstarted (N = 1)[¬e]""']",82,,"['Page 3:\n[¬s]""Allocated to waiting control (N = 90)""\n""Waiting control\nLost to follow-up due to moving schools:\nt2 = 2\nt3 = 0\nt4 = 1\nt5 = 3\nt6 = 2[¬e]""']",82,,NA,NA,,NA,NA,,['Yes'],"['Page 3:\n[¬s]""Intervention\n••\nLost to follow-up due to moving schools:\nt2 = 6\nt3 = 0\nt4 = 0\nt5 = 1\nt6 = 0""\n""Waiting control\nLost to follow-up due to moving schools:\nt2 = 2\nt3 = 0\nt4 = 1\nt5 = 3\nt6 = 2[¬e]""']",NA,,"['Page 3:\n[¬s]""Allocated to intervention (N = 90) Received allocated intervention (N = 89) Did not receive allocated intervention due to moving schools before intervention started (N = 1)""\n""\x81 \x81""\n""t2 = 6\nt3 = 0\nt4 = 0\nt5 = 1\nt6 = 0[¬e]""']",9,,"['Page 3:\n[¬s]""Allocated to intervention (N = 90)\nReceived allocated intervention (N = 89)\nDid not receive allocated intervention due\nto moving schools before intervention\nstarted (N = 1)""\n""Allocated to waiting control (N = 90)""\n""Intervention\n••\nLost to follow-up due to moving schools:\nt2 = 6\nt3 = 0\nt4 = 0\nt5 = 1\nt6 = 0\nWaiting control\nLost to follow-up due to moving schools:\nt2 = 2\nt3 = 0\nt4 = 1\nt5 = 3\nt6 = 2[¬e]""']",9%,
37671520,Haley (2017),2017,"['Teaching assistants', 'Oral language interventions']",NA,,98,"['Page 1:\n[¬s]""eight children (N = 104, mean age = 3 years 11 months) with the poorest performance on standardized language measures were selected to take part. All but one child were randomly allocated to either an intervention (N = 52) or a waiting control group (N = 51). [¬e]""']",,['Mixed gender'],"['Page 5:\n[¬s]""Gender (% male) 52% 55%[¬e]""']",46.5,,NA,NA,,NA,NA,,['No SES/FSM Information Provided'],NA,,NA,52,,NA,51,,NA,NA,,NA,NA,,NA,51,,NA,47,,NA,NA,,NA,NA,,['Yes'],NA,1 child in treatment and 4 children in control dropped the study.,,"['Page 4:\n[¬s]""Figure 1. CONSORT ﬂowchart detailing the selection, allocation and attrition ofparticipants.[¬e]""']",2,,NA,10%,
38111647,Hargrave (2000),2000,['Oral language interventions'],NA,,36,"['Page 5:\n[¬s]""The participants were 36 children (21 girls and 15 boys) between the ages of 3 and 5.[¬e]""']",,['Mixed gender'],"['Page 5:\n[¬s]""21 girls and 15 boys[¬e]""']",58.3,,NA,NA,,NA,"['Page 5:\n[¬s]"" The two centers catered primarily to low-income families, as 98% of the participating families quali®ed for govern- ment subsidy to cover either partial or total cost of child care.[¬e]""']",,NA,NA,,"['Page 5:\n[¬s]""The participants were 36 children (21 girls and 15 boys) between the ages of 3 and 5. On average, children were 4 years 1 months (SD 5 7 months) at the time of pre-testing.[¬e]""']",18,,"['Page 5:\n[¬s]""The participants were 36 children (21 girls and 15 boys) between the ages of 3 and 5. On average, children were 4 years 1 months (SD 5 7 months) at the time of pre-testing.[¬e]""']",18,,NA,NA,,NA,NA,,"['Page 5:\n[¬s]""The participants were 36 children (21 girls and 15 boys) between the ages of 3 and 5. On average, children were 4 years 1 months (SD 5 7 months) at the time of pre-testing. The data for eight additional children were not analyzed for a variety of reasons. One child had been diagnosed as having a learning disability. Three children did not have poor expressive vocabulary skills. In addition, the data for the two youngest children (30 and 31 months) from the regular-reading center and the two oldest children (61 and 64 months) from the dialogic-reading center were excluded to equate the two groups on age.[¬e]""']",14,,"['Page 5:\n[¬s]""The participants were 36 children (21 girls and 15 boys) between the ages of 3 and 5. On average, children were 4 years 1 months (SD 5 7 months) at the time of pre-testing. The data for eight additional children were not analyzed for a variety of reasons. One child had been diagnosed as having a learning disability. Three children did not have poor expressive vocabulary skills. In addition, the data for the two youngest children (30 and 31 months) from the regular-reading center and the two oldest children (61 and 64 months) from the dialogic-reading center were excluded to equate the two groups on age.[¬e]""']",14,,NA,NA,,NA,NA,,['Yes'],"['Page 5:\n[¬s]""The data for eight additional children were not analyzed for a variety of reasons. One child had been diagnosed as having a learning disability. Three children did not have poor expressive vocabulary skills. In addition, the data for the two youngest children (30 and 31 months) from the regular-reading center and the two oldest children (61 and 64 months) from the dialogic-reading center were excluded to equate the two groups on age.[¬e]""']",NA,,"['Page 5:\n[¬s]""The data for eight additional children were not analyzed for a variety of reasons. One child had been diagnosed as having a learning disability. Three children did not have poor expressive vocabulary skills. In addition, the data for the two youngest children (30 and 31 months) from the regular-reading center and the two oldest children (61 and 64 months) from the dialogic-reading center were excluded to equate the two groups on age.[¬e]""']",22.222%,,"['Page 5:\n[¬s]""The data for eight additional children were not analyzed for a variety of reasons. One child had been diagnosed as having a learning disability. Three children did not have poor expressive vocabulary skills. In addition, the data for the two youngest children (30 and 31 months) from the regular-reading center and the two oldest children (61 and 64 months) from the dialogic-reading center were excluded to equate the two groups on age.[¬e]""']",22.222%,
38111494,Harvey (2002),2002,['Oral language interventions'],NA,,80,"['Page 48:\n[¬s]""The treatment group initially consisted of 41 preschool children""\n"" An Asian female child was dropped from the treatment group once it was apparent English was not the language spoken in the home, and that her English was very limited. This left the treatment group with 40 preschool subjects.[¬e]""', 'Page 50:\n[¬s]""The comparison group consisted of 40 students chosen by random assignment.[¬e]""']",,['Mixed gender'],"['Page 68:\n[¬s]""Within the treatment group, 47.5% of the population were girls (n = 19/40), while 52.5% were boys (n = 21/40). [¬e]""', 'Page 71:\n[¬s]""Fifty-five percent of the students in the comparison group were girls (n = 22/40), while 45% were boys (n = 18/40).[¬e]""']",51.25,,NA,NA,,NA,NA,,['No SES/FSM Information Provided'],NA,,"['Page 48:\n[¬s]""The treatment group initially consisted of 41 preschool children 3.6-5.2 years, who were selected via random assignment to the treatment under investigation, which was to determine whether listening to audiobooks increased a preschool child’s receptive and/or expressive vocabulary[¬e]""']",41,,"['Page 50:\n[¬s]""The comparison group consisted of 40 students chosen by random assignment.[¬e]""']",40,,NA,NA,,NA,NA,,"['Page 159:\n[¬s]""40[¬e]""']",40,,"['Page 153:\n[¬s]""40[¬e]""']",40,,NA,NA,,NA,NA,,['Yes'],"['Page 39:\n[¬s]""The target population initially consisted of 81 preschool children who were between the ages of 3.6 years and 5.2 years at the beginning of the study. One child was dropped from the study when it became evident English was not the language spoken in the home.[¬e]""', 'Page 41:\n[¬s]"" One child was dropped from the study after the pretesting session when it became evident English was not the primary language spoken in the home.[¬e]""', 'Page 48:\n[¬s]""An Asian female child was dropped from the treatment group once it was apparent English was not the language spoken in the home, and that her English was very limited. This left the treatment group with 40 preschool subjects.[¬e]""']",NA,,"['Page 48:\n[¬s]"" An Asian female child was dropped from the treatment group once it was apparent English was not the language spoken in the home, and that her English was very limited. This left the treatment group with 40 preschool subjects.[¬e]""']",2.5,,"['Page 39:\n[¬s]""The target population initially consisted of 81 preschool children who were between the ages of 3.6 years and 5.2 years at the beginning of the study. One child was dropped from the study when it became evident English was not the language spoken in the home.[¬e]""', 'Page 48:\n[¬s]""An Asian female child was dropped from the treatment group once it was apparent English was not the language spoken in the home, and that her English was very limited. This left the treatment group with 40 preschool subjects.[¬e]""', 'Page 50:\n[¬s]""The comparison group consisted of 40 students chosen by random assignment. Each participant on this group received a child’s tabletop easel, a packet of art supplies, paper, and a folder to keep finished artwork in (Appendix G).[¬e]""']",1.23,
38111495,Hasson (1981),1981,['Oral language interventions'],NA,,77,"['Page 31:\n[¬s]"" The final sample consisted of 77 subjects,[¬e]""', 'Page 32:\n[¬s]""The experimental group consisted of 40 subjects, 20 boys and 20 girls. ""\n""The control group consisted of 37 subjects, 19 boys and 18 girls.[¬e]""']",,['Mixed gender'],"['Page 31:\n[¬s]""The final sample consisted of 77 subjects, 39 boys and 38 girls.[¬e]""', 'Page 32:\n[¬s]"" The experimental group consisted of 40 subjects, 20 boys and 20 girls.""\n""The control group consisted of 37 subjects, 19 boys and 18 girls.[¬e]""']",49.35,,NA,NA,,"Whole school, not specific sample.","['Page 32:\n[¬s]""The population consisted primarily of middle and low-middle socio\xad economic families.[¬e]""']",,NA,NA,,"['Page 32:\n[¬s]"" The experimental group consisted of 40 subjects, 20 boys and 20 girls.[¬e]""']",40,,"['Page 32:\n[¬s]""The control group consisted of 37 subjects, 19 boys and 18 girls.[¬e]""']",37,,NA,NA,,NA,NA,,NA,40,,"['Page 46:\n[¬s]""TABLE 3 MEANS AMD STANDARD DEVIATIONS OF AURAL COMPREHENSION SCORES ON STANFORD EARLY SCHOOL ACHIEVEMENT TEST Condition N M SD Experimental 40 Control 37 23.48 3.30 22.76 3.94[¬e]""']",37,,NA,NA,,NA,NA,,['Yes'],"['Page 31:\n[¬s]"" During the course of the study, three children moved out of the school district and one child was assigned to the special education class.[¬e]""']",NA,,NA,NA,,"['Page 31:\n[¬s]"". During the course of the study, three children moved out of the school district and one child was assigned to the special education class[¬e]""']",4.94,
47269817,Hyman (1967) OL,1967,"['Oral language interventions', 'Summer schools']",NA,,40,NA,,['No information provided'],NA,NA,,NA,NA,,NA,NA,,['No SES/FSM Information Provided'],NA,,"['Page 5:\n[¬s]""20[¬e]""']",20,,"['Page 5:\n[¬s]""20[¬e]""']",20,,NA,NA,,NA,NA,,"['Page 5:\n[¬s]""20[¬e]""']",20,,NA,20,,NA,NA,,NA,NA,,['No'],NA,NA,,NA,0,,NA,0,
38111649,Justice (2005),2005,['Oral language interventions'],NA,,57,"['Page 5:\n[¬s]""Fifty-seven""\n"" treatment (n = 29) or comparison (n = 28) group[¬e]""', 'Page 6:\n[¬s]"" treatment (n = 29) or comparison (n = 28) group[¬e]""']",,['Mixed gender'],"['Page 5:\n[¬s]""35 males, 22 females[¬e]""']",38.59,,NA,NA,,NA,"['Page 5:\n[¬s]"" more than two thirds of the children in each school qualified for free or reduced meals[¬e]""']",,NA,NA,,NA,29,,NA,28,,NA,NA,,NA,NA,,NA,NA,,NA,NA,,NA,NA,,NA,NA,,['No'],NA,NA,,NA,NA,,NA,NA,
38111681,Justice (2010),2010,['Oral language interventions'],NA,,379,"['Page 6:\n[¬s]""The final sample of children included 201 children (96 boys, 105 girls) in the high-dose print- referencing condition and 178 children (79 boys, 99 girls) in the book-reading comparison group.[¬e]""']",,['Mixed gender'],"['Page 6:\n[¬s]""he final sample of children included 201 children (96 boys, 105 girls) in the high-dose print- referencing condition and 178 children (79 boys, 99 girls) in the book-reading comparison group.[¬e]""']",53.82,,NA,NA,,NA,"['Page 5:\n[¬s]""Due to study selection procedures in which children were participants in targeted-enrollment preschool programs, this sample is skewed with respect to socioeconomic status (SES). Specifically, the majority of the children \x92 s families reported earning an annual income < $30,000 (56%), and only 4.5% of the families earned > $65,000 per year (data based on 83% of families reporting in- come data). Additional information regarding SES (maternal edu- cation), as well as other key child characteristics, is provided in Table 1.[¬e]""']",,NA,NA,,"['Page 6:\n[¬s]"" 201 children (96 boys, 105 girls) in the high-dose print- referencing condition [¬e]""']",201,,"['Page 6:\n[¬s]"" 178 children (79 boys, 99 girls) in the book-reading comparison group[¬e]""']",178,,NA,NA,,NA,NA,,"['Page 8:\n[¬s]""159[¬e]""']",159,,"['Page 8:\n[¬s]""129[¬e]""']",129,,NA,NA,,NA,NA,,['Yes'],"['Page 1:\n[¬s]""experimental (n = 201) and comparison (n = 178)[¬e]""', 'Page 8:\n[¬s]""Print-referencing condition""\n""Comparison condition""\n""151""\n""127[¬e]""']",NA,,"['Page 1:\n[¬s]""experimental (n = 201)[¬e]""', 'Page 8:\n[¬s]""Print-referencing condition""\n""151[¬e]""']",24.875,,"['Page 1:\n[¬s]""experimental (n = 201) and comparison (n = 178) [¬e]""', 'Page 8:\n[¬s]""Print-referencing condition""\n""Comparison condition""\n""151""\n""127[¬e]""']",26.649%,
38111673,Karweit (1989),1989,['Oral language interventions'],NA,, 206 ,"['Page 2:\n[¬s]""206 prekindergarten (43 matched pairs) and kin- dergarten students (60 matched pairs) [¬e]""']",,['No information provided'],NA,NA,,NA,NA,,NA,NA,,['No SES/FSM Information Provided'],Information was provided only in relation to the whole school from which the sample was taken (103 pupils from a total of 440 made up the sample). See highlighted material.,,"['Page 2:\n[¬s]""206 prekindergarten (43 matched pairs) and kin- dergarten students (60 matched pairs) [¬e]""']",103,,"['Page 2:\n[¬s]""206 prekindergarten (43 matched pairs) and kin- dergarten students (60 matched pairs)[¬e]""']",103,,NA,NA,,NA,NA,,"['Page 8:\n[¬s]""Prekindergarten (N= 43 pairs)[¬e]""', 'Page 9:\n[¬s]""Kindergarten (N= 60 pairs)[¬e]""']",PKG  43 KG  60,,"['Page 8:\n[¬s]""Prekindergarten (N= 43 pairs)[¬e]""', 'Page 9:\n[¬s]""Kindergarten (N= 60 pairs)[¬e]""']",PKG  43 KG  60,,NA,NA,,NA,NA,,['No'],NA,NA,,NA,0,,NA,0,
