id,pub_author,pub_year,strand_raw,strand_info,strand_CLEAN,int_name_ht,int_name_info,int_name_CLEAN,int_desc_ht,int_desc_info,int_desc_CLEAN,int_objec_ht,int_objec_info,int_objec_CLEAN,int_prov_raw,int_prov_ht,int_prov_info,int_prov_CLEAN,int_training_raw,int_training_ht,int_training_info,int_training_CLEAN,int_part_raw,int_part_ht,int_part_info,int_part_CLEAN,int_approach_raw,int_approach_ht,int_approach_info,int_approach_CLEAN,digit_tech_raw,digit_tech_ht,digit_tech_info,digital_tech_CLEAN,parent_partic_raw,parent_partic_ht,parent_partic_info,parent_partic_CLEAN,int_when_raw,int_when_ht,int_when_info,int_when_CLEAN,int_who_raw,int_who_ht,int_who_info,int_who_CLEAN,int_dur_ht,int_dur_info,int_dur_CLEAN,int_freq_ht,int_freq_info,int_freq_CLEAN,int_leng_ht,int_leng_info,int_leng_CLEAN,int_fidel_raw,int_fidel_ht,int_fidel_info,int_fidel_CLEAN,int_cost_raw,int_cost_ht,int_cost_info,int_cost_CLEAN,out_eval_raw,out_eval_ht,out_eval_info,out_eval_CLEAN,eef_eval_raw,eef_eval_CLEAN,base_diff_raw,base_diff_ht,base_diff_info,base_diff_CLEAN,comp_anal_raw,comp_anal_ht,comp_anal_info,comp_anal_CLEAN,comp_var_rep_raw,comp_var_rep_ht,comp_var_rep_info,comp_var_rep_CLEAN,comp_var_raw,comp_var_ht,comp_var_info,comp_var_CLEAN,clust_anal_raw,clust_anal_ht,clust_anal_info,clust_anal_CLEAN
38224167,Adey (2002),2002,['Metacognition and self-regulation'],NA,,"['Page 1:\n[¬s]""Cognitive Acceleration[¬e]""']",NA,,"['Page 11:\n[¬s]"" The total programme for this experiment consisted of 26 CA activities plus three introductory listening’ activities intended to introduce children to the working methods of the activities (listening to others, respecting others’ views, finding ways of disagreeing constructively, and so on). In practice, the teachers would do the CA activity with one group of six children on Monday, while the rest of the class carried on with other work set from the task board’, sometimes with the help of a teacher assistant. Each day of the week a different group would get the CA activity, so that a whole class of 30 children could be covered in each week. The activities typically took 30 to 40 minutes. Each activity related to one of the schemata of concrete operations described in detail by Piaget and Inhelder, and scaled by Shayer et al. (1988). This latter work, especially, provides comprehensive data from a large international study on the relative difficulty of each schema. One set of concrete schemata, however, was specifically excluded from the intervention programme for this experiment: those related to conservation.""\n""A list of the CA activities in the intervention programme for this experiment is given in 1\'aiSi\'c 6. Table 6. List of activities in CA intervention programme, 1999/2000[¬e]""', 'Page 12:\n[¬s]""Each activity has a pattern in its delivery. There is initial concrete preparation’ in which the situation, apparatus, and any unfamiliar words and phrases are introduced. Then there is a phase of cognitive conflict where the problem is presented and the difficulty of reasoning comes to the fore as attempts are made to find a solution, with all in the group contributing to the construction of new understanding. Whilst metacognition may be included in this phase, it is often also made specific after the construction (‘How did we solve that problem?\'). Finally there is a bridging phase, when the teacher shows other opportunities where that schema can be used.[¬e]""']",NA,,"['Page 1:\n[¬s]""To investigate the effect of a cogniti ve intervention programme on the cognitive development of children in Year I of primary schools.[¬e]""', 'Page 5:\n[¬s]""Within a formal educational setting, the development of concrete operational thinking, as characterised by Piaget a nd Inhelder, can be accelerated in children aged five or six years with an intervention programme which provides well-managed cognitive conflict and structured opportunities for social construction, including the encouragement of metacognition.[¬e]""']",NA,,"['University/ researcher design', 'Local education authority or district']",NA,NA,,['Yes (Please specify)'],"['Page 12:\n[¬s]""All of the authors of this paper have extensive experience of working with practising teachers to support the development of their pedagogy and we drew both on this experience and on research on effective staff development (e.g., Joyce & Showers. 1995) to design a course of six in-[¬e]""', 'Page 13:\n[¬s]""service days and three or four coaching visits to each teacher to help them develop the necessary skills. The programme introduced the basic theory of cognitive acceleration, allowed the teachers to experience the specific activities, and gave them plenty of opportunity to share their experiences of using the method with their children. Teaching methods on the professional development programme mirrored the methods of cognitive acceleration, especially with respect to social construction and metacognition.[¬e]""']",NA,,['Students'],NA,NA,,['Large group/class teaching (+6)'],"['Page 11:\n[¬s]"" In practice, the teachers would do the CA activity with one group of six children on Monday, while the rest of the class carried on with other work set from the task board’, sometimes with the help of a teacher assistant. Each day of the week a different group would get the CA activity, so that a whole class of 30 children could be covered in each week.[¬e]""']",NA,,['No'],NA,NA,,['No'],NA,NA,,['During regular school hours '],NA,NA,,['Class teachers'],NA,NA,,"['Page 6:\n[¬s]"" near the start of the school year to all of the Year 1 children in 10 experimental (‘CA’ for Cognitive Acceleration) schools and five control schools. Near the end of the school year, the same tests were administered to the same children. During the year, the children in CA schools experienced an intervention programme designed on the theoretical bases outlined in the last section.[¬e]""']",33,,"['Page 11:\n[¬s]""In practice, the teachers would do the CA activity with one group of six children on Monday, while the rest of the class carried on with other work set from the task board’, sometimes with the help of a teacher assistant. Each day of the week a different group would get the CA activity, so that a whole class of 30 children could be covered in each week.[¬e]""']",1,,"['Page 11:\n[¬s]""The activities typically took 30 to 40 minutes.[¬e]""']",35,,['No implementation details provided.'],NA,NA,,['No'],NA,NA,,['The developer'],NA,NA,,No,,['Yes'],"['Page 7:\n[¬s]""Table 2. Comparison of baseline test means for language and for number for CA and Control children""\n""It appears that the children in the CA classes score significantly higher on the baseline testing than did those in die control classes.[¬e]""']",NA,,['Yes'],"['Page 6:\n[¬s]""Table I. Some social and ethnic data on the children in the study[¬e]""', 'Page 7:\n[¬s]""Table 2. Comparison of baseline test means for language and for number for CA and Control children[¬e]""']",NA,,['Yes'],NA,NA,,"['Socio-economic status', 'Other (please specify)', 'Educational attainment']","['Page 6:\n[¬s]""% eligible for free school meals[¬e]""', 'Page 6:\n[¬s]""Ethnic composition (%)[¬e]""', 'Page 7:\n[¬s]""t-test CASE-Control[¬e]""']",NA,,['No'],NA,NA,
47063511,Barnett (2008),2008,['Metacognition and self-regulation'],NA,,"['Page 1:\n[¬s]""Tools ofthe Mind (Tools) curriculum[¬e]""']",NA,,"['Page 1:\n[¬s]""focuses on the development of self-regulation at the\nsame time as teaching literacy and mathematics skills in a way that is socially mediated by\npeers and teachers and with a focus on play[¬e]""']",NA,,"['Page 1:\n[¬s]""development of self-regulation at the\nsame time as teaching literacy and mathematics skills[¬e]""', 'Page 2:\n[¬s]""emphasisonself-regulationandemergent literacy[¬e]""', 'Page 3:\n[¬s]""curriculum focuses on broad foundational skills, including children’s abilities to regulate their own social and\ncognitive behaviors, to attend and to remember on purpose, the use ofsymbolic representation, and early math skills[¬e]""']",NA,,['University/ researcher design'],NA,NA,,['Yes (Please specify)'],"['Page 6:\n[¬s]""The two groups\nof teachers received similar amounts of in-service training so that differences in this may be ruled out as an explanation for\ngroup differences. Teachers who were assigned to Tools received 4 full days of curriculum training before classes began in\nthe 2002–2003 school year.""\n""During the school year Tools teachers received 30min classroom visits approximately once a week from a Tools trainer\nto address any difﬁculties they were having with the curriculum. If a teacher expressed a speciﬁc concern the Tools trainer\nwould then schedule an appointment to come and spend more time in that teacher’s classroom. In addition to classroom\nvisits, Tools teachers received one half-day workshop and ﬁve 1-h lunchtime meetings to discuss aspects of the curriculum.[¬e]""']",NA,,"['Students', 'Teachers']","['Page 3:\n[¬s]""As the name suggests, Tools guides teachers’ daily practices to support children’s acquisition and development of various\npsychological “tools.”[¬e]""']",NA,,['Large group/class teaching (+6)'],"['Page 6:\n[¬s]""Tools sets aside a limited amount of time, 8–10min, for large group morning meeting\nand is very speci?c regarding how it is to be implemented. Tools teachers are expected to pose questions to the group of\nchildren, rather than to speci?c individuals.""\n""We found that on average large group sessions lasted 9min in Tools classroom[¬e]""']",no indication of small groups,,['No'],NA,NA,,['No'],NA,NA,,['During regular school hours '],NA,NA,,['Class teachers'],"['Page 5:\n[¬s]""In addition, treatment group teachers signed documents in which they pledged not to divulge the practices they\nwere learning to other teachers while the study was underway.[¬e]""']",NA,,"['Page 6:\n[¬s]""Children were assessed in the fall (October and November) and spring (late April through early June) of the 2002–2003\nschool year[¬e]""']",20,,NA,NA,,NA,NA,,['Quantitative'],"['Page 6:\n[¬s]""Full implementation of the Tools curriculum requires speci?c materials and procedures. In addition to more general\nobservation measures discussed later, highly speci?c ?delity measures were developed to assess the extent to which the\nstudy classrooms provided required materials and followed distinctive program procedures. For example, socio-dramatic\nplay is considered to lead cognitive development during the preschool period. Thus, the curriculum calls for the use of toy\n?gures (animal or human) in each ofthe learning centers in the classroom to support children’s socio-dramatic play. To assess\n?delity ofimplementation regarding materials, a 50-item “environmental features” observation instrument was developed.\nThe scale measures the presence of materials for seven features: opening activity (circle time); play; equipment; classroom\nlabeling; books; writing; and socio-dramatic play. A criterion of 80% was established as “full” implementation for each\nfeature. Reliability scores of.85–.96were obtained prior to collecting data fromthe study classrooms. At the beginning ofthe\nyear, the Tools classrooms fully implemented three of the seven key environmental features. At years end, Tools classrooms\nfully implemented all environmental features except writing. Control classrooms did not fully implement any of the key\nenvironmental features at any time.""\n""Assessment of ﬁdelity regarding procedures focused on one particular activity that is common to many curricula, large\ngroup morning meeting (circle time). Tools sets aside a limited amount of time, 8–10min, for large group morning meeting\nand is very speciﬁc regarding how it is to be implemented. Tools teachers are expected to pose questions to the group of\nchildren, rather than to speciﬁc individuals. Fidelity of implementation in this activity was examined using video tapes of\nlarge group meetings collected midyear. We found that on average large group sessions lasted 9min in Tools classrooms\nand 19min in control classrooms. This indicated ﬁdelity to the Tools model and a clear difference between treatment and\ncontrol conditions.""\n""In addition, Tools teachers are expected to pose questions to the entire group simultaneously during\nrather than to individual children during large group time. Thus, ﬁdelity of teacher–child interaction was assessed by coding\nthe video-taped teacher and child large group time interactions for instances in which teachers posed questions to the group\nas “group talk” and questions to individual children as “individual talk.” Coders were na¨ıve with respect to the study’s focus\nand which classrooms were in the treatment or control conditions. Reliability scores ranged from .90 to .95. Tools teachers,\nbut not control group teachers, were found to direct signiﬁcantly more “group talk” than “individual talk.”[¬e]""']",NA,,['Yes (Please add details)'],"['Page 5:\n[¬s]""A total of 274 three- and four-year-old children were randomly assigned to either Tools curriculum classrooms (n=106)\nor district curriculum classrooms (n=168).""\n""As an incentive to join the\nstudy parentswere offered $20worth ofchildren’s books[¬e]""', 'Page 6:\n[¬s]""All the teachers chosen to participate in the study freely agreed to do so and signed informed consent. For their participa-\ntion, teachers were given a $100 honorarium plus $300 worth of educational supplies for their classrooms[¬e]""']",some of the costs are reported but not total costs ,,['The developer'],NA,NA,,No,,['Yes'],"['Page 10:\n[¬s]""Table 4\nComparisons of pre-test scores by treatment group (Tools versus control)[¬e]""', 'Page 6:\n[¬s]""No signiﬁcant differences\nwere found between Tools and control group children on these characteristics or on prior child care attendance, frequency of\nbeing read to in the home, and parent-reported knowledge ofnumbers, letters, and colors[¬e]""']",NA,,['No'],NA,NA,,['No'],NA,NA,,NA,NA,NA,,['Yes'],"['Page 10:\n[¬s]""Given the multi-level nature of the data, we also estimated hierarchical linear models with treatment at the classroom\nlevel. These analyses are more conservative as they recognize that children are clustered within classrooms.[¬e]""']",NA,
47063512,Blair (2014),2014,['Metacognition and self-regulation'],NA,,"['Page 2:\n[¬s]""Tools of the Mind[¬e]""']",NA,,"['Page 2:\n[¬s]""Tools of the Mind. This study is the first to examine the kindergarten version of the program.""\n""Specifically, Tools of the Mind has a coherent focus\non executive functions as a primary mechanism through which\nchildren make academic progress and develop social competen-\ncies. In doing so, the program blends teacher-led scaffolding of a\ncomprehensive curriculum of literacy, mathematics, and science\nactivities aligned with the Common Core Standards with child-\ndirected activities and structured sociodramatic play. In Tools of\nthe Mind, teachers learn how to organize and manage instruction\nso that children build self-regulation skills through purposeful\ninteractions with classmates.""\n""To make play an effective\neducational approach, play in Tools of the Mind classrooms is\nplanned in advance, includes children’s enactment of roles with\nimplicit rules, role speech, and the use of symbolic props [e.g. a\nblock is a loafofbread, a brick, a phone, etc.]""\n""Another major difference between Tools and traditional\nkindergarten is the intentional use of peer interaction and teacher\nscaffolding t[¬e]""', 'Page 3:\n[¬s]""The teaching practices and activities of Tools of the Mind are\ndesigned to promote academic learning and ability by broadly\nfocusing on multiple aspects of self-regulation including executive\nfunctions, social and emotion regulation skills, the control of\nattention, and the regulation of stress response physiology.[¬e]""']",NA,,"['Page 3:\n[¬s]""The teaching practices and activities of Tools of the Mind are\ndesigned to promote academic learning and ability by broadly\nfocusing on multiple aspects of self-regulation including executive\nfunctions, social and emotion regulation skills, the control of\nattention, and the regulation of stress response physiology[¬e]""']",NA,,['University/ researcher design'],NA,NA,,['Yes (Please specify)'],"['Page 4:\n[¬s]""Teachers and teaching assistants in the Tools of the Mind\nclassrooms were trained in a 2-year professional development\ncycle. In Year 1 teachers had 4 workshops spread across the year\nwith a total of 5 days of training [Workshop 1 is 2 days]. Year 2\nhad 3 training workshops spread across the year with 3 days of\ntraining. Each school had a Tools coach that worked with the\nTools trainer to provide in-classroom coaching once every other\nweek during Year 1 and then once a month in Year 2. Coaches\nvaried in their experience with Tools. Most were new to Tools and\ntrained with the teachers during Year 1. There were self-reflection\nforms for the teacher to complete to assist the teacher in thinking\nabout the implementation of different activities and to help the\nteacher reach better fidelity. Four times a year the Tools trainer\nwould visit classrooms with the Coach to give feedback to the\ncoach. Tools teachers may have attended district-wide professional\ndevelopment, such as health-related training, but they were not\ntrained on any other curriculum during the course of the study.[¬e]""']",NA,,"['Students', 'Teachers']","['Page 2:\n[¬s]""In Tools of\nthe Mind, teachers learn how to organize and manage instruction\nso that children build self-regulation skills through purposeful\ninteractions with classmates. In this way, the program is designed\nto foster attention and emotion regulation skills in ways that\nsupport the development of executive functions and lead to\nadvances in social and emotional competence. Teachers also\nengage in daily dynamic assessment of children’s development in\ncore areas and provide individualized, differentiated scaffolding\n[meaning that teachers increase or decrease instructional and\nemotional support depending on how a child independently\nperforms a specific skill.][¬e]""']",NA,,"['Large group/class teaching (+6)', 'Paired learning']","['Page 2:\n[¬s]""Another major difference between Tools and traditional\nkindergarten is the intentional use of peer interaction and teacher\nscaffolding to support reflective, higher-order thinking skills and to\nassist children in developing social competence and intrinsic\nmotivation to accomplish academic tasks and goals. Maintaining\nand building children’s intrinsic motivation to learn instead of[¬e]""', 'Page 3:\n[¬s]""using external rewards [stickers or stars] is a distinguishing feature\nof Tools. Social interaction within learning activities and games is\ndesigned so that children work primarily in pairs with materials\nthat are self-correcting and prompt children to help one another.[¬e]""']",NA,,['No'],NA,NA,,['No'],NA,NA,,['During regular school hours '],NA,NA,,"['Class teachers', 'Teaching assistants']","['Page 4:\n[¬s]""Teachers and teaching assistants in the Tools of the Mind[¬e]""', 'Page 4:\n[¬s]""Teachers and teaching assistants in the Tools of the Mind[¬e]""']",NA,,"['Page 3:\n[¬s]""On average children were seen at the end of October in the fall\nand at the end of March in the spring.[¬e]""']",20,,NA,NA,,NA,NA,,['No implementation details provided.'],NA,NA,,['No'],NA,NA,,['The developer'],NA,NA,,No,,NA,NA,NA,,['Yes'],"['Page 7:\n[¬s]""[age, sex, parent\neducation, pre-treatment cognitive ability] and school-level\n[percent free or reduced-price lunch, size of kindergarten\nenrollment] covariate[¬e]""']",NA,,NA,NA,NA,,NA,NA,NA,,['Yes'],"['Page 7:\n[¬s]""We analyzed the data using multilevel models with children\nnested within schools, the unit of random assignment. W[¬e]""']",NA,
38224206,de Koning (2002),2002,['Metacognition and self-regulation'],NA,,"['Page 8:\n[¬s]""Program Inductive Reasoning 1 (De Koning & Hamers, 1995)""\n""The Program Inductive Reasoning in Reading Comprehension (De Koning & Hamers, 1996)[¬e]""']",NA,,"['Page 10:\n[¬s]""Pupils in Condition 2 were only taught with visual material in the ®rst phase in Grade 3, and pupils in the third Condition were only taught with verbal material in the second phase in Grade 4.[¬e]""', 'Page 8:\n[¬s]"" The program using visual material was a new classroom version of Klauer\'s Program Inductive Reasoning 1 (De Koning & Hamers, 1995) and was applied to the third grade. The Program Inductive Reasoning in Reading Comprehension (De Koning & Hamers, 1996) consisted of verbal material and was applied to the fourth grade. In both programs, teaching and learning were embedded in a classroom dialog in which the pupils and the teacher explicated exactly how they reasoned inductively. ""\n""The programs introduce the reasoning processes using easy-to-perceive (visual program) and easy-to-understand (verbal program) materials.""\n"" the visual material changed from building blocks to pictures of objects and to pictures of situations and abstract ®gures; the verbal material changed from short texts with everyday context to longer texts with everyday context and to longer texts with unfamiliar context (see Fig. 3).[¬e]""']",NA,,"['Page 3:\n[¬s]""extending the stimulation of the development of inductive reasoning in the preparatory phase to the third and fourth grades[¬e]""']",NA,,['School or group of schools'],NA,NA,,['Yes (Please specify)'],"['Page 16:\n[¬s]""The teachers were provided with two kinds of information. First, the objec- tives underlying the three-phase teaching method were described in general, rather than abstract, terms. Second, the teachers received a manual with de- tailed examples of the typical tasks and dialogs to be used preferably in each separate phase. In a few sessions teachers were supported to connect the two kinds of information.[¬e]""', 'Page 18:\n[¬s]""Without exception the lessons were very demanding for the teachers. First, teachers had to be assisted in bringing about a process-focused attitude while weakening their emphasis on the product of reasoning. For example, they had to be taught how to ask their pupils questions like ``Why do you think this answer is correct\'\' or ``What other correct solutions do you suggest\'\'[¬e]""']",NA,,['Students'],NA,NA,,['Large group/class teaching (+6)'],NA,NA,,['No'],NA,NA,,['No'],NA,NA,,['During regular school hours '],NA,NA,,['Class teachers'],"['Page 16:\n[¬s]""The teachers were provided with two kinds ofinformation. First, the objec-\ntives underlying the three-phase teaching method were described in general,\nrather than abstract, terms. Second, the teachers received a manual with de-\ntailed examples of the typical tasks and dialogs to be used preferably in each\nseparate phase. In a few sessions teachers were supported to connect the two\nkinds of information""\n""One observer (ﬁrst author) attended part ofthe lessons ofall teachers.\nSix other observers (graduate students) each closely monitored a few teach-\ners during most ofthe program lessons. The observers compared their obser-\nvations of particular teachers.[¬e]""']",NA,,"['Page 2:\n[¬s]""2-year[¬e]""']",33,,NA,.8,,NA, ,,['Qualitative'],"['Page 18:\n[¬s]""Without exception the lessons were very demanding for the teachers. First, teachers had to be assisted in bringing about a process-focused attitude while weakening their emphasis on the product of reasoning. For example, they had to be taught how to ask their pupils questions like ``Why do you think this answer is correct\'\' or ``What other correct solutions do you suggest\'\'[¬e]""']",NA,,['No'],NA,NA,,['The developer'],NA,NA,,No,,['Yes'],"['Page 20:\n[¬s]""TABLE 2\nMean, Standard Error, and 95% Conﬁdence Intervals of the Scores on the Test for Listening\nComprehension and the Vocabulary Test and Person Parameter Estimates on the Test for\nInductive Reasoning in the Experimental Conditions and the Control Conditions on the\nPretests, Posttests, and Follow-Up Tests in Phase 1[¬e]""']","Note  Pretests here compare additional conditions, Conditions 1+2 vs Conditions 3+4.",,['Yes'],"['Page 20:\n[¬s]""TABLE 2\nMean, Standard Error, and 95% Conﬁdence Intervals of the Scores on the Test for Listening\nComprehension and the Vocabulary Test and Person Parameter Estimates on the Test for\nInductive Reasoning in the Experimental Conditions and the Control Conditions on the\nPretests, Posttests, and Follow-Up Tests in Phase 1[¬e]""']","Note  Pretests here compare additional conditions, Conditions 1+2 vs Conditions 3+4.",,['Yes'],NA,NA,,"['Socio-economic status', 'Educational attainment', 'Other (please specify)']","['Page 11:\n[¬s]""The mean pupil\nSES weights did not differ across the conditions (F ⫽ 1.123, df⫽ 3, p ⫽\n.34).[¬e]""', 'Page 20:\n[¬s]""TABLE 2\nMean, Standard Error, and 95% Conﬁdence Intervals of the Scores on the Test for Listening\nComprehension and the Vocabulary Test and Person Parameter Estimates on the Test for\nInductive Reasoning in the Experimental Conditions and the Control Conditions on the\nPretests, Posttests, and Follow-Up Tests in Phase 1[¬e]""', 'Page 11:\n[¬s]""The mean ages did not differ across the conditions (F ⫽ .183,\ndf⫽ 3, p ⫽ .91).[¬e]""']","Age. Note  Across all four conditions, not just the two conditions (1 and 4) used for this extraction.",,['No'],NA,NA,
