38223850,Ennis (1969),1969,['Metacognition and self-regulation'],NA,,"['Page 1:\n[¬s]""Cornell Critical Thinking Readiness Project[¬e]""']",NA,,"['Page 11:\n[¬s]""Conditional logic, the kind considered in this study, is so called because the central ingredient in a conditional argument is one or more condi\xad tional statements. A conditional statement is one of the form, \'If p, then q‘, in which \'p\' and \'q\' represent statements of varying degrees of complexity.[¬e]""', 'Page 29:\n[¬s]""To our knowledge no study of the readiness of primary children to learn conditional logic has ever been done.[¬e]""', 'Page 42:\n[¬s]""Our instruction in logic was carried out using fifteen individually administered audio-tutorial programs with science content. The lessons were installed weekly in a three-sided carrel placed on a table in six of the experimental classrooms. The three classes in the urban school used a single carrel located in a learning center. Each lesson consisted of a set of materials for the child to observe and manipulate, and an audio tape recording. The recording guided the observations and manipulations, presented the logic principles, and posed questions for the child to answer by applying the logic to the situation at hand. In each case a situation was developed which illustrated a scientific principle. After the child had become familiar with the situation, the logic content which the lesson was designed to teach was introduced. Usually the child was then asked questions which required him to apply the logic to the specific situation. Following each such question the correct answer was given together with a brief explanation as to why that answer was correct. Each lesson lasted from fifteen to twenty minutes.[¬e]""']",NA,,NA,To implement a Conditional Logic intervention to determine if students from the Experimental Group learned this fundamental Critical Thinking skill. ,,['University/ researcher design'],NA,NA,,['No'],NA,NA,,['Students'],NA,NA,,['Student alone (self-administered)'],"['Page 42:\n[¬s]""Our instruction in logic was carried out using fifteen individually administered audio-tutorial programs with science content. [¬e]""']",NA,,['Yes'],NA,NA,,['No'],NA,NA,,['During regular school hours '],NA,NA,,['Digital technology'],"['Page 43:\n[¬s]"" audio-tutorial lessons[¬e]""']",NA,,NA,15 ,,"['Page 1:\n[¬s]""weekly lessons[¬e]""']",1,,"['Page 42:\n[¬s]""Each lesson lasted from fifteen to twenty minutes.[¬e]""']",18,,['No implementation details provided.'],NA,NA,,['No'],NA,NA,,['The developer'],NA,NA,,No,,['Yes'],"['Page 32:\n[¬s]""For each child the following information was obtained: a. School (urban, rural, or suburban). b. Grade level in school (1, 2, or 3). c. Chronological age. d. Sex.[¬e]""', 'Page 33:\n[¬s]""e. . I. Q. score (HISC). f. An index of socioeconomic status. g. Scores on the ""Smith-Sturgeon Conditional Reasoning Test"".[¬e]""']",NA,,['Yes'],"['Page 67:\n[¬s]""*I.Q., SEI, and age are covariates[¬e]""', 'Page 86:\n[¬s]""♦Covariates: I.Q. and SEI.[¬e]""', 'Page 92:\n[¬s]""*Covariates: I.O., SEI, and Age.[¬e]""', 'Page 94:\n[¬s]""*Covariates: I.Q. and SEI.[¬e]""']",NA,,['Yes'],NA,NA,,"['Gender', 'Other (please specify)', 'Educational attainment', 'Socio-economic status']","['Page 35:\n[¬s]""NUMBERS OF BOYS AND OF GIRLS IN EACH GROUP[¬e]""', 'Page 34:\n[¬s]""MEAN CHRONOLOGICAL AGES (IN MONTHS)[¬e]""', 'Page 36:\n[¬s]""MEAN SCORES ON WECHSLER INTELLIGENCE SCALE FOR CHILDREN[¬e]""', 'Page 39:\n[¬s]""MEAN SOCIOECONOMIC INDICES[¬e]""']",NA,,['No'],NA,NA,
55203434,Ford (2009),2009,NA,NA,,"['Page 1:\n[¬s]""Parent-delivered compensatory education for\nchildren at risk of educational failure[¬e]""', 'Page 5:\n[¬s]""Let’s Play in Tandem[¬e]""']",NA,,"['Page 1:\n[¬s]""scaffolded educational\nactivities delivered at home by their mothers[¬e]""', 'Page 5:\n[¬s]""third birthday and continued for 12 months. During this time, they participated in\neducational activities in partnership with their mothers that were intended to develop\npre-reading skills (e.g., phonological awareness, perceptual discrimination), basic\nnumerical skills (e.g., understanding of size and quantity, counting to 10), and general\nknowledge.""\n""All activities took the form of enjoyable games that were designed to elicit\nsustained one-on-one verbal interactions, a joint focus of attention, and scaffolding\nof the children’s learning. In accordance with the deﬁnition of scaffolding provided\nby Wood, Bruner, and Ross (1976), mothers’ role in such activities was therefore to\nprovide children with prompts, demonstrations, instructions, and encouragement to\ncomplete the tasks.[¬e]""']",NA,,"['Page 5:\n[¬s]""developing\nparticipants’ school readiness[¬e]""']",NA,,['University/ researcher design'],NA,NA,,['Unclear/ Not specified'],NA,NA,,"['Students', 'Parents']",NA,NA,,['One to one'],NA,NA,,['No'],NA,NA,,['No'],NA,NA,,['During regular school hours '],NA,NA,,NA,NA,NA,,"['Page 7:\n[¬s]""12-month[¬e]""']",38,,"['Page 8:\n[¬s]""families being requested to engage in each of the activities at least once and preferably more often""\n""Each week, they received a pack containing three activities[¬e]""']",3,,"['Page 8:\n[¬s]""20 min[¬e]""']",20,,['Qualitative'],"['Page 8:\n[¬s]""The project workers visited each\nfamily once a week, for between 90 and 120 min, to deliver and demonstrate new\nactivities and to answer questions.""\n""we made concerted efforts to bolster parents’\nmotivation for the programme with regular newsletters and invitations to participate in\nSure Start social events, as well by asking them to record their experiences with the\nactivities in a diary.[¬e]""']",NA,,['No'],NA,NA,,['The developer'],NA,NA,,No,,['Yes'],"['Page 10:\n[¬s]""These analyses revealed no reliable group difference in developmental age\n(in months) in any ofthe domains, manipulative skills: intervention M ¼ 35:4, SD ¼ 5:3,\ncontrol M ¼ 35:2, SD ¼ 6:0, t ¼ 0:14; hearing and language skills: intervention\nM ¼ 33:4, SD ¼ 5:8, control M ¼ 33:6, SD ¼ 5:1, t ¼ 20:14; speech and language\nskills: intervention M ¼ 33:4, SD ¼ 5:6, control M ¼ 34:4, SD ¼ 4:1, t ¼ 20:79;\nself-care skills: intervention M ¼ 35:0, SD ¼ 4:7, control M ¼ 34:8, SD ¼ 5:3, t ¼ 0:15\n(all p values . :05, two-tail).[¬e]""']",NA,,['Yes'],"['Page 13:\n[¬s]""entry-level academic skills""\n""(Step 1),[¬e]""']",NA,,['Yes'],"['Page 13:\n[¬s]""entry-level academic skills[¬e]""']",NA,,['Educational attainment'],NA,NA,,['No'],NA,NA,
38224214,Hamers (1998) 1_1,1998,['Metacognition and self-regulation'],NA,,"['Page 2:\n[¬s]"" `Denktraining fu È r Kinder 1\' (Cognitive training for children).[¬e]""']",NA,,"['Page 4:\n[¬s]""The programme consists of 120 tasks (problem plates). Each class of tasks consists of 20 plates. Each plate presents the student with a problem which can be solved by application of inductive reasoning processes (Fig. 2 exhibits examples of problem plates). The tasks are divided across 20 lessons, and six tasks are dealt with in each lesson. There are two lessons per week, and each lesson lasts 45 minutes""\n""The steps can be performed by two procedures. The ®rst procedure (see Fig. 3) is characterized by systematic and analytic searching and comparison of attributes or relations.""\n""Instruction of this inductive reasoning pro-[¬e]""', 'Page 5:\n[¬s]""cess is realized by means of a `direct teaching\' method (Van Parreren, 1981), known as `guided discovery\'""\n""Teaching both procedures consists of three phases. The introductory phase uses simple tasks to give students an impression of the tasks and the way to solve them. This phase precedes both the direct and the indirect teaching methods. In the second phase (see Fig. 3 and 4), instruction and task charac- teristics according to the two procedures are given. In the `re¯ection\' part of the second phase, the properties of general abstract concepts such as attri-[¬e]""', 'Page 6:\n[¬s]""butes and relations are dealt with. The application phase follows after both procedures and deals with transfer to induction tasks in realistic situations and in school material. Students are trained to differentiate between the vari- ous classes of tasks in different situations. [¬e]""', 'Page 7:\n[¬s]""The lessons are conducted in dialogue form with the whole group. The students sit in a semicircle so that they have a good view of each other, of the teacher and of the problem plate which is shown in front of the class.[¬e]""']",NA,,"['Page 3:\n[¬s]""Inductive Reasoning 1 (De Koning & Hamers, 1995) was used here with children identi®ed as `at risk\' (children with low social-economic-status backgrounds) in the remedial and compensating sense. The programme can be characterized as an `across-the-curriculum\' programme because it stimu- lates the general thinking processes of inductive reasoning and problem solv- ing[¬e]""']",NA,,['University/ researcher design'],NA,NA,,['Unclear/ Not specified'],NA,NA,,['Students'],NA,NA,,['Large group/class teaching (+6)'],NA,NA,,['No'],NA,NA,,['No'],NA,NA,,['During regular school hours '],NA,NA,,['Class teachers'],NA,NA,,"['Page 8:\n[¬s]"" The interval between pretests and post- tests was 10 weeks (period in which lessons were followed),[¬e]""']",10 ,,"['Page 4:\n[¬s]""There are two lessons per week,[¬e]""']",2,,"['Page 4:\n[¬s]""each lesson lasts 45 minutes.[¬e]""']",45,,['Qualitative'],NA,NA,,['No'],NA,NA,,['The developer'],NA,NA,,No,,['Yes'],"['Page 11:\n[¬s]""TABLE 1""\n""Pretest[¬e]""']",NA,,['Yes'],"['Page 8:\n[¬s]""There were no signi®cant age differences between the three groups.[¬e]""']",NA,,['Yes'],NA,NA,,['Other (please specify)'],"['Page 8:\n[¬s]""experimental group 1""\n""mean age 84.0""\n"" control group""\n""mean age 85.6 months[¬e]""']",age,,['No'],NA,NA,
38224059,Kernaghan (1995),1995,['Metacognition and self-regulation'],NA,,"['Page 3:\n[¬s]"" multiple strategy instruction with metacognitive information[¬e]""']",NA,,"['Page 4:\n[¬s]""In addition to strategic instruction, students in the explicit training condition with metacognitive information also participated in teacher-led discussions about spelling. Specifically, students talked about the importance of good spelling as it related to educational attainment, literacy, and their everyday lives. These students also dis- cussed the importance of spelling strategies and were provided with \x91when\x92, \x91where\x92, and \x91how\x92 information about each of the instructional strategies. Briefly, students were told that they should use their spelling strategies whenever they needed to spell an unfamiliar word, regardless of whether they were inside or outside the classroom. They were also instructed to use the strategies alone or in combination. For example, they were told to use the analogy strategy if they knew the spelling of a word that rhymed with the unknown one. Imagery was explained to be an effective strategy for recalling the spelling of a known word and one that would help prevent them from forgetting a new spelling, with students encouraged to use imagery after using either analogy of phonology. Phonology was explained to be an effective strategy when students could identify some of the letter patterns in an unknown word. Students were also encouraged to use phonology as a second step when spelling by analogy (i.e. use phonology to spell the remaining portion of a word not accounted for by the rhyming principle). This information was reiterated by the instructor when she modelled each strategy. The provision of this information did not require additional study time, but was carried out while the other students practised using spelling strategies or completing language arts activities.[¬e]""']",NA,,"['Page 2:\n[¬s]"" Because a repertoire of effective spelling strategies was taught in this study, it was anticipated that providing first-grade students with explicit instruction about multiple strategies, which included metacognitive information about when and where to use each strategy, would improve spelling relative to providing strategy instruction or traditional language arts activities[¬e]""']",NA,,['University/ researcher design'],NA,NA,,['No'],NA,NA,,['Students'],NA,NA,,['Small group/intensive support (3-5)'],NA,NA,,['No'],NA,NA,,['No'],NA,NA,,['During regular school hours '],NA,NA,,['Research staff'],NA,NA,,"['Page 3:\n[¬s]"" over a 4-week interval.[¬e]""']",4,,"['Page 3:\n[¬s]""Students met once a week[¬e]""']",1,,"['Page 3:\n[¬s]"" for 25 minutes.[¬e]""']",25,,['Qualitative'],NA,NA,,['No'],NA,NA,,['The developer'],NA,NA,,No,,['Yes'],"['Page 6:\n[¬s]""Table 1.""\n""Pretest[¬e]""']",NA,,['Yes'],"['Page 5:\n[¬s]""For the dictated spelling and\nthe developmental spelling tests, a 3 (condition) by 3 (time) ANOVA with repeated\nmeasurement on the last variable was carried out. For the writing sample, a 3 (con-\ndition) by 2 (time) split plot ANOVA was carried out.[¬e]""']",NA,,['No'],NA,NA,,NA,NA,NA,,['No'],NA,NA,
38224234,Klauer (1992),1992,['Metacognition and self-regulation'],NA,,"['Page 2:\n[¬s]""a program for fostering inductive thinking,[¬e]""']",NA,,"['Page 12:\n[¬s]""All of these tasks can be solved in a very similar way by looking for the relationship between corresponding pairs. The tasks provide enough information for inducing the relationship. Therefore, it seems justified to assume strong transfer of training from one task to the other. This is obviously not the case, at least not under normal conditions. Children \x97 and even adults - do not spontaneously recognize the same basic structure underlying these different kinds of tasks. This is particularly true if the tasks use elements from different content domains as, for instance, flowers or human beings or animals or prices or geometrical figures or numbers, etc. A training program has to take these problems into account. Consequently it is necessary \x97 to teach the basic structure, the paradigm, in such a way that children can understand it; - to teach how such a structure is to be solved; - to teach recognizing the basic structure under different conditions, in various disguises; \x97 to teach how the solving procedure can be adapted to different content domains. This is done for every one of the paradigms dealt with when teaching for inductive thinking. The different paradigms which are to be taught make it necessary to look for an adequate allotment of space to the different paradigms and an adequate number and distribution of repetitions within each of the paradigms. [¬e]""']",NA,,"['Page 2:\n[¬s]""In one condition the children were trained using a program for fostering inductive thinking, whereas the children in the other condition continued their normal kindergarten activities. Based upon a new theory of inductive reasoning, the training was expected to have a positive effect on intelligence test performance.[¬e]""']",NA,,['University/ researcher design'],NA,NA,,['No'],NA,NA,,['Students'],NA,NA,,['One to one'],NA,NA,,['No'],NA,NA,,['No'],NA,NA,,['During regular school hours '],NA,NA,,['Research staff'],NA,NA,,"['Page 13:\n[¬s]""daily training session of 15 to 20 minutes continuing for about 15 sessions.[¬e]""']",3 ,,"['Page 13:\n[¬s]""daily training session[¬e]""']",5,,"['Page 13:\n[¬s]""15 to 20 minutes[¬e]""']",18,,['No implementation details provided.'],NA,NA,,['No'],NA,NA,,['The developer'],NA,NA,,No,,['Yes'],"['Page 14:\n[¬s]""Table 4.""\n""Pretest[¬e]""']",NA,,['No'],NA,NA,,['Yes'],NA,NA,,['Other (please specify)'],"['Page 13:\n[¬s]""The mean IQs\nof both groups were fairly high, indicating that highly intelligent children had been\nfound.[¬e]""']",IQ,,['No'],NA,NA,
38224233,Klauer (1996) 1_1,1996,['Metacognition and self-regulation'],NA,,"['Page 1:\n[¬s]"" INDUCTIVE REASONING:[¬e]""']",NA,,"['Page 4:\n[¬s]""A training program has been developed and empirically tested that is suited for paradigmatic teaching of inductive reasoning to 5-8-year-old children [¬e]""']",NA,,"['Page 1:\n[¬s]"" hypothesized that a training of an inductive strategy should (a) enhance performance with tests measuring fluid intelligence, (b) sup- port learning of school-relevant declarative knowledge, and (c) improve solving of complex and dynamic problems.[¬e]""', 'Page 6:\n[¬s]"" the hypothesis was that the paradigmatic group would outperform the alternatively trained group [¬e]""']",NA,,['University/ researcher design'],NA,NA,,['Unclear/ Not specified'],NA,NA,,['Students'],NA,NA,,['Small group/intensive support (3-5)'],NA,NA,,['No'],NA,NA,,['No'],NA,NA,,['During regular school hours '],NA,NA,,['Unclear/not specified'],NA,NA,,"['Page 5:\n[¬s]"" 4 weeks o[¬e]""']",4,,"['Page 5:\n[¬s]"" 10 sessions of training split up into two or three sessions per week.[¬e]""']",2.5 ,,"['Page 5:\n[¬s]"" a paradigmatic session took about 25 min and a session of the alternatively trained group about 10 min.[¬e]""']",35,,['No implementation details provided.'],NA,NA,,['No'],NA,NA,,['The developer'],NA,NA,,No,,['Yes'],"['Page 6:\n[¬s]""Pre-test""\n""Table 2[¬e]""']",NA,,['Yes'],"['Page 6:\n[¬s]""Using the CFT pre-test as covariate and the post-test as dependent variable, an analysis of\ncovariance has been calculated.[¬e]""']",NA,,['Yes'],NA,NA,,['Educational attainment'],"['Page 6:\n[¬s]""Table 2""\n""Pre-test[¬e]""']",NA,,['No'],NA,NA,
38224235,Klauer (2002),2002,['Metacognition and self-regulation'],NA,,"['Page 20:\n[¬s]"" inductive reasoning training[¬e]""']",NA,,"['Page 8:\n[¬s]""The training was based on the program published by Klauer and Phye (1994). Basic cogni- tive and metacognitive objectives of the program are to teach the children to recognize an inductive problem, to differentiate between the types of problems (not necessarily by labeling them), to apply the adequate solution procedure to the type of problem, and ®nally to check one\'s own solution. Particular emphasis was put on teaching for transfer such that the children should become able to apply the cognitive and metacognitive strategies on any inductive prob- lem whenever they met one. The project started at the beginning of the second half of the school year. In all schools, one class received training and the other class continued with regular classroom activities. The training lasted 5 weeks. In each of the weeks, every child participated in 2 training sessions of maximally 45 min so that 10 training lessons were administered to each child. The training sessions took place in small groups of about three to ®ve children. It was administered in a separate room so that the children had to leave their classroom in order to participate in the training.[¬e]""']",NA,,"['Page 8:\n[¬s]""Basic cogni- tive and metacognitive objectives of the program are to teach the children to recognize an inductive problem, to differentiate between the types of problems (not necessarily by labeling them), to apply the adequate solution procedure to the type of problem, and ®nally to check one\'s own solution. Particular emphasis was put on teaching for transfer such that the children should become able to apply the cognitive and metacognitive strategies on any inductive prob- lem whenever they met one.[¬e]""']",NA,,['University/ researcher design'],NA,NA,,['No'],NA,NA,,['Students'],NA,NA,,['Small group/intensive support (3-5)'],NA,NA,,['No'],NA,NA,,['No'],NA,NA,,['During regular school hours '],NA,NA,,['Research staff'],NA,NA,,"['Page 8:\n[¬s]""The training lasted 5 weeks.[¬e]""']",5,,"['Page 8:\n[¬s]""In each of the weeks, every child participated in 2 training sessions of maximally 45 min so that 10 training lessons were administered to each child[¬e]""']",2,,"['Page 8:\n[¬s]"" maximally 45 min[¬e]""']",45,,['No implementation details provided.'],NA,NA,,['No'],NA,NA,,['The developer'],NA,NA,,No,,['Yes'],"['Page 9:\n[¬s]""TABLE 2""\n""Pretest""\n""Pretest[¬e]""']",NA,,['Yes'],"['Page 9:\n[¬s]""Analyses of covariance were performed using the posttest values as the dependent variable, the pretest values as a covariate,[¬e]""']",NA,,['No'],NA,NA,,NA,NA,NA,,['No'],NA,NA,
40294945,Peskin (2004) MSR,2004,['Metacognition and self-regulation'],NA,,"['Page 5:\n[¬s]"" exposure to explicit metacognitive terms in story texts[¬e]""']",NA,,"['Page 1:\n[¬s]"" Over a 4-week period, parents, teachers and graduate assistants read about 70 picture books to each participant (N = 48, mean age 4;6). The experimental group received books with text rich in explicit metacognitive terms. The control group received the same books with no metacognitive language but with most stories and accompanying illustrations implicitly requiring children to think about alternative perspectives.[¬e]""', 'Page 6:\n[¬s]"". The intervention was kept very short in order to avoid the natural development of a theory of mind, which would be expected by the time many of these low SES children were 5 years old. It was, however, intense involving (1) the teacher reading two of the books to the whole class three times a week (2) a graduate assistant withdrawing participants in small groups of three from the classroom and reading three of the books to them on the remaining 2 days a week; and (3) parents reading the books at home to each child individually.[¬e]""']",NA,,"['Page 1:\n[¬s]""This study investigated whether exposing Kindergarten children to metacognitive language results in a greater conceptual understanding of mental states, and increased production and comprehension of metacognitive vocabulary.[¬e]""']",NA,,['University/ researcher design'],NA,NA,,['Unclear/ Not specified'],NA,NA,,['Students'],NA,NA,,['Large group/class teaching (+6)'],NA,NA,,['No'],NA,NA,,['Yes'],NA,NA,,"['During regular school hours ', 'Evenings and/or weekends']","['Page 6:\n[¬s]""(1) the teacher reading two of the books to the whole class three times a week (2) a graduate assistant withdrawing participants in small groups of three from the classroom and reading three of the books to them on the remaining 2 days a week;[¬e]""', 'Page 6:\n[¬s]"" (3) parents reading the books at home to each child individually.[¬e]""']",NA,,"['Class teachers', 'Research staff', 'Parents/carers']","['Page 6:\n[¬s]"" (1) the teacher reading two of the books to the whole class three times a week[¬e]""', 'Page 6:\n[¬s]"" (2) a graduate assistant withdrawing participants in small groups of three from the classroom and reading three of the books to them on the remaining 2 days a week;[¬e]""', 'Page 6:\n[¬s]""(3) parents reading the books at home to each child individually.[¬e]""']",NA,,"['Page 6:\n[¬s]""Between the pre- and the post-test there was a 4-week intervention. [¬e]""']",4,,"['Page 6:\n[¬s]"" (1) the teacher reading two of the books to the whole class three times a week (2) a graduate assistant""\n"" reading three of the books to them on the remaining 2 days a week;[¬e]""', 'Page 7:\n[¬s]"" parents had agreed to read to their child between four and six times a week in order to be part of the study. Almost all the families complied, with the readings fairly evenly spaced over the 4 weeks, and some read to their children so often that they ran out of the stickers and used their own stickers or checkmarks.[¬e]""']",3,,NA,NA,,['No implementation details provided.'],NA,NA,,['No'],NA,NA,,['The developer'],NA,NA,,No,,['Yes'],"['Page 11:\n[¬s]""Table 1 Means and standard deviations for all variables by group[¬e]""']",NA,,['Yes'],"['Page 10:\n[¬s]"" There was no signi\x1ecant difference between the experimental and control groups in age or on any of the pre-test measure[¬e]""']",NA,,['No'],NA,NA,,NA,NA,NA,,['No'],NA,NA,
38224188,Riding (1987),1987,['Metacognition and self-regulation'],NA,,"['Page 5:\n[¬s]"" \'Get Ready to Think\'[¬e]""']",NA,,"['Page 5:\n[¬s]""(4) Critical thinking activities. The critical thinking tasks used were problem solving activities of the package \'Get Ready to Think\' (Riding & Powell, 1987) which contained 32 activities each of which provided 10 trials each of which was unique. The activities were presented on a Commodore 64 computer with a 14"" colour monitor. The activities are summarised in Appendix 1.""\n""Each child in the treatment groups were allowed to progress through the 32 activities of \'Get Ready to Think\' at his or her own pace. Instruction and encouragement were given whenever a child was unable to proceed or was consistently answering inaccurately.[¬e]""']",NA,,"['Page 2:\n[¬s]""he present paper considered the possibility of improving critical thinking in young children and of the effect of this on attainment in the basic subjects of reading and number.[¬e]""']",NA,,['University/ researcher design'],NA,NA,,['No'],NA,NA,,['Students'],NA,NA,,['Student alone (self-administered)'],NA,NA,,['Yes'],NA,NA,,['No'],NA,NA,,['During regular school hours '],NA,NA,,['Digital technology'],NA,NA,,"['Page 5:\n[¬s]"" Over a period of 13 weeks[¬e]""']",13,,NA,NA,,NA,NA,,['No implementation details provided.'],NA,NA,,['No'],NA,NA,,['The developer'],NA,NA,,No,,['Yes'],"['Page 6:\n[¬s]""TABLE I. Mean Raven\'s Matrices scores for high and low initial attainment[¬e]""']",NA,,['Yes'],"['Page 5:\n[¬s]""The 64 children were then randomly divided, within sexes, into two groups and the resulting four groups of sixteen subjects were similar in terms of mean age, score on Raven\'s Matrices, score on the Mathematics Test, and score on the Reading Scheme; they were also balanced in terms of membership of class within the school. [¬e]""']",NA,,['No'],NA,NA,,NA,NA,NA,,['No'],NA,NA,
