ID,toolkit_strand,short_title,main_authors,year,main_title,parent_title,parent_authors,type_name,abstract,volume,issue,pages,doi,url,publisher,city,institution
42025476,['Parental engagement'],Kraft (2001),Kraft Benjamin Lignugaris  Findlay Penny   Major Julie   Gilberts Guy   Hofmeister Alan   ,2001,The Association between a Home Reading Program and Young Children's Early Reading Skill,Journal of Direct Instruction,NA,"Journal, Article","The purpose of this study was to examine the effects of teaching parents to deliver a carefully sequenced reading program to their kindergarten children who were not receiving formal reading instruction in school. Forty-five children and their parents enrolled in a kindergarten in a university-sponsored primary school participated in the research. Approximately twice as many children who participated in the home reading program scored in the top quartile of the Woodcock Reading Mastery (WRMT-R) word identification and word attack subtests as might be expected based on the test norms, while the children in the control group approximated the expected norms. On curriculum-based measures, the average score of children in the home reading group was higher than 87% of the children in the control group. Finally, a multiple regression analysis revealed that a significant proportion of the variance in children’s posttest performance was associated with their pretest scores on the WRMT-R letter identification subtest scores, their knowledge of the phonemes introduced in the curriculum and the consistency with which their parents implemented the home reading program. The results are discussed relative to previous research in which teachers implemented the curriculum and the issues associated with utilizing parents as primary beginning reading teachers. In addition, limitations of this research and suggestions for future research are provided.",1,2,117-36,NA,https //search.proquest.com/docview/62283474,NA,NA,NA
42025477,['Parental engagement'],Leach (1990),Leach D J  Siddall S W  ,1990,"Parental involvement in the teaching of reading  a comparison of hearing reading, paired reading, pause, prompt, praise, and direct instruction methods",British Journal of Educational Psychology,NA,"Journal, Article","The parents of 40 children in two grade 1 classrooms were randomly assigned to receive brief training in one of four instructional methods for helping their child to read or to hear their children read at home. The tutoring methods were Hearing Reading , Paired Reading , Pause , Prompt , Praise , and Direct Instruction . The results showed that the use of the additional instructional strategies included in the Direct Instruction and Paired Reading tutoring methods led to faster progress by the children receiving them than by children whose parents simply heard them read. Some theoretical and practical implications of the study are discussed.",60,3,349-355,https //doi.org/10.1111/j.2044-8279.1990.tb00951.x,NA,NA,NA,NA
42025499,['Parental engagement'],Lonigan (1998),Lonigan Christopher J  Whitehurst Grover J  ,1998,Relative efficacy of parent and teacher involvement in a shared-reading intervention for preschool children from low-income backgrounds,Early Childhood Research Quarterly,NA,"Journal, Article","The effects of an interactive shared-reading intervention were evaluated with 3-to 4-year-old children from low-income families who attended subsidized child care. The children entered the program with oral language skills that were significantly below age-level as measured by standardized tests. Children were pretested and randomly assigned to 1 of 4 conditions  (a) no treatment control, (b) a school condition in which children were read to by their teachers in small groups, (c) a home condition in which children were read to by their parents, and (d) a combined school plus home condition. Parents and teachers were trained in a specific form of interactive reading via an instructional videotape. The intervention was conducted for 6 weeks, after which children were posttested on standardized measures of oral language, and language samples were obtained during a shared-reading assessment. Significant effects of the reading intervention were obtained at posttest and were largest for children in conditions involving home reading.",13,2,263-290,https //doi.org/10.1016/S0885-2006(99)80038-6,http //www.sciencedirect.com/science/article/pii/S0885200699800386,NA,NA,NA
38296639,['Parental engagement'],Lord (2018),Lord Pippa   Styles Ben   Morrison Jo   White Richard   Andrade Joana   Bamford Susie   Lushey Clare   Lucas Megan   Smith Robert   ,2018,Families and Schools Together (FAST)  Evaluation report and executive summary,NA,NA,Report,"Families and Schools Together (FAST) is a parental engagement programme which aims to support parenting and enhance links between families, school and the community. Groups of parents and their children (usually around 5–8 families in each group) attend eight weekly 2.5-hour group sessions after school, delivered by trained local partners. Families then continue to meet on a more informal basis for up to 22 months, a period known as FASTworks. Sessions are designed to encourage good home routines around mealtimes, bedtimes and homework with the intention that this will improve the behaviour of the attending pupils, freeing up the teacher to focus on learning to the benefit of the whole class. Save the Children U.K. (SCUK) delivers FAST in U.K. primary schools. This school-level randomised controlled trial focused on pupils in Year 1 and measured the impact of FAST for the whole year group on Key Stage 1 (KS1) attainment, as well as on children’s behavioural and prosocial outcomes measured using Goodman’s (1997) Strengths and Difficulties Questionnaire (SDQ). One hundred and fifty eight schools took part in the trial with a total of 7,207 Year 1 pupils involved at the start of the trial  and 632 Year 1 pupils taking part in the eight-week programme. A process evaluation explored the views of school leaders, school FAST co-ordinators, teachers, pupils, parents, and FAST partners through case studies and telephone interviews. The trial ran between April 2015 and September 2017.",NA,November,NA,NA,https //educationendowmentfoundation.org.uk/projects-and-evaluation/projects/families-and-schools-together-fast,NA,London,NA
42024838,['Parental engagement'],McCormick (1986),McCormick C   Mason J M  ,1986,Intervention procedures for increasing preschool children's interest in and knowledge about reading.,Emergent literacy,Sulzby W H. Teale  E    ,"Book, Chapter","A study examined the effects of preschool reading intervention procedures on the knowledge about reading (reading readiness) of the subjects as they entered kindergarten. One such intervention, carried out for two consecutive years, involved giving low and middle income parents packets of several small, easy-to-read books and guidelines for using them with their children when the parents brought their children for preschool screening provided by the school districts in the spring. Children in the first wave (year one) of the study received two additional packets of books by mail during the summer, and children in the second wave (year two) received only the packet at the screening. Children who came to kindergarten the following fall were then tested, and the results were compared with those of control classmates who had received no materials. The first year students were tested at the beginning and end of the year. Year 2 students were tested only in November. A three-variable model (gender, picture vocabulary test score, and treatment type) was used to predict end-of-kindergarten scores on knowledge of words, letters, spelling, and story. Analyses of the reading knowledge of the first year students indicated reliable and longlasting effects of the treatment. The treatment affected not only story reading but also word reading and spelling. Year 2 students showed a smaller instructional effect when compared with control students. Children's story reading was affected by the treatment, but not word reading or spelling. The diminished effect could be explained by either the earlier posttesting date or the provision of fewer materials.",NA,NA,90-115,NA,https //eric.ed.gov/?id=ED244222,Norwood,NJ  Ablex,NA
42025500,['Parental engagement'],McElvany (2009),McElvany Nele   Artelt Cordula   ,2009,"Systematic reading training in the family  Development, implementation, and initial evaluation of the Berlin Parent–Child Reading Program",Learning and Instruction,NA,"Journal, Article","Drawing on knowledge about the development of reading comprehension, and empirical insights into the effects of training on students' learning strategies and reading-related metacognition, we developed a parent–child reading program for implementation in the home environment. The results of this first quasi-experimental evaluation study indicate that it is generally possible to implement a program of this kind within the family setting, but that participation is low and selective based on family background and children's achievement level. Nevertheless, participation in the program was found to have substantial effects on the development of vocabulary and on reading-related metacognition, indicating that family-based reading programs have considerable potential. The issues of selective participation and the lack of a program effect on text comprehension are discussed, and prospects for future research on systematic reading training in the family context are considered.",19,1,79-95,https //doi.org/10.1016/j.learninstruc.2008.02.002,http //www.sciencedirect.com/science/article/pii/S0959475208000212,NA,NA,NA
42025441,['Parental engagement'],McGrath (1992),McGrath J B  ,1992,Student and parental homework practices and the effect of English homework on student test scores,Dissertation Abstracts International,NA,Dissertation,"THE PROBLEM  This study determined whether students who did English homework over an eleven-day period achieved higher scores on an English literature test than did students who did not do English homework over the same period of time. Moreover, the study assessed whether parental supervision of English homework influenced both students' grade point averages in English and students' scores on an English literature test. Finally, the study examined student and parental attitudes and practices with English homework. METHOD  Participants in this study included 94 senior (grade 1 2 ) English students and their parents. The data collected consisted of the scores on the English test and student and parental questionnaires. Students'^ tests were applied to test three hypotheses. RESULTS  Findings indicated that students who did English homework performed significantly better than did students who did not do English homework. This suggests that doing English homework will improve student performance on literature tests. However, there was no significant difference between the cumulative twelfth-grade grade point averages in English of students who did and students who did not receive parental supervision of their English homework, and no significant difference between scores on an English litera­ ture test of students who received parental supervision and students who did not.",53,NA,3490,NA,https //search.proquest.com/docview/304033702,NA,NA,NA
42025150,['Parental engagement'],McKinney (1975),McKinney J A  ,1975,The development and implementation of a tutorial program for parents to improve the reading and mathematics achievement of their children.,NA,NA,Report,"The purpose of the particum described in this paper was to teach parents tutoring skills so that they could help raise their children's academic achievement in reading and mathematics. The pupils and parents in the project represented a tri-ethnic population of blacks, whites, and Spanish surnamed. The practicum consisted of training 50 parents in reading and mathematics, two hours a week for 15 weeks, to tutor their children at home. The children of these parents were the experimental group. A group of 50 pupils whose parents were not trained in the tutoring sessions were used as the control group. Relevant data gathered during the study tends to support the two major hypotheses that, given the training program for parents, the students in the experimental group would show a significant increase in achievement over the students in the control group and the parents in the experimental group would evidence a more positive attitude toward the school. Both hypotheses were accepted with significance at the .001 level.",NA,NA,NA,NA,https //eric.ed.gov/?id=ED113703,NA,NA,NA
42024898,['Parental engagement'],McQueen (1988),McQueen A B  Washington V   ,1988,"Effect of Intervention on the Language Facility of Poor, Black Adolescent Mothers and their Preschool Children",Early Child Development and Care,NA,"Journal, Article","This study investigates the effects of varying degrees of mother-child language stimulation activities on the test performance of poor Black children and their adolescent mothers. The sample consisted of 60 mothers paired with their three or four year old children who attended full day preschool. The families were randomly assigned to one of three groups for a twelve week period. The tests used in the study were the Peabody Picture Vocabulary Test  the Cultural Language Test—Mean Length of Utterance  the Cultural Language Test—Standard English  and the Conversation—Mean Length of Utterance Measure. Three major findings result from the study  1. The children of mothers provided with intensive training and practice (Group 1) scored significantly higher on all four tests than did the children whose mothers received minimal help (Group 2) or children whose mothers received no help at all (Group 3). 2. Group 2 children did not score any higher than did Group 3. 3. Group 1 mothers scored significantly higher on all measures. © 1988 Gordon and Breach Science Publishers, Inc.",33,1-4,137-152,https //doi.org/10.1080/0300443880330111,NA,NA,NA,NA
42025519,['Parental engagement'],Mehran (1988),Mehran Maryam   White Karl R  ,1988,Parent Tutoring as a Supplement to Compensatory Education for First-Grade Children,Remedial and Special Education (RASE),NA,"Journal, Article","Children identified for Chapter I compensatory education programs were randomly assigned to an experimental program in which mothers were trained in structured tutoring techniques or to a control group. Children assessed on two standardized reading tests showed statistically significant differences after 6 months, but these differences later disappeared. When analyses were limited to those pairs of children in which the parent of the experimental group child had participated more completely in the tutoring program, there were both immediate and long-term statistically significant differences between the groups. It is concluded that parent tutoring programs can be an effective supplement to compensatory education programs but a substantial number of parents do not participate in such programs. The failure to account for degree of participation in previous research on parent involvement may account for the contradictory findings often reported.",9,3,35-41,https //doi.org/10.1177/074193258800900307,NA,NA,NA,NA
42025151,['Parental engagement'],Meteyer (1998),Meteyer B V  ,1998,The effects of a manual-based parent training program on parents perceptions of homework problems on mathematics homework and on mathematics achievement.,NA,NA,Dissertation,"Most research concludes that parent involvement is beneficial to academic achievement. However, it is unclear whether training parents to assist their children succeed in school is an effective form of intervention. This study examined the effects of a manual-based parent training program on parent perception of homework problems, on the percentage of mathematics homework assignments turned in by students, and on mathematics achievement were examined. Participants included 52 fourth and fifth grade students. Students were randomly assigned to a treatment group or to a control group. Parent perceptions of homework problems were assessed using the Homework Problem Checklist. Achievement was assessed via teacher assigned mathematics grades and curriculum based mathematics probes. Outcome measures were collected at three intervals  pretest, posttest, follow-up over an 18 week period. Data analysis revealed that all subjects showed significant improvement on the percentage of homework turned in, on teacher assigned grades, and on curriculum based mathematics probes over the three time periods of the study. The only significant difference between the treatment group and the control group was found on Homework Problem Checklist scores. Homework problems for the treatment group significantly decreased when compared to control group scores.",NA,NA,NA,NA,https //search.proquest.com/docview/304411168,NA,NA,Alfred University
42025479,['Parental engagement'],Miller (1986),Miller Andrew   Robson D   Bushell R   ,1986,Parental Participation in Paired Reading  A Controlled Study,Educational Psychology,NA,"Journal, Article","A double-blind controlled study of the effects of Paired Reading was carried out with 33 failing readers and their parents. The children were aged 8 to 11 and had reading delays of at least 18 months. After a mean time of 7.6 hours of Paired Reading at home, spread over six weeks, the children made gains of 2.43 months for reading accuracy and 4.36 months for reading comprehension compared with a control group which experienced respective gains of 0.81 months and 1.69 months. The differences were statistically significant for accuracy but not for comprehension. The conclusions of previous Paired Reading studies are discussed in the light of these results and suggestions are made for the evaluation of future, similar projects.",6,3,277-84,https //doi.org/10.1080/0144341860060305,NA,NA,NA,NA
42025520,['Parental engagement'],Miller (1996),Miller B V  Kratochwill T R  ,1996,An evaluation of the paired reading program using competency-based training,School Psychology International,NA,"Journal, Article","The purpose of this study was to evaluate the effectiveness of the Paired Reading (PR) method using a competency-based training program with parents of children who are poor readers. PR consists of two phases  simultaneous and independent reading. The PR method focuses on parent modeling, practice, praise and a positive atmosphere. Fifty-two parents of second and third graders receiving Chapter 1 services and fourth graders who received Chapter 1 services in the year prior were recruited for this study. Participants were assigned to either the experimental (PR) condition where they were trained to use the PR Program through a competency-based training format or to a wait-list control condition. Twenty-four of the 26 parents in the PR condition participated in the training. Parents were asked to read with their child using the PR method five times a week, for 10 to 15 minutes, across eight weeks and to tape record their reading sessions. Seven of those 24 parents returned all eight audio recordings of the reading sessions. Eight participants returned no tapes and 9 subjects returned between one and seven tapes. Overall reading improvement based on reading accuracy, rate and comprehension was assessed in the children, using difference scores obtained on the Paragraph Reading subtest of the Gray Oral Reading Test-Diagnostic. Child and parent perceptions of the child's reading skills and reading habits were also assessed. Comparisons were made between participants in the trained PR and untrained control conditions. Significant attrition effected the analysis of the data and an intent-to-treat-analysis was conducted. Children in the PR condition did not improve more than children in the control condition on overall reading scores. The small subset of children who completed the program did, however, improve more in their overall reading scores than their matched controls. A post-hoc analysis indicated that second and third graders who were receiving Chapter 1 services in school improved significantly in their overall reading scores and that the fourth graders, who no longer were eligible for Chapter 1 services in their school, did not show improvement over the course of this study. Implications and future directions are discussed.",17,3,269-291,https //doi.org/10.1177/0143034396173003,NA,NA,NA,NA
38296652,['Parental engagement'],Miller (2016),Miller Sarah   Davison Jenny   Yohanis Jamie   Sloan Seaneen   Gildea Aideen   Thurston Allen   ,2016,Texting Parents  Evaluation report and executive summary,NA,NA,Report,"The Parent Engagement Project (PEP) was a school-level intervention designed to improve pupil outcomes by engaging parents in their children’s learning. The intervention involved text messages being sent to parents using school communications systems, such as Schoolcomms. Texts informed parents about dates of upcoming tests, whether homework was submitted on time, and what their children were learning at school. The programme was developed collaboratively by research teams from the University of Bristol and Harvard University and was delivered between September 2014 and July 2015. The trial involved 15,697 students in Years 7, 9 and 11 from 36 English secondary schools, with schools sending an average of 30 texts to each parent over the period of the trial. This study was an efficacy trial in which the developers of the intervention managed its delivery to ensure optimal implementation. It was a cluster randomised controlled trial with randomisation at the Key Stage level, designed to determine the impact of the intervention on the academic outcomes of students in English, maths, and science, and the impact on absenteeism. A process evaluation used focus groups, telephone surveys, interviews, and an online survey to provide data on implementation and to capture the perceptions and experiences of participating parents, pupils, and teachers. The project was co- funded by the Education Endowment Foundation (EEF) and Nominet Trust as part of a funding round focused on digital technology.",NA,July,NA,NA,https //eric.ed.gov/?id=ED581121,NA,London,NA
42025502,['Parental engagement'],Morrow (1992),Morrow L M  ,1992,"The impact of a Literature-based program on literacy achievement, use of literature, and attitudes of children from minority backgrounds",Reading Research Quarterly,NA,"Journal, Article","THE AUTHOR investigated the impact of a literature-based program on the literacy achievement, use of literature, and attitudes toward reading of children from minority backgrounds. Nine second-grade classes (N = 166) were assigned to one control group and two experimental  one in a school-based program only and one in a school- and home-based program. Standardized and informal written and oral tests of comprehension were used to determine growth in literacy. Use of literature was measured by child surveys concerning after-school activities and records of books read in school and checked out to read at home. In with teachers and children determined attitudes toward the reading program. Children in the experimental groups did significantly better on all literacy measures except for the standardized test, where no differences were found. ND differences were found in the performance of the children in the home- and school-based program and the school-based program alone.",27,3,250-275,https //doi.org/10.2307/747794,NA,NA,NA,NA
42025503,['Parental engagement'],Morrow (1997),Morrow L M  Young J   ,1997,"A family literacy program connecting school and home  Effects on attitude, motivation, and literacy achievement",Journal of Education Psychology,NA,"Journal, Article","This study connected home and school literacy contexts by involving parents in developmentally appropriate and culturally sensitive literacy activities with their children. The purpose of the program was to enhance children's achievement and interest in literacy. The family program was similar to a literature-based school program that included classroom literacy centers, teacher-modeled literature activities, and literacy center time. Meetings were held monthly, with parents, teachers, and children all working together. The program was in an inner-city school district including African American and Latino families. There were 56 children in 1st through 3rd grades (28 in the experimental group and 28 in the control). Pre- and posttest data determined achievement and motivation differences favoring the children in the family program.",89,NA,736-742,https //doi.org/10.1037/0022-0663.89.4.736,NA,NA,NA,NA
47269856,['Parental engagement'],Nedler (1971) PE,Nedler Shari   Sebera Peggy   ,1971,Intervention Strategies for Spanish-speaking Preschool Children,Child Development,NA,"Journal, Article","This study compared 3 strategies of early intervention designed to increase the language and communication skills of disadvantaged 3-year-old Mexican-American children. Treatment group I (T1 included 16 children in a planned Bilingual Early Childhood Educational Program. Group T2 included 16 children who were indirectly involved in a Parental Involvement Program. Group T3 was composed of 14 children in a traditional day-care center. Before and after a 9-month intervention period, all Ss were tested with the Leiter International Performance Scale and the Peabody Picture Vocabulary Test in English and Spanish. On all measures, T1 made significantly greater gains than T2 or T3, indicating the greater effectiveness of the planned Bilingual Early Childhood Education Program.",42,1,259,https //doi.org/10.2307/1127080,NA,NA,NA,NA
