id,pub_author,pub_year,strand_raw,strand_info,toolkit_version,out_tit_tool,out_tit_tool_CLEAN,out_desc_tool,out_desc_tool_CLEAN,out_type_tool,out_type_tool_CLEAN,smd_tool,smd_tool_CLEAN,se_tool,se_tool_CLEAN,out_measure_tool,out_measure_tool_CLEAN,out_g1_n_tool,out_g1_n_tool_CLEAN,out_g1_mean_tool,out_g1_mean_tool_CLEAN,out_g1_sd_tool,out_g1_sd_tool_CLEAN,out_g2_n_tool,out_g2_n_tool_CLEAN,out_g2_mean_tool,out_g2_mean_tool_CLEAN,out_g2_sd_tool,out_g2_sd_tool_CLEAN,ci_lower_tool,ci_lower_tool_CLEAN,ci_upper_tool,ci_upper_tool_CLEAN,out_label_tool,out_label_tool_CLEAN,out_samp_tool,out_samp_tool_CLEAN,out_comp_tool,out_comp_tool_CLEAN,out_es_type_tool,out_es_type_tool_CLEAN,out_test_type_raw_tool,out_test_type_raw_tool_CLEAN
42025124,Arnold (1996),1996,['Parental engagement'],NA,NA,Addison Wesley Maths Grade 3,,Posttest combined Means and SD's for A+B vs C,,"['Toolkit primary outcome', 'Mathematics primary outcome']",,-0.2905,,0.6048,,Mathematics,,9.0,,35.22,,3.31,,4.0,,36.5,,5.69,,-1.4759,,0.8949,,Primary outcome,,['Sample: All'],,With business as usual,,['Post-test unadjusted (select one from this group)'],,['Test type: Standardised test '],
42025125,Austin (1988),1988,['Parental engagement'],NA,NA,GCRT Reading,,effect size calculated from F-value uploaded to Slack ,,"['Toolkit primary outcome', 'Reading primary outcome']",,0.3571,,0.1822,,Literacy  reading comprehension,,NA,,NA,,NA,,NA,,NA,,NA,,-0.0,,0.7142,,Primary outcome,,NA,,With business as usual,,NA,,NA,
42025487,Barhava‐Mònteith (1999),1999,['Parental engagement'],NA,NA,Reading Diagnostic Survey ,,Posttest Means and SD's for BURT Word Reading Test,,"['Toolkit primary outcome', 'Writing and spelling primary outcome.']",,0.2614,,0.1202,,Literacy  spelling,,77.0,,14.01,,8.93,,704.0,,11.6,,9.24,,0.0258,,0.497,,Primary outcome,,['Sample: All'],,With business as usual,,['Post-test unadjusted (select one from this group)'],,['Test type: Standardised test '],
42024853,Barkley (2000),2000,['Parental engagement'],NA,NA,WJ Academic Skills (PT vs Control),,"Woodcock Johnson Psychoeducational Test Battery (Woodcock & Johnson, 1984)  includes a number of tests assessing cognitive abilities (intelligence) as well as a separate battery of tests assessing academic knowledge (science, social studies, humanities) and skills (reading, math, spelling). Standard scores are produced for each subtest. Only the academic knowledge and skills tests were used in assessing treatment effects",,"['Toolkit primary outcome', 'Reading primary outcome']",,0.244,,0.2263,,Literacy  reading comprehension,,37.0,,98.4,,11.3,,42.0,,95.2,,14.3,,-0.1996,,0.6877,,Primary outcome,,['Sample: All'],,With business as usual,,['Post-test adjusted for baseline attainment'],,['Test type: Standardised test '],
42059739,Beach (2004),2004,"['Parental engagement', 'Phonics', 'Summer schools']",NA,NA,DIBELS,,Regression Initial sounds fluency,,"['Toolkit primary outcome', 'Reading primary outcome']",,0.419,,0.125,,Literacy  decoding/phonics,,NA,,NA,,NA,,NA,,NA,,NA,,0.174,,0.664,,Primary outcome,,['Sample: All'],,With business as usual,,['Post-test adjusted for baseline attainment'],,['Test type: Standardised test '],
42025129,Bermúdez (1990),1990,['Parental engagement'],NA,NA,Reading Achievement,,Posttest means and SD's ,,"['Toolkit primary outcome', 'Reading primary outcome']",,0.3019,,0.1582,,Literacy  reading comprehension,,84.0,,81.92,,10.28,,78.0,,78.77,,10.5,,-0.0081,,0.6118,,Primary outcome,,NA,,With business as usual,,NA,,NA,
42024854,Beveridge (1981),1981,['Parental engagement'],NA,NA,EPVT   language - Parental Engagement,,EPVT (English Picture Vocabulary Test) (Grp2+Grp3) vs (Grp1+Grp4) - Parental Engag.- (Grp1+Grp4 (control),,"['Toolkit primary outcome', 'Other outcome']",,0.4616,,0.3209,,Literacy  speaking and listening/oral language,,20.0,,31.0,,9.05,,20.0,,26.8,,8.786,,-0.1673,,1.0904,,Primary outcome,,['Sample: All'],,With business as usual,,['Post-test unadjusted (select one from this group)'],,['Test type: Standardised test '],
47269778,Brickman (2002) PE,2002,['Parental engagement'],NA,NA,Peabody Picture Vocabulary Test ,,"The PPVT-R score, a continuous measure, was used to provide a measure of the children's receptive language development",,"['Toolkit primary outcome', 'Other outcome']",,0.3228,,0.3636,,Cognitive  reasoning,,14.0,,62.43,,20.14,,17.0,,56.53,,15.65,,-0.3898,,1.0353,,Primary outcome,,['Sample: All'],,With business as usual,,NA,,NA,
42025132,Busco (1991),1991,['Parental engagement'],NA,NA,SABE Scores Including Grade as a Between-Subiects Factor,,,,"['Toolkit primary outcome', 'Reading primary outcome']",,0.7732,,0.1999,,,,56.0,,0.0,,0.0,,52.0,,0.0001,,0.0,,0.3814,,1.1651,,Primary outcome,,NA,,With active control,,NA,,NA,
47269780,Butler (1991) PE,1991,['Parental engagement'],NA,NA,Holborn Reading Test,,"The students were tested on the Holborn Reading Test (Watts 1944) which is an assessment of ability to read sentences of increasing difficulty with respect to vocabulary, sen- tence structure and comprehension.",,"['Toolkit primary outcome', 'Reading primary outcome']",,1.172,,0.4705,,Literacy  reading comprehension,,12.0,,3.289,,0.0,,10.0,,0.01,,0.0,,0.2499,,2.0942,,,,NA,,With business as usual,,NA,,NA,
42025488,Chow (2003),2003,"['Parental engagement', 'Oral language interventions']",NA,NA,PPCLS posttest Dialogic v control,,Preschool and Primary Chinese Literacy Scale (PPCLS)  posttest Dialogic v control,,"['Toolkit primary outcome', 'Reading primary outcome']",,0.4584,,0.2663,,Literacy  reading other,,29.0,,30.69,,6.25,,29.0,,27.5,,7.43,,-0.0635,,0.9803,,Primary outcome,,['Sample: All'],,With business as usual,,['Post-test unadjusted (select one from this group)'],,['Test type: Standardised test '],
42025489,Chow (2008),2008,['Parental engagement'],NA,NA,Chinese character recognition (DR vs Control),,"A 61-item character recognition list and 150 items adapted from the Hong Kong Test of Specific Learning Difficulties in Reading and Writing (HKT-SpLD  Ho, Chan, Tsang, & Lee, 2000) were combined and administered. The items were arranged in order of increasing difficulty, and the children were required to read each character aloud. Children were given the items adapted from the HKT-SpLD if they progressed beyond the 61-item character rec- ognition list. Testing stopped when the child failed to read 15 consecutive items.",,"['Toolkit primary outcome', 'Reading primary outcome']",,0.065,,0.23,,Literacy  reading other,,NA,,NA,,NA,,NA,,NA,,NA,,-0.3858,,0.5158,,Primary outcome,,['Sample: All'],,With business as usual,,['Post-test adjusted for baseline attainment'],,['Test type: Standardised test '],
42025134,Clegg (1971),1971,['Parental engagement'],NA,NA,Comprehension,,Posttest adjusted means and SE for experimental vs External Control,,"['Toolkit primary outcome', 'Reading primary outcome']",,0.734,,0.4656,,Literacy  reading comprehension,,10.0,,30.16,,1.8,,10.0,,25.81,,1.79,,-0.1786,,1.6465,,Primary outcome,,['Sample: All'],,With business as usual,,['Post-test adjusted for baseline attainment'],,['Test type: Standardised test '],
42025415,Crain-Thoreson (1999),1999,['Parental engagement'],NA,NA,EOWPVT-R,,Posttest Means and SD's for Parent vs Staff/Control,,"['Toolkit primary outcome', 'Reading primary outcome']",,0.3848,,0.4648,,Literacy  reading comprehension,,10.0,,75.6,,12.1,,9.0,,71.0,,10.6,,-0.5262,,1.2958,,Primary outcome,,NA,,With business as usual,,NA,,NA,
45336725,Crain-Thoreson (1999) PE,1999,['Parental engagement'],NA,NA,EOWPVT-R,,Posttest Means and SD's for Parent Reading vs Staff/Practice,,"['Toolkit primary outcome', 'Reading primary outcome']",,0.3889,,0.4253,,Literacy  reading comprehension,,10.0,,75.6,,12.1,,13.0,,70.9,,11.3,,-0.4447,,1.2225,,Primary outcome,,NA,,With active control,,NA,,NA,
42025417,DeBaryshe (2007),2007,['Parental engagement'],NA,NA,TERA-3  - Emergent Reading,,TERA-3 (Test of Early Reading Abilities) - Emergent Reading,,"['Toolkit primary outcome', 'Reading primary outcome']",,0.0592,,0.2301,,Literacy  reading other,,51.0,,18.0,,10.6,,30.0,,17.4,,9.0,,-0.3919,,0.5103,,Primary outcome,,['Sample: All'],,With business as usual,,['Post-test adjusted for baseline attainment'],,['Test type: Standardised test '],
42025436,Doering (1994),1994,['Parental engagement'],NA,NA,California Achievement Test (Reading),,Posttest means and SD's ,,"['Toolkit primary outcome', 'Reading primary outcome']",,0.3459,,0.3076,,Literacy  reading comprehension,,22.0,,733.864,,39.795,,21.0,,721.571,,28.844,,-0.257,,0.9488,,Primary outcome,,['Sample: All'],,With business as usual,,['Post-test unadjusted (select one from this group)'],,['Test type: Standardised test '],
42024828,Donachy (1976),1976,['Parental engagement'],NA,NA,Reynell  Compreh. - Parental Engagm.,,Reynell Developmental Language Scale - Compreh. (GrpA+B vs GrpE+F) - Parental Engagm.,,"['Toolkit primary outcome', 'Reading primary outcome']",,0.7165,,0.2584,,Literacy  reading comprehension,,32,,1.135,,0.928,,32,,0.43,,1.014,,0.2101,,1.223,,Primary outcome,,['Sample: All'],,With business as usual,,['Post-test unadjusted (select one from this group)'],,['Test type: Standardised test '],
38296611,Dorsett (2014),2014,"['Metacognition and self-regulation', 'Parental engagement', 'Extending school time']",NA,NA,KS2 MathEng Combined (inCAS) - Metacognition PETT,,"Pre-test and 6 months delayed post-test age-equivalent score. Combination of three InCAS measures  reading, general maths and mental arithmetic. Combined literacy and numeracy score =(reading score + (general maths score + mental arithmetic score)/2)/2.",,"['Toolkit primary outcome', 'Other outcome']",,-0.141,,0.283,,Combined subjects,,NA,,NA,,NA,,NA,,NA,,NA,,-0.6957,,0.4137,,Primary outcome,,['Sample: All'],,With business as usual,,['Post-test adjusted for baseline attainment AND clustering'],,['Test type: Standardised test '],
42025516,Erion (1994),1994,['Parental engagement'],NA,NA,Correct word/min - Parental Engag.,,"Mean of number of words correctly read per minute-R – PE (use of 1 minute oral reading probes …. When an omission or substitution was made, this error was pointed to immediately & correct response was requested. If the student didn’t know the word/hesitated for 3 secs the word was counted as unknown)",,"['Toolkit primary outcome', 'Reading primary outcome']",,0.4529,,0.4145,,Literacy  reading other,,12.0,,30.42,,10.86,,12.0,,24.75,,13.2,,-0.3594,,1.2653,,Primary outcome,,['Sample: Low achievers'],,With business as usual,,['Post-test unadjusted (select one from this group)'],,['Test type: Researcher developed test'],
42025494,Evangelou (2007),2007,['Parental engagement'],NA,NA,Verbal Comprehension (BAS),,"Verbal Comprehension from the British Ability Scales II (BAS) by Elliot, Smith, and McCulloch (1996). The test assesses understanding of language.",,"['Toolkit primary outcome', 'Other outcome']",,0.5255,,0.1692,,Literacy  speaking and listening/oral language,,64.0,,21.16,,3.43,,83.0,,19.68,,2.2,,0.1939,,0.8572,,Primary outcome,,['Sample: All'],,With business as usual,,['Post-test unadjusted (select one from this group)'],,['Test type: Standardised test '],
42025517,Fantuzzo (1995),1995,['Parental engagement'],NA,NA,Mathematics Computation,,Posttest adjusted means and SD's for maths computation. PIvsPractice Control. These results are also given for dyads in each group,,"['Toolkit primary outcome', 'Mathematics primary outcome']",,0.323,,0.4034,,Mathematics,,12.0,,552.71,,48.13,,13.0,,537.58,,42.54,,-0.4677,,1.1137,,Primary outcome,,NA,,With business as usual,,NA,,NA,
42025509,Fielding-Barnsley (2003),2003,['Parental engagement'],NA,NA,PPVT (time 2),," The Peabody picture vocabulary test (PPVT-111) (Dunn and Dunn, 1997). This test is a measure of receptive vocabulary. A matrix of four pictures is shown to the child, who is then asked to choose the picture that matches the spoken word provided by the tester.",,"['Toolkit primary outcome', 'Reading primary outcome']",,0.4583,,0.2903,,Literacy  reading other,,26.0,,88.69,,10.0,,23.0,,81.65,,19.35,,-0.1107,,1.0273,,Primary outcome,,['Sample: Low achievers'],,With business as usual,,['Post-test unadjusted (select one from this group)'],,['Test type: Standardised test '],
42025495,France (1993),1993,"['Parental engagement', 'One to one tuition']",NA,NA,Graded Spelling Test,,"The Graded Spelling Test (Daniels and Diack 1979) was applied before and after the project to all the children in one class in the Year 4 group, whether participant or not",,"['Toolkit primary outcome', 'Writing and spelling primary outcome.']",,0.5752,,0.389,,Literacy  spelling,,22.0,,0.51,,0.51,,10.0,,0.18,,0.66,,-0.1873,,1.3377,,Primary outcome,,NA,,With business as usual,,NA,,NA,
42025140,Glass (1978),1978,['Parental engagement'],NA,NA,CPre-ScInv (Kinderg) Read&Maths,,Cooperative Pre-School Inventory (Kindergarten) Reading & Maths combined – gain scores,,"['Toolkit primary outcome', 'Other outcome']",,-0.4183,,0.2418,,Combined subjects,,35.0,,-1.75,,0.0,,35.0,,0.0,,0.0,,-0.8923,,0.0556,,Primary outcome,,['Sample: All'],,With business as usual,,['Pre-post gain'],,['Test type: Standardised test '],
45336742,Guastello (2001) PE,2001,['Parental engagement'],NA,NA,Rubric score - Parental engagement - parental group,,"Rubric score for writing with 6 components (ie. topic focus, organisation, ... etc) as developed by the St. John's University - Parental engagement - parental group. NOTE  post-test means & Sd give ES=2.19! therefore i took the 2xAnova stats",,"['Toolkit primary outcome', 'Writing and spelling primary outcome.']",,0.619,,0.1604,,Literacy  writing,,NA,,NA,,NA,,NA,,NA,,NA,,0.3045,,0.9334,,Primary outcome,,['Sample: All'],,With business as usual,,['Post-test unadjusted (select one from this group)'],,['Test type: Researcher developed test'],
42025141,Hampton (1998),1998,['Parental engagement'],NA,NA,Reading ES - CTS & Terra Nova,,,,"['Toolkit primary outcome', 'Reading primary outcome']",,0.808,,0.112,,Literacy  reading comprehension,,0.80798934,,0,,0,,0.11204754,,0,,0,,0.5884,,1.0276,,Primary outcome,,['Sample: All'],,With business as usual,,['Post-test unadjusted (select one from this group)'],,['Test type: Standardised test '],
42025474,Hannon (1987),1987,['Parental engagement'],NA,NA,NFER Reading Test A,,Posttest means and SD's for all project children vs control,,"['Toolkit primary outcome', 'Reading primary outcome']",,0.0889,,0.1604,,Literacy  reading comprehension,,71.0,,96.2,,12.9,,86.0,,95.1,,11.8,,-0.2255,,0.4034,,Primary outcome,,['Sample: All'],,With business as usual,,['Post-test unadjusted (select one from this group)'],,['Test type: Standardised test '],
42025518,Heller (1993),1993,['Parental engagement'],NA,NA,Computation Maths RPT + PI v RPT,,Computation Maths RPT + PI v RPT,,"['Toolkit primary outcome', 'Mathematics primary outcome']",,0.5928,,0.2411,,Mathematics,,36.0,,9.5,,1.9,,36.0,,8.5,,1.4,,0.1202,,1.0654,,Primary outcome,,['Sample: Low achievers'],,With active control,,['Post-test unadjusted (select one from this group)'],,['Test type: Standardised test '],
45336749,Henderson (1982) PE,1982,['Parental engagement'],NA,NA,SCORES FOR THE READING COMPREHENSION TEST,,"There are 16 skill objectives represented in the reading comprehension test. The objectives are organized into three major divisions  ""facts— to recognize and understand stated factual details and relationships  inferences— to infer underlying relation­ ships  generalizations— to develop generalizations from a selection"" (Hieronymous et al., 1979, p. 32).",,"['Toolkit primary outcome', 'Reading primary outcome']",,0.2389,,0.1469,,Literacy  reading comprehension,,102.0,,26.58,,10.45,,86.0,,24.12,,10.02,,-0.0491,,0.5269,,Primary outcome,,['Sample: All'],,With business as usual,,['Post-test adjusted for baseline attainment'],,['Test type: Standardised test '],
42025142,Henry (1974),1974,['Parental engagement'],NA,NA,Word in context,,posttest means and SD's for fathers reading vs control,,"['Toolkit primary outcome', 'Reading primary outcome']",,0.9468,,0.5728,,Literacy  decoding/phonics,,5.0,,10.6,,7.27,,11.0,,3.82,,6.56,,-0.1759,,2.0694,,Primary outcome,,NA,,With business as usual,,NA,,NA,
42025212,Henry (1974),1974,['Parental engagement'],NA,NA,Naming Letters,,Posttest Combined means and SD's or mothers+fathers vs control,,"['Toolkit primary outcome', 'Reading primary outcome']",,-0.2188,,0.4111,,Literacy  decoding/phonics,,13.0,,41.08,,14.06,,11.0,,43.56,,5.13,,-1.0246,,0.587,,Primary outcome,,NA,,With business as usual,,NA,,NA,
42025143,Hewison (1988),1988,['Parental engagement'],NA,NA,London Reading (School 1+2 Combined) - PE,,London Reading Test (School 1+2)  Combined for fixed effect - Parental engagement,,"['Toolkit primary outcome', 'Reading primary outcome']",,0.4771,,0.2025,,Literacy  reading comprehension,,0.477055284,,0,,0,,0.202474127,,0,,0,,0.0802,,0.8739,,Primary outcome,,['Sample: All'],,With business as usual,,['Post-test unadjusted (select one from this group)'],,['Test type: Standardised test '],
42024832,Highberger (1973),1973,['Parental engagement'],NA,NA,Peabody Picture Vocabulary Test - Parental Engagement,,Pre-post gain score of the Peabody Picture Vocabulary Test. Form J was administered at pre-test and Form B at post-test.,,"['Toolkit primary outcome', 'Reading primary outcome']",,1.1584,,0.2425,,Literacy  reading other,,40.0,,10.08,,7.25,,40.0,,1.6,,7.25,,0.683,,1.6337,,Primary outcome,,['Sample: All'],,With business as usual,,['Pre-post gain'],,['Test type: Standardised test '],
42025144,Hirst (1972),1972,['Parental engagement'],NA,NA,Gates McGinitie -compreh- Parental Eng.,,Gates McGinitie Reading-comprehension - Parental Engagement,,"['Toolkit primary outcome', 'Reading primary outcome']",,0.1064,,0.2043,,Literacy  reading comprehension,,NA,,NA,,NA,,NA,,NA,,NA,,-0.2939,,0.5067,,Primary outcome,,['Sample: All'],,With business as usual,,['Post-test unadjusted (select one from this group)'],,['Test type: Standardised test '],
38296625,Husain (2016),2016,['Parental engagement'],NA,NA,KS2 Maths Overall ES,,"Age standardised pre-test post-test scores. InCAS measure of attainment in general mathematics which consists of four components that measure informal arithmetic  formal arithmetic  measures, shapes and space  and data handling.",,"['Toolkit primary outcome', 'Mathematics primary outcome']",,-0.0162,,0.0738,,Mathematics,,NA,,NA,,NA,,NA,,NA,,NA,,-0.1609,,0.1285,,Primary outcome,,['Sample: All'],,With business as usual,,['Post-test adjusted for baseline attainment AND clustering'],,['Test type: Standardised test '],
42025475,Jordan (2000),2000,['Parental engagement'],NA,NA,CAP Language Posttest,,Comprehensive Assessment Program Language Postest,,"['Toolkit primary outcome', 'Reading primary outcome']",,0.6865,,0.1439,,Literacy  reading other,,177.0,,37.27,,4.3,,71.0,,33.83,,6.42,,0.4045,,0.9685,,Primary outcome,,['Sample: Low achievers'],,With business as usual,,['Post-test unadjusted (select one from this group)'],,['Test type: Standardised test '],
42025422,Justice (2000),2000,['Parental engagement'],NA,NA,Words in Print,,Posttest Means and SD's ,,"['Toolkit primary outcome', 'Reading primary outcome']",,1.0585,,0.4076,,Literacy  reading comprehension,,14.0,,0.64,,0.19,,14.0,,0.41,,0.23,,0.2596,,1.8575,,Primary outcome,,NA,,With business as usual,,NA,,NA,
42025439,Kiesner (1997),1997,['Parental engagement'],NA,NA,Mathematics Quiz,,"These tests were constructed by graduate student research assistants, drawing problem types directly from the chapters of the textbooks that the teachers were planning to teach during the course of this study.",,"['Toolkit primary outcome', 'Mathematics primary outcome']",,0.0,,0.4174,,Mathematics,,11.0,,10.9,,3.3,,12.0,,10.9,,2.4,,-0.8182,,0.8182,,Primary outcome,,['Sample: Low achievers'],,With business as usual,,['Post-test unadjusted (select one from this group)'],,['Test type: Researcher developed test'],
42064877,Kim (2008),2008,['Parental engagement'],NA,NA,ITBS Posttest Adjusted for pretest covariate,,ITBS Posttest Adjusted for pretest covariate,,"['Toolkit primary outcome', 'Reading primary outcome']",,0.1384,,0.1393,,Literacy  reading other,,100.0,,207.0,,28.57,,107.0,,203.07,,28.01,,-0.1345,,0.4114,,Primary outcome,,['Sample: Low achievers'],,With business as usual,,['Post-test adjusted for baseline attainment'],,['Test type: Standardised test '],
42064876,Kim (2010),2010,['Parental engagement'],NA,NA,Pot-Test Comprehension scores (GMRT)(Family Literacy v Control),,"Gates–MacGinitie Reading Test, includes a total reading score based on a 48-item comprehension subtest and a 45-item vocabulary subtest.",,"['Toolkit primary outcome', 'Reading primary outcome']",,-0.1028,,0.1343,,Literacy  reading comprehension,,112.0,,18.98,,20.9,,110.0,,21.07,,19.58,,-0.3661,,0.1605,,Primary outcome,,NA,,With business as usual,,NA,,NA,
42059811,Koh (1982),1982,['Parental engagement'],NA,NA,CBTS– Gr1-Grp A  Reading  Parental Engag.,,CBTS (Comprehensive Test of Basic Skills) – Gr1 - Grp A - Reading -Parental Engagement,,"['Toolkit primary outcome', 'Reading primary outcome']",,0.2551,,0.267,,Literacy  reading comprehension,,19.0,,0.9586,,0.0,,55.0,,0.0,,0.0,,-0.2682,,0.7784,,Primary outcome,,['Sample: All'],,With business as usual,,['Post-test adjusted for baseline attainment'],,['Test type: Standardised test '],
42025146,Kosten (1997),1997,['Parental engagement'],NA,NA,California Achievement Test 5 (Science),,Posttest means and SD's fror reatment vs control,,"['Toolkit primary outcome', 'Science primary outcome']",,0.0746,,0.3383,,Science,,17.0,,48.35,,16.7,,18.0,,47.19,,13.63,,-0.5885,,0.7377,,Primary outcome,,['Sample: Average'],,With business as usual,,['Post-test unadjusted (select one from this group)'],,['Test type: Standardised test '],
42025476,Kraft (2001),2001,['Parental engagement'],NA,NA,WRMT Word Identification,,Posttest means and SD's ,,"['Toolkit primary outcome', 'Other outcome']",,0.2758,,0.3073,,Literacy  decoding/phonics,,20.0,,104.1,,11.3,,23.0,,99.9,,17.5,,-0.3266,,0.8781,,Primary outcome,,['Sample: All'],,With business as usual,,['Post-test unadjusted (select one from this group)'],,['Test type: Standardised test '],
42025477,Leach (1990),1990,['Parental engagement'],NA,NA,Neale - Comprehension - Parental engag.,,Neale Test - Reading Comprehension - Parental engagement,,"['Toolkit primary outcome', 'Reading primary outcome']",,1.2306,,0.3929,,Literacy  reading comprehension,,30.0,,6.807,,0.459,,10.0,,6.25,,0.39,,0.4606,,2.0006,,Primary outcome,,['Sample: All'],,With active control,,['Post-test unadjusted (select one from this group)'],,['Test type: Standardised test '],
42025499,Lonigan (1998),1998,['Parental engagement'],NA,NA,PPVT Posttest adjusted High compliance Home only v control,,PPVT Posttest adjusted High compliance Home only v control,,"['Toolkit primary outcome', 'Reading primary outcome']",,0.0852,,0.4534,,Literacy  reading other,,7,,82.1,,9.41,,16,,80.7,,17.78,,-0.8035,,0.9738,,Primary outcome,,['Sample: Low achievers'],,With business as usual,,['Post-test unadjusted (select one from this group)'],,['Test type: Standardised test '],
38296639,Lord (2018),2018,['Parental engagement'],NA,NA,Parental Engagement - reading comprehension KS1,,Mean posttest KS1 scores adjusted for comparibility and clustering using an intention to treat (ITT) approach.,,"['Toolkit primary outcome', 'Reading primary outcome']",,0.03,,0.061,,Literacy  reading comprehension,,NA,,NA,,NA,,NA,,NA,,NA,,-0.0896,,0.1496,,Secondary outcome(s),,['Sample: All'],,With business as usual,,['Post-test adjusted for baseline attainment AND clustering'],,['Test type: National test'],
42024838,McCormick (1986),1986,['Parental engagement'],NA,NA,PPVT-R,,Posttest means and SD's for wav 2 intervention vs control... as instructions state,,"['Toolkit primary outcome', 'Other outcome']",,0.0029,,0.2748,,Cognitive  other,,27.0,,100.07,,9.14,,26.0,,100.04,,10.92,,-0.5356,,0.5415,,,,['Sample: All'],,With business as usual,,['Post-test adjusted for baseline attainment'],,['Test type: Standardised test '],
42025500,McElvany (2009),2009,['Parental engagement'],NA,NA,HAMLET 3- 4 (Comprehension),,Posttest t-value controlled for pretest scores ,,"['Toolkit primary outcome', 'Reading primary outcome']",,0.0666,,0.1057,,Literacy  reading comprehension,,116.0,,0.63,,0.0,,393.0,,0.0,,0.0,,-0.1406,,0.2737,,Primary outcome,,['Sample: All'],,With business as usual,,['Post-test adjusted for baseline attainment'],,['Test type: Standardised test '],
42025441,McGrath (1992),1992,['Parental engagement'],NA,NA,English Literature Scores,,"Posttest means and SD's for English literature, parents supervision vs no supervision ",,"['Toolkit primary outcome', 'Reading primary outcome']",,0.1861,,0.2742,,Literacy  reading comprehension,,34.0,,83.6176,,7.58,,22.0,,82.2273,,7.023,,-0.3514,,0.7235,,Primary outcome,,['Sample: All'],,With business as usual,,['Post-test unadjusted (select one from this group)'],,['Test type: Researcher developed test'],
42025150,McKinney (1975),1975,['Parental engagement'],NA,NA,Mathematics Posttest ,,F-value for comparison between treatment and control ,,"['Toolkit primary outcome', 'Mathematics primary outcome']",,0.3294,,0.2847,,Mathematics,,NA,,NA,,NA,,NA,,NA,,NA,,-0.2286,,0.8874,,Primary outcome,,['Sample: All'],,With business as usual,,['Post-test adjusted for baseline attainment'],,['Test type: National test'],
