ID,toolkit_strand,short_title,main_authors,year,main_title,parent_title,parent_authors,type_name,abstract,volume,issue,pages,doi,url,publisher,city,institution
42025153,['Parental engagement'],Nesbitt (1993),Nesbitt G K  ,1993,"The effects of three school-to-home parental involvement communication programs on reading achievement, conduct, homework habits, attendance, and parent-student-school interaction.",NA,NA,Dissertation,"The purpose of this study was to examine the effects of three school-to-home parent involvement communication programs on reading achievement, conduct, homework habits, attendance, and parent-student-school interactions. The method. The subjects (N = 136) scored at or below the fiftieth percentile in reading and mathematics on the Iowa Test of Basic Skills and were served in a Chapter I replacement model for reading and mathematics. The study site was Blackshear Trail School, Crisp County, Georgia, a second and third grade elementary school. Scores, ranked from highest to lowest by grade, were grouped to assure equal groups. Group A parents received monthly communication by letter. Group B parents received monthly communication by letter with an invitation from the school to visit their child's classroom and have lunch with their child. Transportation and the cost of lunch were provided by the school. Group C parents received monthly communication through home visits. Group D was the control group and received standard school communication. Parent and teacher questionnaires were completed. An analysis of variance (ANOVA) was used to determine group differences. Results. Group differences attributable to the type of parent involvement communication implemented were not found. There were no significant differences among groups in terms of student reading achievement, conduct, attendance, homework habits, and parent-student-school interaction. The data from this study supported the decision to fail to reject the null hypotheses. Conclusions. This study indicated there may not be one specific communication type which is most advantageous for promoting parent involvement but that a variety of types may be best. Parent and teacher questionnaires revealed relevant information regarding different perspectives and opinions of parent involvement in terms of its effect on school and children. Parents were generally pleased with the school and expressed positive feelings regarding the school's parent involvement program. Parents' attitudes toward school, considered to be important to their child's success, may produce long range benefits to the student which were not measured by this study. Teacher's opinions varied as to the most effective method for involving parents but all indicated a belief that schools should involve parents in their child's education.",NA,NA,NA,NA,https //search.proquest.com/docview/304053770,NA,NA,Georgia State University
42025480,['Parental engagement'],Niedermeyer (1970),Niedermeyer Fred C  ,1970,Parents Teach Kindergarten Reading at Home,Elementary School Journal,NA,"Journal, Article",The study reported here investigated the effect that parent-monitored practice at home had on pupil performance in reading. The study used as the instructional vehicle a kindergarten reading curriculum prepared by the Southwest Regional Laboratory. The Parent-Assisted Learning Program was designed to enable school personnel to establish a system to help parents effectively instruct their primary-grade children in basic skills at home. ,70,NA,NA,https //doi.org/10.1086/460605,NA,NA,NA,NA
42025154,['Parental engagement'],O’Neil (1975),O’Neil A G  ,1975,An investigation of parent tutorial intervention as a means of improving reading skills in the primary age child.,NA,NA,Dissertation,"This study compared the performance of three groups of reading disabled students  those who were tutored by supervised parents, those who were tutored by unsupervised parents, and those who were not tutored. The subjects were 159 first-, second-, and third-grade children who read at least one year below grade level. The parents who tutored their children used an instructional guide for a ten-week period during the summer months. In addition, the supervised parents were required to attend weekly instructional workshop meetings in order to hear formal presentations regarding the program and were supervised individually each week by the author. At the end of the ten-week period, the results suggested that parental tutoring efforts were not significantly different for the children of either the supervised tutors or the unsupervised tutors. However, parental tutoring was effective in increasing children's scores in some reading subskills on the posttests.",NA,NA,NA,NA,https //search.proquest.com/docview/63992463,NA,NA,University of Oregon
42025158,['Parental engagement'],Overett (1998),Overett D   Donald D   ,1998,Paired reading  Effects of a parent involvement programme in advantaged community in South Africa.,British Journal of Educational Psychology,NA,"Journal, Article","Background. The study was conducted in an educationally disadvantaged South African community where the effectiveness of a paired reading parent involvement programme, which stressed interaction around reading as a means of mediating meaning, was evaluated. Aims. The research aimed to evaluate whether reading accuracy, comprehension and attitude were promoted through involving parents and other family members as mediators in a process of paired reading. Further, it aimed to elucidate interactive ecosystemic effects across family, school and community levels. Samples. Two complete grade four classes (29 and 32 children respectively) served as comparison groups (average age  9 years 7 months). Methods. To test the significance of the improvement in reading accuracy and comprehension (Neale Analysis of Reading Ability  Neale, 1966) and attitude (Elementary Reading Attitude Survey  McKenna & Kear, 1990) for the experimental group relative to the control, one-tailed t-tests for independent samples on the respective pre-test/post-test difference scores were applied. Results. Statistically significant improvements in reading accuracy and comprehension, as well as reading attitude and involvement, were demonstrated. A broad ecosystemic analysis suggested that positive relationships between children and significant others in the family were nurtured and other children in the family were benefiting. Interactions between family and school, and school and the local community library, were also enhanced. Conclusions. The study emphasises the importance of developing mediation insights and skills in parent involvement programmes, and the place of ecosystemic analysis in understanding the social dynamics involved in such programmes. ",68,NA,347-356, https //doi.org/10.1111/j.2044-8279.1998.tb01296.x,NA,NA,NA,NA
42064885,['Parental engagement'],Pagan (2010),Pagan Stephanie L  ,2010,Children Reading for Pleasure  Investigating Predictors of Reading Achievement and the Efficacy of a Paired-Reading Intervention to Foster Children's Literacy Skills,NA,NA,Dissertation,"The amount of reading children do outside of school is positively related to their reading achievement. This relation is consistent and robust, but fails to consider additional factors that may be influential in predicting children's literacy performance. Moreover, this relation speaks to the use of reading programs to improve children's achievement by increasing reading frequency. Two studies were conducted to examine these issues. Study 1 proposed and tested a comprehensive model of children's literacy performance where the association between children's home literacy environment, reading motivation, and achievement was mediated by children's reading exposure. A sample ( N = 116) of grade 3 and 5 children and their parents participated. Findings were in accord with the model  however, children's reading motivation was a significant and unique predictor of children's reading and spelling ability. Overall, the findings of Study 1 suggested that incorporating additional explanatory factors is necessary to children's literacy performance. Study 2 tested whether a summer reading program would improve achievement measures in a targeted sample (N = 57) of poor achievers from Study 1. Children were randomly assigned to a Book Reading Group or Control Group. Over 8-weeks children in the Book Reading Group were sent one book per week that was matched to their interest and reading level. In addition, parents acted as reading models and were trained to use skill-building strategies. As predicted, children in the Book Reading Group showed significant gains in reading compared to children in the Control Group. No group differences were found for oral language skills or reading motivation. Study 2 revealed that providing access to books and maximizing the role of parents was an effective method for improving poor achiever's literacy skills over the summer. Copies of dissertations may be obtained by addressing your request to ProQuest, 789 E. Eisenhower Parkway, P.O. Box 1346, Ann Arbor, MI 48106-1346. Telephone 1-800-521-3042  e-mail  disspub@umi.com",NA,NA,0888,NA,https //search.proquest.com/docview/1018383725,NA,NA,NA
42025159,['Parental engagement'],Peeples (1996),Peeples R T  ,1996,The impact of parental training methods to aid beginning reading on reading achievements and reading attitudes of first graders,NA,NA,Dissertation,"The purpose of the study was to determine if parental training in methods to aid beginning reading had a significant effect on reading achievement and reading attitude of first-grade students. Subjects were 50 first-grade students in the Madison County, Mississippi public school system who were randomly selected and assigned to either a control or experimental group. Parents of students assigned to the experimental group received the parental training component, HELP (Home Enrichment Learning Program), while parents of students assigned to the control group received no training. After a period of approximately 15 weeks, the Gates-MacGinitie Reading Tests and the Elementary Reading Attitude Survey were administered to each student in the control and treatment groups. Six null hypotheses were proposed and tested. The reading achievement data were analyzed using an independent samples t-test with alpha preset at.05, power at.80, and medium effect size. Alternative hypotheses were nondirectional. Reading attitude data were analyzed with an independent samples Wilcoxon Rank Sum test with alpha preset at.05. Alternative hypotheses were nondirectional. Three null hypotheses (relating to reading achievement data) were rejected, and three null hypotheses (relating to reading attitude data) were not rejected in the study. The following conclusions were reached  (1) Parental participation in a training program designed to train parents in methods to aid beginning reading development had a positive significant effect on vocabulary development, reading comprehension, and total reading achievement of first-grade students. (2) Parental participation in a training program designed to train parents in methods to aid beginning reading development had no significant effect on recreational, academic, or total reading attitude of first-grade students.",NA,NA,NA,NA,https //search.proquest.com/docview/304301416,NA,NA,Florida State University
42024842,['Parental engagement'],Phillips (1990),Phillips L M  Norris S P  Mason J M  Kerr B M  ,1990,Effect of early literacy intervention on kindergarten achievement.,National Reading Conference,NA,Conference Proceedings,"A study examined whether a beneficial effect on children's literacy development accrues from the use of the LittleBooks with kindergarten children, and identified differential effects on kindergarten achievement according to treatment type, community status, and school type. From a sample of 40 Newfoundland schools, schools were grouped into rural village (drawing students from one small community), rural collector (drawing students from several small communities), and urban, and four schools were randomly selected from each grouping. Schools were assigned randomly to one of the treatment groups (Little Books used in the home only, LittleBooks used in the home and school, Little Books used in the school only, and control). Complete pretest and posttest data were obtained for 309 children. Quantitative analyses showed the children entering kindergarten in this study to be at risk of school failure. On average, urban kindergartners scored higher on all measures, and village and collector students scored about the same. Differences in posttest means were not related clearly to treatment. However, the Metropolitan Reading Readiness Pretest x Treatment interaction, which showed that the lowest achieving students profited most from the Little Books when they were used at home only, and the highest achieving students profited most from the Little Books when they used them in school only, helps to support the hypothesis that the home has a crucial role to play in literacy development. (Three tables of data are included and 16 references are attached.)",NA,NA,199-207,NA,https //psycnet.apa.org/record/1991-16850-001,NA,NA,NA
45336777,['Parental engagement'],Phillips (1990) PE,Phillips Linda M  Norris Stephen P  Mason Jana M  Kerr Bonnie M  ,1990,Effect of early literacy intervention on kindergarten achievement,NA,NA,Report,"This study identified differential effects on kindergarten achievement according to treatment type,community status, and school type. From a sample of 40, schools were grouped into rural village(drawing students form only one small community), rural collector (drawing students form a number of small communities), and urban. From each of these groupings, four schools were randomly selected. From each group of four, schools were assigned randomly to one of the treatment groups (Little Books used in the home only, Little Books used in the home and school, Little Books used in the school only, and control). Eighteen classes of kindergarten children from 12 schools participated in the study.Complete pretest and posttest data were obtained for 309 children. Quantitative analyses showed the children entering kindergarten in this study to be at risk of school failure. On average, urban kindergartners scored higher on all measures, and village and collector students scored about the same. Differences in posttest means were not related clearly to treatment. However, the Metropolitan Reading Readiness Pretest x Treatment interaction, which showed that the lowest achieving students profited most from the Little Books when they were used at home only and the highest achieving students when they used in school only, helps to support the hypothesis that the home has a crucial role to play in literacy development.",NA,NA,NA,NA,https //eric.ed.gov/?id=ED325832,Center for the Study of Reading,NA,NA
42025450,['Parental engagement'],Pigford (1987),Pigford T   ,1987,A study to investigate the effects of parent involvement on the mathematical achievement of first-grade pupils using a structured parent and teacher homework plan. ,Dissertation Abstracts International,NA,Dissertation,"This study was conducted in order to investigate the relationship between the achievement gains in mathematics of first-grade pupils who were taught mathematics using a structured parent and teacher homework plan and the gains in mathematics of first-grade pupils who were taught mathematics without such a plan. Specifically, this study identified beginning mathematics achievement levels of first-grade pupils from two elementary schools at the pre-kindergarten level, kindergarten level and on-grade-level. Beginning mathematics achievement levels were determined by a pretest using the mathematics curriculum used in Richland School District One called Progress and Review in Mathematics Education (PRIME). There were two posttest measures used. PRIME was one posttest measure and the mathematics portion of the Comprehensive Test of Basic Skills (CTBS) was used as the other posttest measure. The results of this investigation using PRIME as the pre and posttest measure showed that the first-grade pupils from the experimental school scored significantly better in mathematics achievement than the first-grade pupils from the control school when all of the first-grade pupils, pre-k level, and on-grade-level pupils were compared. Although the experimental first-grade pupils who were categorized as kindergarten level also scored better in mathematics achievement than the corresponding control group, this difference was not significant. The results of this investigation using the CTBS as the posttest measure showed that the first-grade pupils from the control school scored significantly better in mathematics achievement than the first-grade pupils from the experimental school when all first-grade pupils and the kindergarten level first-grade pupils were compared. However, there was no significant difference in mathematics achievement at the pre-k level or the on-grade-level.",NA,NA,1980,NA,https //search.proquest.com/docview/303611581,NA,NA,University of South Carolina
42025522,['Parental engagement'],Powell-Smith (2000),Powell-Smith Kelly A  Shinn Mark R  Stoner Gary   Good Roland H  III    ,2000,Parent Tutoring in Reading Using Literature and Curriculum Materials  Impact on Student Reading Achievement,School Psychology Review,NA,"Journal, Article","This study investigated the effects of two parent tutoring reading programs upon children's reading achievement  one that used children's literature books and one that used each child's classroom basal reading materials. Subjects were 36 student/parent pairs assigned randomly to two treatment groups and a control group. The 15-week study comprised 5 weeks of baseline, 5 weeks of treatment, and 5 weeks of follow-up. During treatment, tutoring occurred four times each week for 20 minutes per session. Treatment effects were evaluated using curriculum-based measurement. Results showed that although parents implemented the tutoring programs as designed, neither tutoring program had a significant effect upon student reading achievement. Some individual students in LB and CB groups did experience gains in reading achievement, however. Implications for future endeavors in parent tutoring in reading are discussed.",29,1,5-27,https //doi.org/10.1080/02796015.2000.12085995,NA,NA,NA,NA
42025506,['Parental engagement'],Rasinski (2005),Rasinski Timothy   Stevenson Bruce   ,2005,"The Effects of Fast Start Reading  A Fluency-BasedHome Involvement Reading Program, On the Reading Achievement of Beginning Readers",Reading Psychology,NA,"Journal, Article","This study tested the effects of a fluency-based home reading program called Fast Start. Thirty beginning first-grade students, representing a wide range of early reading abilities, were randomly assigned to experimental or control conditions for a period of 11 weeks. Parents and students in the experimental group received Fast Start training, weekly materials packets, and weekly telephone support. Control group parents and students received the parent involvement opportunities typical for their family and classroom. Significant effects for those students most at-risk in reading (as measured by pretest) were found on measures of Letter/Word recognition and reading fluency. Verbal and written survey information collected from the experimental group indicated generally positive perceptions of the program by parents.",26,2,109-125,https //doi.org/10.1080/02702710590930483,NA,NA,NA,NA
42025507,['Parental engagement'],Reutzel (2005),Reutzel D Ray  Fawson Parker C  Smith John A  ,2005,Words to go!  Evaluating a first‐grade parent involvement program for “making” words at home,Reading Research and Instruction,NA,"Journal, Article","Parents make powerful contributions to their children's early literacy learning in school. The purpose of this study was to design, implement, and evaluate the efficacy of the Words to Go parent involvement program as part of a larger effort to reach out to parents in early literacy. Quantitative data from surveys and qualitative data from focus group meetings were collected about the Words?to?Go program and demonstrated moderate to highly favorable perceptions among parents, teachers, and students. A pretest post test comparison of first?graders? word reading, word writing ability and criterion?referenced reading test performance in two matched elementary schools showed significant effects favoring the Words?to?Go program participants.",45,2,119-159,https //doi.org/10.1080/19388070609558445,NA,NA,NA,NA
42025508,['Parental engagement'],Rolla (2006),Rolla San Francisco  Andrea    Arias Melissa   Villers Renata   Snow Catherine   ,2006,Evaluating the impact of different early literacy interventions on low-income Costa Rican kindergarteners,International Journal of Educational Research,NA,"Journal, Article","Grade retention has been the de facto policy for children with academic difficulties in many Latin American countries [Schiefelbein, E., & Wolff, L. (1992). Repetition and inadequate achievement in Latin America’s primary schools  a review of magnitudes, causes, relationships, and strategies. Washington, DC  World Bank.]. In Costa Rica, 14.9% of public school children were retained in first grade in 2002. In a study of first grade classrooms in Costa Rica, children identified as in need of repeating first grade were found to have lower levels of reading ability [Rolla San Francisco, A., Arias, M., Villers, R., & Snow, C. (in press). The importance of reading skills, prereading skills, and family in teachers’ decisions to retain children  a case study in costa rica. Aula Abierta]. There has been a greater focus in recent years on the importance of prevention of educational difficulties, versus repetition, as the most cost-effective and efficient way of providing educational opportunities to low-income children. There is little rigorous research evaluating the impact of different interventions on the early literacy skills of low-income children in developing countries as a way to prevent posterior academic difficulties. This experimental study evaluated the differential impact of three early literacy interventions—tutoring, classroom activities, and work with families—on the emergent literacy skills of low-income Costa Rican kindergarteners. Tutoring or a combination of all three interventions were the most effective, while providing high-quality materials to teachers without training had no impact, but more intensive interventions of longer duration will probably be needed to ensure long-term impact on first grade repetition and eventual school dropout. Continuing research will assess the impact of these interventions on student outcomes and repetition rates in first grade, as well as exploring the impact of the more intensive intervention of professional development.",45,3,188-201,https //doi.org/10.1016/j.ijer.2006.11.002,http //www.sciencedirect.com/science/article/pii/S088303550600125X,NA,NA,NA
42025164,['Parental engagement'],Ryan (1964),Ryan E M  ,1964,A comparative study of the reading achievement of second grade pupils in programs characterized by a contrasting degree of parental participation.,NA,NA,Dissertation,The purpose of this study was to compare the reading achievement at second grade level in situations where contrast in the degree of parental participation was characterised in one instance by a planned program of parent participation and in the other instance by incidental participation of parents. ,NA,NA,NA,NA,https //www.proquest.com/docview/302131800,NA,NA,NA
42025510,['Parental engagement'],Saint-Laurent (2005),Saint-Laurent Lise   Giasson Jocelyne   ,2005,Effects of a family literacy program adapting parental intervention to first graders’ evolution of reading and writing abilities,Journal of Early Childhood Literacy,NA,"Journal, Article","This article reports on the effects of a family literacy program for first graders that had three main characteristics  (1) book reading with parents that adapts parental intervention to the child’s gradually increasing skills in reading during the school year, (2) support for writing activities, and (3) enjoyable home activities complementing the in-class teaching. The 108 participants were assigned to two treatment conditions  Workshop and Control. Pre- and post-test group comparisons indicate that the workshop program has a positive effect on the children’s performance in both reading and writing. Children produced longer texts and used better vocabulary, sentence structure and spelling. This study provides new data supporting the utility of family literacy programs by demonstrating their positive effect on writing. This confirms the importance of connecting reading and writing activities in family literacy at the beginning of learning and that parents should be invited by the teacher to intervene in these two areas rather than only in reading.",5,3,253-278,https //doi.org/10.1177/1468798405058688,NA,NA,NA,NA
42025511,['Parental engagement'],Saracho (1997),Saracho Olivia N  ,1997,Home Literacy Program and Children's Development of Literacy,Perceptual and Motor Skills,NA,"Journal, Article",This study assessed the relation between family's involvement in a home literacy program and children's development of literacy. Differences in outcomes between 48 children whose parents participated in a parent program and 54 whose parents did not were examined by multivariate analysis of variance which indicated significantly higher scores for the former children.,85,1,185-186,https //doi.org/10.2466/pms.1997.85.1.185,NA,NA,NA,NA
