75313922,Pozuelos (2019),2019,"Interventions including social scaffolding and metacognitive strategies have been used in educational settings to promote cognition. In addition, increasing evidence shows that computerized process‐based training enhances cognitive skills. However, no prior studies have examined the effect of combining these two training strategies. The goal of this study was to test the combined effect of metacognitive scaffolding and computer‐based training of executive attention in a sample of typically developing preschoolers at the cognitive and brain levels. Compared to children in the regular training protocol and an untrained active control group, children in the metacognitive group showed larger gains on intelligence and significant increases on an electrophysiological index associated with conflict processing. Moreover, changes in the conflict‐related brain activity predicted gains in intelligence in the metacognitive scaffolding group. These results suggest that metacognitive scaffolding boosts the influence of process‐based training on cognitive efficiency and brain plasticity related to executive attention. A few sessions of training with a process‐based program of executive attention combined with metacognitive scaffolding produce cognitive and brain function benefits. Also, changes in brain activation predict gains in intelligence following training.",['EY_Self-regulation strategies'],NA,,['EY_January 2023'],"Journal, Article",,['Journal article'],NA,NA,,['Spain'],,['Nursery school/pre-school'],NA,NA,,Low ecological validity,NA,requires specialist software and staff training,,"['4', '5']","['Page 4:\n[¬s]""63.6 (7.1)[¬e]""']",NA,,NA,NA,,NA,NA,,NA,NA,,['not_provided'],NA,"['Page 4:\n[¬s]""107 5- year- old children were recruited from various kin-\ndergartens[¬e]""']",,NA,NA,,NA,NA,,NA,NA,,['not_provided'],NA,"['Page 4:\n[¬s]""107 5- year- old children were recruited from various kin-\ndergartens[¬e]""']",,['Yes (Please specify)'],"['Page 5:\n[¬s]""Training + Metacognitive\nscaffolding (MT), Training + Corrective feedback (T), or Active Control\n(AC) groups.[¬e]""']",NA,,Random (please specify),"['Page 5:\n[¬s]""participants were randomly as-\nsigned to one of three intervention groups[¬e]""']",NA,,Individual,NA,NA,,['Individual RCT'],"['Page 5:\n[¬s]""participants were randomly as-\nsigned to one of three intervention groups[¬e]""']",NA,,Yes,"['Page 5:\n[¬s]""After pre-training assessment, participants were randomly as-\nsigned to one of three intervention groups: Training + Metacognitive\nscaffolding (MT), Training + Corrective feedback (T), or Active Control\n(AC) groups. Groups were matched for age, gender distribution, and\naverage composite intelligence (see Table 1)[¬e]""']",NA,,['Yes'],NA,working memory digit span,,['Cognitive outcomes measured (Please specify)'],NA,working memory digit span,,NA,NA,
75313897,Raver (2011),2011,"Based on theoretically driven models, the Chicago School Readiness Project (CSRP) targeted low-income children's school readiness through the mediating mechanism of self-regulation. The CSRP is a multicomponent, cluster-randomized efficacy trial implemented in 35 Head Start-funded classrooms (N = 602 children). The analyses confirm that the CSRP improved low-income children's self-regulation skills (as indexed by attention/impulse control and executive function) from fall to spring of the Head Start year. Analyses also suggest significant benefits of CSRP for children's preacademic skills, as measured by vocabulary, letter-naming, and math skills. Partial support was found for improvement in children's self-regulation as a hypothesized mediator for children's gains in academic readiness. Implications for programs and policies that support young children's behavioral health and academic success are discussed. ","['Metacognition and self-regulation', 'EY_Self-regulation strategies']",NA,,['EY_January 2023'],"Journal, Article",,['Journal article'],NA,NA,,['USA'],,['Nursery school/pre-school'],NA,NA,,Low ecological validity,NA,requires specialist training and onsite extra research staff ,,"['4', '5']",NA,NA,,9,"['Page 6:\n[¬s]""nine treatment\nsites[¬e]""']",,9,"['Page 6:\n[¬s]""9 control sites[¬e]""']",,18,"['Page 6:\n[¬s]""Within each of the nine treatment\nsites, 2 classrooms participated, for a total of 18\ntreatment classrooms. Across the 9 control sites,\nthere were 17 classrooms (2 classrooms in eight\nsites, and 1 classroom in the remaining site that lost[¬e]""']",,NA,NA,NA,,18,"['Page 6:\n[¬s]""18\ntreatment classrooms[¬e]""']",,17,"['Page 6:\n[¬s]""Across the 9 control sites,\nthere were 17 classrooms[¬e]""']",,35,NA,,NA,NA,NA,,['No'],NA,NA,,Random (please specify),"['Page 5:\n[¬s]""Pairwise matching and random-\nization procedures were used to match pairs of[¬e]""', 'Page 6:\n[¬s]""sites, with one member of each pair randomly\nassigned to treatment and the other member of the\npair assigned to the control group[¬e]""']",NA,,School - cluster,NA,NA,,['Cluster RCT'],"['Page 5:\n[¬s]""preschool\nsites were selected on the basis of (a) receipt of\nHead Start funding; (b) having two or more class-\nrooms that offered ‘‘full-day’’ programming; (c)\nlocation in one of seven high-poverty neighbor-\nhoods""\n""Randomization. Pairwise matching and random-\nization procedures were used to match pairs of[¬e]""', 'Page 6:\n[¬s]""sites, with one member of each pair randomly\nassigned to treatment and the other member of the\npair assigned to the control group[¬e]""']",NA,,Yes,"['Page 5:\n[¬s]""Randomization. Pairwise matching and random-\nization procedures were used to match pairs of[¬e]""', 'Page 6:\n[¬s]""sites, with one member of each pair randomly\nassigned to treatment and the other member of the\npair assigned to the control group[¬e]""']",NA,,['Yes'],"['Page 7:\n[¬s]""Balance Beam (Murray & Kochanska,\n2002) and Pencil Tap, which was adapted from the\npeg-tapping task (Blair, 2002; Diamond & Taylor,\n1996). In addition, four delay tasks were used to\ntap children’s EC skills and were adapted from the\nlab-based work of Kochanska and colleagues: Toy\nWrap, Toy Wait, Snack Delay, and Tongue Task[¬e]""']",NA,,['Cognitive outcomes measured (Please specify)'],NA,physical sensory motor coordination,,NA,NA,
75313928,Rueda (2012),2012,"Executive attention is involved in the regulation of thoughts, emotions and responses. This function experiences major development during preschool years and is associated to a neural network involving the anterior cingulate cortex and prefrontal structures. Recently, there have been some attempts to improve attention and other executive functions through training. In the current study, a group of 5 years old children (n=37) were assigned to either a training-group who performed ten sessions of computerized training of attention or a non-trained control group. Assessment of performance in a range of tasks, targeting attention, intelligence and regulation of affect was carried out in three occasions  (1) before, (2) after, and (3) two months after completion of training. Also, brain function was examined with a high-density electroencephalogram system. Results demonstrate that trained children activate the executive attention network faster and more efficiently than untrained children, an effect that was still observed two months after without further training. Also, evidence of transfer of attention training to fluid intelligence and, to a lesser degree, to regulation of affect was observed. Results show that efficiency of the brain system underlying self-regulation can be enhanced by experience during development, providing opportunities for curricular improvement.","['EY_Self-regulation strategies', 'Metacognition and self-regulation']",NA,,['EY_January 2023'],"Journal, Article",,['Journal article'],NA,NA,,['Spain'],,['Primary/elementary school'],"['Page 3:\n[¬s]""at an urban Primary School[¬e]""']",NA,,Low ecological validity,"['Page 3:\n[¬s]""Children in the trained group went through intervention with a set of computerized exercises for a total of ten 45- min sessions that were carried out over a period of 5 weeks (2 sessions per week). Those sessions were conducted indi- vidually for each participant in a quiet room at the school.""\n""Participants assigned to the control group underwent the\nsame number of sessions in similar conditions (individu-\nally with the experimenter and in a quiet room at school)\nbut watched cartoon videos instead.[¬e]""']",NA,,['5'],"['Page 3:\n[¬s]""mean age: 64.7\nmonths; SD: 3.2)[¬e]""']",NA,,1,"['Page 3:\n[¬s]""they all\nattended the same school.[¬e]""']",,1,"['Page 3:\n[¬s]""and they all\nattended the same schoo[¬e]""']",,1,"['Page 3:\n[¬s]""an urban Primary School[¬e]""']",,NA,NA,NA,,NA,NA,,NA,NA,,NA,NA,,['not_provided'],NA,NA,,['No'],NA,NA,,Random (please specify),"['Page 3:\n[¬s]""After completion of the ﬁrst session, children were\npseudo-randomly assigned to either the experimental\n(to-be-trained) or the control (untrained) group.[¬e]""']",NA,,Individual,"['Page 3:\n[¬s]""After completion of the ﬁrst session, children were\npseudo-randomly assigned to either the experimental\n(to-be-trained) or the control (untrained) group.[¬e]""']",NA,,['Individual RCT'],"['Page 3:\n[¬s]""After completion of the ﬁrst session, children were\npseudo-randomly assigned to either the experimental\n(to-be-trained) or the control (untrained) group.[¬e]""']",NA,,Yes,"['Page 3:\n[¬s]""After completion of the ﬁrst session, children were\npseudo-randomly assigned to either the experimental\n(to-be-trained) or the control (untrained) group. The\nassignment was made so children in each group would be\nmatched by gender, average intelligence and ﬂanker inter-\nference in the ANT. A[¬e]""']",NA,,['Yes'],NA,NA,,['Cognitive outcomes measured (Please specify)'],"['Page 4:\n[¬s]""The Kaufman Brief Intelligence Test (K-BIT; Kaufman\nand Kaufman, 1990)""\n""We used the children version of the ANT task (Rueda\net al., 2004a) to measure attenti[¬e]""']",this is the primary outcome,,NA,NA,
75313930,Schmitt (2015),2015,"The present study examined the efficacy of a self-regulation intervention for children experiencing demographic risk. Utilizing a randomized controlled design, analyses examined if children (N=276 children in 14 Head Start classrooms  M age=51.69, SD=6.55) who participated in an 8-week self-regulation intervention demonstrated greater gains in self-regulation and academic achievement over the preschool year compared to children in a control group. In addition, indirect intervention effects on achievement outcomes through self-regulation were explored and differential intervention effects for English language learners within a sample of children from low-income families were tested. Results indicated that children in the intervention group demonstrated stronger levels of self-regulation compared to the control group in the spring of the preschool year. Group comparisons also revealed that the intervention was related to significantly higher math skills for children who were English language learners. In other words, English language learners who participated in the intervention demonstrated stronger levels of math in the spring of preschool in comparison to children in the control group and relative to English speakers who also participated in the intervention. The present study provides support for the efficacy of a school readiness intervention in promoting self-regulation and achievement in young children, especially English language learners.","['EY_Self-regulation strategies', 'Metacognition and self-regulation']",NA,,['EY_January 2023'],"Journal, Article",,['Journal article'],NA,NA,,['USA'],,['Nursery school/pre-school'],"['Page 5:\n[¬s]""The current sample consisted of 276 children (49% boys)\nenrolled in 14 Head Start classrooms across nine sites located in a\nPaciﬁc Northwest city. Each site was part of a public school district’s\nHead Start program[¬e]""']",NA,,High ecological validity,"['Page 4:\n[¬s]""in the present study, we random-\nized at the classroom level in order to evaluate the ef?cacy of the\nintervention as implemented in typical classroom settings""\n""One example of a game\nused in the intervention is called Red Light, Purple Light. Similar to\nthe children’s game Red Light, Green Light, a researcher acted as\na stoplight and held up different-colored construction paper cir-\ncles to represent stop and go[¬e]""']",although in this case it might have been implemented by a researcher,,"['3', '4', '5']","['Page 5:\n[¬s]""Participants ranged in age from 37.98 to 66.04 months (M = 51.69,\nSD = 6.55),[¬e]""']",NA,,NA,NA,,NA,NA,,9,"['Page 5:\n[¬s]""across nine sites l[¬e]""']",,NA,NA,NA,,7,"['Page 5:\n[¬s]""14 classrooms across nine\nsites were randomly assigned to the intervention group (n = 7; chil-\ndren = 126)[¬e]""']",,7,"['Page 5:\n[¬s]""14 classrooms across nine\nsites were randomly assigned to the intervention group (n = 7; chil-\ndren = 126) or the control group (n = 7; children = 150[¬e]""']",,14,"['Page 5:\n[¬s]""The current sample consisted of 276 children (49% boys)\nenrolled in 14 Head Start classrooms[¬e]""']",,NA,NA,NA,,['No'],NA,NA,,Random (please specify),"['Page 2:\n[¬s]""randomized controlled design[¬e]""']",NA,,Class,"['Page 4:\n[¬s]""in the present study, we random-\nized at the classroom level in order to evaluate the efﬁcacy of the\nintervention as implemented in typical classroom settings[¬e]""', 'Page 5:\n[¬s]""In the winter of the preschool year, 14 classrooms across nine\nsites were randomly assigned to the intervention group (n = 7; chil-\ndren = 126) or the control group (n = 7; children = 150) to evaluate[¬e]""']",NA,,['Multisite RCT'],"['Page 5:\n[¬s]""In the winter of the preschool year, 14 classrooms across nine\nsites were randomly assigned to the intervention group (n = 7; chil-\ndren = 126) or the control group (n = 7; children = 150) to evaluate\nthe intervention as a classroom-based program.[¬e]""']",NA,,Yes,"['Page 5:\n[¬s]""In the winter of the preschool year, 14 classrooms across nine\nsites were randomly assigned to the intervention group (n = 7; chil-\ndren = 126) or the control group (n = 7; children = 150) to evaluate\nthe intervention as a classroom-based program. Three sites h[¬e]""', 'Page 6:\n[¬s]""classroom each randomly assigned to the intervention, and 3 sites\nhad one classroom each randomly assigned to the control group.\nTwo sites had one classroom randomly assigned to the intervention\ngroup and one classroom randomly assigned to the control group.\nOne site had two classrooms randomly assigned to the intervention\nand two classrooms randomly assigned to the control group.[¬e]""']",NA,,['Yes'],NA,NA,,"['Other types of student outcomes (Please specify)', 'Cognitive outcomes measured (Please specify)']","['Page 7:\n[¬s]""Teacher ratings of behavioral self-regulation""\n""Child Behavior Rating Scale\n(CBRS;""\n""Direct measures of behavioral self-regulation\nThe Head-Toes-Knees-Shoulders Task (HTKS),[¬e]""', 'Page 7:\n[¬s]""A Card Sorting task that was based on the Dimensional Change\nCard Sort (DCCS; Frye, Zelazo, & Palfai, 1995), a measure of chil-\ndren’s cognitive or attentional ﬂexibility[¬e]""']",NA,,NA,NA,
75313935,Zhang (2019),2019,"Executive function (EF), its importance for scholastic achievement and the question of whether or not EF is malleable, have become a topic of intense interest. Education or schooling is often seen as effective approaches to enhance EF due to the specific school‐related requirements as compared to kindergarten or pre‐school. However, no study to date has investigated whether targeted training focusing on those domains might be comparable with regular schooling in improving EF and fluid intelligence (Gf). The aim of the present study was to replicate and extend the previously demonstrated schooling effects on EF by using a school‐cutoff design, and to further investigate whether a theoretically motivated intervention targeting specific EF, i.e., working memory (WM) or inhibitory control (IC), could achieve comparable effects with schooling in both, WM and IC, as well as Gf. 91 6‐year‐old kindergarteners and first‐graders with similar chronological age participated the study. We compared the performance of a first‐grade schooling group with that of two kindergarten training groups as well as a business‐as‐usual kindergarten control group. Participants were assessed in WM, IC and Gf at baseline, immediately after the intervention (posttest), as well as 3 months after training completion (follow‐up). The results showed that the schooling group indeed outperformed the kindergarten groups at baseline in several cognitive tasks. Furthermore, both the WM and IC training showed pronounced gains in the trained tasks, as well as varying degrees of improvement in non‐trained outcome measures. Most importantly, both training groups achieved comparable performance with the schooling group, which was especially apparent in Gf at follow‐up. Our findings provide further evidence for the malleability of EF demonstrating that both, long‐term and short‐term interventions can facilitate the acquisition of those important skills, and as such, our work has important implications for educational practice. Comparing first graders and kindergartners with similar chronological age at baseline, we observed so‐called schooling effects which were most pronounced in a test of fluid reasoning. However, targeted training that focused on either working memory or inhibitory control led to improvements in fluid reasoning as observed three months after training completion. Kindergartners who received targeted training were ultimately able to catch up with their first‐grade peers.","['EY_Self-regulation strategies', 'Metacognition and self-regulation']",NA,,['EY_January 2023'],"Journal, Article",,['Journal article'],NA,NA,,['China'],,['Primary/elementary school'],"['Page 3:\n[¬s]""Ninety- one typically- developing children (25 “young” first grad- ers and 66 “old” kindergarteners;""\n""The two kindergarten training groups completed a 15- min\nintervention each day, 4 times per week, for a total of 20 sessions\nin addition to their kindergarten routine activities.[¬e]""']",NA,,Unclear,"['Page 3:\n[¬s]""Two child- friendly tasks were used for the IC intervention: An adap-\ntive stop- signal task (Berkman, Kahn, & Merchant, 2014), and a mod-\nified Stroop task (Rueda et al., 2012)[¬e]""', 'Page 4:\n[¬s]""Stop- signal task\nThe go stimuli comprised of a strawberry and a peach (150 × 150\npixels in size) (see Figure 1b). Participants were instructed to press\n‘F’ when a strawberry appeared and ‘J’ when a peach did (go- trials),\nbut they had to inhibit their response when an apple (150 × 150\npixels in size) appeared shortly after the presentation of the go-\nstimulus (stop- trials). Each trial began with a central fixation lasting\nfor 500 ms, followed by a go- stimulus with a 1,500 ms duration in\nthe case of go- trials.""\n""Modified stroop task\nThe conflicting dimensions were number and size (see Figure 1c).\nThe task included two versions with different stimuli (either fruits\nor animals). In each trial, participants were presented with various\nnumbers of cherries (or mice) and watermelons (or elephants) at\nthe same time, and they were asked to indicate which set had more\nthan the other, irrespective of fruit/animal size. T[¬e]""']",it doesn't specify who delivered the intervention. Not whether there is training and how much involve,,['6'],"['Page 3:\n[¬s]""66 “old” kindergarteners; mean age: 73.50 months; SD: 2.10)[¬e]""']",NA,,NA,NA,,NA,NA,,NA,NA,,['not_provided'],NA,NA,,NA,NA,,NA,NA,,NA,NA,,['not_provided'],NA,NA,,['Yes (Please specify)'],"['Page 3:\n[¬s]""4 (groups: SG/WM training group/IC training\ngroup/CG)""\n""The first graders (11 girls) who participated\nin regular school classes and activities made up the schooling group\n(SG""\n""Among the kindergar-\nteners, 22 children (10 girls) were assigned to the business- as- usual\nkindergarten control group (CG""\n""he remaining 44 children were as-\nsigned to either the WM training group or the IC training group. Two\nchildren withdrew from the study after the pretest (one from the\nWM group, and one from the IC group).[¬e]""']",we are interested only in the IC (inhibitory control) vs control here,,"Non-random, not matched prior to treatment",NA,"it does not mention random assignment, so it is pressumed it's not random",,Individual,"['Page 3:\n[¬s]""inety- one typically- developing children (25 “young” first grad- ers and 66 “old” kindergarteners; mean age: 73.50 months; SD: 2.10) from a primary school and two kindergartens in Hangzhou (China) participated the study. T""\n""The remaining 44 children were as-\nsigned to either the WM training group or the IC training group. Two\nchildren withdrew from the study after the pretest (one from the\nWM group, and one from the IC group)[¬e]""']",NA,,['Prospective QED'],NA,"it does not mention random assignment, so it is pressumed it's not random",,No/Unclear,NA,NA,,['Yes'],NA,NA,,['Cognitive outcomes measured (Please specify)'],"['Page 5:\n[¬s]""Raven’s Standard Progressive Matrices (RSPM""\n""Backward Digit Span Task (BDST;""\n""AX- CPT (Braver,[¬e]""']",NA,,NA,NA,
