id,pub_author,pub_year,abstract,strand_raw,strand_info,strand_CLEAN,toolkit_version,pub_eppi,pub_eppi_CLEAN,pub_type_raw,pubtype_ht,pubtype_info,pub_type_CLEAN,loc_country_raw,loc_country_CLEAN,int_setting_raw,int_setting_ht,int_setting_info,int_Setting_CLEAN,eco_valid_raw,eco_valid_ht,eco_valid_info,eco_valid_CLEAN,part_age_raw,part_age_ht,part_age_info,part_age_CLEAN,school_treat_info,school_treat_ht,school_treat_CLEAN,school_cont_info,school_cont_ht,school_cont_CLEAN,school_total_info,school_total_ht,school_total_CLEAN,school_na_raw,school_na_info,school_na_ht,school_na_CLEAN,class_treat_info,class_treat_ht,class_treat_CLEAN,class_cont_info,class_cont_ht,class_cont_CLEAN,class_total_info,class_total_ht,class_total_CLEAN,class_na_raw,class_na_info,class_na_ht,class_na_CLEAN,treat_group_raw,treat_group_ht,treat_group_info,treat_group_CLEAN,part_assig_raw,part_assig_ht,part_assig_info,part_assig_CLEAN,level_assig_raw,level_assig_ht,level_assig_info,level_assig_CLEAN,int_desig_raw,int_design_ht,int_design_info,int_design_CLEAN,rand_raw,rand_ht,rand_info,rand_CLEAN,out_other_raw,out_other_ht,out_other_info,out_other_CLEAN,out_info_raw,out_info_ht,out_info_info,out_info_CLEAN,part_other_ht,part_other_info,part_other_CLEAN
47063511,Barnett (2008),2008,"The effectiveness of the Tools of the Mind (Tools) curriculum in improving the education of 3- and 4-year-old children was evaluated by means of a randomized trial. The Tools curriculum, based on the work of Vygotsky, focuses on the development of self-regulation at the same time as teaching literacy and mathematics skills in a way that is socially mediated by peers and teachers and with a focus on play. The control group experienced an established district-created model described as a 'balanced literacy curriculum with themes.' Teachers and students were randomly assigned to either treatment or control classrooms. Children (88 Tools and 122 control) were compared on social behavior, language, and literacy growth. The Tools curriculum was found to improve classroom quality and children's executive function as indicated by lower scores on a problem behavior scale. There were indications that Tools also improved children's language development, but these effects were smaller and did not reach conventional levels of statistical significance in multi-level models or after adjustments for multiple comparisons. Our findings indicate that a developmentally appropriate curriculum with a strong emphasis on play can enhance learning and development so as to improve both the social and academic success of young children. Moreover, it is suggested that to the extent child care commonly increases behavior problems this outcome may be reversed through the use of more appropriate curricula that actually enhance self-regulation. ","['Metacognition and self-regulation', 'EY_Self-regulation strategies', 'EY_Play-based learning']",NA,,['EY_January 2023'],"Journal, Article",,['Journal article'],NA,NA,,['USA'],,['Nursery school/pre-school'],"['Page 4:\n[¬s]""Abbott programs are open to all children at ages three and four""\n""ﬁnanced full-day “Abbott” preschool education program[¬e]""']",NA,,High ecological validity,"['Page 4:\n[¬s]""In Tools, the teacher’s role is not just to teach skills or facts, but to help children use tools and to learn to develop tools to\nfacilitate learning[¬e]""', 'Page 6:\n[¬s]""All the teachers chosen to participate in the study freely agreed to do so and signed informed consent. For their participa-\ntion, teachers were given a $100 honorarium plus $300 worth of educational supplies for their classrooms.""\n""During the school year Tools teachers received 30min classroom visits approximately once a week from a Tools trainer\nto address any difﬁculties they were having with the curriculum.[¬e]""']",although it requires learning by the teachers,,"['3', '4']","['Page 1:\n[¬s]""3- and 4-year-old children[¬e]""', 'Page 6:\n[¬s]""he sample was composed of slightly more 4-year olds (54%) than 3-year olds reﬂecting overall participation\nrates in the program[¬e]""']",NA,,1,"['Page 4:\n[¬s]""The school selected for this research study[¬e]""']",,1,"['Page 4:\n[¬s]""The school selected for this research study[¬e]""']",,1,"['Page 4:\n[¬s]""The school selected for this research study[¬e]""']",,NA,NA,NA,,7,"['Page 5:\n[¬s]""seven classrooms on one ﬂoor of the school for implementation of the\nTools curriculum[¬e]""']",,11,"['Page 5:\n[¬s]""Eleven classrooms on another ﬂoor were available for the control condition[¬e]""']",,18,"['Page 5:\n[¬s]""District administrators offered the research team seven classrooms on one ﬂoor of the school for implementation of the\nTools curriculum. Eleven classrooms on another ﬂoor were available for the control condition.[¬e]""']",,NA,NA,NA,,['No'],NA,NA,,Random (please specify),"['Page 1:\n[¬s]""nwas evaluated by means ofa randomized trial.[¬e]""', 'Page 5:\n[¬s]""District administrators offered the research team seven classrooms on one ﬂoor of the school for implementation of the\nTools curriculum. Eleven classrooms on another ﬂoor were available for the control condition. Teachers and assistants were\nrandomly assigned to the classrooms for fall of 2002.""\n""Given the small number ofteachers, random assignment by blockswas used to ensure that treatmentwas not confounded\nwith key teacher characteristics. Speciﬁcally, teacherswere stratiﬁed into four groups: eight teachers with a preschool-grade\nthree license (P-3); four teachers with a K-8 license who were grandfathered (requires two full years of preschool teaching\nexperience for preschool validation); four teachers with a N-8 license (an older certiﬁcate that preceded the P-3); and two\nteachers transferred from another school within the district (unlike the others, they did not choose to work at this school\nbut were relocated there by the district). Two teachers from each of the ﬁrst three groups and one teacher from the last were\nrandomly chosen for the Tools classrooms.""\n""Efforts were made to control treatment diffusion (Cook & Shadish, 1994) between the two groups of teachers by placing\nall the treatment classes on one ﬂoor of the building and all the control classes on another ﬂoor. This restriction of each\ncurriculum to separate ﬂoors ofthe building resulted in unequal numbers ofclassrooms in the treatment and control groups.""\n""The smaller ﬂoor was used for Tools because it meant lower costs for training and technical assistance from outside the\ndistrict. In addition, treatment group teachers signed documents in which they pledged not to divulge the practices they\nwere learning to other teachers while the study was underway.[¬e]""']",NA,,Individual,"['Page 5:\n[¬s]""A total of 274 three- and four-year-old children were randomly assigned to either Tools curriculum classrooms (n=106)\nor district curriculum classrooms (n=168).[¬e]""']",NA,,['Individual RCT'],"['Page 5:\n[¬s]""children were randomly assigned to classrooms""\n""A total of 274 three- and four-year-old children were randomly assigned to either Tools curriculum classrooms (n=106)\nor district curriculum classrooms (n=168).[¬e]""']",NA,,Yes,"['Page 5:\n[¬s]""District administrators offered the research team seven classrooms on one ﬂoor of the school for implementation of the\nTools curriculum. Eleven classrooms on another ﬂoor were available for the control condition. Teachers and assistants were\nrandomly assigned to the classrooms for fall of 2002. The district also provided the investigators with a list of children\nregistered for preschool education (n=274) at the research site, and these children were randomly assigned to classrooms\nbefore the start of school, as well.[¬e]""']",NA,,['Yes'],NA,NA,,['Other types of student outcomes (Please specify)'],"['Page 7:\n[¬s]""The Social Skills Rating System (SSRS) w[¬e]""']",behavioral/social,,"['Page 8:\n[¬s]""The Early Childhood Environmental Rating Scale-Revised (ECERS-R) provides a global look at classroom quality with 43 indicators ranging from safety, teacher–child interaction to parent involvement""\n""The Supports for Early Literacy Assessment (SELA) was used to examine the quality of the literacy environment and\ninstruction""\n""The Preschool Classroom Implementation (PCI) rating scale (Frede, 1989) measures the frequency of use of scaffolding\ntechniquesby teachers in their interactions with children.[¬e]""']",teachers classroom environment,
75313870,Blair (2014),2014,"Effective early education is essential for academic achievement and positive life outcomes, particularly for children in poverty. Advances in neuroscience suggest that a focus on self-regulation in education can enhance children's engagement in learning and establish beneficial academic trajectories in the early elementary grades. Here, we experimentally evaluate an innovative approach to the education of children in kindergarten that embeds support for self-regulation, particularly executive functions, into literacy, mathematics, and science learning activities. Results from a cluster randomized controlled trial involving 29 schools, 79 classrooms, and 759 children indicated positive effects on executive functions, reasoning ability, the control of attention, and levels of salivary cortisol and alpha amylase. Results also demonstrated improvements in reading, vocabulary, and mathematics at the end of kindergarten that increased into the first grade. A number of effects were specific to high-poverty schools, suggesting that a focus on executive functions and associated aspects of selfregulation in early elementary education holds promise for closing the achievement gap.","['Metacognition and self-regulation', 'EY_Self-regulation strategies']",NA,,['EY_January 2023'],"Journal, Article",,['Journal article'],NA,NA,,['USA'],,['Primary/elementary school'],"['Page 3:\n[¬s]""Schools signed a\nmemorandum of understanding in which they agreed to accept\nrandom assignment to the treatment or control group, to remain\nin the assigned condition for two years, to facilitate data collection,\nand if randomly assigned to the treatment group to facilitate the\ntraining and coaching. Schools were blocked according to district,[¬e]""']",not specified but believed to be elementary schools with K classes,,High ecological validity,"['Page 4:\n[¬s]""Teachers and teaching assistants in the Tools of the Mind\nclassrooms were trained in a 2-year professional development\ncycle.[¬e]""']",NA,,"['5', '6']",NA,NA,,16,"['Page 3:\n[¬s]""Schools were blocked according to district,\npercent of students eligible for free or reduced-price lunch, school\nsize, state test scores, and number of kindergarten classrooms, and\nrandomly assigned to the treatment [N= 16][¬e]""']",,13,"['Page 3:\n[¬s]""control [N=13][¬e]""']",,29,"['Page 1:\n[¬s]""involving 29 school[¬e]""']",,NA,NA,NA,,42,"['Page 3:\n[¬s]""N=42 treatment[¬e]""']",,37,"['Page 3:\n[¬s]""N=37 control.[¬e]""']",,79,"['Page 1:\n[¬s]""79 classrooms[¬e]""']",,NA,NA,NA,,['No'],NA,NA,,Random (please specify),"['Page 3:\n[¬s]""Schools were blocked according to district, percent of students eligible for free or reduced-price lunch, school size, state test scores, and number of kindergarten classrooms, and randomly assigned to the treatment [N= 16] or control [N=13] group.""\n""Block randomization on multiple variables led to small and acceptable differences in the number of schools randomized to the treatment vs. control groups""\n""We attempted to recruit six children per classroom in each of\nthe two years of the study. Recruitment was conducted through\nflyers sent to children’s homes and through parent night activities.\nParents provided written consent for children to participate and\nchildren provided verbal assent. In instances in which more than 6\nchildren in a classroom expressed interest in participation, we\nenrolled the first 6 children for whom consent forms were returned\nby parents and assigned all other children with returned consents\nto a waiting list.[¬e]""']",NA,,School - cluster,"['Page 3:\n[¬s]""Schools were blocked according to district,\npercent of students eligible for free or reduced-price lunch, school\nsize, state test scores, and number of kindergarten classrooms, and\nrandomly assigned to the treatment [N= 16] or control [N=13]\ngroup. Block randomization on multiple variables led to small and\nacceptable differences in the number of schools randomized to the\ntreatment vs. control groups. Most schools included two partic-\nipating kindergarten classrooms. We made an exception for 2\nschools in the participating districts in which all of the district’s\nkindergarten classrooms were housed in one facility.[¬e]""']",NA,,['Cluster RCT'],"['Page 3:\n[¬s]""Schools were blocked according to district,\npercent of students eligible for free or reduced-price lunch, school\nsize, state test scores, and number of kindergarten classrooms, and\nrandomly assigned to the treatment [N= 16] or control [N=13]\ngroup.[¬e]""']",NA,,Yes,"['Page 3:\n[¬s]""Schools were blocked according to district, percent of students eligible for free or reduced-price lunch, school size, state test scores, and number of kindergarten classrooms, and randomly assigned to the treatment [N= 16] or control [N=13] group.""\n""Block randomization on multiple variables led to small and acceptable differences in the number of schools randomized to the treatment vs. control groups. Most schools included two partic- ipating kindergarten classrooms. We made an exception for 2 schools in the participating districts in which all of the district’s kindergarten classrooms were housed in one facility.""\n""For these two\nschools, random assignment was at the classroom level and the\nschool was treated as two schools for analysis purposes.[¬e]""']",NA,,['Yes'],NA,NA,,"['Other types of student outcomes (Please specify)', 'Cognitive outcomes measured (Please specify)']","['Page 5:\n[¬s]""Indicators of neuroendocrine function, cortisol and alpha amylase, were obtained through unstimulated whole saliva collected using hydrocellulose absorbent material and expressing sample by centrifugation. S""\n""Samples were also assayed for alpha amylase using a\ncommercially available kinetic reaction assay[¬e]""', 'Page 4:\n[¬s]""The measure of general reasoning was the Raven Colored\nProgressive Matrices test [51]. The Raven test is a measure of fluid\nintelligence in which children are presented with a series of plates\ncontaining patterns from which a single uniformly shaped piece is\nmissing.[¬e]""', 'Page 5:\n[¬s]""ontrol attention in the face of\nemotional distraction using a Dot-Probe task,[¬e]""']",NA,,NA,NA,
75313883,Flook (2015),2015,"Self-regulatory abilities are robust predictors of important outcomes across the life span, yet they are rarely taught explicitly in school. Using a randomized controlled design, the present study investigated the effects of a 12-week mindfulness-based Kindness Curriculum (KC) delivered in a public school setting on executive function, self-regulation, and prosocial behavior in a sample of 68 preschool children. The KC intervention group showed greater improvements in social competence and earned higher report card grades in domains of learning, health, and social-emotional development, whereas the control group exhibited more selfish behavior over time. Interpretation of effect sizes overall indicate small to medium effects favoring the KC group on measures of cognitive flexibility and delay of gratification. Baseline functioning was found to moderate treatment effects with KC children initially lower in social competence and executive functioning demonstrating larger gains in social competence relative to the control group. These findings, observed over a relatively short intervention period, support the promise of this program for promoting self-regulation and prosocial behavior in young children. They also support the need for future investigation of program implementation across diverse settings. ",['EY_Self-regulation strategies'],NA,,['EY_January 2023'],"Journal, Article",,['Journal article'],NA,NA,,['USA'],,['Primary/elementary school'],"['Page 2:\n[¬s]""from six different elementary\nschools w[¬e]""']",NA,,Low ecological validity,"['Page 2:\n[¬s]""The curriculum was taught by experienced mindful-\nness instructors in a secular manner and was provided universally\nto children as part of their standard classroom instruction during\nregular school hours[¬e]""']",NA,,['4'],"['Page 2:\n[¬s]""with a mean age of4.67 years (SD ⫽ .27)[¬e]""']",NA,,NA,NA,,NA,NA,,6,"['Page 2:\n[¬s]""from six different elementary[¬e]""']",,NA,NA,NA,,3,"['Page 2:\n[¬s]""(n ⫽ 30 from three classrooms and 38 from\nfour classrooms, for KC and control group respectively)[¬e]""']",,4,NA,,7,"['Page 2:\n[¬s]""Seven classrooms were recruited f""\n""(n ⫽ 30 from three classrooms and 38 from\nfour classrooms, for KC and control group respectively)[¬e]""']",,NA,NA,NA,,['No'],NA,NA,,Random (please specify),"['Page 1:\n[¬s]""randomized controlled design[¬e]""']",NA,,Class,"['Page 2:\n[¬s]""Participants were randomly assigned by classroom to either a\nmindfulness-based “Kindness Curriculum” (KC) intervention or a\nwait-list control group (n ⫽ 30 from three classrooms and 38 from\nfour classrooms, for KC and control group respectively)[¬e]""']",NA,,['Cluster RCT'],"['Page 2:\n[¬s]""Participants were randomly assigned by classroom to either a\nmindfulness-based “Kindness Curriculum” (KC) intervention or a\nwait-list control group (n ⫽ 30 from three classrooms and 38 from\nfour classrooms, for KC and control group respectively[¬e]""']",NA,,Yes,"['Page 2:\n[¬s]""Participants were randomly assigned by classroom to either a\nmindfulness-based “Kindness Curriculum” (KC) intervention or a\nwait-list control group (n ⫽ 30 from three classrooms and 38 from\nfour classrooms, for KC and control group respectively). P[¬e]""']",NA,,['Yes'],NA,NA,,"['Other types of student outcomes (Please specify)', 'Cognitive outcomes measured (Please specify)']","['Page 1:\n[¬s]""social competence""\n""health""\n""social-emotional development,[¬e]""', 'Page 2:\n[¬s]""Teacher-rated social competence (TSC)""\n""e Teacher Social Competence Scale (Conduct Problems\nPrevention Research Group, 1995)[¬e]""', 'Page 3:\n[¬s]""Sharing task[¬e]""', 'Page 3:\n[¬s]""Delay of gratification. T""\n""Dimensional change card sort task (DCCS). A""\n""A computer-\nized version of the dimensional change card sort (DCCS) task""\n""Flanker task. A computerized Flanker task, also from the\nNIH Toolbox Cognitive Function Battery[¬e]""']",NA,,NA,NA,
55203434,Ford (2009),2009,"Thirty preschoolers from low‐income families participated in a 12‐month intervention programme, funded by Sure Start, which engaged them in scaffolded educational activities delivered at home by their mothers. Immediately following the programme, the intervention group outperformed matched controls in tests of academic knowledge, receptive vocabulary, and inhibitory control, but not short‐term memory or theory of mind. Teachers' ratings of children's capabilities upon school entry favoured the intervention group, especially in terms of listening, responding, writing, mathematics, and personal/social skills. Superior inhibitory control, short‐term memory, and numerical skills were associated with higher ratings whereas theory of mind made a unique, negative contribution to responding. We discuss the implications of these findings for efforts to nurture the development of cognitive self‐regulation and school readiness during early childhood.","['EY_Communication and language approaches', 'EY_Self-regulation strategies', 'Oral language interventions', 'Metacognition and self-regulation', 'Parental engagement', 'EY_Parental engagement']",NA,,['EY_January 2023'],"Journal, Article",,['Journal article'],NA,NA,,['Wales'],,['Nursery school/pre-school'],"['Page 6:\n[¬s]""37.0 months[¬e]""']",NA,,Low ecological validity,NA,requires extensive resources for home visits,,"['3', '4']","['Page 6:\n[¬s]""intervention group had a\nmean age of a 37.0 months[¬e]""', 'Page 6:\n[¬s]""The intervention group had a\nmean age of a 37.0 months at the start of the intervention, 50.6 months at the time of the\nﬁrst post-intervention assessment, and 54.6 months at the time of the second post-\nintervention assessment (SD ¼ 4:3). The control group had a mean age of 36.7 months\nat the start of the intervention, 50.3 months at the time of the ﬁrst post-intervention\nassessment, and 54.3 months at the time of the second post-intervention assessment\n(SD ¼ 4:0).[¬e]""']",NA,,NA,NA,,NA,NA,,NA,NA,,['not_provided'],NA,NA,,NA,NA,,NA,NA,,NA,NA,,['not_provided'],NA,NA,,['No'],"['Page 6:\n[¬s]""participants were 60 young children, comprising an intervention group and a\ncontrol group[¬e]""']",NA,,Random (please specify),"['Page 7:\n[¬s]""assignment to the intervention was decided by a lottery""\n""In carrying out the lottery, families were grouped according to child’s age and gender, intended school, highest level of education of the primary caregiver, and whether the family had any paid employment.""\n""randomly assigned to one of two groups,[¬e]""']",NA,,Individual,"['Page 7:\n[¬s]""families who agreed to participate would be\nrandomly assigned to one of two groups[¬e]""']",assigned by participating family ,,['Individual RCT'],NA,NA,,Yes,"['Page 7:\n[¬s]""assignment to the intervention\nwas decided by a lottery conducted by the university researchers. In carrying out the\nlottery, families were grouped according to child’s age and gender, intended school,\nhighest level of education of the primary caregiver, and whether the family had any paid\nemployment[¬e]""']",NA,,['No'],NA,NA,,NA,NA,NA,,NA,NA,
