77945731,Hong (2012),2012,"The present study examined the efficacy of two different approaches to teaching designed to facilitate children's learning about science concepts and vocabulary related to objects’ floating and sinking and scientific problem-solving skills  responsive teaching (RT) and the combination of responsive teaching and explicit instruction (RT + EI). Participants included 104 children (51 boys) aged four to five years. Small groups of children were randomly assigned to one of the two intervention groups (RT, RT + EI) or to a control group. Responsive teaching (RT) reflects a common approach to teaching young children, and the combination approach (RT + EI) includes explicit instruction as well as responsive teaching. The two planned interventions were implemented with preschool children and provided evidence that (1) young children learned science concepts and vocabulary better when either responsive teaching or the combination of responsive teaching and explicit instruction was used  (2) children in the combined intervention group learned more science concepts and vocabulary and more content-specific scientific problem-solving skills than children in either the responsive teaching or control groups. Limitations, future directions, and implications for practice are also discussed.",['EY_Self-regulation strategies'],NA,,['EY_January 2023'],"Journal, Article",,['Journal article'],NA,NA,,['USA'],,['Nursery school/pre-school'],"['Page 2:\n[¬s]""attending early childhood\nprograms in a mid-size midwestern community and their par-\nents. Fifty-one children attended half-day (n = 10 classrooms), and\n53 attended full-day early childhood programs (n = 8 classrooms).[¬e]""']",NA,,High ecological validity,"['Page 3:\n[¬s]""In the RT intervention, the lessons were taught by choosing\nand providing materials that would promote an understanding of\nsinking and ﬂoating. The implementer in this intervention con-\ndition described children’s behavior, commented on and asked\nquestions about what children did and said, but did not provide[¬e]""']",not a lot of extra resources are required and it can be embeded in the teaching easily   even though in this case the experiment happen by the researcher,,"['4', '5']","['Page 1:\n[¬s]""aged four to ﬁve years.[¬e]""', 'Page 2:\n[¬s]""(mean age = 57.6 months; SD = 5.6)[¬e]""']",NA,,NA,NA,,NA,NA,,NA,NA,,['not_provided'],NA,NA,,NA,NA,,NA,NA,,18,"['Page 2:\n[¬s]""ifty-one children attended half-day (n = 10 classrooms), and\n53 attended full-day early childhood programs (n = 8 classrooms).[¬e]""']",,NA,NA,NA,,['Yes (Please specify)'],"['Page 1:\n[¬s]""Small groups of children were randomly assigned to one of the two intervention groups (RT, RT + EI) or\nto a control group.[¬e]""']",NA,,Random (please specify),"['Page 3:\n[¬s]""After pretest, children were randomly assigned to small group\ninstruction with one to three classmates (35 groups), and the small\ngroups were then randomly assigned to an instructional condition:\nResponsive Teaching (RT; n = 35 children), Responsive Teaching\nand Explicit Instruction (RT + EI; n = 37), and Control (n = 32)[¬e]""']",NA,,School - multi-site,"['Page 3:\n[¬s]""When\nthere was more than one small group from a single classroom,\nthose groups were assigned to different instructional conditions.\nThe pretest results did not affect how children were assigned to\ngroups. Each child was pulled out from his or her classroom to par-\nticipate in the intervention group in order to reduce contamination\nfrom classroom materials, peers, and adults.[¬e]""']",NA,,['Multisite RCT'],"['Page 3:\n[¬s]""After pretest, children were randomly assigned to small group\ninstruction with one to three classmates (35 groups), and the small\ngroups were then randomly assigned to an instructional condition:\nResponsive Teaching (RT; n = 35 children), Responsive Teaching\nand Explicit Instruction (RT + EI; n = 37), and Control (n = 32). When\nthere was more than one small group from a single classroom,\nthose groups were assigned to different instructional conditions.\nThe pretest results did not affect how children were assigned to\ngroups. Each child was pulled out from his or her classroom to par-\nticipate in the intervention group in order to reduce contamination\nfrom classroom materials, peers, and adults.[¬e]""']",NA,,Yes,"['Page 3:\n[¬s]""After pretest, children were randomly assigned to small group\ninstruction with one to three classmates (35 groups), and the small\ngroups were then randomly assigned to an instructional condition:\nResponsive Teaching (RT; n = 35 children), Responsive Teaching\nand Explicit Instruction (RT + EI; n = 37), and Control (n = 32). When\nthere was more than one small group from a single classroom,\nthose groups were assigned to different instructional conditions.\nThe pretest results did not affect how children were assigned to\ngroups. Each child was pulled out from his or her classroom to par-\nticipate in the intervention group in order to reduce contamination\nfrom classroom materials, peers, and adults.[¬e]""']",NA,,['Yes'],NA,NA,,NA,NA,NA,,"['Page 5:\n[¬s]""A measure of parent–child academic interaction at home\nwas adapted from a scale used in Roopnarine, Krishnakumar,\nMetindogan, and Evans (2006). A parent of each child reported how\noften during a given week (1 = not at all, 2 = rarely, 3 = sometimes,\n4 = almost always, 5 = always) he or she engaged in (1) teaching the\nchild about things she/he did not understand in school, (2) doing\nhomework (includes work sent home from school and work that\nparents give children at home), (3) engaging in science activities\n(e.g., growing seeds, experimenting objects’ ﬂoating and sinking,\nworking with magnets, etc.), and (4) doing math with the child\n(e.g., addition and subtraction, counting, etc.).[¬e]""']",NA,
38224234,Klauer (1992),1992,"Two criteria were used to identify highly able kindergarten children  assessment by teachers and an IQ ≥ 115 on Raven's Progressive Matrices. In this way, 16 highly able children were found, matched pairwise according to age and IQ, and then randomly allotted to two treatment conditions. In one condition the children were trained using a program for fostering inductive thinking, whereas the children in the other condition continued their normal kindergarten activities. Based upon a new theory of inductive reasoning, the training was expected to have a positive effect on intelligence test performance. Results showed that all of the trained children outperformed their matched counterparts. It was concluded that, even with highly able children, the level of cognitive functioning can be improved, and that training of inductive thinking is an effective means to this end.","['Metacognition and self-regulation', 'EY_Communication and language approaches', 'EY_Self-regulation strategies']",NA,,"['MT_Sept_2021', 'EY_January 2023']","Journal, Article",,['Journal article'],NA,NA,,['Germany'],,['Nursery school/pre-school'],NA,NA,,Low ecological validity,NA,NA,,"['4', '5', '6']",NA,NA,,NA,NA,,NA,NA,,NA,NA,,['not_provided'],Not provided,NA,,NA,NA,,NA,NA,,NA,NA,,['not_provided'],Not provided,NA,,['No'],NA,NA,,Random (please specify),"['Page 13:\n[¬s]""The children fulfilling the criteria were randomly allotted to a training and a nontraining control condition.[¬e]""']",NA,,Individual,"['Page 13:\n[¬s]""The kindergarten teacher was asked to name the bright children, who were then tested with Raven\'s Progressive Matrices test. The children fulfilling the criteria were randomly allotted to a training and a nontraining control condition. [¬e]""']",NA,,['Individual RCT'],"['Page 13:\n[¬s]""The children fulfilling the criteria were randomly allotted to\na training and a nontraining control condition.[¬e]""']",NA,,Yes,"['Page 13:\n[¬s]""The children fulfilling the criteria were randomly allotted to\na training and a nontraining control condition.[¬e]""']",NA,,['Yes'],NA,NA,,['Cognitive outcomes measured (Please specify)'],"['Page 13:\n[¬s]"" Raven\'s Progressive Matrices test.[¬e]""']",Intelligence.,,NA,NA,
75313918,Liu (2015),2015,"Inhibitory control (including response inhibition and interference control) develops rapidly during the preschool period and is important for early cognitive development. This study aimed to determine the training and transfer effects on response inhibition in young children. Children in the training group (N = 20  12 boys, mean age 4.87 +/- 0.26 years) played ""Fruit Ninja"" on a tablet computer for 15 min/day, 4 days/week, for 3 weeks. Children in the active control group (N = 20  10 boys, mean age 4.88 +/- 0.20 years) played a coloring game on a tablet computer for 10 min/day, 1-2 days/week, for 3 weeks. Several cognitive tasks (involving inhibitory control, working memory, and fluid intelligence) were used to evaluate the transfer effects, and electroencephalography (EEG) was performed during a go/no-go task. Progress on the trained game was significant, while performance on a reasoning task (Raven's Progressive Matrices) revealed a trend-level improvement from pre-to post-test. EEG indicated that the N-2 effect of the go/no-go task was enhanced after training for girls. This study is the first to show that pure response inhibition training can potentially improve reasoning ability. Furthermore, gender differences in the training-induced changes in neural activity were found in preschoolers.",['EY_Self-regulation strategies'],NA,,['EY_January 2023'],"Journal, Article",,['Journal article'],NA,NA,,['China'],,['Nursery school/pre-school'],NA,NA,,High ecological validity,NA,with access to the specialist software the intervention can be repeated easily,,"['4', '5']",NA,NA,,1,"['Page 3:\n[¬s]""a community kindergarten[¬e]""']",,1,NA,,1,NA,,NA,NA,NA,,1,NA,,1,NA,,1,NA,,NA,NA,NA,,['No'],NA,NA,,Random (please specify),"['Page 3:\n[¬s]""randomly\nallocated into a training group (N = 20; 12 boys, mean age: 4.87 ± 0.26 years) or a control group ([¬e]""']",NA,,Individual,NA,NA,,['Individual RCT'],NA,NA,,Yes,"['Page 3:\n[¬s]""randomly\nallocated into a training group (N = 20; 12 boys, mean age: 4.87 ± 0.26 years) or a control group[¬e]""']",NA,,['Yes'],NA,EEG,,['Cognitive outcomes measured (Please specify)'],"['Page 4:\n[¬s]""EEG recordings[¬e]""']",NA,,NA,NA,
75313894,O'Connor (2014),2014,"The primary aim of this group randomized trial was to test the efficacy of INSIGHTS Into Children's Temperament (INSIGHTS) in increasing the academic achievement and sustained attention and reducing the disruptive behavior problems of low-income kindergarten and 1st grade children. Twenty-two urban elementary schools serving low-income families were randomly assigned to INSIGHTS or a supplemental reading program that served as an attention-control condition. Data on 435 students in 122 classrooms were collected at 5 time points across kindergarten and 1st grade. Students received intervention in the 2nd half of kindergarten and the 1st half of 1st grade. Their teachers and parents participated in the program at the same time. Two-level hierarchical linear models were used to examine both within- and between-child changes in achievement across kindergarten and 1st grades. Results revealed that children enrolled in INSIGHTS experienced growth in math and reading achievement and sustained attention that was significantly faster than that of children enrolled in the supplemental reading program. In addition, although children participating in INSIGHTS evidenced decreases in behavior problems over time, children enrolled in the supplemental reading program demonstrated increases. Effects on math and reading were partially mediated through a reduction in behavior problems, and effects on reading were partially mediated through an improvement in sustained attention. Results indicate that INSIGHTS enhances the academic development of early elementary school children and supports the need for policies that provide social-emotional intervention for children at risk for academic problems.","['Metacognition and self-regulation', 'EY_Self-regulation strategies']",NA,,['EY_January 2023'],"Journal, Article",,['Journal article'],NA,NA,,['USA'],,['Primary/elementary school'],"['Page 2:\n[¬s]""Twenty-two urban\nelementary schools[¬e]""']",NA,,High ecological validity,"['Page 6:\n[¬s]""During the same 10 weeks, the classroom program was deliv-\nered in 45-min lessons to all students in the classrooms of partic-\nipating teachers. The curriculum materials included puppets, work-\nbooks, flash cards, and videotaped vignettes. Although the\nfacilitators had primary responsibility for conducting the class-\nroom sessions, teachers were engaged in the sessions, especially\nwhen the students practiced resolving dilemmas. N[¬e]""']","although training for teachers and parents is requires, and although facilitators deeivered the sessions they had trained parents and teachers to deliver it themselves",,"['4', '5', '6', '7']","['Page 4:\n[¬s]""The children ranged from 4 to 7 years of age at baseline (M⫽\n5.38 years, SD ⫽ 0.61)""\n""Most\nparent–child dyads (n ⫽ 329) enrolled in the study when the\nchildren were in kindergarten. The remaining dyads (n ⫽ 106)\nenrolled when the children were in first grade[¬e]""']",NA,,11,"['Page 4:\n[¬s]""Eleven\nof the schools hosted the INSIGHTS program; t[¬e]""']",,11,"['Page 4:\n[¬s]""the remaining 11\nschools participated in a supplemental reading program.[¬e]""']",,22,"['Page 4:\n[¬s]""Eleven\nof the schools hosted the INSIGHTS program; the remaining 11\nschools participated in a supplemental reading program.[¬e]""']",,NA,NA,NA,,57,"['Page 5:\n[¬s]""Simi-\nlarly, approximately half of teachers (n ⫽ 57) participated in the\nINSIGHTS program; t[¬e]""']",,65,"['Page 5:\n[¬s]""the remaining teachers (n ⫽ 65) were en-\nrolled in the attention-control condition[¬e]""']",,122,"['Page 2:\n[¬s]""Data on 435 students in 122\nclassrooms[¬e]""']",,NA,NA,NA,,['No'],NA,NA,,Random (please specify),"['Page 2:\n[¬s]""randomized trial[¬e]""']",NA,,School - cluster,"['Page 2:\n[¬s]""Twenty-two urban\nelementary schools serving low-income families were randomly assigned to INSIGHTS or a supple-\nmental reading program[¬e]""']",NA,,['Cluster RCT'],"['Page 5:\n[¬s]""Schools were used as the unit of\nrandom assignment to limit possible contamination effects that\ncould threaten the internal validity of the study. Eleven schools\nwere randomized to INSIGHTS; the remaining 11 schools hosted\nthe supplemental reading program[¬e]""']",NA,,Yes,"['Page 5:\n[¬s]""After baseline data were collected in kindergarten, a random\nnumbers table was used to randomize schools to INSIGHTS or the\nsupplemental reading program. Schools were used as the unit of\nrandom assignment to limit possible contamination effects that\ncould threaten the internal validity of the study.[¬e]""']",NA,,['Yes'],NA,NA,,"['Other types of student outcomes (Please specify)', 'Cognitive outcomes measured (Please specify)']","['Page 2:\n[¬s]""decreases in behavior\nproblems over time[¬e]""', 'Page 2:\n[¬s]""sustained attention[¬e]""']",NA,,NA,NA,
75313896,Pears (2014),2014,"Children from low-income backgrounds demonstrate poorer school readiness skills than their higher-income peers. The Kids In Transition to School (KITS) Program was developed to increase early literacy, social, and self-regulatory skills among children with inadequate school readiness. In the present study, 39 families participated in a pilot efficacy trial conducted through a community collaboration to examine the feasibility and impact of the KITS program with families from disadvantaged neighborhoods. Participating families were demographically representative of the larger populations in the participating school districts. Children who received the intervention demonstrated significantly greater improvements in letter naming, initial sound fluency, and understanding of concepts about print than their peers who did not participate in the intervention as well as decreases in aggressive responses to peer provocation and increases in self-regulation skills. Results suggest that a brief, focused school readiness intervention is feasible to conduct with low-income families and may improve critical skills.  ","['Metacognition and self-regulation', 'EY_Self-regulation strategies']",NA,,['EY_January 2023'],"Journal, Article",,['Journal article'],NA,NA,,['USA'],,['Primary/elementary school'],"['Page 5:\n[¬s]""elementary schools[¬e]""']",NA,,High ecological validity,"['Page 7:\n[¬s]""Like a typical kindergarten\nschedule, school readiness sessions have a highly structured, consistent routine with many\ntransitions between activities. The routine includes circle times at which students engage in\ngames and musical activities designed to promote language, rhyming, and self-regulation\nskills, instructional periods during which the students focus on learning social and early\nliteracy skills, project times during which children complete art and science activities\ndesigned to reinforce the literacy and social-emotional target skills, and snack time during\nwhich children practice their conversational and other social skills. The sessions were held\nin classrooms in the schools.""\n""A lead teacher and two assistant teachers conduct the groups of 20-25 children.\nThe high staff-to-child ratio provides children with high levels of support and feedback. A\nkey component of the school readiness groups is the classroom behavior management\nsystem. Teachers are trained to use evidence-based behavioral support strategies.[¬e]""']","intervention delivered at schools, by teachers. Including parents as well",,['4'],"['Page 7:\n[¬s]""Like a typical kindergarten[¬e]""']",NA,,2,"['Page 5:\n[¬s]""All four schools were very similar in terms of SES. For example, percentages of children receiving FRL were highly similar across schools (range = 71 to 86%). In each district, one school was randomly designated as the intervention school.""\n""Students who would be attending\nkindergarten in these schools in the fall were eligible to participate in the KITS Program\n(KITS schools).[¬e]""']",,2,"['Page 5:\n[¬s]""All four schools were very similar in terms of SES. For example, percentages of children receiving FRL were highly similar across schools (range = 71 to 86%). In each district, one school was randomly designated as the intervention school.""\n""Students who would be attending the other two schools received services as\nusual (SAU).[¬e]""']",,4,"['Page 5:\n[¬s]""All four\nschools were very similar in terms of SES.[¬e]""']",,NA,NA,NA,,NA,NA,,NA,NA,,NA,NA,,['not_provided'],NA,NA,,['No'],NA,NA,,Random (please specify),"['Page 5:\n[¬s]""n each district, one school\nwas randomly designated as the intervention school. Students who would be attending\nkindergarten in these schools in the fall were eligible to participate in the KITS Program\n(KITS schools).[¬e]""']",NA,,School - cluster,"['Page 5:\n[¬s]""In each district, one school\nwas randomly designated as the intervention school. Students who would be attending\nkindergarten in these schools in the fall were eligible to participate in the KITS Program\n(KITS schools). Students who would be attending the other two schools received services as\nusual (SAU).[¬e]""']",NA,,['Cluster RCT'],"['Page 5:\n[¬s]""All four\nschools were very similar in terms of SES. For example, percentages of children receiving\nFRL were highly similar across schools (range = 71 to 86%). In each district, one school\nwas randomly designated as the intervention school.[¬e]""']",NA,,No/Unclear,"['Page 5:\n[¬s]""All four\nschools were very similar in terms of SES. For example, percentages of children receiving\nFRL were highly similar across schools (range = 71 to 86%). In each district, one school\nwas randomly designated as the intervention school.[¬e]""']",NA,,['Yes'],NA,NA,,['Other types of student outcomes (Please specify)'],"['Page 10:\n[¬s]""Self-regulatory skills—Children’s self-regulatory skills were assessed using the Head Toes Knees and Shoulders (HTKS) Test""\n""Early childhood education experiences—T[¬e]""', 'Page 9:\n[¬s]""Social skills—C[¬e]""']",NA,,NA,NA,
40294945,Peskin (2004) MSR,2004,"This study investigated whether exposing Kindergarten children to metacognitive language results in a greater conceptual understanding of mental states, and increased production and comprehension of metacognitive vocabulary. Over a 4-week period, parents, teachers and graduate assistants read about 70 picture books to each participant (N=48, mean age 4 6). The experimental group received books with text rich in explicit metacognitive terms. The control group received the same books with no metacognitive language but with most stories and accompanying illustrations implicitly requiring children to think about alternative perspectives. Results from pre-test to post-test show firstly, that exposing children to explicit metacognitive vocabulary resulted in significantly more metacognitive verb production in story telling but no improvement in metacognitive language comprehension. This demonstrates Nelson's [""Language in Cognitive Development  Emergence of the Mediated Mind,"" Cambridge University Press, New York, 1996] notion that children ""use"" such vocabulary before fully understanding the concepts. A second finding was that the control group children outperformed the experimental group on a false-belief explanation battery. This suggests that hearing numerous metacognitive terms in stories is less important than having to actively construct one's own mentalistic interpretations from illustrations and text that implicitly draw attention to mental states.","['Metacognition and self-regulation', 'EY_Communication and language approaches', 'EY_Self-regulation strategies']",NA,,"['MT_Sept_2021', 'EY_January 2023']","Journal, Article",,['Journal article'],NA,NA,,['Canada'],,['Primary/elementary school'],NA,NA,,High ecological validity,NA,NA,,"['4', '5']",NA,NA,,NA,NA,,NA,NA,,NA,NA,,['not_provided'],NA,NA,,8,"['Page 5:\n[¬s]""eight classrooms[¬e]""']",,8,"['Page 5:\n[¬s]""eight classrooms[¬e]""']",,8,"['Page 5:\n[¬s]""eight classrooms[¬e]""']",,NA,NA,NA,,['No'],NA,NA,,"Non-random, but matched","['Page 6:\n[¬s]""Whether the teacher\x92s morning or afternoon class was designated either a control or experimental group, was determined by the decision to match the experimental and control groups in terms of their total scores on the TELD-3 Receptive language pre-test.[¬e]""']",NA,,Individual,"['Page 6:\n[¬s]"" match the experimental and control groups in terms of their total scores on the TELD-3 Receptive language pre-test.[¬e]""']",NA,,['Prospective QED'],"['Page 6:\n[¬s]""control or experimental group, was determined by the decision to match the experimental and control groups in terms of their total scores on the TELD-3 Receptive language pre-test.[¬e]""']",NA,,Not applicable,NA,NA,,['Yes'],NA,NA,,['Cognitive outcomes measured (Please specify)'],"['Page 8:\n[¬s]"" False-belief prediction battery This consisted of (a) two false-belief location change tasks based on the study by Wimmer and Perner (1983).""\n""(b) one unexpected contents task based on the study by Gopnik and Astington (1988).""\n""False-belief explanation battery This battery was specially developed for this study. It involved four scenarios with ac- companying pictures and then a question which assessed the participants\x92 conceptual un- derstanding that a story character may be ignorant of a situation that the participant knows to be true[¬e]""']",NA,,NA,NA,
