74578001,Fisher (2013) 1_2,2013,NA,NA,,"['Page 3:\n[¬s]""Free play[¬e]""']",NA,,"['Page 3:\n[¬s]""Free play. Prior to the start, the experimenter\norganized the cards in one large group next to the\nfelt board. The cards were organized by their\nrespective shapes within this larger group (e.g.,\ntriangle cards together) to enhance children’s natu-\nral, within-category comparison when examining\nthe cards. Children were given 7 min to play with\nthe shapes and 6 min to play with the construction\nsticks in any way that they wished. Children were\nexposed to the shape stimuli for approximately the\nsame amount of time as the pedagogical conditions.[¬e]""']",NA,,"['Page 1:\n[¬s]""improved shape knowledge[¬e]""']",NA,,['University/ researcher design'],NA,NA,,['Unclear/ Not specified'],NA,"experimenter carried the intervention, he must have had training",,['Students'],NA,NA,,['One to one'],"['Page 3:\n[¬s]""in a private room free\nfrom distractions at two separate locations in the\nsame geographic area (see the Preliminary Analyses\nsection)""\n""One\nexperimenter worked individually with each child.[¬e]""']",NA,,['No'],NA,NA,,['No'],NA,NA,,"['During regular school hours ', 'Other (please specify)']","['Page 4:\n[¬s]""Setting and blind assessment. The experiment was\nconducted in two locations, in the lab and in a\nschool where a second experimenter—blind to the\ncondition—administered the shape-sorting task\nassessment for approximately one third of the sam-\nple (n = 23)[¬e]""']",NA,,['Research staff'],"['Page 3:\n[¬s]""Free play. Prior to the start, the experimenter\norganized the cards in one large group next to the\nfelt board. The cards were organized by their\nrespective shapes within this larger group (e.g.,\ntriangle cards together) to enhance children’s natu-\nral, within-category comparison when examining\nthe cards. Children were given 7 min to play with\nthe shapes and 6 min to play with the construction\nsticks in any way that they wished.[¬e]""']",NA,,"['Page 3:\n[¬s]""Prior to the start, the experimenter\norganized the cards in one large group next to the\nfelt board. The cards were organized by their\nrespective shapes within this larger group (e.g.,\ntriangle cards together) to enhance children’s natu-\nral, within-category comparison when examining\nthe cards. Children were given 7 min to play with\nthe shapes and 6 min to play with the construction\nsticks in any way that they wished. Children were\nexposed to the shape stimuli for approximately the\nsame amount of time as the pedagogical condition[¬e]""']",1,,NA,.2,,"['Page 3:\n[¬s]""Children were given 7 min to play with\nthe shapes and 6 min to play with the construction\nsticks in any way that they wished. Children were\nexposed to the shape stimuli for approximately the\nsame amount of time as the pedagogical conditions.[¬e]""']",15,,['Qualitative'],"['Page 4:\n[¬s]""The experimenter made special efforts to main-\ntain child-friendly affect across all conditions during\ntraining. Even so, slight differences in training affect\ncould have subtly inﬂuenced the outcome. We exam-\nined whether perceived friendliness and warmth\ndiffered among conditions by having 40 adults rate\nﬁfteen 5-s audio clips of the instruction periods from\navailable audio data. Five clips were made for each\ncondition. Clips were played in reverse so raters\nwould not be inﬂuenced by the content of the\nspeech. Participants rated the speaker’s level of\nfriendliness and warmth on 7-point, Likert scales\n(1 = low,5 = moderate,7 = high for each dimension)\nfor each clip. Mean friendliness and warmth scores\nwere computed for each condition.[¬e]""']",NA,,['No'],NA,NA,,['The developer'],NA,NA,,No,,['No/Unclear'],NA,NA,,['No'],NA,NA,,['Yes'],NA,NA,,['Gender'],"['Page 2:\n[¬s]""Children were pre-\ndominantly Caucasian and upper middle-class, and\ndivided equally among three conditions: guided\nplay (Mage = 56.77 months, SD = 6.09; 10 males),\ndidactic instruction (Mage = 57.11, SD = 6.77; 11\nmales), and free play (Mage = 55.83, SD = 5.91; 10\nmale children).[¬e]""']",NA,,['No'],NA,NA,
71090288,Han (2010),2010,NA,NA,,"['Page 1:\n[¬s]""children’s vocabulary develop-\nment and how to improve learning through play,[¬e]""']",NA,,"['Page 1:\n[¬s]""Merging the literatures of how to enhance young children’s vocabulary develop-\nment and how to improve learning through play, this study tested two vocabulary-\nteaching protocols on at-risk preschool children: Explicit Instructional Vocabulary\nProtocol (EIVP) and shortened EIVP and a play session (EIVP + Play). From a group\nof 118 lowest-performing students, 49 children were divided into two groups and\nreceived either EIVP or EIVP + Play twice weekly in thirty-minute tutoring ses-\nsions over the course of four months. A total of 64 words were taught.[¬e]""']",NA,,"['Page 7:\n[¬s]""the present study examines the addition of play to at-risk preschool children’s\nvocabulary learning.[¬e]""']",NA,,['University/ researcher design'],"['Page 12:\n[¬s]""The trained tutors then held thirty-minute tutorial sessions twice\na week. They used the instructional protocol with a target vocabulary word,\nintroducing two words in each tutoring session. During each session, the tutor\nread and discussed the words and employed the interactive reading strategy. At\nwhat she judged the appropriate time, the tutor began the guided play for the\nspecific target word. One of the researchers met weekly with the tutors to solve\nproblems, discuss the children’s progress, reflect on the use of the protocol, and\ntrain the tutors in the use of the protocol with words for the next session.[¬e]""']",NA,,['Yes (Please specify)'],"['Page 12:\n[¬s]""One of the researchers trained three\ngraduate students as tutors in the instructional protocol in an hour-long train-\ning session. During the training, the graduate students took turns assuming\nthe roles of children and tutor, in which the tutor used the word meanings,\nselected word-related actions, and enacted the play episode prepared by the\nresearchers.[¬e]""']",NA,,['Students'],"['Page 7:\n[¬s]""Our overarching goal was to field test the impact of adding play to an\nintervention already shown to improve children’s vocabularies and to assess\nthe effectiveness of this addition of play to promote the ability of high-risk\npreschool children to learn vocabulary words better.[¬e]""']",NA,,['Other (Explain in notes)'],"['Page 9:\n[¬s]""intervention through tutoring (one adult with two children) for\nthirty minutes twice weekly.[¬e]""']",one adult responsible for tutoring two children.,,['No'],NA,NA,,['No'],NA,NA,,['Unclear/ not specified'],"['Page 8:\n[¬s]""kindergarten-bound[¬e]""']",could suggest these children were between pre-kindergarten and kindergarten ,,['Research staff'],"['Page 12:\n[¬s]""One of the researchers trained three\ngraduate students as tutors in the instructional protocol in an hour-long train-\ning session.[¬e]""']",NA,,"['Page 12:\n[¬s]""before the sessions began (in October[¬e]""', 'Page 13:\n[¬s]""November) and once after all the sessions were completed (the following May[¬e]""']",30.42 ,,"['Page 9:\n[¬s]""intervention through tutoring (one adult with two children) for\nthirty minutes twice weekly.[¬e]""']",2,,"['Page 9:\n[¬s]""thirty minutes[¬e]""']",30,,['Quantitative'],"['Page 12:\n[¬s]""One of the researchers trained three\ngraduate students as tutors in the instructional protocol in an hour-long train-\ning session.[¬e]""']",NA,,['No'],NA,NA,,"['Is this an EEF evaluation?', 'The developer']","['Page 18:\n[¬s]""Our study indicates that the children who received either EIVP or EIVP + Play\ntutoring increased their vocabularies over the course of the study compared to\nstudents who received no tutoring. We also found that adding a play compo-\nnent to the protocol slightly improved both the performance and performance\ntrajectory of the children’s vocabulary learning.[¬e]""']",NA,,Yes,,['No/Unclear'],NA,NA,,['Yes'],"['Page 14:\n[¬s]""An individual samples t-test comparing the mean-gain scores of the EIVP\nand EIVP + Play groups o[¬e]""']",gain scores,,['Yes'],NA,NA,,"['Gender', 'Other (please specify)']","['Page 8:\n[¬s]""Gender[¬e]""', 'Page 8:\n[¬s]""Race/Ethnicity""\n""Home Language[¬e]""']","Race, Language",,['No'],NA,NA,
71090289,Jemutai (2019),2019,NA,NA,,"['Page 2:\n[¬s]""(an intervention based on guided play using the 6 Brick\nDuplo Block approach[¬e]""']",NA,,"['Page 3:\n[¬s]""The intervention included providing the experimental group\nteachers with training and sufficient sets of 6 Brick Duplo\nBlocks to allow all of the children in their classes to participate\nin the pre-designed Duplo Blocks activities individually over\n6 months.[¬e]""', 'Page 4:\n[¬s]""The teachers facilitated the 6 Brick activities as set out in their\nfiles. Four 10-min activities were to be carried out separately\non 4 days of each week. The order of the activities each week\nwas an activity that aimed at developing VD, followed on\nconsecutive days by activities that aimed at promoting VM\nand VSM, respectively. The fourth day of the week was\nreserved for teachers to repeat any activity that they believed\nwas not well understood by the children. The approach was\nfor the teacher to demonstrate an activity (building a shape,\nsequencing different coloured blocks, etc.) and then asking\ntheir learners to replicate what they had done before\ncontinuing to play (building their own shapes, sequencing\ntheir own colours, etc.).[¬e]""']",NA,,"['Page 2:\n[¬s]""visual discrimination (VD),\nvisual memory (VM) and visual sequential memory (VSM),\nall of which are essential aspects for enhancing literacy and\nmathematical capabilities (Clutten 2009).[¬e]""', 'Page 3:\n[¬s]""to promote VD, VM and VSM[¬e]""']",NA,,['University/ researcher design'],"['Page 3:\n[¬s]""The intervention included providing the experimental group\nteachers with training and sufficient sets of 6 Brick Duplo\nBlocks to allow all of the children in their classes to participate\nin the pre-designed Duplo Blocks activities individually over\n6 months. The 6 Brick Duplo Block activities that were\nidentified and selected by the researchers as having the\npotential to promote VD, VM and VSM were used for the\nintervention[¬e]""']",NA,,['Yes (Please specify)'],"['Page 3:\n[¬s]""The intervention included providing the experimental group\nteachers with training and sufficient sets of 6 Brick Duplo\nBlocks to allow all of the children in their classes to participate\nin the pre-designed Duplo Blocks activities individually over\n6 months. The 6 Brick Duplo Block activities that were\nidentified and selected by the researchers as having the\npotential to promote VD, VM and VSM were used for the\nintervention.[¬e]""']",NA,,['Students'],NA,NA,,['One to one'],"['Page 3:\n[¬s]""Blocks to allow all of the children in their classes to participate\nin the pre-designed Duplo Blocks activities individually over\n6 months.[¬e]""']",NA,,['No'],NA,NA,,['No'],NA,NA,,['During regular school hours '],NA,NA,,['Class teachers'],NA,NA,,"['Page 3:\n[¬s]""over\n6 months[¬e]""']",19,,"['Page 3:\n[¬s]""The children\nin the experimental classes each received a set of 6 Brick\nDuplo Blocks, one of each colour, which they kept on their\ndesk readily available throughout each school day so that the\nteachers could easily facilitate play at any given time that\nthey felt was appropriate[¬e]""', 'Page 4:\n[¬s]""Four 10-min activities were to be carried out separately\non 4 days of each week.[¬e]""']",5,,"['Page 4:\n[¬s]""10-min activities""\n""Four 10-min activities[¬e]""', 'Page 4:\n[¬s]""The teachers facilitated the 6 Brick activities as set out in their\nfiles. Four 10-min activities were to be carried out separately\non 4 days of each week. The order of the activities each week\nwas an activity that aimed at developing VD, followed on\nconsecutive days by activities that aimed at promoting VM\nand VSM, respectively. The fourth day of the week was\nreserved for teachers to repeat any activity that they believed\nwas not well understood by the children. The approach was\nfor the teacher to demonstrate an activity (building a shape,\nsequencing different coloured blocks, etc.) and then asking\ntheir learners to replicate what they had done before\ncontinuing to play (building their own shapes, sequencing\ntheir own colours, etc.).[¬e]""']",40,,['Qualitative'],"['Page 3:\n[¬s]""In order for the researchers to be able to confirm that the\nintervention took place as planned, the teachers filled in a\nrecord sheet each time they engaged their learner with 6\nBrick activities. The information on the record included the\ndate, activity name, number of bricks used, whether the\nlearners completed the activities or not, whether the teacher\nfelt that the children had understood the activity (fully,\npartially or not at all) and whether they had enjoyed it (five-\npoint Likert scale). There was also space for any additional\ncomment that the teacher might like to make. Classroom\nobservations were made concerning how the teachers and\nlearners engaged in the activities (a minimum of five visits\nper experimental class) and the teachers were interviewed\nindividually on completion of the intervention and testing\nphase of the study in their schools in South Africa and Kenya.[¬e]""']",NA,,['No'],NA,NA,,['The developer'],NA,NA,,No,,['Yes'],"['Page 5:\n[¬s]""TABLE 2: South African and Kenyan pre-test number of participants, mean\nscores and standard deviations.[¬e]""']",NA,,['No'],NA,NA,,['N/A'],NA,NA,,NA,NA,NA,,['No'],NA,NA,
71969375,Macdonald (2017) EY_PBL,2017,NA,NA,,"['Page 5:\n[¬s]""play-based activities (CPBA)[¬e]""']",NA,,"['Page 6:\n[¬s]""The CPBA intervention supports communities to establish play-based activities for children aged 0 to 5""\n""Play-based activities (also known as playgroups) are led by parents, caregivers facilitated by community volunteers to provide guided interaction and play among young children, exposing them to new learning opportunities and socialization through play. These interactions occur once or twice a week and last approximately 2 hours. C""\n""ildren attended an average of 10 sessions per 10 week[¬e]""', 'Page 7:\n[¬s]""term, but many children did not attend all three terms.[¬e]""']","The first intervention, “Come Let’s Read and Write” (CLRW) aims to improve reading instruction techniques of 1st and 2nd grade primary school teachers. It includes a combination of activities to promote reading skills at school and at home.  The second intervention supports communities to establish play-based activities (CPBA) for children aged 0 to 5 to improve their readiness to learn at school.",,"['Page 2:\n[¬s]""to improve school readiness and subsequently early grade\nreading outcomes, by providing communities with sup-\nport to establish a community play-based activity.[¬e]""', 'Page 5:\n[¬s]""The second intervention supports\ncommunities to establish play-based activities (CPBA) for children aged 0 to 5 to improve their\nreadiness to learn at school.[¬e]""', 'Page 6:\n[¬s]""The objective of the CPBA is to improve school readiness across a broad range of child\ndevelopment domains including cognitive, socio-emotional and physical development.\nCommunities play a significant role in the education of their children in Tonga and the Pacific\nIslands more broadly ([¬e]""']",NA,,['School or group of schools'],NA,"Under the CLRW design, 37 primary schools were randomly selected into the treatment group while 36 primary schools were randomly selected into the control group.",,['Yes (Please specify)'],"['Page 18:\n[¬s]""teacher training workshops,[¬e]""']",NA,,['Students'],"['Page 14:\n[¬s]""Tables 1 and 2 present the sample and number of students by control and treatment group for the\ndifferent interventions. Of the 2,005 first grade students, 497 previously lived in a treatment\ncommunity and 379 in a control community; the previous community is unknown for 851 students.\n140 students attended a CPBA, 8 of which lived in a non-treatment community previously; this is\nassumed to be an error in the community in which the child previously lived as no CPBAs had\nbeen established in non-treatment communities. For second grade students, 609 attended CLRW\ntreatment schools and 542 attended CLRW control group schools.[¬e]""']",NA,,['Large group/class teaching (+6)'],NA,Students were randomly selected from within each stratum with a target of 20 children per class.,,['No'],NA,NA,,['No'],NA,NA,,"['During regular school hours ', 'Other (please specify)', 'Unclear/ not specified']","['Page 6:\n[¬s]""Play-based\nactivities (also known as playgroups) are led by parents, caregivers facilitated by community\nvolunteers to provide guided interaction and play among young children, exposing them to new\nlearning opportunities and socialization through play.[¬e]""']",NA,,"['Class teachers', 'Parents/carers', 'Lay persons/volunteers']","['Page 6:\n[¬s]""Play-based\nactivities (also known as playgroups) are led by parents, caregivers facilitated by community\nvolunteers to provide guided interaction and play among young children, exposing them to new\nlearning opportunities and socialization through play. These interactions occur once or twice a\nweek and last approximately 2 hours.[¬e]""']",NA,,NA,30,,"['Page 6:\n[¬s]""Children attended an average of 10 sessions per 10 week[¬e]""', 'Page 6:\n[¬s]""Play-based\nactivities (also known as playgroups) are led by parents, caregivers facilitated by community\nvolunteers to provide guided interaction and play among young children, exposing them to new\nlearning opportunities and socialization through play[¬e]""', 'Page 7:\n[¬s]""term,[¬e]""']",2,,"['Page 6:\n[¬s]""These interactions occur once or twice a\nweek and last approximately 2 hours.[¬e]""']",120,,"['Qualitative', 'Quantitative']",NA,NA,,['Yes (Please add details)'],"['Page 18:\n[¬s]""The estimated impacts of the CLRW intervention in standard deviations per 100 dollars are listed\nin Table 17. These are the same data presented in Table 11, but divided by the cost per child and\nmultiplied by 100. Impact of the program per 100 dollars spent ranges between 0.3 and 0.4\nstandard deviation of initial sounds and letter sounds, and 0.1 to 0.2 standard deviation for the\nother domains where a positive impact is found. Table 18 presents the impact in standard\ndeviations per 100 dollars for the CPBA intervention; this is based on the results presented in Table\n15. Impacts range from 0.1 to 0.3 standard deviation using the balancing methods and for which\nstatistically significant impacts are found.[¬e]""']","The total estimated operating cost for CLRW is 255,436 USD or 183 USD per student [...] The total number of children participating in CPBAs for the costing period is 814, and the intervention cost 104 USD per child. See Table 16 of the source.",,['The developer'],NA,NA,,No,,['Yes'],"['Page 16:\n[¬s]""To identify variables that may confound the estimate of the community-level intervention, Table\n8 presents the association between each background variable and reading domain score[¬e]""']",NA,,['Yes'],"['Page 17:\n[¬s]""Only in two of the estimates of the impact using the difference between treatment and\ncontrol groups (equation 2) and that with class random effects (equation 3) are found to be\nsignificant; a positive impact for listening comprehension and a negative impact for dictation.\nWhen adjusting for the covariates (either estimating equation 1 or with propensity score\nweighting), positive impacts are found for most domains.[¬e]""', 'Page 18:\n[¬s]""Without adjusting for covariates, no impact of a\nCPBA is found except for a negative impact on dictation of negative 0.08 standard deviation.\nWhen controlling for covariates using either method, positive impacts are found for letter\nknowledge, letter sounds, familiar words, reading and listening comprehension. Effect sizes range\nfrom 0.14 to 0.36 standard deviation.[¬e]""']",NA,,['Yes'],NA,NA,,"['Educational attainment', 'Gender']",NA,NA,,['Yes'],"['Page 16:\n[¬s]""and standard errors are estimated robust to clustering at the school\nlevel for the CLRW intervention and at the community level for the community intervention.[¬e]""', 'Page 9:\n[¬s]""Both interventions are randomized at the cluster-level (school or community) rather than the\nindividual (student) level, and the number of clusters is relatively small.[¬e]""']",NA,
74671371,Morrow (1990) 1_1,1990,NA,NA,,"['Page 8:\n[¬s]""Thematic play with\nteacher guidance’[¬e]""']",NA,,"['Page 6:\n[¬s]""n both E2 classrooms (thematic play with teacher guidance)""\n""dramatic play areas\nwere designed to represent veterinarians’\noffices. Each included a waiting\nroom with chairs, a table, magazines, books, and pamphlets. On the wall\nwere posters about pets, a list of doctor’s hours, a “No Smoking” sign, and\na sign that said, “Check in with the nurse when you arrive.” The “nurse”\nwas given forms and a clipboard to use with “patients”.\nAlso in the office\nwere a telephone, address and telephone books, appointment cards, a calen-\ndar, patient folders, prescription pads, white coats, masks, gloves, bandages,\nand doctors’ kits.""\n""teachers discussed the materials with the chil-\ndren and suggested how children could play with them.[¬e]""', 'Page 7:\n[¬s]""n E2 classrooms, teachers also dis-\ncussed potential uses of materials at the beginning of each play period: for\nexample, reading to pets in the waiting room, filling out prescription forms\nand appointment\ncards at the nurse’s desk. Because the children were pre-\nschoolers, they were also told that they could pretend to read and write. I[¬e]""']",NA,,"['Page 4:\n[¬s]""to determine if and how children’s voluntary\nliteracy behaviors could be increased during free-play periods through the\ndesign and equipping of dramatic play areas.[¬e]""']",NA,,['University/ researcher design'],NA,NA,,['Yes (Please specify)'],"['Page 5:\n[¬s]""efore the beginning of data collection, the 13 participat-\ning student-teachers attended a workshop introducing them to the materials\nfor the intervention periods of the study. The workshops were separate for\neach condition. P""\n""nd the student-teachers were provided with scripts for introducing\nplay[¬e]""']",NA,,['Students'],NA,NA,,['Large group/class teaching (+6)'],"['Page 6:\n[¬s]""assrooms (thematic play without teacher guidance), dramatic play areas were designed to represent veterinarians’ offices""\n""In El and E2 classrooms, teachers discussed the materials with the chil-\ndren and suggested how children could play with them.[¬e]""']",NA,,['No'],NA,NA,,['No'],NA,NA,,['During regular school hours '],NA,NA,,"['Other school staff', 'Teaching assistants']","['Page 5:\n[¬s]""Taught by student teachers enrolled in a\nteacher education program, classes were selected for the study if[¬e]""', 'Page 6:\n[¬s]""During the study, they guided play periods and col-\nlected anecdotal data. Research assistants, one per classroom, were also\npresent at the workshops. They prepared and placed classroom materials\naccording to particular\ntreatment and collected data on the children’s\nliteracy behaviors.[¬e]""']",NA,,NA,Not specified,,NA,Not specified,,NA,Not specified,,['Qualitative'],"['Page 5:\n[¬s]""Physical Design of Dramatic Plizy Areas\nPhysical attributes of the dramatic play areas before and after the interven-\ntion were compared to check on design change manipulation.\nResults indi-\ncated that before the investigation, none of the 13 rooms had literacy\nmaterials purposefully\nplaced in the dramatic play area, and none of the\nrooms had created a thematic play situation with literacy materials included.[¬e]""', 'Page 7:\n[¬s]""Research assistants visited the classrooms twice a week to ensure that the\nphysical plans for each of the conditions were in place, to replenish supplies,\nand to monitor student-teacher\nTwice during the observation period, research assistants and student teachers\nwere checked for observer-reliability\nability to study parameters and guidelines.\nin recording literacy behaviors during\nplay. T""\n""hey agreed on 90% of their observations of the number of ch.iIdren\nparticipating\nkinds of activities observe[¬e]""']",NA,,['No'],NA,NA,,['The developer'],NA,NA,,No,,['Yes'],NA,NA,,['No'],NA,NA,,['No'],NA,NA,,NA,NA,NA,,['No'],NA,NA,
