71090269,Bleses (2020),2020,NA,NA,,"['Page 5:\n[¬s]""“Play and Learn,”[¬e]""']",NA,,"['Page 5:\n[¬s]""All childcare centers in the treatment group imple- mented a researcher-developed 20-week instructional curriculum called “Play and Learn,” the design of which was in?uenced by recent ?ndings within the ?eld of ECE.""\n""The intervention targets both teacher and child skills.""\n""Based on theory as well\nas empirical studies, the intervention had several elements, which\nwere developed to support teachers’ and children’s skill develop-\nment. First, we developed a threefold scope of instruction targeting\nlanguage (general vocabulary and language use) and math (math[¬e]""', 'Page 6:\n[¬s]""language and numeracy skills) that was sequenced over the 20-\nweek curriculum period with the overall aim of promoting the\ninstructional quality and to promote teachers’ use of rich language.""\n""Teachers were asked to develop activities of their own choice to\naddress the instructional targets to promote active engagement and\nto support autonomy.[¬e]""']",NA,,"['Page 3:\n[¬s]""The present study represents one of the only large-scale ran-\ndomized control trial (RCT) designed to elevate the quality of\ninstruction in ECE programs serving toddlers to increase the\nintentional support of toddlers’ school readiness.[¬e]""', 'Page 5:\n[¬s]""For teach-\ners, the intervention aimed at improving their instructional and\ninteractive skills. The aim of the intervention for children was to\nimprove their language and math skills.[¬e]""']",NA,,['University/ researcher design'],NA,"While the intervention was provided by teachers in the childcare centers, the researcher was responsible for providing the resources and training, as well as managing the study.",,['Yes (Please specify)'],"['Page 6:\n[¬s]""Finally, inspired by recent work on professional development\n(Hamre et al., 2012), staff in all classrooms participated in a two-day\ntraining workshop, which introduced teachers to the intervention\nelements, including the instructional scope and sequence, the use of\nspeciﬁc practices to enrich and differentially support children, and\nguidance on how best to select activities that create many learning[¬e]""', 'Page 7:\n[¬s]""This training provided teachers with all materials necessary to fully implement the 20-week “Play and Learn” cur- riculum.""\n""opportunities.[¬e]""']",NA,,"['Students', 'Teachers']","['Page 3:\n[¬s]""Second, the intervention targets both teachers’ instructional and\ninteractive skills and children’s language and math skills[¬e]""']",NA,,"['Large group/class teaching (+6)', 'Small group/intensive support (3-5)', 'Paired learning']",NA,NA,,['No'],NA,NA,,['No'],NA,NA,,['During regular school hours '],NA,NA,,['Class teachers'],NA,NA,,NA,20,,"['Page 6:\n[¬s]""To guide implementation, in\nparticular to support the self-organization of activities and the\ninclusion of all children, teachers received a weekly planner offer-\ning an instructional framework by which to plan these activities\nin alignment with the week objectives; the planner provided a\nsuggested weekly dosage of two large-group and two small-group\nactivities per week and one individual conversation per child each\nweek (among others to minimize effects of implicit biases in engag-\ning children in activities). The teachers were encouraged to use\ndaily routines like diaper change and dressing situations for indi-\nvidual conversations with children. Child participation in all three\ntypes of activity settings was logged on the weekly planner[¬e]""']",5,,NA,Not specified,,['Quantitative'],"['Page 7:\n[¬s]""Teachers’ ongoing completion of implementation logs allowed\n?delity to be monitored and this indicated that teachers imple-\nmented the “Play and Learn” activities with varying degrees of\n?delity. For the weekly large-group activities, of which two were\nrecommended, teachers implemented an average of 1.8 (range\n0–5.8). For the weekly recommendation of two small-group activi-\nties, teachers implemented an average of 1.1 (range 0–3.9). Finally,\nindividual children experienced an average of about 1 (0.9) indi-\nvidual conversation with their teachers each week (range 0–11.5).""\n""Additional measures of ﬁdelity were coded from two videos col-\nlected in each classroom mid-way through the implementation\nperiod. Analyses showed that treatment teachers used targeted\nstrategies at signiﬁcantly higher rates than controls (strategies\nfrom “The high-quality conversation” were used 4.7 times across\nteachers in the treatment group vs. 1.0 time in the control group,\nstrategies from “Learning new words” were used on average 1.2\ntimes in the treatment group vs. 0.2 times in the control group\nand strategies from “The Learner’s ladder” were on average used\n4.2 times in the treatment group vs. 0.2 times in the control\ngroup).[¬e]""']",NA,,['No'],NA,NA,,['The developer'],NA,NA,,No,,['Yes'],"['Page 5:\n[¬s]""Balancing tests demonstrated that the baseline character-\nistics of the included teacher, parents and child characteristics were\ndistributed evenly across the intervention and control groups for\nthe ﬁnal sample[¬e]""']",NA,,['Yes'],"['Page 8:\n[¬s]""To increase precision of the estimates, we include child\nand family covariates represented by the vector xi. The included\ncovariates are gender, age, mother’s and father’s education, ethnic\nbackground, employment status (no employment), and family sta-\ntus (married, cohabitating, or single parent), as shown in Table 1.[¬e]""']",NA,,['Yes'],"['Page 8:\n[¬s]""To increase precision of the estimates, we include child\nand family covariates represented by the vector xi. The included\ncovariates are gender, age, mother’s and father’s education, ethnic\nbackground, employment status (no employment), and family sta-\ntus (married, cohabitating, or single parent), as shown in Table 1.[¬e]""']",NA,,"['Gender', 'Socio-economic status', 'Other (please specify)']",NA,"Family variables (parental education, marital status etc).",,['Yes'],"['Page 7:\n[¬s]""we use regression analysis with\nSEs adjusted for clustering at the childcare center level[¬e]""']",NA,
71090272,Casey (2008) 1_1,2008,NA,NA,,"['Page 4:\n[¬s]""whether interventions involving block\nbuilding are effective in improving spatial skills in kindergartners.[¬e]""']",NA,,"['Page 4:\n[¬s]""In the present study, we included two intervention conditions, as well as a\ncontrol condition: (1) a block building intervention embedded in a story context,\n(2) the same block building intervention without a storytelling context, and (3) a\ncontrol condition. The stories used in this research were designed to engage\nchildren’smotivation by providing a narrative context inwhich the story characters\nask the students’ help in solving the block building problems. The goalwas tomake\nthis pedagogical approach appealing to a broad spectrum of students including\nstudents from diverse racial and ethnic backgrounds.[¬e]""']",NA,,"['Page 4:\n[¬s]""to determine whether interventions involving block\nbuilding are effective in improving spatial skills in kindergartners.[¬e]""']",NA,,['School or group of schools'],"['Page 11:\n[¬s]""All the kindergarten classrooms were based on developmentally appropriate\nearly childhood practices (Bredekamp & Copple, 1997; Copple, 2004), with a\nvariety of activity centers in the rooms (including a block area), and choice time\nfor the children to play in these areas[¬e]""']",NA,,['Yes (Please specify)'],"['Page 12:\n[¬s]""Prior to the beginning of the\nproject, teachers in the intervention conditions were given a brief training session\nin a two-hour meeting on how to implement the lessons; the instructional materials\nwere designed to be mainly self-explanatory for the teacher[¬e]""']",NA,,['Students'],"['Page 10:\n[¬s]""The present study is designed to determine the types ofblock building interventions\nthat are most effective in increasing kindergartners’ spatial skills.[¬e]""']",NA,,['Small group/intensive support (3-5)'],"['Page 12:\n[¬s]""Both\nthe intervention and control group teachers were asked to use their knowledge of\nthe students to break up their class into small heterogeneous groups of 3–5 chil-\ndren, and the children stayed in these groups across the activities. The decision to\nbreak the children into small groups was based on pedagogical reasons, as this was\nconsidered the most efﬁcient and effective way of presenting the material[¬e]""']",NA,,['No'],NA,NA,,['No'],NA,NA,,['During regular school hours '],"['Page 15:\n[¬s]""The activities in the interventions were carefully sequenced so that the\nspatial and geometry skills acquired in earlier lessons were incorporated and\ndeveloped further in later lessons[¬e]""']",NA,,['Class teachers'],"['Page 14:\n[¬s]""The teachers in the intervention conditions ensured that the objectives of the\nlessons were achieved by ﬁrst introducing the criteria at the beginning of each\nlesson relating to the key elements of the structure to be built. Then, if a group had\nnot achieved particular criteria, scripted questions were posed to the children to\nhelp them recognize the problem with the construction, and to modify their design.[¬e]""']",NA,,"['Page 15:\n[¬s]""took approximately 6–8 weeks to complete the interventions,[¬e]""']",7,,"['Page 15:\n[¬s]""once a week[¬e]""']",1,,NA,Not specified,,['Quantitative'],"['Page 12:\n[¬s]""Prior to the beginning of the\nproject, teachers in the intervention conditions were given a brief training session\nin a two-hour meeting on how to implement the lessons; the instructional materials\nwere designed to be mainly self-explanatory for the teachers. Further, to enable the\nteachers to present the intervention with ﬁdelity, in both intervention conditions\nthey were given a script, which contained the speciﬁc statements and questions\nthat they were to use when teaching the lessons. To assess the ﬁdelity of the\nimplementations for the two types of interventions, a member of the research\nteam observed and videotaped 2–3 small groups for each activity within each\nintervention classroom. The measure of ﬁdelity across the four activities for each\nteacher included 12 criteria, based on the main objectives for the activities. For\nexample, in the construction of thewall in Activity 1, thewall needed to be 2 blocks\nhigh, have few or no spaces between the blocks, and a gateway. Across teachers,\nthe average ﬁdelity score was 96% of the objectives achieved (one teacher in each\ntype of intervention missed one of the criteria).[¬e]""']",NA,,['No'],NA,NA,,['The developer'],"['Page 22:\n[¬s]""Because there is so little known about children’s block building behaviors, a quali-\ntative description of the general types of block building behaviors observed during\nthe intervention conditions is presented ﬁrst. This is followed by a description of\nthe block building behaviors within the control condition found during the open-\nended, unstructured block play. Next, a qualitative analysis of the levels of block\nbuilding performance found during the pre- and post-test block building tasks is\ndescribed in detail, with drawings representing structures built by the children at\neach level of block building. We then moved to the quantitative analysis of the\ndata, statistically examining the effects of the different conditions on the spatial\nskills assessed in the pre- and post-test tasks.[¬e]""']",NA,,No,,['Yes'],"['Page 31:\n[¬s]""analyses were conducted on the pre-test scores. A 2 × 3 MANOVA,\ngender (male vs. female) by condition (story + block building intervention vs.\nblock building–alone intervention vs. control) was performed, using the pre-test\nblock building score, pre-test block design score, and the pre-test mental rotation\nscore as the dependent measures. The multivariate analysis showed amain effect of\ngender, with the boys scoring signiﬁcantly higher than the girls, F(1,103) = 2.98,\np = .035. The univariate analysis showed that this effect was carried by the mental\nrotation task F(1,103) = 8.29, p = .005, with the boys (M = 5.39, SD = 2.63,\nn = 41) scoring higher than the girls (M = 4.08, SD = 2.06, n = 48). There\nwere no signiﬁcant gender differences for the block building and block design\npre-test scores. In addition, the interaction between gender and condition was not\nsigniﬁcant.[¬e]""']",NA,,['Yes'],NA,NA,,['Yes'],NA,NA,,"['Gender', 'Educational attainment']","['Page 31:\n[¬s]""ith the boys scoring signiﬁcantly higher than the girls, F(1,103) = 2.98,\np = .035. The univariate analysis showed that this effect was carried by the mental\nrotation task F(1,103) = 8.29, p = .005, with the boys (M = 5.39, SD = 2.63,\nn = 41) scoring higher than the girls (M = 4.08, SD = 2.06, n = 48). There\nwere no signiﬁcant gender differences for the block building and block design\npre-test scores[¬e]""']",NA,,['No'],NA,NA,
74577994,Casey (2008) 1_2,2008,NA,NA,,"['Page 2:\n[¬s]""block-building interventions to develop spatial-\nreasoning skills in kindergartners[¬e]""']",NA,,"['Page 2:\n[¬s]""Two intervention conditions and a control condi-\ntion were included to determine, ﬁrst, whether the block building activities them-\nselves beneﬁted children’s spatial skills, and secondly, whether a story context further\nimproved learning. Spatial measures included: spatial visualization, mental rotation,\nand block building.[¬e]""']",NA,,"['Page 4:\n[¬s]""to determine whether interventions involving block\nbuilding are effective in improving spatial skills in kindergartners. S[¬e]""']",NA,,['School or group of schools'],"['Page 12:\n[¬s]""The study employed a quasi-experimental design in which the three classrooms\nfrom each community were randomly assigned to one of three conditions—two\nintervention conditions and one control condition. Prior to the beginning of the\nproject, teachers in the intervention conditions were given a brief training session\nin a two-hour meeting on how to implement the lessons;[¬e]""']",NA,,['Yes (Please specify)'],"['Page 12:\n[¬s]""Prior to the beginning of the\nproject, teachers in the intervention conditions were given a brief training session\nin a two-hour meeting on how to implement the lessons; the instructional materials\nwere designed to be mainly self-explanatory for the teachers[¬e]""']",NA,,['Students'],"['Page 2:\n[¬s]""the use of block-building interventions to develop spatial-\nreasoning skills in kindergartners.[¬e]""']",NA,,['Small group/intensive support (3-5)'],"['Page 12:\n[¬s]""Both\nthe intervention and control group teachers were asked to use their knowledge of\nthe students to break up their class into small heterogeneous groups of 3–5 chil-\ndren, and the children stayed in these groups across the activities.[¬e]""']",NA,,['No'],NA,NA,,['No'],NA,NA,,['During regular school hours '],"['Page 11:\n[¬s]""Both school systems used new\nmath curricula based on the latest NCTM standards (NCTM, 2000); the school\nsystem in the Northeast used the Investigations in Number, Data, and Space\nseries (TERC, 2007), and the school system in the Southwest used the Everyday\nMathematics series (Wright Group/McGraw-Hill, 2001)[¬e]""']",NA,,['Class teachers'],"['Page 14:\n[¬s]""The story was introduced by the teacher before each lesson, by having the\nchildren sit down, one behind the other, holding on, and imagining that they\nwere riding on the back of Sneeze,[¬e]""']",NA,,"['Page 15:\n[¬s]""6–8 weeks to complete the interventions,[¬e]""']",7,,"['Page 15:\n[¬s]""y occurring once a week[¬e]""']",1,,NA,Not specified,,"['Qualitative', 'Quantitative']","['Page 12:\n[¬s]""Prior to the beginning of the\nproject, teachers in the intervention conditions were given a brief training session\nin a two-hour meeting on how to implement the lessons; the instructional materials\nwere designed to be mainly self-explanatory for the teachers.[¬e]""', 'Page 12:\n[¬s]""The study employed a quasi-experimental design in which the three classrooms\nfrom each community were randomly assigned to one of three conditions—two\nintervention conditions and one control condition. Prior to the beginning of the\nproject, teachers in the intervention conditions were given a brief training session\nin a two-hour meeting on how to implement the lessons; the instructional materials\nwere designed to be mainly self-explanatory for the teachers.[¬e]""']",NA,,['No'],NA,NA,,['The developer'],"['Page 35:\n[¬s]""It should be noted that this is now the second study documenting the effec-\ntiveness of storytelling sagas as a medium for improving spatial skills (Casey\net al., 2008). In our prior research, we examined the development of geometry\nskills using part-whole relations puzzle tasks similar to tangram puzzles. Again,\nwe found that the story + geometry intervention condition was more effective\nthan the de-contexualized geometry-alone intervention in improving children’s\npart–whole relations skills. Collectively, our studies offer further documentation\nof the effectiveness of providing an extended literacy/mathematics connection for\nyoung children, and they lend credence to earlier ﬁndings on the advantages of\nintegrating literature with mathematics using trade books (Hong, 1996; Jennings\net al., 1992; Young-Loveridge, 2004).[¬e]""']",NA,,No,,['Yes'],NA,NA,,['No'],NA,NA,,['Yes'],NA,NA,,"['Gender', 'Educational attainment']",NA,NA,,['No'],NA,NA,
71090273,Cavanaugh (2017),2017,NA,NA,,"['Page 1:\n[¬s]""literacy-rich\nsociodramatic guided play[¬e]""']",NA,,"['Page 1:\n[¬s]""During this short time, students working in small\ngroups were given materials (miniature items, toys, letter\ntiles) to practice initial letter sounds and consonant–vowel–\nconsonant rhyming word families using either an assigned\nactivity (control condition) or a student-invented game that\npracticed the same literacy concepts (experimental activ-\nity).[¬e]""', 'Page 4:\n[¬s]""Two types of materials were used in the study. The first\ntype was a set of ten to twenty objects (mostly toys or min-\niature items), all starting with the same initial sound and\nletter, housed in a container (or tub) labeled with the let""\n""Students in the control condition used the teacher-given\nactivity only. Students in the experimental condition used""\n""The\nteacher-given activity for use with these materials was: (1)\nChoose two containers/two letters. (2) Open the first con-\ntainer. Remove the objects, one at a time, saying the ini-\ntial sound and then the name of the object as each object\nis placed on the work surface with space between objects.\n(3) Then, open the second container. In a similar man-\nner, remove those objects individually, saying their initial\nsounds and names, and place them in-between the objects\nfrom the other container so that the objects from the two\ncontainers are mixed together, but visible. (4) Choose an\nobject, say its name, and sort it back into the correct con-\ntainer. (5) Continue until all objects have been sorted into\nthe correct containers. (6) Choose two more containers or\nwork with the word family materials for the rest of the work\ntime[¬e]""', 'Page 5:\n[¬s]""the teacher-given activity once and then were directed to invent their own games that practiced the initial sounds of words. If students could not generate a game, the teacher gave another example of a possible game and coached them to generate ideas for a game.""\n""The second type of material was a rhyming consonant–\nvowel–consonant word family housed in a plastic bag.\nSee Fig. 2. The teacher-given activity for the word fam-\nily sets was: (1) Remove the items from the bag and turn\nthem so the letters face upward. (2) Lay out the letters\nfor the word endings, the rime, for example, in Fig. 2, the\nrime for the top word family is “an.” (3) Choose one o""\n""As with the initial sound activities, students in the\ncontrol condition only used the teacher-given activities.\nStudents in the experimental condition used the teacher-\ngiven activity once and then were asked to generate their\nown games that practiced word family concepts.[¬e]""']",NA,,"['Page 1:\n[¬s]""This study explored the effects of literacy-rich\nsociodramatic guided play on kindergarten student literacy\nperformance and behavior.[¬e]""', 'Page 3:\n[¬s]""The goal of this investigation was to determine how guided\nplay, in which children invented new skill-focused games\nto practice literacy skills, compared to children engaging in\nteacher-prescribed activities concerning the same literacy\nskills, affected student scores on a standardized assessment,\ninfluenced use of the targeted letters in journal writing, and\nimpacted student behaviors during the intervention or con-\ntrol activities.[¬e]""']",NA,,['University/ researcher design'],"['Page 4:\n[¬s]""This study was approved by the Human Subjects Com-\nmittee of the authors’ overseeing university and the partici-\npating school principals[¬e]""']",NA,,['No'],NA,NA,,['Students'],"['Page 4:\n[¬s]""All children received the same grade-level appropri-\nate literacy lessons throughout the school day[¬e]""']",NA,,['Small group/intensive support (3-5)'],"['Page 1:\n[¬s]""During this short time, students working in small\ngroups[¬e]""', 'Page 4:\n[¬s]""During this time, small\ngroups of students were provided hands-on materials to\npractice phonemic awareness and phonics.[¬e]""']",NA,,['No'],NA,NA,,['No'],NA,NA,,['During regular school hours '],"['Page 4:\n[¬s]""All children received the same grade-level appropri-\nate literacy lessons throughout the school day[¬e]""']",NA,,['Class teachers'],"['Page 4:\n[¬s]""The\nteacher-given activity for use with these materials was[¬e]""']",implied although not stated somewhere explicitely,,"['Page 4:\n[¬s]""Students in\neach classroom were divided into two stratified groups\nbased on sex, English language proficiency, and general\nacademic ability, Group A and Group B. Group A in each\nclassroom began with the control condition while Group\nB experienced the experimental activities. Then, after 3\nweeks, a midpoint test was given and the groups switched""\n""conditions.[¬e]""']",3,,NA,not stated,,"['Page 4:\n[¬s]""All children received the same grade-level appropri-\nate literacy lessons throughout the school day except for a\nsmall part of the instructional time (15 min) in which the\nstudy’s intervention took place[¬e]""']",15,,['No implementation details provided.'],NA,NA,,['No'],NA,NA,,['The developer'],"['Page 4:\n[¬s]""This study was approved by the Human Subjects Com-\nmittee of the authors’ overseeing university and the partici-\npating school principals[¬e]""']",NA,,No,,['No/Unclear'],NA,NA,,['No'],NA,NA,,['No'],NA,NA,,NA,NA,NA,,['No'],NA,NA,
71090274,Christie (1983),1983,NA,NA,,"['Page 2:\n[¬s]""play tutoring[¬e]""']",NA,,"['Page 4:\n[¬s]""assistant at\ntempted to engage the subjects in sociodramatic play by\nproviding themes and appropriate props. Four""\n""The assistant observed each child\'s play during these\nsessions and noted if any of Smilansky\'s six sociodra\nmatic play behaviors were missing. If a child was not ex\nhibiting one or more of these behaviors, the assistant\nused Smilansky\'s (1968) two play training procedures to\nencourage the child to incorporate the missing elements\ninto his or her play. T[¬e]""']",NA,,"['Page 3:\n[¬s]""The present study had two purposes: a) to discover if\nplay tutoring results in stable gains in verbal intelligence\nand creativity; and b) to determine which factor?play\nor adult contact?is primarily responsible for gains\nbrought about by play tutoring[¬e]""']",NA,,['University/ researcher design'],NA,NA,,['Unclear/ Not specified'],NA,NA,,['Students'],NA,NA,,['Small group/intensive support (3-5)'],"['Page 4:\n[¬s]""revious experience\nworking with preschool students. The subjects were\ntaken in groups of five to a separate room that con\ntained props or materials appropriate to the treatmen[¬e]""']",NA,,['No'],NA,NA,,['No'],NA,NA,,['During regular school hours '],NA,NA,,['Research staff'],"['Page 4:\n[¬s]""on the third sample.\nTreatments. The treatment sessions were administered\nby a graduate assistant who had previous experience\nworking with preschool student[¬e]""']",NA,,"['Page 3:\n[¬s]""period of nine weeks[¬e]""', 'Page 3:\n[¬s]""Subjects in the experimental\ngroup received nine 20-minute play tutoring sessions\nover a period of nine weeks[¬e]""']",9,,NA,1,,"['Page 2:\n[¬s]""e 20-minute sessio[¬e]""', 'Page 3:\n[¬s]""Subjects in the experimental\ngroup received nine 20-minute play tutoring sessions\nover a period of nine weeks.[¬e]""']",20,,['Qualitative'],NA,NA,,['No'],NA,NA,,['The developer'],NA,NA,,No,,['Yes'],"['Page 5:\n[¬s]""Table 1.?D""\n""Pretest[¬e]""']",NA,,['No'],NA,NA,,['No'],NA,NA,,NA,NA,NA,,['No'],NA,NA,
