71090275,Cohrssen (2019),2019,NA,NA,,"['Page 2:\n[¬s]""NT Preschool Maths\nGames[¬e]""', 'Page 6:\n[¬s]""NT Preschool Maths Games[¬e]""']",NA,,"['Page 5:\n[¬s]""The Northern Territory Department of Education has responded to this complexity by\ncommissioning the development of the NT Preschool Maths Games to assist teachers to\nincorporate play-based mathematics in their curricula. Each game is designed to be used\nwith small or large groups of learners to facilitate peer scaﬀolding. Games include a brief\ndescription of the underpinning mathematical concepts, learning objectives to work\ntowards and assess impact on child outcomes, vocabulary to model, and step-by-step\ninstructions.[¬e]""', 'Page 7:\n[¬s]""The games address number and counting, shapes and spatial thinking,\npatterns and structure, measurement, and data collection, representation and analysis.\nEach game includes ideas for extension and drop-back activities to support teachers plan-\nning for diﬀerentiated teaching.[¬e]""']",NA,,NA,improve outcomes in mathematics and support curriculum delivery,,['University/ researcher design'],NA,NA,,['Yes (Please specify)'],"['Page 6:\n[¬s]""At the start of Term 1, preschool teachers in Group 1 attended a workshop\non the NT Preschool Maths Games and inclusion of the games in their programmes com-\nmenced immediately.[¬e]""']",NA,,['Students'],NA,NA,,['Small group/intensive support (3-5)'],"['Page 7:\n[¬s]""Games are designed,\nin the main, to be for small-group implementation.[¬e]""']",NA,,['No'],NA,NA,,['No'],NA,NA,,['During regular school hours '],NA,NA,,['Class teachers'],NA,NA,,"['Page 6:\n[¬s]""The ﬁrst-round of child assessment took place in the preschool classrooms over four\ndays in early February 2017 (t1), and children were reassessed during four days in mid-\nJune (t2), the ﬁnal week ofTerm 2.[¬e]""']",13,,"['Page 8:\n[¬s]""Explicit learning objectives equip teachers to recognise child learning that\nis spontaneously demonstrated in play as well as purposefully taught. Asking open-ended\nquestions that encourage critical and creative thinking may be challenging for teachers\n(Birbili 2013). Consequently, prompts for open-ended questions and questions that\nprompt children to hypothesise and explain their thinking are provided in the games to\npromote child engagement and learning (Hunter 2007), and the rehearsal and extension\nof mathematical vocabulary[¬e]""']",not specified,,NA,not specified,,['Qualitative'],"['Page 8:\n[¬s]""The challenges of conducting systematic education research in the Northern Territory\ninclude high teacher turnover and variable student attendance (see, for e.g. Helmer et al.\n2014). These challenges were apparent in our project. At t1, between item 2 (counting\ntask) and item 10 (number naming) some children were not assessed with all instruments\ndue to language constraints or refusals to participate in part of the assessment. At t2, 17\nchildren were absent due to holidays, illness or children’s families moving away. This sub-\nsample of children with incomplete data did not diﬀer signiﬁcantly from the remaining\nchildren in regard to sex, age, or their scores in the numerical tasks (all p> .05). Whilst\nthe assistant teacher in Room 3 undertook to continue the roll-out of the games during\nthe lead teacher’s absence, we decided to exclude the children attending Room 3 as they\nhad experienced a one-month break in the delivery of the games by the teacher who\nhad undertaken the professional learning workshop.[¬e]""']",NA,,['No'],NA,NA,,['The developer'],NA,NA,,No,,['Yes'],"['Page 11:\n[¬s]""Table 2. Descriptive statistics for intervention vs delayed-intervention group (ratio, means and\nstandard deviations).""\n""Counting t1\nNumber naming t1\nApplied Problems t1\nMath total score t1[¬e]""', 'Page 9:\n[¬s]""no statistically signiﬁ-\ncant diﬀerences were observed between the intended population (including Room 3)\nand the population that was retained for the purposes of analysis (excluding Room 3).[¬e]""']",NA,,['No'],NA,NA,,['No'],NA,NA,,NA,NA,NA,,['No'],NA,NA,
71090278,Dejonckheere (2016),2016,NA,NA,,"['Page 3:\n[¬s]""inquiry-based didactic\nmethod encouraging scientific reasoning in children of[¬e]""', 'Page 4:\n[¬s]""4–6 years of age.[¬e]""']",NA,,"['Page 3:\n[¬s]""inquiry-based didactic\nmethod encouraging scientific reasoning in children of[¬e]""', 'Page 4:\n[¬s]""4–6 years of age. It includes 15 activities that aim to\nprovoke a set of domain general process skills such as\nobserving, describing,\ncomparing, questioning,\npredicting, experimenting, reflecting and cooperating.\nSecondly, we design a test in order to quantify learning\ngains at the level of inquiry. The main research\nquestion in this study is whether the inquiry-based\nteaching affects real experimenting.[¬e]""', 'Page 7:\n[¬s]""The intervention was only for the\nexperimental group. Controls could not play and\nexperiment with the different activities; they only\nperformed pre- and post-tests and followed their\nnormal classroom courses. During the intervention of\nthe experimental group, 15 activities were used. In\neach session, two to four activities were selected at the\nsame time. Each activity was selected at least twice.\nActivities were presented in a separate corner of the\npreschool classroom and could be chosen by the\nchildren during the course: free playing initiative. For\nall the activities, the contexts of science subjects were\nconnected to the themes that were going on at that\nmoment in the classrooms in order to reach a maximal\nimmersion in the environment. Each child played at\nleast 10 times in the science corner (see Figure 3 for an\nexample).""\n""The activities during the intervention consisted of\nthree different phases. In the introduction phase (the\nwhole class group), the teacher presented the materials\nfor the selected activities. It was shown what one could\ndo with these materials, and a link was established\nwith the child’s actual knowledge. For instance for\nfloating and sinking, it was asked what rubber ducks do\n(floating or sinking) or it was asked what kind of\nmaterials should sink or float, and so on (see Table 2\nfor an overview). No instructions were given. The\nsecond phase is the exploration phase, where children\ncould freely play with the materials. This was done in\nsmall groups of children (three to five children) and\ntook place in one to two science corners. Children\nplayed in each session for about a maximum of 40\nminutes. The third part was called the trigger phase, in\nwhich the teacher posed probe questions in order to\nfocus the exploration activities to the causal and non-\ncausal variables[¬e]""']",NA,,"['Page 1:\n[¬s]""tested and integrated the effects of an inquiry-based didactic method for preschool science in a real practical\nclassroom setting.[¬e]""']",NA,,['School or group of schools'],"['Page 1:\n[¬s]""a real practical\nclassroom setting.[¬e]""']",NA,,['Yes (Please specify)'],"['Page 7:\n[¬s]""The teacher was a final year student of our teacher\neducation department. The purpose and goals of our\nstudy were explained to her, and she received specific\nguidelines to organise and follow up the 15 activities.[¬e]""']",NA,,['Students'],"['Page 1:\n[¬s]""Compared to controls, children in the post-test showed significant\nlearning gains in the development of the so-called control of variables strategy.[¬e]""']",NA,,['Large group/class teaching (+6)'],"['Page 1:\n[¬s]""Four preschool classrooms[¬e]""']",NA,,['No'],NA,NA,,['No'],NA,NA,,['During regular school hours '],"['Page 1:\n[¬s]""real practical\nclassroom setting.[¬e]""']",NA,,['Class teachers'],"['Page 7:\n[¬s]""The teacher was a final year student of our teacher\neducation department. The purpose and goals of our\nstudy were explained to her, and she received specific\nguidelines to organise and follow up the 15 activities.[¬e]""']",NA,,"['Page 4:\n[¬s]""The intervention phase consisted of 15\nactivities that were spread over 7 consecutive weeks[¬e]""']",7,,"['Page 4:\n[¬s]""The intervention phase consisted of 15\nactivities that were spread over 7 consecutive weeks[¬e]""']",2.14,,"['Page 7:\n[¬s]""Children\nplayed in each session for about a maximum of 40\nminutes.[¬e]""']",40,,['No implementation details provided.'],NA,NA,,['No'],NA,NA,,['The developer'],"['Page 4:\n[¬s]""The experimenter was a final year pre-service\npreschool teacher. In the context of her research stage,\nshe assessed and coded both the pretests and the post-\ntests.[¬e]""']",NA,,No,,['No/Unclear'],NA,NA,,['Unclear or details not provided'],NA,NA,,['N/A'],NA,NA,,NA,NA,NA,,['No'],NA,NA,
71090280,Dickinson (2019),2019,NA,NA,,"['Page 6:\n[¬s]""Read-Play-Learn (RPL) Project[¬e]""', 'Page 7:\n[¬s]""reading plus play (R + P)[¬e]""']",Referenced in this study as reading plus play,,"['Page 11:\n[¬s]""Children in both conditions heard four books during the course of 12 weeks (3 weeks per\nbook). Each book was read four times. To keep the teaching and learning load manage-\nable, the 16 taught words were split into two groups, with one half serving as the “focus\nwords” on Reading Days 1 and 2 and the other half serving as focus words on Reading\nDays 3 and 4. “Focus words” received rich explanation (described in the next paragraph)\nwhile the remaining 8 words were read aloud as they appeared in the book but were not\ndiscussed during the session.[¬e]""', 'Page 12:\n[¬s]""Children in the R + P condition participated in three adult-directed play sessions related\nto each book. As the goal of the play session was to provide opportunities for children to\nuse words in a meaningful context in accordance with their play ideas, we incorporated\ntechniques that encouraged children’s use of the words.""\n""Teachers were given guidance cards that\noutlined ways to discuss what was happening in each picture, use each word, provide the\ndeﬁnition, and ask children to say it. The use of gestures was encouraged. To provide\nopportunities for children to use words in their play, we incorporated techniques that have\nbeen found to be useful in previous word-learning research (McKeown & Beck, 2014)as\nwell as new research on play (Dickinson et al., in press).[¬e]""']",NA,,"['Page 6:\n[¬s]""Here, we report results from the ﬁnal year of the Read-Play-Learn (RPL) Project and\ndescribe the 2-year process of creating, testing, and reﬁning methods for preschool\nteachers to use to teach vocabulary through book reading and teacher-guided play.[¬e]""']",To compare the effectiveness of booking reading vs. reading plus play on vocabulary learning of young children from low income backgrounds.,,['University/ researcher design'],"['Page 8:\n[¬s]""The RPL Project spanned 3 years. The ﬁrst 2 years were dedicated to developing and\nreﬁning strategies. In Year 3, we tested our methods. In the ﬁrst 2 years, we created our\nmethods, tested to see if the methods were eﬀective when used with high ﬁdelity, and\nmade adjustments as we turned the instruction over to teachers. Our goal was to ensure\nusability in preschool classrooms while retaining the eﬀectiveness that we obtained when\nusing our controlled form of delivery by trained intervention specialists (ISs).[¬e]""']",NA,,['Yes (Please specify)'],"['Page 13:\n[¬s]""Research team members called ISs acted as coaches to assist teachers in adopting the\nreading and play approaches. The amount of coaching provided was decreased during the\nyear. For Book 1, coaches observed three or four readings and each type of play (reenact-\nment on Days 1 and 2 and new scenario on Day 3). For the remaining books, coaching\ndecreased from two readings and a minimum of two sessions of each type of play for\nBooks 2 and 3 to one reading and one play session.[¬e]""']",NA,,['Students'],NA,NA,,['Small group/intensive support (3-5)'],"['Page 8:\n[¬s]""Finding time\nfor three or four 12-min to 15-min play sessions with groups of three to ﬁve children\nproved to be a challenge for many.[¬e]""']",NA,,['No'],NA,NA,,['No'],NA,NA,,['During regular school hours '],"['Page 8:\n[¬s]""We were\nfaced with a multitude of practical challenges, and as we grappled with them, we\nacquired considerable practical knowledge related to delivering interventions in class-\nrooms. Our eﬀorts also led us to try out diﬀerent approaches to teaching that shed new\nlight on vocabulary acquisition in classrooms.""\n""There was limited time to teach words during group book\nreading due to competing demands on teachers’ time and children’s attention spans.\nTime was a particularly pressing matter for our play methods because it required\nteachers to work with small groups of children across several sessions. Finding time\nfor three or four 12-min to 15-min play sessions with groups of three to ﬁve children\nproved to be a challenge for many.[¬e]""']",NA,,['Class teachers'],"['Page 7:\n[¬s]""All teachers held a bachelor’s degree, and nine held master’s degrees. The\naverage number of years of teaching experience in the ﬁeld of early childhood educa-\ntion was 15.4 years (range = 1–40 years). The same classrooms participated throughout\nthe year, and fall and spring samples were very similar.[¬e]""']",NA,,"['Page 10:\n[¬s]""September to March.[¬e]""']",25,,"['Page 11:\n[¬s]""To keep the teaching and learning load manage-\nable, the 16 taught words were split into two groups, with one half serving as the “focus\nwords” on Reading Days 1 and 2 and the other half serving as focus words on Reading\nDays 3 and 4. “Focus words” received rich explanation (described in the next paragraph)\nwhile the remaining 8 words were read aloud as they appeared in the book but were not\ndiscussed during the session.[¬e]""']",4,,"['Page 8:\n[¬s]""12-min to 15-min play sessions[¬e]""']",13.5,,['Quantitative'],"['Page 18:\n[¬s]""The mean ?delity of implementation of book reading was strong for vocabulary picture\ncard review behaviors before reading: 77% in the fall and 87% in the spring. Mean ?delity\nfor behaviors during the reading was marginal: 63% in the fall and 62% in the spring, with\nscores being depressed because of weak adherence to the strategy of asking children to use\nthe words and comprehension-questioning strategies.""\n""There was much variability in the degree of ﬁdelity to the play methods. In the preplay\nword review on Days 1 and 2, most teachers had a mean proportion of more than 80%\n(and all had more than 60%).""\n""Teachers’ average\nproportion of vocabulary review behaviors during play ranged from 32% to 88%.[¬e]""', 'Page 19:\n[¬s]""Similarly, the average proportion of 1-min segments in which they built on children’s\ncontributions (a main indicator of the play style) ranged from 40% to 78%. When we\nexamined the relationship between individual teachers’ scores on the two measures of\nﬁdelity during play—vocabulary review and play style—there was a signiﬁcant negative\ncorrelation (r = –.64, p < .05), indicating that teachers who tended to do better on one\naspect of ﬁdelity tended to do worse on the other.[¬e]""']",NA,,['No'],"['Page 26:\n[¬s]""This research was conducted as part of award R305A110128 from the Institute of Education\nSciences, U.S. Department of Education to Vanderbilt University, Temple University, the\nUniversity of Delaware, and Lehigh University.[¬e]""']",NA,,['The developer'],NA,NA,,No,,['Yes'],"['Page 17:\n[¬s]""We found\nno diﬀerences at baseline associated with condition[¬e]""']",NA,,['Yes'],"['Page 17:\n[¬s]""we used multiple-level modeling that\naccounted for nesting of children within classrooms, and we had covariates for site,\npretest, age, gender, English language learner (ELL) status, phase, and theme.\nComparing pretest to posttest growth in taught words compared with control words for\nboth measures, we found no diﬀerence between conditions (see online supplement\nTable 3)[¬e]""']",NA,,['Yes'],"['Page 17:\n[¬s]""and we had covariates for site,\npretest, age, gender, English language learner (ELL) status, phase, and theme[¬e]""']",NA,,"['Educational attainment', 'Gender', 'Other (please specify)']",NA,ELL,,['Yes'],NA,NA,
71090284,Fisher (2013) 1_1,2013,NA,NA,,"['Page 1:\n[¬s]""Guided Play[¬e]""']",NA,,"['Page 3:\n[¬s]""Guided play. Participants were taught de?nitional\nproperties for each shape in a playful, exploratory\nmanner. The experimenter asked the child “Did you\nknow all shapes have secrets? Today I need your\nhelp in discovering the secret of the shapes” and\nboth donned make-believe detective hats. For each\nshape category, the experimenter af?xed four exem-\nplar cards (two typical, two atypical) on the felt\nboard in front of the child, pointed to the exemplars,\nand said that all of the shapes were “real” shapes,\nalthough they looked different. The experimenter\nthen asked the child to help her ?gure out the\nshapes’ secret—what makes them “real” shapes.""\n""After approximately 10 s of exploration, the experi-\nmenter helped the child “discover” each shape’s dis-\ntinguishing features through questions and by\nencouraging the child to touch or trace shapes as\nthey examined the exemplar cards. After training,\nthe construction sticks were laid out in the pre-\nscribed shape forms, one at time. The child was\nasked to construct two new shapes and to describe\nhow these new shapes were similar to those on the\ntraining cards. This process was repeated for each\nshape.[¬e]""']",NA,,"['Page 1:\n[¬s]""improved shape knowledge[¬e]""', 'Page 2:\n[¬s]""We hypothesized that children in\nguided play, more than children in didactic instruc-\ntion or free play, would show improved under-\nstanding of the standard features of shapes[¬e]""']",to improve shape knowledge,,['University/ researcher design'],"['Page 3:\n[¬s]""One\nexperimenter worked individually with each child.[¬e]""']",NA,,['Unclear/ Not specified'],NA,"experimenter carried the intervention, he must have had training",,['Students'],NA,NA,,['One to one'],"['Page 3:\n[¬s]""One\nexperimenter worked individually with each child.[¬e]""']",NA,,['No'],NA,NA,,['No'],NA,NA,,"['During regular school hours ', 'Other (please specify)']","['Page 4:\n[¬s]""Setting and blind assessment. The experiment was\nconducted in two locations, in the lab and in a\nschool where a second experimenter—blind to the\ncondition—administered the shape-sorting task\nassessment for approximately one third of the sam-\nple (n = 23)[¬e]""', 'Page 4:\n[¬s]""Setting and blind assessment. The experiment was\nconducted in two locations, in the lab and in a\nschool where a second experimenter—blind to the\ncondition—administered the shape-sorting task\nassessment for approximately one third of the sam-\nple (n = 23).[¬e]""']",NA,,['Research staff'],"['Page 3:\n[¬s]""One\nexperimenter worked individually with each child.[¬e]""']",NA,,"['Page 3:\n[¬s]""ne\nexperimenter worked individually with each child.\nFifty-one children returned 1 week after initial\ntraining and assessment (M = 7.19 days, SD = 1.05).""\n""The study was conducted in a private room free\nfrom distractions at two separate locations in the[¬e]""', 'Page 4:\n[¬s]""The experimenter made special efforts to main-\ntain child-friendly affect across all conditions during\ntrainin[¬e]""']",1,,NA,.2,,NA,not specified,,['Quantitative'],"['Page 4:\n[¬s]""Manipulation Fidelity The experimenter made special efforts to main- tain child-friendly affect across all conditions during training. Even so, slight differences in training affect could have subtly in?uenced the outcome. We exam- ined whether perceived friendliness and warmth differed among conditions by having 40 adults rate ?fteen 5-s audio clips of the instruction periods from available audio data.""\n""Five clips were made for each condition. Clips were played in reverse so raters would not be inﬂuenced by the content of the speech. Participants rated the speaker’s level of friendliness and warmth on 7-point, Likert scales (1 = low,5 = moderate,7 = high for each dimension) for each clip. Mean friendliness and warmth scores were computed for each condition.""\n""Repeated measures analysis of variance (ANOVA) revealed a signiﬁcant effect of condition on perceived friendliness, F(2, 78) = 6.79, p = .01, gp 2 = .15; paired t tests showed free play (M = 4.74, SD = 1.01) was rated higher than didactic instruction (M = 4.33, SD = .81) or guided play (M = 4.36, SD = .79), ps < .01. Similarly, perceived warmth (M = 4.56, SD = .89) was higher in free play than didactic instruction (M = 4.02, SD .76) or guided play (M = 4.15, SD = .71), ps < .01, F(2, 78) = 13.55, p = .001, gp 2 = .26.""\n""Furthermore, didactic instruction and guided play did not differ from one another on either friendliness or warmth (ps < .17), suggesting that the experimenter’s affect was consistent across training conditions.""\n""The fact that free play was viewed\nas more friendly and warm suggests that emotional\nsupport is probably part of the construct of free play.\nImportantly, this ﬁnding suggests that an outcome in\nfavor of guided play cannot be attributed to differen-\ntial support in that condition[¬e]""']",NA,,['No'],NA,NA,,['The developer'],NA,NA,,No,,['No/Unclear'],NA,NA,,['No'],NA,NA,,['Yes'],NA,NA,,"['Gender', 'Socio-economic status']","['Page 2:\n[¬s]""r error (2), leaving\n60 children for data analysis. Children were pre-\ndominantly Caucasian and upper middle-class, and\ndivided equally among three conditions: guided\nplay (Mage = 56.77 months, SD = 6.09; 10 males),\ndidactic instruction (Mage = 57.11, SD = 6.77; 11\nmales), and free play (Mage = 55.83, SD = 5.91; 10\nmale children).[¬e]""']",NA,,['No'],NA,NA,
