id,pub_author,pub_year,strand_raw,strand_info,strand_CLEAN,int_name_ht,int_name_info,int_name_CLEAN,int_desc_ht,int_desc_info,int_desc_CLEAN,int_objec_ht,int_objec_info,int_objec_CLEAN,int_prov_raw,int_prov_ht,int_prov_info,int_prov_CLEAN,int_training_raw,int_training_ht,int_training_info,int_training_CLEAN,int_part_raw,int_part_ht,int_part_info,int_part_CLEAN,int_approach_raw,int_approach_ht,int_approach_info,int_approach_CLEAN,digit_tech_raw,digit_tech_ht,digit_tech_info,digital_tech_CLEAN,parent_partic_raw,parent_partic_ht,parent_partic_info,parent_partic_CLEAN,int_when_raw,int_when_ht,int_when_info,int_when_CLEAN,int_who_raw,int_who_ht,int_who_info,int_who_CLEAN,int_dur_ht,int_dur_info,int_dur_CLEAN,int_freq_ht,int_freq_info,int_freq_CLEAN,int_leng_ht,int_leng_info,int_leng_CLEAN,int_fidel_raw,int_fidel_ht,int_fidel_info,int_fidel_CLEAN,int_cost_raw,int_cost_ht,int_cost_info,int_cost_CLEAN,out_eval_raw,out_eval_ht,out_eval_info,out_eval_CLEAN,eef_eval_raw,eef_eval_CLEAN,base_diff_raw,base_diff_ht,base_diff_info,base_diff_CLEAN,comp_anal_raw,comp_anal_ht,comp_anal_info,comp_anal_CLEAN,comp_var_rep_raw,comp_var_rep_ht,comp_var_rep_info,comp_var_rep_CLEAN,comp_var_raw,comp_var_ht,comp_var_info,comp_var_CLEAN,clust_anal_raw,clust_anal_ht,clust_anal_info,clust_anal_CLEAN
47063511,Barnett (2008),2008,['Metacognition and self-regulation'],NA,,"['Page 1:\n[¬s]""Tools ofthe Mind (Tools) curriculum[¬e]""']",NA,,"['Page 1:\n[¬s]""focuses on the development of self-regulation at the\nsame time as teaching literacy and mathematics skills in a way that is socially mediated by\npeers and teachers and with a focus on play[¬e]""', 'Page 3:\n[¬s]""The Tools ofthe Mind (Tools) curriculum""\n""including the promotion ofself-regulation through a comprehensive system of activities. Basic principles of the curriculum include: (1) children construct their own knowledge; (2) development cannot be separated from its social context; (3) learning can lead development; and (4) language plays a central role in mental developmen""\n""Play is viewed as the primary source ofself-regulation aswell as leading\nchildren to higher levels ofdevelopment. Thus, Tools teachers donot simply “let” children play, but use a play planning process\nas well as speciﬁc interactions to actively support children’s development of “mature” play in which pretend scenarios\nare complex, planned, sustained, and involve multiple roles.[¬e]""', 'Page 4:\n[¬s]""Dramatic play is a leading mechanism for the development of self-regulation, and Tools is similar to other constructivist and play-based curricula in room arrangement, materials, and the balance between small group, large group, and play activities. However, Tools differs from other curricular models in that the teacher actively supports the development of mature intentional dramatic play, while ensuring that each child is active in the selection of activities and the creation ofthe play scenarios (Bodrova & Leong, 2007). In Tools, the teacher helps children to write play plans, teaches children to plan their dramatic play together, and helps children to think about next steps during their play with the intention of fostering the development of self-regulation. Dramatic play contributes to the development of children’s self-regulation because it is an imaginary situation governed by social rules. While pretending to be a store clerk, the child must seek to behave in ways that meet the social rules for that role, curbing immediate impulses in order to think about how to represent how a clerk would act. Dramatic play leads to the internalization of rules and expectations and places demands and constraints on the child’s behavior. In thinking about the role while talking and acting the child is relying on private speech, while play plans provide an external support and children remind each other ofthe rules and roles thereby helping each other regulate their behavior. In addition, the extensive use ofsymbols (e.g., pretending a jar lid is the cat’s ball) develops abstract thought more generally.""\n""In Tools, the teacher’s role is not just to teach skills or facts, but to help children use tools and to learn to develop tools to facilitate learning. One ofthe tools expressly taught is the use ofexternal mediators to regulate behavior. In “Buddy Reading”""\n""The “Freeze Game” is another activity speciﬁcally designed to develop self-regulation and other abilities. During the\nFreeze Game, children practice self-regulation and symbolic representation. During circle time, the teacher plays music to\nwhich she and the children dance.[¬e]""']",NA,,"['Page 1:\n[¬s]""development of self-regulation at the\nsame time as teaching literacy and mathematics skills[¬e]""', 'Page 2:\n[¬s]""emphasisonself-regulationandemergent literacy[¬e]""', 'Page 3:\n[¬s]""curriculum focuses on broad foundational skills, including children’s abilities to regulate their own social and\ncognitive behaviors, to attend and to remember on purpose, the use ofsymbolic representation, and early math skills[¬e]""']",NA,,['University/ researcher design'],NA,NA,,['Yes (Please specify)'],"['Page 6:\n[¬s]""The two groups\nof teachers received similar amounts of in-service training so that differences in this may be ruled out as an explanation for\ngroup differences. Teachers who were assigned to Tools received 4 full days of curriculum training before classes began in\nthe 2002–2003 school year.""\n""During the school year Tools teachers received 30min classroom visits approximately once a week from a Tools trainer\nto address any difﬁculties they were having with the curriculum. If a teacher expressed a speciﬁc concern the Tools trainer\nwould then schedule an appointment to come and spend more time in that teacher’s classroom. In addition to classroom\nvisits, Tools teachers received one half-day workshop and ﬁve 1-h lunchtime meetings to discuss aspects of the curriculum.[¬e]""']",NA,,"['Students', 'Teachers']","['Page 3:\n[¬s]""As the name suggests, Tools guides teachers’ daily practices to support children’s acquisition and development of various\npsychological “tools.”[¬e]""']",NA,,['Large group/class teaching (+6)'],"['Page 6:\n[¬s]""Tools sets aside a limited amount of time, 8–10min, for large group morning meeting\nand is very speci?c regarding how it is to be implemented. Tools teachers are expected to pose questions to the group of\nchildren, rather than to speci?c individuals.""\n""We found that on average large group sessions lasted 9min in Tools classroom[¬e]""']",no indication of small groups,,['No'],NA,NA,,['No'],NA,NA,,['During regular school hours '],NA,NA,,['Class teachers'],"['Page 5:\n[¬s]""In addition, treatment group teachers signed documents in which they pledged not to divulge the practices they\nwere learning to other teachers while the study was underway.[¬e]""']",NA,,"['Page 6:\n[¬s]""Children were assessed in the fall (October and November) and spring (late April through early June) of the 2002–2003\nschool year[¬e]""']",20,,"['Page 4:\n[¬s]""The school selected for this research study is located in an urban school district in New Jersey and is part of the state-\nﬁnanced full-day “Abbott” preschool education program[¬e]""']",5 ,,"['Page 5:\n[¬s]""classrooms operate for at least 6h per day[¬e]""']",360 ,,['Quantitative'],"['Page 6:\n[¬s]""Full implementation of the Tools curriculum requires speci?c materials and procedures. In addition to more general\nobservation measures discussed later, highly speci?c ?delity measures were developed to assess the extent to which the\nstudy classrooms provided required materials and followed distinctive program procedures. For example, socio-dramatic\nplay is considered to lead cognitive development during the preschool period. Thus, the curriculum calls for the use of toy\n?gures (animal or human) in each ofthe learning centers in the classroom to support children’s socio-dramatic play. To assess\n?delity ofimplementation regarding materials, a 50-item “environmental features” observation instrument was developed.\nThe scale measures the presence of materials for seven features: opening activity (circle time); play; equipment; classroom\nlabeling; books; writing; and socio-dramatic play. A criterion of 80% was established as “full” implementation for each\nfeature. Reliability scores of.85–.96were obtained prior to collecting data fromthe study classrooms. At the beginning ofthe\nyear, the Tools classrooms fully implemented three of the seven key environmental features. At years end, Tools classrooms\nfully implemented all environmental features except writing. Control classrooms did not fully implement any of the key\nenvironmental features at any time.""\n""Assessment of ﬁdelity regarding procedures focused on one particular activity that is common to many curricula, large\ngroup morning meeting (circle time). Tools sets aside a limited amount of time, 8–10min, for large group morning meeting\nand is very speciﬁc regarding how it is to be implemented. Tools teachers are expected to pose questions to the group of\nchildren, rather than to speciﬁc individuals. Fidelity of implementation in this activity was examined using video tapes of\nlarge group meetings collected midyear. We found that on average large group sessions lasted 9min in Tools classrooms\nand 19min in control classrooms. This indicated ﬁdelity to the Tools model and a clear difference between treatment and\ncontrol conditions.""\n""In addition, Tools teachers are expected to pose questions to the entire group simultaneously during\nrather than to individual children during large group time. Thus, ﬁdelity of teacher–child interaction was assessed by coding\nthe video-taped teacher and child large group time interactions for instances in which teachers posed questions to the group\nas “group talk” and questions to individual children as “individual talk.” Coders were na¨ıve with respect to the study’s focus\nand which classrooms were in the treatment or control conditions. Reliability scores ranged from .90 to .95. Tools teachers,\nbut not control group teachers, were found to direct signiﬁcantly more “group talk” than “individual talk.”[¬e]""']",NA,,['Yes (Please add details)'],"['Page 5:\n[¬s]""A total of 274 three- and four-year-old children were randomly assigned to either Tools curriculum classrooms (n=106)\nor district curriculum classrooms (n=168).""\n""As an incentive to join the\nstudy parentswere offered $20worth ofchildren’s books[¬e]""', 'Page 6:\n[¬s]""All the teachers chosen to participate in the study freely agreed to do so and signed informed consent. For their participa-\ntion, teachers were given a $100 honorarium plus $300 worth of educational supplies for their classrooms[¬e]""']",some of the costs are reported but not total costs ,,['The developer'],NA,NA,,No,,['Yes'],"['Page 10:\n[¬s]""Table 4\nComparisons of pre-test scores by treatment group (Tools versus control)[¬e]""', 'Page 6:\n[¬s]""No signiﬁcant differences\nwere found between Tools and control group children on these characteristics or on prior child care attendance, frequency of\nbeing read to in the home, and parent-reported knowledge ofnumbers, letters, and colors[¬e]""']",NA,,['No'],NA,NA,,['No'],NA,NA,,NA,NA,NA,,['Yes'],"['Page 10:\n[¬s]""Given the multi-level nature of the data, we also estimated hierarchical linear models with treatment at the classroom\nlevel. These analyses are more conservative as they recognize that children are clustered within classrooms.[¬e]""']",NA,
74671364,Baumer (2005),2005,NA,NA,,"['Page 1:\n[¬s]""The playworld educational practice[¬e]""']",NA,,"['Page 4:\n[¬s]""We created an experimental intervention consisting of a playworld practice which incorporates all the essential elements described by Lindqvist (1995) and Hakkarainen (2004): joint adult–child dramatization ofa text from children’s literature, general discussion, drawing, and free play. We used the text of C.S. Lewis’s novel, The Lion, the Witch and the Wardrobe, as the foundation of this playworld practice. This is a multifaceted text featuring a complex plot that includes sibling rivalry, betrayal, and an ultimate struggle against evil, and the action in the text takes place in two imaginaryworlds—one featuring a British country house during WWII and the other featuring Narnia, an imaginary world controlled by an evil White Witch""\n""We contrasted this playworld practice with a control intervention. Our control intervention\nmade use of the same novel, but consisted solely of practices which the teachers in this school\ntraditionally implement when reading a text to the whole class. These practices include reading,\nwriting, and discussion as a whole class, in pairs and individually, and occasionally drawing as\nwell. The intention here was to create a school activity around a certain text enhanced by outside\nadult participants, but lacking dramatization and play. The two interventions were thus matched\nin that they consisted ofthe same number ofsessions, the same number ofadults and children, and\nthe use of the same text, allowing us to isolate the effects of play and dramatization, the central\naspects of the playworld intervention.[¬e]""', 'Page 6:\n[¬s]""There were 14 sessions of the experimental intervention. These sessions also took place once\na week and lasted approximately 2 hours. Each session consisted of an enactment of the text\nfollowed by discussion and then free play or art activities.[¬e]""', 'Page 7:\n[¬s]""Concurrent with the experimental intervention, there were 14 sessions of the control inter-\nvention. These sessions also lasted approximately 2 hours.[¬e]""']",NA,,"['Page 4:\n[¬s]""providing experimental evidence about\nthe developmental outcomes of the playworld practice.[¬e]""']",NA,,['School or group of schools'],"['Page 5:\n[¬s]""The experimental class and the control class came from the same elementary public school in\nSouthern California. This school is located on a large military base and only 20% of the student\npopulation comes from non-military families. T[¬e]""']",NA,,['Unclear/ Not specified'],NA,NA,,['Students'],"['Page 1:\n[¬s]""This paper examines the effects of the playworld educational practice on the development of narrative\ncompetence in 5- to 7-year-old children[¬e]""']",NA,,['Large group/class teaching (+6)'],"['Page 6:\n[¬s]""During this time the experimental group\nengaged in the playworld practice, consisting ofjoint adult–child dramatization ofthe text, general\ndiscussion, drawing, and free play. During this time the control group engaged solely in practices\nwhich the teachers in this school traditionally implement when reading a text with the whole\nclass: the teacher reading a portion ofthe text aloud to the class, class discussion ofthe text which\nhas been read aloud, the children reading level-appropriate picture books to a partner and then\nto themselves, the children writing individually on a topic of their choice and drawing a picture\nto accompany this writing[¬e]""']",NA,,['No'],NA,NA,,['No'],NA,NA,,['During regular school hours '],"['Page 6:\n[¬s]""There were 14 sessions of the experimental intervention. These sessions also took place once\na week and lasted approximately 2 hours. Each session consisted of an enactment of the text\nfollowed by discussion and then free play or art activities[¬e]""']",NA,,"['Research staff', 'Class teachers']","['Page 6:\n[¬s]""During these sessions the teacher did not read from the book. Each session started with the\nfour researchers’ enactment of portions of the text.[¬e]""', 'Page 6:\n[¬s]""During the seventh session the teacher joined\nthe researchers in the enactment, and during almost one third ofthe sessions both the teacher and\nthe children joined the researchers in the enactment.[¬e]""']",NA,,"['Page 6:\n[¬s]""There were 14 sessions of the experimental intervention. These sessions also took place once\na week and lasted approximately 2 hours.[¬e]""']",14,,"['Page 6:\n[¬s]""once\na week[¬e]""']",1,,"['Page 6:\n[¬s]""approximately 2 hours[¬e]""']",120,,"['Qualitative', 'Quantitative']","['Page 13:\n[¬s]""The main limitation of our study is that we had only one classroom per condition and thus\na relatively small pool of cases. Also, due to the high mobility rate on the base we lost nine\nchildren (24%), and this loss was selective, as six of the nine were from the control group.\nFurthermore, the experimental and control groups were nonequivalent with regards to gender and\nethnic composition, and, due to circumstances beyond our control we were unable to test for\ncomprehension of the speciﬁc text we used in this study.[¬e]""', 'Page 5:\n[¬s]"". The teacher, a 30-year-old\nmale, had been teaching for 7 consecutive years.""\n""The teacher, a 43-year-old female, had been teaching for over 10 years.[¬e]""']",NA,,['No'],NA,NA,,['The developer'],"['Page 11:\n[¬s]""We created an experimental intervention consisting of a playworld which incor-\nporated joint adult–child dramatization of a text from children’s literature, general discussion,\ndrawing, and free play. We contrasted this playworld practice with a control intervention. Our\ncontrol intervention lacked pretend play and consisted of conventional school practices.[¬e]""']",NA,,No,,['Yes'],"['Page 8:\n[¬s]""During the pre-test condition 4/17 (24%) children in the experimental group placed the pictures\nin the correct sequence, while 11/17 (65%) did so in the post-test condition. Three ofthe 12 (25%)\nchildren in the control group constructed the appropriate sequence in the pre-test condition,[¬e]""']",NA,,['No'],NA,NA,,['Yes'],NA,NA,,"['Gender', 'Socio-economic status']","['Page 5:\n[¬s]""The participants in the experimental group included the entire class, 20 children, 13 girls and 7\nboys: 12 kindergarteners and 8 ﬁrst graders (Mage = 5.7, age range 5.3–7.2 at the time ofpre-test).[¬e]""', 'Page 5:\n[¬s]""The ethnic make-up ofthis classroom was not representative ofthe overall make-up ofthe school,\nas there were no African American children and as the majority of the children were Latino: 12\nLatino, 5 European American, 2 mixed ethnicity, and 1 Paciﬁc Islander. The teacher, a 30-year-old\nmale, had been teaching for 7 consecutive years.[¬e]""']",NA,,['No'],NA,NA,
71090268,Bierman (2015),2015,NA,NA,,"['Page 1:\n[¬s]""Research-based Developmentally Informed (REDI)\nParent program (REDI-P)[¬e]""']",NA,,"['Page 1:\n[¬s]""the Research-based Developmentally Informed (REDI)\nParent program (REDI-P) provided home visits before and after the kindergarten transition, giving parents\nevidence-based learning games, interactive stories, and guided pretend play to use with their children.[¬e]""', 'Page 4:\n[¬s]""REDI-P included 10 home visits during the\nspring of the child’s Head Start prekindergarten[¬e]""', 'Page 5:\n[¬s]""year and six “booster” sessions after the child\ntransitioned into kindergarten. Visits followed a\nwell-speciﬁed manualized curriculum, synchronized\nwith the REDI classroom curriculum and targeting\nthe same two domains of child language–emergent\nliteracy and social-emotional skills with evidence-\nbased instructional practices. Parents were shown\nhow to use dialogic reading strategies (Whitehurst\net al., 1994), and they were provided with modeling\nstories that featured characters from the classroom\nPATHS curriculum designed to teach social-emo-\ntional skills. Embedded questions in these stories\nencouraged parent–child conversations and helped\nparents reinforce target skills in areas of prosocial\nbehavior, emotional understanding, self-control,\nand problem-solving skills. Parents also received\nmonthly activity boxes containing play materials\ndesigned to support parent–child dramatic play\nand letter identiﬁcation and print concept practice\n(Senechal, 2006).[¬e]""']",NA,,"['Page 1:\n[¬s]""the REDI classroom program\nwas designed to promote child school readiness in\nthe dual domains of social-emotional development\nand language–emergent literacy skills.[¬e]""']",NA,,['University/ researcher design'],NA,NA,,['Yes (Please specify)'],"['Page 5:\n[¬s]""Parents were shown\nhow to use dialogic reading strategies (Whitehurst\net al., 1994), and they were provided with modeling\nstories that featured characters from the classroom\nPATHS curriculum designed to teach social-emo-\ntional skills. Embedded questions in these stories\nencouraged parent–child conversations and helped\nparents reinforce target skills in areas of prosocial\nbehavior, emotional understanding, self-control,\nand problem-solving skills. Parents also received\nmonthly activity boxes containing play materials\ndesigned to support parent–child dramatic play\nand letter identi?cation and print concept practice\n(Senechal, 2006).""\n""Although home visitors were dis-\npersed geographically, they came together for\nformal training workshops held at the start of the\nprogram (3 days) and midway through the pro-\ngram (2 days). Home visitors also participated\ntogether in a weekly group supervision call to\ndebrief completed sessions and discuss the concepts\nand activities in the upcoming sessions. To main-\ntain program ﬁdelity, home visitors also had a\nweekly individual supervision call with the inter-\nvention supervisor to report on their progress with\nspeciﬁc families and get feedback regarding any\nimplementation challenges.[¬e]""']",NA,,['Students'],NA,NA,,['One to one'],NA,NA,,['No'],NA,NA,,['Yes'],NA,NA,,['Evenings and/or weekends'],"['Page 4:\n[¬s]""REDI-P included 10 home visits during the\nspring of the child’s Head Start prekindergarten[¬e]""', 'Page 5:\n[¬s]""year and six “booster” sessions after the child\ntransitioned into kindergarten.[¬e]""']",NA,,['Parents/carers'],NA,NA,,NA,not specified,,NA,2,,NA,not specified,,['Qualitative'],"['Page 5:\n[¬s]""To main-\ntain program ﬁdelity, home visitors also had a\nweekly individual supervision call with the inter-\nvention supervisor to report on their progress with\nspeciﬁc families and get feedback regarding any\nimplementation challenges. In addition, the supervi-\nsor made a bimonthly visit to each site, attending\n20% of the home visits to provide individual feed-\nback and guidance to each home visitor, and to\nassure standard intervention implementation across\nthe various home visitors.[¬e]""']",NA,,['No'],NA,NA,,['The developer'],NA,NA,,No,,['Yes'],"['Page 8:\n[¬s]""Table 2\nIntervention Effects on Child Skills and Parent Support for Learning""\n""Pre""\n""Pre[¬e]""']",NA,,['Yes'],"['Page 7:\n[¬s]""Additional Covariates[¬e]""']",NA,,['No'],NA,NA,,NA,NA,NA,,['No'],NA,NA,
