61218207,Korat (2013) PE,2013,['Parental engagement'],NA,,"['Page 1:\n[¬s]""shared book reading: E-books\nand printed books[¬e]""']",NA,,"['Page 5:\n[¬s]""The printed book. The children’s book used in this study is called Yuval Hamebulbal (Confused Yuva""\n""The e-book. The e-book used in the research is based on the printed book Yuval\nHamebulbal.""\n""The children in this study worked only on the ‘read\nstory and play’ and ‘read story with dictionary’ channels. All channels include an oral\nreading of the printed text by a narrator. The e-book incorporates automatic dynamic\nvisuals that dramatize story details, fragments and the complete story scene as well as\nextra music and film effects that may ‘bring the story content to life’. The e-book has\na forward button (a colored arrow that points to the right) and a backward button (an\narrow that points to the left) on each screen in order to stimulate the children’s read-\ning orientation and involvement, thereby allowing them to return to previous screens\nor continue to the next one. A function that allows the children to re-read/re-listen to\nthe text is also available.""\n""The highlighting of written phrases as the text is declaimed[¬e]""', 'Page 7:\n[¬s]""All mothers were visited in their home by the researcher. They were given the target book (electronic or printed book according to the group to which they were assigned) and were asked to read it to their children during the next 2 weeks in five dif- ferent sessions.""\n""The reading instructions\nincluded raising questions about the story content (problems, solutions), learning new\nwords, pointing to the written text while reading, playing with words (rhyming, divid-\ning into syllables and sub-syllables) and reading important words that were repeated in\nthe text.""\n""For example, it was suggested that mothers explain new words to the children, and\nthey were given a list of the dictionary target words in the book. They were also given a[¬e]""', 'Page 8:\n[¬s]""Examples of mothers’ instruction levels while book reading with their children.[¬e]""']",NA,,"['Page 4:\n[¬s]""promote\nlanguage skills (word comprehension and phonological awareness) of LSES pre-\nkindergarten children (aged 3–4 years)[¬e]""']",NA,,['University/ researcher design'],"['Page 7:\n[¬s]""All mothers were visited in their home by the researcher.[¬e]""']",NA,,['Yes (Please specify)'],"['Page 7:\n[¬s]""All mothers were visited in their home by the researcher.""\n""and were asked to read it to their children during the next 2 weeks""\n""They were\nalso given recommendations on how to read the books with their children. Suggestions\nfor support in book reading followed principles developed in previous research (Korat,\nRon, & Klein, 2008), following Vygotsky’s theory (1978). The reading instructions\nincluded raising questions about the story content (problems, solutions), learning new\nwords, pointing to the written text while reading, playing with words (rhyming, divid-\ning into syllables and sub-syllables) and reading important words that were repeated in\nthe text.[¬e]""']",NA,,"['Students', 'Parents']","['Page 7:\n[¬s]""All mothers were visited in their home by the researcher. They were given the target book (electronic or printed book according to the group to which they were assigned) and were asked to read it to their children during the next 2 weeks in five dif- ferent sessions. The mothers were asked to hold the sessions 2–3 days apart.""\n""They were\nalso given recommendations on how to read the books with their children""\n""The reading instructions\nincluded raising questions about the story content (problems, solutions), learning new\nwords, pointing to the written text while reading, playing with words (rhyming, divid-\ning into syllables and sub-syllables) and reading important words that were repeated in\nthe text.[¬e]""']",NA,,['Other (Explain in notes)'],"['Page 4:\n[¬s]""The sample consisted of 90 pre-kindergarten children (57% girls) and their mothers[¬e]""', 'Page 5:\n[¬s]""(30\ndyads in each)[¬e]""']",one-to-one parent-child dyads,,['Yes'],"['Page 7:\n[¬s]""All mothers were visited in their home by the researcher. They were given\nthe target book (electronic or printed book according to the group to which they were\nassigned) and were asked to read it to their children[¬e]""']","for one of the treatments, the e-book arm",,['Yes'],"['Page 7:\n[¬s]""All mothers were visited in their home by the researcher. They were given\nthe target book (electronic or printed book according to the group to which they were\nassigned) and were asked to read it to their children[¬e]""']","for one of the treatments, the e-book arm",,['Evenings and/or weekends'],"['Page 7:\n[¬s]""All mothers were visited in their home by the researcher. They were given\nthe target book (electronic or printed book according to the group to which they were\nassigned) and were asked to read it to their children during the next 2 weeks in five dif-\nferent sessions. The mothers were asked to hold the sessions 2–3 days apart. They were\nalso given recommendations on how to read the books with their children.[¬e]""']",NA,,['Parents/carers'],"['Page 7:\n[¬s]""All mothers were visited in their home by the researcher. They were given\nthe target book (electronic or printed book according to the group to which they were\nassigned) and were asked to read it to their children during the next 2 weeks in five dif-\nferent sessions. The mothers were asked to hold the sessions 2–3 days apart. They were\nalso given recommendations on how to read the books with their children.[¬e]""']",NA,,"['Page 7:\n[¬s]""and were asked to read it to their children during the next 2 weeks in five dif-\nferent sessions. T[¬e]""']",2,,"['Page 7:\n[¬s]""and were asked to read it to their children during the next 2 weeks in five dif-\nferent sessions. The mothers were asked to hold the sessions 2–3 days apart.[¬e]""']",2.5,,"['Page 9:\n[¬s]""The mothers were told that each session should last 20 minutes.""\n"". In the first session\nthey were asked to first read the ‘read and play’ channel to the child, followed by the\n‘read with dictionary’ channel, allowing 10 minutes for each channel. In the second ses-\nsion they were asked to read only the ‘read with dictionary’ channel for 20 minutes. In\nthe third session they were asked to first read the ‘read with dictionary’ channel with the\nchild and afterwards the ‘read and play’ channel, again allowing 10 minutes for each\nchannel. In the fourth session they were asked to read the ‘read and play’ channel for the\nentire 20 minutes. In the last and fifth session they were asked to first read the ‘read and\nplay’ channel with the child, followed by ‘read with dictionary’, allowing 10 minutes for\neach channel.[¬e]""']",20,,"['Qualitative', 'Quantitative']","['Page 9:\n[¬s]""The mothers were told that their fifth reading session would be videotaped by the researchers.""\n""Videotaping the mother–child reading session. The fifth mother–child story reading\n(printed/electronic) session was videotaped in the participants’ homes.\nThe mother–child book reading interaction took place in the participants’ chosen\nplace at home (the living room, the child’s room, or the kitchen). Almost all mothers\npreferred the living room, which they found as a convenient place for the activity. The\nresearcher asked the mother to read the book with her child as she did in the previous\nsessions. A VHS camcorder placed at the far end of the room videotaped the session. For\nthe e-book session, an additional VHS camcorder was used in order to videotape the\ncomputer screen. In most cases, mothers and children succeeded in ignoring noise which\ncame from outside the home, and in a few cases when the noise came from inside the\nhome, the mothers stopped it by request. The dyadic interactions were transcribed verba-\ntim and the transcripts were used to code the interactions.[¬e]""', 'Page 9:\n[¬s]""The mothers were given a printed chart which they were asked to fill for reporting on\ntheir reading to their children (date, hour, short description and remarks), in order to\nencourage the mothers and children during the reading sessions.[¬e]""']",NA,,['No'],NA,NA,,['The developer'],"['Page 4:\n[¬s]""In the present study we investigated the extent to which reading an educational e-book\nwith adult support compared to reading a printed book with adult support can promote\nlanguage skills (word comprehension and phonological awareness) of LSES pre-\nkindergarten children (aged 3–4 years). We hypothesized that children in both interven-\ntion groups will exhibit greater language knowledge (in word comprehension, syllabic\nand sub-syllabic skills) compared to the control group which did not receive the book\nreading interve[¬e]""', 'Page 7:\n[¬s]""Data were collected in three sessions: pretest, intervention and posttest[¬e]""']","researchers designed the intervention and evaluated it, collecting date at pre-, during and post-intervention",,No,,['Yes'],"['Page 10:\n[¬s]""control group (M = 40.40, SD = 3.40)""\n""No significant differences, F(2,87) = 0.14, p = .87, were found in the pretests between\nchildren’s scores in the three groups, indicating that the groups were well matched on the\nmeasured syllabic knowledge""\n""No significant differences, F(2,87) = 1.36, p = .26, were found in the pretests between\nthe children’s scores in the three groups, indicating that the groups were well matched on[¬e]""', 'Page 11:\n[¬s]""the measured sub-syllabic knowledge.[¬e]""', 'Page 9:\n[¬s]""Significant differences, F(2,87) = 3.22, p = .04, ηp\n2 = .07, were found in the pretests\nbetween the children’s scores in the three groups, indicating that the groups differed on the\nmeasured word comprehension. Pairwise comparisons showed that children who worked\nwith the printed book (M = 52.50, SD = 3.40) had higher scores than children from the[¬e]""']",NA,,['Yes'],"['Page 9:\n[¬s]""Each dependent variable was submitted to a 3 (group: printed book,\ne-book, control) × 2 (time: pretest vs posttest) ANOVA, with repeated measures on the\nlatter factor.[¬e]""']",NA,,['Yes'],NA,NA,,"['Gender', 'Educational attainment']","['Page 5:\n[¬s]""A nearly\nequal number of boys and girls were represented in each of the three groups.[¬e]""', 'Page 10:\n[¬s]""Word meaning\nSyllabic awareness\nSub-syllabic awareness[¬e]""']",NA,,['No'],NA,NA,
73032962,Kotaman (2007),2007,['Parental engagement'],NA,,"['Page 65:\n[¬s]""dialogical storybook reading training[¬e]""']",NA,,"['Page 65:\n[¬s]""The experimental\ninstruction session lasted two hours. During the instruction session the parents in the\nexperimental group received education on dialogic storybook reading techniques. The\nsession lasted 120 minutes and consisted of two 20-minute sessions, a 15-minute break\nand a 65-minute session.[¬e]""', 'Page 66:\n[¬s]""In the first 20 minutes parents received information about the importance of\nvocabulary development and the impacts of dialogical storybook reading techniques on\nvocabulary development.""\n""In the second 20 minutes, the trainer and his assistant taught parents how to apply\ndialogical storybook reading techniques through modeling and role-playing. After the\nsecond 20 minutes, participants took a 15-minute break.""\n""The third section of the training session lasted 65 minutes. Participants spent this\ntime applying dialogical reading techniques to each other using role-playing.[¬e]""']",NA,,"['Page 3:\n[¬s]""In this study the researcher examined the impacts of dialogical storybook reading\non children‘s receptive vocabulary development and their parents‘ self-efficacy for\nstorybook reading. The study also investigated parents‘ concerns about the dialogical\nstorybook reading technique and the technique‘s effects on parent-child relationships.[¬e]""']",NA,,['University/ researcher design'],"['Page 65:\n[¬s]""Participants in the experimental group received instruction. The experimental\ninstruction session lasted two hours. During the instruction session the parents in the\nexperimental group received education on dialogic storybook reading techniques. The\nsession lasted 120 minutes and consisted of two 20-minute sessions, a 15-minute break\nand a 65-minute session.[¬e]""', 'Page 66:\n[¬s]""The trainer presented examples from research studies that\nshowed the importance of vocabulary development for education and how dialogical\nreading techniques affected children‘s vocabulary development.[¬e]""']",NA,,['Unclear/ Not specified'],NA,not specified,,"['Students', 'Parents']","['Page 3:\n[¬s]""In this study the researcher examined the impacts of dialogical storybook reading\non children‘s receptive vocabulary development and their parents‘ self-efficacy for\nstorybook reading.[¬e]""', 'Page 3:\n[¬s]""The study also investigated parents‘ concerns about the dialogical\nstorybook reading technique and the technique‘s effects on parent-child relationships.[¬e]""', 'Page 63:\n[¬s]""Self-efficacy belief has an important influence on the\nacquisition and application of a new skill. Therefore, measurement of the self-efficacy\nbeliefs of parents in dialogical storybook reading technique training was the focus of this\nstudy. Parents who have more tools to use in support of their children‘s development[¬e]""', 'Page 64:\n[¬s]""might lead to a high sense of parenting efficacy, which in turn would result in better\nparenting practices.[¬e]""']",NA,,"['Large group/class teaching (+6)', 'One to one', 'Paired learning']","['Page 66:\n[¬s]""Participants spent this\ntime applying dialogical reading techniques to each other using role-playing. One\nparticipant played the role of a child and the other participant played the role of a parent,\nand then switched roles. Once both of the participants had a chance to apply the\ntechniques, they switched partners.[¬e]""']",NA,,['No'],NA,NA,,['Yes'],NA,NA,,['Unclear/ not specified'],NA,Not specified,,"['Parents/carers', 'Unclear/not specified']",NA,"parents were participants in this study and were instructed by a trainer and their assistant, however it was not specified whether they were research staff or class teachers etc.",,NA,not specified,,"['Page 83:\n[¬s]"". In the experimental group, parents reported\nthe following frequencies for telling yarns: 2 (11%) everyday, 8 (44.4%) 1–5 times every\nweek, and 8 (44.4%) 2–3 times every month. On the other hand, in the experimental\ngroup, frequencies were: 4 (21%) every day, 12 (63%) 1–5 times every week, and 13\n(16%) 2–3 times every month.\nAll parents in the experimental and control groups reported reading storybooks to\ntheir children. Frequency distributions of storybook reading for the experiment and\ncontrol groups, respectively, were: 8 (40%) and 7 (35%) every day, 7 (35%) and 8 (40%)\n3–4 times a week, 3 (15%) and 1 (5%) 1–2 times a week, and 2 (10%) and 4 (20%)\naveraging less than once each week.[¬e]""']","not specified, the paper indicates that there was only one session for parents, but it did not specify how many times per week the parent had to work with their child using the techniques they used.",,"['Page 65:\n[¬s]""The\nsession lasted 120 minutes and consisted of two 20-minute sessions, a 15-minute break\nand a 65-minute session.[¬e]""']",120,,['No implementation details provided.'],NA,NA,,['No'],NA,NA,,['The developer'],"['Page 74:\n[¬s]""The data analysis procedures were conducted and completed using SPSS13.0\n(Statistical Package for the Social Sciences) for Windows.[¬e]""']",NA,,No,,['Yes'],"['Page 93:\n[¬s]""hildren in the experimental group had a higher mean score (M = 40.25) on the\nPPVT than children in the control group (M = 39.1).""\n"". To control for this difference in the\ncomparison of posttest means, ANCOVA was used. Table 4.14 presents the ANCOVA\nposttest result[¬e]""']",NA,,['Yes'],"['Page 93:\n[¬s]""Children in the experimental group had a higher mean score (M = 40.25) on the\nPPVT than children in the control group (M = 39.1). To control for this difference in the\ncomparison of posttest means, ANCOVA was used. Table 4.14 presents the ANCOVA\nposttest results. Results from ANCOVA for the posttest scores, with the pre-test as the\ncovariant, indicate significant differences (F = 6.91; df = 1; p< 0.05). PPVT scores for the\nchildren in the experimental group increased significantly more than those of their peers\nin the control group.[¬e]""']",NA,,['Yes'],NA,NA,,"['Gender', 'Socio-economic status', 'Other (please specify)']","['Page 82:\n[¬s]""Children‘s Gender\nFemale\nMale[¬e]""', 'Page 82:\n[¬s]""Parent Highest Education Literate Elementa""\n""High School\nUniversity""\n""Parents‘ Age\n15-25 years\n26-36 years\n37-47 years""\n""Income\nytl. 250-750\nytl. 751-1250\nytl. 1251-1750\nytl. 1751-Above""\n""Number of Children\n1\n2\n3[¬e]""', 'Page 82:\n[¬s]""Children‘s Age\nBeginning Low-High\nBeginning Mean (SD)""\n""Parents‘ Age\n15-25 years\n26-36 years\n37-47 years[¬e]""']",parents' age age,,['No'],NA,NA,
74578013,Kotaman (2020) PE,2020,"['EY_Parental engagement', 'Parental engagement']",NA,,"['Page 2:\n[¬s]""parents\' dialogical sto-\nrybook reading[¬e]""']",NA,,"['Page 4:\n[¬s]""Participants in the experimental group\nreceived instruction. The experimental\ninstruction session lasted two hours. Dur-[¬e]""', 'Page 5:\n[¬s]""ing the instruction session the parents in the\nexperimental group received education on\ndialogic storybook reading techniques. The\nsession lasted 120 minutes and consisted\nof two 20-minute sessions, a 15-minute\nbreak and a 65-minute session.[¬e]""']",NA,,"['Page 2:\n[¬s]""The current study assessed the impact of parents\' dialogical sto-\nrybook reading on their children\'s receptive vocabulary and\nreading attitudes.[¬e]""']",NA,,['University/ researcher design'],"['Page 1:\n[¬s]""Hüseyin Kotaman\nHarran University[¬e]""']",NA,,['Unclear/ Not specified'],NA,NA,,"['Students', 'Parents']",NA,NA,,"['One to one', 'Large group/class teaching (+6)']","['Page 5:\n[¬s]""In the second 20 minutes, the trainer\nand his assistant taught parents how to\napply dialogical storybook reading tech-\nniques through modeling and role-playing.\nAfter the second 20 minutes, participants\ntook a 10-minute break.\nThe third section of the training session\nlasted 65 minutes. Participants spent this\ntime applying dialogical reading tech-\nniques to each other using role-play.[¬e]""']",NA,,['No'],NA,NA,,['Yes'],NA,NA,,['Unclear/ not specified'],NA,NA,,['Research staff'],"['Page 5:\n[¬s]""the trainer\nand his assistant[¬e]""']",Instructors only referenced as 'trainer' and his 'assistant',,"['Page 5:\n[¬s]""The\nsession lasted 120 minutes and consisted\nof two 20-minute sessions, a 15-minute\nbreak and a 65-minute session.[¬e]""']",1,,NA,1,,"['Page 5:\n[¬s]""The\nsession lasted 120 minutes and consisted\nof two 20-minute sessions, a 15-minute\nbreak and a 65-minute session.[¬e]""']",120,,['No implementation details provided.'],NA,NA,,['No'],NA,NA,,['The developer'],NA,NA,,No,,['No/Unclear'],NA,NA,,['Yes'],"['Page 6:\n[¬s]""Children in the experimental group had\na higher mean score (M = 40.25) on the\nPPVT than that for children in the control\ngroup (M = 39.1). To control for this dif-\nference in the comparison of posttest\nmeans, ANCOVA was used. Results from\nANCOVA for the posttest scores, with the\npre-test as the covariant, indicated signif-\nicant differences (F = 6.91; df = 1; p< 0.05).[¬e]""']",NA,,['Yes'],NA,NA,,['Educational attainment'],NA,NA,,['No'],NA,NA,
42025476,Kraft (2001),2001,['Parental engagement'],NA,,"['Page 6:\n[¬s]""Parent Training[¬e]""']",NA,,"['Page 6:\n[¬s]""When parents arrived for the two-\nhour training session, they were provided a 10-\npage parent guide that outlined the reading pro-\ncedures the parents should use with their chil-\ndren. These included arranging the environ-\nment; teaching letter-sound correspondence;\nblending sounds without stopping between the\nsounds; a model, lead, test error correction\nstrategy; and criterion for moving the child to\nthe next book in the series. In addition, the par-\nents were given a small chart the children could\ncomplete to track their own progress through\nthe reading series.""\n""procedures were modeled by the\nworkshop presenters and briefly practiced by\nthe parents. The instructional procedures (e.g.,\nteaching letter-sound correspondence, blending\nsounds and error correction) were presented in\nthe parent guide and during the parent work-\nshop as explicit instructional frames""\n""e parents were taught to use a\nmodel-test strategy for introducing new letter-\nsounds and blending the sounds of new words\nand a model-lead-test strategy for correcting\nchild mistakes.""\n""Table 2\nInstructional Frames to Teach\nLetter-Sound Corespondence\nand Correct Child Mistakes\nNew Sounds\nSteps\nSay the sound.\nAsk your child to say\nthe sound.\nExample\n“Aaaaaa.”\n“What sound?”\nChild says the sound. “Aaaaa.”\nCorrecting Mistakes\nSounds\nSteps\nSay the sound.\nSay the sound\ntogether.\nAsk the child to say\nthe sound.\nExample\n“That sound is ‘aaaaaa’.”\n“Let’s say the sound\ntogether. ‘Aaaaaa’.”\n“Say the sound alone.”\nChild says the sound “Aaaaaa.”[¬e]""']",NA,,"['Page 1:\n[¬s]""early reading skills[¬e]""']",NA,,['University/ researcher design'],"['Page 1:\n[¬s]""; Utah State University[¬e]""', 'Page 6:\n[¬s]""procedures were modeled by the\nworkshop presenters[¬e]""']",NA,,['Yes (Please specify)'],"['Page 6:\n[¬s]""Parent Training.""\n""two-\nhour training session, they were provided a 10-\npage parent guide that outlined the reading pro-\ncedures the parents should use with their chil-\ndren.""\n""arranging the environ-\nment; teaching letter-sound correspondence;\nblending sounds without stopping between the\nsounds; a model, lead, test error correction\nstrategy; and criterion for moving the child to\nthe next book in the series. In addition, the par-\nents were given a small chart the children could\ncomplete to track their own progress through\nthe reading series.""\n""procedures were modeled by the\nworkshop presenters and briefly practiced by\nthe parents. The instructional procedures (e.g.,\nteaching letter-sound correspondence, blending\nsounds and error correction) were presented in\nthe parent guide and during the parent work-\nshop as explicit instructional frames.\nProcedurally the parents were taught to use a\nmodel-test strategy for introducing new letter-\nsounds and blending the sounds of new words\nand a model-lead-test strategy for correcting\nchild mistakes.[¬e]""']",NA,,"['Students', 'Parents']",NA,the intervention encourages parents to read with their children at home,,['One to one'],"['Page 6:\n[¬s]""reading pro-\ncedures the parents should use with their chil-\ndren[¬e]""']",NA,,['No'],NA,NA,,['Yes'],NA,NA,,"['Before/after school', 'Evenings and/or weekends']",NA,when the child was at home,,['Parents/carers'],NA,the intervention is parent led tuition,,"['Page 5:\n[¬s]""four-month program[¬e]""']",16,,NA,NA,,NA,NA,,['Qualitative'],"['Page 7:\n[¬s]""parents were asked\nhow the reading program was progressing and\nspecifically how their child was progressing""\n""parents were asked to complete a com-\nment sheet about each packet the child com-\npleted. The comment sheet requested infor-\nmation about sounds and words that the child\nwas having difficulty with, the number of\ntimes the child read each book, if the child\nwas having difficulty with comprehension\nquestions, and other general suggestions or\ncomments from the parent. Second, parents\nreceived a monthly letter from the program\nstaff describing the progress""\n""5 to 10-\nminute daily group session was held at school\nwith the experimental children to exchange\nbook packets[¬e]""']",NA,,['No'],NA,NA,,['The developer'],NA,it seems reasonable the authors developed the program as no other originators are mentioned ,,No,,['Yes'],NA,Table presents information regarding to socio-economic status,,['No'],NA,NA,,['Yes'],NA,NA,,"['Socio-economic status', 'Other (please specify)']",NA,Parents educational achievement,,['No'],NA,NA,
