id,pub_author,pub_year,strand_raw,strand_info,strand_CLEAN,int_name_ht,int_name_info,int_name_CLEAN,int_desc_ht,int_desc_info,int_desc_CLEAN,int_objec_ht,int_objec_info,int_objec_CLEAN,int_prov_raw,int_prov_ht,int_prov_info,int_prov_CLEAN,int_training_raw,int_training_ht,int_training_info,int_training_CLEAN,int_part_raw,int_part_ht,int_part_info,int_part_CLEAN,int_approach_raw,int_approach_ht,int_approach_info,int_approach_CLEAN,digit_tech_raw,digit_tech_ht,digit_tech_info,digital_tech_CLEAN,parent_partic_raw,parent_partic_ht,parent_partic_info,parent_partic_CLEAN,int_when_raw,int_when_ht,int_when_info,int_when_CLEAN,int_who_raw,int_who_ht,int_who_info,int_who_CLEAN,int_dur_ht,int_dur_info,int_dur_CLEAN,int_freq_ht,int_freq_info,int_freq_CLEAN,int_leng_ht,int_leng_info,int_leng_CLEAN,int_fidel_raw,int_fidel_ht,int_fidel_info,int_fidel_CLEAN,int_cost_raw,int_cost_ht,int_cost_info,int_cost_CLEAN,out_eval_raw,out_eval_ht,out_eval_info,out_eval_CLEAN,eef_eval_raw,eef_eval_CLEAN,base_diff_raw,base_diff_ht,base_diff_info,base_diff_CLEAN,comp_anal_raw,comp_anal_ht,comp_anal_info,comp_anal_CLEAN,comp_var_rep_raw,comp_var_rep_ht,comp_var_rep_info,comp_var_rep_CLEAN,comp_var_raw,comp_var_ht,comp_var_info,comp_var_CLEAN,clust_anal_raw,clust_anal_ht,clust_anal_info,clust_anal_CLEAN
55203411,Aral (2011),2011,NA,NA,,"['Page 5:\n[¬s]""The parent education program[¬e]""']",NA,,"['Page 5:\n[¬s]""The parent education program was designed to support child development in\ndifferent areas. Accordingly, the program topics were chosen by considering\nparent needs and included the following: personality development for child\ndevelopment and education, language development, cognitive development,\nsexual development, social development, motor development, parent-child\ncommunication, sibling relationships, behavioral disorders, discipline, games-\ntoys-books, accidents, home activities, childhood illnesses, and nutrition. The\nprogram was then evaluated by nine field experts and the program was finalized\nin line with their feedback. The parent education program was implemented in\nthe experimental group as informational sessions once weekly for a duration of\n8 weeks. In order to assist parents in supporting their children’s development,\nrelevant brochures were distributed to parents, and they were given tasks to\ncarry out at home with their children. In addition, there were sessions held to\ndiscuss the topics of behavioral problems, sexual development, parent-child\ncommunication, and discipline.[¬e]""']",NA,,"['Page 2:\n[¬s]""The aim of parent education is to maximize\ntheir children’s academic and life success, and to prepare them for life as\ncontented and accomplished individuals[¬e]""']",NA,,['University/ researcher design'],NA,NA,,['Yes (Please specify)'],"['Page 5:\n[¬s]""The parent education program was designed to support child development in\ndifferent areas. Accordingly, the program topics were chosen by considering\nparent needs and included the following: personality development for child\ndevelopment and education, language development, cognitive development,\nsexual development, social development, motor development, parent-child\ncommunication, sibling relationships, behavioral disorders, discipline, games-\ntoys-books, accidents, home activities, childhood illnesses, and nutrition. The\nprogram was then evaluated by nine field experts and the program was finalized\nin line with their feedback. The parent education program was implemented in\nthe experimental group as informational sessions once weekly for a duration of\n8 weeks. In order to assist parents in supporting their children’s development,\nrelevant brochures were distributed to parents, and they were given tasks to\ncarry out at home with their children. In addition, there were sessions held to\ndiscuss the topics of behavioral problems, sexual development, parent-child\ncommunication, and discipline.[¬e]""']",NA,,"['Students', 'Parents']",NA,NA,,['One to one'],NA,parent to child   Parents also engaged in training for 8-weeks which was in larger groups,,['No'],NA,NA,,['Yes'],NA,NA,,['Evenings and/or weekends'],NA,NA,,"['Research staff', 'External teachers', 'Parents/carers']",NA,Parents to children,,"['Page 5:\n[¬s]""once weekly for a duration of\n8 weeks[¬e]""']",8,,NA,1,,NA,NA,,['No implementation details provided.'],NA,NA,,['No'],NA,NA,,['The developer'],NA,NA,,No,,['Yes'],NA,NA,,['Yes'],NA,NA,,['Yes'],NA,NA,,"['Educational attainment', 'Gender']",NA,NA,,['No'],NA,NA,
42025413,Baker (1998) 1_1,1998,"['Parental engagement', 'EY_Parental engagement']",NA,,"['Page 1:\n[¬s]""the Home Instruction Program\nfor Preschool Youngsters (HIPPY)[¬e]""']",NA,,"['Page 4:\n[¬s]""At the time of the study HIPPY was a two-year program. Most children were four years old at the beginning of the program and attended kindergarten during its second year. Thus, the program was designed to span the transition from preschool to formal elementary school. In each year of the program, there were 30 weeks of activities, scheduled to coincide with the school year.""\n""Lombard designed the program for\nmothers to deliver the HIPPY lessons to their children (as opposed to a home vis-\nitor working with the children directly). By learning how to teach their child and\nby having successful teaching experiences, the goal was for HIPPY mothers to\ngain confidence, interest, and skills to help their children succeed academically\neven after the completion of the two year HIPPY program.""\n""Over the course of the program, mothers received a series of books written spe-\ncifically for the HIPPY program along with activity packets. Each day, mothers\nwere to read to their children from one of the books and administer one set of activ-\nities (approximately two to three pages of guided instructions for the mother to\nwork on with her child). These activities ranged from a series of questions the\nmother was to ask the child, along with possible responses; connect the dot activi-\nties; identifying the appropriate object from a printed matrix (e.g., find the girl\nwith the hat from a matrix of boys and girls with and without hats); and coloring\nactivities. The HIPPY activities were structured like a detailed lesson plan to guide\nmothers in what to read, what questions to ask their children, and how to respond\nto their children\'s answers. Thus, mothers and children were to progress through\nthe materials in planned stages, providing children with a series of tasks to accom-\nplish before advancing to increasing levels of difficulty.[¬e]""']",NA,,"['Page 7:\n[¬s]""assess the effectiveness of participation in the program on major outcomes rele- vant to program goals.""\n""This\nstudy tested the hypothesis that participation in HIPPY has a positive impact on\nyoung children\'s cognitive skills, standardized achievement, and adaptation to the\nclassroom, over an above any effect of a high-quality preschool program.[¬e]""']",NA,,['School or group of schools'],"['Page 7:\n[¬s]""The HIPPY program participating in this study was situated in a large city in\nNew York State. The HIPPY program became operational in 1989 as a parent\ninvolvement component of the city\'s public school Early Childhood Center. The\nCenter provided an enriched, high-quality early childhood education setting for\nprekindergarten and kindergarten children, many of whom were from low-income\nfamilies with limited English proficiency and from ethnic minorities.[¬e]""']",NA,,['Unclear/ Not specified'],NA,NA,,"['Students', 'Parents']","['Page 4:\n[¬s]""Over the course of the program, mothers received a series of books written spe-\ncifically for the HIPPY program along with activity packets. Each day, mothers\nwere to read to their children from one of the books and administer one set of activ-\nities (approximately two to three pages of guided instructions for the mother to\nwork on with her child). These activities ranged from a series of questions the\nmother was to ask the child, along with possible responses; connect the dot activi-\nties; identifying the appropriate object from a printed matrix (e.g., find the girl\nwith the hat from a matrix of boys and girls with and without hats); and coloring\nactivities.[¬e]""', 'Page 4:\n[¬s]""Over the course of the program, mothers received a series of books written spe-\ncifically for the HIPPY program along with activity packets. Each day, mothers\nwere to read to their children from one of the books and administer one set of activ-\nities (approximately two to three pages of guided instructions for the mother to\nwork on with her child).[¬e]""']",NA,,['One to one'],"['Page 4:\n[¬s]""Over the course of the program, mothers received a series of books written spe-\ncifically for the HIPPY program along with activity packets. Each day, mothers\nwere to read to their children from one of the books and administer one set of activ-\nities[¬e]""']",NA,,['No'],NA,NA,,['Yes'],NA,NA,,"['Before/after school', 'Evenings and/or weekends']","['Page 4:\n[¬s]""Over the course of the program, mothers received a series of books written spe-\ncifically for the HIPPY program along with activity packets. Each day, mothers\nwere to read to their children from one of the books and administer one set of activ-\nities (approximately two to three pages of guided instructions for the mother to\nwork on with her child).[¬e]""']","Mothers were expected to do the activities at home, so before/after school and evenings/weekends can be assumed.",,['Parents/carers'],"['Page 4:\n[¬s]""mothers[¬e]""']",NA,,"['Page 4:\n[¬s]""At the time of the study HIPPY was a two-year program.""\n""In each year of the program, there were 30 weeks of\nactivities, scheduled to coincide with the school year.[¬e]""']",60,,"['Page 4:\n[¬s]""Each day, mothers\nwere to read to their children from one of the books and administer one set of activ-\nities (approximately two to three pages of guided instructions for the mother to\nwork on with her child).[¬e]""']","Not specified, indicative of daily (7)",,NA,Not specified,,['No implementation details provided.'],NA,NA,,['No'],NA,NA,,['The developer'],"['Page 10:\n[¬s]""A principal components factor analysis with varimax rotations was conducted\nwith the 11 CCAI items in order to identify potential underlying constructs that\ncould guide data reduction (see Appendix A).""\n""The study hypothesis was tested in Cohort I and then tested again for Cohort II\nto determine if the findings were replicated.[¬e]""']",NA,,No,,['Yes'],"['Page 11:\n[¬s]""HIPPY and Control children within both cohorts were compared in order to\ndetermine pretest comparability. In neither cohort were there statistically signifi-\ncant baseline differences between the HIPPY and control groups on family\nbackground characteristics 3 or in children\'s cognitive skills as assessed by the\nCooperative Preschool Inventory (CPI)[¬e]""']",NA,,['Yes'],"['Page 10:\n[¬s]""Analyses of covariance (ANCOVA)\nwere conducted to examine group differences within cohorts. Covariates included\nchild\'s age (in months) and gender (0 = female, 1 = male); parents\' ethnicity (Afri-\ncan American, Asian, Latino, White, or Mixed), and level of education (less than\nhigh school, GED or high school, more than high school), family structure (0 = two\nparent 1 = single parent), and source of family\'s income (0 = wages, 1 = public[¬e]""', 'Page 11:\n[¬s]""assistance), and child\'s pretest scores on the CPI.[¬e]""']",NA,,['Yes'],NA,NA,,"['Gender', 'Socio-economic status', 'Other (please specify)']","['Page 8:\n[¬s]""% Girls:[¬e]""', 'Page 8:\n[¬s]""Education of adult: Less than high school High School More than high school""\n""% Public assistance as primary income:[¬e]""', 'Page 8:\n[¬s]""Age of child in months[¬e]""']",NA,,['No'],NA,NA,
74577989,Baker (1998) 1_2,1998,"['Parental engagement', 'EY_Parental engagement']",NA,,"['Page 1:\n[¬s]""the Home Instruction Program\nfor Preschool Youngsters (HIPPY)[¬e]""']",the Home Instruction Program for Preschool Youngsters (HIPPY),,"['Page 4:\n[¬s]""At the time of the study HIPPY was a two-year program. Most children were four years old at the beginning of the program and attended kindergarten during its second year. Thus, the program was designed to span the transition from preschool to formal elementary school. In each year of the program, there were 30 weeks of activities, scheduled to coincide with the school year.""\n""Lombard designed the program for\nmothers to deliver the HIPPY lessons to their children (as opposed to a home vis-\nitor working with the children directly). By learning how to teach their child and\nby having successful teaching experiences, the goal was for HIPPY mothers to\ngain confidence, interest, and skills to help their children succeed academically\neven after the completion of the two year HIPPY program.\nOver the course of the program, mothers received a series of books written spe-\ncifically for the HIPPY program along with activity packets.""\n""Each day, mothers\nwere to read to their children from one of the books and administer one set of activ-\nities (approximately two to three pages of guided instructions for the mother to\nwork on with her child). These activities ranged from a series of questions the\nmother was to ask the child, along with possible responses; connect the dot activi-\nties; identifying the appropriate object from a printed matrix (e.g., find the girl\nwith the hat from a matrix of boys and girls with and without hats); and coloring\nactivities. The HIPPY activities were structured like a detailed lesson plan to guide\nmothers in what to read, what questions to ask their children, and how to respond\nto their children\'s answers.[¬e]""']",NA,,"['Page 1:\n[¬s]""The effectiveness of the Home Instruction Program for Preschool Youngsters (HIPPY)---a two-year, free, home-based, family-oriented, early childhood educa- tion intervention--was assessed in a longitudinal, two cohort, randomized exper- imental evaluation.""\n""Outcomes included assessments of children\'s cogni-\ntive skills, adaptation to the classroom, and standardized achievement at the end\nof the two-year program, and classroom adaptation and standardized achievement\none year later.[¬e]""']",NA,,['School or group of schools'],"['Page 7:\n[¬s]""The HIPPY program participating in this study was situated in a large city in\nNew York State. The HIPPY program became operational in 1989 as a parent\ninvolvement component of the city\'s public school Early Childhood Center. The\nCenter provided an enriched, high-quality early childhood education setting for\nprekindergarten and kindergarten children, many of whom were from low-income\nfamilies with limited English proficiency and from ethnic minorities.[¬e]""']",NA,,['Yes (Please specify)'],"['Page 4:\n[¬s]""In order to enhance the home learning environment and develop each mother\'s ability to support her child\'s lifelong learning, Lombard designed the program for mothers to deliver the HIPPY lessons to their children (as opposed to a home vis- itor working with the children directly). By learning how to teach their child and by having successful teaching experiences, the goal was for HIPPY mothers to gain confidence, interest, and skills to help their children succeed academically even after the completion of the two year HIPPY program. Over the course of the program, mothers received a series of books written spe- cifically for the HIPPY program along with activity packets.""\n""These activities ranged from a series of questions the\nmother was to ask the child, along with possible responses; connect the dot activi-\nties; identifying the appropriate object from a printed matrix (e.g., find the girl\nwith the hat from a matrix of boys and girls with and without hats); and coloring\nactivities. The HIPPY activities were structured like a detailed lesson plan to guide\nmothers in what to read, what questions to ask their children, and how to respond\nto their children\'s answers.[¬e]""', 'Page 5:\n[¬s]""Prior to working with her child on the HIPPY lessons, Lombard designed the\nmodel such that mothers first were presented the lesson by the paraprofessional\nduring the home visit. During the role-playing session, mothers were to take the\nrole of the child and the paraprofessional took the role of the parent. Thus, mothers\nlearned to use the materials through role playing each week\'s lessons with the\nhome visitor. Role playing was chosen by Lombard so that mothers could learn in\na relaxed, playful, and nonthreatening atmosphere. In that way, the home visitor\nfunctions as a modeler of teaching techniques.[¬e]""']",NA,,['Students'],NA,NA,,['One to one'],"['Page 4:\n[¬s]""Each day, mothers\nwere to read to their children from one of the books and administer one set of activ-\nities (approximately two to three pages of guided instructions for the mother to\nwork on with her child).[¬e]""']",NA,,['No'],NA,NA,,['Yes'],NA,NA,,['Unclear/ not specified'],NA,"Not specified, but activities were conducted at home so this could be before/after school or evenings/weekends.",,['Parents/carers'],"['Page 4:\n[¬s]""Lombard designed the program for\nmothers to deliver the HIPPY lessons to their children (as opposed to a home vis-\nitor working with the children directly). By learning how to teach their child and\nby having successful teaching experiences, the goal was for HIPPY mothers to\ngain confidence, interest, and skills to help their children succeed academically\neven after the completion of the two year HIPPY program.[¬e]""']",NA,,"['Page 4:\n[¬s]""In each year of the program, there were 30 weeks of\nactivities, scheduled to coincide with the school year.""\n""At the time of the study HIPPY was a two-year program.[¬e]""']",60,,"['Page 5:\n[¬s]""Prior to working with her child on the HIPPY lessons, Lombard designed the\nmodel such that mothers first were presented the lesson by the paraprofessional\nduring the home visit. During the role-playing session, mothers were to take the\nrole of the child and the paraprofessional took the role of the parent. Thus, mothers\nlearned to use the materials through role playing each week\'s lessons with the\nhome visitor. Role playing was chosen by Lombard so that mothers could learn in\na relaxed, playful, and nonthreatening atmosphere. In that way, the home visitor\nfunctions as a modeler of teaching techniques.[¬e]""']",1,,NA,not specified,,['No implementation details provided.'],NA,NA,,['No'],NA,NA,,['The developer'],NA,NA,,No,,['Yes'],"['Page 8:\n[¬s]""Table 1. Sample Characteristics at Baseline\nGroup\nCohort I\nVariables\nEthnicity of child:\nAfrican-American\nLatino\nOther\nWhite\nEducation of adult:\nLess than high school\nHigh School\nMore than high school\nHousehold composition:\nSingle adult alone\nSingle adult with family\nCouple alone\nCouple with extended family\n% Public assistance as primary income:\n% Girls:\nAge of child in months\nBaseline score on CPI:\n35%\n24%\n41%\n32%\n14%\n43%\n11%\n38%\n49%\n58(3.1)\n43.7(11)\n28%\n44%\n28%\n25%\n13%\n47%\n16%\n28%\n59%\n59(3.4)\n40.5(9.7)\n28%\n32%\n40%\n26%\n8%\n60%\n6%\n34%\n36%\n54(3.5)\n34.4(15.3)\n18%\n35%\n47%\nns\n21%\n6%\n55%\n18%\n20% ns\n46% ns\n54(3.8) a\n36.5(14) b\nNotes: aln the control group, Cohort I is significantly older than Cohort II [T(96) =6.27; p < .001]\nIn the HIPPY group, Cohort I is significantly older than Cohort II [T(82) =5.21, p < ,001]\nbln the HIPPY group, Cohort I scored significantly higher on the CPI than Cohort II [T(82) = 3.21; p <\n.0051\nsome families moved away before the program began. Table 1 presents a descrip-\ntion of the sample by group and cohort.\nAs can be seen from Table 1, about two-thirds of the families were from ethnic\nminorities, primarily African American and Latino backgrounds. One third of the\nfamilies reported that public assistance was their primary source of income. Fam-\nilies were evenly divided between single parents and couples. As can be seen, a\nsubstantial proportion (28% to 41%) of the families had educations beyond high\nschool. Despite this educational advantage, many families did not speak English as\ntheir primary language (n = 63, 34.6%).\nProcedures\nBaseline Data Collection. Baseline data were collected during individualized\nhome visits conducted by trained research assistants not associated with the\nHIPPY program. For Cohort I, baseline data were collected in February 1991\n(rather than in the Fall), because of delays in the beginning of the HIPPY program.\nCohort II baseline took place at the beginning of the next school year (September\n1991), which coincided with the beginning of their first year of the HIPPY pro-\nHIPPY\nn = 37\n16%\n38%\n19%\n27%\nControl\nn = 32\n47%\n28%\n22%\n13%\nCohort II\nHIPPY\nn = 47\n32%\n32%\n14%[¬e]""']",NA,,['Yes'],"['Page 10:\n[¬s]""Analyses of covariance (ANCOVA)\nwere conducted to examine group differences within cohorts. Covariates included\nchild\'s age (in months) and gender (0 = female, 1 = male); parents\' ethnicity (Afri-\ncan American, Asian, Latino, White, or Mixed), and level of education (less than\nhigh school, GED or high school, more than high school), family structure (0 = two\nparent 1 = single parent), and source of family\'s income[¬e]""']",NA,,['Yes'],NA,NA,,"['Gender', 'Educational attainment', 'Socio-economic status']","['Page 8:\n[¬s]""% Girls:""\n""36%""\n""46% ns[¬e]""', 'Page 8:\n[¬s]""Education of adult:\nLess than high school\nHigh School\nMore than high school[¬e]""', 'Page 8:\n[¬s]""Ethnicity of child:\nAfrican-American\nLatino\nOther\nWhite[¬e]""']",NA,,['No'],NA,NA,
