52131591,Callcott (2015),2015,['Physical activity'],NA,,"['Page 4:\n[¬s]"" two components: literacy (Let\x92s Decode); and movement (Moving on with Literacy)[¬e]""']",NA,,"['Page 5:\n[¬s]""Moving on with Literacy (MowL) is an original program developed by the \x1erst author and comprises 30 action songs that a whole class sing and perform together as modelled by a teacher. The engaging action songs provide targeted movement practice that includes \x1ene motor skill practice, eye-tracking, balance, rhythm, cross-lateral movement, gross motor skills, core strength and aerobic capacity and aim to improve overall co-ordination and rhythm. MowL encourages interpersonal skills as there is partner and small group work and the action songs take no longer than 15 min per day to practise.""\n""Let\x92s Decode is an approach to teaching phonological awareness and systematic decoding instruction that is drawn from instructional formats \x1erst published in Direct Instruction Reading (Carnine et al. 1990) and based on the Theory of Instruction (Engleman and Carnine 1991). Teachers implementing Let\x92s Decode spend approximately 15 min each day explicitly teaching auditory analysis such as concept of word, blending, rhyming and phoneme seg- mentation, before letter sounds and the strategy of[¬e]""', 'Page 6:\n[¬s]""decoding words. Students are active participants during Let\x92s Decode lessons as there is a high rate of unison oral responding and teachers maintain a brisk pace to minimise interruptions and teach \x91more in less time\x92.[¬e]""']",NA,,"['Page 5:\n[¬s]""Moving on with Literacy (MowL)""\n""aim to improve overall co-ordination and rhythm. ""\n""Let\x92s Decode (Formentin, 1992)""\n""phonological awareness and systematic decoding[¬e]""']",NA,,['University/ researcher design'],NA,NA,,['Yes (Please specify)'],"['Page 4:\n[¬s]""Pre-test measures were completed in the \x1erst three weeks of the school year and we conducted professional development sessions for the intervention teachers imme- diately after. The day long sessions for literacy and for movement followed the same structure with teachers learning about the programs as well as how to deliver them. We demonstrated how to teach each song or literacy format to the teachers, and then demonstrated with a class of pre- primary students. [¬e]""']",NA,,['Students'],NA,NA,,['Large group/class teaching (+6)'],NA,NA,,['No'],NA,NA,,['No'],NA,NA,,['During regular school hours '],NA,NA,,['Class teachers'],NA,NA,,"['Page 4:\n[¬s]""Pre-test measures were completed in the \x1erst three weeks of the school year""\n"" In the third week of the \x1enal term of the school year, the students were retested on the same measures.[¬e]""']",52,,"['Page 4:\n[¬s]""each day.[¬e]""']",5,,"['Page 4:\n[¬s]"" no more than 30 min [¬e]""']",30,,['Qualitative'],"['Page 4:\n[¬s]""We subsequently visited each partici- pating teacher in their classroom to observe them teaching the movement and/or literacy programs and to provide further demonstrations and support. Over the course of the""\n""intervention, teachers were visited once per term to mon- itor for \x1edelity of implementation. The same procedure was followed for the control groups who received professional development sessions related to the importance of move- ment and early literacy development but did not receive either or both programs.[¬e]""']",NA,,['No'],NA,NA,,['The developer'],NA,NA,,No,,['Yes'],"['Page 7:\n[¬s]""Table 1 Comparison of groups\non the pre-tests, post-tests, and\ngain scores""\n""Pre-test\nn\nWRAT\nLit?Movt 84 95.19\n65 90.37\nLiteracy\nMovement 66 92.64\nControl\n78 91.33\np value\n.482*\nTOPA\nLit?Movt 84 10.89\n67 10.34\nLiteracy\nMovement 67 10.60\nControl\n79 10.99\np value\n.475*\na Adjusted mean post-test\nscores, controlling for pre-test\nperformance\n* One-way analysis of variance\non pre-test conducted between\ngroups\n** Analysis of covariance on\npost-test conducted between\ngroups, using pre-test as\ncovariate\n? One-way analysis on gain\nscore conducted between groups\n?? Non-parametric Kruskall-\nWallis test on gain score\nconducted between groups\nTable 2 Summary of pairwise\nsigniﬁcant differences for each\nof the measures and statistical\ntestsa\nDST\nLit?Movt 85 15.14\n65 14.26\nLiteracy\nControl\np value\nMovement 67 14.87\n77 16.03\n.859*\nMABC-2\nLit?Movt 84 10.02\n63 9.78\nLiteracy\nControl\np value\nMovement 61 10.13\n75 11.13\n.015*\nPost-test\nMean (SD)[¬e]""']",NA,,['Yes'],NA,NA,,['Yes'],"['Page 6:\n[¬s]""Three different perspectives were employed to analyse the\npretest-posttest data: analysis of covariance (ANCOVA)\ncontrolling for pre-test score differences, univariate ana-\nlysis of variance (ANOVA) on the gain (difference) scores,\nand non-parametric analysis of gain scores using the\nKruskal-Wallis H and Mann-Whitney U tests.[¬e]""']",NA,,['Educational attainment'],"['Page 7:\n[¬s]""WRAT""\n""TOPA[¬e]""']",NA,,['No'],NA,NA,
52131597,Elofsson (2018),2018,['Physical activity'],NA,,"['Page 4:\n[¬s]""Math in Action[¬e]""']",NA,,"['Page 4:\n[¬s]""In this condition, children participated in several mathematical activities that\ninvolved motor skill practice, songs, rhythm, and tonality. The children participated in the following\nmathematical activities each session: (a) rote counting (singing, rhythm), (b) counting forward from\ndifferent numbers (jumping on number line, singing, and rhythm), counting backwards from different\nnumbers (jumping on number line, singing, and rhythm), addition and subtraction practice (singing\ngame), and motor skill practice (10 minutes per session).[¬e]""']",NA,,NA,improve maths performance of pupils by integrating physical activity and music into maths lessons,,['University/ researcher design'],NA,NA,,['No'],NA,NA,,['Students'],NA,NA,,['Large group/class teaching (+6)'],NA,NA,,['No'],NA,NA,,['No'],NA,NA,,['During regular school hours '],NA,NA,,['Class teachers'],NA,NA,,"['Page 2:\n[¬s]""during a period of 3 weeks[¬e]""']",3,,"['Page 2:\n[¬s]""(2 times a week for a 30-minute\nsession)[¬e]""']",2,,"['Page 2:\n[¬s]""for a 30-minute\nsession)[¬e]""']",30 ,,['No implementation details provided.'],NA,NA,,['No'],NA,NA,,['The developer'],NA,NA,,No,,['Yes'],NA,see table 3,,['Yes'],NA,NA,,['Yes'],NA,NA,,"['Educational attainment', 'Gender']",NA,NA,,['No'],NA,NA,
52131607,Kirk (2014),2014,"['Physical activity', 'EY_Play-based learning']",NA,,"['Page 3:\n[¬s]""The curriculum was designed by researchers with expertise in early childhood development and physical activity along with teachers and administrators at the Head Start program.[¬e]""']",Didn't have specific name.,,"['Page 3:\n[¬s]""The program was designed to keep the preschoolers moving in moderate physical activity for 15 min, two times per day (30 min daily).""\n"" The program was administered inside or outside of the class- room, to music or without music. Teachers were free to choose the time each morning and afternoon that best Þt into the dayÕs schedule but each teacher was required to administer a morning and afternoon session ""\n""A variety of literacy lessons were used in the areas of Picture Naming (assessment of expressive language development), Rhyming (assessment of phonological awareness) and Alliteration (assessment of phonological awareness). ""\n""The activity was designed to help children understand and identify Rhyming words. During the lesson children would march in place while the teacher repeated several lines of a poem and the child identiÞed the words that rhymed. Depending on the words that rhymed, the children would either act out the words or perform a certain number of jumping jacks (or other movement) before moving on to the next two lines of the poem and repeating the sequence throughout the poem.""\n""While these concepts were covered at both the intervention and control site, the primary difference was that the intervention site integrated[¬e]""', 'Page 4:\n[¬s]""these lessons with physical activity rather than taught them solely through large group time, reading, or other class- room activities.[¬e]""']",NA,,"['Page 1:\n[¬s]""improve early literacy in preschoolers.[¬e]""']",NA,,['University/ researcher design'],NA,NA,,['Yes (Please specify)'],"['Page 4:\n[¬s]""Training was provided to classroom teachers at the pre- school implementing the academic program taught using physical activity in one in-service training session at the beginning of the school year.""\n""Research assistants were trained to support the classroom teachers in the design and delivery of the exercise program, in troubleshooting, and problem-solving strategies. [¬e]""']",NA,,['Students'],NA,NA,,['Large group/class teaching (+6)'],NA,NA,,['No'],NA,NA,,['No'],NA,NA,,['During regular school hours '],NA,NA,,"['Class teachers', 'Teaching assistants']","['Page 2:\n[¬s]""Each classroom was staffed with two teachers (one lead teacher and one assistant teacher).[¬e]""', 'Page 3:\n[¬s]"" all of them female.""\n""The curriculum was designed by researchers with expertise in early childhood development and physical activity along with teachers and administrators at the Head Start program. To increase the likelihood of dissemination in other Head Start preschools, the activities were meant to be easily administered by classroom teachers while being fun and engaging for preschoolers.[¬e]""', 'Page 4:\n[¬s]""Research assistants were trained to support the classroom teachers in the design and delivery of the exercise program, in troubleshooting, and problem-solving strategies. Research assistants who conducted testing were trained to collect valid and reliable data and had to obtain intra-class correlations of 0.80 or greater to be certiÞed to administer each test.[¬e]""']",NA,,"['Page 1:\n[¬s]"" 6 month,[¬e]""']",24,,"['Page 3:\n[¬s]"" two times per day[¬e]""']",5,,"['Page 3:\n[¬s]""15 min[¬e]""']",15,,['Qualitative'],"['Page 3:\n[¬s]""The curriculum included identical time spent in instruction and Þdelity of teacher implementation. All available resources such as technology, educational mate- rial, and teacher training were identical between preschools.[¬e]""', 'Page 4:\n[¬s]"" Throughout the study, a member of the research team performed observa- tions each day to ensure the program was being adminis- tered correctly and to monitor Þdelity.[¬e]""', 'Page 5:\n[¬s]""To gain additional information that would be helpful in guiding the overall design and implementation of the pro- gram for future studies, we asked teachers to complete a 10-item survey from the Child and Adolescent Trial for Cardiovascular Health (CATCH) Physical Education Observation Form (McKenzie et al. 1996). ""\n""Fidelity of teacher implementation of the physical activity lessons was measured using the SOFIT observation tool. SOFIT data were compared between the intervention and control classrooms using a mixed linear model adjusting for age and sex[¬e]""']",NA,,['Yes (Please add details)'],"['Page 1:\n[¬s]"" low cost[¬e]""']",NA,,['The developer'],NA,NA,,No,,['Yes'],"['Page 2:\n[¬s]""Table 1 Baseline participant characteristics\nPhysical\nactivity\nAge (years)\nWeight (kg)\nAllitaration (number of letters sounds\ncorrectly identiﬁed/two min)\nRhyming (number of rhymes correctly\nidentiﬁed/two min)\nPicture naming (number of pictures named\ncorrectly/min)\nControl\n3.8 ± 0.1 3.9 ± 0.1\n18.7 ± 2.1 17.5 ± 1.9\n0.4 ± 0.2 0.2 ± 0.2\n1.7 ± 0.3 1.2 ± 0.2\n17.2 ± 5.9 19.0 ± 5.3[¬e]""']",NA,,['Yes'],NA,NA,,['Yes'],NA,NA,,"['Gender', 'Educational attainment', 'Socio-economic status', 'Other (please specify)']","['Page 3:\n[¬s]""physical activity (1 preschool, 4 classrooms, n = 51 F,\nn = 29, M, n = 22) and a second preschool participating as\nthe control site (1 preschool, 3 classrooms, n = 21, F, n = 9\nF, M, n = 12)[¬e]""', 'Page 6:\n[¬s]""Alliteration (letters sounds/two min)\nPicture Naming (pictures identiﬁed correctly per\nminute)\nRhyming (pictures identiﬁed correctly/2 min[¬e]""', 'Page 2:\n[¬s]""In both pre-\nschools, [99 % of families were African American and\n[95 % of families enrolled in the Head Start Program\nwere below the poverty line. Prior to the start of the study,\nparents signed an informed consent for their children to\nparticipate[¬e]""', 'Page 2:\n[¬s]""Age (years)\nWeight (kg[¬e]""']","age, weight",,['No'],NA,NA,
52131608,Kirk (2016),2016,"['Physical activity', 'EY_Physical development approaches']",NA,,"['Page 2:\n[¬s]""physical activity\n(PA)[¬e]""']",NA,,"['Page 4:\n[¬s]""The PA program was designed by researchers with expertise in early childhood development and PA along with teachers and administrators at the Head Start program. To increase the likelihood of dissemination in other Head Start centers, the activities were designed to be administered by classroom teacherswhile being fun and engaging for preschool children. A variety of early literacy lessons were used in the areas of picture naming (assessment of expressive language development), rhyming, and alliteration (assessment of phonological awareness).""\n""For example, a goal of a rhyming lesson was for\nchildren to ﬁnd the rhymeswithin a particular poem or\nshort story. The activity was designed to help children\nunderstand and identify rhyming words. During the\nlesson, children would march in place while the\nteacher repeated several lines of a poem and the child\nidentiﬁed the words that rhymed. Depending on the\nwords that rhymed, the children would either act out\nthe words or perform a certain number of jumping\njacks (or other movement) before moving on to the\nnext 2 lines of the poem and repeating the sequence\nthroughout the poem. Whereas these concepts were\ncovered at both the intervention and control site,\nthe primary difference was that the intervention site\nintegrated these lessons into a PA rather than teach\nsolely through large-group time, reading, or other\nclassroom activities.\nThe program was designed to keep the children\nmoving in moderate PA for 30 minutes 2 times per day\n(60minutes daily). Sixty minutes per day of moderate\nintensity PA was chosen as it is recommended by the\nNational Association for Sport and Physical Education\n(NASPE)26 and the National Association for the\nEducation of Young Children (NAEYC).27 Despite\nthese recommendations most preschool children\ndo not meet these recommendations28 Therefore,\nintegrating PA within the early literacy curriculum\ncould be an effective way to increase daily PA. The\nprogram was administered inside or outside of the\nclassroom, to music or without music. The goal was\nto make it fun and engaging for both the teachers\nand students. Teachers were free to choose the time\neach morning and afternoon that best ﬁt into the\nday’s schedule but each teacher was required to\nadminister a morning and afternoon session at a\ntime when it was likely that most if not all students\nwere in attendance (eg, after breakfast in the AM\nbut before children are picked up by parents in\nPM). During the 8 months, daily direct observation\nby the investigators was used to ensure that the PA\nlessons were administered appropriately. Throughout\nthe study, teachers in the intervention group were\nrequired to complete a daily activity log. To complete\nthe log, teachers indicated in which PA lesson was\nused, the time of day they performed the activity\nlesson, the total number of minutes that each activity\nlasted, and estimate the intensity level at which they\nbelieved the children were performing (ie, light-,\nmoderate-, or high-intensity levels). An e-mail was\nsent each week to the intervention teachers to remind\nthem to complete the activity logs.[¬e]""']",NA,,NA,improve academic achievement by engaging pupils in 60 minutes of physical activity a day ,,['University/ researcher design'],NA,NA,,['Yes (Please specify)'],"['Page 4:\n[¬s]""Teacher training. The principal investigators pro-\nvide training to the classroom teachers and assistants\nin each of the 2 intervention classrooms at a full-day\nin-service at the beginning of the school year. The\ngoal of the in-service training was to develop compe-\ntency and strategies to deliver two, 30-minute periods[¬e]""', 'Page 5:\n[¬s]""of moderate to vigorous intensity, physically active\nlessons per day[¬e]""']",NA,,['Students'],NA,NA,,['Large group/class teaching (+6)'],NA,NA,,['No'],NA,NA,,['No'],NA,NA,,['During regular school hours '],NA,NA,,['Class teachers'],NA,NA,,"['Page 6:\n[¬s]""The academic\nlesson plans taught using PA can be followed for\nat least 8months[¬e]""']",32,,"['Page 6:\n[¬s]""The results indicated that adherence to the program\nwas greater than 95%, meaning that students\nwere obtaining all of the daily 60 minutes/day\nof recommended structured PA[¬e]""']",5,,"['Page 6:\n[¬s]""60 minutes/day\nof recommended structured PA[¬e]""']",60 ,,['Qualitative'],"['Page 7:\n[¬s]""A limitation to the study was the small sample size.\nBecause an observer sat in the intervention classes\nevery day for 8 months, it is possible (likely) that\nthe very presence of the observer had an impact on\nuse of the intervention and ﬁdelity. The strength of\nthis study was that both quantitative and qualitative\nmethods were used to allow for a more thorough\nexamination of program ﬁdelity and implementation\nissues. Quantitative data regarding minutes of PA\nand number of lessons taught were collected weekly,\nwhich helped to determine if teachers were meeting\nthe minimum prescription for the intervention.\nWeekly reporting also identiﬁed struggling teachers\nwithout delay. In this manner, assistance was\nprovided before excessive time elapsed. Data also\nwere collected to help determine challenges teachers\nfaced implementing the intervention, allowing study\npersonnel to help minimize barriers to increasing\nPA within their curriculum. It is possible that some\nadjustments to the training materials are needed to\ninclude demonstrations of activities given that in\n‘‘real world’’ settings, the research team members\nwould not be present to step in to help out the\ncurriculum.[¬e]""']",NA,,['No'],NA,NA,,['The developer'],NA,NA,,No,,['Yes'],NA,See Table 1.,,['Yes'],NA,NA,,['Yes'],NA,NA,,"['Educational attainment', 'Gender', 'Socio-economic status']",NA,NA,,['No'],NA,NA,
52131682,Lazroe (1968),1968,"['Physical activity', 'EY_Physical development approaches']",NA,,"['Page 5:\n[¬s]"" motor tra in in g[¬e]""']",NA,,"['Page 28:\n[¬s]""v a ria tio n s of a c t iv i t ie s recommended by K eph art1 a n d /o r G etm an .^ The o b je c tiv e s of the a c t iv i t ie s w ere to aid th e c h ild in d ev elo p in g body im a g e , la t e r a l it y (internal a w a re n e s s of le f t and r ig h t) , d ire c tio n a lity (ex te rn al p ro je c tio n of th is a w a r e n e s s ) , motor c o o rd in a tio n , eye m o tility , and g e n e ra lly improved s p a tia l o r ie n ta tio n . These in tu rn , a cc o rd in g to the c ite d a u th o r s , would e n h an c e th e o v e ra ll p e rc e p tu a l d ev elo p m en t of th e c h il d . A d e s c rip tio n of e a c h of th e a c t iv i t ie s u se d in th e program i s c o n ta in e d in Appendix A.[¬e]""', 'Page 6:\n[¬s]""The e x p erim e n tal program c o n s is te d of p re s c rib e d g r o s s motor a c tiv i t ie s for o n e -h a lf hour d a ily over an e ig h t- w e e k p e rio d . Eight te a c h e r s p a r tic ip a te d . Each had one c o n tro l and one e x p erim e n tal c l a s s randomly• a s s ig n e d to a morning or aftern o o n s e s s i o n .[¬e]""']",NA,,"['Page 5:\n[¬s]"" (l) t o d eterm in e w h eth er th e re w a s a s ig n if ic a n t d iffe re n c e b e tw e e n re a d in g r e a d in e s s t e s t sc o re s and p e rc e p tu a l t e s t s c o r e s of k in d e rg a rte n c h ild re n g iv e n c e r ta in motor tra in in g and k in d e rg a rte n c h ild re n g iv e n r e g u la r tra in in g[¬e]""']",NA,,['University/ researcher design'],NA,NA,,['Yes (Please specify)'],"['Page 28:\n[¬s]"" Each te a c h e r w a s pro\xad vided w ith a com plete sc h e d u le of a c t iv i t ie s for e a c h w eek of th e p ro \xad gram . Time for the program w a s ta k e n from tim e re g u la rly d ev o ted to fre e p lay and g ro ss -m o to r rhythm a c t i v i t i e s . The sc h e d u le i s p re s e n te d in Appendix B.[¬e]""']",NA,,['Students'],NA,NA,,['Large group/class teaching (+6)'],"['Page 28:\n[¬s]"" w ith sm all g rou ps a s w e ll a s""\n""w hole c l a s s""\n""Three groups of from e ig h t to te n w ere formed in e a c h c l a s s [¬e]""']",NA,,['No'],NA,NA,,['No'],NA,NA,,['During regular school hours '],"['Page 28:\n[¬s]""Time for the program w a s ta k e n from tim e re g u la rly d ev o ted to fre e p lay and g ro ss -m o to r rhythm a c t i v i t i e s[¬e]""']",NA,,['Class teachers'],"['Page 24:\n[¬s]""The e ig h t te a c h e r s who p a rtic ip a te d a s both c o n tro l group and e x p erim e n tal group te a c h e r s were a l l e x p e rie n c e d primary grad e te a c h e r s . Their e x p e rie n c e ran ged from four y e a r s to tw e n ty . All had p a s s e d pro \xad b a tio n a ry p e rio d s in th e d i s t r ic t and h eld t e n u r e . All b u t one h ad ta u g h t k in d e rg a rte n for a t l e a s t four y e a r s . The one te a c h e r had ta u g h t k in d e r\xad g a rte n for th e y e a r p rec ed in g the e x p e rim e n t, had ta u g h t a n ex ten d ed k in d e rg a rte n or p r e - f i r s t c l a s s th e y e a r p reced in g t h a t , and had tau g h t f i r s t grade for th e e ig h t y e a rs p rior to t h a t . Each te a c h e r v o lu n te ere d to p a rtic ip a te in th e stu d y a fte r a p e rs o n a l in te rv ie w w ith th e w r ite r . Table 1 p r e s e n ts d a ta on te a c h e r background and sam ple r e p r e s e n ta tio n ._[¬e]""']",NA,,"['Page 6:\n[¬s]""e ig h t- w e e k p e rio d[¬e]""']",8 ,,"['Page 6:\n[¬s]""o n e -h a lf hour d a ily[¬e]""']",5,,"['Page 27:\n[¬s]"" th irty m in utes[¬e]""']",30,,['No implementation details provided.'],NA,NA,,['No'],NA,NA,,['The developer'],NA,NA,,No,,['Yes'],"['Page 23:\n[¬s]""The median chronological age for each group and for a ll\nsubjects was 66 months.[¬e]""', 'Page 91:\n[¬s]""the mean\nobtained by the experimental group was 18.39 with a standard deviation\nof 11.62[¬e]""']",NA,,['Yes'],"['Page 23:\n[¬s]""The median mental age for the experimental children\nwas 72 months with a range from 49 to 108. For the control children the\nmedian was 71 months and the range was from 49 to 104 months.[¬e]""', 'Page 6:\n[¬s]""Scores earned on the pre- and po s t-tes ts of the Perceptual\nForms Test and the Metropolitan Readiness Tests were treated by analy\xad\nsis of covariance technique. Adjusted po s t- tes t means were given an\nF - te s t for sta tistica l significance.[¬e]""', 'Page 91:\n[¬s]""the mean\nobtained was 22.18 with a standard deviation of 14.71[¬e]""']",NA,,['Yes'],NA,NA,,"['Educational attainment', 'Other (please specify)']","['Page 91:\n[¬s]""the mean obtained by the experimental group was 18.39 with a standard deviation of 11.62.""\n""The range of scores obtained on the p re -tes t of the Per\xad\nceptual Forms Test by the control group was from 1.0 to 64.5; the mean\nobtained was 22.18 with a standard deviation of 14.71.[¬e]""', 'Page 93:\n[¬s]""the\nmean obtained by the experimental group was 40.94 with a standard\ndeviation of 19.78.""\n""the mean ob\xad\ntained by the control group was 43.26 with a standard deviation of\n23.00.[¬e]""', 'Page 23:\n[¬s]""The median chronological age for each group and for a ll subjects was 66 months.""\n""The median mental age for the experimental children\nwas 72 months with a range from 49 to 108. For the control children the\nmedian was 71 months and the range was from 49 to 104 months.[¬e]""']",Chronological age  mental age,,['No'],NA,NA,
