id,pub_author,pub_year,strand_raw,strand_info,strand_CLEAN,int_name_ht,int_name_info,int_name_CLEAN,int_desc_ht,int_desc_info,int_desc_CLEAN,int_objec_ht,int_objec_info,int_objec_CLEAN,int_prov_raw,int_prov_ht,int_prov_info,int_prov_CLEAN,int_training_raw,int_training_ht,int_training_info,int_training_CLEAN,int_part_raw,int_part_ht,int_part_info,int_part_CLEAN,int_approach_raw,int_approach_ht,int_approach_info,int_approach_CLEAN,digit_tech_raw,digit_tech_ht,digit_tech_info,digital_tech_CLEAN,parent_partic_raw,parent_partic_ht,parent_partic_info,parent_partic_CLEAN,int_when_raw,int_when_ht,int_when_info,int_when_CLEAN,int_who_raw,int_who_ht,int_who_info,int_who_CLEAN,int_dur_ht,int_dur_info,int_dur_CLEAN,int_freq_ht,int_freq_info,int_freq_CLEAN,int_leng_ht,int_leng_info,int_leng_CLEAN,int_fidel_raw,int_fidel_ht,int_fidel_info,int_fidel_CLEAN,int_cost_raw,int_cost_ht,int_cost_info,int_cost_CLEAN,out_eval_raw,out_eval_ht,out_eval_info,out_eval_CLEAN,eef_eval_raw,eef_eval_CLEAN,base_diff_raw,base_diff_ht,base_diff_info,base_diff_CLEAN,comp_anal_raw,comp_anal_ht,comp_anal_info,comp_anal_CLEAN,comp_var_rep_raw,comp_var_rep_ht,comp_var_rep_info,comp_var_rep_CLEAN,comp_var_raw,comp_var_ht,comp_var_info,comp_var_CLEAN,clust_anal_raw,clust_anal_ht,clust_anal_info,clust_anal_CLEAN
78361735,Battaglia (2019),2019,"['Physical activity', 'EY_Physical development approaches']",NA,,"['Page 3:\n[¬s]""In agreement with McGee et al. (2016) a school-based\nnon-randomized trial was conducted to evaluate the eﬀect\nof a pilot PEP on preschool children’s gross motor skills\n(Gallahue et al., 2003, 2012; McGee et al., 2016). This\nstudy has been recently developed within the Training-to-\nHealth Project ﬁnanced by Municipality of Palermo. Due to\nfunding requirements, PEP was carried out in several pilot\npreschools within the Palermo City Council administrative\nboundaries. A preschool with demographic characteristics (age,\nsex, socioeconomic characteristics) similar to the enrolled\nplayschools was recruited in Palermo and used as the control.\nIn particular, the catchment areas of these schools were\npredominately of middle socioeconomic status as judged by\nemployment and education.""\n""This study involved 119 children who were clustered in a\ncontrol group [CG, n = 29, age: 52.1 ± 8.65 months; height:\n1.10 ± 0.07 m, body weight: 19.20 ± 5.55 kg, body mass\nindex (BMI): 16.90 ± 3.16] and an intervention group (IG,\nn = 90, age: 57.4 ± 9.42 months; height: 1.10 ± 0.06 m,\nbody weight: 19.30 ± 3.65 kg, BMI: 16.00 ± 1.75). Moreover,\n62.10% males and 37.90% females composed the CG. Similarly,\n55.60% males and 44.40% females composed the IG. The\nstudy was approved by the Ethical Board of the University\nof Palermo (N. 2/2018) and conformed to criteria for the\nuse of persons in research as deﬁned in the Declaration\nof Helsinki (Trial Registration: NCT03454061 retrospectively\nregistered 2 March 2018). Given that the participants were\nminors, parents or legal guardians provided their written\ninformed consent to participate in this research. All children\nparticipated voluntarily and could withdraw from the study at\nany time.""\n""The PEP, based on the psychomotor approach, was done in\na group setting and based on useful, goal-directed training,\npracticing activities of relevance for a preschool child. The\nprogram lasted 16 weeks and was applied twice a week by a\nphysical education specialist (PES), who also had experience\nwith preschool children. Teachers were involved in the goal-\nsetting process and cooperated with PES to carry over the\nactivities safely. Before intervention, PES and teachers have\nfollowed a training course concerning the aims, methodology and\nevaluation of PEP in order to make the intervention uniform for\nall children.\nPEP included activities with speciﬁc aims developing body\nawareness, fundamental motor and perceptual-sensory skills of\npreschool children (see Figure 1).[¬e]""']",NA,,"['Page 1:\n[¬s]""The\naim of this study was to investigate whether the quotient of gross motor development\n(QGMD) and pre-literacy skills concerning visual analysis and spatial orientation abilities\nchanged after 16 weeks of PEP (2 h/week) in preschool children.[¬e]""', 'Page 3:\n[¬s]""a school-based\nnon-randomized trial was conducted to evaluate the eﬀect\nof a pilot PEP on preschool children’s gross motor skills[¬e]""']",NA,,"['Page 1:\n[¬s]""We conducted a\nschool-based non-randomized pilot trial. It involved 119 preschool children, clustered\nin a control group [CG, n = 29, body mass index (BMI): 16.90 ± 3.16 Kg/m2] and an\nintervention group (IG, n = 90, BMI: 16.00 ± 1.75 kg/m2).[¬e]""']",NA,,['School or group of schools'],"['Page 3:\n[¬s]""Before intervention, PES and teachers have\nfollowed a training course concerning the aims, methodology and\nevaluation of PEP in order to make the intervention uniform for\nall children.[¬e]""']",NA,,['Yes (Please specify)'],"['Page 3:\n[¬s]""The PEP, based on the psychomotor approach, was done in\na group setting and based on useful, goal-directed training,\npracticing activities of relevance for a preschool child.[¬e]""']",NA,,['Students'],"['Page 3:\n[¬s]""Once preschools\nhad given written informed consent to participate in the study,\nall Year 3.5 preschool children were invited to take part in the\nexperiment and were tested before and after the experimental\nperiod.""\n""The PEP, based on the psychomotor approach, was done in\na group setting and based on useful, goal-directed training,\npracticing activities of relevance for a preschool child.[¬e]""']",NA,,"['Large group/class teaching (+6)', 'Other (Explain in notes)']","['Page 3:\n[¬s]""Each lesson was structured in the form of scheduled\nplay that emphasizes enjoyment and participation in several play[¬e]""', 'Page 4:\n[¬s]""actions (Pesce et al., 2016). Gross motor skill acquisition was\nfocused by means of developmentally appropriate tasks (Giblin\net al., 2014) in order to promote transfer eﬀects between PA and\nspontaneous play. PES used hands-on discovery and problem-\nsolving heuristic learning modalities in order to strengthen the""\n""eﬀectiveness of such a program targeted on the preparation and\nthe scheduled play. The CG participated in classroom activities\nfor the same amount of time as the IG with teachers. Both\ngroups performed the activities during the school period in a\nmulti-activity area.[¬e]""']",NA,,['Yes'],NA,"A digital video camera videotaped all their performances. Before observations, two observers were previously trained on videotapes of children in order to analyze movement sequences and to assign scores.",,['No'],NA,"A digital video camera videotaped all their performances. Before observations, two observers were previously trained on videotapes of children in order to analyze movement sequences and to assign scores.",,['During regular school hours '],"['Page 3:\n[¬s]""The\nprogram lasted 16 weeks and was applied twice a week by a\nphysical education specialist (PES), who also had experience\nwith preschool children. Teachers were involved in the goal-\nsetting process and cooperated with PES to carry over the\nactivities safely.[¬e]""']",NA,,"['Class teachers', 'Other school staff']","['Page 3:\n[¬s]""a\nphysical education specialist (PES)[¬e]""', 'Page 3:\n[¬s]""The\nprogram lasted 16 weeks[¬e]""']",NA,,"['Page 3:\n[¬s]""The\nprogram lasted 16 weeks and was applied twice a week by a\nphysical education specialist (PES)[¬e]""']",16,,"['Page 3:\n[¬s]""Each lesson (see Table 1)\nlasted about 60 min[¬e]""']",2,,"['Page 3:\n[¬s]""Teachers were involved in the goal-\nsetting process and cooperated with PES to carry over the\nactivities safely. Before intervention, PES and teachers have\nfollowed a training course concerning the aims, methodology and\nevaluation of PEP in order to make the intervention uniform for\nall children.[¬e]""', 'Page 4:\n[¬s]""The CG participated in classroom activities\nfor the same amount of time as the IG with teachers[¬e]""', 'Page 5:\n[¬s]""Means and standard deviations (SD) were calculated to describe\nthe sample characteristics. Analysis of gain scores, also called\nchange scores or diﬀerence scores, was used to test for the eﬀect\nof treatment; unpaired Student’s t-tests were used to compare\nthe post- and pre-test diﬀerence in scores between the control\nand intervention groups (Allison, 1990; Ragosa, 1995; Oakes\nand Feldman, 2001). Since baseline diﬀerences between groups\nexisted at pre-test, analysis ofcovariance (ANCOVA) was applied\nas an alternative to analyze the scores. We used the post-test\ngross motor and pre-literacy scores as the dependent variable,\nthe control/intervention group as independent variable and the\npre-test score as covariate. ANCOVA focuses on diﬀerences\nbetween the groups at post-test while holding constant pre-test\ndiﬀerences. In all the analyses, the level of signiﬁcance was set at\np < 0.05. Statistics were performed by using STATA/MP 12.1.[¬e]""', 'Page 7:\n[¬s]""As can be seen in Figure 1\nand Table 1, we included several speciﬁc activities in order\nto increase gross motor skills in IG. In particular, PEP was\nmade up of 70% of activities improving fundamental motors\nskills. Scheduled activities never consisted of simply imitating\nphysical movements but always prompted the children to adapt\ncreatively. Furthermore, children were invited to ﬁnd their\nown solutions for the tasks they were encountered.[¬e]""']",60,,"['Qualitative', 'Quantitative']","['Page 3:\n[¬s]""The\nprogram lasted 16 weeks and was applied twice a week by a\nphysical education specialist (PES), who also had experience\nwith preschool children.[¬e]""', 'Page 5:\n[¬s]"". To\nobtain a higher validity, according to the handbook, each child\nperformed three trials ofeach skill and acquired a “1” mark, when\na criterion performance was executed two out of three times,\nor a “0” grade, when a criterion was not observed or was used\ninappropriately two out of three times.""\n""The number of errors for the task was recorded. The\nﬁnal score was obtained by adding together the number of\nerrors.[¬e]""', 'Page 8:\n[¬s]""The Palermo Municipality Preschool District ﬁnancially\nsupported this study.[¬e]""']",NA,,['No'],"['Page 8:\n[¬s]""GB and MA conceived the study, participated in its design and\ncoordination, performed aspects of the measurement and of the\nPEP, participated in the interpretation of the data, and drafted\nmuch of the manuscript. GT conducted the statistical analyses\nand participated in interpretation of the data. AP participated\nin the interpretation of the data and guided the study. MB\nparticipated in the design and coordination of the study and\nparticipated in the interpretation ofthe data. All authors read and\napproved the ﬁnal manuscript.[¬e]""']",NA,,['The developer'],NA,NA,,No,,['Yes'],"['Page 3:\n[¬s]""[CG, n = 29, age: 52.1 ± 8.65 months; height:\n1.10 ± 0.07 m, body weight: 19.20 ± 5.55 kg, body mass\nindex (BMI): 16.90 ± 3.16] and an intervention group (IG,\nn = 90, age: 57.4 ± 9.42 months; height: 1.10 ± 0.06 m,\nbody weight: 19.30 ± 3.65 kg, BMI: 16.00 ± 1.75).[¬e]""']",NA,,['Yes'],"['Page 5:\n[¬s]""Since baseline diﬀerences between groups\nexisted at pre-test, analysis ofcovariance (ANCOVA) was applied\nas an alternative to analyze the scores.[¬e]""']",NA,,['Yes'],NA,NA,,"['Other (please specify)', 'Gender']","['Page 3:\n[¬s]""CG, n = 29, age: 52.1 ± 8.65 months; height:\n1.10 ± 0.07 m, body weight: 19.20 ± 5.55 kg, body mass\nindex (BMI): 16.90 ± 3.16] and an intervention group (IG,\nn = 90, age: 57.4 ± 9.42 months; height: 1.10 ± 0.06 m,\nbody weight: 19.30 ± 3.65 kg, BMI: 16.00 ± 1.75).[¬e]""', 'Page 3:\n[¬s]""Moreover,\n62.10% males and 37.90% females composed the CG. Similarly,\n55.60% males and 44.40% females composed the IG.[¬e]""']",NA,,['No'],NA,NA,
77945718,Becker (2014),2014,['EY_Physical development approaches'],NA,,NA,NA,,NA,NA,,NA,NA,,NA,NA,NA,,NA,NA,NA,,NA,NA,NA,,NA,NA,NA,,NA,NA,NA,,NA,NA,NA,,NA,NA,NA,,NA,NA,NA,,NA,NA,,NA,NA,,NA,NA,,NA,NA,NA,,NA,NA,NA,,NA,NA,NA,,No,,['No/Unclear'],NA,NA,,['Yes'],"['Page 9:\n[¬s]""Prior to the analyses, we ran a series of t tests to check for gender differences on active play (moderate to vigorous physical activity), the measure of self-regulation (i.e., HTKS), and the two measures of achievement. No significant differences were found on any of the study variables.""\n""age and Head Start status\nwere included as control variables in all path models.[¬e]""']",NA,,['Yes'],"['Page 9:\n[¬s]""As can be seen in Table 2, active play was positively correlated at .46 with the HTKS\nself-regulation measure and positively correlated at .16 with math achievement. At the same\ntime, active play was unrelated to emergent literacy achievement. Age was positively correlated\nwith active play and HTKS scores, whereas Head Start status was inversely correlated with the\ntwo measures of achievement and self-regulation (see Table 2). Thus, age and Head Start status\nwere included as control variables in all path models.[¬e]""']",NA,,NA,NA,NA,,['No'],NA,NA,
78361737,Bedard (2020),2020,['Physical activity'],NA,,"['Page 4:\n[¬s]""Therefore, the objectives of the current study were:\n(1) To evaluate the eﬀectiveness of the M2L Program, as modiﬁed to suit a community’s need, in\nimproving children’s movement and pre-literacy skills;\n(2) To evaluate the eﬀectiveness of the M2L program in increasing caregivers’ levels of engagement\nin movement and pre-literacy activities with their children;\n(3) To evaluate the feasibility of training non-experts to deliver the M2L program.[¬e]""']",NA,,"['Page 5:\n[¬s]""A quasi-\nexperimental study design was used to evaluate the implementation of the program in two of the\nfour sites which were able to recruit control participants. Families enrolled in the program were eli-\ngible to participate in the experimental group; families attending each center, but not enrolled in the\nprogram were eligible to participate in the control group. All children and caregivers were assessed\ntwice: the experimental group was assessed pre- and post-program; the control group was assessed at\nbaseline and 10 weeks following. The other two sites were unable to recruit families for a control\ngroup, therefore the eﬀectiveness of the program was evaluated using a pre–post design.[¬e]""']",NA,,"['Page 4:\n[¬s]""The Move 2 Learn (M2L) program was developed in response to this need to create a Canadian\ncommunity-based program for children and their caregivers, with the intention of improving chil-\ndren’s movement skills while also supporting their overall development (Bedard et al. 2017a, 2017b).\nThe program focuses on teaching a speciﬁc movement skill each week with the skills increasing in\ndiﬃculty throughout the program. Given the young age of the participants, the importance of pre-\nliteracy skill development for school readiness (“What Is School Readiness” 2006), and the beneﬁts of\nteaching movement and cognitive activities together (Callcott, Hammond, and Hill 2015), M2L also\nfocuses on teaching pre-literacy skills through a dialogic storybook reading circle.""\n""Therefore, in the context of the M2L program, it was\nessential that the next step in the evaluation and dissemination of the program be a community-\nengaged research project in which the intervention was delivered by non-experts.\nA Southwestern Ontario community involved in the HKCC invited the M2L study team to\nimplement and evaluate the program as a means of improving movement skills and supporting\nthe overall development of young children in their community.[¬e]""']",NA,,['Other (please provide details)'],"['Page 5:\n[¬s]""Training of intervention staﬀ\nOne-to-two staﬀ members at each of the four sites volunteered to lead the M2L program at their\nrespective sites (a total of 6 staﬀ). These individuals were employed as early childcare workers\nand librarians at the OEYCs and library sites, respectively. Staﬀ attended a one-day workshop\ntogether led by the researchers (CB and EB); total time spent in the workshop was 5.5 h.[¬e]""']",NA,,['Yes (Please specify)'],"['Page 6:\n[¬s]""Movement skill progression was\nscaﬀolded to the child’s own abilities and progression.""\n""The next 15 min of the program consisted of free play with supervision from the staﬀ to\nallow children the opportunity to self-direct their own activities with access to various gross- and\nﬁne-motor play items (e.g. hula hoops and puzzles). The ﬁnal 15 min of the program was spent\nin an interactive reading circle.[¬e]""']",NA,,"['Students', 'Other (Please specify)']","['Page 6:\n[¬s]""There was active involvement of at least one caregiver per\nchild in both the direct instruction and reading components.[¬e]""', 'Page 5:\n[¬s]""With\napproximately 8 children per group at each site, teacher-to-child ratios were 1:4.[¬e]""']",NA,,['Large group/class teaching (+6)'],NA,NA,,['No'],"['Page 5:\n[¬s]""One-to-two staﬀ members at each of the four sites volunteered to lead the M2L program at their\nrespective sites (a total of 6 staﬀ). These individuals were employed as early childcare workers\nand librarians at the OEYCs and library sites, respectively.""\n""Families\nenrolled in the program were assessed before participating in the program and again after the pro-\ngram was completed.[¬e]""', 'Page 6:\n[¬s]""A weekly one-page handout was\nalso provided to each family that outlined simple strategies to practise the movement and reading\nactivities learned in the session at home.[¬e]""']",NA,,['Yes'],"['Page 5:\n[¬s]""One-to-two staﬀ members at each of the four sites volunteered to lead the M2L program at their\nrespective sites (a total of 6 staﬀ). These individuals were employed as early childcare workers\nand librarians at the OEYCs and library sites, respectively.""\n""Families\nenrolled in the program were assessed before participating in the program and again after the pro-\ngram was completed.[¬e]""', 'Page 6:\n[¬s]""A weekly one-page handout was\nalso provided to each family that outlined simple strategies to practise the movement and reading\nactivities learned in the session at home.[¬e]""']",NA,,['Other (please specify)'],"['Page 5:\n[¬s]""The program was led by 1–2 trained staﬀ at each of the four sites and each site used their own dis-\ncretion to determine the day and time for each weekly session and the program start date. With\napproximately 8 children per group at each site, teacher-to-child ratios were 1:4. The program""\n""One-to-two staﬀ members at each of the four sites volunteered to lead the M2L program at their\nrespective sites (a total of 6 staﬀ). These individuals were employed as early childcare workers\nand librarians at the OEYCs and library sites, respectively.[¬e]""']",NA,,"['Lay persons/volunteers', 'Parents/carers']","['Page 6:\n[¬s]""There was active involvement of at least one caregiver per\nchild in both the direct instruction and reading components.[¬e]""', 'Page 5:\n[¬s]""The program con-\nsisted of 10 consecutive weeks of 60-minute sessions.[¬e]""']",NA,,"['Page 5:\n[¬s]""The program was led by 1–2 trained staﬀ at each of the four sites and each site used their own dis-\ncretion to determine the day and time for each weekly session and the program start date.[¬e]""']",10,,"['Page 5:\n[¬s]""The program con-\nsisted of 10 consecutive weeks of 60-minute sessions.[¬e]""']",1,,"['Page 7:\n[¬s]""Implementation ﬁdelity was assessed quantitatively using an implementation checklist and qualitat-\nively through semi-structured observation of one session per site. Staﬀ were asked to complete the\nimplementation checklist after each session; 9 items assessed the extent to which staﬀimplemented\ncaregiver involvement, active child participation, skill modiﬁcations for the movement and reading\ncomponents of the program, and child-directed free play. Each item asked the leader to judge the\nsession on average and responses included ‘not attempted,’‘tried, but was unsuccessful,’ and\n‘attempted and was successful.’ Weekly responses on the implementation checklist were averaged\nover the 10 weeks to provide a single implementation score ranging from 0 to 18, with higher scores\nrepresenting greater levels of self-reported compliance to the intervention.[¬e]""']",60,,"['Qualitative', 'Quantitative']","['Page 7:\n[¬s]""The qualitative session\nobservations at each site took place between weeks 4–7. Sessions 4–7 were chosen to minimize\nthe eﬀect of early enthusiasm bias in our evaluation of implementation. Observation notes for\neach segment of the program were recorded to determine how closely the session aligned with\nthe M2L manual.[¬e]""']",NA,,['No'],"['Page 12:\n[¬s]""Given both the small sample size and constrains of the community-engaged research design we are\nlimited in our ability to make ﬁrm conclusions.[¬e]""', 'Page 14:\n[¬s]""The results ofthe current study are in general alignment with both the pilot study conducted in 2015\n(Bedard et al. 2017a, 2017b) and with other movement-based direct-instruction interventions\n(Alhassan et al. 2012; Robinson and Goodway 2009).[¬e]""']",NA,,['The developer'],NA,NA,,No,,['Yes'],NA,NA,,['Yes'],"['Page 8:\n[¬s]""To evaluate the ﬁrst study objective within the quasi-experimental design, three linear regression\nmodels were run with time 2 gross motor skill, print-concept scores, and alphabet knowledge scores\nas the dependent variable and their respective time 1 scores, group (experimental or control), site,\nand a group-by-site interaction term as independent variables[¬e]""']",NA,,NA,NA,NA,,NA,NA,NA,,NA,NA,NA,
