52131739,Mavilidi (2015),2015,['EY_Physical development approaches'],NA,,"['Page 5:\n[¬s]""Themain hypothesis was that an integratedphysical exercise condition in which children learn\nforeign language vocabulary by performing physical exercises to enact the meaning of those\nwords would lead to the highest immediate and delayed retention performance. The integrated\nphysical exercise condition was compared to a non-integrated physical exercise condition,a\ngesturing condition,and a conventional condition.""\n""Participants were 125 preschool children (64 boys and 61 girls) with a mean age 4.94 years\n(SD=0.56). Fifteen childcare centers were recruited for this study. However, in the analysis 111\nparticipants were included due to missing data. Participants were recruited from four childcare\ncenters in total in the integrated, four centers in the non-integrated, four centers in the control\ncondition and three childcare centers in the embodied condition. The study was approved by the\nHuman Research Ethics Committee ofthe University ofWollongong. All parents completed a\nwritten consent form about their children’s participation in the research. Only children who\nattended childcare for 2 days or more per week were eligible to participate in the study. Children\nwho had prior knowledge or relatives speaking the Italian language at home were excluded\nfrom the study. Also, children with developmental disorders and/or learning difficulties did not\nparticipate in the study. The childcare centers were randomly assigned, in such a way that there\nwere children from 3 to 4 centers in total per condition.[¬e]""']",NA,,"['Page 5:\n[¬s]""The integrated\nphysical exercise condition was compared to a non-integrated physical exercise condition,a\ngesturing condition,and a conventional condition.[¬e]""']",NA,,"['Page 1:\n[¬s]""Integrated Physical Exercises and Gestures\non Preschool Children’s Foreign Language\nVocabulary Learning[¬e]""']",NA,,['Other (please provide details)'],NA,NA,,['Yes (Please specify)'],"['Page 8:\n[¬s]""A pilot study was first conducted by the researcher to test the efficacy and feasibility of the\nforthcoming procedure. The researcher performed the teaching and testing together with three\nresearch assistants, who had received a 4-h training session on how to teach and test children\nbefore the experiment.[¬e]""']",NA,,['Students'],NA,NA,,"['Student alone (self-administered)', 'Large group/class teaching (+6)']","['Page 7:\n[¬s]""Children were tested individually on their ability to recall the Italian\nwords.[¬e]""']",NA,,['No'],"['Page 5:\n[¬s]""All parents completed a\nwritten consent form about their children’s participation in the research.[¬e]""', 'Page 6:\n[¬s]""Children and parents were instructed\nvia written consent forms that the accelerometer should be worn every day during the intervention\nlessons.[¬e]""']",NA,,['Yes'],"['Page 5:\n[¬s]""All parents completed a\nwritten consent form about their children’s participation in the research.[¬e]""', 'Page 6:\n[¬s]""Children and parents were instructed\nvia written consent forms that the accelerometer should be worn every day during the intervention\nlessons.[¬e]""']",NA,,['During regular school hours '],"['Page 6:\n[¬s]""The\nsuitability of the chosen words in terms of pronunciation and meaning of the actions for\npreschool children was evaluated by a teacher with an Italian background.[¬e]""']",NA,,['Class teachers'],NA,NA,,"['Page 7:\n[¬s]""The total duration ofthe learning phase was 4 weeks, consisting ofone 15-min\nsession per day for 2 days per week.[¬e]""']",4,,"['Page 7:\n[¬s]""The total duration ofthe learning phase was 4 weeks, consisting ofone 15-min\nsession per day for 2 days per week.[¬e]""']",2,,"['Page 10:\n[¬s]""Two separate ANOVAs were performed to assess the levels of physical activity across the\ndifferent conditions and verify that the level of physical activity did not differ between the\nintegrated and non-integrated exercise conditions. In addition, the analysis was used to verify\nwhether the children in the exercise conditions were more active than the children in the\ngesturing and conventional condition.[¬e]""', 'Page 7:\n[¬s]""In the assessment during the learning phase at the end of week 2, the possible short-term\nor acute effects of embodiment and physical activity on learning were examined. The\nassessment directly after the learning phase in week 4 occurred at the end of the interven-\ntion and evaluated the medium-term effects of embodiment and physical activity on\nchildren’s ability to learn a foreign language. The final follow-up assessment was admin-\nistered 6 weeks after the learning phase in week 10 to determine how well the words were\nmaintained in the children’s memory. Moreover, emphasis was put on observing children’s\nlearning progress. The assessments in the three different time periods were administered in\nidentical form.[¬e]""', 'Page 8:\n[¬s]""A pilot study was first conducted by the researcher to test the efficacy and feasibility of the\nforthcoming procedure. The researcher performed the teaching and testing together with three\nresearch assistants, who had received a 4-h training session on how to teach and test children\nbefore the experiment.[¬e]""']",15,,"['Qualitative', 'Quantitative']","['Page 5:\n[¬s]""Fifteen childcare centers were recruited for this study. However, in the analysis 111\nparticipants were included due to missing data.""\n""The childcare centers were randomly assigned, in such a way that there\nwere children from 3 to 4 centers in total per condition. The resulting number ofparticipants in\neach condition was as follows: 31 in the integrated condition, 23 in the non-integrated\ncondition, 31 in the gesturing condition, and 26 in the conventional condition.[¬e]""', 'Page 7:\n[¬s]""The final follow-up assessment was admin-\nistered 6 weeks after the learning phase in week 10 to determine how well the words were\nmaintained in the children’s memory.[¬e]""']",NA,,['No'],"['Page 10:\n[¬s]""The main goal of this study was to investigate the effects ofenacting words through full-body\nmovements in the form ofphysical exercise and part-body movements in the form ofgesturing\non learning a foreign language vocabulary. The results confirmed the hypotheses, indicating\nthat the integrated condition, in which children used physical exercises to enact words to be\nlearned, outperformed all other conditions for free-recall performance.[¬e]""']",NA,,['The developer'],NA,NA,,No,,['No/Unclear'],NA,NA,,['No'],NA,NA,,['No'],NA,NA,,NA,NA,NA,,['No'],NA,NA,
52131616,Mavilidi (2016) 1_1,2016,"['Physical activity', 'EY_Physical development approaches']",NA,,"['Page 3:\n[¬s]""integrated physical activity condition[¬e]""']",NA,,"['Page 3:\n[¬s]""The geography task included learning the six con-\ntinents of the world and one characteristic animal from each\ncontinent (i.e., kangaroo in Oceania, panda bear in Asia, fox\nin Europe, penguin in Antarctica, gira?e in Africa, and bear\nin America). A world map was placed on the ?oor (fabric\nwith dimensions 550×520 cm; see Figure 1). The character-\nistic animals (soft toys) were placed on top of each continent\non the map. Children in all conditions performed the same\ntask for 3 learning sessions lasting 10min each.""\n""in the inte-\ngrated physical activity condition, children “traveled” from\none continent to the other imitating the movements of the\nanimal representing the continent (e.g., hop like a kanga-\nroo starting from Oceania).[¬e]""']",NA,,"['Page 1:\n[¬s]""In this intervention study, we investigated\nthe eﬀects of physical activities that were integrated into\na geography task on preschool children’s learning per-\nformance and enjoyment.[¬e]""']",To improve children's learning performance and enjoyment of learning in geography,,['University/ researcher design'],NA,NA,,['No'],NA,NA,,['Students'],NA,NA,,['Large group/class teaching (+6)'],NA,"Not specified, but assumed by the total participants in each condition",,['No'],NA,NA,,['No'],NA,NA,,['During regular school hours '],NA,"not specified, but assumed that it occurred during the children's attendance to their respective childcare centre.",,['Research staff'],NA,NA,,"['Page 3:\n[¬s]""The\nlearning sessions occurred over a 2-day period with a 1-day\nbreak for the ﬁrst week, and the same ﬁrst day in the second\nweek (e.g., Monday–Wednesday–Monday).[¬e]""']",2,,NA,2,,"['Page 3:\n[¬s]""3 learning sessions lasting 10min each[¬e]""']",30 ,,['No implementation details provided.'],NA,NA,,['No'],NA,NA,,['The developer'],NA,NA,,No,,['No/Unclear'],"['Page 4:\n[¬s]""An analysis of variance (ANOVA) with condition as inde-\npendent variable and pretest scores as dependent variable\nshowed no signiﬁcant eﬀect of condition, F(1, 87)= 1.19,\np= .310., indicating that children’s pretest scores did not\ndiﬀer across conditions (integrated condition, M= .13,\nSD= .73; nonintegrated, M= .00, SD= .00; control condi-\ntion, M= .52, SD= 2.19)[¬e]""']",NA,,['Yes'],"['Page 4:\n[¬s]""A 3 (Condition: integrated physical activity, nonintegrated\nphysical activity, control) ×2 (Time of Testing: immediate,\ndelayed) experimental designwith repeated measures on the\nlatter factor was used. The dependent variables were chil-\ndren’s performance at the posttest (immediate and delayed),\nchildren’s interest on the type of instruction, and children’s\ninterest in the game in the future.[¬e]""']",NA,,['Yes'],NA,NA,,"['Educational attainment', 'Gender']","['Page 4:\n[¬s]""The assessment included a pretest and posttests which\nevaluated children’s existing and acquired knowledge,\nrespectively.[¬e]""', 'Page 3:\n[¬s]""Participants were 90 preschool children (Mage =4.88\nSD= .56; 45 boys and 45 girls) recruited in eight child-\ncare centers.[¬e]""']",NA,,['No'],NA,NA,
66537715,Mavilidi (2016) 1_2,2016,"['Physical activity', 'EY_Physical development approaches']",NA,,"['Page 1:\n[¬s]""uninte-\ngrated physical activity condition[¬e]""']",NA,,"['Page 3:\n[¬s]""In the nonintegrated physical\nactivity condition, children would pick up one animal at a\ntime and then would run in a circle around the map. After\ntheir run, they would leave that animal at the same position\nand then pick up a di?erent animal and run again around\nthe map and repeat this until they ?nished with all the ani-\nmals""\n""e geography task included learning the six con-\ntinents of the world and one characteristic animal from each\ncontinent (i.e., kangaroo in Oceania, panda bear in Asia, fox\nin Europe, penguin in Antarctica, giraﬀe in Africa, and bear\nin America). A world map was placed on the ﬂoor (fabric\nwith dimensions 550×520 cm; see Figure 1). The character-\nistic animals (soft toys) were placed on top of each continent\non the map. Children in all conditions performed the same\ntask for 3 learning sessions lasting 10min each[¬e]""']",NA,,NA,NA,,['University/ researcher design'],NA,NA,,['Unclear/ Not specified'],NA,the researcher implemented the intervention,,['Students'],NA,NA,,['One to one'],"['Page 3:\n[¬s]""It consisted of learning and assessment phases, in\nwhich children participated on an individual basis in a sepa-\nrate room.[¬e]""', 'Page 6:\n[¬s]""An interesting topic for future study is related to the\nfact that children in this study performed the activities\nindividually. Activities occurred in a separate place, isolated\nfrom the other children who did not have the possibility\nto learn by seeing other children moving around the con-\ntinents.[¬e]""']",NA,,['No'],NA,NA,,['No'],NA,NA,,['During regular school hours '],"['Page 3:\n[¬s]""The study was conducted by the lead author at the childcare\ncenters. It consisted of learning and assessment phases, in\nwhich children participated on an individual basis in a sepa-\nrate room.[¬e]""']",NA,,['Research staff'],"['Page 3:\n[¬s]""The study was conducted by the lead author at the childcare\ncenters.[¬e]""']",NA,,"['Page 3:\n[¬s]""Children in all conditions performed the same\ntask for 3 learning sessions lasting 10min each. This dura-\ntion was chosen to engage children’s attention for a short\ntime without mentally and physically exhausting them. The\nlearning sessions occurred over a 2-day period with a 1-day\nbreak for the ﬁrst week, and the same ﬁrst day in the second\nweek (e.g., Monday–Wednesday–Monday)[¬e]""', 'Page 4:\n[¬s]""The pretest and the immediate test\ntook place within a 1-week period[¬e]""']",1,,"['Page 3:\n[¬s]""Children in all conditions performed the same task for 3 learning sessions lasting 10min each""\n""This dura-\ntion was chosen to engage children’s attention for a short\ntime without mentally and physically exhausting them. The\nlearning sessions occurred over a 2-day period with a 1-day\nbreak for the ﬁrst week[¬e]""']",2,,"['Page 3:\n[¬s]""Children in all conditions performed the same\ntask for 3 learning sessions lasting 10min each[¬e]""']",10,,['Quantitative'],"['Page 4:\n[¬s]""To measure children’s intensity of physical activity, chil-\ndren were ﬁtted with an Actigraph accelerometer (model\nGT3X+/BT; ActiGraph, Pensacola, FL) worn around the\nwaist on an elastic belt with the accelerometer positioned\nover the anterior aspect of the right hip upon the beginning\nof the learning session and removed afterwards. Actigraphs\nhave established utility, validity, and reliability in children\naged 3–5 years (Cliﬀ, Reilly, & Okely, 2009). Data were\ncalculated for the scheduled 10-min time period with epoch\nlength of 1s intervals. Age-appropriate cut-points (Janssen[¬e]""']",NA,,['No'],NA,NA,,['The developer'],NA,NA,,No,,['Yes'],"['Page 4:\n[¬s]""An analysis of variance (ANOVA) with condition as inde-\npendent variable and pretest scores as dependent variable\nshowed no signiﬁcant eﬀect of condition, F(1, 87)= 1.19,\np= .310., indicating that children’s pretest scores did not\ndiﬀer across conditions (integrated condition, M= .13,\nSD= .73; nonintegrated, M= .00, SD= .00; control condi-\ntion, M= .52, SD= 2.19).[¬e]""']",NA,,['No'],NA,NA,,['No'],NA,NA,,NA,NA,NA,,['No'],NA,NA,
52131614,Mavilidi (2017) 1_1,2017,"['Physical activity', 'EY_Physical development approaches']",NA,,"['Page 1:\n[¬s]""fphysical activities that were integrated into a science lesson[¬e]""']",physical activity integrated into science lesson,,"['Page 2:\n[¬s]""In the nonintegrated condition, movements will be unrelated\nto the task and children will run around the classroom for\nseveral minutes[¬e]""', 'Page 3:\n[¬s]""During the learning sessions, a picture of the sun and the\nplanets in space (on a straight line) was placed at a central\npoint easily to be seen by all children""\n""The\ninstructor began with a small introduction of the concept of\nspace and the planets.""\n""The\ninstructor called aloud the name of the planets in all\nconditions.[¬e]""', 'Page 4:\n[¬s]""In the nonintegrated condition,\nthe children performed physical activities unrelated to the\nlearning task. Firstly, the children ran a lap around the room.\nThen, they sat and listened to all the names of the planets.\nThey followed the same process three times.[¬e]""']",NA,,"['Page 1:\n[¬s]""by investigating the effects of infusing\nphysical activities in preschool children’s science learning\non learning outcomes.[¬e]""', 'Page 2:\n[¬s]""Intervention programmes to increase physical activity\nlevels and positively affect academic achievemen[¬e]""']",not directly stated -overall to improve learning on science outcomes - to increase physical activity as well as learning outcomes for pre-schoolers,,['University/ researcher design'],"['Page 3:\n[¬s]""The researcher visited the childcare centres and coordinated\nthe learning and testing sessions[¬e]""']",NA,,['No'],NA,it was the researcher who delivered the sessions,,['Students'],NA,NA,,['Large group/class teaching (+6)'],"['Page 3:\n[¬s]""The\nlearning sessions took place in small groups (max 10\nchildren),[¬e]""']",NA,,['No'],NA,NA,,['No'],NA,NA,,['During regular school hours '],"['Page 3:\n[¬s]""he learning sessions\nconsisted of a solar system task (i.e. name of planets and\ntheir right order based on their distance from the sun). The\nlearning sessions took place in small groups (max 10\nchildren), once per week, for 4 weeks.""\n""The researcher visited the childcare centres and coordinated\nthe learning and testing sessions. T[¬e]""']",NA,,['Research staff'],"['Page 3:\n[¬s]""The researcher visited the childcare centres and coordinated\nthe learning and testing sessions.[¬e]""']",NA,,"['Page 3:\n[¬s]""for 4 weeks.[¬e]""']",4,,"['Page 3:\n[¬s]""once per week,[¬e]""']",1,,"['Page 4:\n[¬s]""During each learning session, which lasted 10 minutes\nper day for all conditions,[¬e]""']",10,,['Quantitative'],"['Page 4:\n[¬s]""Physical activity was objectively assessed by using accelerometers (model GT1M, Pensacola, FL). The sampling interval (epoch) was set at 1 second to best capture variability in children’s activity (Cliff, Reilly, & Okely,""\n""The accelerometers were afﬁxed to an elastic belt and placed by trained staff around the child’s waist so that the accelerometer was at the top of their right""\n""Physical activity outcomes were included\nin the analyses to conﬁrm our basic assumption that children\nwould be more physically active in the physical activity\nconditions (integrated and nonintegrated) than in the\nsedentary control condition.[¬e]""']",NA,,['No'],NA,NA,,['The developer'],NA,NA,,No,,['Yes'],"['Page 5:\n[¬s]""no signiﬁcant differences among the conditions in\nthe pretest scores, F(2,84) = 0.08, p = .922[¬e]""']",NA,,['Yes'],"['Page 4:\n[¬s]""To control for baseline\ndifferences in demographic characteristics among the\nconditions (age, gender, ethnicity, and socioeconomic\nstatus), analysis of variance (ANOVA) and ?2\ntests were\nused.""\n""Because the analyses\nproduced similar results and none of the demographics[¬e]""', 'Page 5:\n[¬s]""The results from the mixed ANCOVA revealed that the covariate, pretest scores had a signiﬁcant effect on learning scores, F(1,82) = 12.44, p ≤ .001,""\n""After""\n""controlling for the covariate, pretest scores, there were signiﬁcant main effects of condition, F(2,82) = 34.98, p ≤ .001, η2 p ≤ .001, η2 p = 0.46, and time of testing, F(1,82) = 16.15, p = 0.17, on learning performance.""\n""characteristics seem to be a confounder, we chose to perform\na mixed 3 (condition:[¬e]""']",NA,,['Yes'],NA,NA,,"['Gender', 'Socio-economic status', 'Other (please specify)']","['Page 4:\n[¬s]""Gender, N boys (%)[¬e]""', 'Page 3:\n[¬s]""no differences\namong the conditions in terms of demographic\ncharacteristics (Table 1).[¬e]""', 'Page 4:\n[¬s]""Healthcare card or pension card, N no (%)c[¬e]""', 'Page 4:\n[¬s]""Ethnicity, N Australian (%)""\n""Age, years (SD)[¬e]""']",ehnicity age  ,,['Yes'],"['Page 4:\n[¬s]""With regard to the learning\noutcomes, a cluster design was chosen initially because the\nintervention was structured in seven childcare centres, where\nchildcare centre was treated as a random variable with\nchildren nested in preschools and in conditions (integrated\nvs nonintegrated vs control). T""\n""The childcare centre, children’s\nethnicity, socioeconomic status, and gender were set as the\ncluster units for the randomization.[¬e]""']",NA,
66537716,Mavilidi (2017) 1_2,2017,"['Physical activity', 'EY_Physical development approaches']",NA,,"['Page 1:\n[¬s]""integrated physical activity condition[¬e]""']",NA,,"['Page 1:\n[¬s]""integrated physical activity condition including task-relevant physical activities[¬e]""', 'Page 3:\n[¬s]""The learning sessions consisted of a solar system task (i.e. name of planets and their right order based on their distance from the sun). The learning sessions took place in small groups (max 10 children), once per week, for 4 weeks.""\n""During the learning sessions, a picture of the sun and the planets in space (on a straight line) was placed at a central point easily to be seen by all children. Also, ‘toy’ planets were placed in a line on the ﬂoor in the same order, corresponding to the planets in the pictures. The children had to remember the names of the planets and their correct order starting from the planet closest to the sun, Mercury, through to the planet furthest from the sun, Neptune. The instructor began with a small introduction of the concept of space and the plane""\n""The\ninstructor called aloud the name of the planets in all\nconditions. In the integrated condition, the children\nperformed physical activities related to the learning task.[¬e]""', 'Page 4:\n[¬s]""Starting from the sun, they visited the ?rst planet and then\nthey returned back to the sun. Then, they visited the second\nplanet and returned back to the sun. They did the same\nactions for all the planets.""\n""During each learning session, which lasted 10 minutes\nper day for all conditions, the names of the planets were\nrepeated three times in all conditions.[¬e]""']",NA,,NA,science learning,,['University/ researcher design'],NA,NA,,['Unclear/ Not specified'],"['Page 3:\n[¬s]""The researcher visited the childcare centres and coordinated\nthe learning and testing sessions[¬e]""']",researcher delivered the intervention,,['Students'],NA,NA,,['Large group/class teaching (+6)'],"['Page 3:\n[¬s]""The\nlearning sessions took place in small groups (max 10\nchildren),[¬e]""']",although they call it small groups,,['No'],NA,NA,,['No'],NA,NA,,['During regular school hours '],"['Page 3:\n[¬s]""The researcher visited the childcare centres and coordinated\nthe learning and testing sessions[¬e]""']",NA,,['Research staff'],"['Page 3:\n[¬s]""The researcher visited the childcare centres and coordinated\nthe learning and testing sessions.[¬e]""']",NA,,"['Page 3:\n[¬s]""for 4 weeks.[¬e]""']",4,,"['Page 3:\n[¬s]""The\nlearning sessions took place in small groups (max 10\nchildren), once per week, for 4 weeks.[¬e]""']",1,,"['Page 4:\n[¬s]""During each learning session, which lasted 10 minutes\nper day for all conditions,[¬e]""']",10,,['Quantitative'],"['Page 4:\n[¬s]""Physical activity was objectively assessed by using accelerometers (model GT1M, Pensacola, FL). The sampling interval (epoch) was set at 1 second to best capture variability in children’s activity""\n""The accelerometers were afﬁxed to an\nelastic belt and placed by trained staff around the child’s\nwaist so that the accelerometer was at the top of their right""\n""hip at the beginning of the lesson and were removed at the\nend of the lesson. The accelerometers were processed by\nusing ACTILIFE v6.12.1 software and were recorded for the\nscheduled 10-minute period.[¬e]""']",NA,,['No'],NA,NA,,['The developer'],NA,NA,,No,,['Yes'],"['Page 5:\n[¬s]""An ANOVA was run before the main analysis. This analysis\nyielded no signiﬁcant differences among the conditions in\nthe pretest scores, F(2,84) = 0.08, p = .922 (integrated\ncondition, M = 1.58, SE = 0.38, 95% CI 0.82, 2.34;\nnonintegrated condition, M = 1.37, SE = 0.41, 95% CI\n0.56–2.18; control condition, M= 1.55, SE = 0.39, 95% CI\n0.77–2.33).""\n""After[¬e]""']",NA,,['Yes'],"['Page 5:\n[¬s]""The independent variables were condition and time of testing, and the covariate was children’s pretest scores.""\n""controlling for the covariate, pretest scores, there were\nsigniﬁcant main effects of condition, F(2,82) = 34.98,\np ≤ .001, η2\np ≤ .001, η2\np = 0.46, and time of testing, F(1,82) = 16.15,\np = 0.17, on learning performance.""\n""After[¬e]""']",NA,,NA,NA,NA,,NA,NA,NA,,['Yes'],"['Page 4:\n[¬s]""With regard to the learning\noutcomes, a cluster design was chosen initially because the\nintervention was structured in seven childcare centres, where\nchildcare centre was treated as a random variable with\nchildren nested in preschools and in conditions (integrated\nvs nonintegrated vs control). The childcare centre, children’s\nethnicity, socioeconomic status, and gender were set as the\ncluster units for the randomization. Because the analyses\nproduced similar results and none of the demographics[¬e]""', 'Page 5:\n[¬s]""characteristics seem to be a confounder, we chose to perform\na mixed 3 (condition: integrated physical activity,\nnonintegrated physical activity, and control) × 2 (time of\ntesting:[¬e]""']",initially yes ,
